FID,OBJECTID,FACILITYID,NAME,ADDRESS,CITY,STATE,ZIP,ZIP4,TELEPHONE,TYPE,STATUS,POPULATION,COUNTY,COUNTYFIPS,COUNTRY,NAICS_CODE,NAICS_DESC,SOURCE,SOURCEDATE,VAL_METHOD,VAL_DATE,WEBSITE,SECURELVL,CAPACITY,Shape_Leng,Shape_Area,Shape__Are,Shape__Len,STATEFP,COUNTYFP,TRACTCE,GEOID,CENSUS_TRACT_NAME,NAMELSAD,MTFCC,FUNCSTAT,ALAND,AWATER,INTPTLAT,INTPTLON,x,lat,long,BF_COUNT,PB_COUNT
1001,989,"10006583",CABARRUS REGIONAL JUVENILE DETENTION CENTER,822 MCWHORTER ROAD,CONCORD,NC,"28027",NOT AVAILABLE,(704) 720-0807,STATE,OPEN,-999,CABARRUS,"37025",USA,"922140",CORRECTIONAL INSTITUTIONS,https://www.ncdps.gov/Juvenile-Justice/Juvenile-Facility-Operations/Juvenile-Detention-Centers,12/12/2017,UNVERIFIED,2017-12-12T00:00:00.000Z,https://www.ncdps.gov/Juvenile-Justice/Juvenile-Facility-Operations/Juvenile-Detention-Centers,JUVENILE,30,0.00196878836239,2.45814195e-07,3735.3125,244.350590379707,"37","025","042000","37025042000","420",Census Tract 420,G5020,S,16774875,0,"+35.3758415","-080.6155081",NC,-80.6023877439985,35.363388433228,,"2"
1002,990,"10003650",BLACKBURN CORRECTIONAL COMPLEX,3111 SPURR RD,LEXINGTON,KY,"40511",NOT AVAILABLE,(859) 246-2366,STATE,OPEN,591,FAYETTE,"21067",USA,"922140",CORRECTIONAL INSTITUTIONS,https://corrections.ky.gov/about/Pages/ResearchandStatistics.aspx,11/29/2017,IMAGERY,2017-12-01T00:00:00.000Z,https://corrections.ky.gov/depts/AI/Pages/default.aspx,MINIMUM,594,0.0298537971698,4.2608215095e-05,671080.703125,3695.56062510826,"21","067","003701","21067003701","37.01",Census Tract 37.01,G5020,S,83180923,341040,"+38.0893188","-084.5775210",KY,-84.5372045261834,38.113159349729,,"4"
1003,991,"10001476",MORGAN COUNTY JAIL,300 WEST COURT STREET,JACKSONVILLE,IL,"62650",NOT AVAILABLE,(217) 243-4143,COUNTY,OPEN,40,MORGAN,"17137",USA,"922140",CORRECTIONAL INSTITUTIONS,http://morgancounty-il.com/departments/sheriffs-office/,3/6/2017,IMAGERY,2018-03-02T00:00:00.000Z,http://morgancounty-il.com/departments/sheriffs-office/,NOT AVAILABLE,65,0.00173160138645,1.85689957e-07,2992.26953125,215.089704471741,"17","137","951700","17137951700","9517",Census Tract 9517,G5020,S,4034361,0,"+39.7449241","-090.2359585",IL,-90.2318633716002,39.7352352807736,,"1"
1004,992,"10000205",POLUNSKY PRISON,3872 FM 350 S,LIVINGSTON,TX,"77351",NOT AVAILABLE,(936) 967-8082,STATE,OPEN,2904,POLK,"48373",USA,"922140",CORRECTIONAL INSTITUTIONS,"https://www.texastribune.org/library/data/texas-prisons/units/, http://www.tdcj.state.tx.us/unit_directory/index.html",9/15/2016,IMAGERY/OTHER,2018-01-11T00:00:00.000Z,http://www.tdcj.state.tx.us/unit_directory/index.html,MAXIMUM,2984,0.0180705605544,2.2695479082e-05,327078.38671875,2155.11656783433,"48","373","210203","48373210203","2102.03",Census Tract 2102.03,G5020,S,30096769,3381697,"+30.7248147","-095.0118864",TX,-95.0147478953749,30.6985564176018,,"1"
1005,993,"10000996",WINNEBAGO COUNTY WORK RELEASE CENTER,90 W COUNTY RD Y,OSHKOSH,WI,"54901",NOT AVAILABLE,NOT AVAILABLE,COUNTY,CLOSED,0,WINNEBAGO,"55139",USA,"922140",CORRECTIONAL INSTITUTIONS,https://www.co.winnebago.wi.us/sheriff/corrections-division,5/9/2018,IMAGERY,2018-05-09T00:00:00.000Z,NOT AVAILABLE,MINIMUM,210,0.00313200536379,5.80387299e-07,10012.41015625,410.124698047778,"55","139","001700","55139001700","17",Census Tract 17,G5020,S,25539499,11250470,"+44.0779637","-088.5912929",WI,-88.5441379075063,44.0836259067607,,"3"
1006,994,"10000920",CHARLES COUNTY DETENTION CENTER / ANNEX,6905 CRAIN HWY,LA PLATA,MD,"20646",NOT AVAILABLE,NOT AVAILABLE,COUNTY,OPEN,333,CHARLES,"24017",USA,"922140",CORRECTIONAL INSTITUTIONS,http://dlslibrary.state.md.us/publications/JCR/2016/2016_309.pdf,8/30/2016,IMAGERY,2018-03-19T00:00:00.000Z,https://www.ccso.us/,NOT AVAILABLE,490,0.00905593680769,2.254092722e-06,35703.75390625,1103.27884546501,"24","017","851001","24017851001","8510.01",Census Tract 8510.01,G5020,S,17078758,22848,"+38.5327464","-077.0000423",MD,-76.9848983349559,38.5238995681034,,"1"
1007,995,"10000110",EASTERN KENTUCKY CORRECTIONAL COMPLEX,200 ROAD TO JUSTICE,WEST LIBERTY,KY,"41472",NOT AVAILABLE,(606) 743-2800,STATE,OPEN,1672,MORGAN,"21175",USA,"922140",CORRECTIONAL INSTITUTIONS,https://corrections.ky.gov/about/Pages/ResearchandStatistics.aspx,11/29/2017,IMAGERY,2017-12-01T00:00:00.000Z,https://corrections.ky.gov/depts/AI/Pages/default.aspx,MEDIUM,1674,0.016348611029,1.1611733149e-05,182363.85546875,1987.16221553103,"21","175","950400","21175950400","9504",Census Tract 9504,G5020,S,123066214,969954,"+37.8933925","-083.2233795",KY,-83.2693099568385,37.9038891107805,,"1"
1008,996,"10000117",GREEN RIVER CORRECTIONAL COMPLEX,1200 RIVER RD,CENTRAL CITY,KY,"42330",NOT AVAILABLE,(270) 754-5415,STATE,OPEN,962,MUHLENBERG,"21177",USA,"922140",CORRECTIONAL INSTITUTIONS,https://corrections.ky.gov/about/Pages/ResearchandStatistics.aspx,11/29/2017,IMAGERY,2017-12-01T00:00:00.000Z,https://corrections.ky.gov/depts/AI/Pages/default.aspx,MEDIUM,947,0.0166803825286,1.5421596291e-05,240286.16015625,2116.57179363395,"21","177","960200","21177960200","9602",Census Tract 9602,G5020,S,100018371,3996597,"+37.3257843","-087.1543609",KY,-87.1134167400553,37.3143803015481,,"1"
1009,997,"10000121",WESTERN KENTUCKY CORRECTIONAL COMPLEX,374 NEW BETHEL CHURCH RD,FREDONIA,KY,"42411",NOT AVAILABLE,(270) 388-9781,STATE,OPEN,677,LYON,"21143",USA,"922140",CORRECTIONAL INSTITUTIONS,https://corrections.ky.gov/about/Pages/ResearchandStatistics.aspx,11/29/2017,IMAGERY,2017-12-01T00:00:00.000Z,https://corrections.ky.gov/depts/AI/Pages/default.aspx,MEDIUM,670,0.0143266261991,9.157130741e-06,142342.58984375,1772.28478980915,"21","143","960100","21143960100","9601",Census Tract 9601,G5020,S,233634397,24341031,"+37.0924072","-088.1354755",KY,-88.0401480155724,37.1364597911947,,"2"
1010,998,"10000106",KENTUCKY CORRECTIONAL INSTITUTION FOR WOMEN,3000 ASH AVE,PEWEE VALLEY,KY,"40056",NOT AVAILABLE,(502) 241-8454,STATE,OPEN,719,SHELBY,"21211",USA,"922140",CORRECTIONAL INSTITUTIONS,https://corrections.ky.gov/about/Pages/ResearchandStatistics.aspx,11/29/2017,IMAGERY,2017-12-01T00:00:00.000Z,https://corrections.ky.gov/depts/AI/Pages/default.aspx,MAXIMUM,691,0.0168693058824,1.0704477769e-05,168995.546875,2084.7378735043,"21","211","040502","21211040502","405.02",Census Tract 405.02,G5020,S,111577004,1983193,"+38.2666389","-085.3564226",KY,-85.4571197207601,38.2854755973986,,"1"
1011,999,"10000107",LITTLE SANDY CORRECTIONAL COMPLEX,505 PRISON CONNECTOR,SANDY HOOK,KY,"41171",NOT AVAILABLE,(606) 738-6133,STATE,OPEN,1001,ELLIOTT,"21063",USA,"922140",CORRECTIONAL INSTITUTIONS,https://corrections.ky.gov/about/Pages/ResearchandStatistics.aspx,11/29/2017,IMAGERY,2017-12-01T00:00:00.000Z,https://corrections.ky.gov/depts/AI/Pages/default.aspx,MEDIUM,987,0.0158136954964,1.655385916e-05,260798.17578125,1920.46102766388,"21","063","920100","21063920100","9201",Census Tract 9201,G5020,S,336102284,1383202,"+38.1386646","-083.1682357",KY,-83.0810042244929,38.1339203321236,,"1"
1012,1000,"10003647",AUDUBON YOUTH DEVELOPMENT CENTER,8711 LAGRANGE RD,LOUISVILLE,KY,"40242",NOT AVAILABLE,(502) 429-7287,STATE,OPEN,41,JEFFERSON,"21111",USA,"922140",CORRECTIONAL INSTITUTIONS,https://schools.jefferson.kyschools.us/special/sac/audubon.html,12/1/2017,IMAGERY,2017-12-01T00:00:00.000Z,https://schools.jefferson.kyschools.us/special/sac/audubon.html,JUVENILE,80,0.00793842606852,2.553894774e-06,40310.36328125,995.672528037657,"21","111","010005","21111010005","100.05",Census Tract 100.05,G5020,S,2987077,27208,"+38.2719112","-085.5850573",KY,-85.5895922447588,38.2694511144469,,"1"
1013,1001,"10000116",NORTHPOINT TRAINING CENTER,710 WALTER REED RD,BURGIN,KY,"40310",NOT AVAILABLE,(859) 239-7012,STATE,OPEN,1237,BOYLE,"21021",USA,"922140",CORRECTIONAL INSTITUTIONS,https://corrections.ky.gov/about/Pages/ResearchandStatistics.aspx,11/29/2017,IMAGERY,2017-12-01T00:00:00.000Z,https://corrections.ky.gov/depts/AI/Pages/default.aspx,MEDIUM,1226,0.0127955850469,1.0151659727e-05,159015.24609375,1600.90896213718,"21","021","930100","21021930100","9301",Census Tract 9301,G5020,S,30984369,1123263,"+37.6862626","-084.7520071",KY,-84.7463568131888,37.7100209207808,,"1"
1014,1002,"10000102",ROEDERER CORRECTIONAL COMPLEX,P.O. BOX 69,LAGRANGE,KY,"40031",NOT AVAILABLE,(502) 222-0170,STATE,OPEN,1209,OLDHAM,"21185",USA,"922140",CORRECTIONAL INSTITUTIONS,https://corrections.ky.gov/about/Pages/ResearchandStatistics.aspx,11/29/2017,IMAGERY,2017-12-01T00:00:00.000Z,https://corrections.ky.gov/depts/AI/Pages/default.aspx,MAXIMUM,1138,0.0154036090826,7.82504179e-06,123737.54296875,1854.37179562957,"21","185","030200","21185030200","302",Census Tract 302,G5020,S,16921933,417139,"+38.4099243","-085.4320345",KY,-85.4297630493541,38.4031279906084,,"3"
1015,1003,"10002360",FREDERICK COUNTY ADULT DETENTION CENTER,7300 MARCIE'S CHOICE LN,FREDERICK,MD,"21704",NOT AVAILABLE,(301) 600-2550,COUNTY,OPEN,374,FREDERICK,"24021",USA,"922140",CORRECTIONAL INSTITUTIONS,http://dlslibrary.state.md.us/publications/JCR/2016/2016_309.pdf,8/30/2016,IMAGERY,2018-03-19T00:00:00.000Z,https://frederickcountymd.gov/677/Sheriff-Adult-Detention,MAXIMUM,405,0.00614593406539,1.801335227e-06,28873.171875,763.379924217567,"24","021","751003","24021751003","7510.03",Census Tract 7510.03,G5020,S,14194045,33282,"+39.3871801","-077.3961940",MD,-77.4122372318628,39.3658543404829,,"2"
1016,1004,"10001802",NEW HANOVER REGIONAL JUVENILE DETENTION CENTER,3830 JUVENILE CENTER RD,CASTLE HAYNE,NC,"28429",NOT AVAILABLE,(910) 675-0594,STATE,OPEN,-999,NEW HANOVER,"37129",USA,"922140",CORRECTIONAL INSTITUTIONS,https://www.ncdps.gov/Juvenile-Justice/Juvenile-Facility-Operations/Juvenile-Detention-Centers,12/12/2017,IMAGERY,2017-12-12T00:00:00.000Z,https://www.ncdps.gov/Juvenile-Justice/Juvenile-Facility-Operations/Juvenile-Detention-Centers,JUVENILE,18,0.00189881374539,1.34769061e-07,2022.1484375,233.35453352298,"37","129","011603","37129011603","116.03",Census Tract 116.03,G5020,S,26459101,154938,"+34.2987251","-077.8913034",NC,-77.8917256692888,34.3219876819842,,"2"
1017,1005,"10005047",GREEN RIVER YOUTH DEVELOPMENT CENTER,363 BOY CAMP ROAD,CROMWELL,KY,"42333",NOT AVAILABLE,(270) 526-3826,STATE,OPEN,23,BUTLER,"21031",USA,"922140",CORRECTIONAL INSTITUTIONS,https://djj.ky.gov/Pages/PREA.aspx,4/21/2015,IMAGERY,2017-12-01T00:00:00.000Z,https://djj.ky.gov/Facilities/Pages/Youth-Development-Centers.aspx,JUVENILE,40,0.00847469958024,3.677336386e-06,57278.5859375,1060.99010120797,"21","031","930100","21031930100","9301",Census Tract 9301,G5020,S,233654280,1649164,"+37.3162232","-086.6220725",KY,-86.7367740031218,37.2899948849165,,"1"
1018,1006,"10004185",PITT REGIONAL JUVENILE DETENTION CENTER,451 BELVOIR RD,GREENVILLE,NC,"27834",NOT AVAILABLE,(252) 830-6590,STATE,OPEN,-999,PITT,"37147",USA,"922140",CORRECTIONAL INSTITUTIONS,https://www.ncdps.gov/Juvenile-Justice/Juvenile-Facility-Operations/Juvenile-Detention-Centers,12/12/2017,IMAGERY,2017-12-12T00:00:00.000Z,https://www.ncdps.gov/Juvenile-Justice/Juvenile-Facility-Operations/Juvenile-Detention-Centers,JUVENILE,18,0.00194291805107,1.81262983e-07,2763.93359375,236.976829645359,"37","147","000800","37147000800","8",Census Tract 8,G5020,S,27132764,1217040,"+35.6385498","-077.3659853",NC,-77.3778288547514,35.6406480388936,,"2"
1019,1007,"10004327",LAKE CUMBERLAND YOUTH DEVELOPMENT CENTER,9000 HIGHWAY 1546,MONTICELLO,KY,"42633",NOT AVAILABLE,(606) 348-4201,STATE,OPEN,26,WAYNE,"21231",USA,"922140",CORRECTIONAL INSTITUTIONS,https://djj.ky.gov/Pages/PREA.aspx,6/16/2017,IMAGERY,2017-12-01T00:00:00.000Z,https://djj.ky.gov/Facilities/Pages/Youth-Development-Centers.aspx,JUVENILE,40,0.00872524372477,2.188205769e-06,33887.90234375,1093.35995126511,"21","231","920400","21231920400","9204",Census Tract 9204,G5020,S,253618957,16558029,"+36.7443434","-084.9687675",KY,-85.018662508968,36.853090025672,,"1"
1020,1008,"10005684",OWENSBORO TREATMENT CENTER,3001 LEITCHFIELD ROAD,OWENSBORO,KY,"42303",NOT AVAILABLE,(270) 687-7311,STATE,OPEN,21,DAVIESS,"21059",USA,"922140",CORRECTIONAL INSTITUTIONS,https://djj.ky.gov/Pages/PREA.aspx?Paged=TRUE&p_SortBehavior=0&p_FileLeafRef=Morehead%20YDC%202016%2epdf&p_ID=28&PageFirstRow=31&&View={2A6FDF3C-C8B7-4DC5-9FC3-92531E2BBB46},5/23/2015,IMAGERY,2017-12-01T00:00:00.000Z,NOT AVAILABLE,JUVENILE,30,0.0111728649924,6.88230794e-06,107872.4609375,1449.02719574891,"21","059","001401","21059001401","14.01",Census Tract 14.01,G5020,S,16449838,2392521,"+37.7766612","-087.0577968",KY,-87.063173297118,37.7568314690374,,"2"
1021,1009,"10005054",MAYFIELD YOUTH DEVELOPMENT CENTER,3179 STATE ROAD 45 SOUTH,MAYFIELD,KY,"42066",NOT AVAILABLE,(270) 247-3237,STATE,OPEN,20,GRAVES,"21083",USA,"922140",CORRECTIONAL INSTITUTIONS,https://djj.ky.gov/Pages/PREA.aspx,2/22/2016,IMAGERY,2017-12-01T00:00:00.000Z,https://djj.ky.gov/Facilities/Pages/Youth-Development-Centers.aspx,JUVENILE,30,0.00621513254821,2.130391752e-06,32932.8046875,793.621812733768,"21","083","020200","21083020200","202",Census Tract 202,G5020,S,50876504,530683,"+36.7033475","-088.6783874",KY,-88.6764020931147,36.7141695036429,,"1"
1022,1010,"10004312",MOREHEAD YOUTH DEVELOPMENT CENTER,495 FOREST HILLS DR,MOREHEAD,KY,"40351",NOT AVAILABLE,(606) 783-8565,STATE,OPEN,6,ROWAN,"21205",USA,"922140",CORRECTIONAL INSTITUTIONS,https://djj.ky.gov/Pages/PREA.aspx,6/17/2016,IMAGERY,2017-12-01T00:00:00.000Z,https://djj.ky.gov/Facilities/Pages/Youth-Development-Centers.aspx,JUVENILE,40,0.0108690800985,6.722675339e-06,105990.74609375,1329.5233250104,"21","205","950200","21205950200","9502",Census Tract 9502,G5020,S,112832542,978987,"+38.1940445","-083.4781722",KY,-83.4808072615256,38.1877563344769,,"2"
1023,1011,"10003639",NORTHERN KENTUCKY YOUTH DEVELOPMENT CENTER,15600 TURNER ROAD,CRITTENDEN,KY,"40130",NOT AVAILABLE,(859) 356-3172,STATE,OPEN,24,KENTON,"21117",USA,"922140",CORRECTIONAL INSTITUTIONS,https://djj.ky.gov/Pages/PREA.aspx?Paged=TRUE&p_SortBehavior=0&p_FileLeafRef=Morehead%20YDC%202016%2epdf&p_ID=28&PageFirstRow=31&&View={2A6FDF3C-C8B7-4DC5-9FC3-92531E2BBB46},5/15/2016,IMAGERY,2017-12-01T00:00:00.000Z,https://djj.ky.gov/Facilities/Pages/Youth-Development-Centers.aspx,JUVENILE,40,0.00716303417354,2.069214115e-06,32901.078125,863.998880396053,"21","117","063701","21117063701","637.01",Census Tract 637.01,G5020,S,78999109,834038,"+38.8373811","-084.5653670",KY,-84.6058366608075,38.7980600112821,,"1"
1024,1012,"10006714",GARFIELD COUNTY COMMUNITY CORRECTIONS FACILITY,0244 COUNTY ROAD 333A,RIFLE,CO,"81650",NOT AVAILABLE,(970) 625-0334,COUNTY,OPEN,-999,GARFIELD,"08045",USA,"922140",CORRECTIONAL INSTITUTIONS,https://www.garfield-county.com/criminal-justice/residential.aspx,2/19/2018,IMAGERY/OTHER,2018-02-19T00:00:00.000Z,https://www.garfield-county.com/criminal-justice/residential.aspx,MINIMUM,60,0.00142633012648,1.24786929e-07,2004.49609375,182.772390982001,"08","045","952002","08045952002","9520.02",Census Tract 9520.02,G5020,S,1064344396,4550086,"+39.6694299","-107.8585608",CO,-107.71635400302,39.5159116298181,,"2"
1025,1013,"10003645",BOYD REGIONAL JUVENILE DETENTION CENTER,2420 ROBERTS DR,ASHLAND,KY,"41102",NOT AVAILABLE,(606) 920-2085,STATE,OPEN,18,BOYD,"21019",USA,"922140",CORRECTIONAL INSTITUTIONS,https://djj.ky.gov/Pages/PREA.aspx,4/3/2017,IMAGERY,2017-12-01T00:00:00.000Z,https://djj.ky.gov/Facilities/Pages/Detention-Centers.aspx,JUVENILE,36,0.00297763577792,3.54048262e-07,5604.09375,389.211260551442,"21","019","030800","21019030800","308",Census Tract 308,G5020,S,4624956,0,"+38.4652760","-082.6668733",KY,-82.6671948226634,38.4744082426451,,"1"
1026,1014,"10003638",CAMPBELL REGIONAL JUVENILE DETENTION CENTER,590 COLUMBIA ST,NEWPORT,KY,"41071","6371",(859) 292-6371,STATE,OPEN,18,CAMPBELL,"21037",USA,"922140",CORRECTIONAL INSTITUTIONS,https://djj.ky.gov/Pages/PREA.aspx,9/14/2015,IMAGERY,2017-12-01T00:00:00.000Z,https://djj.ky.gov/Facilities/Pages/Detention-Centers.aspx,JUVENILE,52,0.00270491348523,3.32572805e-07,5309.7890625,331.76653422296,"21","037","050100","21037050100","501",Census Tract 501,G5020,S,524921,270118,"+39.0894248","-084.5005224",KY,-84.4966350098368,39.0895857337142,,"2"
1027,1015,"10003651",FAYETTE REGIONAL JUVENILE DETENTION CENTER,3475 SPURR RD,LEXINGTON,KY,"40511",NOT AVAILABLE,(859) 246-2806,STATE,OPEN,40,FAYETTE,"21067",USA,"922140",CORRECTIONAL INSTITUTIONS,https://djj.ky.gov/Pages/PREA.aspx,4/12/2017,IMAGERY,2017-12-01T00:00:00.000Z,https://djj.ky.gov/Facilities/Pages/Detention-Centers.aspx,JUVENILE,60,0.00828175930845,4.049133873e-06,63773.4453125,1006.68593332266,"21","067","003701","21067003701","37.01",Census Tract 37.01,G5020,S,83180923,341040,"+38.0893188","-084.5775210",KY,-84.5468880709404,38.1124329242959,,"4"
1028,1016,"10003657",LINCOLN VILLAGE REGIONAL JUVENILE DETENTION CENTER,820 NEW GLENDALE RD,ELIZABETHTOWN,KY,"42701",NOT AVAILABLE,(270) 766-5280,STATE,OPEN,25,HARDIN,"21093",USA,"922140",CORRECTIONAL INSTITUTIONS,https://djj.ky.gov/Pages/PREA.aspx,5/24/2015,IMAGERY,2017-12-01T00:00:00.000Z,https://djj.ky.gov/Facilities/Pages/Detention-Centers.aspx,JUVENILE,48,0.00310407834255,4.48122245e-07,7015.484375,390.726388914566,"21","093","001600","21093001600","16",Census Tract 16,G5020,S,357383005,4557888,"+37.5538636","-085.9551850",KY,-85.8602363356691,37.668954577676,,"2"
1029,1017,"10004705",MOULTRIE COUNTY JAIL,1505 WEST HAGERMAN ROAD,SULLIVAN,IL,"61951",NOT AVAILABLE,(217) 728-4386,COUNTY,OPEN,19,MOULTRIE,"17139",USA,"922140",CORRECTIONAL INSTITUTIONS,http://www.moultriesheriff.com/Moultrie_County_Detention_Center/Moultrie_County_Detention_Center_and_Sheriffs_Office.html,2/26/2018,IMAGERY,2018-03-02T00:00:00.000Z,http://www.moultriesheriff.com/Moultrie_County_Detention_Center/Moultrie_County_Detention_Center_and_Sheriffs_Office.html,NOT AVAILABLE,56,0.001907913723,2.15446753e-07,3465.37890625,240.824021923018,"17","139","977100","17139977100","9771",Census Tract 9771,G5020,S,208631328,17436030,"+39.5976418","-088.6827173",IL,-88.6305897689615,39.6076721335284,,"1"
1030,1018,"10002947",AMADOR R RODRIGUEZ BOOT CAMP / ED CTR,2310 W HWY 77,SAN BENITO,TX,"78586",NOT AVAILABLE,(956) 361-3509,COUNTY,OPEN,-999,CAMERON,"48061",USA,"922140",CORRECTIONAL INSTITUTIONS,http://www.co.cameron.tx.us/iJDC/index.html,4/25/2018,IMAGERY,2018-04-25T00:00:00.000Z,http://www.co.cameron.tx.us/iJDC/index.html,JUVENILE,40,0.00416637657873,7.89949828e-07,10906.59375,486.318336915482,"48","061","011700","48061011700","117",Census Tract 117,G5020,S,8149404,35477,"+26.1492004","-097.6527166",TX,-97.6576866421091,26.163734989918,,"2"
1031,1019,"10003680",MCCRACKEN REGIONAL JUVENILE DETENTION CENTER,500 COUNTRY PARK RD,PADUCAH,KY,"42001",NOT AVAILABLE,(270) 575-7111,STATE,OPEN,28,MCCRACKEN,"21145",USA,"922140",CORRECTIONAL INSTITUTIONS,https://djj.ky.gov/Pages/PREA.aspx,6/18/2016,IMAGERY,2017-12-01T00:00:00.000Z,https://djj.ky.gov/Facilities/Pages/Detention-Centers.aspx,JUVENILE,52,0.00252319978337,3.25767427e-07,5060.74609375,323.769729633953,"21","145","031400","21145031400","314",Census Tract 314,G5020,S,58572192,9827404,"+37.0952350","-088.6896751",KY,-88.6716849361883,37.0897357653573,,"1"
1032,1020,"10001944",WARREN REGIONAL JUVENILE DETENTION CENTER,1020 KENTUCKY ST,BOWLING GREEN,KY,"42101",NOT AVAILABLE,(270) 746-7155,STATE,OPEN,16,WARREN,"21227",USA,"922140",CORRECTIONAL INSTITUTIONS,https://djj.ky.gov/Pages/PREA.aspx?Paged=TRUE&p_SortBehavior=0&p_FileLeafRef=Morehead%20YDC%202016%2epdf&p_ID=28&PageFirstRow=31&&View={2A6FDF3C-C8B7-4DC5-9FC3-92531E2BBB46},11/10/2015,IMAGERY,2017-12-01T00:00:00.000Z,https://djj.ky.gov/Facilities/Pages/Detention-Centers.aspx,JUVENILE,48,0.00307546615362,3.77125691e-07,5851.23828125,377.995609904087,"21","227","010100","21227010100","101",Census Tract 101,G5020,S,975850,0,"+36.9921321","-086.4466206",KY,-86.4453352133983,36.9943574756506,"1","2"
1033,1021,"10003678",ADAIR YOUTH DEVELOPMENT CENTER,401 APPLEBY DRIVE,COLUMBIA,KY,"42728",NOT AVAILABLE,(270) 384-0811,STATE,OPEN,18,ADAIR,"21001",USA,"922140",CORRECTIONAL INSTITUTIONS,https://djj.ky.gov/Pages/PREA.aspx,6/19/2016,IMAGERY,2017-12-01T00:00:00.000Z,https://djj.ky.gov/Facilities/Pages/Youth-Development-Centers.aspx,JUVENILE,80,0.0082765514521,3.400776491e-06,52827.125,993.40976265987,"21","001","970401","21001970401","9704.01",Census Tract 9704.01,G5020,S,105370188,706583,"+37.0523709","-085.3284570",KY,-85.3046994240901,37.0847747364444,,"1"
1034,1022,"10005044",CADET LEADERSHIP & EDUCATION PROGRAM,2665 KENTUCKY HIGHWAY 30 WEST,JACKSON,KY,"41339",NOT AVAILABLE,(606) 295-2267,STATE,OPEN,17,BREATHITT,"21025",USA,"922140",CORRECTIONAL INSTITUTIONS,https://djj.ky.gov/Pages/PREA.aspx,3/31/2017,IMAGERY,2017-12-01T00:00:00.000Z,https://djj.ky.gov/Facilities/Pages/Cadet-Leadership-and-Education-Program.aspx,JUVENILE,40,0.0031025300489,5.91603264e-07,9245.55078125,388.339854532032,"21","025","920300","21025920300","9203",Census Tract 9203,G5020,S,50436970,1097432,"+37.5801106","-083.3677041",KY,-83.4155517184327,37.5388943189673,"2","2"
1035,1023,"10002416",B B RAYBURN CORRECTIONAL CENTER,27268 STATE HWY 21 N,ANGIE,LA,"70426",NOT AVAILABLE,(985) 661-6300,STATE,OPEN,1313,WASHINGTON,"22117",USA,"922140",CORRECTIONAL INSTITUTIONS,http://doc.louisiana.gov/briefing-book,9/27/2017,IMAGERY,2017-12-01T00:00:00.000Z,http://www.doc.la.gov/contact/correctional-facilities/,MEDIUM,1314,0.0195558916002,1.5056121571e-05,217487.296875,2390.78623573876,"22","117","950101","22117950101","9501.01",Census Tract 9501.01,G5020,S,164047118,4078495,"+30.8959922","-089.8078318",LA,-89.8158427329166,30.9216982269932,,"1"
1036,1024,"10000115",LEE ADJUSTMENT CENTER,168 LEE ADJUSTMENT CENTER DRIVE,BEATTYVILLE,KY,"41311",NOT AVAILABLE,(606) 464-2866,STATE,OPEN,-999,LEE,"21129",USA,"922140",CORRECTIONAL INSTITUTIONS,http://www.cca.com/locations,12/1/2017,IMAGERY,2017-12-01T00:00:00.000Z,http://www.cca.com/locations,CLOSE,816,0.0111465085758,5.116796481e-06,80037.875,1408.71982345991,"21","129","950100","21129950100","9501",Census Tract 9501,G5020,S,240027797,2017036,"+37.6384906","-083.7388335",KY,-83.7057956442269,37.6066831035134,"1","2"
1037,1025,"10000967",ALLEN CORRECTIONAL CENTER,3751 LAUDERDALE WOODYARD RD,KINDER,LA,"70648",NOT AVAILABLE,(337) 639-2943,STATE,OPEN,1579,ALLEN,"22003",USA,"922140",CORRECTIONAL INSTITUTIONS,http://www.doc.la.gov/contact/correctional-facilities/,12/1/2017,IMAGERY,2017-12-01T00:00:00.000Z,http://www.doc.la.gov/contact/correctional-facilities/,MAXIMUM,1576,0.019341723561,2.0570177397e-05,296029.46484375,2257.11752866901,"22","003","950500","22003950500","9505",Census Tract 9505,G5020,S,367334934,2694924,"+30.5129489","-092.8239587",LA,-92.7896727051345,30.5614831946338,,"1"
1038,1026,"10004094",DIXON CORRECTIONAL INSTITUTE,5568 STATE HWY 68,JACKSON,LA,"70748",NOT AVAILABLE,(225) 634-1200,STATE,OPEN,1778,EAST FELICIANA,"22037",USA,"922140",CORRECTIONAL INSTITUTIONS,http://doc.louisiana.gov/briefing-book,9/27/2017,IMAGERY,2017-12-01T00:00:00.000Z,http://www.doc.la.gov/contact/correctional-facilities/,MAXIMUM,1800,0.0254899000521,1.5127595746e-05,218272.484375,3156.59285723131,"22","037","951502","22037951502","9515.02",Census Tract 9515.02,G5020,S,249990723,539496,"+30.7679514","-091.1400292",LA,-91.207513733718,30.8132389993568,,"1"
1039,1027,"10000948",DAVID WADE CORRECTIONAL CENTER,670 BELL HILL RD,HOMER,LA,"71040",NOT AVAILABLE,(318) 927-0400,STATE,OPEN,1227,CLAIBORNE,"22027",USA,"922140",CORRECTIONAL INSTITUTIONS,http://doc.louisiana.gov/briefing-book,9/27/2017,IMAGERY,2017-12-01T00:00:00.000Z,http://www.doc.la.gov/contact/correctional-facilities/,MAXIMUM,1224,0.0142928969064,1.3199363792e-05,194814.48046875,1796.34528281884,"22","027","950200","22027950200","9502",Census Tract 9502,G5020,S,670867932,996219,"+32.8878543","-093.1083133",LA,-93.0195443845712,32.9017308831769,,"2"
1040,1028,"10000185",POWLEDGE PRISON,1400 FM 3452,PALESTINE,TX,"75803",NOT AVAILABLE,(903) 723-5074,STATE,OPEN,1101,ANDERSON,"48001",USA,"922140",CORRECTIONAL INSTITUTIONS,"https://www.texastribune.org/library/data/texas-prisons/units/, http://www.tdcj.state.tx.us/unit_directory/index.html",9/15/2016,IMAGERY,2018-01-11T00:00:00.000Z,http://www.tdcj.state.tx.us/unit_directory/index.html,MEDIUM,1137,0.0181945348953,1.2689281323e-05,184884.9140625,2213.68717660327,"48","001","950401","48001950401","9504.01",Census Tract 9504.01,G5020,S,16549991,296734,"+31.7346372","-095.8157096",TX,-95.8043563625123,31.7330412191954,,"3"
1041,1029,"10003998",MIDDLESEX COUNTY ADULT CORRECTION CENTER,ROUTE 130 AND APPLE ORCHARD LANE,NORTH BRUNSWICK,NJ,"08902",NOT AVAILABLE,(732) 951-3360,COUNTY,OPEN,1182,MIDDLESEX,"34023",USA,"922140",CORRECTIONAL INSTITUTIONS,"http://www.njcjwa.org/jails.html, http://www.drugpolicy.org/sites/default/files/New_Jersey_Jail_Population_Analysis_March_2013.pdf",2/15/2016,IMAGERY,2018-04-06T00:00:00.000Z,http://www.middlesexcountynj.gov/Government/Departments/PSH/Pages/default.aspx,NOT AVAILABLE,1436,0.00998754684058,3.349487847e-06,54520.76953125,1266.36063775462,"34","023","006203","34023006203","62.03",Census Tract 62.03,G5020,S,8825349,251940,"+40.4317957","-074.4953637",NJ,-74.4891992979146,40.4206184259162,,"2"
1042,1030,"10002550",WOOD COUNTY JAIL,400 MARKET ST,WISCONSIN RAPIDS,WI,"54495",NOT AVAILABLE,(715) 421-8730,COUNTY,OPEN,110,WOOD,"55141",USA,"922140",CORRECTIONAL INSTITUTIONS,http://woodcountysheriffsdepartment.com/index.php,5/9/2018,IMAGERY,2018-05-09T00:00:00.000Z,http://woodcountysheriffsdepartment.com/index.php,MAXIMUM,132,0.0046692569894,6.46450652e-07,11210.80859375,625.36600631256,"55","141","011000","55141011000","110",Census Tract 110,G5020,S,31159110,3049044,"+44.4178296","-089.7716656",WI,-89.8209809357008,44.3925534255032,"10","1"
1043,1031,"10000963",LOUISIANA STATE PENITENTIARY,17544 TUNICA TRACE,ANGOLA,LA,"70712",NOT AVAILABLE,(225) 655-4411,STATE,OPEN,6073,WEST FELICIANA,"22125",USA,"922140",CORRECTIONAL INSTITUTIONS,http://doc.louisiana.gov/briefing-book,9/27/2017,IMAGERY,2017-12-01T00:00:00.000Z,http://www.doc.la.gov/contact/correctional-facilities/,MAXIMUM,6312,0.0958348754504,0.000111834972715,1616110.47265625,11529.8932913489,"22","125","951702","22125951702","9517.02",Census Tract 9517.02,G5020,S,153958243,24292876,"+30.9404596","-091.6143742",LA,-91.5973261360141,30.9597693686425,,"1"
1044,1032,"10001768",WAKE JUVENILE DETENTION CENTER,700 BEACON LAKE DR,RALEIGH,NC,"27610",NOT AVAILABLE,(919) 212-3104,STATE,OPEN,-999,WAKE,"37183",USA,"922140",CORRECTIONAL INSTITUTIONS,https://www.ncdps.gov/Juvenile-Justice/Juvenile-Facility-Operations/Juvenile-Detention-Centers,12/13/2017,IMAGERY,2017-12-13T00:00:00.000Z,https://www.ncdps.gov/Juvenile-Justice/Juvenile-Facility-Operations/Juvenile-Detention-Centers,JUVENILE,24,0.00219615242496,1.28061322e-07,1956.34765625,273.55099930094,"37","183","054106","37183054106","541.06",Census Tract 541.06,G5020,S,14612163,253550,"+35.7763220","-078.5519570",NC,-78.5724472216194,35.789016455308,,"1"
1045,1033,"10000242",RAMSEY PRISON,1100 FM 655,ROSHARON,TX,"77583",NOT AVAILABLE,(281) 595-3491,STATE,OPEN,1798,BRAZORIA,"48039",USA,"922140",CORRECTIONAL INSTITUTIONS,"https://www.texastribune.org/library/data/texas-prisons/units/, http://www.tdcj.state.tx.us/unit_directory/index.html",9/15/2016,IMAGERY,2018-01-11T00:00:00.000Z,http://www.tdcj.state.tx.us/unit_directory/index.html,MAXIMUM,1891,0.0154019947356,8.055019273e-06,114472.84375,1808.76592272293,"48","039","661900","48039661900","6619",Census Tract 6619,G5020,S,302423802,5519691,"+29.3464118","-095.4933180",TX,-95.5370186381264,29.3104475741816,,"4"
1046,1034,"10006216",CHATHAM YOUTH DEVELOPMENT CENTER,560 PROGRESS BLVD.,SILER CITY,NC,"27344",NOT AVAILABLE,(919) 742-6220,STATE,OPEN,61,CHATHAM,"37037",USA,"922140",CORRECTIONAL INSTITUTIONS,https://www.ncdps.gov/annual-report-youth-development-centers-october-2017,10/1/2017,IMAGERY,2017-12-13T00:00:00.000Z,https://www.ncdps.gov/Juvenile-Justice/Juvenile-Facility-Operations/Youth-Development-Centers,JUVENILE,32,0.0030694055315,5.70349805e-07,8705.4765625,377.285098711745,"37","037","020300","37037020300","203",Census Tract 203,G5020,S,144605335,721831,"+35.6925992","-079.4750166",NC,-79.4241130438035,35.7201380216309,,"1"
1047,1035,"10002200",GILPIN COUNTY JUSTICE CENTER,2960 DORY HILL ROAD,GOLDEN,CO,"80403",NOT AVAILABLE,(303) 582-3576,COUNTY,OPEN,-999,GILPIN,"08047",USA,"922140",CORRECTIONAL INSTITUTIONS,http://www.gilpincountysheriff.com/divisions,2/19/2018,IMAGERY,2018-02-19T00:00:00.000Z,http://www.gilpincountysheriff.com/divisions,NOT AVAILABLE,55,0.00343516064828,5.87337052e-07,9478.8515625,432.337739055254,"08","047","013800","08047013800","138",Census Tract 138,G5020,S,388556733,942056,"+39.8611555","-105.5288778",CO,-105.48219864877,39.8392004524424,,"1"
1048,1036,"10000156",ROACH UNIT,15845 FM 164,CHILDRESS,TX,"79201",NOT AVAILABLE,(940) 937-6364,STATE,OPEN,1369,CHILDRESS,"48075",USA,"922140",CORRECTIONAL INSTITUTIONS,"https://www.texastribune.org/library/data/texas-prisons/units/, http://www.tdcj.state.tx.us/unit_directory/index.html",9/15/2016,IMAGERY,2018-01-11T00:00:00.000Z,http://www.tdcj.state.tx.us/unit_directory/index.html,MEDIUM,1384,0.0131660193846,1.1184114221e-05,168032.390625,1622.96360187376,"48","075","950100","48075950100","9501",Census Tract 9501,G5020,S,1777318679,44346232,"+34.5246235","-100.2081658",TX,-100.275923902388,34.4313264441225,,"1"
1049,1037,"10002208",JEFFERSON COUNTY DETENTION FACILITY,200 JEFFERSON COUNTY PARKWAY,GOLDEN,CO,"80419",NOT AVAILABLE,(303) 277-0211,COUNTY,OPEN,1470,JEFFERSON,"08059",USA,"922140",CORRECTIONAL INSTITUTIONS,https://www.jeffco.us/650/Sheriff,2/15/2016,IMAGERY,2018-02-19T00:00:00.000Z,https://www.jeffco.us/650/Sheriff,MAXIMUM,1300,0.00945938884789,2.073222599e-06,33406.48046875,1224.67460981305,"08","059","010000","08059010000","100",Census Tract 100,G5020,S,4928603,20413,"+39.7424830","-105.2105614",CO,-105.201294219705,39.730869031133,"1","2"
1050,1038,"10004664",HULSE JUVENILE DETENTION CENTER,24647 NORTH MILWAUKEE AVENUE,VERNON HILLS,IL,"60061",NOT AVAILABLE,(847) 377-7800,COUNTY,OPEN,-999,LAKE,"17097",USA,"922140",CORRECTIONAL INSTITUTIONS,http://19thcircuitcourt.state.il.us/1194/Juvenile-Detention,3/2/2018,IMAGERY,2018-03-02T00:00:00.000Z,http://19thcircuitcourt.state.il.us/1194/Juvenile-Detention,JUVENILE,-999,0.00444209350304,1.322874514e-06,22136.1328125,562.685284893945,"17","097","866200","17097866200","8662",Census Tract 8662,G5020,S,32750859,580968,"+42.2360556","-087.9107093",IL,-87.9364572877153,42.220982221669,,"1"
1051,1039,"10002220",GUNNISON COUNTY DETENTION CENTER,510 BIDWELL,GUNNISON,CO,"81230",NOT AVAILABLE,(970) 641-1108,COUNTY,OPEN,16,GUNNISON,"08051",USA,"922140",CORRECTIONAL INSTITUTIONS,http://www.gunnisoncounty.org/165/Detention-Services,2/16/2018,IMAGERY,2018-02-19T00:00:00.000Z,http://www.gunnisoncounty.org/165/Detention-Services,NOT AVAILABLE,-999,0.00205149668136,2.23809639e-07,3545.8125,261.343365732845,"08","051","963700","08051963700","9637",Census Tract 9637,G5020,S,14498887,0,"+38.5443384","-106.9270308",CO,-106.932335930927,38.5395347075559,,"1"
1052,1040,"10002196",GRAND COUNTY JAIL,670 SPRING STREET,HOT SULPHUR SPRINGS,CO,"80451",NOT AVAILABLE,(970) 725-3343,COUNTY,OPEN,-999,GRAND,"08049",USA,"922140",CORRECTIONAL INSTITUTIONS,http://co.grand.co.us/255/Sheriff,2/19/2018,IMAGERY,2018-02-19T00:00:00.000Z,http://co.grand.co.us/255/Sheriff,NOT AVAILABLE,-999,0.00188472421061,2.21173397e-07,3581.625,240.040358078111,"08","049","000202","08049000202","2.02",Census Tract 2.02,G5020,S,653965686,223268,"+39.9432243","-105.8783655",CO,-106.104490104039,40.0720849050539,,"1"
1053,1041,"10002744",CASS COUNTY JAIL,600 HWY 8 NORTH,LINDEN,TX,"75563",NOT AVAILABLE,(903) 756-7511,COUNTY,OPEN,68,CASS,"48067",USA,"922140",CORRECTIONAL INSTITUTIONS,"https://www.tcjs.state.tx.us/index.php?linkID=325, https://texasjailproject.org/list_of_county_jails/",3/1/2018,IMAGERY,2018-04-25T00:00:00.000Z,NOT AVAILABLE,NOT AVAILABLE,96,0.00260161633772,2.63141714e-07,3888.953125,304.215654193069,"48","067","950600","48067950600","9506",Census Tract 9506,G5020,S,705649660,2492577,"+32.9856172","-094.3504148",TX,-94.375705855972,33.0186980105717,,"1"
1054,1042,"10002879",CHAMBERS COUNTY JAIL,201 N COURT,ANAHUAC,TX,"77514",NOT AVAILABLE,NOT AVAILABLE,COUNTY,OPEN,84,CHAMBERS,"48071",USA,"922140",CORRECTIONAL INSTITUTIONS,"https://www.tcjs.state.tx.us/index.php?linkID=325, http://www.co.chambers.tx.us/default.aspx?name=sheriff",3/1/2018,IMAGERY,2018-04-25T00:00:00.000Z,NOT AVAILABLE,NOT AVAILABLE,148,0.00275080172628,3.67488024e-07,5246.3125,330.795329511206,"48","071","710500","48071710500","7105",Census Tract 7105,G5020,S,644472113,32908192,"+29.6525309","-094.5779034",TX,-94.6851545805458,29.7701808032245,,"1"
1055,1043,"10000049",MONROE COUNTY SHERIFF'S DEPARTMENT,216 MAIN ST,UNION,WV,"24983",NOT AVAILABLE,NOT AVAILABLE,COUNTY,NOT AVAILABLE,-999,MONROE,"54063",USA,"922140",CORRECTIONAL INSTITUTIONS,NOT AVAILABLE,NOT AVAILABLE,IMAGERY/OTHER,2018-05-10T00:00:00.000Z,NOT AVAILABLE,NOT AVAILABLE,-999,0.00134847610143,8.1314393e-08,1271.671875,164.191150318291,"54","063","950200","54063950200","9502",Census Tract 9502,G5020,S,454261482,607924,"+37.5777595","-080.6230295",WV,-80.5432406396092,37.591171166838,,"1"
1056,1044,"10005933",BRIDGE CITY CENTER FOR YOUTH,3225 RIVER ROAD,BRIDGE CITY,LA,"70094",NOT AVAILABLE,(504) 436-4253,STATE,OPEN,124,JEFFERSON,"22051",USA,"922140",CORRECTIONAL INSTITUTIONS,https://ojj.la.gov/about-ojj/administrative-functions/ojj-secure-care-facilities/,12/4/2017,IMAGERY/OTHER,2017-12-04T00:00:00.000Z,https://ojj.la.gov/about-ojj/administrative-functions/ojj-secure-care-facilities/,JUVENILE,-999,0.0114479017958,8.775762034e-06,125494.720703125,1376.01613976888,"22","051","028200","22051028200","282",Census Tract 282,G5020,S,14461933,5004029,"+29.9227436","-090.1622868",LA,-90.1674502629397,29.9378673447651,"5","1"
1057,1045,"10002095",BOSTON PRE-RELEASE CENTER,430 CANTERBURY ST,ROSLINDALE,MA,"02131",NOT AVAILABLE,(617) 822-5000,STATE,OPEN,106,SUFFOLK,"25025",USA,"922140",CORRECTIONAL INSTITUTIONS,http://www.mass.gov/eopss/law-enforce-and-cj/prisons/rsch-data/weekly-count-sheets.html,9/4/2017,IMAGERY,2017-12-04T00:00:00.000Z,https://www.mass.gov/prison/locations,MINIMUM,175,0.00393967852077,2.93345519e-07,4914.22265625,502.280902177789,"25","025","981100","25025981100","9811",Census Tract 9811,G5020,S,2712308,19090,"+42.2879942","-071.1034042",MA,-71.1013836827548,42.2924953358224,,"2"
1058,1046,"10001643",TENSAS / J.B. EVANS CORRECTIONAL CENTER,500 ROUTH ST,NEWELTON,LA,"71357",NOT AVAILABLE,(318) 467-3355,STATE,OPEN,-999,TENSAS,"22107",USA,"922140",CORRECTIONAL INSTITUTIONS,http://www.doc.la.gov/wp-content/uploads/stats/1k.pdf,3/25/2015,UNVERIFIED,2017-12-04T00:00:00.000Z,NOT AVAILABLE,MEDIUM,388,0.00510266615818,1.264948805e-06,18497.08984375,606.649241786385,"22","107","000100","22107000100","1",Census Tract 1,G5020,S,360559297,55348295,"+32.0409052","-091.1493287",LA,-91.2435748511352,32.0650455768698,,"1"
1059,1047,"10000949",SWANSON CENTER FOR YOUTH AT MONROE,4701 S GRAND ST,MONROE,LA,"71202",NOT AVAILABLE,(318) 362-5000,STATE,OPEN,156,OUACHITA,"22073",USA,"922140",CORRECTIONAL INSTITUTIONS,https://ojj.la.gov/about-ojj/administrative-functions/ojj-secure-care-facilities/,12/4/2017,IMAGERY,2017-12-04T00:00:00.000Z,https://ojj.la.gov/about-ojj/administrative-functions/ojj-secure-care-facilities/,JUVENILE,426,0.0176437998291,1.5816012465e-05,232268.05859375,2096.64139522429,"22","073","011000","22073011000","110",Census Tract 110,G5020,S,20119418,1187229,"+32.4350254","-092.1190566",LA,-92.1093761659431,32.4542143929048,,"3"
1060,1048,"10004747",WARE YOUTH CENTER,3565 UNITED STATES HIGHWAY 71,COUSHATTA,LA,"71019",NOT AVAILABLE,(318) 932-4411,STATE,OPEN,-999,RED RIVER,"22081",USA,"922140",CORRECTIONAL INSTITUTIONS,http://www.wareyouthcenter.com/Group_Home.php,12/4/2017,IMAGERY,2017-12-04T00:00:00.000Z,http://www.wareyouthcenter.com/Home_Page.php,JUVENILE,40,0.0182756813812,1.6375363641e-05,239494.96875,2140.71219437992,"22","081","960300","22081960300","9603",Census Tract 9603,G5020,S,103388525,6804577,"+32.0115509","-093.3237631",LA,-93.3742096965451,32.0808443703648,,"2"
1061,1049,"10006385",SWANSON CENTER FOR YOUTH AT COLUMBIA,132 HWY 850,COLUMBIA,LA,"71418",NOT AVAILABLE,(318) 649-4310,STATE,OPEN,-999,CALDWELL,"22021",USA,"922140",CORRECTIONAL INSTITUTIONS,https://ojj.la.gov/about-ojj/administrative-functions/ojj-secure-care-facilities/,12/4/2017,IMAGERY,2017-12-04T00:00:00.000Z,https://ojj.la.gov/about-ojj/administrative-functions/ojj-secure-care-facilities/,JUVENILE,-999,0.00719198186656,3.059392857e-06,44742.08203125,862.764732174591,"22","021","000300","22021000300","3",Census Tract 3,G5020,S,318165075,3054654,"+31.9959904","-092.0854092",LA,-92.1086287405697,32.0756926803372,,"4"
1062,1050,"10002417",C PAUL PHELPS CORRECTIONAL CENTER,14925 STATE HWY 27 N,DEQUINCY,LA,"70633",NOT AVAILABLE,NOT AVAILABLE,STATE,CLOSED,0,BEAUREGARD,"22011",USA,"922140",CORRECTIONAL INSTITUTIONS,http://www.nola.com/politics/index.ssf/2012/11/c_paul_phelps_prison_shuts_dow.html,11/1/2012,IMAGERY,2017-12-04T00:00:00.000Z,NOT AVAILABLE,MEDIUM,-999,0.0202453488437,1.3342254791e-05,191884.3671875,2437.01446947991,"22","011","960700","22011960700","9607",Census Tract 9607,G5020,S,926503087,1823101,"+30.5507508","-093.3141606",LA,-93.431764438931,30.4973844486134,,"1"
1063,1051,"10003997",MIDDLESEX COUNTY JUVENILE DETENTION CENTER,APPLE ORCHARD LANE,NORTH BRUNSWICK,NJ,"08902",NOT AVAILABLE,NOT AVAILABLE,COUNTY,OPEN,56,MIDDLESEX,"34023",USA,"922140",CORRECTIONAL INSTITUTIONS,"http://www.middlesexcountynj.gov/Government/Departments/PSH/Pages/default.aspx, http://www.nj.gov/lps/jjc/2011-AnnualDetentionStatisticsReport.pdf",2/15/2016,IMAGERY,2018-04-06T00:00:00.000Z,http://www.middlesexcountynj.gov/Government/Departments/PSH/Pages/default.aspx,JUVENILE,100,0.00579553531894,1.423309134e-06,23170.44140625,751.647292254174,"34","023","006203","34023006203","62.03",Census Tract 62.03,G5020,S,8825349,251940,"+40.4317957","-074.4953637",NJ,-74.4892605706019,40.4285907547362,,"2"
1064,1052,"10000175",ROBERTSON PRISON,12071 FM 3522,ABILENE,TX,"79601",NOT AVAILABLE,(325) 548-9035,STATE,OPEN,2971,JONES,"48253",USA,"922140",CORRECTIONAL INSTITUTIONS,"https://www.texastribune.org/library/data/texas-prisons/units/, http://www.tdcj.state.tx.us/unit_directory/index.html",9/15/2016,IMAGERY,2018-01-11T00:00:00.000Z,http://www.tdcj.state.tx.us/unit_directory/index.html,MAXIMUM,2984,0.0182016581992,2.3129745536e-05,340061.0390625,2197.48794946999,"48","253","020102","48253020102","201.02",Census Tract 201.02,G5020,S,4927870,1396799,"+32.5487573","-099.6251588",TX,-99.63324737641,32.5563504595955,,"2"
1065,1053,"10001101",MARION COUNTY JAIL,217 ADAMS ST,FAIRMONT,WV,"26554",NOT AVAILABLE,NOT AVAILABLE,COUNTY,CLOSED,0,MARION,"54049",USA,"922140",CORRECTIONAL INSTITUTIONS,http://www.timeswv.com/news/officials-looking-into-reopening-county-jail/article_6f3f0752-8584-11e7-bd37-7b501a24f70d.html,3/20/2017,IMAGERY,2018-05-10T00:00:00.000Z,NOT AVAILABLE,NOT AVAILABLE,-999,0.00170416553137,1.75309248e-07,2814.80078125,213.331186343905,"54","049","020100","54049020100","201",Census Tract 201,G5020,S,659636,69574,"+39.4841213","-080.1462241",WV,-80.1432339008558,39.4849948525017,,"1"
1066,1054,"10006785",FREDERICK COUNTY WORK RELEASE FACILITY,7300 MARCIE'S CHOICE LN,FREDERICK,MD,"21704",NOT AVAILABLE,NOT AVAILABLE,COUNTY,OPEN,55,FREDERICK,"24021",USA,"922140",CORRECTIONAL INSTITUTIONS,http://dlslibrary.state.md.us/publications/JCR/2016/2016_309.pdf,8/30/2016,IMAGERY,2018-03-19T00:00:00.000Z,https://frederickcountymd.gov/677/Sheriff-Adult-Detention,MINIMUM,128,0.00181805704612,1.92785338e-07,3090.0703125,232.399084391894,"24","021","751003","24021751003","7510.03",Census Tract 7510.03,G5020,S,14194045,33282,"+39.3871801","-077.3961940",MD,-77.4152012900179,39.3649178507036,,"2"
1067,1055,"10000038",NICHOLAS COUNTY SHERIFF'S DEPARTMENT,700 MAIN ST,SUMMERSVILLE,WV,"26651",NOT AVAILABLE,NOT AVAILABLE,COUNTY,NOT AVAILABLE,-999,NICHOLAS,"54067",USA,"922140",CORRECTIONAL INSTITUTIONS,NOT AVAILABLE,NOT AVAILABLE,IMAGERY/OTHER,2018-05-10T00:00:00.000Z,NOT AVAILABLE,NOT AVAILABLE,-999,0.00162539101126,1.28773122e-07,2032.8515625,206.314518750848,"54","067","950200","54067950200","9502",Census Tract 9502,G5020,S,262683665,8153687,"+38.2843210","-080.9143166",WV,-80.8512299812083,38.2806648100753,,"1"
1068,1056,"10002097",BRIDGEWATER STATE HOSPITAL,20 ADMINISTRATION RD,BRIDGEWATER,MA,"02324",NOT AVAILABLE,(508) 279-4500,STATE,OPEN,191,PLYMOUTH,"25023",USA,"922140",CORRECTIONAL INSTITUTIONS,http://www.mass.gov/eopss/law-enforce-and-cj/prisons/rsch-data/weekly-count-sheets.html,9/4/2017,IMAGERY,2017-12-04T00:00:00.000Z,https://www.mass.gov/prison/locations,MEDIUM,319,0.0116828730159,9.073956755e-06,151172.34375,1466.01238882408,"25","023","525300","25023525300","5253",Census Tract 5253,G5020,S,6959548,328265,"+41.9500489","-070.9519064",MA,-70.9553389624858,41.9423626854701,,"4"
1069,1057,"10000199",SAN SABA TRANSFER FACILITY,206 S WALLACE CREEK RD,SAN SABA,TX,"76877",NOT AVAILABLE,(325) 372-4255,STATE,OPEN,546,SAN SABA,"48411",USA,"922140",CORRECTIONAL INSTITUTIONS,"https://www.texastribune.org/library/data/texas-prisons/units/, http://www.tdcj.state.tx.us/unit_directory/index.html",9/15/2016,IMAGERY,2018-01-11T00:00:00.000Z,http://www.tdcj.state.tx.us/unit_directory/index.html,MEDIUM,606,0.00982088119571,3.662403235e-06,53058.65625,1193.76086796988,"48","411","950200","48411950200","9502",Census Tract 9502,G5020,S,2911439248,8069095,"+31.1551375","-098.8192922",TX,-98.7627057328552,31.1997168798557,,"1"
1070,1058,"10006584",LENOIR YOUTH DEVELOPMENT CENTER,3055 DOBBS FARM ROAD,KINSTON,NC,"28504",NOT AVAILABLE,(252) 208-4920,STATE,OPEN,54,LENOIR,"37107",USA,"922140",CORRECTIONAL INSTITUTIONS,https://www.ncdps.gov/annual-report-youth-development-centers-october-2017,10/1/2017,IMAGERY/OTHER,2017-12-13T00:00:00.000Z,https://www.ncdps.gov/Juvenile-Justice/Juvenile-Facility-Operations/Youth-Development-Centers,JUVENILE,44,0.00299821585335,5.18261387e-07,7869.96875,363.604963479449,"37","107","010900","37107010900","109",Census Tract 109,G5020,S,79446497,25968,"+35.3514224","-077.6123942",NC,-77.6306272534489,35.3084324530665,,"2"
1071,1059,"10001401",LEMUEL SHATTUCK HOSPITAL CORRECTIONAL UNIT,180 MORTON ST,JAMAICA PLAIN,MA,"02130",NOT AVAILABLE,(617) 522-7585,STATE,OPEN,19,SUFFOLK,"25025",USA,"922140",CORRECTIONAL INSTITUTIONS,http://www.mass.gov/eopss/law-enforce-and-cj/prisons/rsch-data/weekly-count-sheets.html,9/4/2017,IMAGERY,2017-12-04T00:00:00.000Z,https://www.mass.gov/prison/locations,MEDIUM,29,0.00424809017858,9.78459961e-07,16393.3359375,567.893443414098,"25","025","980300","25025980300","9803",Census Tract 9803,G5020,S,2081297,27540,"+42.3006134","-071.0946130",MA,-71.1018611595633,42.299543319431,,"1"
1072,1060,"10002099",MASSACHUSETTS ALCOHOL AND SUBSTANCE ABUSE CENTER,2 ADMINISTRATION RD,BRIDGEWATER,MA,"02324",NOT AVAILABLE,(508) 279-3500,STATE,CLOSED,0,PLYMOUTH,"25023",USA,"922140",CORRECTIONAL INSTITUTIONS,http://www.enterprisenews.com/news/20170504/nine-briefly-escape-from-state-substance-abuse-facility-amid-move-to-plymouth,5/4/2017,IMAGERY,2017-12-04T00:00:00.000Z,http://www.mass.gov/eopss/law-enforce-and-cj/prisons/doc-facilities/massachusetts-alcohol-and-substance-abuse-center.html,MINIMUM,236,0.0146843868455,4.777588452e-06,79608.26953125,1967.90332374209,"25","023","525300","25023525300","5253",Census Tract 5253,G5020,S,6959548,328265,"+41.9500489","-070.9519064",MA,-70.9557920751758,41.9531965983985,,"4"
1073,1061,"10000594",LAS ANIMAS COUNTY JAIL,"2309 EAST MAIN STREET, GARCIA JUSTICE CENTER",TRINIDAD,CO,"81082",NOT AVAILABLE,(719) 846-2211,COUNTY,OPEN,-999,LAS ANIMAS,"08071",USA,"922140",CORRECTIONAL INSTITUTIONS,http://www.lasanimascounty.net/index.php?option=com_content&view=category&layout=blog&id=16&Itemid=138,2/20/2018,IMAGERY,2018-02-20T00:00:00.000Z,http://www.lasanimascounty.net/index.php?option=com_content&view=category&layout=blog&id=16&Itemid=138,NOT AVAILABLE,-999,0.00427089361747,4.41645668e-07,6869.3359375,540.769912804891,"08","071","000500","08071000500","5",Census Tract 5,G5020,S,72835256,0,"+37.1267215","-104.4307432",CO,-104.485045613641,37.182620952177,"4","1"
1074,1062,"10006715",LAKE COUNTY JAIL,505 HARRISON AVENUE,LEADVILLE,CO,"80461",NOT AVAILABLE,(719) 486-4127,COUNTY,OPEN,-999,LAKE,"08065",USA,"922140",CORRECTIONAL INSTITUTIONS,http://www.lakecountyco.com/sheriff/,2/20/2018,IMAGERY,2018-02-20T00:00:00.000Z,http://www.lakecountyco.com/sheriff/,NOT AVAILABLE,-999,0.00180225965743,1.40560746e-07,2249.2265625,228.084075449781,"08","065","961700","08065961700","9617",Census Tract 9617,G5020,S,39955749,13043,"+39.2395898","-106.3084435",CO,-106.292230927315,39.2480856432482,"10","1"
1075,1063,"10002802",SANCHEZ STATE JAIL,3901 STATE JAIL RD,EL PASO,TX,"79938","8456",(915) 856-0046,STATE,OPEN,988,EL PASO,"48141",USA,"922140",CORRECTIONAL INSTITUTIONS,"https://www.texastribune.org/library/data/texas-prisons/units/, http://www.tdcj.state.tx.us/unit_directory/index.html",9/15/2016,IMAGERY,2018-01-11T00:00:00.000Z,http://www.tdcj.state.tx.us/unit_directory/index.html,MAXIMUM,1100,0.00984832937849,6.079132147e-06,88652.3359375,1188.36045723689,"48","141","010339","48141010339","103.39",Census Tract 103.39,G5020,S,47351243,0,"+31.8261423","-106.2555180",TX,-106.254049304199,31.8149532713052,,"3"
1076,1064,"10002194",LARIMER COUNTY JAIL,2405 MIDPOINT DRIVE,FORT COLLINS,CO,"80525",NOT AVAILABLE,(970) 498-5200,COUNTY,OPEN,557,LARIMER,"08069",USA,"922140",CORRECTIONAL INSTITUTIONS,https://www.larimer.org/sheriff,2/20/2018,IMAGERY,2018-02-20T00:00:00.000Z,https://www.larimer.org/sheriff,NOT AVAILABLE,617,0.00650408484297,1.832541169e-06,29892.8203125,820.22788281773,"08","069","001605","08069001605","16.05",Census Tract 16.05,G5020,S,15352611,900078,"+40.5418247","-105.0160060",CO,-105.033214632076,40.5642415532385,,"1"
1077,1065,"10006502",LA PLATA COUNTY JAIL,742 TURNER DR,DURANGO,CO,"81303",NOT AVAILABLE,(970) 247-1161,COUNTY,OPEN,-999,LA PLATA,"08067",USA,"922140",CORRECTIONAL INSTITUTIONS,http://lpcso.org/divisions,2/20/2018,IMAGERY,2018-02-20T00:00:00.000Z,http://lpcso.org/divisions,NOT AVAILABLE,293,0.00486300380424,1.186947463e-06,18477.625,623.378457876867,"08","067","971100","08067971100","9711",Census Tract 9711,G5020,S,24345833,59060,"+37.2554292","-107.8890742",CO,-107.878422917563,37.2476394293641,"2","2"
1078,1066,"10003999",MONMOUTH COUNTY YOUTH DETENTION CENTER,119 DUTCH LANE RD,FREEHOLD,NJ,"07728",NOT AVAILABLE,NOT AVAILABLE,COUNTY,CLOSED,0,MONMOUTH,"34025",USA,"922140",CORRECTIONAL INSTITUTIONS,http://www.nj.com/news/index.ssf/2010/01/monmouth_juvenile_detainees_to.html,1/28/2010,IMAGERY,2018-04-06T00:00:00.000Z,NOT AVAILABLE,JUVENILE,40,0.00511431807035,9.14961495e-07,14860.34765625,649.780069366555,"34","025","810402","34025810402","8104.02",Census Tract 8104.02,G5020,S,12538756,28947,"+40.2705616","-074.2434757",NJ,-74.2594385365595,40.2719183085289,,"1"
1079,1067,"10000046",MINGO COUNTY COURTHOUSE,75 E 2ND AVE,WILLIAMSON,WV,"25661",NOT AVAILABLE,NOT AVAILABLE,COUNTY,NOT AVAILABLE,-999,MINGO,"54059",USA,"922140",CORRECTIONAL INSTITUTIONS,http://www.mingocountywv.com/,3/4/2016,UNVERIFIED,2018-05-10T00:00:00.000Z,NOT AVAILABLE,NOT AVAILABLE,-999,0.00145136429536,1.25123488e-07,1958.9453125,182.128387009217,"54","059","957400","54059957400","9574",Census Tract 9574,G5020,S,23031468,0,"+37.6854468","-082.2666336",WV,-82.278500749379,37.6726844375469,"3","1"
1080,1068,"10000008",MINERAL COUNTY HOLDING FACILITY,100 EAST STREET,KEYSER,WV,"26726",NOT AVAILABLE,NOT AVAILABLE,COUNTY,NOT AVAILABLE,-999,MINERAL,"54057",USA,"922140",CORRECTIONAL INSTITUTIONS,NOT AVAILABLE,NOT AVAILABLE,IMAGERY/OTHER,2018-05-10T00:00:00.000Z,NOT AVAILABLE,NOT AVAILABLE,-999,0.00130572385289,1.03102278e-07,1654.3515625,162.706521778441,"54","057","010500","54057010500","105",Census Tract 105,G5020,S,137015559,103993,"+39.3730798","-079.0310138",WV,-78.9730423410913,39.4394581244413,,"1"
1081,1069,"10004208",DOBBS YOUTH DEVELOPMENT CENTER,3060 DOBBS FARM RD,KINSTON,NC,"28504",NOT AVAILABLE,(252) 522-0511,STATE,CLOSED,0,LENOIR,"37107",USA,"922140",CORRECTIONAL INSTITUTIONS,https://www.ncdps.gov/annual-report-youth-development-centers-october-2017,10/1/2017,IMAGERY,2017-12-13T00:00:00.000Z,"https://www.ncdps.gov/Index2.cfm?a=000003,002476,003108,003110",JUVENILE,43,0.0198019465682,1.553181571e-05,235865.06640625,2392.71141005773,"37","107","010900","37107010900","109",Census Tract 109,G5020,S,79446497,25968,"+35.3514224","-077.6123942",NC,-77.6318658424939,35.3116205696365,,"2"
1082,1070,"10001404",MASAC AT PLYMOUTH,1 BUMP POND RD,PLYMOUTH,MA,"02360",NOT AVAILABLE,(508) 291-2441,STATE,OPEN,262,PLYMOUTH,"25023",USA,"922140",CORRECTIONAL INSTITUTIONS,http://www.mass.gov/eopss/law-enforce-and-cj/prisons/rsch-data/weekly-count-sheets.html,9/4/2017,IMAGERY,2017-12-04T00:00:00.000Z,https://www.mass.gov/prison/locations,MINIMUM,275,0.0108462896868,4.074844795e-06,67788.484375,1406.49593596404,"25","023","530600","25023530600","5306",Census Tract 5306,G5020,S,98785674,6797569,"+41.8698585","-070.6603338",MA,-70.6605552118173,41.8495406680599,,"2"
1083,1071,"10001408",MCI - CEDAR JUNCTION,2405 MAIN ST,SOUTH WALPOLE,MA,"02071",NOT AVAILABLE,(508) 660-8000,STATE,OPEN,711,NORFOLK,"25021",USA,"922140",CORRECTIONAL INSTITUTIONS,http://www.mass.gov/eopss/law-enforce-and-cj/prisons/rsch-data/weekly-count-sheets.html,9/4/2017,IMAGERY,2017-12-04T00:00:00.000Z,https://www.mass.gov/prison/locations,MAXIMUM,646,0.0160394617808,1.4822131396e-05,247574.30859375,2039.42466546403,"25","021","411302","25021411302","4113.02",Census Tract 4113.02,G5020,S,12932836,162200,"+42.1334850","-071.2769727",MA,-71.2897965583048,42.1062558380284,,"1"
1084,1072,"10004444",MCI - FRAMINGHAM,99 LORING DRIVE,FRAMINGHAM,MA,"01701",NOT AVAILABLE,(508) 532-5100,STATE,OPEN,478,MIDDLESEX,"25017",USA,"922140",CORRECTIONAL INSTITUTIONS,http://www.mass.gov/eopss/law-enforce-and-cj/prisons/rsch-data/weekly-count-sheets.html,9/4/2017,IMAGERY,2017-12-04T00:00:00.000Z,https://www.mass.gov/prison/locations,MEDIUM,572,0.0115076602609,7.579987132e-06,126932.1875,1538.93030940599,"25","017","383101","25017383101","3831.01",Census Tract 3831.01,G5020,S,2815540,9845,"+42.2673461","-071.4076209",MA,-71.4074191869709,42.2675128887611,"3","2"
1085,1073,"10004743",GARRETT COUNTY JAIL,311 EAST ALDER STREET,OAKLAND,MD,"21550",NOT AVAILABLE,(301) 334-5055,COUNTY,OPEN,42,GARRETT,"24023",USA,"922140",CORRECTIONAL INSTITUTIONS,http://dlslibrary.state.md.us/publications/JCR/2016/2016_309.pdf,8/30/2016,IMAGERY,2018-03-19T00:00:00.000Z,https://www.garrettcounty.org/sheriffs-office,MAXIMUM,64,0.00341670406949,3.70385565e-07,5940.36328125,418.270343147582,"24","023","000600","24023000600","6",Census Tract 6,G5020,S,216143504,481147,"+39.4460403","-079.4357541",MD,-79.4065386289217,39.4074498745189,,"1"
1086,1074,"10002215",LINCOLN COUNTY JAIL,103 THIRD AVENUE,HUGO,CO,"80821",NOT AVAILABLE,(719) 743-2846,COUNTY,OPEN,-999,LINCOLN,"08073",USA,"922140",CORRECTIONAL INSTITUTIONS,http://lincolnsheriff.net/index.html,2/20/2018,IMAGERY,2018-02-20T00:00:00.000Z,http://lincolnsheriff.net/index.html,NOT AVAILABLE,40,0.00410098905863,6.94151336e-07,11089.39453125,513.04674899713,"08","073","961800","08073961800","9618",Census Tract 9618,G5020,S,5736438020,19096919,"+38.9629061","-103.5309720",CO,-103.473832970654,39.1322877464987,,"1"
1087,1075,"10000245",SCOTT PRISON,6999 RETRIEVE,ANGLETON,TX,"77515",NOT AVAILABLE,(979) 849-9306,STATE,OPEN,1071,BRAZORIA,"48039",USA,"922140",CORRECTIONAL INSTITUTIONS,"https://www.texastribune.org/library/data/texas-prisons/units/, http://www.tdcj.state.tx.us/unit_directory/index.html",9/15/2016,IMAGERY,2018-01-11T00:00:00.000Z,http://www.tdcj.state.tx.us/unit_directory/index.html,MAXIMUM,1130,0.0132967497017,4.845825322e-06,68718.4921875,1592.10425869424,"48","039","663100","48039663100","6631",Census Tract 6631,G5020,S,89028282,12587760,"+29.0774430","-095.4725290",TX,-95.4825132138511,29.0909350517963,,"1"
1088,1076,"10002363",HOWARD COUNTY DETENTION CENTER,7301 WATERLOO RD,JESSUP,MD,"20794",NOT AVAILABLE,(410) 313-5200,COUNTY,OPEN,283,HOWARD,"24027",USA,"922140",CORRECTIONAL INSTITUTIONS,http://dlslibrary.state.md.us/publications/JCR/2016/2016_309.pdf,8/30/2016,IMAGERY,2018-03-19T00:00:00.000Z,https://www.howardcountymd.gov/Departments/Corrections,NOT AVAILABLE,343,0.00695033537943,1.612794387e-06,25778.80078125,875.99414778061,"24","027","601203","24027601203","6012.03",Census Tract 6012.03,G5020,S,8891346,4381,"+39.1784051","-076.7637098",MD,-76.7817795136261,39.1695480948077,,"2"
1089,1077,"10006737",KNOX COUNTY MARY DAVIS DETENTION HOME,1319 E. 5TH STREET,GALESBURG,IL,"61401",NOT AVAILABLE,(309) 343-5112,COUNTY,OPEN,-999,KNOX,"17095",USA,"922140",CORRECTIONAL INSTITUTIONS,http://www.co.knox.il.us/mary-davis-detention-home/,3/2/2018,IMAGERY,2018-03-02T00:00:00.000Z,http://www.co.knox.il.us/mary-davis-detention-home/,JUVENILE,-999,0.00283453302186,3.16452727e-07,5190.76953125,359.063874738309,"17","095","001000","17095001000","10",Census Tract 10,G5020,S,6921362,0,"+40.9303488","-090.3599107",IL,-90.3496863699499,40.9333921582968,,"1"
1090,1078,"10000021",LEWIS COUNTY SHERIFF,110 CENTER AVE,WESTON,WV,"26452",NOT AVAILABLE,NOT AVAILABLE,COUNTY,NOT AVAILABLE,-999,LEWIS,"54041",USA,"922140",CORRECTIONAL INSTITUTIONS,NOT AVAILABLE,NOT AVAILABLE,IMAGERY/OTHER,2018-05-10T00:00:00.000Z,NOT AVAILABLE,NOT AVAILABLE,-999,0.0011230130088,6.8197514e-08,1088.01171875,139.504590664238,"54","041","967400","54041967400","9674",Census Tract 9674,G5020,S,27730536,187515,"+39.0484851","-080.4339206",WV,-80.466908840996,39.0363473055626,,"1"
1091,1079,"10002101",MCI - NORFOLK,2 CLARK ST,NORFOLK,MA,"02056",NOT AVAILABLE,(508) 660-5900,STATE,OPEN,1417,NORFOLK,"25021",USA,"922140",CORRECTIONAL INSTITUTIONS,http://www.mass.gov/eopss/law-enforce-and-cj/prisons/rsch-data/weekly-count-sheets.html,9/4/2017,IMAGERY,2017-12-04T00:00:00.000Z,https://www.mass.gov/prison/locations,MEDIUM,1473,0.0178226696024,1.5969210324e-05,266788.4296875,2258.46536908085,"25","021","409101","25021409101","4091.01",Census Tract 4091.01,G5020,S,20875886,733000,"+42.1167622","-071.3168858",MA,-71.3041713610019,42.1191290297871,,"3"
1092,1080,"10001393",MCI - SHIRLEY,1 HARVARD RD,SHIRLEY,MA,"01464",NOT AVAILABLE,(978) 425-4341,STATE,OPEN,1476,MIDDLESEX,"25017",USA,"922140",CORRECTIONAL INSTITUTIONS,http://www.mass.gov/eopss/law-enforce-and-cj/prisons/rsch-data/weekly-count-sheets.html,9/4/2017,IMAGERY,2017-12-04T00:00:00.000Z,https://www.mass.gov/prison/locations,MEDIUM,1455,0.02204015403,1.7641937119e-05,296654.421875,2590.06757231218,"25","017","388200","25017388200","3882",Census Tract 3882,G5020,S,40967067,204574,"+42.5736544","-071.6409862",MA,-71.6447857559965,42.5277754710656,,"1"
1093,1081,"10004449",NORTH CENTRAL CORRECTIONAL INSTITUTION,500 COLONY ROAD,GARDNER,MA,"01440",NOT AVAILABLE,(978) 630-6000,STATE,OPEN,959,WORCESTER,"25027",USA,"922140",CORRECTIONAL INSTITUTIONS,http://www.mass.gov/eopss/law-enforce-and-cj/prisons/rsch-data/weekly-count-sheets.html,9/4/2017,IMAGERY,2017-12-04T00:00:00.000Z,https://www.mass.gov/prison/locations,MEDIUM,1012,0.0144192034618,1.3294040923e-05,223729.640625,1824.08279513793,"25","027","707500","25027707500","7075",Census Tract 7075,G5020,S,27895453,1085182,"+42.5925766","-071.9674534",MA,-71.9416300008503,42.5797906425079,,"1"
1094,1082,"10006585",EDGECOMBE YOUTH DEVELOPMENT CENTER,78 POSITIVE WAY,ROCKY MOUNT,NC,"27801",NOT AVAILABLE,(252) 544-5730,STATE,OPEN,67,EDGECOMBE,"37065",USA,"922140",CORRECTIONAL INSTITUTIONS,https://www.ncdps.gov/annual-report-youth-development-centers-october-2017,10/1/2017,IMAGERY,2017-12-13T00:00:00.000Z,https://www.ncdps.gov/Juvenile-Justice/Juvenile-Facility-Operations/Youth-Development-Centers,JUVENILE,44,0.0029399776602,5.21930552e-07,7994.01171875,366.545892409737,"37","065","020600","37065020600","206",Census Tract 206,G5020,S,139240553,276156,"+35.9942385","-077.6905098",NC,-77.7714258298301,35.9940204373143,,"2"
1095,1083,"10002940",SEGOVIA PRE-RELEASE FACILITY,1201 E EL CIBOLO RD,EDINBURG,TX,"78542",NOT AVAILABLE,(956) 316-2400,STATE,OPEN,1167,HIDALGO,"48215",USA,"922140",CORRECTIONAL INSTITUTIONS,"https://www.texastribune.org/library/data/texas-prisons/units/, http://www.tdcj.state.tx.us/unit_directory/index.html",9/15/2016,IMAGERY,2018-01-11T00:00:00.000Z,http://www.tdcj.state.tx.us/unit_directory/index.html,MEDIUM,1224,0.00942759032134,5.718812264e-06,79130.787109375,1108.16877159371,"48","215","023512","48215023512","235.12",Census Tract 235.12,G5020,S,33519019,0,"+26.4243643","-098.0958984",TX,-98.120560800203,26.4173751285151,,"3"
1096,1084,"10002219",MESA COUNTY JAIL / SHERIFF,215 RICE STREET,GRAND JUNCTION,CO,"81501",NOT AVAILABLE,NOT AVAILABLE,COUNTY,OPEN,574,MESA,"08077",USA,"922140",CORRECTIONAL INSTITUTIONS,http://sheriff.mesacounty.us/jail/,2/20/2018,IMAGERY,2018-02-20T00:00:00.000Z,http://sheriff.mesacounty.us/jail/,NOT AVAILABLE,440,0.00647136827567,1.945256335e-06,31048.21875,834.327387404756,"08","077","000900","08077000900","9",Census Tract 9,G5020,S,16764091,1363149,"+39.1013837","-108.6167119",CO,-108.574093223375,39.0683510887901,,"1"
1097,1085,"10004041",ST. MARY'S COUNTY DETENTION CENTER,41880 BALDRIDGE ST,LEONARDTOWN,MD,"20650",NOT AVAILABLE,(301) 475-4200 EXT 2200,COUNTY,OPEN,198,ST. MARY'S,"24037",USA,"922140",CORRECTIONAL INSTITUTIONS,http://dlslibrary.state.md.us/publications/JCR/2016/2016_309.pdf,8/30/2016,IMAGERY,2018-03-20T00:00:00.000Z,https://www.firstsheriff.com/corrections.asp,NOT AVAILABLE,245,0.00500967832256,6.93613452e-07,10952.94921875,621.536795232306,"24","037","875500","24037875500","8755",Census Tract 8755,G5020,S,88296359,396771,"+38.3156097","-076.6275785",MD,-76.6278693442997,38.3028899919663,,"1"
1098,1086,"10004666",OGLE COUNTY JAIL,107 SOUTH 5TH STREET,OREGON,IL,"61061",NOT AVAILABLE,(815) 732-2135,COUNTY,OPEN,64,OGLE,"17141",USA,"922140",CORRECTIONAL INSTITUTIONS,"http://oglecounty.org/departments/sheriff/ogle-county-jail/, http://www.ilsheriff.org/index.php/directory",12/31/2017,IMAGERY,2018-03-02T00:00:00.000Z,http://oglecounty.org/departments/sheriff/ogle-county-jail/,NOT AVAILABLE,109,0.00144767129732,1.26951612e-07,2117.38671875,193.886555767714,"17","141","961400","17141961400","9614",Census Tract 9614,G5020,S,21404647,906334,"+42.0178323","-089.3090238",IL,-89.3332090542483,42.0136405099885,,"1"
1099,1087,"10002218",MESA COUNTY ALTERNATIVE SENTENCING UNIT,650 SOUTH AVENUE,GRAND JUNCTION,CO,"81501",NOT AVAILABLE,NOT AVAILABLE,COUNTY,CLOSED,0,MESA,"08077",USA,"922140",CORRECTIONAL INSTITUTIONS,http://www.mcsonews.com/2016/04/alternative-sentencing-unit-no-longer.html,4/8/2016,IMAGERY,2018-02-20T00:00:00.000Z,http://sheriff.mesacounty.us/jail/template.aspx?id=5232,NOT AVAILABLE,-999,0.00150993098306,1.4092658e-07,2249.19921875,189.759171780247,"08","077","000800","08077000800","8",Census Tract 8,G5020,S,15875844,315678,"+39.0509375","-108.5105025",CO,-108.563076063127,39.0641132712048,,"4"
1100,1088,"10004042",WORCESTER COUNTY JAIL,5022 JOYNER RD,SNOW HILL,MD,"21863",NOT AVAILABLE,(410) 632-1300,COUNTY,OPEN,184,WORCESTER,"24047",USA,"922140",CORRECTIONAL INSTITUTIONS,http://dlslibrary.state.md.us/publications/JCR/2016/2016_309.pdf,8/30/2016,IMAGERY,2018-03-20T00:00:00.000Z,http://www.co.worcester.md.us/departments,NOT AVAILABLE,480,0.00837632259596,2.120794932e-06,33428.54296875,1040.09536940518,"24","047","951300","24047951300","9513",Census Tract 9513,G5020,S,15375010,914127,"+38.1618108","-075.3968682",MD,-75.3758057937819,38.1697860621626,"2","1"
1101,1089,"10001472",PEORIA COUNTY JUVENILE DETENTION CENTER,223 NORTH MAXWELL ROAD,PEORIA,IL,"61604",NOT AVAILABLE,(309) 634-4200,COUNTY,OPEN,43,PEORIA,"17143",USA,"922140",CORRECTIONAL INSTITUTIONS,http://www.10thcircuitcourtil.org/198/Prison-Rape-Elimination-Act-PREA,6/16/2016,IMAGERY,2018-03-02T00:00:00.000Z,http://www.10thcircuitcourtil.org/190/Juvenile-Detention-Center,JUVENILE,63,0.00431547789511,6.17246856e-07,10087.5625,531.552499483344,"17","143","004500","17143004500","45",Census Tract 45,G5020,S,31193605,0,"+40.7041267","-089.6924480",IL,-89.6960424964278,40.6894833266957,,"2"
1102,1090,"10003635",CUMBERLAND COUNTY JAIL,36 COUNTY WAY,PORTLAND,ME,"04102",NOT AVAILABLE,(207) 774-5939,COUNTY,OPEN,340,CUMBERLAND,"23005",USA,"922140",CORRECTIONAL INSTITUTIONS,http://www.cumberlandso.org/31/Corrections-Division,3/20/2018,IMAGERY,2018-03-20T00:00:00.000Z,http://www.cumberlandso.org/31/Corrections-Division,MAXIMUM,500,0.00737265938342,1.714525208e-06,29363.75,931.068089453786,"23","005","002002","23005002002","20.02",Census Tract 20.02,G5020,S,8388219,928710,"+43.6530080","-070.3135329",ME,-70.2817508321055,43.650791762868,"8","2"
1103,1091,"10001392",NORTHEASTERN CORRECTIONAL INSTITUTION,1 BARRETTS MILL RD,WEST CONCORD,MA,"01742",NOT AVAILABLE,(978) 371-7941,STATE,OPEN,193,MIDDLESEX,"25017",USA,"922140",CORRECTIONAL INSTITUTIONS,http://www.mass.gov/eopss/law-enforce-and-cj/prisons/rsch-data/weekly-count-sheets.html,9/4/2017,IMAGERY,2017-12-04T00:00:00.000Z,https://www.mass.gov/prison/locations,MINIMUM,277,0.0127080022376,7.340639639e-06,123325.49609375,1630.01519693575,"25","017","361300","25017361300","3613",Census Tract 3613,G5020,S,34660437,1781059,"+42.4776669","-071.3424997",MA,-71.3979683963659,42.4722627128396,,"1"
1104,1092,"10002792",SKYVIEW PSYCHIATRIC FACILITY,379 FM 2972 WEST,RUSK,TX,"75785","3666",(903) 683-5781,STATE,OPEN,466,CHEROKEE,"48073",USA,"922140",CORRECTIONAL INSTITUTIONS,"https://www.texastribune.org/library/data/texas-prisons/units/, http://www.tdcj.state.tx.us/unit_directory/index.html",9/15/2016,IMAGERY,2018-01-11T00:00:00.000Z,http://www.tdcj.state.tx.us/unit_directory/index.html,MAXIMUM,562,0.0130352938357,9.040513009e-06,131833.25,1537.75602877163,"48","073","950900","48073950900","9509",Census Tract 9509,G5020,S,29349902,57206,"+31.8041275","-095.0905697",TX,-95.1647222174059,31.81132658011,"1","2"
1105,1093,"10004204",STONEWALL JACKSON YOUTH DEVELOPMENT CENTER,850 HOLSHOUSER ROAD,CONCORD,NC,"28027",NOT AVAILABLE,(704) 652-4300,STATE,OPEN,227,CABARRUS,"37025",USA,"922140",CORRECTIONAL INSTITUTIONS,https://www.ncdps.gov/annual-report-youth-development-centers-october-2017,10/1/2017,IMAGERY,2017-12-13T00:00:00.000Z,https://www.ncdps.gov/Juvenile-Justice/Juvenile-Facility-Operations/Youth-Development-Centers,JUVENILE,128,0.0231188278561,1.9219669363e-05,292057.55078125,2829.7368716592,"37","025","042000","37025042000","420",Census Tract 420,G5020,S,16774875,0,"+35.3758415","-080.6155081",NC,-80.6005273982073,35.3639349668862,,"2"
1106,1094,"10004451",OLD COLONY CORRECTIONAL CENTER,1 ADMINISTRATION ROAD,BRIDGEWATER,MA,"02324",NOT AVAILABLE,(508) 279-6000,STATE,OPEN,702,PLYMOUTH,"25023",USA,"922140",CORRECTIONAL INSTITUTIONS,http://www.mass.gov/eopss/law-enforce-and-cj/prisons/rsch-data/weekly-count-sheets.html,9/4/2017,IMAGERY,2017-12-04T00:00:00.000Z,https://www.mass.gov/prison/locations,MEDIUM,757,0.0126339592669,9.798880692e-06,163267.4609375,1577.37591808579,"25","023","525300","25023525300","5253",Census Tract 5253,G5020,S,6959548,328265,"+41.9500489","-070.9519064",MA,-70.9555808243045,41.9492869139956,,"4"
1107,1095,"10004011",OCEAN COUNTY JAIL,114 HOOPER AVE,TOMS RIVER,NJ,"08754",NOT AVAILABLE,NOT AVAILABLE,COUNTY,OPEN,-999,OCEAN,"34029",USA,"922140",CORRECTIONAL INSTITUTIONS,"http://www.co.ocean.nj.us/corrections/index.htm, http://m.pressofatlanticcity.com/news/breaking/cape-jail-looks-to-expand-to-ease-overcrowding-increase-security/article_80e0cee6-6112-11e2-a242-001a4bcf887a.html?mode=jqm",2/15/2016,IMAGERY,2018-04-06T00:00:00.000Z,http://www.co.ocean.nj.us/CorrectionsWebSite/,MAXIMUM,700,0.00530557699858,1.082406815e-06,17497.90234375,662.683487997682,"34","029","723100","34029723100","7231",Census Tract 7231,G5020,S,3707977,39058,"+39.9566515","-074.1894156",NJ,-74.1947123510476,39.9538555840328,,"1"
1108,1096,"10002758",SMITH PRISON,1313 COUNTY RD 19,LAMESA,TX,"79331","1898",(806) 872-6741,STATE,OPEN,1254,DAWSON,"48115",USA,"922140",CORRECTIONAL INSTITUTIONS,"https://www.texastribune.org/library/data/texas-prisons/units/, http://www.tdcj.state.tx.us/unit_directory/index.html",9/15/2016,IMAGERY,2018-01-11T00:00:00.000Z,http://www.tdcj.state.tx.us/unit_directory/index.html,MAXIMUM,2234,0.0158328778226,1.5322747465e-05,225709.109375,1888.68933581137,"48","115","950402","48115950402","9504.02",Census Tract 9504.02,G5020,S,81959645,183008,"+32.7116702","-101.9935199",TX,-101.910745664694,32.7266689785758,,"1"
1109,1097,"10002710",CHILDRESS COUNTY JAIL,1005 AVENUE F NE,CHILDRESS,TX,"79201",NOT AVAILABLE,NOT AVAILABLE,COUNTY,OPEN,51,CHILDRESS,"48075",USA,"922140",CORRECTIONAL INSTITUTIONS,"https://www.tcjs.state.tx.us/index.php?linkID=325, http://www.childresscountytexas.us/Sheriff/Sheriff.htm",3/1/2018,IMAGERY,2018-04-26T00:00:00.000Z,NOT AVAILABLE,NOT AVAILABLE,94,0.00219799340514,2.16814893e-07,3257.1484375,265.553279954323,"48","075","950200","48075950200","9502",Census Tract 9502,G5020,S,26635948,214423,"+34.4111893","-100.2078504",TX,-100.193535700026,34.4230053482997,,"1"
1110,1098,"10000690",PERRY COUNTY JAIL,12 EAST WATER STREET,PINCKNEYVILLE,IL,"62274",NOT AVAILABLE,(618) 357-5212,COUNTY,OPEN,-999,PERRY,"17145",USA,"922140",CORRECTIONAL INSTITUTIONS,http://www.ilsheriff.org/index.php/directory,3/2/2018,IMAGERY,2018-03-02T00:00:00.000Z,https://perrycountysheriffsoffice.com/,NOT AVAILABLE,56,0.00149718420211,1.39646445e-07,2198.43359375,190.298413548727,"17","145","030200","17145030200","302",Census Tract 302,G5020,S,147609032,1880476,"+38.0941512","-089.3610405",IL,-89.3812574999218,38.0797224465672,,"2"
1111,1099,"10004010",OCEAN COUNTY JUVENILE DETENTION CENTER,165 SUNSET AVE,TOMS RIVER,NJ,"08754",NOT AVAILABLE,(732) 341-1365,COUNTY,OPEN,21,OCEAN,"34029",USA,"922140",CORRECTIONAL INSTITUTIONS,"http://www.co.ocean.nj.us/ocjs/JSOverview.aspx, http://www.nj.gov/lps/jjc/2011-AnnualDetentionStatisticsReport.pdf",2/15/2016,IMAGERY/OTHER,2018-04-06T00:00:00.000Z,http://www.co.ocean.nj.us/ocjs/JSOverview.aspx,JUVENILE,30,0.00510704772412,1.028842036e-06,16644.76171875,621.474369513808,"34","029","722002","34029722002","7220.02",Census Tract 7220.02,G5020,S,10591298,58166,"+40.0158088","-074.2240866",NJ,-74.2242619985998,40.0063324514752,,"1"
1112,1100,"10000022",RANDOLPH COUNTY SHERIFF'S DEPARTMENT,25 HIGH STREET,ELKINS,WV,"26241",NOT AVAILABLE,NOT AVAILABLE,COUNTY,NOT AVAILABLE,-999,RANDOLPH,"54083",USA,"922140",CORRECTIONAL INSTITUTIONS,NOT AVAILABLE,NOT AVAILABLE,IMAGERY/OTHER,2018-05-10T00:00:00.000Z,NOT AVAILABLE,NOT AVAILABLE,-999,0.00296600559435,2.46417343e-07,3925.0078125,367.699906411218,"54","083","966100","54083966100","9661",Census Tract 9661,G5020,S,3734398,0,"+38.9296131","-079.8526740",WV,-79.8430199535352,38.92327870047,,"1"
1113,1101,"10000011",TYLER COUNTY JAIL / SHERIFF,121 COURT ST,MIDDLEBOURNE,WV,"26149",NOT AVAILABLE,NOT AVAILABLE,COUNTY,NOT AVAILABLE,-999,TYLER,"54095",USA,"922140",CORRECTIONAL INSTITUTIONS,http://www.tylercountywv.com/admin/sheriff-tax-office.htm,3/4/2016,UNVERIFIED,2018-05-10T00:00:00.000Z,NOT AVAILABLE,NOT AVAILABLE,-999,0.00129575252671,8.9798798e-08,1441.97265625,158.485061182442,"54","095","961900","54095961900","9619",Census Tract 9619,G5020,S,257141077,6258679,"+39.5141063","-080.9200073",WV,-80.9032562321206,39.492132222911,,"1"
1114,1102,"10000282",PONDVILLE CORRECTIONAL CENTER,1 INDUSTRIES DR,NORFOLK,MA,"02056",NOT AVAILABLE,(508) 660-3924,STATE,OPEN,150,NORFOLK,"25021",USA,"922140",CORRECTIONAL INSTITUTIONS,http://www.mass.gov/eopss/law-enforce-and-cj/prisons/rsch-data/weekly-count-sheets.html,9/4/2017,IMAGERY,2017-12-04T00:00:00.000Z,https://www.mass.gov/prison/locations,MINIMUM,204,0.00806282310566,1.937944206e-06,32370.68359375,1018.06103137045,"25","021","409101","25021409101","4091.01",Census Tract 4091.01,G5020,S,20875886,733000,"+42.1167622","-071.3168858",MA,-71.2930257719373,42.1084424133523,,"3"
1115,1103,"10006348",BURKE CRV CENTER,5161 WESTERN AVE,MORGANTON,NC,"28655",NOT AVAILABLE,(828) 433-4036,STATE,OPEN,155,BURKE,"37023",USA,"922140",CORRECTIONAL INSTITUTIONS,"http://webapps6.doc.state.nc.us/apps/asqExt/ASQ, https://www.ncdps.gov/Adult-Corrections/Community-Corrections/Confinement-in-Response-to-Violation-CRV",10/31/2017,IMAGERY,2017-12-13T00:00:00.000Z,https://www.ncdps.gov/Adult-Corrections/Community-Corrections/Confinement-in-Response-to-Violation-CRV,MINIMUM,248,0.00542245918221,1.804419942e-06,27526.79296875,661.843401848738,"37","023","021301","37023021301","213.01",Census Tract 213.01,G5020,S,41597597,0,"+35.6808305","-081.6823365",NC,-81.6804208949018,35.6772600458501,,"3"
1116,1104,"10001794",ROBESON CRV CENTER,803 NC HWY 711,LUMBERTON,NC,"28360",NOT AVAILABLE,(910) 618-5535,STATE,OPEN,145,ROBESON,"37155",USA,"922140",CORRECTIONAL INSTITUTIONS,"http://webapps6.doc.state.nc.us/apps/asqExt/ASQ, https://www.ncdps.gov/Adult-Corrections/Community-Corrections/Confinement-in-Response-to-Violation-CRV",10/31/2017,IMAGERY,2017-12-13T00:00:00.000Z,https://www.ncdps.gov/Adult-Corrections/Community-Corrections/Confinement-in-Response-to-Violation-CRV,MINIMUM,192,0.00655017577875,1.72876744e-06,26033.6875,796.588626374404,"37","155","960600","37155960600","9606",Census Tract 9606,G5020,S,70493022,5388,"+34.6702499","-079.1045572",NC,-79.0737554396604,34.6245429600544,,"1"
1117,1105,"10004443",SOUTH MIDDLESEX CORRECTIONAL CENTER,135 WESTERN AVENUE,FRAMINGHAM,MA,"01701",NOT AVAILABLE,(508) 875-2883,STATE,OPEN,112,MIDDLESEX,"25017",USA,"922140",CORRECTIONAL INSTITUTIONS,http://www.mass.gov/eopss/law-enforce-and-cj/prisons/rsch-data/weekly-count-sheets.html,9/4/2017,IMAGERY,2017-12-04T00:00:00.000Z,https://www.mass.gov/prison/locations,MINIMUM,185,0.00373211189266,4.12284764e-07,6903.75,471.531318669228,"25","017","383101","25017383101","3831.01",Census Tract 3831.01,G5020,S,2815540,9845,"+42.2673461","-071.4076209",MA,-71.4059207136379,42.2652753329448,"3","2"
1118,1106,"10004150",CHARLES A DILLON YOUTH DEVELOPMENT CENTER,100 DILLON DR,BUTNER,NC,"27509",NOT AVAILABLE,(919) 575-3166,STATE,CLOSED,0,GRANVILLE,"37077",USA,"922140",CORRECTIONAL INSTITUTIONS,https://www.ncdps.gov/press-release/north-carolina-invests-giving-troubled-youth-second-chance,4/14/2016,IMAGERY,2017-12-13T00:00:00.000Z,"https://www.ncdps.gov/Index2.cfm?a=000003,002476,003108,003110",JUVENILE,90,0.0120936412346,4.777702705e-06,73321.0859375,1524.05391304484,"37","077","970704","37077970704","9707.04",Census Tract 9707.04,G5020,S,7857872,18933,"+36.1547908","-078.7934856",NC,-78.7924784368011,36.1494039765315,,"2"
1119,1107,"10002900",STEVENSON PRISON,1525 FM 766,CUERO,TX,"77954",NOT AVAILABLE,(361) 275-2075,STATE,OPEN,1363,DEWITT,"48123",USA,"922140",CORRECTIONAL INSTITUTIONS,"https://www.texastribune.org/library/data/texas-prisons/units/, http://www.tdcj.state.tx.us/unit_directory/index.html",9/15/2016,IMAGERY,2018-01-11T00:00:00.000Z,http://www.tdcj.state.tx.us/unit_directory/index.html,MEDIUM,1384,0.0128936214366,1.0367751554e-05,147086.765625,1519.17022699016,"48","123","970200","48123970200","9702",Census Tract 9702,G5020,S,430504902,1135978,"+29.1698440","-097.4060010",TX,-97.2976500229214,29.1343014662004,,"1"
1120,1108,"10004209",GASTON REG JUVENILE DETENTION CENTER,135 CAMP SERTOMA RD,DALLAS,NC,"28034",NOT AVAILABLE,(704) 922-7832,STATE,CLOSED,0,GASTON,"37071",USA,"922140",CORRECTIONAL INSTITUTIONS,http://www.wbtv.com/story/29755154/new-juvenile-detention-center-slated-to-open-in-concord,9/9/2015,IMAGERY,2017-12-13T00:00:00.000Z,"https://www.ncdps.gov/Index2.cfm?a=000003,002476,003108,003109",JUVENILE,24,0.00205389963955,1.85761194e-07,2821.265625,251.267928637303,"37","071","030402","37071030402","304.02",Census Tract 304.02,G5020,S,34509843,196129,"+35.3257710","-081.2399149",NC,-81.2097188214415,35.3204229610599,,"2"
1121,1109,"10006716",MESA COUNTY COMMUNITY CORRECTIONS - POWELL BUILDING,650 SOUTH AVENUE,GRAND JUNCTION,CO,"81501",NOT AVAILABLE,NOT AVAILABLE,COUNTY,OPEN,-999,MESA,"08077",USA,"922140",CORRECTIONAL INSTITUTIONS,http://cjsd.mesacounty.us/ResidentialServices.aspx,2/20/2018,IMAGERY,2018-02-20T00:00:00.000Z,http://cjsd.mesacounty.us/ResidentialServices.aspx,NOT AVAILABLE,-999,0.00187514914309,2.038265e-07,3253.05859375,230.701596081836,"08","077","000800","08077000800","8",Census Tract 8,G5020,S,15875844,315678,"+39.0509375","-108.5105025",CO,-108.561563219336,39.063750911491,,"4"
1122,1110,"10004697",PIATT COUNTY JAIL,1216 RAYMOND ROAD,MONTICELLO,IL,"61856",NOT AVAILABLE,(217) 762-7822,COUNTY,OPEN,-999,PIATT,"17147",USA,"922140",CORRECTIONAL INSTITUTIONS,http://sheriff.piattcounty.org/,3/2/2018,IMAGERY,2018-03-02T00:00:00.000Z,http://sheriff.piattcounty.org/,NOT AVAILABLE,76,0.00255646498682,3.23994857e-07,5241.71484375,325.331405969542,"17","147","954600","17147954600","9546",Census Tract 9546,G5020,S,65445815,12863,"+40.0150673","-088.5767335",IL,-88.5785335205763,40.0073053429771,"2","1"
1123,1111,"10000039",WAYNE COUNTY SHERIFF'S OFFICE,700 HENDRICKS ST,WAYNE,WV,"25570",NOT AVAILABLE,NOT AVAILABLE,COUNTY,NOT AVAILABLE,-999,WAYNE,"54099",USA,"922140",CORRECTIONAL INSTITUTIONS,http://www.waynecountywv.org/sheriff.php,3/1/2016,IMAGERY,2018-05-10T00:00:00.000Z,NOT AVAILABLE,NOT AVAILABLE,-999,0.00169834158055,1.59494503e-07,2515.76953125,211.15166688675,"54","099","020600","54099020600","206",Census Tract 206,G5020,S,78375415,0,"+38.2731242","-082.4777472",WV,-82.442677725774,38.2210272270588,"3","1"
1124,1112,"10000030",WEBSTER COUNTY SHERIFF DEPARTMENT,2 COURT SQUARE,WEBSTER SPRINGS,WV,"26288",NOT AVAILABLE,NOT AVAILABLE,COUNTY,NOT AVAILABLE,-999,WEBSTER,"54101",USA,"922140",CORRECTIONAL INSTITUTIONS,http://www.webstercounty.wv.gov/countygovernmentagencies/Pages/sheriff.aspx,3/4/2016,IMAGERY,2018-05-10T00:00:00.000Z,NOT AVAILABLE,NOT AVAILABLE,-999,0.00155349749253,1.31722518e-07,2085.1015625,191.364303369021,"54","101","970200","54101970200","9702",Census Tract 9702,G5020,S,289445092,1808446,"+38.5064641","-080.2961161",WV,-80.4119588390632,38.4780294254322,,"1"
1125,1113,"10001396",SOUZA-BARANOWSKI CORRECTIONAL CENTER,1 HARVARD RD,SHIRLEY,MA,"01464",NOT AVAILABLE,(978) 514-6500,STATE,OPEN,1075,WORCESTER,"25027",USA,"922140",CORRECTIONAL INSTITUTIONS,http://www.mass.gov/eopss/law-enforce-and-cj/prisons/rsch-data/weekly-count-sheets.html,9/4/2017,IMAGERY,2017-12-04T00:00:00.000Z,https://www.mass.gov/prison/locations,MAXIMUM,1410,0.0111127778855,7.357738928e-06,123713.85546875,1425.15879665823,"25","027","713100","25027713100","7131",Census Tract 7131,G5020,S,71144123,1335617,"+42.4835693","-071.6755848",MA,-71.6480585863139,42.5233984515712,"3","1"
1126,1114,"10000229",STILES UNIT,3060 FM 3514,BEAUMONT,TX,"77705",NOT AVAILABLE,(409) 722-5255,STATE,OPEN,2819,JEFFERSON,"48245",USA,"922140",CORRECTIONAL INSTITUTIONS,"https://www.texastribune.org/library/data/texas-prisons/units/, http://www.tdcj.state.tx.us/unit_directory/index.html",9/15/2016,IMAGERY,2018-01-11T00:00:00.000Z,http://www.tdcj.state.tx.us/unit_directory/index.html,MEDIUM,2981,0.0179132252423,2.2534743195e-05,322413.890625,2138.5203262433,"48","245","011203","48245011203","112.03",Census Tract 112.03,G5020,S,3496273,130615,"+29.9859820","-094.0500790",TX,-94.0524959671409,29.9884368536444,,"2"
1127,1115,"10003864",CENTER FOR HUMAN DEVELOPMENT - TERRI THOMAS SCHOOL,280 TINKHAM ROAD,SPRINGFIELD,MA,"01129",NOT AVAILABLE,(413) 731-4952,STATE,OPEN,15,HAMPDEN,"25013",USA,"922140",CORRECTIONAL INSTITUTIONS,http://chd.org/child-adolescent-and-family-services/juvenile-justice/,12/4/2017,IMAGERY,2017-12-04T00:00:00.000Z,http://chd.org/child-adolescent-and-family-services/juvenile-justice/,JUVENILE,-999,0.00737929706488,2.374256305e-06,39659.7265625,960.211745285711,"25","013","801604","25013801604","8016.04",Census Tract 8016.04,G5020,S,5228797,55126,"+42.1022055","-072.4895603",MA,-72.4808376796128,42.1101363124483,,"1"
1128,1116,"10002096",JUDGE JOHN CONNELLY YOUTH CENTER,450 CANTERBURY ST,ROSLINDALE,MA,"02131",NOT AVAILABLE,(617) 474-8101,STATE,OPEN,75,SUFFOLK,"25025",USA,"922140",CORRECTIONAL INSTITUTIONS,https://www.publiccounsel.net/ya/wp-content/uploads/sites/6/2015/05/DYS-Metro-Region-Contact-List-4.20151.pdf,12/4/2017,IMAGERY,2017-12-04T00:00:00.000Z,NOT AVAILABLE,JUVENILE,-999,0.00504815318098,8.5833034e-07,14378.8125,642.692177787682,"25","025","981100","25025981100","9811",Census Tract 9811,G5020,S,2712308,19090,"+42.2879942","-071.1034042",MA,-71.1024261722255,42.2914814953593,,"2"
1129,1117,"10004034",BALTIMORE CENTRAL BOOKING AND INTAKE CENTER,300 E MADISON ST,BALTIMORE,MD,"21202",NOT AVAILABLE,(410) 545-8080,STATE,OPEN,166,BALTIMORE CITY,"24510",USA,"922140",CORRECTIONAL INSTITUTIONS,http://dpscs.maryland.gov/publicinfo/publications/annuals.shtml#doc,6/30/2016,IMAGERY/OTHER,2017-12-04T00:00:00.000Z,http://www.dpscs.maryland.gov/locations/prisons.shtml,MAXIMUM,895,0.00538136342112,6.51581173e-07,10434.203125,731.956870861817,"24","510","100300","24510100300","1003",Census Tract 1003,G5020,S,156309,0,"+39.2995112","-076.6091250",MD,-76.6105000381893,39.3000825569821,,"7"
1130,1118,"10000178",ESTES PRISON,1100 HWY 1807,VENUS,TX,"76084",NOT AVAILABLE,(972) 366-3334,STATE,OPEN,1023,JOHNSON,"48251",USA,"922140",CORRECTIONAL INSTITUTIONS,"https://www.texastribune.org/library/data/texas-prisons/units/, http://www.tdcj.state.tx.us/unit_directory/index.html",9/15/2016,IMAGERY/OTHER,2018-01-11T00:00:00.000Z,http://www.mtctrains.com/corrections/#locations,MINIMUM,1040,0.00888584769239,4.873221092e-06,71529.17578125,1069.92719311193,"48","251","130408","48251130408","1304.08",Census Tract 1304.08,G5020,S,115026303,380022,"+32.4276183","-097.1177286",TX,-97.0959698666291,32.407451929268,,"1"
1131,1119,"10004181",MARION MINIMUM SECURITY UNIT,4019 STATE HWY 226 S,MARION,NC,"28752",NOT AVAILABLE,(828) 659-7810,STATE,OPEN,-999,MCDOWELL,"37111",USA,"922140",CORRECTIONAL INSTITUTIONS,https://www.ncdps.gov/Adult-Corrections/Prisons/Prison-Facilities,12/13/2017,IMAGERY,2017-12-13T00:00:00.000Z,https://www.ncdps.gov/Adult-Corrections/Prisons/Prison-Facilities,MINIMUM,116,0.00759372383001,1.625501148e-06,24789.54296875,930.588788277309,"37","111","970901","37111970901","9709.01",Census Tract 9709.01,G5020,S,198541245,667822,"+35.6212043","-081.9095781",NC,-81.9536078462669,35.6521395746038,,"2"
1132,1120,"10001477",PIKE COUNTY JAIL,204 EAST ADAMS STREET,PITTSFIELD,IL,"62363",NOT AVAILABLE,(217) 285-5011,COUNTY,OPEN,-999,PIKE,"17149",USA,"922140",CORRECTIONAL INSTITUTIONS,http://www.ilsheriff.org/index.php/directory,3/2/2018,IMAGERY,2018-03-02T00:00:00.000Z,http://www.pikecountyil.org/pike-county-sheriff/,NOT AVAILABLE,62,0.00157696371966,1.14758695e-07,1845.859375,199.053103759445,"17","149","952700","17149952700","9527",Census Tract 9527,G5020,S,29912100,144487,"+39.6126418","-090.8052704",IL,-90.8042066311398,39.6082556885499,,"2"
1133,1121,"10004735",POPE COUNTY JAIL,216 EAST DECATUR STREET,GOLCONDA,IL,"62938",NOT AVAILABLE,(618) 683-4321,COUNTY,OPEN,-999,POPE,"17151",USA,"922140",CORRECTIONAL INSTITUTIONS,http://www.ilsheriff.org/index.php/directory?option=com_countysheriffs&view=countysheriffs,3/2/2018,UNVERIFIED,2018-03-02T00:00:00.000Z,NOT AVAILABLE,NOT AVAILABLE,-999,0.000926886924,5.271153e-08,821.90234375,117.944831579223,"17","151","971300","17151971300","9713",Census Tract 9713,G5020,S,333545835,10811618,"+37.2750214","-088.5409917",IL,-88.4849908110561,37.3688403949803,,"1"
1134,1122,"10006786",CUMBERLAND COUNTY COMMUNITY CORRECTION CENTER,20 COUNTY WAY,PORTLAND,ME,"04102",NOT AVAILABLE,(207) 774-5939 EXT 2131,COUNTY,OPEN,-999,CUMBERLAND,"23005",USA,"922140",CORRECTIONAL INSTITUTIONS,http://www.cumberlandso.org/176/Community-Corrections,3/20/2018,IMAGERY/OTHER,2018-03-20T00:00:00.000Z,http://www.cumberlandso.org/176/Community-Corrections,MINIMUM,-999,0.00131079879654,8.9032327e-08,1524.8515625,169.875768154534,"23","005","002002","23005002002","20.02",Census Tract 20.02,G5020,S,8388219,928710,"+43.6530080","-070.3135329",ME,-70.2813896248715,43.6524219344509,"8","2"
1135,1123,"10004739",PULASKI COUNTY DETENTION CENTER,20 JUSTICE DRIVE,ULLIN,IL,"62992",NOT AVAILABLE,(618) 845-3512,COUNTY,OPEN,185,PULASKI,"17153",USA,"922140",CORRECTIONAL INSTITUTIONS,http://www.pulaskicountyil.net/pulaski-county-detention-center.html,12/2/2016,IMAGERY,2018-03-02T00:00:00.000Z,http://www.pulaskicountyil.net/pulaski-county-detention-center.html,MAXIMUM,240,0.00451784401172,7.07204141e-07,11012.421875,568.105236880422,"17","153","971100","17153971100","9711",Census Tract 9711,G5020,S,243893617,2438951,"+37.2241900","-089.1949567",IL,-89.1638792954855,37.2690325813114,,"1"
1136,1124,"10003984",PASSAIC COUNTY JAIL,11 MARSHALL ST,PATERSON,NJ,"07501",NOT AVAILABLE,NOT AVAILABLE,COUNTY,OPEN,862,PASSAIC,"34031",USA,"922140",CORRECTIONAL INSTITUTIONS,http://www.pcsheriff.org/home.html,1/31/2016,IMAGERY,2018-04-06T00:00:00.000Z,http://www.pcsheriff.org/home.html,MAXIMUM,1242,0.0045610091946,3.96484708e-07,6501.515625,574.733377240331,"34","031","181800","34031181800","1818",Census Tract 1818,G5020,S,421768,22980,"+40.9156717","-074.1761223",NJ,-74.1738478727564,40.9126799382289,,"1"
1137,1125,"10002731",TELFORD PRISON,3899 STATE HWY 98,NEW BOSTON,TX,"75570",NOT AVAILABLE,(903) 628-3171,STATE,OPEN,2626,BOWIE,"48037",USA,"922140",CORRECTIONAL INSTITUTIONS,"https://www.texastribune.org/library/data/texas-prisons/units/, http://www.tdcj.state.tx.us/unit_directory/index.html",9/15/2016,IMAGERY,2018-01-11T00:00:00.000Z,http://www.tdcj.state.tx.us/unit_directory/index.html,MAXIMUM,2872,0.0183697088944,2.3517811794e-05,349168.79296875,2231.00756037286,"48","037","011501","48037011501","115.01",Census Tract 115.01,G5020,S,163973513,1034203,"+33.4494554","-094.4805444",TX,-94.4735606847588,33.4206841708399,,"1"
1138,1126,"10001751",CALEDONIA CORRECTIONAL INSTITUTION - MINIMUM,"1984 CALEDONIA DR, STATE RD 1141",TILLERY,NC,"27882",NOT AVAILABLE,(252) 826-5621,STATE,OPEN,-999,HALIFAX,"37083",USA,"922140",CORRECTIONAL INSTITUTIONS,https://www.ncdps.gov/Adult-Corrections/Prisons/Prison-Facilities,12/13/2017,IMAGERY,2017-12-13T00:00:00.000Z,https://www.ncdps.gov/Adult-Corrections/Prisons/Prison-Facilities,MINIMUM,-999,0.0113141377218,5.910740359e-06,90873.18359375,1402.24509295579,"37","083","931000","37083931000","9310",Census Tract 9310,G5020,S,337828908,296036,"+36.2733034","-077.5165168",NC,-77.4633319854786,36.2905251517648,,"3"
1139,1127,"10001773",BLACK MOUNTAIN CORRECTIONAL CENTER FOR WOMEN,1449 N FORK RD,BLACK MOUNTAIN,NC,"28711",NOT AVAILABLE,NOT AVAILABLE,STATE,CLOSED,0,BUNCOMBE,"37021",USA,"922140",CORRECTIONAL INSTITUTIONS,"https://www2.ncdps.gov/Index2.cfm?a=000003,002240,002324",11/13/2015,IMAGERY,2017-12-13T00:00:00.000Z,"https://www.ncdps.gov/Index2.cfm?a=000003,002240,002324",MINIMUM,80,0.00604073126148,1.984439182e-06,30247.8125,745.868810887073,"37","021","003104","37021003104","31.04",Census Tract 31.04,G5020,S,55235712,876857,"+35.6877735","-082.3555208",NC,-82.3602531432952,35.6107615618694,,"2"
1140,1128,"10006546",BALTIMORE PRETRIAL COMPLEX,531 EAST MADISON STREET,BALTIMORE,MD,"21202",NOT AVAILABLE,(410) 209-4130,STATE,OPEN,313,BALTIMORE CITY,"24510",USA,"922140",CORRECTIONAL INSTITUTIONS,http://dpscs.maryland.gov/publicinfo/publications/annuals.shtml#doc,6/30/2016,IMAGERY,2017-12-04T00:00:00.000Z,http://www.dpscs.maryland.gov/locations/prisons.shtml,NOT AVAILABLE,-999,0.00277893007178,4.5906553e-07,7351.17578125,344.644343866312,"24","510","100300","24510100300","1003",Census Tract 1003,G5020,S,156309,0,"+39.2995112","-076.6091250",MD,-76.6084346824991,39.2985478657336,,"7"
1141,1129,"10001795",BLADEN CORRECTIONAL CENTER,5853 US HWY 701 N,ELIZABETHTOWN,NC,"28337",NOT AVAILABLE,NOT AVAILABLE,STATE,CLOSED,0,BLADEN,"37017",USA,"922140",CORRECTIONAL INSTITUTIONS,"https://www2.ncdps.gov/Index2.cfm?a=000003,002240,002324",11/13/2015,IMAGERY,2017-12-13T00:00:00.000Z,"https://www.ncdps.gov/Index2.cfm?a=000003,002240,002324",MINIMUM,172,0.00451001850533,1.145989263e-06,17263.84375,546.248421535999,"37","017","950100","37017950100","9501",Census Tract 9501,G5020,S,818510240,16611052,"+34.6257087","-078.3979630",NC,-78.5190162691112,34.6547012982744,,"1"
1142,1130,"10004681",PUTNAM COUNTY JAIL,120 NORTH 4TH STREET,HENNEPIN,IL,"61327",NOT AVAILABLE,(815) 925-7084,COUNTY,OPEN,-999,PUTNAM,"17155",USA,"922140",CORRECTIONAL INSTITUTIONS,http://www.ilsheriff.org/index.php/directory,3/2/2018,IMAGERY,2018-03-02T00:00:00.000Z,https://www.co.putnam.il.us/county-offices/sheriff-s-office,NOT AVAILABLE,5,0.00223112000206,1.61903831e-07,2668.6796875,265.327144568533,"17","155","954600","17155954600","9546",Census Tract 9546,G5020,S,292437277,29010204,"+41.1772988","-089.3148393",IL,-89.3423500607698,41.2532443543043,,"1"
1143,1131,"10006717",MESA COUNTY COMMUNITY CORRECTIONS - CHIPETA BUILDING,436 SOUTH 7TH STREET,GRAND JUNCTION,CO,"81501",NOT AVAILABLE,NOT AVAILABLE,COUNTY,OPEN,-999,MESA,"08077",USA,"922140",CORRECTIONAL INSTITUTIONS,http://cjsd.mesacounty.us/ResidentialServices.aspx,2/20/2018,IMAGERY,2018-02-20T00:00:00.000Z,http://cjsd.mesacounty.us/ResidentialServices.aspx,NOT AVAILABLE,-999,0.00138486987953,9.7746053e-08,1560.01953125,166.824534617074,"08","077","000800","08077000800","8",Census Tract 8,G5020,S,15875844,315678,"+39.0509375","-108.5105025",CO,-108.560641367364,39.0636421846368,,"4"
1144,1132,"10000241",C T TERRELL PRISON,1300 FM 655,ROSHARON,TX,"77583",NOT AVAILABLE,(281) 595-3481,STATE,OPEN,1570,BRAZORIA,"48039",USA,"922140",CORRECTIONAL INSTITUTIONS,"https://www.texastribune.org/library/data/texas-prisons/units/, http://www.tdcj.state.tx.us/unit_directory/index.html",9/15/2016,IMAGERY,2018-01-11T00:00:00.000Z,http://www.tdcj.state.tx.us/unit_directory/index.html,MEDIUM,1603,0.0209675139709,1.1557735926e-05,164233.18359375,2471.1401648389,"48","039","661900","48039661900","6619",Census Tract 6619,G5020,S,302423802,5519691,"+29.3464118","-095.4933180",TX,-95.5386196630314,29.2992221002003,,"4"
1145,1133,"10005030",FRANKLIN COUNTY DETENTION CENTER,121 COUNTY WAY,FARMINGTON,ME,"04938",NOT AVAILABLE,(207) 778-3032,COUNTY,OPEN,42,FRANKLIN,"23007",USA,"922140",CORRECTIONAL INSTITUTIONS,http://www.franklincounty.maine.gov/dispatch-log-jail-bookings,3/18/2018,IMAGERY/OTHER,2018-03-20T00:00:00.000Z,http://www.franklincounty.maine.gov/dispatch-log-jail-bookings,NOT AVAILABLE,-999,0.00325957349555,6.29449544e-07,10973.24609375,420.973198842747,"23","007","971200","23007971200","9712",Census Tract 9712,G5020,S,144199921,382855,"+44.6769355","-070.1414906",ME,-70.1572787062391,44.6971649936289,,"1"
1146,1134,"10005032",HANCOCK COUNTY JAIL,50 STATE STREET,ELLSWORTH,ME,"04605",NOT AVAILABLE,(207) 667-7588,COUNTY,OPEN,45,HANCOCK,"23009",USA,"922140",CORRECTIONAL INSTITUTIONS,https://co.hancock.me.us/site/index.php/state-police-so-call-sharing-agreement-8,3/20/2018,IMAGERY/OTHER,2018-03-20T00:00:00.000Z,https://co.hancock.me.us/site/index.php/state-police-so-call-sharing-agreement-8,NOT AVAILABLE,-999,0.00456318278551,4.99882597e-07,8691.37109375,585.785155465208,"23","009","965503","23009965503","9655.03",Census Tract 9655.03,G5020,S,41103798,6821051,"+44.5429412","-068.4087965",ME,-68.4260717900116,44.542922635101,"5","1"
1147,1135,"10000020",WIRT COUNTY SHERIFF DEPARTMENT,1 COURT STREET,ELIZABETH,WV,"26143",NOT AVAILABLE,NOT AVAILABLE,COUNTY,NOT AVAILABLE,-999,WIRT,"54105",USA,"922140",CORRECTIONAL INSTITUTIONS,http://www.littlekanawha.com/wirtphone.htm,3/1/2016,UNVERIFIED,2018-05-10T00:00:00.000Z,NOT AVAILABLE,NOT AVAILABLE,-999,0.00142382064204,1.09795917e-07,1752.3359375,176.610165818827,"54","105","030101","54105030101","301.01",Census Tract 301.01,G5020,S,363340368,2969702,"+39.0013168","-081.4200134",WV,-81.3940684792896,39.0635986015078,,"1"
1148,1136,"10003983",KEOGH DWYER CORRECTIONAL FACILITY,41 HIGH ST,NEWTON,NJ,"07860",NOT AVAILABLE,NOT AVAILABLE,COUNTY,OPEN,116,SUSSEX,"34037",USA,"922140",CORRECTIONAL INSTITUTIONS,http://www.sussexcountysheriff.com/,4/6/2018,IMAGERY/OTHER,2018-04-06T00:00:00.000Z,http://www.sussexcountysheriff.com/,NOT AVAILABLE,225,0.00368359313409,3.95162974e-07,6494.2265625,464.189190467211,"34","037","373700","34037373700","3737",Census Tract 3737,G5020,S,3820497,38566,"+41.0597970","-074.7578985",NJ,-74.7549164389182,41.0589083529865,,"1"
1149,1137,"10001980",MCLENNAN RESIDENTIAL TREATMENT CENTER,116 BURLESON RD,MART,TX,"76664",NOT AVAILABLE,(254) 297-8200,STATE,OPEN,65,MCLENNAN,"48309",USA,"922140",CORRECTIONAL INSTITUTIONS,http://www.tjjd.texas.gov/programs/prea.aspx,1/14/2016,IMAGERY,2018-01-12T00:00:00.000Z,http://www.tjjd.texas.gov/programs/facilities_list.aspx,JUVENILE,185,0.00993869466125,6.074245666e-06,88324.40625,1197.49751783752,"48","309","003601","48309003601","36.01",Census Tract 36.01,G5020,S,106873839,1823592,"+31.5506146","-096.8798056",TX,-96.844552186307,31.5455023415424,,"2"
1150,1138,"10004188",WESTERN AREA MULTIPURPOSE JUVENILE CRISIS AND ASSESMENT CENTER,20 LEES CREEK RD,ASHEVILLE,NC,"28806",NOT AVAILABLE,(828) 338-8340,STATE,OPEN,-999,BUNCOMBE,"37021",USA,"922140",CORRECTIONAL INSTITUTIONS,https://www.ncdps.gov/press-release/thursday-open-house-scheduled-western-area-multipurpose-juvenile-crisis-and-assessment,8/22/2016,IMAGERY,2017-12-13T00:00:00.000Z,NOT AVAILABLE,JUVENILE,4,0.0026098858026,4.45839801e-07,6796.1015625,313.918845444251,"37","021","002607","37021002607","26.07",Census Tract 26.07,G5020,S,16386367,409683,"+35.6342979","-082.6148321",NC,-82.6283370182689,35.6152254101505,,"1"
1151,1139,"10004205",CABARRUS CORRECTIONAL CENTER,130 DUTCH RD,MOUNT PLEASANT,NC,"28124",NOT AVAILABLE,NOT AVAILABLE,STATE,CLOSED,0,CABARRUS,"37025",USA,"922140",CORRECTIONAL INSTITUTIONS,"https://www2.ncdps.gov/Index2.cfm?a=000003,002240,002324",11/13/2015,IMAGERY,2017-12-13T00:00:00.000Z,"https://www.ncdps.gov/Index2.cfm?a=000003,002240,002324",MINIMUM,-999,0.00507270468077,1.457908994e-06,22163.34375,642.1483383675,"37","025","041701","37025041701","417.01",Census Tract 417.01,G5020,S,73024968,0,"+35.3980800","-080.4047449",NC,-80.412675758894,35.3977890504657,,"1"
1152,1140,"10000155",TULIA TRANSFER FACILITY,4000 HWY 86 W,TULIA,TX,"79088",NOT AVAILABLE,(806) 995-4109,STATE,OPEN,594,SWISHER,"48437",USA,"922140",CORRECTIONAL INSTITUTIONS,"https://www.texastribune.org/library/data/texas-prisons/units/, http://www.tdcj.state.tx.us/unit_directory/index.html",9/15/2016,IMAGERY,2018-01-12T00:00:00.000Z,http://www.tdcj.state.tx.us/unit_directory/index.html,MEDIUM,606,0.00788610078519,3.403488901e-06,51195.9765625,981.71680245464,"48","437","950200","48437950200","9502",Census Tract 9502,G5020,S,1469235836,18328645,"+34.6100135","-101.7496792",TX,-101.812788964524,34.5312299923385,,"1"
1153,1141,"10004203",CHARLOTTE CORRECTIONAL CENTER,4100 MEADOW OAK DR,CHARLOTTE,NC,"28208",NOT AVAILABLE,NOT AVAILABLE,STATE,CLOSED,0,MECKLENBURG,"37119",USA,"922140",CORRECTIONAL INSTITUTIONS,"https://www2.ncdps.gov/Index2.cfm?a=000003,002240,002324",11/13/2015,IMAGERY,2017-12-13T00:00:00.000Z,"https://www.ncdps.gov/Index2.cfm?a=000003,002240,002324",MINIMUM,252,0.00514077173499,1.249991254e-06,18954.578125,646.226325622974,"37","119","003903","37119003903","39.03",Census Tract 39.03,G5020,S,5408345,1162,"+35.2076512","-080.9206437",NC,-80.921175051279,35.1932168787186,,"1"
1154,1142,"10001552",BALTIMORE CITY CORRECTIONAL CENTER,901 GREENMOUNT AVE,BALTIMORE,MD,"21202",NOT AVAILABLE,(410) 332-4340,STATE,OPEN,503,BALTIMORE CITY,"24510",USA,"922140",CORRECTIONAL INSTITUTIONS,http://dpscs.maryland.gov/publicinfo/publications/annuals.shtml#doc,6/30/2016,IMAGERY/OTHER,2017-12-05T00:00:00.000Z,http://www.dpscs.maryland.gov/locations/prisons.shtml,MINIMUM,495,0.00499080908065,1.00528685e-06,16098.3828125,670.661474449072,"24","510","100200","24510100200","1002",Census Tract 1002,G5020,S,304692,0,"+39.2998552","-076.6022617",MD,-76.606461805167,39.3001316629359,,"1"
1155,1143,"10004218",DUPLIN CORRECTIONAL CENTER,364 HWY 11 S & 903,KENANSVILLE,NC,"28349",NOT AVAILABLE,NOT AVAILABLE,STATE,CLOSED,0,DUPLIN,"37061",USA,"922140",CORRECTIONAL INSTITUTIONS,"https://www2.ncdps.gov/Index2.cfm?a=000003,002240,002324",11/13/2015,IMAGERY,2017-12-13T00:00:00.000Z,"https://www.ncdps.gov/Index2.cfm?a=000003,002240,002324",MINIMUM,328,0.0107512948865,3.053956801e-06,46168.7421875,1320.1326483139,"37","061","090400","37061090400","904",Census Tract 904,G5020,S,315331422,2337852,"+34.9479257","-077.9329503",NC,-77.9808914682011,34.9447914383857,,"2"
1156,1144,"10002897",YOUNG MEDICAL FACILITY COMPLEX,5509 ATTWATER AVE,DICKINSON,TX,"77539",NOT AVAILABLE,(409) 948-0001,STATE,OPEN,449,GALVESTON,"48167",USA,"922140",CORRECTIONAL INSTITUTIONS,"https://www.texastribune.org/library/data/texas-prisons/units/, http://www.tdcj.state.tx.us/unit_directory/index.html",9/15/2016,IMAGERY,2018-01-12T00:00:00.000Z,http://www.tdcj.state.tx.us/unit_directory/index.html,MAXIMUM,455,0.00987301086338,3.202362329e-06,45561.8046875,1180.68676580314,"48","167","721900","48167721900","7219",Census Tract 7219,G5020,S,70076911,5559975,"+29.4376953","-094.9821525",TX,-94.9815284674452,29.4264016069659,"1","2"
1157,1145,"10002885",VANCE UNIT,2 JESTER RD,RICHMOND,TX,"77406",NOT AVAILABLE,(281) 277-3030,STATE,OPEN,270,FORT BEND,"48157",USA,"922140",CORRECTIONAL INSTITUTIONS,"https://www.texastribune.org/library/data/texas-prisons/units/, http://www.tdcj.state.tx.us/unit_directory/index.html",9/15/2016,IMAGERY,2018-01-12T00:00:00.000Z,http://www.tdcj.state.tx.us/unit_directory/index.html,MEDIUM,378,0.00684412526088,2.243510704e-06,31981.2109375,801.353559311019,"48","157","672900","48157672900","6729",Census Tract 6729,G5020,S,47282806,1085553,"+29.6700035","-095.7080888",TX,-95.6926977169904,29.6211924954287,,"1"
1158,1146,"10002713",WHEELER STATE JAIL,986 COUNTY RD AA,PLAINVIEW,TX,"79072",NOT AVAILABLE,(806) 293-1081,STATE,OPEN,533,HALE,"48189",USA,"922140",CORRECTIONAL INSTITUTIONS,"https://www.texastribune.org/library/data/texas-prisons/units/, http://www.tdcj.state.tx.us/unit_directory/index.html",9/15/2016,IMAGERY,2018-01-12T00:00:00.000Z,http://www.tdcj.state.tx.us/unit_directory/index.html,MEDIUM,576,0.0077979432922,3.324388595e-06,49797.19921875,945.398863650025,"48","189","950600","48189950600","9506",Census Tract 9506,G5020,S,1078681516,76997,"+34.1956637","-101.7858491",TX,-101.64626956034,34.180299197517,,"2"
1159,1147,"10006503",MOFFAT COUNTY DETENTION FACILITY,800 WEST 1ST STREET,CRAIG,CO,"81625",NOT AVAILABLE,(970) 824-4498,COUNTY,OPEN,-999,MOFFAT,"08081",USA,"922140",CORRECTIONAL INSTITUTIONS,http://www.moffatcountysheriff.com/index.html,2/20/2018,IMAGERY,2018-02-20T00:00:00.000Z,http://www.moffatcountysheriff.com/index.html,NOT AVAILABLE,101,0.00293550397529,5.46333377e-07,8904.1953125,368.023168552184,"08","081","000300","08081000300","3",Census Tract 3,G5020,S,401673348,1773556,"+40.5254675","-107.5290111",CO,-107.556427681148,40.5061277514024,,"1"
1160,1148,"10001979",MCLENNAN COUNTY STATE JUVENILE CORRECTIONAL FACILITY,116 BURLESON RD,MART,TX,"76664",NOT AVAILABLE,(254) 297-8200,STATE,OPEN,225,MCLENNAN,"48309",USA,"922140",CORRECTIONAL INSTITUTIONS,http://www.tjjd.texas.gov/programs/prea.aspx,1/14/2016,IMAGERY,2018-01-12T00:00:00.000Z,http://www.tjjd.texas.gov/programs/facilities_list.aspx,JUVENILE,368,0.0117582562475,8.219306546e-06,119516.75390625,1408.26153228031,"48","309","003601","48309003601","36.01",Census Tract 36.01,G5020,S,106873839,1823592,"+31.5506146","-096.8798056",TX,-96.8423967107064,31.5466997074247,,"2"
1161,1149,"10000188",BROWNWOOD HALFWAY HOUSE,910 FM 3254,BROWNWOOD,TX,"76801",NOT AVAILABLE,(325) 641-6462,STATE,OPEN,7,BROWN,"48049",USA,"922140",CORRECTIONAL INSTITUTIONS,http://www.tjjd.texas.gov/programs/prea.aspx,3/8/2017,IMAGERY/OTHER,2018-01-12T00:00:00.000Z,http://www.tjjd.texas.gov/programs/facilities_list.aspx,JUVENILE,10,0.00125779994397,9.8697196e-08,1437.7109375,152.089371196006,"48","049","950600","48049950600","9506",Census Tract 9506,G5020,S,6651492,0,"+31.7302058","-098.9950847",TX,-99.0093082685809,31.712332129207,,"2"
1162,1150,"10001765",FOUNTAIN CORRECTIONAL CENTER FOR WOMEN,300 FOUNTAIN SCHOOL RD,ROCKY MOUNT,NC,"27804",NOT AVAILABLE,(252) 442-9712,STATE,CLOSED,0,EDGECOMBE,"37065",USA,"922140",CORRECTIONAL INSTITUTIONS,"https://www2.ncdps.gov/Index2.cfm?a=000003,002240,002324",11/13/2015,IMAGERY,2017-12-13T00:00:00.000Z,"https://www.ncdps.gov/Index2.cfm?a=000003,002240,002324",MINIMUM,510,0.0187624816309,1.029972899e-05,157759.21484375,2325.20475526302,"37","065","020600","37065020600","206",Census Tract 206,G5020,S,139240553,276156,"+35.9942385","-077.6905098",NC,-77.7711577944805,35.9971636952005,,"2"
1163,1151,"10004167",DURHAM CORRECTIONAL CENTER,3900 GUESS RD,DURHAM,NC,"27705",NOT AVAILABLE,NOT AVAILABLE,STATE,CLOSED,0,DURHAM,"37063",USA,"922140",CORRECTIONAL INSTITUTIONS,"https://www2.ncdps.gov/Index2.cfm?a=000003,002240,002324",11/13/2015,IMAGERY,2017-12-13T00:00:00.000Z,"https://www.ncdps.gov/Index2.cfm?a=000003,002240,002324",MINIMUM,216,0.00497967959683,1.265565556e-06,19401.3515625,605.370203864787,"37","063","001711","37063001711","17.11",Census Tract 17.11,G5020,S,3925302,23975,"+36.0589447","-078.9315016",NC,-78.9259919270464,36.0657536626681,,"1"
1164,1152,"10001756",GUILFORD CORRECTIONAL CENTER,4250 CAMP BURTON RD,MCLEANSVILLE,NC,"27301",NOT AVAILABLE,NOT AVAILABLE,STATE,CLOSED,0,GUILFORD,"37081",USA,"922140",CORRECTIONAL INSTITUTIONS,"https://www2.ncdps.gov/Index2.cfm?a=000003,002240,002324",11/13/2015,IMAGERY,2017-12-13T00:00:00.000Z,"https://www.ncdps.gov/Index2.cfm?a=000003,002240,002324",MINIMUM,-999,0.00451307532078,1.060173339e-06,16263.09375,561.728894033127,"37","081","015402","37081015402","154.02",Census Tract 154.02,G5020,S,36621641,383501,"+36.1238624","-079.7037658",NC,-79.7014261171699,36.1162326509936,,"1"
1165,1153,"10004225",MCCAIN CORRECTIONAL HOSPITAL,855 OLD HWY 211,RAEFORD,NC,"28376",NOT AVAILABLE,NOT AVAILABLE,STATE,CLOSED,0,HOKE,"37093",USA,"922140",CORRECTIONAL INSTITUTIONS,"https://www2.ncdps.gov/Index2.cfm?a=000003,002240,002324",11/13/2015,IMAGERY,2017-12-13T00:00:00.000Z,"https://www.ncdps.gov/Index2.cfm?a=000003,002240,002324",MINIMUM,411,0.0094821123721,1.893441925e-06,28664.7109375,1162.95279458409,"37","093","970201","37093970201","9702.01",Census Tract 9702.01,G5020,S,136000735,376827,"+35.0376466","-079.3534211",NC,-79.3460994044016,35.0597282645899,,"2"
1166,1154,"10004035",METROPOLITAN TRANSITION CENTER,954 FORREST ST,BALTIMORE,MD,"21202",NOT AVAILABLE,(410) 230-1452,STATE,OPEN,202,BALTIMORE CITY,"24510",USA,"922140",CORRECTIONAL INSTITUTIONS,http://dpscs.maryland.gov/publicinfo/publications/annuals.shtml#doc,6/30/2016,IMAGERY/OTHER,2017-12-05T00:00:00.000Z,http://www.dpscs.maryland.gov/locations/prisons.shtml,MINIMUM,580,0.00869568915224,3.294955868e-06,52764.4296875,1105.73608828113,"24","510","100300","24510100300","1003",Census Tract 1003,G5020,S,156309,0,"+39.2995112","-076.6091250",MD,-76.6085661424695,39.3000616247293,,"7"
1167,1155,"10001558",BROCKBRIDGE CORRECTIONAL FACILITY,7930 BROCK BRIDGE RD,JESSUP,MD,"20794",NOT AVAILABLE,(410) 799-1363,STATE,OPEN,660,ANNE ARUNDEL,"24003",USA,"922140",CORRECTIONAL INSTITUTIONS,http://dpscs.maryland.gov/publicinfo/publications/annuals.shtml#doc,6/30/2016,IMAGERY,2017-12-05T00:00:00.000Z,http://www.dpscs.maryland.gov/locations/prisons.shtml,MINIMUM,536,0.00760585842012,3.766273891e-06,60170.5078125,989.515618967046,"24","003","740400","24003740400","7404",Census Tract 7404,G5020,S,2705357,0,"+39.1354606","-076.7778306",MD,-76.774637592225,39.1351931872676,,"8"
1168,1156,"10002362",BALTIMORE PRE-RELEASE UNIT FOR WOMEN,301 N CALVERTON RD,BALTIMORE,MD,"21223",NOT AVAILABLE,NOT AVAILABLE,STATE,CLOSED,0,BALTIMORE CITY,"24510",USA,"922140",CORRECTIONAL INSTITUTIONS,http://www.dpscs.maryland.gov/locations/prisons.shtml,12/5/2017,IMAGERY,2017-12-05T00:00:00.000Z,NOT AVAILABLE,MINIMUM,144,0.00306320686412,4.10825173e-07,6578.13671875,385.483861320951,"24","510","200200","24510200200","2002",Census Tract 2002,G5020,S,925146,0,"+39.2908648","-076.6588372",MD,-76.6599746726596,39.2927365442858,,"1"
1169,1157,"10004223",EVERGREEN REHABILITATION CENTER,20513 US HWY 301N,ST. PAUL'S,NC,"28384",NOT AVAILABLE,NOT AVAILABLE,STATE,CLOSED,0,ROBESON,"37155",USA,"922140",CORRECTIONAL INSTITUTIONS,http://www.corrections.com/news/article/29031-nc-division-of-prisons-sets-closing-dates-at-four-prisons,8/9/2011,IMAGERY,2017-12-13T00:00:00.000Z,http://evergreenrehabilitationcenter.org/,NOT AVAILABLE,-999,0.00584080321972,2.077952244e-06,31376.54296875,720.50529130017,"37","155","960102","37155960102","9601.02",Census Tract 9601.02,G5020,S,83098606,178386,"+34.8178866","-079.0088383",NC,-78.9807109009417,34.8472675850384,"1","1"
1170,1158,"10005520",SAMARKAND YOUTH DEVELOPMENT CENTER,3600 SAMARKAND ROAD,EAGLE SPRINGS,NC,"27242",NOT AVAILABLE,NOT AVAILABLE,STATE,CLOSED,0,MOORE,"37125",USA,"922140",CORRECTIONAL INSTITUTIONS,"http://www.juvjus.state.nc.us/facilities/youth_development_centers.html, http://wmtgradio.wordpress.com/2013/07/31/samarkand-campus-to-be-used-as-law-enforcement-training-center/",11/13/2015,IMAGERY,2017-12-13T00:00:00.000Z,NOT AVAILABLE,JUVENILE,70,0.0291329327103,3.6673389096e-05,556552.171875,3643.33296265727,"37","125","950302","37125950302","9503.02",Census Tract 9503.02,G5020,S,164327118,3917938,"+35.2244145","-079.5967386",NC,-79.6946601175534,35.258196310739,,"1"
1171,1159,"10001022",NORTH CAROLINA CORRECTIONAL INSTITUTION FOR WOMEN - MINIMUM,1201 S STATE ST,RALEIGH,NC,"27610",NOT AVAILABLE,(919) 733-4340,STATE,OPEN,-999,WAKE,"37183",USA,"922140",CORRECTIONAL INSTITUTIONS,"https://www.ncdps.gov/Adult-Corrections/Prisons/Prison-Facilities, https://www2.ncdps.gov/Index2.cfm?a=000003,002240,002324",12/13/2017,IMAGERY,2017-12-13T00:00:00.000Z,https://www.ncdps.gov/Adult-Corrections/Prisons/Prison-Facilities,MINIMUM,-999,0.00518844488198,1.059794392e-06,16184.97265625,661.807191584825,"37","183","050800","37183050800","508",Census Tract 508,G5020,S,2216937,10158,"+35.7644588","-078.6256548",NC,-78.6239037506701,35.7639443799419,"1","3"
1172,1160,"10001781",WAYNE CORRECTIONAL CENTER,700 STEVENS MILL RD,GOLDSBORO,NC,"27530",NOT AVAILABLE,NOT AVAILABLE,STATE,CLOSED,0,WAYNE,"37191",USA,"922140",CORRECTIONAL INSTITUTIONS,"https://www2.ncdps.gov/Index2.cfm?a=000003,002240,002324",11/13/2015,IMAGERY,2017-12-13T00:00:00.000Z,"https://www.ncdps.gov/Index2.cfm?a=000003,002240,002324",MEDIUM,428,0.00680013212269,2.827714326e-06,42980.515625,830.109773539221,"37","191","001101","37191001101","11.01",Census Tract 11.01,G5020,S,95956843,781079,"+35.4098402","-078.0995289",NC,-78.0349884785441,35.3850435819051,,"2"
1173,1161,"10005031",OXFORD COUNTY HOLDING FACILITY,26 WESTERN AVENUE,SOUTH PARIS,ME,"04281",NOT AVAILABLE,(207) 743-9554,COUNTY,NOT AVAILABLE,10,OXFORD,"23017",USA,"922140",CORRECTIONAL INSTITUTIONS,NOT AVAILABLE,NOT AVAILABLE,IMAGERY/OTHER,2018-03-20T00:00:00.000Z,NOT AVAILABLE,MINIMUM,-999,0.00167528073493,1.42775083e-07,2468.80859375,215.874600516649,"23","017","966200","23017966200","9662",Census Tract 9662,G5020,S,105603388,511305,"+44.2480012","-070.4908157",ME,-70.519052825447,44.221508940785,"1","1"
1174,1162,"10004179",WESTERN YOUTH INSTITUTION,5155 WESTERN AVE,MORGANTON,NC,"28655",NOT AVAILABLE,NOT AVAILABLE,STATE,CLOSED,0,BURKE,"37023",USA,"922140",CORRECTIONAL INSTITUTIONS,"https://www2.ncdps.gov/Index2.cfm?a=000003,002240,002324",11/13/2015,IMAGERY,2017-12-13T00:00:00.000Z,"https://www.ncdps.gov/Index2.cfm?a=000003,002240,002324",JUVENILE,785,0.0110546684524,6.728069328e-06,102640.85546875,1354.34331142127,"37","023","021301","37023021301","213.01",Census Tract 213.01,G5020,S,41597597,0,"+35.6808305","-081.6823365",NC,-81.6823144079709,35.6793393911802,,"3"
1175,1163,"10002359",CENTRAL MARYLAND CORRECTIONAL FACILITY,7301 BUTTERCUP RD,SYKESVILLE,MD,"21784",NOT AVAILABLE,(410) 781-4444,STATE,OPEN,497,CARROLL,"24013",USA,"922140",CORRECTIONAL INSTITUTIONS,http://dpscs.maryland.gov/publicinfo/publications/annuals.shtml#doc,6/30/2016,IMAGERY,2017-12-05T00:00:00.000Z,http://www.dpscs.maryland.gov/locations/prisons.shtml,MINIMUM,475,0.0103624053661,5.658596542e-06,90709.03125,1291.54463765769,"24","013","505203","24013505203","5052.03",Census Tract 5052.03,G5020,S,7058920,14506,"+39.3851259","-076.9492567",MD,-76.9556899414847,39.3725144999526,,"1"
1176,1164,"10001293",EDNA TAMAYO HOUSE,1438 N 77TH SUNSHINE STRIP,HARLINGEN,TX,"78550",NOT AVAILABLE,(956) 425-6567,STATE,OPEN,21,CAMERON,"48061",USA,"922140",CORRECTIONAL INSTITUTIONS,http://www.tjjd.texas.gov/programs/prea.aspx,5/11/2017,IMAGERY,2018-01-12T00:00:00.000Z,http://www.tjjd.texas.gov/programs/facilities_list.aspx,JUVENILE,24,0.00114108085993,6.8917846e-08,951.88671875,131.730085715027,"48","061","010601","48061010601","106.01",Census Tract 106.01,G5020,S,5841161,31874,"+26.2195655","-097.7016770",TX,-97.6927245479435,26.2074510785646,,"1"
1177,1165,"10002364",PATUXENT INSTITUTION,7555 WATERLOO RD,JESSUP,MD,"20794",NOT AVAILABLE,(410) 799-3400,STATE,OPEN,915,HOWARD,"24027",USA,"922140",CORRECTIONAL INSTITUTIONS,"http://dpscs.maryland.gov/publicinfo/publications/annuals.shtml#doc, http://dpscs.maryland.gov/publicinfo/publications/pdfs/pax_annual_report_2013.pdf",4/1/2014,IMAGERY/OTHER,2017-12-05T00:00:00.000Z,http://www.dpscs.maryland.gov/locations/prisons.shtml,MAXIMUM,1113,0.0152773995656,1.285279735e-05,205423.94140625,1871.31218509452,"24","027","601203","24027601203","6012.03",Census Tract 6012.03,G5020,S,8891346,4381,"+39.1784051","-076.7637098",MD,-76.7780723029179,39.1646364566185,,"2"
1178,1166,"10001554",DISMAS HOUSE - EAST,1415 N CAROLINE ST,BALTIMORE,MD,"21213",NOT AVAILABLE,NOT AVAILABLE,STATE,CLOSED,0,BALTIMORE CITY,"24510",USA,"922140",CORRECTIONAL INSTITUTIONS,http://www.dpscs.maryland.gov/locations/prisons.shtml,4/1/2014,IMAGERY,2017-12-05T00:00:00.000Z,NOT AVAILABLE,MINIMUM,45,0.00187880037667,1.70376496e-07,2728.62109375,231.545769517697,"24","510","080700","24510080700","807",Census Tract 807,G5020,S,298756,0,"+39.3070324","-076.5932887",MD,-76.5977948685554,39.3069251756833,,"1"
1179,1167,"10001551",DISMAS HOUSE - WEST,105 S MOUNT ST,BALTIMORE,MD,"21223",NOT AVAILABLE,NOT AVAILABLE,STATE,CLOSED,0,BALTIMORE CITY,"24510",USA,"922140",CORRECTIONAL INSTITUTIONS,http://www.dpscs.maryland.gov/locations/prisons.shtml,4/1/2014,IMAGERY,2017-12-05T00:00:00.000Z,NOT AVAILABLE,NOT AVAILABLE,-999,0.00193434913305,1.88117421e-07,3011.859375,241.025283743743,"24","510","190300","24510190300","1903",Census Tract 1903,G5020,S,375717,0,"+39.2839729","-076.6444254",MD,-76.6432804289606,39.2860554049244,,"1"
1180,1168,"10006353",DORSEY RUN CORRECTIONAL FACILITY,2020 TOULSON ROAD,JESSUP,MD,"20794",NOT AVAILABLE,(410) 379-6020,STATE,OPEN,553,ANNE ARUNDEL,"24003",USA,"922140",CORRECTIONAL INSTITUTIONS,http://dpscs.maryland.gov/publicinfo/publications/annuals.shtml#doc,6/30/2016,IMAGERY,2017-12-05T00:00:00.000Z,http://www.dpscs.maryland.gov/locations/prisons.shtml,MINIMUM,480,0.0056901141273,1.682507289e-06,26881.43359375,712.768250893414,"24","003","740400","24003740400","7404",Census Tract 7404,G5020,S,2705357,0,"+39.1354606","-076.7778306",MD,-76.7769733357037,39.1390625129442,,"8"
1181,1169,"10002803",SCHAEFFER HALFWAY HOUSE,12451 GARMENT RD,EL PASO,TX,"79938",NOT AVAILABLE,(915) 856-9324,STATE,OPEN,17,EL PASO,"48141",USA,"922140",CORRECTIONAL INSTITUTIONS,http://www.tjjd.texas.gov/programs/prea.aspx,2/3/2015,IMAGERY,2018-01-12T00:00:00.000Z,http://www.tjjd.texas.gov/programs/facilities_list.aspx,JUVENILE,24,0.00212438200003,2.04461708e-07,2981.5546875,258.097092435695,"48","141","010339","48141010339","103.39",Census Tract 103.39,G5020,S,47351243,0,"+31.8261423","-106.2555180",TX,-106.258081061463,31.8109624388423,,"3"
1182,1170,"10001261",WILLOUGHBY HOUSE,8100 W ELIZABETH LN,FORT WORTH,TX,"76116",NOT AVAILABLE,(817) 244-4992,STATE,OPEN,12,TARRANT,"48439",USA,"922140",CORRECTIONAL INSTITUTIONS,http://www.tjjd.texas.gov/programs/prea.aspx,2/4/2016,IMAGERY,2018-01-12T00:00:00.000Z,http://www.tjjd.texas.gov/programs/facilities_list.aspx,JUVENILE,20,0.00152589074611,1.087174e-07,1601.41796875,187.447138314934,"48","439","105201","48439105201","1052.01",Census Tract 1052.01,G5020,S,2286690,0,"+32.7309752","-097.4585258",TX,-97.4554265054057,32.7251485492872,,"1"
1183,1171,"10001255",MCFADDEN RANCH,3505 N HAYNES RD,ROANOKE,TX,"76262",NOT AVAILABLE,(817) 491-9387,STATE,OPEN,47,DENTON,"48121",USA,"922140",CORRECTIONAL INSTITUTIONS,http://www.tjjd.texas.gov/programs/prea.aspx,6/7/2017,IMAGERY,2018-01-12T00:00:00.000Z,http://www.tjjd.texas.gov/programs/facilities_list.aspx,JUVENILE,48,0.00326525710246,5.16761991e-07,7638.63671875,391.840982787087,"48","121","020307","48121020307","203.07",Census Tract 203.07,G5020,S,45514047,2917797,"+33.0314845","-097.2088044",TX,-97.1951446884075,33.0353743943927,,"1"
1184,1172,"10002824",CROCKETT STATE SCHOOL,1701 SW LOOP 304,CROCKETT,TX,"75835",NOT AVAILABLE,NOT AVAILABLE,STATE,CLOSED,0,HOUSTON,"48225",USA,"922140",CORRECTIONAL INSTITUTIONS,"http://www.ktre.com/story/24536064/regional-juvenile-facility-moving-to-old-crockett-state-school-building, http://messenger-news.com/2017/09/23/strike-three/",9/23/2017,IMAGERY,2018-01-12T00:00:00.000Z,NOT AVAILABLE,JUVENILE,-999,0.0132043606257,1.0848128652e-05,157323.6640625,1573.61845534526,"48","225","950500","48225950500","9505",Census Tract 9505,G5020,S,704339883,4626367,"+31.3085512","-095.3712626",TX,-95.4714912356371,31.2974332064697,,"1"
1185,1173,"10005732",TYC CORSICANA RESIDENTIAL TREATMENT CENTER,4000 WEST 2ND AVENUE,CORSICANA,TX,"75110",NOT AVAILABLE,NOT AVAILABLE,STATE,CLOSED,0,NAVARRO,"48349",USA,"922140",CORRECTIONAL INSTITUTIONS,"http://www.tyc.state.tx.us/programs/corsicana/index.html#history, http://www.publicintegrity.org/2014/02/12/14227/closing-troubled-symbol-texas-juvenile-justice",2/12/2014,IMAGERY/OTHER,2018-01-12T00:00:00.000Z,NOT AVAILABLE,JUVENILE,-999,0.0168450137785,1.5537871638e-05,227235.6875,1993.71538965368,"48","349","970300","48349970300","9703",Census Tract 9703,G5020,S,232357395,2294799,"+32.1057703","-096.5876216",TX,-96.511567143197,32.0764805028319,,"1"
1186,1174,"10001970",NORTH TEXAS INTERMEDIATE SANCTION FACILITY,4700 BLUE MOUND RD,FORT WORTH,TX,"76106",NOT AVAILABLE,NOT AVAILABLE,STATE,CLOSED,0,TARRANT,"48439",USA,"922140",CORRECTIONAL INSTITUTIONS,http://www.texasprisonbidness.org/facility/north-texas-intermediate-sanction-facility-closed,1/12/2018,IMAGERY,2018-01-12T00:00:00.000Z,http://www.tdcj.state.tx.us/divisions/pf/pf_unit_list.html#intermediate,MINIMUM,424,0.0120840271187,5.119209955e-06,75492.10546875,1433.50639693942,"48","439","105001","48439105001","1050.01",Census Tract 1050.01,G5020,S,6636976,18923,"+32.8278790","-097.3435243",TX,-97.3402648937071,32.8262683779136,,"1"
1187,1175,"10001569",EASTERN CORRECTIONAL INSTITUTION,30420 REVELLS NECK RD,WESTOVER,MD,"21890",NOT AVAILABLE,(410) 845-4000,STATE,OPEN,2604,SOMERSET,"24039",USA,"922140",CORRECTIONAL INSTITUTIONS,http://dpscs.maryland.gov/publicinfo/publications/annuals.shtml#doc,6/30/2016,IMAGERY/OTHER,2017-12-05T00:00:00.000Z,http://www.dpscs.maryland.gov/locations/prisons.shtml,MEDIUM,3310,0.0194442149951,2.1485763663e-05,338607.30078125,2381.35582953217,"24","039","980400","24039980400","9804",Census Tract 9804,G5020,S,16063293,238214,"+38.1416567","-075.6915888",MD,-75.7044004804211,38.1573851852169,,"3"
1188,1176,"10001288",HECTOR GARZA CENTER,620 E. AFTON OAKS BLVD,SAN ANTONIO,TX,"78232",NOT AVAILABLE,(210) 568-8600,STATE,OPEN,-999,BEXAR,"48029",USA,"922140",CORRECTIONAL INSTITUTIONS,https://www.geogroup.com/Locations,1/12/2018,IMAGERY,2018-01-12T00:00:00.000Z,https://www.geogroup.com/Locations,JUVENILE,139,0.00259410001488,4.61126059e-07,6572.40625,308.340698061413,"48","029","191702","48029191702","1917.02",Census Tract 1917.02,G5020,S,8096293,17128,"+29.5980050","-098.4944432",TX,-98.4827781970748,29.6068322454258,,"1"
1189,1177,"10001570",EASTERN CORRECTIONAL INSTITUTION - ANNEX,30420 REVELLS NECK RD,WESTOVER,MD,"21890",NOT AVAILABLE,(410) 845-4000,STATE,OPEN,597,SOMERSET,"24039",USA,"922140",CORRECTIONAL INSTITUTIONS,http://dpscs.maryland.gov/publicinfo/publications/annuals.shtml#doc,6/30/2016,IMAGERY/OTHER,2017-12-05T00:00:00.000Z,http://www.dpscs.maryland.gov/locations/prisons.shtml,MINIMUM,608,0.0112994478228,6.772631021e-06,106733.515625,1442.14663099222,"24","039","980400","24039980400","9804",Census Tract 9804,G5020,S,16063293,238214,"+38.1416567","-075.6915888",MD,-75.6952517591208,38.1570986145147,,"3"
1190,1178,"10002740",WEST TEXAS INTERMEDIATE SANCTION FACILITY,2002 LAMESA HWY,BROWNFIELD,TX,"79316",NOT AVAILABLE,(806) 637-4032,STATE,CLOSED,0,TERRY,"48445",USA,"922140",CORRECTIONAL INSTITUTIONS,http://amarillo.com/local-news/news/2017-06-02/brownfield-lose-250k-plus-annually-state-prison-closes-today,6/2/2017,IMAGERY,2018-01-12T00:00:00.000Z,http://tdcj.state.tx.us/unit_directory/xn.html,NOT AVAILABLE,275,0.00477169542487,1.1811438e-06,17483.84765625,580.975742149727,"48","445","950300","48445950300","9503",Census Tract 9503,G5020,S,15930625,15523,"+33.1772301","-102.2901075",TX,-102.284175949082,33.1586198232398,,"2"
1191,1179,"10002869",KEGANS STATE JAIL,707 TOP ST,HOUSTON,TX,"77002",NOT AVAILABLE,(713) 224-6584,STATE,NOT AVAILABLE,0,HARRIS,"48201",USA,"922140",CORRECTIONAL INSTITUTIONS,"https://www.texastribune.org/library/data/texas-prisons/units/kegans/, http://www.tdcj.state.tx.us/unit_directory/index.html",9/15/2016,IMAGERY,2018-01-12T00:00:00.000Z,http://www.tdcj.state.tx.us/unit_directory/index.html,MEDIUM,667,0.00295495286874,5.43153201e-07,7753.6640625,352.249479743823,"48","201","210100","48201210100","2101",Census Tract 2101,G5020,S,662528,36430,"+29.7663846","-095.3513042",TX,-95.3556694539066,29.764217135512,,"5"
1192,1180,"10006586",CENTRAL REGIONAL HOSPITAL,300 VEAZEY ROAD,BUTNER,NC,"27509",NOT AVAILABLE,(919) 764-2000,STATE,OPEN,-999,GRANVILLE,"37077",USA,"922140",CORRECTIONAL INSTITUTIONS,https://files.nc.gov/ncdhhs/CRH%20Treatment%20Units_0.pdf,12/13/2017,IMAGERY,2017-12-13T00:00:00.000Z,https://www.ncdhhs.gov/divisions/dsohf/facilities,NOT AVAILABLE,76,0.00913328596859,4.429818972e-06,67979.5390625,1127.29069188749,"37","077","970703","37077970703","9707.03",Census Tract 9707.03,G5020,S,27835002,2971324,"+36.1209084","-078.7724734",NC,-78.7722101297397,36.1460838920145,,"3"
1193,1181,"10002238",MONTEZUMA COUNTY DETENTION CENTER,730 EAST DRISCOLL STREET,CORTEZ,CO,"81321",NOT AVAILABLE,(970) 564-4979,COUNTY,OPEN,-999,MONTEZUMA,"08083",USA,"922140",CORRECTIONAL INSTITUTIONS,http://www.montezumasheriff.org/departments-contacts/,2/20/2018,IMAGERY,2018-02-20T00:00:00.000Z,http://www.montezumasheriff.org/departments-contacts/,NOT AVAILABLE,104,0.00336756648228,4.14280091e-07,6458.828125,420.531448243444,"08","083","969300","08083969300","9693",Census Tract 9693,G5020,S,41739017,61341,"+37.3779662","-108.5815318",CO,-108.575957842321,37.3593234459581,"3","1"
1194,1182,"10005028",PISCATAQUIS COUNTY JAIL,52 COURT STREET,DOVER-FOXCROFT,ME,"04426",NOT AVAILABLE,(207) 564-3304,COUNTY,OPEN,26,PISCATAQUIS,"23021",USA,"922140",CORRECTIONAL INSTITUTIONS,https://www.piscataquis.us/sheriff-s-office,3/20/2018,IMAGERY/OTHER,2018-03-20T00:00:00.000Z,https://www.piscataquis.us/sheriff-s-office,NOT AVAILABLE,-999,0.00436861943911,3.46912143e-07,6099.10546875,582.416685191492,"23","021","960700","23021960700","9607",Census Tract 9607,G5020,S,175617646,8732271,"+45.1780248","-069.1926964",ME,-69.2241418887378,45.1828186724008,"6","1"
1195,1183,"10005824",SUSSEX COUNTY JUVENILE DETENTION CENTER,135 MORRIS TURNPIKE,NEWTON,NJ,"07860",NOT AVAILABLE,NOT AVAILABLE,COUNTY,CLOSED,0,SUSSEX,"34037",USA,"922140",CORRECTIONAL INSTITUTIONS,"http://www.sussex.nj.us/Cit-e-Access/webpage.cfm?TID=7&TPID=6594, http://www.nj.gov/lps/jjc/2011-AnnualDetentionStatisticsReport.pdf",2/15/2016,IMAGERY,2018-04-06T00:00:00.000Z,NOT AVAILABLE,JUVENILE,-999,0.0031155801435,5.78786283e-07,9522.04296875,393.985336245968,"34","037","372300","34037372300","3723",Census Tract 3723,G5020,S,67560338,313298,"+41.1600507","-074.7173880",NJ,-74.7578595887602,41.1286139739481,,"1"
1196,1184,"10000048",WYOMING COUNTY JAIL,P O BOX 529,PINEVILLE,WV,"24874",NOT AVAILABLE,NOT AVAILABLE,COUNTY,NOT AVAILABLE,-999,WYOMING,"54109",USA,"922140",CORRECTIONAL INSTITUTIONS,"http://www.wyomingcounty.wv.gov/elected_officials/sheriff/Pages/default.aspx, http://en.wikipedia.org/wiki/Wyoming_County_Courthouse_and_Jail",3/4/2016,IMAGERY,2018-05-10T00:00:00.000Z,NOT AVAILABLE,NOT AVAILABLE,-999,0.00143807193168,1.13129222e-07,1769.04296875,176.824165544608,"54","109","003100","54109003100","31",Census Tract 31,G5020,S,319936573,1318724,"+37.5517187","-081.5793264",WV,-81.538027305302,37.5839521817153,,"1"
1197,1185,"10006504",MONTROSE COUNTY JAIL,1200 NORTH GRAND AVE,MONTROSE,CO,"81401",NOT AVAILABLE,NOT AVAILABLE,COUNTY,OPEN,-999,MONTROSE,"08085",USA,"922140",CORRECTIONAL INSTITUTIONS,http://www.co.montrose.co.us/352/Detention-Center,2/20/2018,IMAGERY,2018-02-20T00:00:00.000Z,http://www.co.montrose.co.us/352/Detention-Center,NOT AVAILABLE,-999,0.00338672360986,6.33806109e-07,10034.07421875,432.885798340748,"08","085","966300","08085966300","9663",Census Tract 9663,G5020,S,11421425,0,"+38.4915708","-107.8807735",CO,-107.890290664921,38.4871754819753,"12","1"
1198,1186,"10001556",EASTERN PRE-RELEASE UNIT,700 FLAT IRON SQUARE RD,CHURCH HILL,MD,"21623",NOT AVAILABLE,(410) 810-5400,STATE,OPEN,180,QUEEN ANNE'S,"24035",USA,"922140",CORRECTIONAL INSTITUTIONS,http://dpscs.maryland.gov/publicinfo/publications/annuals.shtml#doc,6/30/2016,IMAGERY,2017-12-05T00:00:00.000Z,http://www.dpscs.maryland.gov/locations/prisons.shtml,MINIMUM,165,0.00463654077262,3.12233168e-07,4986.7578125,554.030067210585,"24","035","810300","24035810300","8103",Census Tract 8103,G5020,S,136456720,4902779,"+39.1409149","-075.9786731",MD,-75.9858928151246,39.1137326924366,,"1"
1199,1187,"10001561",HERMAN L TOULSON CORRECTIONAL FACILITY,2001 TOULSON RD,JESSUP,MD,"20794",NOT AVAILABLE,NOT AVAILABLE,STATE,CLOSED,0,ANNE ARUNDEL,"24003",USA,"922140",CORRECTIONAL INSTITUTIONS,http://www.dpscs.state.md.us/locations/tcf.shtml,4/1/2014,IMAGERY/OTHER,2017-12-05T00:00:00.000Z,NOT AVAILABLE,MINIMUM,384,0.00744519165047,3.574541154e-06,57109.7890625,964.92782496028,"24","003","740400","24003740400","7404",Census Tract 7404,G5020,S,2705357,0,"+39.1354606","-076.7778306",MD,-76.7739977367079,39.1382303787196,,"8"
1200,1188,"10003601",NORTH DAKOTA STATE PENITENTIARY,3100 RAILROAD AVE,BISMARCK,ND,"58506","5521",(701) 328-6100,STATE,OPEN,753,BURLEIGH,"38015",USA,"922140",CORRECTIONAL INSTITUTIONS,"http://www.nd.gov/docr/media/stats.html, http://www.nd.gov/docr/adult/",12/31/2016,IMAGERY,2017-12-13T00:00:00.000Z,http://www.nd.gov/docr/adult/,MAXIMUM,520,0.0146442368747,1.0764524748e-05,194864.8125,1964.34411905541,"38","015","010900","38015010900","109",Census Tract 109,G5020,S,5903294,0,"+46.8158823","-100.7417552",ND,-100.741540475416,46.7999670097596,"1","1"
1201,1189,"10002234",OTERO COUNTY JAIL / SHERIFF,222 EAST 2ND STREET,LA JUNTA,CO,"81050",NOT AVAILABLE,(719) 384-5941,COUNTY,OPEN,-999,OTERO,"08089",USA,"922140",CORRECTIONAL INSTITUTIONS,https://www.oterogov.com/elected-officials/sheriff,2/20/2018,IMAGERY,2018-02-20T00:00:00.000Z,https://www.oterogov.com/elected-officials/sheriff,NOT AVAILABLE,34,0.00116576847952,7.6409643e-08,1201.37109375,148.908758447654,"08","089","968600","08089968600","9686",Census Tract 9686,G5020,S,5083549,71234,"+37.9814479","-103.5400401",CO,-103.539581823196,37.9866967780735,"1","1"
1202,1190,"10001482",RANDOLPH COUNTY JAIL,200 WEST BUENA VISTA STREET,CHESTER,IL,"62233",NOT AVAILABLE,(618) 826-5484,COUNTY,OPEN,23,RANDOLPH,"17157",USA,"922140",CORRECTIONAL INSTITUTIONS,"http://am.randolphco.org/index.php/gov-menu/electedofficials/2015-12-04-01-54-52, http://www.ilsheriff.org/index.php/directory",3/2/2018,IMAGERY,2018-03-02T00:00:00.000Z,http://am.randolphco.org/index.php/gov-menu/electedofficials/2015-12-04-01-54-52,NOT AVAILABLE,44,0.0016845158274,1.72898424e-07,2715.39453125,208.514044703131,"17","157","951300","17157951300","9513",Census Tract 9513,G5020,S,28735963,11060957,"+37.8637548","-089.7737805",IL,-89.8282439484707,37.9037224364872,,"1"
1203,1191,"10000590",PUEBLO COUNTY DETENTION CENTER,909 COURT ST,PUEBLO,CO,"81003",NOT AVAILABLE,(719) 583-6125,COUNTY,OPEN,545,PUEBLO,"08101",USA,"922140",CORRECTIONAL INSTITUTIONS,https://www.sheriff.co.pueblo.co.us/index.html,2/20/2018,IMAGERY,2018-02-20T00:00:00.000Z,https://www.sheriff.co.pueblo.co.us/index.html,MAXIMUM,780,0.00376193343711,7.49641922e-07,11833.203125,474.158095272118,"08","101","003500","08101003500","35",Census Tract 35,G5020,S,4999062,337903,"+38.2663099","-104.6083782",CO,-104.610769538636,38.2752510039739,"3","1"
1204,1192,"10003631",SOMERSET COUNTY JAIL,131 E MADISON RD,MADISON,ME,"04950",NOT AVAILABLE,(207) 474-7409,COUNTY,OPEN,165,SOMERSET,"23025",USA,"922140",CORRECTIONAL INSTITUTIONS,http://www.somersetcounty-me.org/somerset-county-jail.html#!slide_09,3/20/2018,IMAGERY,2018-03-20T00:00:00.000Z,http://www.somersetcounty-me.org/somerset-county-jail.html#!slide_09,MEDIUM,234,0.00626476385597,1.997150928e-06,34873.921875,836.220192204438,"23","025","966500","23025966500","9665",Census Tract 9665,G5020,S,134378091,7613725,"+44.8263541","-069.7997127",ME,-69.7262223573239,44.7924446599052,"1","1"
1205,1193,"10006665",JACK HARWELL DETENTION CENTER,3101 MARLIN HWY,WACO,TX,"76705",NOT AVAILABLE,(254) 759-5900,MULTI,OPEN,-999,MCLENNAN,"48309",USA,"922140",CORRECTIONAL INSTITUTIONS,http://www.lasallecorrections.com/our-locations-table/,1/12/2018,IMAGERY,2018-01-12T00:00:00.000Z,http://www.lasallecorrections.com/our-locations-table/,MAXIMUM,816,0.00649772856247,2.44541374e-06,35559.65234375,785.142370451025,"48","309","001800","48309001800","18",Census Tract 18,G5020,S,34754003,1373795,"+31.5515506","-097.0490627",TX,-97.0813132481585,31.5491567500422,,"2"
1206,1194,"10002212",PARK COUNTY JAIL / SHERIFF,1180 COUNTY ROAD 16,FAIRPLAY,CO,"80440",NOT AVAILABLE,(719) 836-4373,COUNTY,OPEN,-999,PARK,"08093",USA,"922140",CORRECTIONAL INSTITUTIONS,http://www.parkco.us/88/Sheriffs-Office,2/20/2018,IMAGERY,2018-02-20T00:00:00.000Z,http://www.parkco.us/88/Sheriffs-Office,NOT AVAILABLE,-999,0.00364800018969,7.19161494e-07,11503.87890625,451.716523782048,"08","093","000300","08093000300","3",Census Tract 3,G5020,S,282700248,1212542,"+39.2621420","-106.0641967",CO,-105.988908137206,39.2236135707697,"1","1"
1207,1195,"10001876",CENTRAL REGIONAL JAIL,1255 DYER HILL RD,SUTTON,WV,"26601",NOT AVAILABLE,(304) 765-7904,COUNTY,OPEN,310,BRAXTON,"54007",USA,"922140",CORRECTIONAL INSTITUTIONS,http://rja.wv.gov/Pages/About-Us.aspx,1/22/2018,IMAGERY/OTHER,2018-01-22T00:00:00.000Z,http://rja.wv.gov/facilityinfo/Pages/default.aspx,NOT AVAILABLE,200,0.00577462630518,2.135087719e-06,33900.6875,729.678230957049,"54","007","967900","54007967900","9679",Census Tract 9679,G5020,S,570900559,6471528,"+38.7602528","-080.5620615",WV,-80.6567633182697,38.6974484556243,,"1"
1208,1196,"10006864",CLAY COUNTY JAIL,215 WEST GILBERT STREET,HENRIETTA,TX,"76365",NOT AVAILABLE,NOT AVAILABLE,COUNTY,OPEN,22,CLAY,"48077",USA,"922140",CORRECTIONAL INSTITUTIONS,"https://www.sheriff.co.clay.tx.us/, https://www.tcjs.state.tx.us/index.php?linkID=325",3/1/2018,IMAGERY,2018-04-26T00:00:00.000Z,https://www.sheriff.co.clay.tx.us/,NOT AVAILABLE,38,0.00154273634668,1.19170052e-07,1777.4296875,189.468236733613,"48","077","030200","48077030200","302",Census Tract 302,G5020,S,39347950,595974,"+33.8275374","-098.1839936",TX,-98.1971185250563,33.8153716051528,,"1"
1209,1197,"10000009",EASTERN REGIONAL JAIL,94 GRAPEVINE ROAD,MARTINSBURG,WV,"25405",NOT AVAILABLE,(304) 267-0046,COUNTY,OPEN,392,BERKELEY,"54003",USA,"922140",CORRECTIONAL INSTITUTIONS,http://rja.wv.gov/Pages/About-Us.aspx,1/22/2018,IMAGERY,2018-01-22T00:00:00.000Z,http://rja.wv.gov/facilityinfo/Pages/default.aspx,NOT AVAILABLE,500,0.00716535565828,1.98605405e-06,31865.93359375,900.811636446702,"54","003","972000","54003972000","9720",Census Tract 9720,G5020,S,52668500,0,"+39.4099438","-077.9467129",WV,-77.9559094454654,39.4357670602975,,"2"
1210,1198,"10005831",MARYLAND  HOUSE OF CORRECTION - JESSUP,"P O BOX 549, HOUSE OF CORRECTION RD",JESSUP,MD,"20794",NOT AVAILABLE,NOT AVAILABLE,STATE,CLOSED,0,ANNE ARUNDEL,"24003",USA,"922140",CORRECTIONAL INSTITUTIONS,http://www.washingtonpost.com/wp-dyn/content/article/2007/03/18/AR2007031800137.html,4/1/2014,IMAGERY/OTHER,2017-12-05T00:00:00.000Z,NOT AVAILABLE,MEDIUM,1068,0.00980694467783,4.953743829e-06,79150.96875,1218.8302705397,"24","003","740400","24003740400","7404",Census Tract 7404,G5020,S,2705357,0,"+39.1354606","-076.7778306",MD,-76.7788515034376,39.1434842831089,,"8"
1211,1199,"10001553",CENTRAL HOME DETENTION UNIT,2100 GUILFORD AVE,BALTIMORE,MD,"21218",NOT AVAILABLE,(443) 263-3800,STATE,OPEN,192,BALTIMORE CITY,"24510",USA,"922140",CORRECTIONAL INSTITUTIONS,http://dpscs.maryland.gov/publicinfo/publications/annuals.shtml#doc,6/30/2016,IMAGERY,2017-12-05T00:00:00.000Z,http://www.dpscs.maryland.gov/locations/prisons.shtml,NOT AVAILABLE,-999,0.00271532248938,3.19275237e-07,5113.7890625,352.906585583186,"24","510","120400","24510120400","1204",Census Tract 1204,G5020,S,281026,0,"+39.3138354","-076.6123840",MD,-76.6129747003945,39.313890594934,,"1"
1212,1200,"10003607",DAKOTA WOMEN'S CORRECTIONAL AND REHABILITATION CENTER,440 MCKENZIE ST,NEW ENGLAND,ND,"58647",NOT AVAILABLE,(701) 579-5100,STATE,OPEN,113,HETTINGER,"38041",USA,"922140",CORRECTIONAL INSTITUTIONS,"http://www.nd.gov/docr/media/stats.html, http://www.nd.gov/docr/adult/",12/31/2016,IMAGERY,2017-12-13T00:00:00.000Z,http://www.nd.gov/docr/adult/,MINIMUM,126,0.00744382487846,2.189356812e-06,39439.3515625,1088.32880711167,"38","041","964800","38041964800","9648",Census Tract 9648,G5020,S,1520086943,1400395,"+46.4620206","-102.6674440",ND,-102.867200592457,46.5354115787339,,"1"
1213,1605,"10006549",MINNESOTA SECURITY HOSPITAL,100 FREEMAN DRIVE,ST. PETER,MN,"56082","1599",(507) 985-2000,STATE,OPEN,369,NICOLLET,"27103",USA,"922140",CORRECTIONAL INSTITUTIONS,http://www.twincities.com/2017/04/07/big-bucks-needed-to-solve-security-hospital-problems/,4/8/2017,IMAGERY,2017-12-07T00:00:00.000Z,http://www.dhs.state.mn.us/main/idcplg?IdcService=GET_DYNAMIC_CONVERSION&RevisionSelectionMethod=LatestReleased&dDocName=id_000261,NOT AVAILABLE,-999,0.00957226099185,4.042459605e-06,69999.89453125,1237.65593535644,"27","103","480400","27103480400","4804",Census Tract 4804,G5020,S,11811073,212189,"+44.3094034","-093.9817859",MN,-93.9760671769206,44.3048303651076,,"2"
1214,1606,"10006606",SOUTHERN TRANSITIONAL,800A BUFFALO AVENUE,EGG HARBOR,NJ,"08215",NOT AVAILABLE,(609) 965-5200,STATE,OPEN,15,ATLANTIC,"34001",USA,"922140",CORRECTIONAL INSTITUTIONS,http://www.nj.gov/oag/jjc/prea.html,3/10/2016,IMAGERY/OTHER,2017-12-18T00:00:00.000Z,http://www.nj.gov/oag/jjc/residential_community_list.html,JUVENILE,32,0.00286601253136,2.75470921e-07,4426.30859375,359.432406817757,"34","001","010600","34001010600","106",Census Tract 106,G5020,S,28103807,1477247,"+39.5636873","-074.5958654",NJ,-74.6332935009006,39.5366895521592,,"2"
1215,1209,"10002617",CENTRAL UTAH CORRECTIONAL FACILITY,255 E 300 N ST,GUNNISON,UT,"84634",NOT AVAILABLE,(435) 528-6000,STATE,OPEN,1700,SANPETE,"49039",USA,"922140",CORRECTIONAL INSTITUTIONS,"https://crbiprod.utah.gov/cognos10/cgi-bin/cognos.cgi?b_action=xts.run&m=portal/cc.xts&gohome=, https://corrections.utah.gov/",1/17/2018,IMAGERY,2018-01-17T00:00:00.000Z,https://corrections.utah.gov/,MAXIMUM,1600,0.025579986517,2.7689899069e-05,442572.7265625,3190.70188373403,"49","039","972300","49039972300","9723",Census Tract 9723,G5020,S,943267591,22463203,"+39.2282925","-111.8534084",UT,-111.811498049382,39.1662429720597,,"1"
1216,1607,"10001618",CREMER THERAPEUTIC COMMUNITY CENTER,689 ROUTE O,FULTON,MO,"65251",NOT AVAILABLE,(573) 592-4013,STATE,OPEN,174,CALLAWAY,"29027",USA,"922140",CORRECTIONAL INSTITUTIONS,https://doc.mo.gov/OD/PREA-2015.php,4/14/2015,IMAGERY,2017-12-07T00:00:00.000Z,https://doc.mo.gov/DAI/Institutional_Facilities.php,MINIMUM,180,0.00386513159361,4.95867332e-07,7889.62890625,467.94318422222,"29","027","070300","29027070300","703",Census Tract 703,G5020,S,31216261,443222,"+38.8513012","-091.9235718",MO,-91.9384583277674,38.844986475887,,"9"
1217,1608,"10001598",DEERFIELD WORK CENTER FOR MEN,15172 OLD BELFIELD RD,CAPRON,VA,"23829",NOT AVAILABLE,(434) 658-4368,STATE,OPEN,199,SOUTHAMPTON,"51175",USA,"922140",CORRECTIONAL INSTITUTIONS,https://vadoc.virginia.gov/about/facts/,6/15/2017,IMAGERY,2018-01-19T00:00:00.000Z,https://vadoc.virginia.gov/facilities/,MINIMUM,216,0.00647102558794,2.245381907e-06,34714.65625,791.129497121525,"51","175","200300","51175200300","2003",Census Tract 2003,G5020,S,10719196,84844,"+36.7371266","-077.2510665",VA,-77.2484144955825,36.7235530790968,,"7"
1218,1609,"10003324",DEERFIELD CORRECTIONAL CENTER,21360 DEERFIELD DR,CAPRON,VA,"23829",NOT AVAILABLE,(434) 658-4368,STATE,OPEN,1059,SOUTHAMPTON,"51175",USA,"922140",CORRECTIONAL INSTITUTIONS,https://vadoc.virginia.gov/about/facts/,4/27/2017,IMAGERY,2018-01-19T00:00:00.000Z,https://vadoc.virginia.gov/facilities/,MEDIUM,1080,0.0149153892001,9.343837321e-06,144471.31640625,1779.62693549414,"51","175","200300","51175200300","2003",Census Tract 2003,G5020,S,10719196,84844,"+36.7371266","-077.2510665",VA,-77.2456620291206,36.7295077415658,,"7"
1219,1610,"10003845",JACKSON COUNTY JAIL-WESLEY STREET,212 W WESLEY ST,JACKSON,MI,"49201",NOT AVAILABLE,(517) 768-7900,COUNTY,OPEN,-999,JACKSON,"26075",USA,"922140",CORRECTIONAL INSTITUTIONS,https://www.co.jackson.mi.us/167/Sheriff,3/20/2018,IMAGERY,2018-03-20T00:00:00.000Z,https://www.co.jackson.mi.us/167/Sheriff,NOT AVAILABLE,200,0.00324330437871,4.38607433e-07,7342.171875,399.35007104256,"26","075","000600","26075000600","6",Census Tract 6,G5020,S,911647,2556,"+42.2470057","-084.4073077",MI,-84.4096273362033,42.245018558478,"12","1"
1220,1611,"10002010",NORTHWESTERN MINNESOTA JUVENILE CENTER,1231 5TH STREET NORTHWEST,BEMIDJI,MN,"56601",NOT AVAILABLE,(218) 751-3196,LOCAL,OPEN,58,BELTRAMI,"27007",USA,"922140",CORRECTIONAL INSTITUTIONS,http://www.nmjconline.org/index.php,12/7/2017,IMAGERY,2017-12-07T00:00:00.000Z,http://www.nmjconline.org/index.php,JUVENILE,65,0.00428330361735,9.58085708e-07,17566.16796875,588.552624550052,"27","007","450702","27007450702","4507.02",Census Tract 4507.02,G5020,S,30329141,7556743,"+47.4779490","-094.9009071",MN,-94.9042333766697,47.4774680906573,,"1"
1221,1612,"10001630",POTOSI CORRECTIONAL CENTER,11593 STATE HWY O,MINERAL POINT,MO,"63660",NOT AVAILABLE,(573) 438-6000,STATE,OPEN,-999,WASHINGTON,"29221",USA,"922140",CORRECTIONAL INSTITUTIONS,https://doc.mo.gov/OD/PREA-2015.php,3/26/2015,IMAGERY,2017-12-07T00:00:00.000Z,https://doc.mo.gov/DAI/Institutional_Facilities.php,MAXIMUM,852,0.0154060442101,1.3417198277e-05,210813.140625,1904.17520416844,"29","221","460300","29221460300","4603",Census Tract 4603,G5020,S,30950363,331906,"+37.9357592","-090.7745867",MO,-90.7369268357817,37.9366948036602,"2","2"
1222,1613,"10001608",CROSSROADS CORRECTIONAL CENTER,1115 E PENCE RD,CAMERON,MO,"64429",NOT AVAILABLE,(816) 632-2727,STATE,OPEN,1463,DEKALB,"29063",USA,"922140",CORRECTIONAL INSTITUTIONS,https://doc.mo.gov/OD/PREA-2015.php,1/14/2015,IMAGERY,2017-12-07T00:00:00.000Z,https://doc.mo.gov/DAI/Institutional_Facilities.php,MAXIMUM,1400,0.0133832348558,1.2863391422e-05,207376.62890625,1699.44499913384,"29","063","080100","29063080100","801",Census Tract 801,G5020,S,541711484,5945715,"+39.9123487","-094.3128169",MO,-94.223671166948,39.7657210141641,,"2"
1223,1614,"10004065",EASTERN RECEPTION DIAGNOSTIC / CORRECTIONAL CTR,2727 HWY K,BONNE TERRE,MO,"63628",NOT AVAILABLE,(573) 358-5516,STATE,OPEN,2986,ST. FRANCOIS,"29187",USA,"922140",CORRECTIONAL INSTITUTIONS,https://doc.mo.gov/OD/PREA-2017.php,6/14/2017,IMAGERY,2017-12-07T00:00:00.000Z,https://doc.mo.gov/DAI/Institutional_Facilities.php,MAXIMUM,3100,0.017175539914,1.98818309e-05,312334.61328125,2140.27471513168,"29","187","950300","29187950300","9503",Census Tract 9503,G5020,S,31158248,48697,"+37.9327142","-090.5475823",MO,-90.5146845833307,37.9245330863162,"7","1"
1224,1615,"10001631",FARMINGTON CORRECTIONAL CENTER,1012 W COLUMBIA ST,FARMINGTON,MO,"63640",NOT AVAILABLE,(573) 218-7100,STATE,OPEN,2622,ST. FRANCOIS,"29187",USA,"922140",CORRECTIONAL INSTITUTIONS,https://doc.mo.gov/OD/PREA-2017.php,3/24/2017,IMAGERY,2017-12-07T00:00:00.000Z,https://doc.mo.gov/DAI/Institutional_Facilities.php,MEDIUM,2655,0.0299701131445,4.0064539654e-05,628053.01953125,3673.92159789157,"29","187","950902","29187950902","9509.02",Census Tract 9509.02,G5020,S,7530979,0,"+37.7751996","-090.4322357",MO,-90.4363852546672,37.7669929583832,,"1"
1225,1616,"10001617",FULTON RECEPTION AND DIAGNOSTIC CENTER,1393 HWY O,FULTON,MO,"65251",NOT AVAILABLE,(573) 592-4040,STATE,OPEN,1400,CALLAWAY,"29027",USA,"922140",CORRECTIONAL INSTITUTIONS,https://doc.mo.gov/OD/PREA-2015.php,4/16/2015,IMAGERY,2017-12-07T00:00:00.000Z,https://doc.mo.gov/DAI/Institutional_Facilities.php,MINIMUM,1302,0.0154765813282,1.521848225e-05,242141.05078125,1899.30086839298,"29","027","070300","29027070300","703",Census Tract 703,G5020,S,31216261,443222,"+38.8513012","-091.9235718",MO,-91.9221143064947,38.8459874499843,,"9"
1226,1617,"10001626",JEFFERSON CITY CORRECTIONAL CENTER,8200 NO MORE VICTIMS RD,JEFFERSON CITY,MO,"65101",NOT AVAILABLE,(573) 751-3224,STATE,OPEN,1941,COLE,"29051",USA,"922140",CORRECTIONAL INSTITUTIONS,https://doc.mo.gov/OD/PREA-2017.php,2/28/2017,IMAGERY,2017-12-07T00:00:00.000Z,https://doc.mo.gov/DAI/Institutional_Facilities.php,MAXIMUM,2052,0.0178056781729,1.9235976122e-05,304806.953125,2249.85884601645,"29","051","020198","29051020198","201.98",Census Tract 201.98,G5020,S,98459697,5397372,"+38.5129420","-092.0783234",MO,-92.0469363727961,38.5518771296583,,"2"
1227,1618,"10001606",MARYVILLE TREATMENT CENTER,30227 US HWY 136,MARYVILLE,MO,"64468",NOT AVAILABLE,(660) 582-6542,STATE,OPEN,520,NODAWAY,"29147",USA,"922140",CORRECTIONAL INSTITUTIONS,https://doc.mo.gov/OD/PREA-2015.php,5/7/2015,IMAGERY,2017-12-07T00:00:00.000Z,https://doc.mo.gov/DAI/Institutional_Facilities.php,MINIMUM,525,0.0107362661764,3.959044135e-06,64371.15234375,1344.41702046331,"29","147","470500","29147470500","4705",Census Tract 4705,G5020,S,833691913,786403,"+40.3233480","-094.7426572",MO,-94.814128915527,40.3457412964127,,"1"
1228,1619,"10000941",MOBERLY CORRECTIONAL CENTER,5201 SOUTH MORLEY ST,MOBERLY,MO,"65270",NOT AVAILABLE,(660) 263-3778,STATE,OPEN,1790,RANDOLPH,"29175",USA,"922140",CORRECTIONAL INSTITUTIONS,https://doc.mo.gov/OD/PREA-2015.php,7/16/2015,IMAGERY,2017-12-07T00:00:00.000Z,https://doc.mo.gov/DAI/Institutional_Facilities.php,MEDIUM,1800,0.0210262068407,2.5860183944e-05,414485.2109375,2607.7652706576,"29","175","490600","29175490600","4906",Census Tract 4906,G5020,S,443457790,659113,"+39.3313712","-092.4967373",MO,-92.4405879627373,39.3622745973917,,"1"
1229,1620,"10000942",TIPTON CORRECTIONAL CENTER,619 N OSAGE AVE,TIPTON,MO,"65081",NOT AVAILABLE,(660) 433-2031,STATE,OPEN,1225,MONITEAU,"29135",USA,"922140",CORRECTIONAL INSTITUTIONS,https://doc.mo.gov/OD/PREA-2015.php,7/9/2015,IMAGERY,2017-12-07T00:00:00.000Z,https://doc.mo.gov/DAI/Institutional_Facilities.php,MINIMUM,1222,0.0161447917219,1.3807923475e-05,219149.234375,2111.91863004099,"29","135","385400","29135385400","3854",Census Tract 3854,G5020,S,134739476,436008,"+38.6173820","-092.7783375",MO,-92.7800729168649,38.6675628564653,,"1"
1230,1621,"10000923",DILLWYN CORRECTIONAL CENTER,1522 PRISON RD,DILLWYN,VA,"23936",NOT AVAILABLE,(434) 983-4200,STATE,OPEN,917,BUCKINGHAM,"51029",USA,"922140",CORRECTIONAL INSTITUTIONS,https://vadoc.virginia.gov/about/facts/,9/19/2017,IMAGERY,2018-01-19T00:00:00.000Z,https://vadoc.virginia.gov/facilities/,MEDIUM,933,0.0162639635148,1.7163657916e-05,268361.46875,1996.62764959526,"51","029","930201","51029930201","9302.01",Census Tract 9302.01,G5020,S,248642700,1426405,"+37.5051575","-078.4235283",VA,-78.4705204083207,37.5746224514044,,"2"
1231,1622,"10006721",MONROE COUNTY KEY WEST DETENTION CENTER,5501 COLLEGE ROAD,KEY WEST,FL,"33040",NOT AVAILABLE,NOT AVAILABLE,COUNTY,OPEN,-999,MONROE,"12087",USA,"922140",CORRECTIONAL INSTITUTIONS,https://www.keysso.net/jail/detention_center_index.htm,2/21/2018,IMAGERY,2018-02-21T00:00:00.000Z,https://www.keysso.net/jail/detention_center_index.htm,NOT AVAILABLE,596,0.00536212665631,1.042865164e-06,14210.599609375,630.171642065143,"12","087","971900","12087971900","9719",Census Tract 9719,G5020,S,2657828,3385536,"+24.5772104","-081.7515563",FL,-81.751502566937,24.5764919842998,,"2"
1232,1623,"10005764",NYE COUNTY JAIL - SOUTH AREA COMMAND,1520 E BASIN ROAD,PAHRUMP,NV,"89060",NOT AVAILABLE,(775) 751-7027,COUNTY,OPEN,-999,NYE,"32023",USA,"922140",CORRECTIONAL INSTITUTIONS,http://www.nyecounty.net/109/Sheriff,4/9/2018,IMAGERY,2018-04-09T00:00:00.000Z,http://www.nyecountysheriffsoffice.com/home.html,NOT AVAILABLE,-999,0.00412528587637,6.83297566e-07,10495.76953125,517.552821167379,"32","023","960401","32023960401","9604.01",Census Tract 9604.01,G5020,S,1415466805,385982,"+36.4957124","-116.0157160",NV,-115.986909710144,36.2205215496304,"5","2"
1233,1624,"10002927",JUDGE RICARDO H GARCIA REGIONAL JUVENILE DETENTION CENTER,599 S FM 1329,SAN DIEGO,TX,"78384",NOT AVAILABLE,(361) 279-2040,COUNTY,OPEN,28,DUVAL,"48131",USA,"922140",CORRECTIONAL INSTITUTIONS,"http://www.co.duval.tx.us/default.aspx?name=Juvenile.Facility, http://www.tjjd.texas.gov/publications/other/searchfacilityregistryresults.aspx?SelectedFacilityType=YKSBbGCMUWM=&SelectedSortBy=laExhobORj5ZHimppFKN0Q==&IncludeInactive=bZL7qeN3IjY=",7/29/2016,IMAGERY,2018-04-26T00:00:00.000Z,http://www.co.duval.tx.us/default.aspx?name=Juvenile.Facility,JUVENILE,50,0.00243113341416,3.41217874e-07,4776.3828125,289.532820488891,"48","131","950100","48131950100","9501",Census Tract 9501,G5020,S,880761436,2356507,"+27.8873624","-098.3460839",TX,-98.2541801786039,27.7154829384281,,"3"
1234,1625,"10001612","WESTERN RECEPTION, DIAGNOSTIC / CORRECTIONAL CTR",3401 FARAON ST,ST. JOSEPH,MO,"64506",NOT AVAILABLE,(816) 387-2158,STATE,OPEN,2051,BUCHANAN,"29021",USA,"922140",CORRECTIONAL INSTITUTIONS,https://doc.mo.gov/OD/PREA-2015.php,10/10/2015,IMAGERY,2017-12-07T00:00:00.000Z,https://doc.mo.gov/DAI/Institutional_Facilities.php,MINIMUM,1968,0.0165561908948,1.4110791543e-05,227515.16796875,2018.29210629509,"29","021","000600","29021000600","6",Census Tract 6,G5020,S,5364093,12139,"+39.7829384","-094.8135023",MO,-94.8107934674161,39.7743524884086,,"2"
1235,1626,"10004926",DEARBORN COUNTY LAW ENFORCEMENT CENTER,301 W HIGH ST,LAWRENCEBURG,IN,"47025",NOT AVAILABLE,(812) 537-8700,COUNTY,OPEN,333,DEARBORN,"18029",USA,"922140",CORRECTIONAL INSTITUTIONS,http://www.dearborncountysheriff.org/,3/5/2018,IMAGERY,2018-03-05T00:00:00.000Z,http://www.dearborncountysheriff.org/,NOT AVAILABLE,200,0.00181190636097,2.26362047e-07,3614.125,227.875731974532,"18","029","080300","18029080300","803",Census Tract 803,G5020,S,19085687,1201184,"+39.0974888","-084.8804338",IN,-84.8509715716357,39.0909474635451,,"2"
1236,1627,"10006607",VINELAND PREPARATORY ACADEMY,2000 MAPLE AVENUE,VINELAND,NJ,"08361",NOT AVAILABLE,(856) 696-6624,STATE,OPEN,20,CUMBERLAND,"34011",USA,"922140",CORRECTIONAL INSTITUTIONS,http://www.nj.gov/oag/jjc/prea.html,3/10/2016,IMAGERY,2017-12-18T00:00:00.000Z,http://www.nj.gov/oag/jjc/residential_community_list.html,JUVENILE,60,0.00411097409618,9.7309124e-07,15625.94140625,534.12843116609,"34","011","040700","34011040700","407",Census Tract 407,G5020,S,15817201,162650,"+39.4891903","-074.9736358",NJ,-74.987997344727,39.4930146517308,,"1"
1237,1628,"10001615","WOMEN'S EASTERN RECEPTION, DIAGNOSTIC / CORRECTIONAL CENTER",1101 E HWY 54,VANDALIA,MO,"63382",NOT AVAILABLE,(573) 594-6686,STATE,OPEN,1767,AUDRAIN,"29007",USA,"922140",CORRECTIONAL INSTITUTIONS,https://doc.mo.gov/OD/PREA-2016.php,5/6/2016,IMAGERY,2017-12-07T00:00:00.000Z,https://doc.mo.gov/DAI/Institutional_Facilities.php,MAXIMUM,1560,0.0171065522407,1.6044100921e-05,256990.73828125,2109.43466638056,"29","007","950100","29007950100","9501",Census Tract 9501,G5020,S,32573196,129771,"+39.3059738","-091.4929857",MO,-91.4766407574844,39.3179052242028,,"1"
1238,1629,"10003268",FLUVANNA CORRECTIONAL CENTER FOR WOMEN,144 PRISON LANE,TROY,VA,"22974",NOT AVAILABLE,(434) 984-3700,STATE,OPEN,1181,FLUVANNA,"51065",USA,"922140",CORRECTIONAL INSTITUTIONS,https://vadoc.virginia.gov/about/facts/,9/27/2017,IMAGERY,2018-01-19T00:00:00.000Z,https://vadoc.virginia.gov/facilities/,MAXIMUM,1315,0.0129400591703,1.0049922266e-05,158004.77734375,1665.47888926397,"51","065","020101","51065020101","201.01",Census Tract 201.01,G5020,S,111925060,1236961,"+37.9429399","-078.2669199",VA,-78.2701794058318,37.9826392961826,,"1"
1239,1630,"10003310",GREEN ROCK CORRECTIONAL CENTER,475 GREEN ROCK LANE,CHATHAM,VA,"24531",NOT AVAILABLE,(434) 797-2000,STATE,OPEN,1030,PITTSYLVANIA,"51143",USA,"922140",CORRECTIONAL INSTITUTIONS,https://vadoc.virginia.gov/about/facts/,12/1/2014,IMAGERY,2018-01-19T00:00:00.000Z,https://vadoc.virginia.gov/facilities/,CLOSE,1038,0.0108369080449,7.896839165e-06,122210.55859375,1343.50098990762,"51","143","010500","51143010500","105",Census Tract 105,G5020,S,166780189,1539493,"+36.8334644","-079.4072695",VA,-79.4219061778487,36.7999467418384,,"3"
1240,1631,"10003327",GREENSVILLE CORRECTIONAL CENTER,901 CORRECTIONS WAY,JARRATT,VA,"23870","9614",(434) 535-7000,STATE,OPEN,2976,GREENSVILLE,"51081",USA,"922140",CORRECTIONAL INSTITUTIONS,https://vadoc.virginia.gov/about/facts/,1/19/2018,IMAGERY,2018-01-19T00:00:00.000Z,https://vadoc.virginia.gov/facilities/,CLOSE,-999,0.0225151136101,3.5067624321e-05,542693.67578125,2778.37923634803,"51","081","880102","51081880102","8801.02",Census Tract 8801.02,G5020,S,393965,0,"+36.7986024","-077.4861902",VA,-77.4863652319298,36.7987278786161,,"1"
1241,1632,"10001603",GREENSVILLE WORK CENTER,901 CORRECTIONS WAY,JARRATT,VA,"23870","9614",(434) 535-7000,STATE,OPEN,210,GREENSVILLE,"51081",USA,"922140",CORRECTIONAL INSTITUTIONS,https://vadoc.virginia.gov/about/facts/,1/19/2018,IMAGERY/OTHER,2018-01-19T00:00:00.000Z,https://vadoc.virginia.gov/facilities/,MINIMUM,-999,0.00495835313459,1.502123257e-06,23245.015625,609.868956443031,"51","081","880101","51081880101","8801.01",Census Tract 8801.01,G5020,S,295138100,2251859,"+36.7836335","-077.5615704",VA,-77.4866859784139,36.7944661316548,,"2"
1242,1633,"10001895",SUBLETTE COUNTY DETENTION CENTER,35 1/2 S TYLER AVE,PINEDALE,WY,"82941",NOT AVAILABLE,(307) 367-4378,COUNTY,OPEN,-999,SUBLETTE,"56035",USA,"922140",CORRECTIONAL INSTITUTIONS,http://www.sublettewyo.com/index.aspx?NID=139,5/11/2018,IMAGERY,2018-05-11T00:00:00.000Z,NOT AVAILABLE,NOT AVAILABLE,52,0.00371681994081,3.83069877e-07,6476.6171875,468.57549502939,"56","035","000102","56035000102","1.02",Census Tract 1.02,G5020,S,6178754926,114671145,"+42.9571465","-109.6510146",WY,-109.860585754604,42.8660273173225,,"1"
1243,1634,"10004925",DEARBORN COUNTY JUVENILE DETENTION CENTER,219 W HIGH ST,LAWRENCEBURG,IN,"47025",NOT AVAILABLE,(812) 537-8740,COUNTY,OPEN,7,DEARBORN,"18029",USA,"922140",CORRECTIONAL INSTITUTIONS,http://www.in.gov/idoc/dys/2481.htm,3/5/2018,IMAGERY,2018-03-05T00:00:00.000Z,NOT AVAILABLE,JUVENILE,20,0.00122095216708,7.1605197e-08,1143.25390625,152.081693478146,"18","029","080300","18029080300","803",Census Tract 803,G5020,S,19085687,1201184,"+39.0974888","-084.8804338",IN,-84.8503098361331,39.0908738643478,,"2"
1244,1635,"10001887",TETON COUNTY DETENTION CENTER,175 S WILLOW ST,JACKSON,WY,"83001",NOT AVAILABLE,(307) 733-2141,COUNTY,OPEN,10,TETON,"56039",USA,"922140",CORRECTIONAL INSTITUTIONS,http://www.tetonsheriff.org/,5/11/2018,IMAGERY,2018-05-11T00:00:00.000Z,http://www.tetonsheriff.org/,MAXIMUM,45,0.00102081739039,6.4954363e-08,1109.25390625,136.232705454132,"56","039","967800","56039967800","9678",Census Tract 9678,G5020,S,77818842,840400,"+43.4286916","-110.7408967",WY,-110.759369415366,43.4779466344382,,"1"
1245,1636,"10001889",WASHAKIE COUNTY JAIL,100 N 10TH ST,WORLAND,WY,"82401",NOT AVAILABLE,NOT AVAILABLE,COUNTY,OPEN,-999,WASHAKIE,"56043",USA,"922140",CORRECTIONAL INSTITUTIONS,http://www.washakiecounty.net/sheriff,5/11/2018,IMAGERY,2018-05-11T00:00:00.000Z,NOT AVAILABLE,NOT AVAILABLE,-999,0.00253838854674,2.60567374e-07,4490.11328125,332.64346844087,"56","043","000301","56043000301","3.01",Census Tract 3.01,G5020,S,1993203,0,"+44.0143691","-107.9563794",WY,-107.955196675731,44.0174771522186,,"1"
1246,1637,"10006550",ST. JOSEPH COMMUNITY SUPERVISION CENTER,3305 FARAON STREET,ST. JOSEPH,MO,"64506",NOT AVAILABLE,(816) 271-3131,STATE,OPEN,29,BUCHANAN,"29021",USA,"922140",CORRECTIONAL INSTITUTIONS,https://doc.mo.gov/OD/PREA-2016.php,6/28/2016,IMAGERY,2017-12-07T00:00:00.000Z,https://doc.mo.gov/Facilities.php,NOT AVAILABLE,30,0.00256662096169,2.68668136e-07,4331.64453125,322.202118219376,"29","021","000600","29021000600","6",Census Tract 6,G5020,S,5364093,12139,"+39.7829384","-094.8135023",MO,-94.8143444210278,39.770930386844,,"2"
1247,1638,"10006608",VOORHEES RESIDENTIAL COMMUNITY HOME,201 ROUTE 513,GLEN GARDNER,NJ,"08826",NOT AVAILABLE,(908) 638-4625,STATE,OPEN,19,HUNTERDON,"34019",USA,"922140",CORRECTIONAL INSTITUTIONS,http://www.nj.gov/oag/jjc/prea.html,4/1/2015,IMAGERY/OTHER,2017-12-18T00:00:00.000Z,http://www.nj.gov/oag/jjc/residential_community_list.html,JUVENILE,27,0.00598728422698,1.601716221e-06,26173.4765625,728.789068472232,"34","019","010200","34019010200","102",Census Tract 102,G5020,S,83878772,708777,"+40.7263694","-074.8944081",NJ,-74.8914656003316,40.6815528471801,,"1"
1248,1639,"10003262",HAYNESVILLE CORRECTIONAL CENTER,421 BARNFIELD RD,HAYNESVILLE,VA,"22472",NOT AVAILABLE,(804) 333-3577,STATE,OPEN,942,RICHMOND,"51159",USA,"922140",CORRECTIONAL INSTITUTIONS,https://vadoc.virginia.gov/about/facts/,10/22/2015,IMAGERY,2018-01-19T00:00:00.000Z,https://vadoc.virginia.gov/facilities/,MEDIUM,938,0.0167773676501,1.7340007535e-05,272526.03515625,2070.14813977903,"51","159","040200","51159040200","402",Census Tract 402,G5020,S,145706017,1070479,"+37.9147998","-076.6278355",VA,-76.6706534245167,37.9574746812694,,"2"
1249,1640,"10006235",MONROE COUNTY MARATHON DETENTION FACILITY,3981 OCEAN TERRACE,MARATHON,FL,"33050",NOT AVAILABLE,(305) 289-2420,COUNTY,OPEN,40,MONROE,"12087",USA,"922140",CORRECTIONAL INSTITUTIONS,https://www.keysso.net/jail/detention_center_index.htm,2/21/2018,UNVERIFIED,2018-02-21T00:00:00.000Z,https://www.keysso.net/jail/detention_center_index.htm,NOT AVAILABLE,52,0.00130444324121,1.00205049e-07,1366.921875,153.629526287287,"12","087","971300","12087971300","9713",Census Tract 9713,G5020,S,5361731,24290345,"+24.7071065","-081.1238335",FL,-81.0878279423116,24.7115668003184,,"1"
1250,1641,"10005625",DECATUR COUNTY JAIL,119 EAST RAILROAD STREET,GREENSBURG,IN,"47240",NOT AVAILABLE,(812) 663-8125,COUNTY,OPEN,-999,DECATUR,"18031",USA,"922140",CORRECTIONAL INSTITUTIONS,http://www.decaturcountysheriff.com/index.html,3/5/2018,IMAGERY,2018-03-05T00:00:00.000Z,http://www.decaturcountysheriff.com/index.html,NOT AVAILABLE,-999,0.00215065846851,2.39286474e-07,3833.78125,266.564098011939,"18","031","969400","18031969400","9694",Census Tract 9694,G5020,S,220573032,353063,"+39.2710724","-085.4137787",IN,-85.4833726200588,39.3351373130926,,"1"
1251,1642,"10003263",HAYNESVILLE CORRECTIONAL UNIT #17,CAMP SEVENTEEN RD,HAYNESVILLE,VA,"22472",NOT AVAILABLE,(804) 333-3577,STATE,OPEN,111,RICHMOND,"51159",USA,"922140",CORRECTIONAL INSTITUTIONS,https://vadoc.virginia.gov/about/facts/,10/21/2015,IMAGERY,2018-01-19T00:00:00.000Z,https://vadoc.virginia.gov/facilities/,MINIMUM,114,0.00655181799312,1.815136135e-06,28527.24609375,812.97371595246,"51","159","040200","51159040200","402",Census Tract 402,G5020,S,145706017,1070479,"+37.9147998","-076.6278355",VA,-76.673763502838,37.9561370506531,,"2"
1252,1643,"10006234",MONROE COUNTY PLANTATION KEY DETENTION FACILITY,53 HIGH POINT ROAD,PLANTATION KEY,FL,"33070",NOT AVAILABLE,(305) 853-3266,COUNTY,OPEN,37,MONROE,"12087",USA,"922140",CORRECTIONAL INSTITUTIONS,https://www.keysso.net/jail/detention_center_index.htm,2/21/2018,IMAGERY,2018-02-21T00:00:00.000Z,https://www.keysso.net/jail/detention_center_index.htm,NOT AVAILABLE,47,0.00203010753798,2.14893238e-07,2937.775390625,237.016146836329,"12","087","970800","12087970800","9708",Census Tract 9708,G5020,S,7532993,25786322,"+24.9782176","-080.5555867",FL,-80.5512860728027,24.9798471960226,,"1"
1253,1644,"10002782",EASTLAND COUNTY JAIL,201 W WHITE,EASTLAND,TX,"76448",NOT AVAILABLE,(254) 629-3298,COUNTY,OPEN,39,EASTLAND,"48133",USA,"922140",CORRECTIONAL INSTITUTIONS,"https://www.tcjs.state.tx.us/index.php?linkID=325, http://www.eastlandcountytexas.com/page/eastland.Sheriff",3/1/2018,IMAGERY,2018-04-26T00:00:00.000Z,NOT AVAILABLE,NOT AVAILABLE,97,0.00246527396442,2.78977525e-07,4094.62890625,298.024601982113,"48","133","950200","48133950200","9502",Census Tract 9502,G5020,S,394650747,8274017,"+32.4173690","-098.8061548",TX,-98.8194701716866,32.4029211403656,,"1"
1254,1645,"10005604",DEKALB COUNTY JAIL,215 EAST 8TH STREET,AUBURN,IN,"46706",NOT AVAILABLE,(815) 895-2155,COUNTY,OPEN,-999,DEKALB,"18033",USA,"922140",CORRECTIONAL INSTITUTIONS,http://www.co.dekalb.in.us/department/index.php?structureid=32,3/5/2018,IMAGERY,2018-03-05T00:00:00.000Z,http://www.co.dekalb.in.us/department/index.php?structureid=32,NOT AVAILABLE,-999,0.0029179921925,3.54191711e-07,5848.2890625,356.459469222246,"18","033","020500","18033020500","205",Census Tract 205,G5020,S,10331746,0,"+41.3716224","-085.0656300",IN,-85.0538057781676,41.3661272562449,,"1"
1255,1646,"10006551",HANNIBAL COMMUNITY SUPERVISION CENTER,2002 WARREN BARRET DRIVE,HANNIBAL,MO,"63401",NOT AVAILABLE,(573) 248-2450,STATE,OPEN,27,MARION,"29127",USA,"922140",CORRECTIONAL INSTITUTIONS,https://doc.mo.gov/OD/PREA-2015.php,8/13/2015,IMAGERY,2017-12-07T00:00:00.000Z,https://doc.mo.gov/Facilities.php,NOT AVAILABLE,50,0.00248496372505,2.69993295e-07,4348.4921875,308.46960215106,"29","127","960800","29127960800","9608",Census Tract 9608,G5020,S,9440774,1739835,"+39.6963696","-091.3492235",MO,-91.3733176176454,39.6991442772109,,"1"
1256,1647,"10000054",WESTON COUNTY DETENTION CENTER,25 N SUMNER AVE,NEWCASTLE,WY,"82701",NOT AVAILABLE,NOT AVAILABLE,COUNTY,OPEN,-999,WESTON,"56045",USA,"922140",CORRECTIONAL INSTITUTIONS,http://westongov.com/_departments/_county_sheriff/index.asp,5/11/2018,IMAGERY,2018-05-11T00:00:00.000Z,NOT AVAILABLE,NOT AVAILABLE,38,0.00158402137595,1.25914269e-07,2163.8671875,204.180630332925,"56","045","951300","56045951300","9513",Census Tract 9513,G5020,S,110794048,183772,"+43.8596486","-104.2445128",WY,-104.203371908268,43.8560943380865,,"1"
1257,1648,"10006552",FARMINGTON COMMUNITY SUPERVISION CENTER,1430 DOUBET ROAD,FARMINGTON,MO,"63640",NOT AVAILABLE,(573) 218-5006,STATE,OPEN,27,ST. FRANCOIS,"29187",USA,"922140",CORRECTIONAL INSTITUTIONS,https://doc.mo.gov/OD/PREA-2015.php,8/10/2015,IMAGERY,2017-12-07T00:00:00.000Z,https://doc.mo.gov/Facilities.php,NOT AVAILABLE,30,0.00252091801329,2.6367448e-07,4133.1875,312.523018465075,"29","187","950400","29187950400","9504",Census Tract 9504,G5020,S,163757138,665984,"+37.8160464","-090.5382692",MO,-90.4330785700518,37.7635897264647,"1","2"
1258,1649,"10006609",WARREN RESIDENTIAL COMMUNITY HOME,509 BRASS CASTLE ROAD,OXFORD,NJ,"07863",NOT AVAILABLE,(908) 453-2032,STATE,OPEN,27,WARREN,"34041",USA,"922140",CORRECTIONAL INSTITUTIONS,http://www.nj.gov/oag/jjc/prea.html,4/2/2015,IMAGERY/OTHER,2017-12-18T00:00:00.000Z,http://www.nj.gov/oag/jjc/residential_community_list.html,JUVENILE,30,0.00284560826277,4.92545571e-07,8060.9140625,359.607423533135,"34","041","031601","34041031601","316.01",Census Tract 316.01,G5020,S,70878203,1387592,"+40.8211975","-075.0305025",NJ,-75.0279851393737,40.7829485638931,,"2"
1259,1650,"10000924",INDIAN CREEK CORRECTIONAL CENTER,801 SANDERSON RD,CHESAPEAKE,VA,"23328","6481",(757) 421-0095,STATE,OPEN,1000,CHESAPEAKE,"51550",USA,"922140",CORRECTIONAL INSTITUTIONS,https://vadoc.virginia.gov/about/facts/,6/23/2015,IMAGERY,2018-01-19T00:00:00.000Z,https://vadoc.virginia.gov/facilities/,MEDIUM,1008,0.0167108046219,1.7099876858e-05,263997.3828125,2032.34132925878,"51","550","021102","51550021102","211.02",Census Tract 211.02,G5020,S,150040744,3213526,"+36.6297744","-076.1418442",VA,-76.17807889029,36.6143982485182,,"2"
1260,1651,"10001244",WESTERN NM CORRECTIONAL FACILITY,2111 LOBO CANYON RD,GRANTS,NM,"87020",NOT AVAILABLE,(505) 876-8300,STATE,OPEN,357,CIBOLA,"35006",USA,"922140",CORRECTIONAL INSTITUTIONS,"http://cd.nm.gov/prea/prea.html, http://cd.nm.gov/apd/facilities.html",4/30/2015,IMAGERY,2017-12-18T00:00:00.000Z,http://cd.nm.gov/apd/facilities.html,CLOSE,440,0.0157429614338,9.177816503e-06,139148.109375,1914.88911526127,"35","006","974700","35006974700","9747",Census Tract 9747,G5020,S,7327296888,3874773,"+34.9317010","-108.2048759",NM,-107.798370565259,35.1803002635348,,"2"
1261,1652,"10001583",KEEN MOUNTAIN CORRECTIONAL CENTER,STATE ROUTE 629,OAKWOOD,VA,"24631",NOT AVAILABLE,(276) 498-7411,STATE,OPEN,723,BUCHANAN,"51027",USA,"922140",CORRECTIONAL INSTITUTIONS,https://vadoc.virginia.gov/about/facts/,11/18/2014,IMAGERY,2018-01-19T00:00:00.000Z,https://vadoc.virginia.gov/facilities/,CLOSE,870,0.0122761621546,1.0384584959e-05,161608.51171875,1538.0143966201,"51","027","010600","51027010600","106",Census Tract 106,G5020,S,213549061,848993,"+37.1912863","-081.9915297",VA,-81.9796886988228,37.2234136289745,,"1"
1262,1653,"10003775","PENITENTIARY OF NEW MEXICO, LEVEL II UNIT",4311 STATE HWY 14,SANTA FE,NM,"87504",NOT AVAILABLE,(505) 827-8201,STATE,OPEN,191,SANTA FE,"35049",USA,"922140",CORRECTIONAL INSTITUTIONS,http://cd.nm.gov/apd/facilities.html,12/18/2017,IMAGERY,2017-12-18T00:00:00.000Z,http://cd.nm.gov/apd/facilities.html,MINIMUM,-999,0.00735804751601,2.557686594e-06,38964.0390625,861.72399803851,"35","049","980000","35049980000","9800",Census Tract 9800,G5020,S,1764640,0,"+35.5659004","-106.0658843",NM,-106.064360419576,35.5665369114748,,"4"
1263,1654,"10006554",POPLAR BLUFF COMMUNITY SUPERVISION CENTER,1441 BLACK RIVER INDUSTRIAL PARK DRIVE,POPLAR BLUFF,MO,"63901",NOT AVAILABLE,(573) 840-9555,STATE,OPEN,38,BUTLER,"29023",USA,"922140",CORRECTIONAL INSTITUTIONS,https://doc.mo.gov/OD/PREA-2016.php,7/6/2016,IMAGERY,2017-12-07T00:00:00.000Z,https://doc.mo.gov/Facilities.php,NOT AVAILABLE,30,0.00263056720587,2.84031589e-07,4393.921875,324.107545768905,"29","023","950500","29023950500","9505",Census Tract 9505,G5020,S,22787546,359144,"+36.7617135","-090.3654367",MO,-90.3741895826717,36.7700841647158,,"3"
1264,1655,"10001596",LAWRENCEVILLE CORRECTIONAL CENTER,1607 PLANTERS RD,LAWRENCEVILLE,VA,"23868",NOT AVAILABLE,(434) 848-9349,STATE,OPEN,1563,BRUNSWICK,"51025",USA,"922140",CORRECTIONAL INSTITUTIONS,"https://vadoc.virginia.gov/about/facts/, https://www.geogroup.com/Locations",1/19/2018,IMAGERY/OTHER,2018-01-19T00:00:00.000Z,https://www.geogroup.com/Locations,MEDIUM,1536,0.0132765833083,1.1757825588e-05,181920.046875,1711.53969651757,"51","025","930202","51025930202","9302.02",Census Tract 9302.02,G5020,S,2193311,0,"+36.7826422","-077.8198356",VA,-77.8155388063194,36.7819881191099,,"3"
1265,1656,"10006553",KENNETT COMMUNITY SUPERVISION CENTER,1401 LAURA DRIVE,KENNETT,MO,"63857",NOT AVAILABLE,(573) 888-4900,STATE,OPEN,41,DUNKLIN,"29069",USA,"922140",CORRECTIONAL INSTITUTIONS,https://doc.mo.gov/OD/PREA-2016.php,7/7/2016,IMAGERY,2017-12-07T00:00:00.000Z,https://doc.mo.gov/Facilities.php,NOT AVAILABLE,30,0.00269142324645,2.78350258e-07,4277.3515625,330.521859155799,"29","069","360500","29069360500","3605",Census Tract 3605,G5020,S,12604488,2635,"+36.2476673","-090.0570230",MO,-90.0480380492821,36.2526798893065,"1","2"
1266,1657,"10006791",JACKSON COUNTY YOUTH CENTER,930 FLEMING AVENUE,JACKSON,MI,"49202",NOT AVAILABLE,(517) 788-4460,COUNTY,OPEN,-999,JACKSON,"26075",USA,"922140",CORRECTIONAL INSTITUTIONS,https://www.co.jackson.mi.us/593/Youth-Center,3/20/2018,IMAGERY,2018-03-20T00:00:00.000Z,https://www.co.jackson.mi.us/593/Youth-Center,JUVENILE,50,0.00520162509173,5.67191913e-07,9497.3203125,661.890779531272,"26","075","000400","26075000400","4",Census Tract 4,G5020,S,2913482,1136,"+42.2609849","-084.3850012",MI,-84.387627629346,42.2628793145095,"2","1"
1267,1658,"10004563",NASSAU COUNTY JAIL AND DETENTION CENTER,76212 NICHOLAS CUTINHA ROAD,YULEE,FL,"32097",NOT AVAILABLE,(904) 548-4002,COUNTY,OPEN,238,NASSAU,"12089",USA,"922140",CORRECTIONAL INSTITUTIONS,http://nassauso.com/,2/21/2018,IMAGERY,2018-02-21T00:00:00.000Z,http://nassauso.com/,NOT AVAILABLE,-999,0.00435176241241,7.90841848e-07,11386.974609375,517.741088146532,"12","089","050301","12089050301","503.01",Census Tract 503.01,G5020,S,306889990,5609724,"+30.6570830","-081.6667846",FL,-81.6310290451424,30.6110155704252,,"2"
1268,1659,"10004907",DELAWARE COUNTY JUVENILE DETENTION CENTER,3412 W KILGORE AVE,MUNCIE,IN,"47304",NOT AVAILABLE,(765) 741-4940,COUNTY,OPEN,27,DELAWARE,"18035",USA,"922140",CORRECTIONAL INSTITUTIONS,http://www.in.gov/idoc/dys/2481.htm,3/5/2018,IMAGERY,2018-03-05T00:00:00.000Z,http://www.yocinc.org/programs/,JUVENILE,42,0.00192041948448,2.20149156e-07,3570.82421875,253.796911518137,"18","035","000500","18035000500","5",Census Tract 5,G5020,S,5709845,55670,"+40.1794879","-085.4234599",IN,-85.4264487533321,40.1822336576035,,"1"
1269,1660,"10002795",ECTOR COUNTY DETENTION CENTER,2500 S US HWY 385,ODESSA,TX,"79760",NOT AVAILABLE,NOT AVAILABLE,COUNTY,OPEN,576,ECTOR,"48135",USA,"922140",CORRECTIONAL INSTITUTIONS,"https://www.tcjs.state.tx.us/index.php?linkID=325, http://www.ectorcountysheriff.us/index.html",3/1/2018,IMAGERY,2018-04-26T00:00:00.000Z,http://www.ectorcountysheriff.us/index.html,NOT AVAILABLE,667,0.00918396871711,3.210178737e-06,46817.13671875,1094.83624287034,"48","135","003000","48135003000","30",Census Tract 30,G5020,S,490134773,3722873,"+31.9704514","-102.3207293",TX,-102.359053435069,31.8207194657002,,"1"
1270,1661,"10006835",PERSHING COUNTY JAIL / SHERIFF,395 9TH ST,LOVELOCK,NV,"89419",NOT AVAILABLE,NOT AVAILABLE,COUNTY,OPEN,-999,PERSHING,"32027",USA,"922140",CORRECTIONAL INSTITUTIONS,http://www.pershingcounty.net/government/sheriff_s_office/index.php,4/9/2018,IMAGERY,2018-04-09T00:00:00.000Z,http://www.pershingcounty.net/government/sheriff_s_office/index.php,NOT AVAILABLE,-999,0.00146102383033,9.0141958e-08,1462.03515625,184.057904297509,"32","027","960100","32027960100","9601",Census Tract 9601,G5020,S,15634691964,79934815,"+40.4396390","-118.4094765",NV,-118.476245206093,40.1792316590115,"1","2"
1271,1662,"10003774","PENITENTIARY OF NEW MEXICO, LEVEL V UNIT",4311 STATE HWY 14,SANTA FE,NM,"87504",NOT AVAILABLE,(505) 827-8201,STATE,OPEN,300,SANTA FE,"35049",USA,"922140",CORRECTIONAL INSTITUTIONS,http://cd.nm.gov/apd/facilities.html,12/18/2017,IMAGERY,2017-12-18T00:00:00.000Z,http://cd.nm.gov/apd/facilities.html,MAXIMUM,-999,0.0159169945957,1.4636759876e-05,222962.43359375,1963.41402959806,"35","049","980000","35049980000","9800",Census Tract 9800,G5020,S,1764640,0,"+35.5659004","-106.0658843",NM,-106.068090437461,35.561054617473,,"4"
1272,1663,"10001592",LUNENBURG CORRECTIONAL CENTER,690 FALLS RD,VICTORIA,VA,"23974",NOT AVAILABLE,(434) 696-2045,STATE,OPEN,975,LUNENBURG,"51111",USA,"922140",CORRECTIONAL INSTITUTIONS,https://vadoc.virginia.gov/about/facts/,3/9/2017,IMAGERY,2018-01-19T00:00:00.000Z,https://vadoc.virginia.gov/facilities/,MEDIUM,987,0.014817477276,1.3399849862e-05,207960.1640625,1809.42685070683,"51","111","930100","51111930100","9301",Census Tract 9301,G5020,S,268530656,516104,"+37.0129110","-078.1703092",VA,-78.2115047771151,37.0151390748783,,"1"
1273,1664,"10003320",MARION CORRECTIONAL TREATMENT CENTER,110 WRIGHT ST,MARION,VA,"24354","3145",(276) 783-7154,STATE,OPEN,264,SMYTH,"51173",USA,"922140",CORRECTIONAL INSTITUTIONS,https://vadoc.virginia.gov/about/facts/,5/17/2017,IMAGERY,2018-01-19T00:00:00.000Z,https://vadoc.virginia.gov/facilities/,MAXIMUM,379,0.00570832075318,2.285855666e-06,35389.4453125,710.240879120234,"51","173","030500","51173030500","305",Census Tract 305,G5020,S,145393386,166406,"+36.7751698","-081.4105629",VA,-81.5088713671812,36.8298562974884,,"2"
1274,1665,"10003333",PATRICK HENRY CORRECTIONAL UNIT #28,18155 A L PHILPOTT HWY,RIDGEWAY,VA,"24148",NOT AVAILABLE,(276) 957-2234,STATE,OPEN,136,HENRY,"51089",USA,"922140",CORRECTIONAL INSTITUTIONS,https://vadoc.virginia.gov/about/facts/,9/21/2015,IMAGERY,2018-01-19T00:00:00.000Z,https://vadoc.virginia.gov/facilities/,MINIMUM,138,0.00726381520212,1.340872598e-06,20703.37109375,898.517057270442,"51","089","010700","51089010700","107",Census Tract 107,G5020,S,143886706,233350,"+36.5837201","-079.9752725",VA,-79.9552193522649,36.6227616825859,,"1"
1275,1666,"10003278",MEDICAL COLLEGE OF VIRGINIA SECURITY WARD,401 N 12TH ST,RICHMOND,VA,"23219",NOT AVAILABLE,(804) 828-0804,STATE,OPEN,15,RICHMOND CITY,"51760",USA,"922140",CORRECTIONAL INSTITUTIONS,https://vadoc.virginia.gov/about/facts/,1/19/2018,IMAGERY,2018-01-19T00:00:00.000Z,https://vadoc.virginia.gov/facilities/,NOT AVAILABLE,-999,0.00208960209542,2.6255265e-07,4103.24609375,257.157693834144,"51","760","030200","51760030200","302",Census Tract 302,G5020,S,1311451,0,"+37.5456964","-077.4359931",VA,-77.4303147283447,37.5404365378593,"11","1"
1276,1667,"10001589",NOTTOWAY CORRECTIONAL CENTER,2892 SCHUTT RD,BURKEVILLE,VA,"23922",NOT AVAILABLE,(434) 767-5543,STATE,OPEN,1432,NOTTOWAY,"51135",USA,"922140",CORRECTIONAL INSTITUTIONS,https://vadoc.virginia.gov/about/facts/,6/2/2017,IMAGERY,2018-01-19T00:00:00.000Z,https://vadoc.virginia.gov/facilities/,MAXIMUM,1475,0.0126337264799,1.0063891581e-05,156534.21875,1526.72238522558,"51","135","000300","51135000300","3",Census Tract 3,G5020,S,250996170,981898,"+37.1681572","-078.1688130",VA,-78.1747556307715,37.1831469969172,,"2"
1277,1668,"10006555",FULTON COMMUNITY SUPERVISION CENTER,1397 STATE ROAD O,FULTON,MO,"65251",NOT AVAILABLE,(573) 592-4061,STATE,OPEN,25,CALLAWAY,"29027",USA,"922140",CORRECTIONAL INSTITUTIONS,https://doc.mo.gov/OD/PREA-2015.php,8/11/2015,IMAGERY,2017-12-07T00:00:00.000Z,https://doc.mo.gov/Facilities.php,NOT AVAILABLE,32,0.00269263799764,2.831909e-07,4505.69921875,336.085838939661,"29","027","070300","29027070300","703",Census Tract 703,G5020,S,31216261,443222,"+38.8513012","-091.9235718",MO,-91.9223130024818,38.8437005181787,,"9"
1278,1669,"10005834",POCAHONTAS STATE CORRECTIONAL CENTER,317 OLD MOUNTAIN ROAD,POCAHONTAS,VA,"24635","0518",(276) 945-9173,STATE,OPEN,1026,TAZEWELL,"51185",USA,"922140",CORRECTIONAL INSTITUTIONS,https://vadoc.virginia.gov/about/facts/,5/11/2017,IMAGERY,2018-01-19T00:00:00.000Z,https://vadoc.virginia.gov/facilities/,MEDIUM,1034,0.00955555882316,6.491657039e-06,101124.42578125,1171.54805920512,"51","185","020100","51185020100","201",Census Tract 201,G5020,S,78913093,288257,"+37.2762244","-081.3869013",VA,-81.3654337321761,37.297191353181,,"1"
1279,1670,"10003848",KALAMAZOO COUNTY JAIL,1500 LAMONT AVE,KALAMAZOO,MI,"49048",NOT AVAILABLE,(269) 383-8821,COUNTY,OPEN,307,KALAMAZOO,"26077",USA,"922140",CORRECTIONAL INSTITUTIONS,http://www.kalcounty.com/sheriff/index.php,3/21/2018,IMAGERY,2018-03-21T00:00:00.000Z,http://www.kalcounty.com/sheriff/index.php,NOT AVAILABLE,400,0.00812409418543,1.514284587e-06,25361.11328125,1073.67018184257,"26","077","001801","26077001801","18.01",Census Tract 18.01,G5020,S,4637940,72573,"+42.2635037","-085.5533897",MI,-85.5495035788532,42.2758530146377,"3","1"
1280,1671,"10001581",POWHATAN RECEPTION CENTER,3600 WOODS WAY,STATE FARM,VA,"23160",NOT AVAILABLE,(804) 598-4251,STATE,OPEN,326,POWHATAN,"51145",USA,"922140",CORRECTIONAL INSTITUTIONS,https://vadoc.virginia.gov/about/facts/,7/26/2016,IMAGERY,2018-01-19T00:00:00.000Z,https://vadoc.virginia.gov/facilities/,MAXIMUM,518,0.00368722984782,8.40496844e-07,13150.91796875,458.769440882037,"51","145","500300","51145500300","5003",Census Tract 5003,G5020,S,33482296,200018,"+37.6621939","-077.9403515",VA,-77.8342818404358,37.6276937175537,,"5"
1281,1672,"10001901",JEFFREY C. WARDLE ACADEMY,3304 INTERSTATE 80 SERVICE RD,CHEYENNE,WY,"82009",NOT AVAILABLE,NOT AVAILABLE,COUNTY,CLOSED,0,LARAMIE,"56021",USA,"922140",CORRECTIONAL INSTITUTIONS,https://www.publicschoolreview.com/jeffrey-c-wardle-academy-cornerstone-programs-profile,5/11/2018,IMAGERY,2018-05-11T00:00:00.000Z,NOT AVAILABLE,JUVENILE,96,0.00381169306789,3.33989634e-07,5497.41015625,486.650464963228,"56","021","002000","56021002000","20",Census Tract 20,G5020,S,2729588322,1205491,"+41.2408635","-104.3404666",WY,-104.652078891624,41.160586470991,,"2"
1282,1673,"10004060",TRANSITION CENTER OF ST. LOUIS,1621 NORTH FIRST ST,ST. LOUIS,MO,"63102",NOT AVAILABLE,(314) 877-0300,STATE,OPEN,372,ST. LOUIS CITY,"29510",USA,"922140",CORRECTIONAL INSTITUTIONS,https://doc.mo.gov/OD/PREA-2016.php,7/8/2016,IMAGERY,2017-12-07T00:00:00.000Z,https://doc.mo.gov/Facilities.php,MINIMUM,538,0.0071742413172,2.690550591e-06,42687.62890625,958.322093375699,"29","510","126600","29510126600","1266",Census Tract 1266,G5020,S,3182569,582265,"+38.6484011","-090.1908571",MO,-90.1842703385525,38.6427383235377,"15","2"
1283,1674,"10005841",BRUCE NORMILE JUVENILE JUSTICE CENTER,1400 SOUTH BOUNDARY STREET,KIRKSVILLE,MO,"63501",NOT AVAILABLE,(660) 665-4224,STATE,OPEN,-999,ADAIR,"29001",USA,"922140",CORRECTIONAL INSTITUTIONS,http://www.juvenilecircuit2.org/juvenile-center-history,12/7/2017,IMAGERY,2017-12-07T00:00:00.000Z,http://www.juvenilecircuit2.org/,JUVENILE,16,0.00268917557809,2.87825033e-07,4668.72265625,342.521899498223,"29","001","950500","29001950500","9505",Census Tract 9505,G5020,S,68944894,2433866,"+40.1823975","-092.6170570",MO,-92.5965295496622,40.184978027973,"1","1"
1284,1675,"10003773","PENITENTIARY OF NEW MEXICO, LEVEL VI UNIT",4311 STATE HWY 14,SANTA FE,NM,"87504",NOT AVAILABLE,(505) 827-8201,STATE,OPEN,300,SANTA FE,"35049",USA,"922140",CORRECTIONAL INSTITUTIONS,http://cd.nm.gov/apd/facilities.html,12/18/2017,IMAGERY,2017-12-18T00:00:00.000Z,http://cd.nm.gov/apd/facilities.html,MAXIMUM,-999,0.0162619703782,1.4609111734e-05,222563.53515625,1995.57742472035,"35","049","980000","35049980000","9800",Census Tract 9800,G5020,S,1764640,0,"+35.5659004","-106.0658843",NM,-106.069106670158,35.5690483675224,,"4"
1285,1676,"10003776","PENITENTIARY OF NEW MEXICO, OLD MAIN UNIT",4311 STATE HWY 14,SANTA FE,NM,"87504",NOT AVAILABLE,(505) 827-8201,STATE,CLOSED,0,SANTA FE,"35049",USA,"922140",CORRECTIONAL INSTITUTIONS,http://cd.nm.gov/pio/old_main.html,12/18/2017,IMAGERY,2017-12-18T00:00:00.000Z,http://corrections.state.nm.us/prisons/pnm.html,NOT AVAILABLE,-999,0.0162879098307,1.4571850968e-05,221976.3984375,1995.71852369216,"35","049","980000","35049980000","9800",Census Tract 9800,G5020,S,1764640,0,"+35.5659004","-106.0658843",NM,-106.061689751155,35.5620166173106,,"4"
1286,1677,"10000497",OKEECHOBEE COUNTY JAIL,504 NW 4TH ST,OKEECHOBEE,FL,"34972",NOT AVAILABLE,NOT AVAILABLE,COUNTY,OPEN,244,OKEECHOBEE,"12093",USA,"922140",CORRECTIONAL INSTITUTIONS,"http://www.dc.state.fl.us/pub/jails/, https://www.okeesheriff.org/",2/21/2018,IMAGERY,2018-02-21T00:00:00.000Z,https://www.okeesheriff.org/,MAXIMUM,232,0.00533306730741,9.86757627e-07,13754.140625,630.062536794634,"12","093","910202","12093910202","9102.02",Census Tract 9102.02,G5020,S,22853535,162502,"+27.2613205","-080.8798465",FL,-80.8360789421129,27.2476447107447,,"1"
1287,1678,"10001960",CENTRAL NM CORRECTIONAL FACILITY / MAIN / LEVEL II UNIT,1525 MORRIS RD,LOS LUNAS,NM,"87031",NOT AVAILABLE,(505) 383-3359,STATE,OPEN,955,VALENCIA,"35061",USA,"922140",CORRECTIONAL INSTITUTIONS,http://cd.nm.gov/prea/prea.html,7/27/2016,IMAGERY,2017-12-18T00:00:00.000Z,http://cd.nm.gov/apd/facilities.html,MAXIMUM,966,0.0254393918768,2.4104258562e-05,363705.21875,3185.41697663059,"35","061","970700","35061970700","9707",Census Tract 9707,G5020,S,42329824,16449,"+34.7434060","-106.7620613",NM,-106.766265770325,34.7877375704015,,"2"
1288,1679,"10003307",RED ONION STATE PRISON,10800 H JACK ROSE HWY,POUND,VA,"24279",NOT AVAILABLE,(276) 796-7510,STATE,OPEN,851,WISE,"51195",USA,"922140",CORRECTIONAL INSTITUTIONS,https://vadoc.virginia.gov/about/facts/,9/22/2015,IMAGERY,2018-01-19T00:00:00.000Z,https://vadoc.virginia.gov/facilities/,MAXIMUM,987,0.0108044693706,7.939778038e-06,123379.13671875,1339.82642556941,"51","195","930700","51195930700","9307",Census Tract 9307,G5020,S,96928037,450039,"+37.1147032","-082.5668741",VA,-82.5499112926803,37.1117073014791,,"1"
1289,1680,"10006218",RIVER NORTH CORRECTIONAL CENTER,329 DELL BROOK LANE,INDEPENDENCE,VA,"24348",NOT AVAILABLE,(276) 773-2518,STATE,OPEN,897,GRAYSON,"51077",USA,"922140",CORRECTIONAL INSTITUTIONS,https://vadoc.virginia.gov/about/facts/,3/16/2016,IMAGERY,2018-01-19T00:00:00.000Z,https://vadoc.virginia.gov/facilities/,MEDIUM,1000,0.0100621192598,5.751531226e-06,88796.234375,1212.76181364283,"51","077","060201","51077060201","602.01",Census Tract 602.01,G5020,S,195750619,2939470,"+36.6615826","-081.1039390",VA,-81.126827525826,36.6151737218856,,"1"
1290,1681,"10005635",DUBOIS COUNTY JAIL,255 BRUCKE STRASSE,JASPER,IN,"47546",NOT AVAILABLE,(812) 482-3522,COUNTY,OPEN,77,DUBOIS,"18037",USA,"922140",CORRECTIONAL INSTITUTIONS,"http://www.duboiscountysd.com/index.html, http://www.duboiscountyin.org/offices/corrections.html",3/5/2018,IMAGERY,2018-03-05T00:00:00.000Z,http://www.duboiscountysd.com/index.html,NOT AVAILABLE,98,0.00481535782866,6.44969792e-07,10196.30078125,598.438143793553,"18","037","953400","18037953400","9534",Census Tract 9534,G5020,S,18429356,334464,"+38.3772534","-086.9315039",IN,-86.92799681549,38.3845132269526,"2","1"
1291,1682,"10006556",CAMP AVERY PARK CAMP,198 AVERY LANE,TROY,MO,"63379",NOT AVAILABLE,(636) 528-8800,STATE,OPEN,24,LINCOLN,"29113",USA,"922140",CORRECTIONAL INSTITUTIONS,https://dss.mo.gov/reports/prison-rape-elimination-act-reports/prea-audit-full-compliance-reports/,2/17/2017,IMAGERY,2017-12-07T00:00:00.000Z,NOT AVAILABLE,JUVENILE,36,0.00326333043159,5.02940758e-07,8021.8359375,401.991711087895,"29","113","810304","29113810304","8103.04",Census Tract 8103.04,G5020,S,162623003,1248797,"+39.0186404","-090.8904584",MO,-90.9147649559388,39.0190969297256,,"1"
1292,1683,"10002794",ECTOR COUNTY YOUTH CENTER,1401 E YUKON RD,ODESSA,TX,"79762",NOT AVAILABLE,(432) 362-6356,COUNTY,OPEN,-999,ECTOR,"48135",USA,"922140",CORRECTIONAL INSTITUTIONS,http://www.tjjd.texas.gov/publications/other/searchfacilityregistryresults.aspx?SelectedFacilityType=YKSBbGCMUWM=&SelectedSortBy=laExhobORj5ZHimppFKN0Q==&IncludeInactive=bZL7qeN3IjY=,4/26/2018,IMAGERY,2018-04-26T00:00:00.000Z,NOT AVAILABLE,JUVENILE,21,0.00523961249886,8.40195222e-07,12265.89453125,631.656221031685,"48","135","002501","48135002501","25.01",Census Tract 25.01,G5020,S,16978123,144818,"+31.9225461","-102.3865496",TX,-102.379652089545,31.9146855082229,,"1"
1293,1684,"10005761",STOREY COUNTY JAIL,911 STATE ROUTE 341 S,VIRGINIA CITY,NV,"89440",NOT AVAILABLE,NOT AVAILABLE,COUNTY,OPEN,-999,STOREY,"32029",USA,"922140",CORRECTIONAL INSTITUTIONS,http://www.storeycounty.org/313/Sheriff,4/9/2018,IMAGERY,2018-04-09T00:00:00.000Z,http://www.storeycounty.org/313/Sheriff,NOT AVAILABLE,25,0.00228041854179,2.71420853e-07,4346.30078125,280.081762161054,"32","029","970200","32029970200","9702",Census Tract 9702,G5020,S,683680818,1881020,"+39.4383853","-119.5246462",NV,-119.650849586829,39.2976676982316,,"1"
1294,1685,"10005902",DELMINA WOODS YOUTH FACILITY,8872 STATE HIGHWAY H,FORSYTH,MO,"65653",NOT AVAILABLE,(417) 634-3196,STATE,OPEN,18,CHRISTIAN,"29213",USA,"922140",CORRECTIONAL INSTITUTIONS,https://dss.mo.gov/reports/prison-rape-elimination-act-reports/prea-audit-full-compliance-reports/,4/20/2017,IMAGERY,2017-12-07T00:00:00.000Z,NOT AVAILABLE,JUVENILE,24,0.00830118881956,2.992667317e-06,46332.49609375,978.752239438772,"29","043","020500","29043020500","205",Census Tract 205,G5020,S,607326656,98306,"+36.8855946","-093.1231988",MO,-93.1095963350687,36.8302519709404,,"1"
1295,1686,"10003787","CENTRAL NM CORRECTIONAL FACILITY, LEVEL I UNIT",3201 HIGHWAY 314 SW,LOS LUNAS,NM,"87031",NOT AVAILABLE,(505) 865-2728,STATE,OPEN,350,VALENCIA,"35061",USA,"922140",CORRECTIONAL INSTITUTIONS,http://cd.nm.gov/prea/prea.html,7/27/2016,IMAGERY,2017-12-18T00:00:00.000Z,http://cd.nm.gov/apd/facilities.html,MINIMUM,336,0.0121003477153,7.218401634e-06,108894.0625,1490.9402289919,"35","061","970700","35061970700","9707",Census Tract 9707,G5020,S,42329824,16449,"+34.7434060","-106.7620613",NM,-106.750979829026,34.770149507677,,"2"
1296,1687,"10004053",FULTON TREATMENT CENTER,1650 STATE HWY O,FULTON,MO,"65251",NOT AVAILABLE,(573) 592-4188,STATE,OPEN,23,CALLAWAY,"29027",USA,"922140",CORRECTIONAL INSTITUTIONS,"https://dss.mo.gov/reports/prison-rape-elimination-act-reports/prea-audit-full-compliance-reports/, https://dss.mo.gov/re/dysar.htm",6/30/2016,IMAGERY,2017-12-07T00:00:00.000Z,NOT AVAILABLE,JUVENILE,30,0.00524467057406,1.613616449e-06,25671.11328125,664.663163323155,"29","027","070300","29027070300","703",Census Tract 703,G5020,S,31216261,443222,"+38.8513012","-091.9235718",MO,-91.925469827783,38.8373798529914,,"9"
1297,1688,"10003289",RUSTBURG CORRECTIONAL UNIT #9,479 CAMP NINE RD,RUSTBURG,VA,"24588",NOT AVAILABLE,(434) 332-7354,STATE,OPEN,149,CAMPBELL,"51031",USA,"922140",CORRECTIONAL INSTITUTIONS,https://vadoc.virginia.gov/about/facts/,7/6/2017,IMAGERY/OTHER,2018-01-19T00:00:00.000Z,https://vadoc.virginia.gov/facilities/,MINIMUM,157,0.00573012367701,1.175299126e-06,18301.0703125,676.559654263187,"51","031","020102","51031020102","201.02",Census Tract 201.02,G5020,S,176108956,237634,"+37.2552932","-079.0137313",VA,-79.067832750689,37.2673148840305,,"1"
1298,1689,"10003769",SPRINGER CORRECTIONAL CENTER,201 ROAD HWY 468,SPRINGER,NM,"87747",NOT AVAILABLE,(575) 483-3100,STATE,OPEN,271,COLFAX,"35007",USA,"922140",CORRECTIONAL INSTITUTIONS,http://cd.nm.gov/prea/prea.html,6/9/2016,IMAGERY,2017-12-18T00:00:00.000Z,http://cd.nm.gov/apd/facilities.html,MINIMUM,294,0.0160659663635,1.5766262647e-05,242694.70703125,1954.8067855841,"35","007","950700","35007950700","9507",Census Tract 9507,G5020,S,6035917903,23114442,"+36.4792323","-104.7523081",NM,-104.626328093365,36.3869920103021,"3","1"
1299,1690,"10000925",ST. BRIDES CORRECTIONAL CENTER,701 SANDERSON RD,CHESAPEAKE,VA,"23328","6482",(757) 421-6600,STATE,OPEN,1174,CHESAPEAKE,"51550",USA,"922140",CORRECTIONAL INSTITUTIONS,https://vadoc.virginia.gov/about/facts/,11/18/2014,IMAGERY,2018-01-19T00:00:00.000Z,https://vadoc.virginia.gov/facilities/,MEDIUM,1214,0.0141139861275,1.1870993804e-05,183261.53125,1738.26334908318,"51","550","021102","51550021102","211.02",Census Tract 211.02,G5020,S,150040744,3213526,"+36.6297744","-076.1418442",VA,-76.1829587199312,36.6104820294424,,"2"
1300,1691,"10004892",ELKHART COUNTY CORRECTIONS CENTER,26861 C.R. 26,ELKHART,IN,"46517",NOT AVAILABLE,(574) 891-2100,COUNTY,OPEN,782,ELKHART,"18039",USA,"922140",CORRECTIONAL INSTITUTIONS,http://www.elkhartcountysheriff.com/divisions/corrections/,3/5/2018,IMAGERY,2018-03-05T00:00:00.000Z,http://www.elkhartcountysheriff.com/divisions/corrections/,MAXIMUM,936,0.0124302307552,3.494173928e-06,57925.75,1569.00901608501,"18","039","002200","18039002200","22",Census Tract 22,G5020,S,18977486,0,"+41.6365601","-085.9825909",IN,-85.9812815392239,41.625129450016,,"1"
1301,1692,"10002990",WASHOE COUNTY DETENTION FACILITY,911 PARR BLVD,RENO,NV,"89512",NOT AVAILABLE,(775) 328-2971,COUNTY,OPEN,1085,WASHOE,"32031",USA,"922140",CORRECTIONAL INSTITUTIONS,https://www.washoesheriff.com/,4/9/2018,IMAGERY,2018-04-09T00:00:00.000Z,https://www.washoesheriff.com/,MAXIMUM,1124,0.0110438580995,5.590769539e-06,89881.9140625,1349.95427095982,"32","031","002617","32031002617","26.17",Census Tract 26.17,G5020,S,10449566,0,"+39.5862498","-119.8180511",NV,-119.811771403834,39.5742274947579,,"2"
1302,1693,"10006557",GENTRY RESIDENTIAL TREATMENT CENTER,2001 DYS DRIVE,CABOOL,MO,"65689",NOT AVAILABLE,(417) 962-4344,STATE,OPEN,20,TEXAS,"29215",USA,"922140",CORRECTIONAL INSTITUTIONS,https://dss.mo.gov/reports/prison-rape-elimination-act-reports/prea-audit-full-compliance-reports/,4/20/2017,IMAGERY,2017-12-07T00:00:00.000Z,NOT AVAILABLE,JUVENILE,24,0.00348782489164,7.81367364e-07,12142.71875,427.837477727203,"29","215","480400","29215480400","4804",Census Tract 4804,G5020,S,618574865,566797,"+37.1444221","-092.0928699",MO,-92.091196125273,37.1164808729348,,"1"
1303,1694,"10006792",KALAMAZOO COUNTY JUVENILE HOME,1424 GULL ROAD,KALAMAZOO,MI,"49048",NOT AVAILABLE,(269) 385-8550,COUNTY,OPEN,-999,KALAMAZOO,"26077",USA,"922140",CORRECTIONAL INSTITUTIONS,http://www.kalcounty.com/courts/kcjh/,3/21/2018,IMAGERY,2018-03-21T00:00:00.000Z,http://www.kalcounty.com/courts/kcjh/,JUVENILE,40,0.00797908395886,1.347976713e-06,22585.78515625,973.596179445434,"26","077","000100","26077000100","1",Census Tract 1,G5020,S,1685637,55834,"+42.2987687","-085.5624219",MI,-85.5617886597533,42.3036935912741,"3","1"
1304,1695,"10004062",HILLSBORO TREATMENT CENTER,10434 STATE RD BB,HILLSBORO,MO,"63050",NOT AVAILABLE,(636) 797-9813,STATE,OPEN,18,JEFFERSON,"29099",USA,"922140",CORRECTIONAL INSTITUTIONS,https://dss.mo.gov/reports/prison-rape-elimination-act-reports/prea-audit-full-compliance-reports/,6/8/2015,IMAGERY,2017-12-07T00:00:00.000Z,NOT AVAILABLE,JUVENILE,24,0.00407541179704,8.07399442e-07,12738.03125,495.951420482182,"29","099","700502","29099700502","7005.02",Census Tract 7005.02,G5020,S,82533986,1261214,"+38.2836330","-090.5854310",MO,-90.5687756167473,38.2359680526091,,"2"
1305,1696,"10001593",SUSSEX I STATE PRISON,24414 MUSSELWHITE DR,WAVERLY,VA,"23891","1111",(804) 834-9967,STATE,OPEN,1131,SUSSEX,"51183",USA,"922140",CORRECTIONAL INSTITUTIONS,https://vadoc.virginia.gov/about/facts/,5/23/2017,IMAGERY,2018-01-19T00:00:00.000Z,https://vadoc.virginia.gov/facilities/,MAXIMUM,1227,0.0130949030257,1.0835475953e-05,168231.3046875,1615.20973663085,"51","183","870202","51183870202","8702.02",Census Tract 8702.02,G5020,S,1454865,0,"+37.0458906","-077.2024823",VA,-77.1988084727693,37.0463099590334,,"2"
1306,1697,"10001594",SUSSEX II STATE PRISON,24427 MUSSELWHITE DR,WAVERLY,VA,"23891","2222",(804) 834-2678,STATE,OPEN,1258,SUSSEX,"51183",USA,"922140",CORRECTIONAL INSTITUTIONS,https://vadoc.virginia.gov/about/facts/,11/3/2015,IMAGERY,2018-01-19T00:00:00.000Z,https://vadoc.virginia.gov/facilities/,MAXIMUM,1302,0.015832203183,1.1250661557e-05,174690.734375,1947.45150370702,"51","183","870202","51183870202","8702.02",Census Tract 8702.02,G5020,S,1454865,0,"+37.0458906","-077.2024823",VA,-77.2054553889404,37.0520819430954,,"2"
1307,1698,"10005867",HOGAN STREET REGIONAL YOUTH CENTER,1839 HOGAN STREET,SAINT LOUIS,MO,"65109",NOT AVAILABLE,(314) 340-7434,STATE,OPEN,35,ST. LOUIS CITY,"29510",USA,"922140",CORRECTIONAL INSTITUTIONS,https://dss.mo.gov/reports/prison-rape-elimination-act-reports/prea-audit-full-compliance-reports/,11/15/2016,IMAGERY/OTHER,2017-12-07T00:00:00.000Z,NOT AVAILABLE,JUVENILE,36,0.00220194798188,2.92993204e-07,4648.81640625,273.355130982354,"29","510","126600","29510126600","1266",Census Tract 1266,G5020,S,3182569,582265,"+38.6484011","-090.1908571",MO,-90.2006734591455,38.6466254866784,"15","2"
1308,1699,"10003795","SOUTHERN NM CORRECTIONAL FACILITY, LEVEL III UNIT",1983 JOE R SILVA BLVD,LAS CRUCES,NM,"88004","0639",(575) 523-3200,STATE,OPEN,440,DONA ANA,"35013",USA,"922140",CORRECTIONAL INSTITUTIONS,http://cd.nm.gov/prea/prea.html,7/21/2017,IMAGERY,2017-12-18T00:00:00.000Z,http://cd.nm.gov/apd/facilities.html,MAXIMUM,480,0.0184947034379,2.1839110589e-05,319996.14453125,2262.99312328114,"35","013","001500","35013001500","15",Census Tract 15,G5020,S,1586024543,733685,"+32.3444876","-107.0502871",NM,-106.951674255445,32.2495844373636,,"3"
1309,1700,"10002171","ORANGE COUNTY DETENTION CENTER, MAIN FACILITY",3723 VISION BLVD,ORLANDO,FL,"32839",NOT AVAILABLE,(407) 836-3400,COUNTY,OPEN,1000,ORANGE,"12095",USA,"922140",CORRECTIONAL INSTITUTIONS,http://www.orangecountyfl.net/JailInmateServices.aspx#.Wo3LVvnwbmG,2/21/2018,IMAGERY,2018-02-21T00:00:00.000Z,http://www.orangecountyfl.net/JailInmateServices.aspx#.Wo3LVvnwbmG,MAXIMUM,1053,0.0097388173264,3.559225927e-06,50190.615234375,1166.11646221638,"12","095","014503","12095014503","145.03",Census Tract 145.03,G5020,S,1654519,364870,"+28.5020716","-081.4102035",FL,-81.4143157407685,28.5056108554164,,"6"
1310,1701,"10001249",ROSWELL CORRECTIONAL CENTER,578 W CHICKASAW RD,HAGERMAN,NM,"88232",NOT AVAILABLE,(575) 625-3100,STATE,OPEN,339,CHAVES,"35005",USA,"922140",CORRECTIONAL INSTITUTIONS,http://cd.nm.gov/prea/prea.html,2/18/2016,IMAGERY,2017-12-18T00:00:00.000Z,http://cd.nm.gov/apd/facilities.html,MINIMUM,340,0.00817875721307,2.469251479e-06,36543.57421875,998.692564792578,"35","005","001300","35005001300","13",Census Tract 13,G5020,S,510045044,1011474,"+33.1759645","-104.3968082",NM,-104.543213515304,33.1407417277514,,"1"
1311,1702,"10001591",WALLENS RIDGE STATE PRISON,272 DOGWOOD DR,BIG STONE GAP,VA,"24219",NOT AVAILABLE,(276) 523-3310,STATE,OPEN,1062,WISE,"51195",USA,"922140",CORRECTIONAL INSTITUTIONS,https://vadoc.virginia.gov/about/facts/,4/28/2016,IMAGERY,2018-01-19T00:00:00.000Z,https://vadoc.virginia.gov/facilities/,MAXIMUM,1212,0.0104385704507,7.786018191e-06,120561.8515625,1290.45203328504,"51","195","931200","51195931200","9312",Census Tract 9312,G5020,S,38086329,349192,"+36.8553326","-082.7810250",VA,-82.7867515707181,36.842101399777,,"1"
1312,1703,"10002167","ORANGE COUNTY DETENTION CENTER, PHOENIX FACILITY",3723 VISION BLVD,ORLANDO,FL,"32839",NOT AVAILABLE,(407) 836-3400,COUNTY,OPEN,286,ORANGE,"12095",USA,"922140",CORRECTIONAL INSTITUTIONS,http://www.orangecountyfl.net/JailInmateServices.aspx#.Wo3LVvnwbmG,2/21/2018,IMAGERY,2018-02-21T00:00:00.000Z,http://www.orangecountyfl.net/JailInmateServices.aspx#.Wo3LVvnwbmG,NOT AVAILABLE,288,0.00435844566234,5.68127345e-07,8011.26953125,520.425555409211,"12","095","014503","12095014503","145.03",Census Tract 145.03,G5020,S,1654519,364870,"+28.5020716","-081.4102035",FL,-81.4163876777344,28.5028785427058,,"6"
1313,1704,"10004893",ELKHART COUNTY JUVENILE DETENTION CENTER,114 N 2ND ST,GOSHEN,IN,"46526",NOT AVAILABLE,(574) 534-1312,COUNTY,NOT AVAILABLE,14,ELKHART,"18039",USA,"922140",CORRECTIONAL INSTITUTIONS,"http://www.in.gov/idoc/dys/2481.htm, http://wsbt.com/news/local/elkhart-county-moving-to-build-new-juvenile-detention-center",3/5/2018,IMAGERY,2018-03-05T00:00:00.000Z,NOT AVAILABLE,JUVENILE,17,0.000854543593345,4.2998253e-08,712.40625,114.958552232206,"18","039","000100","18039000100","1",Census Tract 1,G5020,S,1859611,29700,"+41.5817738","-085.8352019",IN,-85.8369813613864,41.5873609328185,"15","1"
1314,1705,"10006456",DAPHNE CORRECTIONS CENTER,1502 US HWY 98,DAPHNE,AL,"36526",NOT AVAILABLE,NOT AVAILABLE,LOCAL,OPEN,-999,BALDWIN,"01003",USA,"922140",CORRECTIONAL INSTITUTIONS,http://daphnepolice.org/,5/11/2018,IMAGERY,2018-05-11T00:00:00.000Z,http://daphnepolice.org/,NOT AVAILABLE,74,0.00288626394286,3.82047935e-07,5500.30859375,347.16094588967,"01","003","010800","01003010800","108",Census Tract 108,G5020,S,18088470,3922795,"+30.5939161","-087.9006394",AL,-87.8966636178388,30.6000217584974,,"1"
1315,1706,"10006558",LANGSFORD HOUSE YOUTH CENTER,525 SE 2ND STREET,LEES SUMMIT,MO,"64063",NOT AVAILABLE,(816) 622-0999,STATE,OPEN,8,JACKSON,"29095",USA,"922140",CORRECTIONAL INSTITUTIONS,https://dss.mo.gov/reports/prison-rape-elimination-act-reports/prea-audit-full-compliance-reports/,12/6/2016,IMAGERY,2017-12-07T00:00:00.000Z,NOT AVAILABLE,JUVENILE,12,0.00123252682454,9.1722015e-08,1460.81640625,153.392610998312,"29","095","013703","29095013703","137.03",Census Tract 137.03,G5020,S,3811728,0,"+38.9156844","-094.3717465",MO,-94.3679715998737,38.9153272433213,"1","1"
1316,1707,"10006559",CORNERSTONE,1250 EAST BROWN SCHOOL RD,COLUMBIA,MO,"65202",NOT AVAILABLE,(573) 449-3756,STATE,OPEN,12,BOONE,"29019",USA,"922140",CORRECTIONAL INSTITUTIONS,"https://dss.mo.gov/reports/prison-rape-elimination-act-reports/prea-audit-full-compliance-reports/, https://dss.mo.gov/re/dysar.htm",6/30/2016,IMAGERY,2017-12-07T00:00:00.000Z,NOT AVAILABLE,JUVENILE,10,0.00300048847124,4.14938437e-07,6616.40625,389.736923203423,"29","019","001504","29019001504","15.04",Census Tract 15.04,G5020,S,9455490,0,"+38.9852378","-092.3096514",MO,-92.322437358576,38.9997893391328,,"1"
1317,1708,"10005875",GREEN GABLES LODGE,275 GREEN GABLE DRIVE,MACKS CREEK,MO,"65786",NOT AVAILABLE,(573) 363-5352,STATE,CLOSED,0,CAMDEN,"29029",USA,"922140",CORRECTIONAL INSTITUTIONS,https://dss.mo.gov/re/pdf/dys/youth-services-annual-report-fy16.pdf,3/15/2016,IMAGERY,2017-12-07T00:00:00.000Z,NOT AVAILABLE,JUVENILE,12,0.00677986212211,1.887417863e-06,29660.72265625,810.066216052358,"29","029","950800","29029950800","9508",Census Tract 9508,G5020,S,554064558,7240703,"+37.9744196","-092.8809740",MO,-92.8753390105537,37.9498395550767,,"1"
1318,1709,"10003781",NORTHWEST NEW MEXICO CORRECTIONAL CENTER,1700 EAST OLD HIGHWAY 66,GRANTS,NM,"87020",NOT AVAILABLE,(505) 287-2941,STATE,OPEN,-999,CIBOLA,"35006",USA,"922140",CORRECTIONAL INSTITUTIONS,http://www.corecivic.com/facilities,12/18/2017,IMAGERY,2017-12-18T00:00:00.000Z,http://www.corecivic.com/facilities,MAXIMUM,-999,0.00790393563953,3.907006955e-06,59206.76171875,985.499380927357,"35","006","974201","35006974201","9742.01",Census Tract 9742.01,G5020,S,27406062,0,"+35.1344415","-107.8132278",NM,-107.816946901337,35.140787248017,,"2"
1319,1710,"10001246",GUADALUPE COUNTY CORRECTIONAL FACILITY,SOUTH HWY 54,SANTA ROSA,NM,"88435",NOT AVAILABLE,(575) 472-1001,STATE,OPEN,588,GUADALUPE,"35019",USA,"922140",CORRECTIONAL INSTITUTIONS,"http://cd.nm.gov/pio/docs/2013-2014_Annual_Report.pdf, https://www.geogroup.com/Locations",10/13/2017,IMAGERY/OTHER,2017-10-13T00:00:00.000Z,https://www.geogroup.com/Locations,CLOSE,600,0.0088169891777,5.103186774e-06,77113.6484375,1099.60491828871,"35","019","961600","35019961600","9616",Census Tract 9616,G5020,S,7847072129,2887948,"+34.8697822","-104.7849677",NM,-104.702851479621,34.9078715553342,,"1"
1320,1711,"10002380",BON AIR JUVENILE CORRECTIONAL CENTER,1900 CHATSWORTH AVE,RICHMOND,VA,"23235",NOT AVAILABLE,(804) 323-2550,STATE,OPEN,178,CHESTERFIELD,"51041",USA,"922140",CORRECTIONAL INSTITUTIONS,http://www.djj.virginia.gov/pages/residential/residential-services.htm,11/20/2015,IMAGERY,2018-01-22T00:00:00.000Z,http://www.djj.virginia.gov/pages/residential/residential-services.htm,JUVENILE,284,0.0142572482203,8.731348008e-06,136411.37109375,1810.7857278852,"51","041","100907","51041100907","1009.07",Census Tract 1009.07,G5020,S,4947313,32335,"+37.5066609","-077.5649254",VA,-77.5701657867358,37.5160694689405,,"3"
1321,1712,"10002168",ORANGE COUNTY FEMALE DETENTION CENTER,3723 VISION BLVD,ORLANDO,FL,"32839",NOT AVAILABLE,(407) 836-3400,COUNTY,OPEN,473,ORANGE,"12095",USA,"922140",CORRECTIONAL INSTITUTIONS,http://www.orangecountyfl.net/JailInmateServices.aspx#.Wo3LVvnwbmG,2/21/2018,IMAGERY,2018-02-21T00:00:00.000Z,http://www.orangecountyfl.net/JailInmateServices.aspx#.Wo3LVvnwbmG,MAXIMUM,652,0.00453900680052,1.007319481e-06,14204.759765625,533.670196323036,"12","095","014504","12095014504","145.04",Census Tract 145.04,G5020,S,3605078,140540,"+28.4959138","-081.4205899",FL,-81.4165253204305,28.50553198486,,"2"
1322,1713,"10003831",KENT COUNTY CORRECTIONAL FACILITY,703 BALL AVE NE,GRAND RAPIDS,MI,"49503",NOT AVAILABLE,(616) 632-6400,COUNTY,OPEN,1071,KENT,"26081",USA,"922140",CORRECTIONAL INSTITUTIONS,https://www.accesskent.com/Sheriff/,3/21/2018,IMAGERY,2018-03-21T00:00:00.000Z,https://www.accesskent.com/Sheriff/,MAXIMUM,1100,0.0101919239887,2.903958436e-06,49184.7109375,1316.51121744182,"26","081","001101","26081001101","11.01",Census Tract 11.01,G5020,S,3922246,3962,"+42.9870456","-085.6306662",MI,-85.6322821991424,42.9752093715595,,"3"
1323,1714,"10003798",JAN EVANS JUVENILE JUSTICE CENTER,650 FERRARI MCLEOD BLVD,RENO,NV,"89512",NOT AVAILABLE,(775) 325-7810,COUNTY,OPEN,-999,WASHOE,"32031",USA,"922140",CORRECTIONAL INSTITUTIONS,https://www.washoecounty.us/juvenilesvs/index.php,4/9/2018,IMAGERY,2018-04-09T00:00:00.000Z,https://www.washoecounty.us/juvenilesvs/index.php,JUVENILE,108,0.00691381865829,1.436724543e-06,23096.5625,856.162269235723,"32","031","002617","32031002617","26.17",Census Tract 26.17,G5020,S,10449566,0,"+39.5862498","-119.8180511",NV,-119.809076677332,39.5699419274145,,"2"
1324,1715,"10006139",FAYETTE COUNTY JAIL,123 WEST FOURTH STREET,CONNERSVILLE,IN,"47331",NOT AVAILABLE,(765) 825-1110,COUNTY,OPEN,-999,FAYETTE,"18041",USA,"922140",CORRECTIONAL INSTITUTIONS,http://connersvillecommunity.com/Fayette_County/Justice_System/Jail,3/5/2018,IMAGERY,2018-03-05T00:00:00.000Z,NOT AVAILABLE,NOT AVAILABLE,-999,0.0031474768604,4.8027865e-07,7728.75,388.333957865999,"18","041","954500","18041954500","9545",Census Tract 9545,G5020,S,12062515,0,"+39.6240145","-085.1340230",IN,-85.1411043029162,39.6404527628063,,"1"
1325,1716,"10006457",FOLEY CITY JAIL,200 EAST SECTION AVENUE,FOLEY,AL,"36535",NOT AVAILABLE,(251) 970-3040,LOCAL,OPEN,-999,BALDWIN,"01003",USA,"922140",CORRECTIONAL INSTITUTIONS,http://www.cityoffoley.org/CityServices/PoliceDepartment.aspx,5/11/2018,IMAGERY,2018-05-11T00:00:00.000Z,NOT AVAILABLE,NOT AVAILABLE,55,0.00234495440202,3.59874428e-07,5171.1484375,276.642179016865,"01","003","011501","01003011501","115.01",Census Tract 115.01,G5020,S,38605086,96924,"+30.4324484","-087.6790139",AL,-87.6818689803998,30.4133990007459,,"1"
1326,1717,"10005863",MISSOURI HILLS CAMPUS - BISSEL HALL,13298 BELLEFONTAINE ROAD,SAINT LOUIS,MO,"63138",NOT AVAILABLE,(314) 355-8088,STATE,OPEN,26,ST. LOUIS,"29189",USA,"922140",CORRECTIONAL INSTITUTIONS,"https://dss.mo.gov/reports/prison-rape-elimination-act-reports/prea-audit-full-compliance-reports/, https://dss.mo.gov/re/dysar.htm",6/30/2016,IMAGERY/OTHER,2017-12-07T00:00:00.000Z,NOT AVAILABLE,JUVENILE,20,0.000977941258364,5.671756e-08,902.19140625,121.882043686447,"29","189","210100","29189210100","2101",Census Tract 2101,G5020,S,39086010,4961325,"+38.8034745","-090.1576849",MO,-90.2153278838023,38.8271083846366,,"6"
1327,1718,"10003282",CENTRAL ADMISSION AND PLACEMENT UNIT,1601 OLD BON AIR RD,NORTH CHESTERFIELD,VA,"23235",NOT AVAILABLE,(804) 323-2104,STATE,OPEN,-999,CHESTERFIELD,"51041",USA,"922140",CORRECTIONAL INSTITUTIONS,http://www.djj.virginia.gov/pages/residential/residential-services.htm,1/22/2018,IMAGERY,2018-01-22T00:00:00.000Z,http://www.djj.virginia.gov/pages/residential/residential-services.htm,JUVENILE,-999,0.0133522733679,4.380601137e-06,68439.98828125,1667.41205701785,"51","041","100907","51041100907","1009.07",Census Tract 1009.07,G5020,S,4947313,32335,"+37.5066609","-077.5649254",VA,-77.5724514520526,37.517276747514,,"3"
1328,1719,"10005866",MISSOURI HILLS CAMPUS - FORT BELLEFONTAINE,13290 BELLEFONTAINE ROAD,SAINT LOUIS,MO,"63138",NOT AVAILABLE,(314) 355-7807,STATE,OPEN,24,ST. LOUIS,"29189",USA,"922140",CORRECTIONAL INSTITUTIONS,"https://dss.mo.gov/reports/prison-rape-elimination-act-reports/prea-audit-full-compliance-reports/, https://dss.mo.gov/re/dysar.htm",6/30/2016,IMAGERY/OTHER,2017-12-07T00:00:00.000Z,NOT AVAILABLE,JUVENILE,20,0.000922521306587,5.1049912e-08,812.03125,118.415526004043,"29","189","210100","29189210100","2101",Census Tract 2101,G5020,S,39086010,4961325,"+38.8034745","-090.1576849",MO,-90.2160741642643,38.8260866344144,,"6"
1329,1720,"10005862",MISSOURI HILLS CAMPUS - LEWIS AND CLARK HALL,13311 BELLEFONTAINE ROAD,SAINT LOUIS,MO,"63138",NOT AVAILABLE,(314) 355-7809,STATE,OPEN,10,ST. LOUIS,"29189",USA,"922140",CORRECTIONAL INSTITUTIONS,"https://dss.mo.gov/reports/prison-rape-elimination-act-reports/prea-audit-full-compliance-reports/, https://dss.mo.gov/re/dysar.htm",6/30/2016,IMAGERY/OTHER,2017-12-07T00:00:00.000Z,NOT AVAILABLE,JUVENILE,10,0.000894057689181,4.7441626e-08,754.66015625,110.890878421896,"29","189","210100","29189210100","2101",Census Tract 2101,G5020,S,39086010,4961325,"+38.8034745","-090.1576849",MO,-90.2176290968719,38.8283595388112,,"6"
1330,1721,"10005854",MONTGOMERY CITY YOUTH CAMP,300 NIEDERGERKE DRIVE,MONTGOMERY CITY,MO,"63361",NOT AVAILABLE,(573) 564-5262,STATE,OPEN,17,MONTGOMERY,"29139",USA,"922140",CORRECTIONAL INSTITUTIONS,https://dss.mo.gov/reports/prison-rape-elimination-act-reports/prea-audit-full-compliance-reports/,2/15/2017,IMAGERY/OTHER,2017-12-08T00:00:00.000Z,NOT AVAILABLE,JUVENILE,36,0.00662815575249,2.489708811e-06,39676.80859375,841.49833985602,"29","139","970200","29139970200","9702",Census Tract 9702,G5020,S,231045129,1695506,"+39.0079397","-091.5157703",MO,-91.4963862480305,38.9589740751341,,"2"
1331,1722,"10005713",LINCOLN PINES YOUTH CENTER,200 BLACK JACK PERSHING RD,CAPITAN,NM,"88316",NOT AVAILABLE,NOT AVAILABLE,STATE,CLOSED,0,LINCOLN,"35027",USA,"922140",CORRECTIONAL INSTITUTIONS,https://cyfd.org/about-cyfd/publications-reports,12/18/2017,IMAGERY,2017-12-18T00:00:00.000Z,NOT AVAILABLE,JUVENILE,24,0.00670684151164,3.281803924e-06,48761.1484375,813.252550955357,"35","027","960300","35027960300","9603",Census Tract 9603,G5020,S,3866600573,300319,"+33.7095505","-105.2393970",NM,-105.541839672261,33.4851406125586,"1","1"
1332,1723,"10006560",DATEMA HOUSE,918 SOUTH JEFFERSON,SPRINGFIELD,MO,"65806",NOT AVAILABLE,(417) 895-6830,STATE,OPEN,11,GREENE,"29077",USA,"922140",CORRECTIONAL INSTITUTIONS,https://dss.mo.gov/reports/prison-rape-elimination-act-reports/prea-audit-full-compliance-reports/,4/17/2017,IMAGERY,2017-12-07T00:00:00.000Z,NOT AVAILABLE,JUVENILE,12,0.00136429192995,9.6384161e-08,1499.45703125,163.236766398791,"29","077","000200","29077000200","2",Census Tract 2,G5020,S,997356,0,"+37.2004083","-093.2830719",MO,-93.2897261526161,37.197910039476,,"1"
1333,1724,"10002379",BEAUMONT JUVENILE CORRECTIONAL CENTER,3500 BEAUMONT RD,BEAUMONT,VA,"23014",NOT AVAILABLE,(804) 556-3316,STATE,CLOSED,0,POWHATAN,"51145",USA,"922140",CORRECTIONAL INSTITUTIONS,http://www.richmond.com/news/local/central-virginia/powhatan/powhatan-today/beaumont-correctional-in-powhatan-county-closes-its-doors/article_235360fa-57bb-11e7-aabe-27b0eec0a0bb.html,6/22/2017,IMAGERY,2018-01-22T00:00:00.000Z,http://www.djj.virginia.gov/ResidentialPages/Beaumont.aspx#beaumontvisitation,JUVENILE,284,0.02608377802,1.1863720946e-05,185720.46875,3231.73066143075,"51","145","500300","51145500300","5003",Census Tract 5003,G5020,S,33482296,200018,"+37.6621939","-077.9403515",VA,-77.9102509124847,37.6650763955583,,"5"
1334,1725,"10002173","ORANGE COUNTY JAIL, WHITCOMB FACILITY",3855 S JOHN YOUNG PKWY,ORLANDO,FL,"32839",NOT AVAILABLE,(407) 836-3400,COUNTY,OPEN,-999,ORANGE,"12095",USA,"922140",CORRECTIONAL INSTITUTIONS,http://www.orangecountyfl.net/JailInmateServices.aspx#.Wo3LVvnwbmG,2/21/2018,IMAGERY,2018-02-21T00:00:00.000Z,http://www.orangecountyfl.net/JailInmateServices.aspx#.Wo3LVvnwbmG,NOT AVAILABLE,224,0.00265715019411,4.26272528e-07,6011.044921875,312.485381106186,"12","095","014503","12095014503","145.03",Census Tract 145.03,G5020,S,1654519,364870,"+28.5020716","-081.4102035",FL,-81.4166998508643,28.5045225704076,,"6"
1335,1726,"10006561",GIRARDOT CENTER FOR YOUTH AND FAMILIES,609 NORTH MIDDLE STREET,CAPE GIRARDEAU,MO,"63701",NOT AVAILABLE,(573) 290-5680,STATE,OPEN,23,CAPE GIRARDEAU,"29031",USA,"922140",CORRECTIONAL INSTITUTIONS,https://dss.mo.gov/reports/prison-rape-elimination-act-reports/prea-audit-full-compliance-reports/,10/27/2016,IMAGERY/OTHER,2017-12-08T00:00:00.000Z,NOT AVAILABLE,JUVENILE,24,0.0035801067085,4.26607539e-07,6646.8671875,451.592848526048,"29","031","880900","29031880900","8809",Census Tract 8809,G5020,S,3070727,814377,"+37.3206250","-089.5113124",MO,-89.5234770358319,37.3124247484484,"1","1"
1336,1727,"10004044",RIVERBEND TREATMENT CENTER,5910 MITCHELL AVE,SAINT JOSEPH,MO,"64507",NOT AVAILABLE,(816) 387-2917,STATE,OPEN,30,BUCHANAN,"29021",USA,"922140",CORRECTIONAL INSTITUTIONS,"https://dss.mo.gov/reports/prison-rape-elimination-act-reports/prea-audit-full-compliance-reports/, https://dss.mo.gov/re/dysar.htm",6/30/2016,IMAGERY,2017-12-08T00:00:00.000Z,NOT AVAILABLE,JUVENILE,30,0.00655843879463,2.247727552e-06,36230.703125,804.05654302892,"29","021","002700","29021002700","27",Census Tract 27,G5020,S,350739494,4510296,"+39.6898354","-094.6730597",MO,-94.752122422389,39.7544048860791,"1","1"
1337,1728,"10003783",NM YOUTH DIAGNOSTIC DEVELOPMENT CENTER,4000 EDITH NE,ALBUQUERQUE,NM,"87197",NOT AVAILABLE,(505) 841-2400,STATE,OPEN,76,BERNALILLO,"35001",USA,"922140",CORRECTIONAL INSTITUTIONS,https://cyfd.org/about-cyfd/publications-reports,12/18/2017,IMAGERY,2017-12-18T00:00:00.000Z,http://www.nmjustice.net/nmsc/juvenile/program.php?id=6207,JUVENILE,108,0.0136973374909,5.772377455e-06,87452.01171875,1691.07177019284,"35","001","003400","35001003400","34",Census Tract 34,G5020,S,8255142,61240,"+35.1219385","-106.6185228",NM,-106.631485526627,35.1197807865438,,"2"
1338,1729,"10006562",MT. VERNON TREATMENT CENTER,500 STATE DRIVE,MT. VERNON,MO,"65712",NOT AVAILABLE,(417) 466-0292,STATE,OPEN,31,LAWRENCE,"29109",USA,"922140",CORRECTIONAL INSTITUTIONS,https://dss.mo.gov/reports/prison-rape-elimination-act-reports/prea-audit-full-compliance-reports/,5/4/2017,IMAGERY,2017-12-08T00:00:00.000Z,NOT AVAILABLE,JUVENILE,36,0.0062366781642,2.041883529e-06,31729.38671875,788.696421324034,"29","109","470200","29109470200","4702",Census Tract 4702,G5020,S,233873609,456481,"+37.1111335","-093.7913144",MO,-93.8355043216729,37.1112754343248,,"2"
1339,1730,"10001621",ROSA PARKS CENTER,211 W 12TH ST,FULTON,MO,"65251",NOT AVAILABLE,(573) 592-7227,STATE,OPEN,12,CALLAWAY,"29027",USA,"922140",CORRECTIONAL INSTITUTIONS,https://dss.mo.gov/reports/prison-rape-elimination-act-reports/prea-audit-full-compliance-reports/,2/13/2017,IMAGERY,2017-12-08T00:00:00.000Z,NOT AVAILABLE,JUVENILE,12,0.000712841416226,2.7494919e-08,437.5390625,86.4972936383033,"29","027","070400","29027070400","704",Census Tract 704,G5020,S,20297487,298035,"+38.8478672","-091.9631391",MO,-91.9508239421911,38.8581961394627,,"1"
1340,1731,"10005848",NORTHWEST REGIONAL YOUTH CENTER,4901 NORTHEAST BARRY ROAD,KANSAS CITY,MO,"64156","1279",(816) 437-3656,STATE,OPEN,28,CLAY,"29047",USA,"922140",CORRECTIONAL INSTITUTIONS,"https://dss.mo.gov/reports/prison-rape-elimination-act-reports/prea-audit-full-compliance-reports/, https://dss.mo.gov/re/dysar.htm",6/30/2016,IMAGERY,2017-12-08T00:00:00.000Z,NOT AVAILABLE,JUVENILE,30,0.00661772344984,1.773817072e-06,28383.01953125,797.34170993392,"29","047","021205","29047021205","212.05",Census Tract 212.05,G5020,S,13980823,15983,"+39.2560738","-094.5425055",MO,-94.5221812208341,39.2449416978304,,"1"
1341,1732,"10000462",ORANGE COUNTY WORK RELEASE CENTER,130 W KALEY ST,ORLANDO,FL,"32806",NOT AVAILABLE,(407) 836-3400,COUNTY,OPEN,46,ORANGE,"12095",USA,"922140",CORRECTIONAL INSTITUTIONS,"http://www.dc.state.fl.us/pub/jails/, http://www.orangecountyfl.net/JailInmateServices.aspx#.Wo3LVvnwbmG",2/21/2018,IMAGERY,2018-02-21T00:00:00.000Z,http://www.orangecountyfl.net/JailInmateServices.aspx#.Wo3LVvnwbmG,MINIMUM,308,0.00307060247459,5.68700284e-07,8020.607421875,364.927477738131,"12","095","018500","12095018500","185",Census Tract 185,G5020,S,3968937,55785,"+28.5224061","-081.3877536",FL,-81.3802234853854,28.5194366788997,"1","1"
1342,1733,"10003284",CHESTERFIELD WOMEN'S DETENTION AND DIVERSION CENTER,7000 COURTHOUSE RD,CHESTERFIELD,VA,"23832",NOT AVAILABLE,(804) 796-4242,STATE,OPEN,84,CHESTERFIELD,"51041",USA,"922140",CORRECTIONAL INSTITUTIONS,https://vadoc.virginia.gov/about/facts/,12/3/2014,IMAGERY,2018-01-22T00:00:00.000Z,https://vadoc.virginia.gov/community/community-facilities.shtm,MINIMUM,160,0.00355001632598,6.15217208e-07,9596.8671875,442.509488215231,"51","041","100821","51041100821","1008.21",Census Tract 1008.21,G5020,S,63932814,1294683,"+37.3647362","-077.5685609",VA,-77.5585293618552,37.401065107003,,"2"
1343,1734,"10004070",WENDELL E SEARS YOUTH CENTER,9400 SEARS LN,POPLAR BLUFF,MO,"63901",NOT AVAILABLE,(573) 840-9280,STATE,OPEN,53,BUTLER,"29023",USA,"922140",CORRECTIONAL INSTITUTIONS,https://dss.mo.gov/reports/prison-rape-elimination-act-reports/prea-audit-full-compliance-reports/,10/25/2016,IMAGERY,2017-12-08T00:00:00.000Z,NOT AVAILABLE,JUVENILE,60,0.00747588544617,2.60966252e-06,40419.03125,886.773863810394,"29","023","950201","29023950201","9502.01",Census Tract 9502.01,G5020,S,274223997,995155,"+36.8410740","-090.5647154",MO,-90.5116099876615,36.8609461222174,,"2"
1344,1735,"10003256",COLD SPRINGS DETENTION AND DIVERSION CENTER,192 SPITLER CIRCLE,GREENVILLE,VA,"24440",NOT AVAILABLE,(540) 569-3702,STATE,OPEN,112,AUGUSTA,"51015",USA,"922140",CORRECTIONAL INSTITUTIONS,https://vadoc.virginia.gov/about/facts/,1/22/2018,IMAGERY,2018-01-22T00:00:00.000Z,https://vadoc.virginia.gov/community/community-facilities.shtm,MINIMUM,-999,0.00423068144649,1.117626788e-06,17573.5390625,536.193010201959,"51","015","071000","51015071000","710",Census Tract 710,G5020,S,354893778,553264,"+38.0057096","-079.1963657",VA,-79.1501149748945,37.9919075228841,,"2"
1345,1736,"10006867",EDWARDS COUNTY DETENTION CENTER,404 WEST AUSTIN ST,ROCKSPRINGS,TX,"78880",NOT AVAILABLE,(830) 683-4104,COUNTY,OPEN,7,EDWARDS,"48137",USA,"922140",CORRECTIONAL INSTITUTIONS,"http://www.edwardscountysheriff.org/, https://www.tcjs.state.tx.us/index.php?linkID=325",3/1/2018,IMAGERY,2018-04-26T00:00:00.000Z,http://www.edwardscountysheriff.org/,NOT AVAILABLE,25,0.00109632039718,6.0378018e-08,864.1015625,131.428206569689,"48","137","950300","48137950300","9503",Census Tract 9503,G5020,S,5485259735,5199798,"+29.9858774","-100.3073732",TX,-100.210900370495,30.0173163352106,,"1"
1346,1737,"10004932",FLOYD COUNTY JAIL,311 HAUSS SQUARE,NEW ALBANY,IN,"47150",NOT AVAILABLE,(812) 948-5404,COUNTY,OPEN,-999,FLOYD,"18043",USA,"922140",CORRECTIONAL INSTITUTIONS,https://www.fcsdin.org/,3/5/2018,IMAGERY,2018-03-05T00:00:00.000Z,https://www.fcsdin.org/,NOT AVAILABLE,234,0.00422463212441,6.90007235e-07,10893.25390625,535.922218591818,"18","043","070500","18043070500","705",Census Tract 705,G5020,S,3003299,9015,"+38.2888875","-085.8250394",IN,-85.8253971894313,38.2845324787217,"9","1"
1347,1738,"10003247",HARRISONBURG DETENTION AND DIVERSION CENTER,6624 BEARD WOODS LANE,HARRISONBURG,VA,"22802",NOT AVAILABLE,(540) 833-2011,STATE,OPEN,115,ROCKINGHAM,"51165",USA,"922140",CORRECTIONAL INSTITUTIONS,https://vadoc.virginia.gov/about/facts/,4/6/2016,IMAGERY,2018-01-22T00:00:00.000Z,https://vadoc.virginia.gov/community/community-facilities.shtm,MINIMUM,124,0.00656088984197,1.786911556e-06,28306.96484375,819.220214124473,"51","165","010600","51165010600","106",Census Tract 106,G5020,S,91077605,234708,"+38.5164322","-078.8525662",VA,-78.816557865761,38.5318659734177,,"1"
1348,1739,"10006563",SIERRA OSAGE TREATMENT CENTER,9200 SEARS LANE,POPLAR BLUFF,MO,"63901",NOT AVAILABLE,(573) 840-9717,STATE,OPEN,20,BUTLER,"29023",USA,"922140",CORRECTIONAL INSTITUTIONS,https://dss.mo.gov/reports/prison-rape-elimination-act-reports/prea-audit-full-compliance-reports/,10/26/2016,IMAGERY,2017-12-08T00:00:00.000Z,NOT AVAILABLE,JUVENILE,24,0.00532723741631,1.144506539e-06,17726.16015625,678.802713807602,"29","023","950201","29023950201","9502.01",Census Tract 9502.01,G5020,S,274223997,995155,"+36.8410740","-090.5647154",MO,-90.5094546595805,36.8598284186703,,"2"
1349,1740,"10005864",MISSOURI HILLS CAMPUS - SPANISH LAKE,13312 BELLEFONTAINE ROAD,SAINT LOUIS,MO,"63138",NOT AVAILABLE,(314) 355-2642,STATE,OPEN,24,ST. LOUIS,"29189",USA,"922140",CORRECTIONAL INSTITUTIONS,"https://dss.mo.gov/reports/prison-rape-elimination-act-reports/prea-audit-full-compliance-reports/, https://dss.mo.gov/re/dysar.htm",6/30/2016,IMAGERY/OTHER,2017-12-08T00:00:00.000Z,NOT AVAILABLE,JUVENILE,20,0.000811473680831,3.8880873e-08,618.45703125,101.453740133487,"29","189","210100","29189210100","2101",Census Tract 2101,G5020,S,39086010,4961325,"+38.8034745","-090.1576849",MO,-90.2124619532338,38.826250713477,,"6"
1350,1741,"10005865",MISSOURI HILLS CAMPUS - TWIN RIVERS,13290 BELLEFONTAINE ROAD,SAINT LOUIS,MO,"63138",NOT AVAILABLE,(314) 355-4189,STATE,OPEN,19,ST. LOUIS,"29189",USA,"922140",CORRECTIONAL INSTITUTIONS,"https://dss.mo.gov/reports/prison-rape-elimination-act-reports/prea-audit-full-compliance-reports/, https://dss.mo.gov/re/dysar.htm",6/30/2016,IMAGERY/OTHER,2017-12-08T00:00:00.000Z,NOT AVAILABLE,JUVENILE,20,0.000755708123924,3.5264837e-08,560.93359375,97.3546431489045,"29","189","210100","29189210100","2101",Census Tract 2101,G5020,S,39086010,4961325,"+38.8034745","-090.1576849",MO,-90.2117734508508,38.8256486959552,,"6"
1351,1742,"10004050",WAVERLY REGIONAL YOUTH CENTER,109 W KELLING AVE,WAVERLY,MO,"64096",NOT AVAILABLE,(660) 493-2272,STATE,OPEN,46,LAFAYETTE,"29107",USA,"922140",CORRECTIONAL INSTITUTIONS,"https://dss.mo.gov/reports/prison-rape-elimination-act-reports/prea-audit-full-compliance-reports/, https://dss.mo.gov/re/dysar.htm",6/30/2016,IMAGERY,2017-12-08T00:00:00.000Z,NOT AVAILABLE,JUVENILE,40,0.00326407547109,5.20137009e-07,8318.63671875,395.37439315288,"29","107","090300","29107090300","903",Census Tract 903,G5020,S,237067879,6315854,"+39.1751392","-093.5886403",MO,-93.5192172900826,39.21017669451,,"1"
1352,1743,"10005887",COMMUNITY LEARNING CENTER,3990 WEST SUNSHINE STREET,SPRINGFIELD,MO,"65807",NOT AVAILABLE,(417) 888-4055,STATE,OPEN,10,GREENE,"29077",USA,"922140",CORRECTIONAL INSTITUTIONS,https://dss.mo.gov/reports/prison-rape-elimination-act-reports/prea-audit-full-compliance-reports/,5/5/2017,IMAGERY,2017-12-08T00:00:00.000Z,NOT AVAILABLE,JUVENILE,12,0.00119533045188,7.7945062e-08,1212.296875,145.688330390497,"29","077","004201","29077004201","42.01",Census Tract 42.01,G5020,S,8337985,2096,"+37.1686730","-093.3615114",MO,-93.3610177401463,37.1792745598982,,"2"
1353,1744,"10002172",BOOKING / RELEASE CENTER,3855 SOUTH JOHN YOUNG PARKWAY,ORLANDO,FL,"32839",NOT AVAILABLE,(407) 836-3400,COUNTY,OPEN,590,ORANGE,"12095",USA,"922140",CORRECTIONAL INSTITUTIONS,http://www.orangecountyfl.net/JailInmateServices.aspx#.Wo3LVvnwbmG,2/21/2018,IMAGERY,2018-02-21T00:00:00.000Z,http://www.orangecountyfl.net/JailInmateServices.aspx#.Wo3LVvnwbmG,MAXIMUM,592,0.00351668691268,7.42522975e-07,10470.55078125,414.662431424854,"12","095","014503","12095014503","145.03",Census Tract 145.03,G5020,S,1654519,364870,"+28.5020716","-081.4102035",FL,-81.4164113276596,28.5038352875391,,"6"
1354,1745,"10004609",OSCEOLA COUNTY CORRECTIONAL FACILITY,402 SIMPSON RD,KISSIMMEE,FL,"34744",NOT AVAILABLE,(407) 742-4444,COUNTY,OPEN,781,OSCEOLA,"12097",USA,"922140",CORRECTIONAL INSTITUTIONS,http://www.osceola.org/agencies-departments/corrections/index.stml,8/10/2017,IMAGERY,2018-02-21T00:00:00.000Z,http://www.osceola.org/agencies-departments/corrections/index.stml,MAXIMUM,873,0.00825904605278,3.644661614e-06,51293.685546875,974.393351110721,"12","097","042900","12097042900","429",Census Tract 429,G5020,S,25455312,11324519,"+28.2874147","-081.3302518",FL,-81.3525165378466,28.2957356971099,,"2"
1355,1746,"10003253",STAFFORD DETENTION AND DIVERSION CENTER,384 ESKIMO HILL RD,STAFFORD,VA,"22554",NOT AVAILABLE,(540) 659-2093,STATE,OPEN,109,STAFFORD,"51179",USA,"922140",CORRECTIONAL INSTITUTIONS,https://vadoc.virginia.gov/about/facts/,6/20/2017,IMAGERY,2018-01-22T00:00:00.000Z,https://vadoc.virginia.gov/community/community-facilities.shtm,MINIMUM,116,0.00605529847267,1.469277211e-06,23226.359375,749.941912918675,"51","179","010106","51179010106","101.06",Census Tract 101.06,G5020,S,61293479,7427236,"+38.3790248","-077.3640763",VA,-77.4203426211139,38.3802168048697,,"1"
1356,1747,"10003829",KENT COUNTY JUVENILE DETENTION CENTER,1501 CEDAR ST NE,GRAND RAPIDS,MI,"49503","1390",(616) 632-5750,COUNTY,OPEN,51,KENT,"26081",USA,"922140",CORRECTIONAL INSTITUTIONS,https://www.accesskent.com/Courts/JuvenileDetention/,3/21/2018,IMAGERY,2018-03-21T00:00:00.000Z,https://www.accesskent.com/Courts/JuvenileDetention/,JUVENILE,69,0.00668938988838,1.319437189e-06,22349.95703125,867.71340351825,"26","081","001101","26081001101","11.01",Census Tract 11.01,G5020,S,3922246,3962,"+42.9870456","-085.6306662",MI,-85.6326206313421,42.9819812132127,,"3"
1357,1748,"10006138",FOUNTAIN COUNTY JAIL,216 UNION STREET,COVINGTON,IN,"47932",NOT AVAILABLE,(765) 793-3545,COUNTY,OPEN,-999,FOUNTAIN,"18045",USA,"922140",CORRECTIONAL INSTITUTIONS,http://www.indianasheriffs.org/county-sheriff-map.aspx,3/5/2018,IMAGERY,2018-03-05T00:00:00.000Z,NOT AVAILABLE,NOT AVAILABLE,-999,0.00166753998727,1.55608586e-07,2522.22265625,205.240947788159,"18","045","957800","18045957800","9578",Census Tract 9578,G5020,S,122811639,1633697,"+40.1582526","-087.3507488",IN,-87.3977561646277,40.1351978280467,,"1"
1358,1749,"10001363",LAPEER COUNTY JAIL,3231 JOHN CONLEY DR,LAPEER,MI,"48446",NOT AVAILABLE,(810) 664-1801,COUNTY,OPEN,-999,LAPEER,"26087",USA,"922140",CORRECTIONAL INSTITUTIONS,http://lapeercountyweb.org/LapNew/index.php/departments/lapeer-county-sheriff,3/21/2018,IMAGERY,2018-03-21T00:00:00.000Z,http://lapeercountyweb.org/LapNew/index.php/departments/lapeer-county-sheriff,NOT AVAILABLE,123,0.00312462405529,4.2471999e-07,7200.375,412.234632269259,"26","087","336500","26087336500","3365",Census Tract 3365,G5020,S,309085,0,"+43.0347840","-083.3490585",MI,-83.352370592191,43.03361448663,,"2"
1359,1750,"10003007",SPRING MOUNTAIN YOUTH CAMP,2400 ANGEL PEAK PL,LAS VEGAS,NV,"89124",NOT AVAILABLE,(702) 455-5555,COUNTY,OPEN,-999,CLARK,"32003",USA,"922140",CORRECTIONAL INSTITUTIONS,http://www.clarkcountynv.gov/jjs/services/Pages/default.aspx,4/9/2018,IMAGERY,2018-04-09T00:00:00.000Z,http://www.clarkcountynv.gov/jjs/services/Pages/default.aspx,JUVENILE,100,0.00864238902394,2.974405419e-06,45745.64453125,1020.11443603332,"32","003","007500","32003007500","75",Census Tract 75,G5020,S,1769004048,15624,"+36.2560768","-115.6098388",NV,-115.584155859692,36.3186029580643,"1","1"
1360,1751,"10003242",WHITE POST MENS DETENTION CENTER,201 RAY OF HOPE LANE,WHITE POST,VA,"22663",NOT AVAILABLE,(540) 868-7026,STATE,CLOSED,0,CLARKE,"51043",USA,"922140",CORRECTIONAL INSTITUTIONS,http://www.nvdaily.com/news/local-news/2014/10/white-post-mens-diversion-center-to-close/,10/16/2014,IMAGERY,2018-01-22T00:00:00.000Z,https://vadoc.virginia.gov/community/community-facilities.shtm,MINIMUM,69,0.00764605302603,1.69998245e-06,27127.609375,977.972779763697,"51","043","010200","51043010200","102",Census Tract 102,G5020,S,161803842,1490423,"+39.0765553","-078.0625801",VA,-78.1376515049449,39.0532840880875,,"1"
1361,1752,"10006672",APPALACHIAN DETENTION AND DIVERSION CENTER,924 CLIFTON FARM ROAD,HONAKER,VA,"24260",NOT AVAILABLE,(276) 889-7671,STATE,OPEN,53,RUSSELL,"51167",USA,"922140",CORRECTIONAL INSTITUTIONS,https://vadoc.virginia.gov/about/facts/,6/6/2017,IMAGERY,2018-01-22T00:00:00.000Z,https://vadoc.virginia.gov/community/community-facilities.shtm,MINIMUM,106,0.00573094975948,1.674204172e-06,25977.02734375,706.746424047221,"51","167","030402","51167030402","304.02",Census Tract 304.02,G5020,S,202622155,1945578,"+36.9579691","-081.8912387",VA,-81.9288306486019,36.9976597395323,,"1"
1362,1753,"10003332",MECKLENBURG CORRECTIONAL CENTER,960 PRISON RD,BOYDTON,VA,"23917",NOT AVAILABLE,NOT AVAILABLE,STATE,CLOSED,0,MECKLENBURG,"51117",USA,"922140",CORRECTIONAL INSTITUTIONS,"http://www.vadoc.state.va.us/facilities/central/mecklenburg/default.shtm, http://hamptonroads.com/2011/12/correctional-center-near-emporia-close",12/13/2011,IMAGERY,2018-01-22T00:00:00.000Z,NOT AVAILABLE,MAXIMUM,-999,0.0112193545567,8.513529302e-06,131515.640625,1365.88907172665,"51","117","930600","51117930600","9306",Census Tract 9306,G5020,S,270034063,48384309,"+36.6354841","-078.3953766",VA,-78.3637353336158,36.6607067895573,,"3"
1363,1754,"10000922",CULPEPER JUVENILE CORRECTIONAL CENTER,12240 COFFEEWOOD DR,MITCHELLS,VA,"22729",NOT AVAILABLE,NOT AVAILABLE,STATE,CLOSED,0,CULPEPER,"51047",USA,"922140",CORRECTIONAL INSTITUTIONS,http://www.starexponent.com/news/planned-culpeper-women-s-prison-delayed-again/article_4be9a536-f2ff-5e34-bb7a-495e64ff134a.html,7/12/2017,IMAGERY,2018-01-22T00:00:00.000Z,NOT AVAILABLE,JUVENILE,250,0.0109321093131,6.60641899e-06,104407.46875,1366.66222385511,"51","047","930501","51047930501","9305.01",Census Tract 9305.01,G5020,S,135615386,792586,"+38.3621033","-078.0684367",VA,-78.0262610048324,38.3616208257044,,"2"
1364,1755,"10001600",SOUTHAMPTON MEN'S DETENTION CENTER,14380 TERRAPIN DR,CAPRON,VA,"23829",NOT AVAILABLE,(434) 658-4174,STATE,CLOSED,0,SOUTHAMPTON,"51175",USA,"922140",CORRECTIONAL INSTITUTIONS,https://vadoc.virginia.gov/news/press-releases/16Aug9_southamptoncoldsprings.shtm,8/9/2016,IMAGERY,2018-01-22T00:00:00.000Z,http://vadoc.virginia.gov/facilities/eastern/southampton/,NOT AVAILABLE,-999,0.00635805225548,2.416646707e-06,37359.390625,771.024064304455,"51","175","200300","51175200300","2003",Census Tract 2003,G5020,S,10719196,84844,"+36.7371266","-077.2510665",VA,-77.2592183816823,36.7171557043779,,"7"
1365,1756,"10006564",WILSON CREEK,3992 WEST SUNSHINE,SPRINGFIELD,MO,"65807",NOT AVAILABLE,(417) 888-4050,STATE,OPEN,7,GREENE,"29077",USA,"922140",CORRECTIONAL INSTITUTIONS,"https://dss.mo.gov/reports/prison-rape-elimination-act-reports/prea-audit-full-compliance-reports/, https://dss.mo.gov/re/dysar.htm",6/30/2016,IMAGERY,2017-12-08T00:00:00.000Z,NOT AVAILABLE,JUVENILE,10,0.000962291079535,5.7025841e-08,886.921875,122.305882664864,"29","077","004201","29077004201","42.01",Census Tract 42.01,G5020,S,8337985,2096,"+37.1686730","-093.3615114",MO,-93.3612706968363,37.1784044641311,,"2"
1366,1757,"10004048",NORTHEAST COMMUNITY TREATMENT CENTER,710 S CLARK ST,MEXICO,MO,"65265",NOT AVAILABLE,NOT AVAILABLE,STATE,CLOSED,0,AUDRAIN,"29007",USA,"922140",CORRECTIONAL INSTITUTIONS,"https://dss.mo.gov/re/pdf/dys/youth-services-annual-report-fy13.pdf, https://dss.mo.gov/re/pdf/dys/youth-services-annual-report-fy14.pdf",12/8/2017,IMAGERY,2017-12-08T00:00:00.000Z,NOT AVAILABLE,JUVENILE,-999,0.00140533752743,1.09208663e-07,1745.51171875,171.410618495745,"29","007","950700","29007950700","9507",Census Tract 9507,G5020,S,29058314,928854,"+39.1441034","-091.8647962",MO,-91.8848571958948,39.1666080856502,"1","1"
1367,1758,"10000514",PALM BEACH COUNTY CENTRAL DETENTION CENTER,673 FAIRGROUNDS RD,WEST PALM BEACH,FL,"33411",NOT AVAILABLE,(561) 992-1580,COUNTY,CLOSED,0,PALM BEACH,"12099",USA,"922140",CORRECTIONAL INSTITUTIONS,http://www.pbso.org/inside-pbso/corrections/general/,2/21/2018,IMAGERY,2018-02-21T00:00:00.000Z,http://www.pbso.org/index.cfm?fa=corrections_IMB&ID=317,MAXIMUM,967,0.0113804949164,7.471642334e-06,103627.19140625,1363.3065829196,"12","099","007818","12099007818","78.18",Census Tract 78.18,G5020,S,5591854,196372,"+26.6952972","-080.1962779",FL,-80.1935441266637,26.686166845332,,"5"
1368,1759,"10003264",NATURAL BRIDGE JUVENILE CORRECTIONAL CENTER,1425 ARNOLDS VALLEY RD,NATURAL BRIDGE STATION,VA,"24579",NOT AVAILABLE,NOT AVAILABLE,STATE,CLOSED,0,ROCKBRIDGE,"51163",USA,"922140",CORRECTIONAL INSTITUTIONS,http://www.roanoke.com/webmin/news/juvenile-detention-center-shuttered/article_3ce1a30a-457b-5ffc-a2a2-8f87baf4980c.html,9/16/2009,IMAGERY,2018-01-22T00:00:00.000Z,NOT AVAILABLE,JUVENILE,71,0.00846408054654,2.832559899e-06,44294.57421875,1036.8749714006,"51","163","930400","51163930400","9304",Census Tract 9304,G5020,S,214328099,2362635,"+37.6325969","-079.4611352",VA,-79.5083438578063,37.5850973476601,,"1"
1369,1760,"10003294",TAZEWELL CORRECTIONAL UNIT #31,1245 CLEARFORK RD,TAZEWELL,VA,"24651",NOT AVAILABLE,NOT AVAILABLE,STATE,CLOSED,0,TAZEWELL,"51185",USA,"922140",CORRECTIONAL INSTITUTIONS,https://vadoc.virginia.gov/about/facts/managementInformationSummaries/2009.pdf,6/30/2009,IMAGERY,2018-01-22T00:00:00.000Z,NOT AVAILABLE,MINIMUM,-999,0.00533099913951,9.98773829e-07,15527.0078125,668.390384783711,"51","185","021100","51185021100","211",Census Tract 211,G5020,S,126653989,175318,"+37.1729181","-081.3874435",VA,-81.3982326457869,37.1443493749938,,"1"
1370,1761,"10000520",PALM BEACH COUNTY MAIN DETENTION CENTER,3228 GUN CLUB RD,WEST PALM BEACH,FL,"33406","3001",(561) 688-4400,COUNTY,OPEN,1769,PALM BEACH,"12099",USA,"922140",CORRECTIONAL INSTITUTIONS,http://www.pbso.org/,2/21/2018,IMAGERY,2018-02-21T00:00:00.000Z,http://www.pbso.org/,MAXIMUM,2166,0.0111985017905,4.235811814e-06,58740.201171875,1314.66448057623,"12","099","003800","12099003800","38",Census Tract 38,G5020,S,6337336,379833,"+26.6698070","-080.0944886",FL,-80.0923486096156,26.6707115415766,,"1"
1371,1762,"10006141",FRANKLIN COUNTY JAIL / SHERIFF,371 MAIN STREET,BROOKVILLE,IN,"47012",NOT AVAILABLE,(765) 647-4138,COUNTY,OPEN,-999,FRANKLIN,"18047",USA,"922140",CORRECTIONAL INSTITUTIONS,http://www.franklincounty.in.gov/countyoffices/sheriff/,3/5/2018,IMAGERY,2018-03-05T00:00:00.000Z,http://www.franklincounty.in.gov/countyoffices/sheriff/,NOT AVAILABLE,-999,0.00193437199243,1.93298567e-07,3100.66796875,233.9362958323,"18","047","969700","18047969700","9697",Census Tract 9697,G5020,S,17756344,120607,"+39.4272991","-084.9834891",IN,-85.012419659954,39.4182549288148,,"1"
1372,1763,"10006565",FULTON STATE HOSPITAL,600 EAST 5TH STREET,FULTON,MO,"65251",NOT AVAILABLE,(573) 592-4100,STATE,OPEN,-999,CALLAWAY,"29027",USA,"922140",CORRECTIONAL INSTITUTIONS,https://dmh.mo.gov/fulton/,12/8/2017,IMAGERY,2017-12-08T00:00:00.000Z,https://dmh.mo.gov/fulton/,NOT AVAILABLE,-999,0.0156644333991,1.3822800421e-05,219937.38671875,1947.02064379783,"29","027","070300","29027070300","703",Census Tract 703,G5020,S,31216261,443222,"+38.8513012","-091.9235718",MO,-91.9372467589036,38.8469599047085,,"9"
1373,1764,"10005856",BIGGS FORENSIC CENTER,600 EAST 5TH STREET,FULTON,MO,"65251",NOT AVAILABLE,(573) 592-4100,STATE,OPEN,-999,CALLAWAY,"29027",USA,"922140",CORRECTIONAL INSTITUTIONS,https://dmh.mo.gov/fulton/,12/8/2017,IMAGERY,2017-12-08T00:00:00.000Z,https://dmh.mo.gov/fulton/,MAXIMUM,186,0.0088456894179,4.781879454e-06,76084.08203125,1089.26913537268,"29","027","070300","29027070300","703",Census Tract 703,G5020,S,31216261,443222,"+38.8513012","-091.9235718",MO,-91.9324364323105,38.8456790673995,,"9"
1374,1765,"10005609",FULTON COUNTY JAIL,815 MADISON ST,ROCHESTER,IN,"46975",NOT AVAILABLE,(574) 224-5630,COUNTY,OPEN,133,FULTON,"18049",USA,"922140",CORRECTIONAL INSTITUTIONS,http://www.co.fulton.in.us/department/division.php?structureid=56,3/5/2018,IMAGERY,2018-03-05T00:00:00.000Z,http://www.co.fulton.in.us/department/division.php?structureid=56,NOT AVAILABLE,35,0.00183955483722,1.93883333e-07,3186.66015625,236.502053859608,"18","049","953100","18049953100","9531",Census Tract 9531,G5020,S,9461949,17413,"+41.0581803","-086.2145572",IN,-86.2140098768288,41.0655438664994,"8","1"
1375,1766,"10006610",CAMINO NUEVO YOUTH CENTER,4050 EDITH BLVD,ALBUQUERQUE,NM,"87107",NOT AVAILABLE,(505) 383-3829,STATE,OPEN,65,BERNALILLO,"35001",USA,"922140",CORRECTIONAL INSTITUTIONS,https://cyfd.org/about-cyfd/publications-reports,12/18/2017,IMAGERY,2017-12-18T00:00:00.000Z,http://www.nmjustice.net/nmsc/juvenile/program.php?id=5327,JUVENILE,96,0.0045480146764,1.152737505e-06,17463.71484375,553.522268344562,"35","001","003400","35001003400","34",Census Tract 34,G5020,S,8255142,61240,"+35.1219385","-106.6185228",NM,-106.629877536643,35.1181485088525,,"2"
1376,1767,"10001106",ANTHONY CORRECTIONAL CENTER,313 ANTHONY CENTER DRIVE,WHITE SULPHUR SPRINGS,WV,"24986",NOT AVAILABLE,(304) 536-3911,STATE,OPEN,220,GREENBRIER,"54025",USA,"922140",CORRECTIONAL INSTITUTIONS,"http://www.wvdoc.com/wvdoc/PrisonsandFacilities/tabid/36/Default.aspx, http://www.wvdoc.com/wvdoc/OfficeofResearchPlanning/tabid/70/Default.aspx",1/22/2018,IMAGERY,2018-01-22T00:00:00.000Z,http://www.wvdoc.com/wvdoc/PrisonsandFacilities/tabid/36/Default.aspx,MINIMUM,220,0.00837895221324,3.526241388e-06,55424.89453125,1037.7113348431,"54","025","950100","54025950100","9501",Census Tract 9501,G5020,S,626540245,3722915,"+37.9468237","-080.1831961",WV,-80.1265952224308,37.9632409867839,"1","1"
1377,1768,"10003178",ALBANY COUNTY CORRECTIONAL FACILITY,840 ALBANY SHAKER RD,ALBANY,NY,"12211",NOT AVAILABLE,(518) 869-2600,COUNTY,OPEN,800,ALBANY,"36001",USA,"922140",CORRECTIONAL INSTITUTIONS,http://www.albanycounty.com/Government/Departments/CountySheriff.aspx,4/9/2018,IMAGERY/OTHER,2018-04-09T00:00:00.000Z,http://www.albanycounty.com/Government/Departments/CountySheriff.aspx,NOT AVAILABLE,1043,0.00988391616041,5.304280389e-06,89514.53515625,1228.33061836229,"36","001","013703","36001013703","137.03",Census Tract 137.03,G5020,S,16133183,120545,"+42.7453514","-073.8147594",NY,-73.816578193508,42.7516426885158,,"2"
1378,1769,"10000516",PALM BEACH COUNTY WEST DETENTION CENTER,38811 JAMES WHEELER WAY,BELLE GLADE,FL,"33430",NOT AVAILABLE,(561) 992-1580,COUNTY,OPEN,614,PALM BEACH,"12099",USA,"922140",CORRECTIONAL INSTITUTIONS,http://www.pbso.org/,2/21/2018,IMAGERY,2018-02-21T00:00:00.000Z,http://www.pbso.org/,MAXIMUM,998,0.00565090659572,1.443704807e-06,20030.05859375,673.485532317261,"12","099","008101","12099008101","81.01",Census Tract 81.01,G5020,S,92915262,0,"+26.7302019","-080.6509221",FL,-80.6652052545599,26.7244824293956,,"2"
1379,1770,"10006894",HOMER COMMUNITY JAIL,4060 HEATH ST,HOMER,AK,"99603",NOT AVAILABLE,(907) 235-4158,LOCAL,OPEN,-999,KENAI PENINSULA BOROUGH,"02122",USA,"922140",CORRECTIONAL INSTITUTIONS,https://www.cityofhomer-ak.gov/police,5/11/2018,IMAGERY,2018-05-11T00:00:00.000Z,NOT AVAILABLE,NOT AVAILABLE,7,0.00128664064102,1.00780475e-07,2471.6015625,203.060613717729,"02","122","001000","02122001000","10",Census Tract 10,G5020,S,25118829,56904033,"+59.6204430","-151.4572638",AK,-151.529276335626,59.6493468401619,,"1"
1380,1771,"10002776",ELLIS COUNTY JAIL,300 S JACKSON ST,WAXAHACHIE,TX,"75165",NOT AVAILABLE,(972) 825-4931,COUNTY,OPEN,463,ELLIS,"48139",USA,"922140",CORRECTIONAL INSTITUTIONS,http://elliscountysheriff.com/index.php,4/26/2018,IMAGERY,2018-04-26T00:00:00.000Z,http://elliscountysheriff.com/index.php,MAXIMUM,856,0.00489675476158,8.84818766e-07,12983.921875,593.698905281877,"48","139","060400","48139060400","604",Census Tract 604,G5020,S,22056589,1259938,"+32.3607682","-096.8256498",TX,-96.847976060248,32.3834800476874,,"1"
1381,1772,"10001108",BECKLEY CORRECTIONAL CENTER,111 S EISENHOWER DRIVE,BECKLEY,WV,"25801",NOT AVAILABLE,(304) 256-6780,STATE,OPEN,137,RALEIGH,"54081",USA,"922140",CORRECTIONAL INSTITUTIONS,http://www.wvdoc.com/wvdoc/PrisonsandFacilities/tabid/36/Default.aspx,1/22/2018,IMAGERY,2018-01-22T00:00:00.000Z,http://www.wvdoc.com/wvdoc/PrisonsandFacilities/tabid/36/Default.aspx,MINIMUM,137,0.00363874217324,2.58436026e-07,4052.25,440.060946250249,"54","081","000400","54081000400","4",Census Tract 4,G5020,S,2937358,1310,"+37.7866509","-081.1733870",WV,-81.1653284791696,37.7850453214811,,"1"
1382,1773,"10000477",PINELLAS COUNTY JAIL,14400 49TH ST N,CLEARWATER,FL,"33762","2877",(727) 464-6415,COUNTY,OPEN,3000,PINELLAS,"12103",USA,"922140",CORRECTIONAL INSTITUTIONS,https://www.pcsoweb.com/,2/21/2018,IMAGERY,2018-02-21T00:00:00.000Z,https://www.pcsoweb.com/,MAXIMUM,4389,0.019941730838,8.732579975e-06,122449.9375,2325.68950713976,"12","103","024510","12103024510","245.10",Census Tract 245.10,G5020,S,2568703,104440,"+27.9045518","-082.7068218",FL,-82.7050968694745,27.9026644843336,,"4"
1383,1774,"10004054",GUHLEMAN FORENSIC CENTER,600 EAST 5TH ST,FULTON,MO,"65251",NOT AVAILABLE,(573) 592-4100,STATE,OPEN,-999,CALLAWAY,"29027",USA,"922140",CORRECTIONAL INSTITUTIONS,https://dmh.mo.gov/fulton/,12/8/2017,IMAGERY/OTHER,2017-12-08T00:00:00.000Z,https://dmh.mo.gov/fulton/,MEDIUM,91,0.00767617689132,3.791581962e-06,60325.265625,940.927887210857,"29","027","070300","29027070300","703",Census Tract 703,G5020,S,31216261,443222,"+38.8513012","-091.9235718",MO,-91.9327377830073,38.8429704764302,,"9"
1384,1775,"10002179",CENTRAL COUNTY JAIL,2390 BOB PHILLIPS RD,BARTOW,FL,"33830",NOT AVAILABLE,(863) 534-6123,COUNTY,OPEN,782,POLK,"12105",USA,"922140",CORRECTIONAL INSTITUTIONS,"http://www.dc.state.fl.us/pub/jails/, http://www.polksheriff.org/InsidePCSO/Detention/Pages/Detention.aspx",2/21/2018,IMAGERY,2018-02-21T00:00:00.000Z,http://www.polksheriff.org/InsidePCSO/Detention/Pages/Detention.aspx,MAXIMUM,800,0.00970490735171,4.60675736e-06,64584.83984375,1157.74698030736,"12","105","015200","12105015200","152",Census Tract 152,G5020,S,9993533,342454,"+27.8827922","-081.8193579",FL,-81.8194719569099,27.8825395282106,"1","5"
1385,1776,"10001619",HEARNES FORENSIC CENTER,600 EAST 5TH ST,FULTON,MO,"65251",NOT AVAILABLE,(573) 592-4100,STATE,OPEN,-999,CALLAWAY,"29027",USA,"922140",CORRECTIONAL INSTITUTIONS,https://dmh.mo.gov/fulton/,12/8/2017,IMAGERY,2017-12-08T00:00:00.000Z,https://dmh.mo.gov/fulton/,NOT AVAILABLE,24,0.00721341824871,2.685788511e-06,42730.95703125,936.489673334694,"29","027","070300","29027070300","703",Census Tract 703,G5020,S,31216261,443222,"+38.8513012","-091.9235718",MO,-91.9305734603743,38.8416756356932,,"9"
1386,1777,"10003836",MACOMB COUNTY JUVENILE JUSTICE CENTER,400 NORTH ROSE,MOUNT CLEMENS,MI,"48043",NOT AVAILABLE,(586) 469-5375,COUNTY,OPEN,87,MACOMB,"26099",USA,"922140",CORRECTIONAL INSTITUTIONS,http://jjc.macombgov.org/JJC-Home,3/21/2018,IMAGERY,2018-03-21T00:00:00.000Z,http://jjc.macombgov.org/JJC-Home,JUVENILE,140,0.00895943879387,1.956356869e-06,32943.1796875,1133.90175972334,"26","099","245200","26099245200","2452",Census Tract 2452,G5020,S,2042692,3275,"+42.6068764","-082.8926592",MI,-82.8932384770817,42.6158228100301,"3","2"
1387,1778,"10004931",GIBSON COUNTY JAIL,112 E EMERSON ST,PRINCETON,IN,"47670",NOT AVAILABLE,(812) 385-3496,COUNTY,OPEN,140,GIBSON,"18051",USA,"922140",CORRECTIONAL INSTITUTIONS,http://www.gibsoncountysheriff.com/index.php?page=1,3/5/2018,IMAGERY,2018-03-05T00:00:00.000Z,http://www.gibsoncountysheriff.com/index.php?page=1,NOT AVAILABLE,100,0.00315584482158,4.18840697e-07,6618.96484375,384.437513037771,"18","051","050501","18051050501","505.01",Census Tract 505.01,G5020,S,9235449,125437,"+38.3486676","-087.5482947",IN,-87.566919724029,38.3575244402186,"2","1"
1388,1779,"10006793",MAURICE SPEAR CAMPUS,1910 AIRPORT ROAD,ADRIAN,MI,"49221",NOT AVAILABLE,(517) 265-5171,COUNTY,OPEN,-999,LENAWEE,"26091",USA,"922140",CORRECTIONAL INSTITUTIONS,https://www.lenawee.mi.us/229/Maurice-Spear-Campus,3/21/2018,IMAGERY,2018-03-21T00:00:00.000Z,https://www.lenawee.mi.us/229/Maurice-Spear-Campus,JUVENILE,66,0.00860306439127,4.514287491e-06,75130.10546875,1147.38974225044,"26","091","061700","26091061700","617",Census Tract 617,G5020,S,82335445,670473,"+41.8527313","-084.0730603",MI,-84.0687763778653,41.8760454090026,,"2"
1389,1780,"10005148",MACKINAC COUNTY JAIL,100 SOUTH MARLEY STREET,SAINT IGNACE,MI,"49781",NOT AVAILABLE,(906) 643-7325,COUNTY,OPEN,24,MACKINAC,"26097",USA,"922140",CORRECTIONAL INSTITUTIONS,http://www.michigan.gov/documents/corrections/JPIS_-_CY_2010_344047_7.pdf,3/21/2018,IMAGERY/OTHER,2018-03-21T00:00:00.000Z,http://www.mackinaccounty.net/departments/sheriffs-office/,NOT AVAILABLE,28,0.00249421599846,2.27803959e-07,4054.00390625,351.663464587089,"26","097","950500","26097950500","9505",Census Tract 9505,G5020,S,99626779,39650680,"+45.7707630","-084.4779593",MI,-84.7334379760538,45.8660380839239,"1","2"
1390,1781,"10001343",MARQUETTE COUNTY JAIL,236 W BARAGA AVE,MARQUETTE,MI,"49855",NOT AVAILABLE,NOT AVAILABLE,COUNTY,OPEN,-999,MARQUETTE,"26103",USA,"922140",CORRECTIONAL INSTITUTIONS,http://www.co.marquette.mi.us/departments/sheriff_s_office/index.php#.WrJtdfnwbmE,3/21/2018,UNVERIFIED,2018-03-21T00:00:00.000Z,http://www.co.marquette.mi.us/departments/sheriff_s_office/index.php#.WrJtdfnwbmE,NOT AVAILABLE,80,0.00195560816095,2.05201153e-07,3696.953125,280.118585743907,"26","103","000300","26103000300","3",Census Tract 3,G5020,S,1796546,2594021,"+46.5402528","-087.3914966",MI,-87.3978763173478,46.5418552061268,"2","1"
1391,1782,"10005245",ALLEGANY COUNTY JAIL,4884 STATE ROUTE 19S,BELMONT,NY,"14813","9506",NOT AVAILABLE,COUNTY,OPEN,121,ALLEGANY,"36003",USA,"922140",CORRECTIONAL INSTITUTIONS,http://www.alleganyco.com/departments/sheriffs-office/,4/9/2018,IMAGERY,2018-04-09T00:00:00.000Z,http://www.alleganyco.com/departments/sheriffs-office/,NOT AVAILABLE,-999,0.00849133931495,1.700562436e-06,28452.56640625,1066.00363988177,"36","003","950600","36003950600","9506",Census Tract 9506,G5020,S,155813034,235822,"+42.2035897","-078.0442590",NY,-78.016300623236,42.2130779135135,"1","1"
1392,1783,"10005383",BRIDEWELL DETENTION FACILITY,4203 ROLEKE DRIVE,BETHANY,MO,"64424",NOT AVAILABLE,NOT AVAILABLE,STATE,CLOSED,0,HARRISON,"29081",USA,"922140",CORRECTIONAL INSTITUTIONS,"http://www.desmoinescatholicworker.org/Frankreport3.pdf, http://www.newspressnow.com/news/local_news/article_8a1314d4-add2-5f28-8925-a816fa4f9d5b.html",1/1/2013,IMAGERY,2017-12-08T00:00:00.000Z,NOT AVAILABLE,NOT AVAILABLE,240,0.00339875295341,7.14790142e-07,11609.27734375,431.361329728909,"29","081","950300","29081950300","9503",Census Tract 9503,G5020,S,18115270,281442,"+40.2703547","-094.0262133",MO,-94.0091589818601,40.2719714845319,,"2"
1393,1784,"10001625",CENTRAL MISSOURI CORRECTIONAL CENTER,2600 STATE HWY 179,JEFFERSON CITY,MO,"65109",NOT AVAILABLE,NOT AVAILABLE,STATE,CLOSED,0,COLE,"29051",USA,"922140",CORRECTIONAL INSTITUTIONS,https://www.sos.mo.gov/BlueBook/2011-2012/6_Corr.pdf,1/1/2013,IMAGERY,2017-12-08T00:00:00.000Z,NOT AVAILABLE,MAXIMUM,1000,0.013087727977,7.009654258e-06,111209.203125,1607.670649715,"29","051","020600","29051020600","206",Census Tract 206,G5020,S,165734182,4152848,"+38.6344528","-092.3634544",MO,-92.2783686982984,38.6400078337772,,"1"
1394,1785,"10006284",SAIPAN CORRECTIONAL FACILITY,NOT AVAILABLE,SUSUPE,MP,"96950",NOT AVAILABLE,(670) 236-9700,STATE,OPEN,-999,NOT AVAILABLE,NOT AVAILABLE,MNP,"922140",CORRECTIONAL INSTITUTIONS,https://www.justice.gov/crt/guam-findings-letter,12/8/2017,IMAGERY,2017-12-08T00:00:00.000Z,http://www.doc.gov.mp/,NOT AVAILABLE,64,0.00340954459604,6.79497617e-07,8723.861328125,385.741974685525,"69","110","000800","69110000800","8",Census Tract 8,G5020,S,1844665,185857,"+15.1548769","+145.7085290",MP,145.707343970345,15.1576899969308,,"1"
1395,1786,"10004248",CENTRAL MISSISSIPPI CORRECTIONAL FACILITY,3794 STATE HWY 468,PEARL,MS,"39208",NOT AVAILABLE,(601) 932-2880,STATE,OPEN,3484,RANKIN,"28121",USA,"922140",CORRECTIONAL INSTITUTIONS,http://www.mdoc.ms.gov/Admin-Finance/Pages/Monthly-Facts.aspx,12/4/2017,IMAGERY,2017-12-08T00:00:00.000Z,http://www.mdoc.ms.gov/Pages/Facility-Locations.aspx,MAXIMUM,3750,0.0374300000214,4.3168831383e-05,632376.30859375,4455.11402847237,"28","121","020500","28121020500","205",Census Tract 205,G5020,S,13991499,860,"+32.2314015","-090.0823643",MS,-90.0589954765916,32.2277132022424,,"2"
1396,1787,"10001807",MISSISSIPPI STATE PENITENTIARY,US HWY 49 W,PARCHMAN,MS,"38738",NOT AVAILABLE,(662) 745-6611,STATE,OPEN,3289,SUNFLOWER,"28133",USA,"922140",CORRECTIONAL INSTITUTIONS,http://www.mdoc.ms.gov/Admin-Finance/Pages/Monthly-Facts.aspx,12/4/2017,IMAGERY,2017-12-08T00:00:00.000Z,http://www.mdoc.ms.gov/Pages/Facility-Locations.aspx,MAXIMUM,3590,0.107479157941,0.000402279170367,6007875.4609375,13149.7188755612,"28","133","950100","28133950100","9501",Census Tract 9501,G5020,S,473509512,1439657,"+33.8807374","-090.5523808",MS,-90.5455116883473,33.9265661032126,,"1"
1397,1788,"10005615",GRANT COUNTY JAIL,214 EAST 4TH ST,MARION,IN,"46952",NOT AVAILABLE,(765) 668-6583,COUNTY,OPEN,281,GRANT,"18053",USA,"922140",CORRECTIONAL INSTITUTIONS,http://sheriff.grantcounty27.us/,3/5/2018,IMAGERY,2018-03-05T00:00:00.000Z,http://sheriff.grantcounty27.us/,NOT AVAILABLE,-999,0.00181844273091,1.70804315e-07,2785.92578125,229.69249111466,"18","053","000100","18053000100","1",Census Tract 1,G5020,S,3217164,0,"+40.5582045","-085.6624695",IN,-85.6577681999302,40.5575398030614,"1","2"
1398,1789,"10006673",CHARLESTON CORRECTIONAL CENTER,1356 HANSFORD STREET,CHARLESTON,WV,"25301",NOT AVAILABLE,(304) 340-6921,STATE,OPEN,-999,KANAWHA,"54039",USA,"922140",CORRECTIONAL INSTITUTIONS,http://www.wvdoc.com/wvdoc/OfficeofResearchPlanning/tabid/70/Default.aspx,1/22/2018,IMAGERY/OTHER,2018-01-22T00:00:00.000Z,http://www.wvdoc.com/wvdoc/OfficeofResearchPlanning/tabid/70/Default.aspx,MINIMUM,128,0.00336990924082,5.97252683e-07,9437.15625,421.692091060547,"54","039","001200","54039001200","12",Census Tract 12,G5020,S,867755,0,"+38.3456835","-081.6200424",WV,-81.6191454590805,38.3478214120252,"2","1"
1399,1790,"10003190",BROOME COUNTY CORRECTIONAL FACILITY,155 LT. VANWINKLE DRIVE,BINGHAMTON,NY,"13905",NOT AVAILABLE,NOT AVAILABLE,COUNTY,OPEN,505,BROOME,"36007",USA,"922140",CORRECTIONAL INSTITUTIONS,"https://data.ny.gov/Public-Safety/Jail-Population-By-County-Beginning-1997/nymx-kgkn/data, http://www.gobroomecounty.com/sheriff",4/9/2018,IMAGERY,2018-04-09T00:00:00.000Z,http://www.gobroomecounty.com/sheriff,MAXIMUM,536,0.0100519576649,3.307420854e-06,55265.97265625,1339.19130312729,"36","007","012800","36007012800","128",Census Tract 128,G5020,S,12342855,259439,"+42.1305335","-075.9181575",NY,-75.9167917295249,42.1314698211536,,"1"
1400,1791,"10006611",JOHN PAUL TAYLOR CENTER,10015 ROBERT LARSON BLVD,LAS CRUCES,NM,"88007",NOT AVAILABLE,(575) 827-7629,STATE,OPEN,46,DONA ANA,"35013",USA,"922140",CORRECTIONAL INSTITUTIONS,https://cyfd.org/about-cyfd/publications-reports,12/18/2017,IMAGERY,2017-12-18T00:00:00.000Z,http://www.nmjustice.net/nmsc/juvenile/program.php?id=5243,JUVENILE,48,0.00569077343186,2.038078733e-06,29868.71875,693.831659129022,"35","013","001500","35013001500","15",Census Tract 15,G5020,S,1586024543,733685,"+32.3444876","-107.0502871",NM,-106.940605750113,32.2675195840898,,"3"
1401,1792,"10000431",PUTNAM COUNTY JAIL,130 ORIE GRIFFIN BLVD,PALATKA,FL,"32177",NOT AVAILABLE,(386) 329-0854,COUNTY,OPEN,312,PUTNAM,"12107",USA,"922140",CORRECTIONAL INSTITUTIONS,http://www.dc.state.fl.us/pub/jails/,2/21/2018,IMAGERY,2018-02-21T00:00:00.000Z,http://putnamsheriff.org/en/home/,MAXIMUM,-999,0.00650140758354,1.587185556e-06,22635.962890625,774.678465599398,"12","107","950600","12107950600","9506",Census Tract 9506,G5020,S,40695289,1478482,"+29.6455851","-081.6924491",FL,-81.6623670672099,29.6686271041906,,"1"
1402,1793,"10000028",DENMAR CORRECTIONAL CENTER,4319 DENMAR ROAD,HILLSBORO,WV,"24946",NOT AVAILABLE,(304) 653-4201,STATE,OPEN,232,POCAHONTAS,"54075",USA,"922140",CORRECTIONAL INSTITUTIONS,http://www.wvdoc.com/wvdoc/OfficeofResearchPlanning/tabid/70/Default.aspx,1/22/2018,IMAGERY,2018-01-22T00:00:00.000Z,http://www.wvdoc.com/wvdoc/PrisonsandFacilities/tabid/36/Default.aspx,MEDIUM,216,0.009435803712,3.238118324e-06,50981.27734375,1159.8189394614,"54","075","960300","54075960300","9603",Census Tract 9603,G5020,S,641751299,2100988,"+38.1889625","-080.2060484",WV,-80.2205037682501,38.0856056974197,,"1"
1403,1794,"10000476",SOUTH COUNTY JAIL,1103 US HWY 98 W,FROSTPROOF,FL,"33843",NOT AVAILABLE,(863) 635-6920,COUNTY,OPEN,1783,POLK,"12105",USA,"922140",CORRECTIONAL INSTITUTIONS,"http://www.dc.state.fl.us/pub/jails/, http://www.polksheriff.org/InsidePCSO/Detention/Pages/Detention.aspx",2/21/2018,IMAGERY,2018-02-21T00:00:00.000Z,http://www.polksheriff.org/InsidePCSO/Detention/Pages/Detention.aspx,MAXIMUM,1776,0.00996412301134,6.177940221e-06,86491.634765625,1165.14710461685,"12","105","015802","12105015802","158.02",Census Tract 158.02,G5020,S,143065765,1882487,"+27.6974190","-081.6272222",FL,-81.5935116931081,27.7310985701241,,"1"
1404,1795,"10002186",ST. LUCIE COUNTY JAIL,900 N ROCK RD,FORT PIERCE,FL,"34945",NOT AVAILABLE,(772) 462-3450,COUNTY,OPEN,1256,ST. LUCIE,"12111",USA,"922140",CORRECTIONAL INSTITUTIONS,http://www.dc.state.fl.us/pub/jails/,2/21/2018,IMAGERY,2018-02-21T00:00:00.000Z,https://www.stluciesheriff.com/,MAXIMUM,-999,0.010102733151,5.989890573e-06,83646.67578125,1185.00597824724,"12","111","380800","12111380800","3808",Census Tract 3808,G5020,S,30249928,114865,"+27.4530032","-080.4034731",FL,-80.4101211529673,27.4533842590538,,"1"
1405,1796,"10005614",GRANT COUNTY JUVENILE DETENTION CENTER,501 SOUTH ADAMS ST,MARION,IN,"46952",NOT AVAILABLE,(765) 662-9864,COUNTY,OPEN,18,GRANT,"18053",USA,"922140",CORRECTIONAL INSTITUTIONS,http://www.in.gov/idoc/dys/2481.htm,3/5/2018,IMAGERY,2018-03-05T00:00:00.000Z,NOT AVAILABLE,JUVENILE,46,0.00318840022551,4.30142662e-07,7015.76171875,403.94901905355,"18","053","000100","18053000100","1",Census Tract 1,G5020,S,3217164,0,"+40.5582045","-085.6624695",IN,-85.6580321617628,40.5564521042684,"1","2"
1406,1797,"10005627",GREENE COUNTY JAIL,204 COUNTY ROAD 70 EAST,BLOOMFIELD,IN,"47424",NOT AVAILABLE,(812) 384-4411,COUNTY,OPEN,-999,GREENE,"18055",USA,"922140",CORRECTIONAL INSTITUTIONS,http://www.co.greene.in.us/department/index.php?structureid=16,3/5/2018,IMAGERY,2018-03-05T00:00:00.000Z,http://www.co.greene.in.us/department/index.php?structureid=16,NOT AVAILABLE,-999,0.00228547889311,2.88176823e-07,4596.734375,289.543096158331,"18","055","955400","18055955400","9554",Census Tract 9554,G5020,S,29902053,253197,"+39.0319299","-086.9324003",IN,-86.9283454023411,39.0244832097769,"2","1"
1407,1798,"10002805",EL PASO COUNTY DETENTION FACILITY,601 E OVERLAND AVE,EL PASO,TX,"79901",NOT AVAILABLE,NOT AVAILABLE,COUNTY,OPEN,836,EL PASO,"48141",USA,"922140",CORRECTIONAL INSTITUTIONS,"http://epcounty.com/sheriff/reports/2015%20EPCSO%20Annual%20Report.pdf, http://epcounty.com/sheriff/default.asp",4/26/2018,IMAGERY,2018-04-26T00:00:00.000Z,http://epcounty.com/sheriff/default.asp,MAXIMUM,1000,0.00215311099605,2.54136006e-07,3703.81640625,253.62211640208,"48","141","001700","48141001700","17",Census Tract 17,G5020,S,1127843,0,"+31.7595497","-106.4874258",TX,-106.482992907306,31.7585293218526,"3","1"
1408,1799,"10006612",NEW MEXICO BEHAVIORAL HEALTH INSTITUTE - FORENSIC DIVISION,3695 HOT SPRINGS BLVD,LAS VEGAS,NM,"87701",NOT AVAILABLE,(505) 454-2100,STATE,OPEN,-999,SAN MIGUEL,"35047",USA,"922140",CORRECTIONAL INSTITUTIONS,https://nmhealth.org/about/ofm/ltcf/nmbhi/#overview,12/18/2017,IMAGERY,2017-12-18T00:00:00.000Z,https://nmhealth.org/about/ofm/ltcf/nmbhi/#overview,MAXIMUM,80,0.00399029582826,9.25776803e-07,14110.69921875,497.198111225579,"35","047","957800","35047957800","9578",Census Tract 9578,G5020,S,12800686,6746,"+35.6218692","-105.2395017",NM,-105.242180098171,35.6081714331777,"1","1"
1409,1800,"10003185",CATTARAUGUS COUNTY JAIL,301 COURT ST,LITTLE VALLEY,NY,"14755","1090",(716) 938-9194,COUNTY,OPEN,134,CATTARAUGUS,"36009",USA,"922140",CORRECTIONAL INSTITUTIONS,"https://data.ny.gov/Public-Safety/Jail-Population-By-County-Beginning-1997/nymx-kgkn/data, http://www.cattco.org/sheriffs-office",4/9/2018,IMAGERY,2018-04-09T00:00:00.000Z,http://www.cattco.org/sheriffs-office,MAXIMUM,150,0.00349511012238,4.1688162e-07,6979.2890625,436.870490445384,"36","009","960600","36009960600","9606",Census Tract 9606,G5020,S,248756719,540529,"+42.2291131","-078.8273951",NY,-78.8006890633941,42.2522570765174,,"1"
1410,1801,"10006674",HUTTONSVILLE WORK CAMP,"US HWY 250 S, P.O. BOX 1",HUTTONSVILLE,WV,"26273",NOT AVAILABLE,(304) 335-2291,STATE,OPEN,-999,RANDOLPH,"54083",USA,"922140",CORRECTIONAL INSTITUTIONS,http://www.wvdoc.com/wvdoc/PrisonsandFacilities/tabid/36/Default.aspx,1/22/2018,IMAGERY/OTHER,2018-01-22T00:00:00.000Z,http://www.wvdoc.com/wvdoc/PrisonsandFacilities/tabid/36/Default.aspx,MINIMUM,48,0.0012150097653,8.6059793e-08,1366.4375,149.516730615067,"54","083","966500","54083966500","9665",Census Tract 9665,G5020,S,939354356,11999,"+38.6249940","-079.9675131",WV,-79.9795810962174,38.6968911930181,,"2"
1411,1802,"10002987",CARLIN CONSERVATION CAMP,124 SUZIE CREEK RD,CARLIN,NV,"89822",NOT AVAILABLE,(775) 754-6307,STATE,OPEN,111,ELKO,"32007",USA,"922140",CORRECTIONAL INSTITUTIONS,"http://doc.nv.gov/About/Statistics/Quarterly_Reports_by_Fiscal_Year/Quarterly_Reports_by_Fiscal_Year/, http://doc.nv.gov/Facilities/Home/",12/31/2016,IMAGERY/OTHER,2017-12-18T00:00:00.000Z,http://doc.nv.gov/Facilities/Home/,MINIMUM,150,0.00519544140286,1.45124232e-06,23731.1953125,657.400752534143,"32","007","951600","32007951600","9516",Census Tract 9516,G5020,S,1148319425,252002,"+40.6855290","-116.0170133",NV,-116.083772252644,40.7281267564375,"24","1"
1412,1803,"10003595",MARTINSBURG CORRECTIONAL CENTER,38 GRAPEVINE ROAD,MARTINSBURG,WV,"25401",NOT AVAILABLE,(304) 267-0156,STATE,OPEN,121,BERKELEY,"54003",USA,"922140",CORRECTIONAL INSTITUTIONS,http://www.wvdoc.com/wvdoc/PrisonsandFacilities/tabid/36/Default.aspx,1/22/2018,IMAGERY/OTHER,2018-01-22T00:00:00.000Z,http://www.wvdoc.com/wvdoc/PrisonsandFacilities/tabid/36/Default.aspx,MEDIUM,120,0.00428345450046,1.043471218e-06,16742.078125,541.697856980087,"54","003","972000","54003972000","9720",Census Tract 9720,G5020,S,52668500,0,"+39.4099438","-077.9467129",WV,-77.9566976495037,39.4347514743218,,"2"
1413,1804,"10006146",SALEM CORRECTIONAL CENTER,7 INDUSTRIAL BOULEVARD,INDUSTRIAL,WV,"26426",NOT AVAILABLE,(304) 782-2371,STATE,OPEN,-999,HARRISON,"54017",USA,"922140",CORRECTIONAL INSTITUTIONS,http://www.wvdoc.com/wvdoc/OfficeofResearchPlanning/tabid/70/Default.aspx,1/22/2018,IMAGERY/OTHER,2018-01-22T00:00:00.000Z,http://www.wvdoc.com/wvdoc/PrisonsandFacilities/tabid/36/Default.aspx,MEDIUM,388,0.0147798383634,4.756540414e-06,76149.70703125,1875.90621260783,"54","017","965000","54017965000","9650",Census Tract 9650,G5020,S,543675086,1057224,"+39.2690673","-080.6590540",WV,-80.5789554397836,39.2815948433485,,"1"
1414,1805,"10002988",HUMBOLDT CONSERVATION CAMP,8105 CONSERVATION RD,WINNEMUCCA,NV,"89446",NOT AVAILABLE,(775) 623-6530,STATE,OPEN,122,HUMBOLDT,"32013",USA,"922140",CORRECTIONAL INSTITUTIONS,"http://doc.nv.gov/About/Statistics/Quarterly_Reports_by_Fiscal_Year/Quarterly_Reports_by_Fiscal_Year/, http://doc.nv.gov/Facilities/Home/",12/31/2016,IMAGERY/OTHER,2017-12-18T00:00:00.000Z,http://doc.nv.gov/Facilities/Home/,MINIMUM,152,0.00683624776136,2.338363297e-06,38337.01171875,886.825394775238,"32","013","010500","32013010500","105",Census Tract 105,G5020,S,20371991255,26185681,"+41.5141573","-118.2841989",NV,-117.921760958646,40.9002154852912,,"1"
1415,1806,"10001879",MT. OLIVE CORRECTIONAL COMPLEX,1 MOUNTAINSIDE WAY,MT. OLIVE,WV,"25185",NOT AVAILABLE,(304) 442-7213,STATE,OPEN,1022,FAYETTE,"54019",USA,"922140",CORRECTIONAL INSTITUTIONS,http://www.wvdoc.com/wvdoc/PrisonsandFacilities/tabid/36/Default.aspx,1/22/2018,IMAGERY,2018-01-22T00:00:00.000Z,http://www.wvdoc.com/wvdoc/PrisonsandFacilities/tabid/36/Default.aspx,MAXIMUM,1030,0.0157724201163,1.5450067412e-05,243746.34375,1964.54883269103,"54","019","020800","54019020800","208",Census Tract 208,G5020,S,108800187,2738226,"+38.1876852","-081.2454706",WV,-81.2379934296658,38.2349712748815,"6","1"
1416,1807,"10006191",PARKERSBURG CORRECTIONAL CENTER,225 HOLIDAY HILLS DRIVE,PARKERSBURG,WV,"26104",NOT AVAILABLE,(304) 420-2443,STATE,OPEN,186,WOOD,"54107",USA,"922140",CORRECTIONAL INSTITUTIONS,http://www.wvdoc.com/wvdoc/OfficeofResearchPlanning/tabid/70/Default.aspx,1/22/2018,IMAGERY,2018-01-22T00:00:00.000Z,http://www.wvdoc.com/wvdoc/PrisonsandFacilities/tabid/36/Default.aspx,MINIMUM,-999,0.00449004200004,1.051373015e-06,16827.953125,573.51789872162,"54","107","010602","54107010602","106.02",Census Tract 106.02,G5020,S,130712376,35586,"+39.2751747","-081.3821505",WV,-81.5015701010551,39.2650421186687,,"1"
1417,1808,"10006794",MARQUETTE COUNTY COMMUNITY CORRECTIONS DETENTION CENTER,BASIL ROAD,MARQUETTE,MI,"49855",NOT AVAILABLE,NOT AVAILABLE,COUNTY,OPEN,-999,MARQUETTE,"26103",USA,"922140",CORRECTIONAL INSTITUTIONS,http://www.co.marquette.mi.us/departments/sheriff_s_office/index.php#.WrJu9fnwbmE,3/21/2018,UNVERIFIED,2018-03-21T00:00:00.000Z,http://www.co.marquette.mi.us/departments/sheriff_s_office/index.php#.WrJu9fnwbmE,MINIMUM,60,0.00733247458483,2.462384704e-06,44302.22265625,927.201603936425,"26","103","001200","26103001200","12",Census Tract 12,G5020,S,476331426,4213208,"+46.3710141","-087.2280967",MI,-87.3038308257961,46.4673457646472,,"1"
1418,1809,"10000340",SANTA ROSA COUNTY JAIL,5755 E MILTON RD,MILTON,FL,"32583",NOT AVAILABLE,(850) 983-1100,COUNTY,OPEN,741,SANTA ROSA,"12113",USA,"922140",CORRECTIONAL INSTITUTIONS,"http://www.dc.state.fl.us/pub/jails/, http://santarosasheriff.org/",2/21/2018,IMAGERY,2018-02-21T00:00:00.000Z,http://santarosasheriff.org/,MAXIMUM,682,0.00651474106794,1.803806074e-06,25980.9375,762.00991176267,"12","113","010808","12113010808","108.08",Census Tract 108.08,G5020,S,184173671,1902644,"+30.6450492","-086.8915051",FL,-86.974503069896,30.6435913406928,"5","6"
1419,1810,"10000014",PRUNTYTOWN CORRECTIONAL CENTER,2006 TRAP SPRINGS RD,GRAFTON,WV,"26354",NOT AVAILABLE,(304) 265-6111,STATE,OPEN,369,TAYLOR,"54091",USA,"922140",CORRECTIONAL INSTITUTIONS,http://www.wvdoc.com/wvdoc/PrisonsandFacilities/tabid/36/Default.aspx,1/22/2018,IMAGERY/OTHER,2018-01-22T00:00:00.000Z,http://www.wvdoc.com/wvdoc/PrisonsandFacilities/tabid/36/Default.aspx,MEDIUM,369,0.01611495294,1.135146128e-05,181857.52734375,2012.30767327269,"54","091","964800","54091964800","9648",Census Tract 9648,G5020,S,130876703,47178,"+39.2768555","-080.1008205",WV,-80.0741278851055,39.3304164807477,,"1"
1420,1811,"10002282",CAYUGA COUNTY JAIL,7445 COUNTY HOUSE RD,AUBURN,NY,"13021",NOT AVAILABLE,NOT AVAILABLE,COUNTY,OPEN,176,CAYUGA,"36011",USA,"922140",CORRECTIONAL INSTITUTIONS,"https://data.ny.gov/Public-Safety/Jail-Population-By-County-Beginning-1997/nymx-kgkn/data, http://cayugasheriff.com/",4/9/2018,IMAGERY,2018-04-09T00:00:00.000Z,http://cayugasheriff.com/,MAXIMUM,214,0.00601014649679,1.310826462e-06,22203.29296875,767.227699109418,"36","011","040600","36011040600","406",Census Tract 406,G5020,S,74642555,61548,"+42.9775784","-076.5183651",NY,-76.5435352011805,42.9797907162057,,"4"
1421,1812,"10004631",SARASOTA COUNTY JAIL,2020 MAIN STREET,SARASOTA,FL,"34237",NOT AVAILABLE,(941) 861-4601,COUNTY,OPEN,950,SARASOTA,"12115",USA,"922140",CORRECTIONAL INSTITUTIONS,http://www.sarasotasheriff.org/,2/21/2018,IMAGERY,2018-02-21T00:00:00.000Z,http://www.sarasotasheriff.org/,NOT AVAILABLE,1026,0.0032707017928,6.21861895e-07,8674.8671875,380.940159719287,"12","115","000102","12115000102","1.02",Census Tract 1.02,G5020,S,2394608,33449,"+27.3362532","-082.5318689",FL,-82.5294791739086,27.3360540167597,,"2"
1422,1813,"10003012",JEAN CONSERVATION CAMP,3 PRISON RD,JEAN,NV,"89019",NOT AVAILABLE,(702) 874-2509,STATE,OPEN,184,CLARK,"32003",USA,"922140",CORRECTIONAL INSTITUTIONS,"http://doc.nv.gov/About/Statistics/Quarterly_Reports_by_Fiscal_Year/Quarterly_Reports_by_Fiscal_Year/, http://doc.nv.gov/Facilities/Home/",12/31/2016,IMAGERY/OTHER,2017-12-18T00:00:00.000Z,http://doc.nv.gov/Facilities/Home/,MINIMUM,240,0.00690666786729,2.533873373e-06,38701.3359375,851.021407980572,"32","003","005703","32003005703","57.03",Census Tract 57.03,G5020,S,3643510265,59123623,"+35.5573290","-114.9269665",NV,-115.315355527907,35.7731930254538,,"2"
1423,1814,"10000013",ST MARY'S CORRECTIONAL CENTER,2880 N. PLEASANTS HIGHWAY,ST. MARYS,WV,"26170",NOT AVAILABLE,(304) 684-5500,STATE,OPEN,610,PLEASANTS,"54073",USA,"922140",CORRECTIONAL INSTITUTIONS,http://www.wvdoc.com/wvdoc/PrisonsandFacilities/tabid/36/Default.aspx,1/22/2018,IMAGERY,2018-01-22T00:00:00.000Z,http://www.wvdoc.com/wvdoc/PrisonsandFacilities/tabid/36/Default.aspx,MEDIUM,-999,0.0138932424915,9.296052888e-06,149142.52734375,1689.46217199019,"54","073","962100","54073962100","9621",Census Tract 9621,G5020,S,200124851,3788364,"+39.3945458","-081.0788381",WV,-81.1695418052698,39.4306545536934,,"1"
1424,1815,"10003002",PIOCHE CONSERVATION CAMP,1 HARDTIMES RD,PIOCHE,NV,"89043",NOT AVAILABLE,(775) 962-5125,STATE,OPEN,213,LINCOLN,"32017",USA,"922140",CORRECTIONAL INSTITUTIONS,"http://doc.nv.gov/About/Statistics/Quarterly_Reports_by_Fiscal_Year/Quarterly_Reports_by_Fiscal_Year/, http://doc.nv.gov/Facilities/Home/",12/31/2016,IMAGERY/OTHER,2017-12-18T00:00:00.000Z,http://doc.nv.gov/Facilities/Home/,MINIMUM,238,0.00557432999619,1.395810565e-06,21936.8984375,693.51206625817,"32","017","950100","32017950100","9501",Census Tract 9501,G5020,S,9519523961,1748646,"+38.1591637","-114.4983787",NV,-114.417956800098,37.9558212085813,"2","2"
1425,1816,"10001102","J M ""CHICK"" BUCKBEE JUVENILE CENTER",144 JERRY LANE,AUGUSTA,WV,"26704",NOT AVAILABLE,(304) 496-1341,STATE,OPEN,21,HAMPSHIRE,"54027",USA,"922140",CORRECTIONAL INSTITUTIONS,"http://djs.wv.gov/annualreport/Pages/default.aspx, http://djs.wv.gov/facilities/Pages/default.aspx",1/22/2018,IMAGERY,2018-01-22T00:00:00.000Z,http://djs.wv.gov/facilities/Pages/default.aspx,JUVENILE,24,0.00318655062273,5.35722304e-07,8579.2734375,401.297479815287,"54","027","968300","54027968300","9683",Census Tract 9683,G5020,S,274814642,2628378,"+39.4017937","-078.6149911",WV,-78.6444891627115,39.3031807461183,,"2"
1426,1817,"10002997",STEWART CONSERVATION CAMP,1721 SNYDER AVE,CARSON CITY,NV,"89702",NOT AVAILABLE,(775) 887-9310,STATE,OPEN,357,CARSON CITY,"32510",USA,"922140",CORRECTIONAL INSTITUTIONS,"http://doc.nv.gov/About/Statistics/Quarterly_Reports_by_Fiscal_Year/Quarterly_Reports_by_Fiscal_Year/, http://doc.nv.gov/Facilities/Home/",12/31/2016,IMAGERY/OTHER,2017-12-18T00:00:00.000Z,http://doc.nv.gov/Facilities/Home/,MINIMUM,360,0.00534802560778,1.228016874e-06,19610.91796875,667.694569870936,"32","510","000800","32510000800","8",Census Tract 8,G5020,S,27200669,330453,"+39.1289289","-119.7254128",NV,-119.746854114983,39.1063283192232,"1","2"
1427,1818,"10000041",GENE SPADARO JUVENILE CENTER,106 MARTIN DR.,MOUNT HOPE,WV,"25880",NOT AVAILABLE,(304) 877-6890,STATE,OPEN,25,FAYETTE,"54019",USA,"922140",CORRECTIONAL INSTITUTIONS,"http://djs.wv.gov/annualreport/Pages/default.aspx, http://djs.wv.gov/facilities/Pages/default.aspx",1/22/2018,IMAGERY/OTHER,2018-01-22T00:00:00.000Z,http://djs.wv.gov/facilities/Pages/default.aspx,JUVENILE,23,0.00373739591908,5.58156013e-07,8763.72265625,462.907322850954,"54","019","020500","54019020500","205",Census Tract 205,G5020,S,10864999,8262,"+37.8932594","-081.1617432",WV,-81.1666881835735,37.8853833435022,"2","1"
1428,1819,"10000042",DONALD R. KUHN JUVENILE CENTER,1 LORY PL,JULIAN,WV,"25529",NOT AVAILABLE,(304) 369-2976,STATE,OPEN,40,BOONE,"54005",USA,"922140",CORRECTIONAL INSTITUTIONS,"http://djs.wv.gov/annualreport/Pages/default.aspx, http://djs.wv.gov/facilities/Pages/default.aspx",1/22/2018,IMAGERY/OTHER,2018-01-22T00:00:00.000Z,http://djs.wv.gov/facilities/Pages/default.aspx,JUVENILE,48,0.00512896558924,1.459636014e-06,22997.0546875,635.571790774634,"54","005","958300","54005958300","9583",Census Tract 9583,G5020,S,189874396,399614,"+38.0591906","-081.9169329",WV,-81.8379775772097,38.1377125102133,,"1"
1429,1820,"10004908",HAMILTON COUNTY JAIL,18100 CUMBERLAND RD,NOBLESVILLE,IN,"46060",NOT AVAILABLE,(317) 773-1872,COUNTY,OPEN,325,HAMILTON,"18057",USA,"922140",CORRECTIONAL INSTITUTIONS,https://www.hamiltoncounty.in.gov/547/Divisions,3/5/2018,IMAGERY,2018-03-05T00:00:00.000Z,https://www.hamiltoncounty.in.gov/547/Divisions,MAXIMUM,296,0.00648478291968,1.288990312e-06,20867.79296875,829.743832035045,"18","057","110600","18057110600","1106",Census Tract 1106,G5020,S,3224514,56585,"+40.0529469","-086.0042555",IN,-85.9941965611646,40.0531621309192,"3","3"
1430,1821,"10006192",KENNETH HONEY RUBENSTEIN JUVENILE CENTER,141 FORESTRY CAMP RD,DAVIS,WV,"26260",NOT AVAILABLE,(304) 259-5241,STATE,OPEN,39,TUCKER,"54093",USA,"922140",CORRECTIONAL INSTITUTIONS,"http://djs.wv.gov/annualreport/Pages/default.aspx, http://djs.wv.gov/facilities/Pages/default.aspx",1/22/2018,IMAGERY,2018-01-22T00:00:00.000Z,http://djs.wv.gov/facilities/Pages/default.aspx,JUVENILE,84,0.00890720272228,1.939389543e-06,30990.23046875,1104.25416319893,"54","093","965300","54093965300","9653",Census Tract 9653,G5020,S,531464876,712920,"+39.0571354","-079.5052641",WV,-79.4427206724013,39.1494810534493,,"2"
1431,1822,"10000037",ROBERT L. SHELL JUVENILE CENTER,2 O'HANLON PLACE,BARBOURSVILLE,WV,"25504",NOT AVAILABLE,(304) 733-0871,STATE,OPEN,25,CABELL,"54011",USA,"922140",CORRECTIONAL INSTITUTIONS,"http://djs.wv.gov/annualreport/Pages/default.aspx, http://djs.wv.gov/facilities/Pages/default.aspx",1/22/2018,IMAGERY/OTHER,2018-01-22T00:00:00.000Z,http://djs.wv.gov/facilities/Pages/default.aspx,JUVENILE,23,0.00304810292527,4.09942457e-07,6483.79296875,371.085524234709,"54","011","010400","54011010400","104",Census Tract 104,G5020,S,22595367,510034,"+38.3899476","-082.2637306",WV,-82.2916483875027,38.4181365739425,"1","2"
1432,1823,"10005167",MASON COUNTY JAIL,306 NORTH DELIA STREET,LUDINGTON,MI,"49431",NOT AVAILABLE,NOT AVAILABLE,COUNTY,OPEN,57,MASON,"26105",USA,"922140",CORRECTIONAL INSTITUTIONS,"http://www.michigan.gov/documents/corrections/JPIS_-_CY_2010_344047_7.pdf, http://masoncountysheriff.org/",2/15/2016,IMAGERY/OTHER,2018-03-21T00:00:00.000Z,http://masoncountysheriff.org/,MAXIMUM,104,0.00232066917343,2.66387896e-07,4585.80859375,301.171991759904,"26","105","950400","26105950400","9504",Census Tract 9504,G5020,S,4845345,0,"+43.9635406","-086.4381881",MI,-86.443059206962,43.9580450303291,"2","1"
1433,1824,"10006895",SITKA COMMUNITY JAIL,304 LAKE ST 102,SITKA,AK,"99835",NOT AVAILABLE,NOT AVAILABLE,LOCAL,OPEN,-999,SITKA BOROUGH,"02220",USA,"922140",CORRECTIONAL INSTITUTIONS,http://www.sitkapd.com/index.html,5/11/2018,UNVERIFIED,2018-05-11T00:00:00.000Z,NOT AVAILABLE,NOT AVAILABLE,-999,0.00223759578903,2.44047574e-07,5560.6171875,305.388466234852,"02","220","000200","02220000200","2",Census Tract 2,G5020,S,17090447,32681043,"+57.0478562","-135.3663380",AK,-135.333567923727,57.0526576888711,,"1"
1434,1825,"10002160",JOHN E POLK CORRECTIONAL FACILITY,211 ESLINGER WAY,SANFORD,FL,"32773",NOT AVAILABLE,(407) 665-1200,COUNTY,OPEN,932,SEMINOLE,"12117",USA,"922140",CORRECTIONAL INSTITUTIONS,"http://www.dc.state.fl.us/pub/jails/, https://www.seminolesheriff.org/page.aspx?id=92",2/22/2018,IMAGERY,2018-02-22T00:00:00.000Z,https://www.seminolesheriff.org/page.aspx?id=92,MAXIMUM,1396,0.00921142819053,2.952956169e-06,41737.359375,1093.76482156529,"12","117","020803","12117020803","208.03",Census Tract 208.03,G5020,S,10306133,854090,"+28.7423008","-081.3136934",FL,-81.2991609479625,28.7475371662882,,"2"
1435,1826,"10000050",SAM PERDUE JUVENILE CENTER,843 SHELTER RD,PRINCETON,WV,"24739",NOT AVAILABLE,(304) 425-9721,STATE,OPEN,16,MERCER,"54055",USA,"922140",CORRECTIONAL INSTITUTIONS,http://djs.wv.gov/annualreport/Pages/default.aspx,1/20/2015,IMAGERY,2018-01-22T00:00:00.000Z,http://djs.wv.gov/facilities/Pages/default.aspx,JUVENILE,20,0.00247614127436,3.37855717e-07,5265.3984375,308.532896684559,"54","055","002300","54055002300","23",Census Tract 23,G5020,S,61172070,177057,"+37.3269275","-081.1185319",WV,-81.1273149146736,37.3317750380554,,"1"
1436,1827,"10001453",SUMTER COUNTY DETENTION CENTER,219 E ANDERSON AVE,BUSHNELL,FL,"33513",NOT AVAILABLE,(352) 569-1700,COUNTY,OPEN,385,SUMTER,"12119",USA,"922140",CORRECTIONAL INSTITUTIONS,http://www.dc.state.fl.us/pub/jails/,2/22/2018,IMAGERY,2018-02-22T00:00:00.000Z,http://www.sumtercountysheriff.org/index.php,MEDIUM,-999,0.00686231436064,1.986965757e-06,28061.12109375,810.748347770926,"12","119","910500","12119910500","9105",Census Tract 9105,G5020,S,189420678,3141955,"+28.7122844","-082.0449203",FL,-82.1091375278027,28.6624401814389,,"1"
1437,1828,"10003006",THREE LAKES VALLEY CONSERVATION & BOOT CAMP,20825 COLD CREEK RD,INDIAN SPRINGS,NV,"89070",NOT AVAILABLE,(702) 879-5472,STATE,OPEN,330,CLARK,"32003",USA,"922140",CORRECTIONAL INSTITUTIONS,"http://doc.nv.gov/About/Statistics/Quarterly_Reports_by_Fiscal_Year/Quarterly_Reports_by_Fiscal_Year/, http://doc.nv.gov/Facilities/Home/",12/31/2016,IMAGERY/OTHER,2017-12-18T00:00:00.000Z,http://doc.nv.gov/Facilities/Home/,MINIMUM,192,0.0138058780055,8.848320587e-06,136428.8515625,1694.28899423632,"32","003","005818","32003005818","58.18",Census Tract 58.18,G5020,S,527248957,0,"+36.4693209","-115.7785508",NV,-115.561132140825,36.5145202788763,,"3"
1438,1829,"10004544",ATKINSON COUNTY JAIL,20 SMITH AVE W,PEARSON,GA,"31642",NOT AVAILABLE,(912) 422-3291,COUNTY,OPEN,-999,ATKINSON,"13003",USA,"922140",CORRECTIONAL INSTITUTIONS,http://atkinsonsheriff.org/index.html,2/22/2018,IMAGERY,2018-02-22T00:00:00.000Z,http://atkinsonsheriff.org/index.html,NOT AVAILABLE,-999,0.00120111388975,8.9671267e-08,1300.421875,144.298131568731,"13","003","960200","13003960200","9602",Census Tract 9602,G5020,S,402068873,1423792,"+31.2627888","-082.8831970",GA,-82.8535312935638,31.2957419104249,,"1"
1439,1830,"10004581",UNION COUNTY JAIL,50 NORTHWEST 1ST STREET,LAKE BUTLER,FL,"32054",NOT AVAILABLE,(386) 496-2501,COUNTY,OPEN,37,UNION,"12125",USA,"922140",CORRECTIONAL INSTITUTIONS,"http://www.dc.state.fl.us/pub/jails/, http://www.unionsheriff.us/corrections.html",2/22/2018,IMAGERY,2018-02-22T00:00:00.000Z,http://www.unionsheriff.us/corrections.html,NOT AVAILABLE,36,0.00226916030061,3.14129117e-07,4495.96484375,269.174112988815,"12","125","960200","12125960200","9602",Census Tract 9602,G5020,S,293238434,14779126,"+30.0614072","-082.3799754",FL,-82.338554013516,30.0235543437473,,"4"
1440,1831,"10000447",VOLUSIA COUNTY CORRECTIONAL FACILITY,1354 INDIAN LAKE RD,DAYTONA BEACH,FL,"32124",NOT AVAILABLE,(386) 254-1569,COUNTY,OPEN,514,VOLUSIA,"12127",USA,"922140",CORRECTIONAL INSTITUTIONS,"http://www.dc.state.fl.us/pub/jails/, https://www.volusia.org/services/public-protection/corrections/",2/22/2018,IMAGERY,2018-02-22T00:00:00.000Z,https://www.volusia.org/services/public-protection/corrections/,MAXIMUM,595,0.00746011441958,2.398089428e-06,34023.029296875,873.29961988097,"12","127","083206","12127083206","832.06",Census Tract 832.06,G5020,S,191436609,733033,"+29.1712727","-081.2246774",FL,-81.1468086465055,29.1386933802403,,"8"
1441,1832,"10004560",WALTON COUNTY JAIL,796 TRIPLE G ROAD,DEFUNIAK SPRINGS,FL,"32433",NOT AVAILABLE,(850) 892-8196,COUNTY,OPEN,513,WALTON,"12131",USA,"922140",CORRECTIONAL INSTITUTIONS,http://waltonso.org/,2/22/2018,IMAGERY,2018-02-22T00:00:00.000Z,http://waltonso.org/,MAXIMUM,584,0.00592506609473,1.56419113e-06,22562.37890625,714.630799149057,"12","131","950200","12131950200","9502",Census Tract 9502,G5020,S,85423564,2346806,"+30.7405605","-086.0813990",FL,-86.1032896963516,30.7835064605583,,"3"
1442,1833,"10004541",BAKER COUNTY SHERIFFS OFFICE,STATE HIGHWAY 200,NEWTON,GA,"39870",NOT AVAILABLE,(229) 734-3002,COUNTY,NOT AVAILABLE,-999,BAKER,"13007",USA,"922140",CORRECTIONAL INSTITUTIONS,http://bakercountysheriffoffice.org/,2/15/2016,UNVERIFIED,2018-02-22T00:00:00.000Z,http://bakercountysheriffoffice.org/index.php,NOT AVAILABLE,-999,0.0036774788008,8.33491414e-07,12086.27734375,443.574311772079,"13","007","960100","13007960100","9601",Census Tract 9601,G5020,S,470625163,14157745,"+31.3322322","-084.3614663",GA,-84.4130634904247,31.2870047901606,,"1"
1443,1834,"10002804",EL PASO COUNTY ANNEX JAIL,12501 E MONTANA,EL PASO,TX,"79938",NOT AVAILABLE,NOT AVAILABLE,COUNTY,OPEN,1195,EL PASO,"48141",USA,"922140",CORRECTIONAL INSTITUTIONS,"http://epcounty.com/sheriff/reports/2015%20EPCSO%20Annual%20Report.pdf, http://epcounty.com/sheriff/default.asp",4/26/2018,IMAGERY,2018-04-26T00:00:00.000Z,http://epcounty.com/sheriff/default.asp,MAXIMUM,1450,0.0125493109137,6.690288031e-06,97560.3046875,1519.34513039274,"48","141","010339","48141010339","103.39",Census Tract 103.39,G5020,S,47351243,0,"+31.8261423","-106.2555180",TX,-106.253126538738,31.8106299764869,,"3"
1444,1835,"10005175",MECOSTA COUNTY JAIL,225 SOUTH STEWART,BIG RAPIDS,MI,"49307",NOT AVAILABLE,(231) 592-0156,COUNTY,OPEN,-999,MECOSTA,"26107",USA,"922140",CORRECTIONAL INSTITUTIONS,http://www.michigan.gov/documents/corrections/JPIS_-_CY_2010_344047_7.pdf,2/15/2016,IMAGERY/OTHER,2018-03-21T00:00:00.000Z,http://www.mecostacounty.org/mecostacountysheriff.html,NOT AVAILABLE,97,0.00518146462518,6.80784298e-07,11668.26953125,657.643899217239,"26","107","960600","26107960600","9606",Census Tract 9606,G5020,S,6196362,76614,"+43.6912652","-085.4998622",MI,-85.4781129494605,43.696264074137,"5","1"
1445,1836,"10002288",CHAUTAUQUA COUNTY JAIL,15 E CHAUTAUQUA ST,MAYVILLE,NY,"14757",NOT AVAILABLE,NOT AVAILABLE,COUNTY,OPEN,221,CHAUTAUQUA,"36013",USA,"922140",CORRECTIONAL INSTITUTIONS,http://www.sheriff.us/,4/9/2018,IMAGERY,2018-04-09T00:00:00.000Z,http://www.sheriff.us/,NOT AVAILABLE,-999,0.00401433021722,6.03959961e-07,10111.640625,511.174279270911,"36","013","036401","36013036401","364.01",Census Tract 364.01,G5020,S,106172128,18497058,"+42.2232066","-079.5251619",NY,-79.5034354127548,42.2544476194323,,"1"
1446,1837,"10002998",TONOPAH CONSERVATION CAMP,"HC 76, BOX 8045",TONOPAH,NV,"89049",NOT AVAILABLE,(775) 482-6700,STATE,OPEN,147,NYE,"32023",USA,"922140",CORRECTIONAL INSTITUTIONS,"http://doc.nv.gov/About/Statistics/Quarterly_Reports_by_Fiscal_Year/Quarterly_Reports_by_Fiscal_Year/, http://doc.nv.gov/Facilities/Home/",12/31/2016,IMAGERY/OTHER,2017-12-18T00:00:00.000Z,http://doc.nv.gov/Facilities/Home/,MINIMUM,152,0.00602366716985,2.059844458e-06,32467.34765625,760.007884957738,"32","023","960200","32023960200","9602",Census Tract 9602,G5020,S,7769110001,4386983,"+38.1235057","-116.6775170",NV,-117.107415235281,38.1686809810388,"20","2"
1447,1838,"10000261",FLORENCE MCCLURE WOMEN'S CORRECTIONAL CENTER,4370 SMILEY RD,LAS VEGAS,NV,"89115","1808",(702) 668-7200,STATE,OPEN,991,CLARK,"32003",USA,"922140",CORRECTIONAL INSTITUTIONS,"http://doc.nv.gov/About/Statistics/Quarterly_Reports_by_Fiscal_Year/Quarterly_Reports_by_Fiscal_Year/, http://doc.nv.gov/Facilities/Home/",12/31/2016,IMAGERY/OTHER,2017-12-18T00:00:00.000Z,http://doc.nv.gov/Facilities/Home/,CLOSE,950,0.0098299269716,5.950658457e-06,91448.11328125,1242.59214118484,"32","003","006001","32003006001","60.01",Census Tract 60.01,G5020,S,9762953,0,"+36.2514327","-115.0680887",NV,-115.076968425195,36.2575180687806,,"1"
1448,1839,"10003004",HIGH DESERT STATE PRISON,22010 COLD CREEK RD,INDIAN SPRINGS,NV,"89070",NOT AVAILABLE,(702) 879-6789,STATE,OPEN,3669,CLARK,"32003",USA,"922140",CORRECTIONAL INSTITUTIONS,"http://doc.nv.gov/About/Statistics/Quarterly_Reports_by_Fiscal_Year/Quarterly_Reports_by_Fiscal_Year/, http://doc.nv.gov/Facilities/Home/",12/31/2016,IMAGERY/OTHER,2017-12-18T00:00:00.000Z,http://doc.nv.gov/Facilities/Home/,MEDIUM,4176,0.0291349784835,4.2785232927e-05,659706.515625,3681.00498878259,"32","003","005818","32003005818","58.18",Census Tract 58.18,G5020,S,527248957,0,"+36.4693209","-115.7785508",NV,-115.584661897706,36.5160221787812,,"3"
1449,1840,"10000010",VICKI DOUGLAS JUVENILE CENTER,900 EMMETT ROUSCH DR,MARTINSBURG,WV,"25401",NOT AVAILABLE,(304) 267-0164,STATE,OPEN,17,BERKELEY,"54003",USA,"922140",CORRECTIONAL INSTITUTIONS,"http://djs.wv.gov/annualreport/Pages/default.aspx, http://djs.wv.gov/facilities/Pages/default.aspx",1/22/2018,IMAGERY/OTHER,2018-01-22T00:00:00.000Z,http://djs.wv.gov/facilities/Pages/default.aspx,JUVENILE,23,0.00301646961134,4.8819208e-07,7834.12890625,382.659302256134,"54","003","971500","54003971500","9715",Census Tract 9715,G5020,S,3342854,0,"+39.4577270","-077.9562893",WV,-77.9640033178039,39.4460121974118,,"1"
1450,1841,"10000033",TIGER MORTON JUVENILE CENTER,60 MANFRED HOLLAND WAY,DUNBAR,WV,"25064",NOT AVAILABLE,(304) 766-2616,STATE,OPEN,26,KANAWHA,"54039",USA,"922140",CORRECTIONAL INSTITUTIONS,"http://djs.wv.gov/annualreport/Pages/default.aspx, http://djs.wv.gov/facilities/Pages/default.aspx",1/22/2018,IMAGERY/OTHER,2018-01-22T00:00:00.000Z,http://djs.wv.gov/facilities/Pages/default.aspx,JUVENILE,23,0.00259518533055,3.81676363e-07,6033.0859375,317.458751824937,"54","039","010400","54039010400","104",Census Tract 104,G5020,S,9127078,645091,"+38.3831307","-081.7671022",WV,-81.7599464009897,38.3746340778123,,"1"
1451,1842,"10003799",ELY STATE PRISON,4569 N STATE ROUTE,ELY,NV,"89301",NOT AVAILABLE,(775) 289-8800,STATE,OPEN,1142,WHITE PINE,"32033",USA,"922140",CORRECTIONAL INSTITUTIONS,"http://doc.nv.gov/About/Statistics/Quarterly_Reports_by_Fiscal_Year/Quarterly_Reports_by_Fiscal_Year/, http://doc.nv.gov/Facilities/Home/",12/31/2016,IMAGERY/OTHER,2017-12-18T00:00:00.000Z,http://doc.nv.gov/Facilities/Home/,MAXIMUM,1183,0.0193255952708,2.279616463e-05,365497.5703125,2408.70511436157,"32","033","970200","32033970200","9702",Census Tract 9702,G5020,S,6168942491,740704,"+39.1151145","-115.1951682",NV,-114.938471865471,39.3855374734377,"8","3"
1452,1843,"10001105",CHARLESTON WORK RELEASE CENTER,607 BROOKS ST,CHARLESTON,WV,"25301",NOT AVAILABLE,(304) 558-2763,STATE,CLOSED,0,KANAWHA,"54039",USA,"922140",CORRECTIONAL INSTITUTIONS,http://www.wvdoc.com/wvdoc/PrisonsandFacilities/CharlestonCorrectionalCenter/tabid/199/Default.aspx,1/23/2018,IMAGERY,2018-01-23T00:00:00.000Z,http://www.wvdoc.com/wvdoc/PrisonsandFacilities/CharlestonWorkReleaseCenter/tabid/46/Default.aspx,MINIMUM,66,0.000957032528026,4.2881494e-08,677.58203125,119.187118724251,"54","039","000900","54039000900","9",Census Tract 9,G5020,S,1468599,175251,"+38.3514903","-081.6352653",WV,-81.6263881090662,38.3495940741165,"2","1"
1453,1844,"10000260",NORTHERN NEVADA TRANSITIONAL HOUSING,225 SUNSHINE LANE,RENO,NV,"89502",NOT AVAILABLE,(775) 688-1140,STATE,OPEN,104,WASHOE,"32031",USA,"922140",CORRECTIONAL INSTITUTIONS,"http://doc.nv.gov/About/Statistics/Quarterly_Reports_by_Fiscal_Year/Quarterly_Reports_by_Fiscal_Year/, http://doc.nv.gov/Facilities/Home/",12/31/2016,IMAGERY/OTHER,2017-12-19T00:00:00.000Z,http://doc.nv.gov/Facilities/Home/,MINIMUM,112,0.00262531644816,2.91338641e-07,4680.61328125,341.630582690216,"32","031","002107","32031002107","21.07",Census Tract 21.07,G5020,S,2374872,127559,"+39.5190407","-119.7835119",NV,-119.788673047324,39.5268589677385,"1","1"
1454,1845,"10002991",LOVELOCK CORRECTIONAL CENTER,1200 PRISON RD,LOVELOCK,NV,"89419",NOT AVAILABLE,(775) 273-1300,STATE,OPEN,1681,PERSHING,"32027",USA,"922140",CORRECTIONAL INSTITUTIONS,"http://doc.nv.gov/About/Statistics/Quarterly_Reports_by_Fiscal_Year/Quarterly_Reports_by_Fiscal_Year/, http://doc.nv.gov/Facilities/Home/",12/31/2016,IMAGERY/OTHER,2017-12-19T00:00:00.000Z,http://doc.nv.gov/Facilities/Home/,CLOSE,1680,0.0174145896227,1.5580469232e-05,252867.671875,2196.17179325237,"32","027","960100","32027960100","9601",Census Tract 9601,G5020,S,15634691964,79934815,"+40.4396390","-118.4094765",NV,-118.388806316321,40.2230722052171,"1","2"
1455,1846,"10002994",NEVADA STATE PRISON,3301 E 5TH ST,CARSON CITY,NV,"89701",NOT AVAILABLE,NOT AVAILABLE,STATE,CLOSED,0,CARSON CITY,"32510",USA,"922140",CORRECTIONAL INSTITUTIONS,http://doc.nv.gov/Facilities/Home/,12/19/2017,IMAGERY/OTHER,2017-12-19T00:00:00.000Z,NOT AVAILABLE,MEDIUM,841,0.0151048834952,9.863171159e-06,157629.96875,1889.58371865142,"32","510","000600","32510000600","6",Census Tract 6,G5020,S,6857070,98474,"+39.1582150","-119.7471228",NV,-119.73604176665,39.1596427865462,"3","4"
1456,1847,"10002995",WARM SPRINGS CORRECTIONAL CENTER,3301 E 5TH ST,CARSON CITY,NV,"89701",NOT AVAILABLE,(775) 684-3000,STATE,OPEN,573,CARSON CITY,"32510",USA,"922140",CORRECTIONAL INSTITUTIONS,"http://doc.nv.gov/About/Statistics/Quarterly_Reports_by_Fiscal_Year/Quarterly_Reports_by_Fiscal_Year/, http://doc.nv.gov/Facilities/Home/",12/31/2016,IMAGERY/OTHER,2017-12-19T00:00:00.000Z,http://doc.nv.gov/Facilities/Home/,MEDIUM,532,0.0128340699634,8.206948823e-06,131155.4375,1577.75826356005,"32","510","000600","32510000600","6",Census Tract 6,G5020,S,6857070,98474,"+39.1582150","-119.7471228",NV,-119.737223245193,39.1567770888514,"3","4"
1457,1848,"10002996",NORTHERN NEVADA CORRECTIONAL CENTER,1721 SNYDER AVE,CARSON CITY,NV,"89701",NOT AVAILABLE,(775) 887-9297,STATE,OPEN,1411,CARSON CITY,"32510",USA,"922140",CORRECTIONAL INSTITUTIONS,"http://doc.nv.gov/About/Statistics/Quarterly_Reports_by_Fiscal_Year/Quarterly_Reports_by_Fiscal_Year/, http://doc.nv.gov/Facilities/Home/",12/31/2016,IMAGERY/OTHER,2017-12-19T00:00:00.000Z,http://doc.nv.gov/Facilities/Home/,MEDIUM,1619,0.0210310577462,2.0267969476e-05,323682.7109375,2648.83499596438,"32","510","000800","32510000800","8",Census Tract 8,G5020,S,27200669,330453,"+39.1289289","-119.7254128",NV,-119.744029291276,39.1088521155999,"1","2"
1458,1849,"10003005",SOUTHERN DESERT CORRECTIONAL CENTER,20825 COLD CREEK RD,INDIAN SPRINGS,NV,"89070",NOT AVAILABLE,(702) 879-3800,STATE,OPEN,2150,CLARK,"32003",USA,"922140",CORRECTIONAL INSTITUTIONS,"http://doc.nv.gov/About/Statistics/Quarterly_Reports_by_Fiscal_Year/Quarterly_Reports_by_Fiscal_Year/, http://doc.nv.gov/Facilities/Home/",12/31/2016,IMAGERY/OTHER,2017-12-19T00:00:00.000Z,http://doc.nv.gov/Facilities/Home/,MEDIUM,2149,0.0290714292533,2.968816887e-05,457752.5390625,3546.68536896227,"32","003","005818","32003005818","58.18",Census Tract 58.18,G5020,S,527248957,0,"+36.4693209","-115.7785508",NV,-115.554596715744,36.5148901109888,,"3"
1459,1850,"10000036",HUNTINGTON WORK RELEASE CENTER,1236 5TH AVE.,HUNTINGTON,WV,"25701",NOT AVAILABLE,NOT AVAILABLE,STATE,CLOSED,0,CABELL,"54011",USA,"922140",CORRECTIONAL INSTITUTIONS,https://www.usnews.com/news/best-states/west-virginia/articles/2017-11-30/west-virginia-inmate-work-release-center-closing,11/30/2017,IMAGERY,2018-01-23T00:00:00.000Z,http://www.wvdoc.com/wvdoc/PrisonsandFacilities/HuntingtonWorkReleaseCenter/tabid/48/Default.aspx,MINIMUM,66,0.0013035495111,7.322878e-08,1158.25390625,174.384672515098,"54","011","000600","54011000600","6",Census Tract 6,G5020,S,936968,870250,"+38.4270313","-082.4298843",WV,-82.4373557636317,38.4209142820801,,"1"
1460,1851,"10000055",WYOMING HONOR FARM,40 HONOR FARM RD,RIVERTON,WY,"82501","9411",(307) 856-9578,STATE,OPEN,271,FREMONT,"56013",USA,"922140",CORRECTIONAL INSTITUTIONS,http://corrections.wyo.gov/home/services-and-programs/prison-rape-elimination-act-prea,8/2/2016,IMAGERY,2018-01-23T00:00:00.000Z,http://corrections.wyo.gov/home/institutions,MINIMUM,283,0.0262290406906,2.5739080582e-05,436544.98046875,3432.92530350536,"56","013","940300","56013940300","9403",Census Tract 9403,G5020,S,39409043,1099316,"+43.0642073","-108.3438485",WY,-108.369896122592,43.059427370194,,"1"
1461,1852,"10003000",CALIENTE YOUTH CENTER,500 YOUTH CENTER DRIVE,CALIENTE,NV,"89008",NOT AVAILABLE,(775) 726-8200,STATE,OPEN,115,LINCOLN,"32017",USA,"922140",CORRECTIONAL INSTITUTIONS,"http://dcfs.nv.gov/Programs/JJS/, http://dcfs.nv.gov/Programs/JJS/PREAHome/",12/12/2017,IMAGERY,2017-12-19T00:00:00.000Z,http://dcfs.nv.gov/Programs/JJS/,JUVENILE,140,0.00992504018115,4.924759376e-06,77047.359375,1213.19860893082,"32","017","950200","32017950200","9502",Census Tract 9502,G5020,S,18020818284,8054067,"+37.4680496","-115.0589325",NV,-114.503565881762,37.6195743261215,"2","1"
1462,1853,"10003902",BANKS COUNTY JAIL / SHERIFF,160 WINDMILL FARM ROAD,HOMER,GA,"30547",NOT AVAILABLE,(706) 677-2248,COUNTY,OPEN,-999,BANKS,"13011",USA,"922140",CORRECTIONAL INSTITUTIONS,http://www.bankscountysheriff.org/home.html,2/22/2018,IMAGERY,2018-02-22T00:00:00.000Z,http://www.bankscountysheriff.org/home.html,MAXIMUM,60,0.00303379946833,5.13343515e-07,7701.79296875,366.963796538508,"13","011","970200","13011970200","9702",Census Tract 9702,G5020,S,193261789,774820,"+34.3680144","-083.4828465",GA,-83.4712532462173,34.3140624398691,,"1"
1463,1854,"10005149",MENOMINEE COUNTY JAIL,831 10TH AVENUE,MENOMINEE,MI,"49858",NOT AVAILABLE,(906) 863-4441,COUNTY,OPEN,31,MENOMINEE,"26109",USA,"922140",CORRECTIONAL INSTITUTIONS,http://www.michigan.gov/documents/corrections/JPIS_-_CY_2010_344047_7.pdf,2/15/2016,IMAGERY/OTHER,2018-03-21T00:00:00.000Z,http://www.menomineecounty.com/departments/?department=85bf1f570592,NOT AVAILABLE,51,0.00226274958788,1.94271942e-07,3411,296.232882095401,"26","109","960700","26109960700","9607",Census Tract 9607,G5020,S,4494857,3960694,"+45.1105726","-087.6072856",MI,-87.6127343765191,45.1072653835196,,"1"
1464,1855,"10000259",NEVADA YOUTH TRAINING CENTER,100 YOUTH CENTER DRIVE,ELKO,NV,"89801",NOT AVAILABLE,(775) 738-6200,STATE,OPEN,51,ELKO,"32007",USA,"922140",CORRECTIONAL INSTITUTIONS,http://dcfs.nv.gov/Programs/JJS/,12/12/2017,IMAGERY,2017-12-19T00:00:00.000Z,http://dcfs.nv.gov/Programs/JJS/,JUVENILE,160,0.016746708359,1.2267417094e-05,201061.95703125,2100.37017878546,"32","007","950702","32007950702","9507.02",Census Tract 9507.02,G5020,S,3351515963,406459,"+41.0931599","-115.7874914",NV,-115.727199123183,40.8804910627176,,"1"
1465,1856,"10000057",WYOMING STATE PENITENTIARY,2900 S HIGLEY RD,RAWLINS,WY,"82301","0400",(307) 328-1441,STATE,OPEN,678,CARBON,"56007",USA,"922140",CORRECTIONAL INSTITUTIONS,http://corrections.wyo.gov/home/services-and-programs/prison-rape-elimination-act-prea,8/5/2016,IMAGERY,2018-01-23T00:00:00.000Z,http://corrections.wyo.gov/home/institutions,MAXIMUM,820,0.0357132638195,2.8051161759e-05,466020.7734375,4347.82608611254,"56","007","967600","56007967600","9676",Census Tract 9676,G5020,S,8643062769,81096253,"+41.7068338","-107.3673125",WY,-107.213795084833,41.7624628414866,"1","1"
1466,1857,"10004909",HAMILTON COUNTY JUVENILE DETENTION CENTER,18106 CUMBERLAND RD,NOBLESVILLE,IN,"46060",NOT AVAILABLE,(317) 776-9828,COUNTY,OPEN,-999,HAMILTON,"18057",USA,"922140",CORRECTIONAL INSTITUTIONS,https://www.hamiltoncounty.in.gov/547/Divisions,3/5/2018,IMAGERY,2018-03-05T00:00:00.000Z,https://www.hamiltoncounty.in.gov/547/Divisions,JUVENILE,86,0.00657818848467,1.054520236e-06,17071.6484375,827.76816790988,"18","057","110600","18057110600","1106",Census Tract 1106,G5020,S,3224514,56585,"+40.0529469","-086.0042555",IN,-85.992907692697,40.0522538512141,"3","3"
1467,1858,"10003008",SUMMIT VIEW YOUTH CENTER,5730 RANGE RD,LAS VEGAS,NV,"89115",NOT AVAILABLE,NOT AVAILABLE,STATE,OPEN,34,CLARK,"32003",USA,"922140",CORRECTIONAL INSTITUTIONS,http://dcfs.nv.gov/Programs/JJS/,12/12/2017,IMAGERY,2017-12-19T00:00:00.000Z,http://dcfs.nv.gov/Programs/JJS/,JUVENILE,50,0.00716279730205,3.374208293e-06,51858.77734375,870.753805363382,"32","003","003628","32003003628","36.28",Census Tract 36.28,G5020,S,25368319,112001,"+36.2734327","-115.0598574",NV,-115.053986241168,36.2648334047205,,"1"
1468,1859,"10000056",WYOMING WOMEN'S CENTER,1000 W GRIFFITH BLVD,LUSK,WY,"82225","0020",(307) 334-3693,STATE,OPEN,249,NIOBRARA,"56027",USA,"922140",CORRECTIONAL INSTITUTIONS,http://corrections.wyo.gov/home/services-and-programs/prison-rape-elimination-act-prea,6/30/2017,IMAGERY/OTHER,2018-01-23T00:00:00.000Z,http://corrections.wyo.gov/home/institutions,MAXIMUM,275,0.00766938375524,2.835483678e-06,47863.94140625,954.640595805482,"56","027","957200","56027957200","9572",Census Tract 9572,G5020,S,6801380673,4969450,"+43.0621590","-104.4683727",WY,-104.467310324348,42.7679410033113,"1","2"
1469,1860,"10003908",BARROW COUNTY DETENTION CENTER,652 BARROW PARK DRIVE,WINDER,GA,"30680",NOT AVAILABLE,(770) 307-3080,COUNTY,OPEN,222,BARROW,"13013",USA,"922140",CORRECTIONAL INSTITUTIONS,http://www.barrowga.org/departments/detention-center.aspx,2/22/2018,IMAGERY,2018-02-22T00:00:00.000Z,http://www.barrowga.org/departments/detention-center.aspx,NOT AVAILABLE,372,0.00610570411363,1.490970888e-06,22286.5546875,737.248489628627,"13","013","180107","13013180107","1801.07",Census Tract 1801.07,G5020,S,19207623,136185,"+34.0149923","-083.7895842",GA,-83.7613640574186,34.0010910800172,,"1"
1470,1861,"10001503",CHEMUNG COUNTY CORRECTIONAL FACILITY,211 WILLIAM ST,ELMIRA,NY,"14901",NOT AVAILABLE,(607) 737-2934,COUNTY,OPEN,165,CHEMUNG,"36015",USA,"922140",CORRECTIONAL INSTITUTIONS,"http://www.chemungcountyny.gov/resources/contact_directory/index.php, https://data.ny.gov/Public-Safety/Jail-Population-By-County-Beginning-1997/nymx-kgkn/data, http://www.chemungsheriff.net/index.asp?pageId=266",4/9/2018,IMAGERY,2018-04-09T00:00:00.000Z,http://www.chemungsheriff.net/index.asp?pageId=266,MAXIMUM,262,0.00278977548927,3.28019546e-07,5477.62890625,350.475929382199,"36","015","000700","36015000700","7",Census Tract 7,G5020,S,2441946,226127,"+42.0920401","-076.7977247",NY,-76.8014055869505,42.0912082856001,"2","1"
1471,1862,"10005125",EL PASO COUNTY JUVENILE DETENTION CENTER,6400 DELTA DRIVE,EL PASO,TX,"79905",NOT AVAILABLE,NOT AVAILABLE,COUNTY,OPEN,-999,EL PASO,"48141",USA,"922140",CORRECTIONAL INSTITUTIONS,http://www.epcounty.com/jvprobation/,4/26/2018,IMAGERY/OTHER,2018-04-26T00:00:00.000Z,http://www.epcounty.com/jvprobation/,JUVENILE,62,0.00691554240517,1.751276466e-06,25523.55078125,813.747143045566,"48","141","003602","48141003602","36.02",Census Tract 36.02,G5020,S,2955209,198521,"+31.7547941","-106.4083087",TX,-106.408837832519,31.7590845571179,"1","1"
1472,1863,"10003821",MIDLAND COUNTY JAIL,101 FAST ICE DR,MIDLAND,MI,"48642",NOT AVAILABLE,NOT AVAILABLE,COUNTY,OPEN,135,MIDLAND,"26111",USA,"922140",CORRECTIONAL INSTITUTIONS,https://co.midland.mi.us/Sheriff.aspx,3/21/2018,IMAGERY/OTHER,2018-03-21T00:00:00.000Z,https://co.midland.mi.us/Sheriff.aspx,MAXIMUM,274,0.00452802915595,1.092597592e-06,18696.17578125,621.873649372793,"26","111","290600","26111290600","2906",Census Tract 2906,G5020,S,21906868,728991,"+43.5914259","-084.1965115",MI,-84.1697944508957,43.598869175882,,"1"
1473,1864,"10003903",BARTOW COUNTY JAIL,104 ZENA DRIVE,CARTERSVILLE,GA,"30121",NOT AVAILABLE,(770) 382-5050,COUNTY,OPEN,634,BARTOW,"13015",USA,"922140",CORRECTIONAL INSTITUTIONS,https://www.bartow.org/,2/22/2018,IMAGERY,2018-02-22T00:00:00.000Z,https://www.bartow.org/,NOT AVAILABLE,-999,0.00746741492182,2.984612924e-06,44713.44921875,916.112248003559,"13","015","960402","13015960402","9604.02",Census Tract 9604.02,G5020,S,51460152,422945,"+34.2353226","-084.7965772",GA,-84.7774718430454,34.1913286067574,,"1"
1474,1865,"10001254",FANNIN COUNTY SOUTH JAIL ANNEX,725 COUNTY RD 4200,BONHAM,TX,"75418",NOT AVAILABLE,(903) 449-4200,COUNTY,OPEN,57,FANNIN,"48147",USA,"922140",CORRECTIONAL INSTITUTIONS,"https://www.tcjs.state.tx.us/index.php?linkID=325, https://www.geogroup.com/Locations",3/1/2018,IMAGERY,2018-04-26T00:00:00.000Z,NOT AVAILABLE,NOT AVAILABLE,96,0.00240566041785,2.28406191e-07,3396.72265625,287.748604937718,"48","147","950600","48147950600","9506",Census Tract 9506,G5020,S,163526487,604096,"+33.5113564","-096.2082036",TX,-96.1950163007311,33.5629996595055,,"1"
1475,1866,"10004430",FAYETTE COUNTY JAIL,1646 NORTH JEFFERSON,LA GRANGE,TX,"78945",NOT AVAILABLE,NOT AVAILABLE,COUNTY,OPEN,31,FAYETTE,"48149",USA,"922140",CORRECTIONAL INSTITUTIONS,"https://www.tcjs.state.tx.us/index.php?linkID=325, http://www.co.fayette.tx.us/default.aspx?Fayette_County/Sheriff.Corrections",3/1/2018,IMAGERY,2018-04-26T00:00:00.000Z,http://www.co.fayette.tx.us/default.aspx?Fayette_County/Sheriff.Corrections,NOT AVAILABLE,45,0.00190919647239,1.79446883e-07,2565.7578125,228.731252167591,"48","149","970300","48149970300","9703",Census Tract 9703,G5020,S,38097507,1465725,"+29.9155200","-096.8852933",TX,-96.8800891016782,29.9242286733935,,"1"
1476,1867,"10004540",BERRIEN COUNTY JAIL,500 COUNTY FARM ROAD,NASHVILLE,GA,"31639",NOT AVAILABLE,(229) 686-7664,COUNTY,OPEN,68,BERRIEN,"13019",USA,"922140",CORRECTIONAL INSTITUTIONS,http://www.interopweb.com/berrienjailpop/,2/22/2018,IMAGERY,2018-02-22T00:00:00.000Z,http://berriencountysheriff.com/,NOT AVAILABLE,-999,0.00293874594869,4.92967589e-07,7141.3046875,359.848837726247,"13","019","970300","13019970300","9703",Census Tract 9703,G5020,S,150782729,1060103,"+31.2406903","-083.2961258",GA,-83.2644880040574,31.1929826209609,,"1"
1477,1868,"10006613",LAKE'S CROSSING CENTER,500 GALLETTI WAY,SPARKS,NV,"89431",NOT AVAILABLE,(775) 688-1900,STATE,OPEN,-999,WASHOE,"32031",USA,"922140",CORRECTIONAL INSTITUTIONS,http://dhhs.nv.gov/Reports/Press_Releases/2015/State_Opens_Stein_Forensic_Unit_in_Las_Vegas/,11/23/2015,IMAGERY,2017-12-19T00:00:00.000Z,http://dpbh.nv.gov/Programs/ClinicalBehavioralServ/Clinical_Behavioral_Services_-_Home/,MAXIMUM,86,0.00387681492282,8.83178243e-07,14189.9765625,484.151876018221,"32","031","003101","32031003101","31.01",Census Tract 31.01,G5020,S,21477031,9695,"+39.5305792","-119.7174870",NV,-119.778143851005,39.5315420920662,"9","1"
1478,1869,"10003182",CHENANGO COUNTY JAIL,279 COUNTY ROAD 46,NORWICH,NY,"13815",NOT AVAILABLE,NOT AVAILABLE,COUNTY,OPEN,101,CHENANGO,"36017",USA,"922140",CORRECTIONAL INSTITUTIONS,"https://data.ny.gov/Public-Safety/Jail-Population-By-County-Beginning-1997/nymx-kgkn/data, http://www.chenangosheriff.us/home.html",4/9/2018,IMAGERY,2018-04-09T00:00:00.000Z,http://www.chenangosheriff.us/home.html,NOT AVAILABLE,133,0.0108498355642,4.526080893e-06,76083.4140625,1358.20796656274,"36","017","970601","36017970601","9706.01",Census Tract 9706.01,G5020,S,138498925,382745,"+42.5226347","-075.5409820",NY,-75.5366552880784,42.5080740602035,,"1"
1479,1870,"10002882",FORT BEND COUNTY JAIL,1410 WILLIAMS WAY BLVD,RICHMOND,TX,"77469",NOT AVAILABLE,(281) 341-4730,COUNTY,OPEN,929,FORT BEND,"48157",USA,"922140",CORRECTIONAL INSTITUTIONS,https://www.tcjs.state.tx.us/index.php?linkID=325,3/1/2018,IMAGERY/OTHER,2018-04-26T00:00:00.000Z,https://www.fortbendcountytx.gov/government/departments/administration-of-justice/sheriff-s-office/bureaus-divisions/detention-division,NOT AVAILABLE,1770,0.00741682926121,1.958476584e-06,27904.85546875,869.86174301505,"48","157","674700","48157674700","6747",Census Tract 6747,G5020,S,20844131,1178725,"+29.5733690","-095.7243066",TX,-95.7531902411718,29.5735125496201,,"2"
1480,1871,"10006675",CASPER REENTRY CENTER,10007 LANDMARK LANE,CASPER,WY,"82604",NOT AVAILABLE,(307) 268-4840,MULTI,OPEN,249,NATRONA,"56025",USA,"922140",CORRECTIONAL INSTITUTIONS,http://corrections.wyo.gov/home/services-and-programs/prison-rape-elimination-act-prea,8/3/2017,IMAGERY,2018-01-23T00:00:00.000Z,https://www.geogroup.com/Locations,MEDIUM,342,0.00508940235439,1.333249084e-06,22551.0859375,644.663522243562,"56","025","001800","56025001800","18",Census Tract 18,G5020,S,10782725593,81231183,"+42.8993523","-106.9506987",WY,-106.490480501445,42.8924722721311,,"1"
1481,1872,"10006746",HAMILTON COUNTY COMMUNITY CORRECTIONS,18104 CUMBERLAND ROAD,NOBLESVILLE,IN,"46060",NOT AVAILABLE,(317) 776-9760,COUNTY,OPEN,-999,HAMILTON,"18057",USA,"922140",CORRECTIONAL INSTITUTIONS,https://www.hamiltoncounty.in.gov/181/Community-Corrections,3/5/2018,IMAGERY,2018-03-05T00:00:00.000Z,https://www.hamiltoncounty.in.gov/181/Community-Corrections,NOT AVAILABLE,115,0.00578312871521,6.73345863e-07,10900.7109375,708.118281867545,"18","057","110600","18057110600","1106",Census Tract 1106,G5020,S,3224514,56585,"+40.0529469","-086.0042555",IN,-85.99439424815,40.0515544380384,"3","3"
1482,1873,"10003129",CLINTON COUNTY JAIL,25 MCCARTHY DR,PLATTSBURGH,NY,"12901",NOT AVAILABLE,NOT AVAILABLE,COUNTY,OPEN,210,CLINTON,"36019",USA,"922140",CORRECTIONAL INSTITUTIONS,https://www.clintoncountygov.com/sheriff,4/9/2018,IMAGERY,2018-04-09T00:00:00.000Z,https://www.clintoncountygov.com/sheriff,MAXIMUM,300,0.00715223828394,2.420273468e-06,42209.82421875,957.217874893541,"36","019","100800","36019100800","1008",Census Tract 1008,G5020,S,43113572,33156445,"+44.7277971","-073.3944159",NY,-73.4668689093912,44.7204659591843,,"1"
1483,1874,"10005642",WYOMING BOYS SCHOOL,1550 UNITED STATES HIGHWAY 20 SOUTH,WORLAND,WY,"82401",NOT AVAILABLE,(307) 347-6144,STATE,OPEN,72,WASHAKIE,"56043",USA,"922140",CORRECTIONAL INSTITUTIONS,http://dfsweb.wyo.gov/social-services/prison-rape-elimination-act-prea,4/14/2016,IMAGERY,2018-01-23T00:00:00.000Z,http://dfsweb.wyo.gov/social-services/wyoming-boys-school,JUVENILE,100,0.0214958736499,1.8312231497e-05,315232.67578125,2646.89801657878,"56","043","000200","56043000200","2",Census Tract 2,G5020,S,5780716345,9742603,"+43.8788305","-107.6690520",WY,-108.020552354461,43.9564692365347,,"1"
1484,1875,"10006614",STEIN FORENSIC UNIT,6161 WEST CHARLESTON BLVD,LAS VEGAS,NV,"89146",NOT AVAILABLE,NOT AVAILABLE,STATE,OPEN,12,CLARK,"32003",USA,"922140",CORRECTIONAL INSTITUTIONS,"https://www.reviewjournal.com/local/local-las-vegas/inside-nevadas-newest-facility-for-mentally-ill-offenders-photos/, http://dhhs.nv.gov/Reports/Press_Releases/2015/State_Opens_Stein_Forensic_Unit_in_Las_Vegas/",11/23/2015,IMAGERY/OTHER,2017-12-19T00:00:00.000Z,http://dpbh.nv.gov/Programs/ClinicalBehavioralServ/Clinical_Behavioral_Services_-_Home/,MAXIMUM,47,0.00209936535758,3.24626866e-07,4982.3671875,258.617075231039,"32","003","002905","32003002905","29.05",Census Tract 29.05,G5020,S,2712853,0,"+36.1518241","-115.2343383",NV,-115.226878136816,36.1568659625941,,"1"
1485,1876,"10003128",CLINTON CORRECTIONAL FACILITY - ANNEX,1074 RT. 374,DANNEMORA,NY,"12929",NOT AVAILABLE,(518) 492-2511,STATE,OPEN,839,CLINTON,"36019",USA,"922140",CORRECTIONAL INSTITUTIONS,http://www.doccs.ny.gov/faclist.html,11/13/2015,IMAGERY/OTHER,2017-12-19T00:00:00.000Z,http://www.doccs.ny.gov/faclist.html,MAXIMUM,828,0.0136963465949,1.0772597931e-05,187889.2578125,1740.15876333852,"36","019","100400","36019100400","1004",Census Tract 1004,G5020,S,602736545,19886302,"+44.8118022","-073.8649130",NY,-73.7171129084114,44.7248493233338,,"3"
1486,1877,"10000745",AUBURN CORRECTIONAL FACILITY,135 STATE ST,AUBURN,NY,"13024","9000",(315) 253-8401,STATE,OPEN,1601,CAYUGA,"36011",USA,"922140",CORRECTIONAL INSTITUTIONS,http://www.doccs.ny.gov/PREA/PREA_Final_Audit_Reports.html,3/10/2017,IMAGERY,2017-12-19T00:00:00.000Z,http://www.doccs.ny.gov/faclist.html,MAXIMUM,1766,0.0173798472632,1.0059179393e-05,170261.1875,2101.55569724972,"36","011","042100","36011042100","421",Census Tract 421,G5020,S,2495958,36656,"+42.9297297","-076.5819757",NY,-76.5742254488021,42.9345885329474,"4","1"
1487,1878,"10000744",CAPE VINCENT CORRECTIONAL FACILITY,36560 STATE ROUTE 12E,CAPE VINCENT,NY,"13618","0599",(315) 654-4100,STATE,OPEN,856,JEFFERSON,"36045",USA,"922140",CORRECTIONAL INSTITUTIONS,http://www.doccs.ny.gov/PREA/PREA_Final_Audit_Reports.html,9/21/2016,IMAGERY,2017-12-19T00:00:00.000Z,http://www.doccs.ny.gov/faclist.html,MEDIUM,882,0.0222083657427,2.3949278425e-05,413955.71875,2889.69182825929,"36","045","060200","36045060200","602",Census Tract 602,G5020,S,253283771,56747658,"+44.2311986","-076.0547168",NY,-76.1879761492496,44.1978332148522,,"1"
1488,1879,"10003131",BARE HILL CORRECTIONAL FACILITY,181 BRAND RD,MALONE,NY,"12953","0020",(518) 483-8411,STATE,OPEN,1424,FRANKLIN,"36033",USA,"922140",CORRECTIONAL INSTITUTIONS,http://www.doccs.ny.gov/PREA/PREA_Final_Audit_Reports.html,4/28/2017,IMAGERY,2017-12-19T00:00:00.000Z,http://www.doccs.ny.gov/faclist.html,MEDIUM,1714,0.0316815186853,4.065796381e-05,711047.08984375,4189.18909285332,"36","033","950502","36033950502","9505.02",Census Tract 9505.02,G5020,S,114073486,1379600,"+44.8056453","-074.3255971",NY,-74.3241564885265,44.8803640531206,,"4"
1489,1880,"10002290",BEDFORD HILLS CORRECTIONAL FACILITY,247 HARRIS RD,BEDFORD HILLS,NY,"10507","2400",(914) 241-3100,STATE,OPEN,823,WESTCHESTER,"36119",USA,"922140",CORRECTIONAL INSTITUTIONS,http://www.doccs.ny.gov/faclist.html,11/13/2015,IMAGERY,2017-12-19T00:00:00.000Z,http://www.doccs.ny.gov/faclist.html,MAXIMUM,972,0.0157637509896,1.1237871012e-05,185192.7890625,2075.17146081088,"36","119","983000","36119983000","9830",Census Tract 9830,G5020,S,860069,0,"+41.2430899","-073.6770955",NY,-73.6807852458899,41.2384033813294,,"2"
1490,1881,"10003127",CLINTON CORRECTIONAL FACILITY - MAIN,1156 RT. 374,DANNEMORA,NY,"12929","2000",(518) 492-2511,STATE,OPEN,2652,CLINTON,"36019",USA,"922140",CORRECTIONAL INSTITUTIONS,http://www.doccs.ny.gov/PREA/PREA_Final_Audit_Reports.html,2/3/2017,IMAGERY/OTHER,2017-12-19T00:00:00.000Z,http://www.doccs.ny.gov/faclist.html,MAXIMUM,2852,0.0153737648599,1.3579320929e-05,236837.34765625,1940.57862984525,"36","019","100400","36019100400","1004",Census Tract 1004,G5020,S,602736545,19886302,"+44.8118022","-073.8649130",NY,-73.7213185152457,44.7235558800746,,"3"
1491,1882,"10003199",DOWNSTATE CORRECTIONAL FACILITY,121 RED SCHOOLHOUSE ROAD,FISHKILL,NY,"12524","0445",(845) 831-6600,STATE,OPEN,1196,DUTCHESS,"36027",USA,"922140",CORRECTIONAL INSTITUTIONS,http://www.doccs.ny.gov/faclist.html,11/13/2015,IMAGERY,2017-12-19T00:00:00.000Z,http://www.doccs.ny.gov/faclist.html,MAXIMUM,-999,0.0201338966137,1.5631843521e-05,258769.94140625,2546.78370213562,"36","027","640001","36027640001","6400.01",Census Tract 6400.01,G5020,S,302373,0,"+41.5319765","-073.9459304",NY,-73.9455343863818,41.5323527125783,,"1"
1492,1883,"10003195",EASTERN NY CORRECTIONAL FACILITY,30 INSTITUTION RD,NAPANOCH,NY,"12458","0338",(845) 647-7400,STATE,OPEN,900,ULSTER,"36111",USA,"922140",CORRECTIONAL INSTITUTIONS,http://www.doccs.ny.gov/PREA/PREA_Final_Audit_Reports.html,10/7/2016,IMAGERY,2017-12-19T00:00:00.000Z,http://www.doccs.ny.gov/faclist.html,MAXIMUM,985,0.015120472587,1.2470025773e-05,207099.82421875,2018.28667498229,"36","111","954500","36111954500","9545",Census Tract 9545,G5020,S,97022998,904455,"+41.7190450","-074.3498504",NY,-74.3618269964997,41.7415225414432,,"2"
1493,1884,"10003166",COLLINS CORRECTIONAL FACILITY,"P.O. BOX 490, MIDDLE RD",COLLINS,NY,"14034","0490",(716) 532-4588,STATE,OPEN,1059,ERIE,"36029",USA,"922140",CORRECTIONAL INSTITUTIONS,http://www.doccs.ny.gov/PREA/PREA_Final_Audit_Reports.html,11/18/2016,IMAGERY,2017-12-19T00:00:00.000Z,http://www.doccs.ny.gov/faclist.html,MEDIUM,1107,0.0151579510711,9.969011221e-06,167535.546875,1821.46517002717,"36","029","016100","36029016100","161",Census Tract 161,G5020,S,3035322,11202,"+42.4864712","-078.9336616",NY,-78.938952042061,42.491831852435,,"2"
1494,1885,"10003188",COXSACKIE CORRECTIONAL FACILITY,11260 ROUTE 9 WEST,COXSACKIE,NY,"12051","0200",(518) 731-2781,STATE,OPEN,901,GREENE,"36039",USA,"922140",CORRECTIONAL INSTITUTIONS,http://www.doccs.ny.gov/PREA/PREA_Final_Audit_Reports.html,3/16/2016,IMAGERY,2017-12-19T00:00:00.000Z,http://www.doccs.ny.gov/faclist.html,MAXIMUM,1006,0.0172023545713,1.3919456412e-05,233372.21875,2205.00605504772,"36","039","080800","36039080800","808",Census Tract 808,G5020,S,1634601,0,"+42.3457567","-073.8306412",NY,-73.835787619625,42.3434320483619,,"2"
1495,1886,"10003198",FISHKILL CORRECTIONAL FACILITY,18 STRACK DRIVE,BEACON,NY,"12508","0307",(845) 831-4800,STATE,OPEN,1635,DUTCHESS,"36027",USA,"922140",CORRECTIONAL INSTITUTIONS,http://www.doccs.ny.gov/PREA/PREA_Final_Audit_Reports.html,4/14/2016,IMAGERY/OTHER,2017-12-19T00:00:00.000Z,http://www.doccs.ny.gov/faclist.html,MEDIUM,1840,0.0263797721579,2.2617303885e-05,374354.5,3355.69352700721,"36","027","640002","36027640002","6400.02",Census Tract 6400.02,G5020,S,2304853,13876,"+41.5216636","-073.9534317",NY,-73.9503969752636,41.5231558948969,,"2"
1496,1887,"10003132",FRANKLIN CORRECTIONAL FACILITY,62 BARE HILL RD,MALONE,NY,"12953","0010",(518) 483-6040,STATE,OPEN,1453,FRANKLIN,"36033",USA,"922140",CORRECTIONAL INSTITUTIONS,http://www.doccs.ny.gov/PREA/PREA_Final_Audit_Reports.html,2/10/2017,IMAGERY,2017-12-19T00:00:00.000Z,http://www.doccs.ny.gov/faclist.html,MEDIUM,1730,0.0251413112188,3.3525697264e-05,586198.2890625,3358.09517084022,"36","033","950502","36033950502","9505.02",Census Tract 9505.02,G5020,S,114073486,1379600,"+44.8056453","-074.3255971",NY,-74.3134370363682,44.8689274580718,,"4"
1497,1888,"10003122",GOUVERNEUR CORRECTIONAL FACILITY,112 SCOTCH SETTLEMENT RD,GOUVERNEUR,NY,"13642","0370",(315) 287-7351,STATE,OPEN,976,ST. LAWRENCE,"36089",USA,"922140",CORRECTIONAL INSTITUTIONS,http://www.doccs.ny.gov/PREA/PREA_Final_Audit_Reports.html,9/13/2017,IMAGERY,2017-12-19T00:00:00.000Z,http://www.doccs.ny.gov/faclist.html,MEDIUM,1082,0.0212551036923,2.4997840144e-05,433127.86328125,2732.59405417169,"36","089","492700","36089492700","4927",Census Tract 4927,G5020,S,184410078,2824347,"+44.3550917","-075.4898103",NY,-75.4418849922886,44.3401893473268,,"1"
1498,1889,"10003189",GREENE CORRECTIONAL FACILITY,165 PLANK RD,COXSACKIE,NY,"12051","0008",(518) 731-2741,STATE,OPEN,1648,GREENE,"36039",USA,"922140",CORRECTIONAL INSTITUTIONS,http://www.doccs.ny.gov/PREA/PREA_Final_Audit_Reports.html,4/7/2017,IMAGERY,2017-12-19T00:00:00.000Z,http://www.doccs.ny.gov/faclist.html,MEDIUM,1755,0.0308251774343,2.5793314138e-05,432469.25,3971.22375277941,"36","039","080800","36039080800","808",Census Tract 808,G5020,S,1634601,0,"+42.3457567","-073.8306412",NY,-73.8222629433349,42.3465417798981,,"2"
1499,1890,"10000755",LIVINGSTON CORRECTIONAL FACILITY,7005 SONYEA RD,SONYEA,NY,"14556","0049",(585) 658-3710,STATE,OPEN,772,LIVINGSTON,"36051",USA,"922140",CORRECTIONAL INSTITUTIONS,http://www.doccs.ny.gov/PREA/PREA_Final_Audit_Reports.html,10/6/2017,IMAGERY,2017-12-19T00:00:00.000Z,http://www.doccs.ny.gov/faclist.html,MEDIUM,874,0.0246668988095,2.6775856092e-05,451397.234375,3444.86080220104,"36","051","031000","36051031000","310",Census Tract 310,G5020,S,6019437,0,"+42.6790356","-077.8322178",NY,-77.823926525013,42.687064279494,,"3"
1500,1891,"10000756",GROVELAND CORRECTIONAL FACILITY,7000 SONYEA RD,SONYEA,NY,"14556","0050",(585) 658-2871,STATE,OPEN,1054,LIVINGSTON,"36051",USA,"922140",CORRECTIONAL INSTITUTIONS,http://www.doccs.ny.gov/PREA/PREA_Final_Audit_Reports.html,10/20/2016,IMAGERY,2017-12-19T00:00:00.000Z,http://www.doccs.ny.gov/faclist.html,MEDIUM,1106,0.0266776814873,3.8150335396e-05,643104.44140625,3535.59871043009,"36","051","031000","36051031000","310",Census Tract 310,G5020,S,6019437,0,"+42.6790356","-077.8322178",NY,-77.8367344846248,42.6825009330641,,"3"
1501,1892,"10006722",BIBB COUNTY DETENTION CENTER,645 HAZEL STREET,MACON,GA,"31204",NOT AVAILABLE,(478) 621-5666,COUNTY,OPEN,-999,BIBB,"13021",USA,"922140",CORRECTIONAL INSTITUTIONS,http://bibbsheriff.us/,2/22/2018,IMAGERY,2018-02-22T00:00:00.000Z,http://bibbsheriff.us/,NOT AVAILABLE,192,0.0024714918496,2.80974323e-07,4143.5625,289.048796774101,"13","021","013700","13021013700","137",Census Tract 137,G5020,S,3113580,49917,"+32.8338410","-083.6359378",GA,-83.6366728985847,32.8280365970817,"9","2"
1502,1893,"10000761",HUDSON CORRECTIONAL FACILITY / WORK RELEASE,50 E COURT ST,HUDSON,NY,"12534","0576",(518) 828-4311,STATE,OPEN,131,COLUMBIA,"36021",USA,"922140",CORRECTIONAL INSTITUTIONS,http://www.doccs.ny.gov/PREA/PREA_Final_Audit_Reports.html,4/5/2017,IMAGERY,2017-12-19T00:00:00.000Z,http://www.doccs.ny.gov/faclist.html,MEDIUM,315,0.0220595454283,1.4653253671e-05,245289.6328125,2832.52595371603,"36","021","001300","36021001300","13",Census Tract 13,G5020,S,3269352,316272,"+42.2473867","-073.7882806",NY,-73.7930983992074,42.2445896747599,"1","1"
1503,1894,"10003152",MID-STATE CORRECTIONAL FACILITY,9005 OLD RIVER RD,MARCY,NY,"13403","0216",(315) 768-8581,STATE,OPEN,1584,ONEIDA,"36065",USA,"922140",CORRECTIONAL INSTITUTIONS,http://www.doccs.ny.gov/PREA/PREA_Final_Audit_Reports.html,3/4/2016,IMAGERY,2017-12-19T00:00:00.000Z,http://www.doccs.ny.gov/faclist.html,MEDIUM,1716,0.0292715110242,2.6066904868e-05,442895.69140625,3729.05087692174,"36","065","026600","36065026600","266",Census Tract 266,G5020,S,2598046,0,"+43.1632615","-075.3043813",NY,-75.2971092870382,43.1687872767874,,"3"
1504,1895,"10005640",WYOMING GIRLS SCHOOL,3500 BIG HORN AVENUE,SHERIDAN,WY,"82801",NOT AVAILABLE,(307) 674-7476,STATE,OPEN,38,SHERIDAN,"56033",USA,"922140",CORRECTIONAL INSTITUTIONS,http://dfsweb.wyo.gov/social-services/prison-rape-elimination-act-prea,6/23/2015,IMAGERY,2018-01-23T00:00:00.000Z,http://dfsweb.wyo.gov/social-services/wyoming-girls-school,JUVENILE,65,0.0169703187273,1.4012350666e-05,244551.51953125,2197.39506263417,"56","033","000600","56033000600","6",Census Tract 6,G5020,S,2463544312,3267578,"+44.8342288","-107.4379982",WY,-106.968064176715,44.7618315356803,"3","1"
1505,1896,"10004506",BLECKLEY COUNTY JAIL,345 STATE HIGHWAY 87 BYPASS NORTH,COCHRAN,GA,"31014",NOT AVAILABLE,(478) 934-6282,COUNTY,CLOSED,0,BLECKLEY,"13023",USA,"922140",CORRECTIONAL INSTITUTIONS,http://courier-herald.com/bookmark/4881617-Bleckley-sheriff-announces-county-jail-close-Local-headline,6/30/2009,IMAGERY,2018-02-22T00:00:00.000Z,http://www.dcor.state.ga.us/GDC/FacilityMap/html/S_50000353.html,NOT AVAILABLE,-999,0.00305582025416,5.21344349e-07,7652.8828125,369.420443080475,"13","023","790200","13023790200","7902",Census Tract 7902,G5020,S,152309385,2277436,"+32.4141232","-083.4191400",GA,-83.3521822336835,32.4143801143562,,"2"
1506,1897,"10006795",MIDLAND COUNTY JUVENILE CARE CENTER,3712 E ASHMAN ST,MIDLAND,MI,"48640",NOT AVAILABLE,(989) 837-6080,COUNTY,OPEN,-999,MIDLAND,"26111",USA,"922140",CORRECTIONAL INSTITUTIONS,https://co.midland.mi.us/Courts/ProbateandJuvenileCourt/JuvenileCareCenter.aspx,3/21/2018,IMAGERY,2018-03-21T00:00:00.000Z,https://co.midland.mi.us/Courts/ProbateandJuvenileCourt/JuvenileCareCenter.aspx,JUVENILE,22,0.00298810024836,4.10836826e-07,7033.23828125,391.597902360292,"26","111","290700","26111290700","2907",Census Tract 2907,G5020,S,4890099,50768,"+43.6170755","-084.1920233",MI,-84.1812134979299,43.6256455165331,,"1"
1507,1898,"10003187",COLUMBIA COUNTY JAIL,85 INDUSTRIAL TRACT,HUDSON,NY,"12534",NOT AVAILABLE,NOT AVAILABLE,COUNTY,OPEN,104,COLUMBIA,"36021",USA,"922140",CORRECTIONAL INSTITUTIONS,"https://data.ny.gov/Public-Safety/Jail-Population-By-County-Beginning-1997/nymx-kgkn/data, http://www.columbiacountysheriff.us/",4/9/2018,IMAGERY,2018-04-09T00:00:00.000Z,http://www.columbiacountysheriff.us/,MAXIMUM,135,0.00529812336009,1.681876081e-06,28155.90234375,684.351483390669,"36","021","001100","36021001100","11",Census Tract 11,G5020,S,48192050,4868947,"+42.2300800","-073.7955201",NY,-73.7556924510651,42.2489476450732,,"1"
1508,1899,"10003149",MOHAWK CORRECTIONAL FACILITY,6514 ROUTE 26,ROME,NY,"13442",NOT AVAILABLE,(315) 339-5232,STATE,OPEN,1389,ONEIDA,"36065",USA,"922140",CORRECTIONAL INSTITUTIONS,http://www.doccs.ny.gov/PREA/PREA_Final_Audit_Reports.html,2/12/2016,IMAGERY,2017-12-20T00:00:00.000Z,http://www.doccs.ny.gov/faclist.html,MEDIUM,1423,0.0273955079975,3.188349607e-05,541831.9609375,3507.30970572113,"36","065","025900","36065025900","259",Census Tract 259,G5020,S,2173458,0,"+43.1823069","-075.4828586",NY,-75.4818514376063,43.1810417769803,,"2"
1509,1900,"10004545",BRANTLEY COUNTY JAIL,95 JOHN WILSON STREET,NAHUNTA,GA,"31553",NOT AVAILABLE,(912) 462-5727,COUNTY,OPEN,117,BRANTLEY,"13025",USA,"922140",CORRECTIONAL INSTITUTIONS,https://brantleyso.org/,2/22/2018,IMAGERY,2018-02-22T00:00:00.000Z,https://brantleyso.org/,MAXIMUM,-999,0.00408328148713,6.14429253e-07,8903.34765625,491.845179394649,"13","025","960200","13025960200","9602",Census Tract 9602,G5020,S,499794895,5148623,"+31.2018604","-081.9674237",GA,-81.9803358873255,31.2196325841274,,"1"
1510,1901,"10004483",BURKE COUNTY JAIL,225 STATE HIGHWAY 24 SOUTH,WAYNESBORO,GA,"30830",NOT AVAILABLE,(706) 554-2133,COUNTY,OPEN,-999,BURKE,"13033",USA,"922140",CORRECTIONAL INSTITUTIONS,http://www.burkecountysheriff.com/index.cfm,2/22/2018,IMAGERY,2018-02-22T00:00:00.000Z,http://www.burkecountysheriff.com/index.cfm,NOT AVAILABLE,-999,0.00515136289391,1.24842642e-06,18462.34375,631.850521054961,"13","033","950500","13033950500","9505",Census Tract 9505,G5020,S,371195007,2217746,"+33.0126673","-081.9713799",GA,-81.9957443001642,33.0756122307605,,"1"
1511,1902,"10003204",OTISVILLE CORRECTIONAL FACILITY,57 SANITORIUM ROAD,OTISVILLE,NY,"10963","0008",(845) 386-1490,STATE,OPEN,581,ORANGE,"36071",USA,"922140",CORRECTIONAL INSTITUTIONS,http://www.doccs.ny.gov/PREA/PREA_Final_Audit_Reports.html,10/20/2017,IMAGERY,2017-12-20T00:00:00.000Z,http://www.doccs.ny.gov/faclist.html,MEDIUM,603,0.039309683794,2.6886350586e-05,444767.9296875,4949.24774010776,"36","071","011500","36071011500","115",Census Tract 115,G5020,S,65096339,937239,"+41.4563179","-074.5269678",NY,-74.5251778903044,41.4873978770147,,"3"
1512,1903,"10003209",SING SING CORRECTIONAL FACILITY,354 HUNTER ST,OSSINING,NY,"10562","5442",(914) 941-0108,STATE,OPEN,1576,WESTCHESTER,"36119",USA,"922140",CORRECTIONAL INSTITUTIONS,http://www.doccs.ny.gov/PREA/PREA_Final_Audit_Reports.html,3/24/2016,IMAGERY,2017-12-20T00:00:00.000Z,http://www.doccs.ny.gov/faclist.html,MAXIMUM,1747,0.0172427255277,1.6030080109e-05,263813.2421875,2191.43812089352,"36","119","982000","36119982000","9820",Census Tract 9820,G5020,S,264916,0,"+41.1513369","-073.8684937",NY,-73.868396165393,41.1511320698711,,"1"
1513,1904,"10001420",BUTTS COUNTY JAIL,835 ERNEST BILES DR,JACKSON,GA,"30233",NOT AVAILABLE,(770) 775-8216,COUNTY,OPEN,-999,BUTTS,"13035",USA,"922140",CORRECTIONAL INSTITUTIONS,http://www.buttscountysheriff.com/,2/22/2018,IMAGERY,2018-02-22T00:00:00.000Z,http://www.buttscountysheriff.com/,MAXIMUM,320,0.00466383075859,1.232489802e-06,18272.3359375,580.663031863126,"13","035","150200","13035150200","1502",Census Tract 1502,G5020,S,98576517,672071,"+33.2903551","-083.9582206",GA,-83.9462164450275,33.2948642964747,,"1"
1514,1905,"10003197",WALLKILL CORRECTIONAL FACILITY,50 MCKENDRICK RD,WALLKILL,NY,"12589","0286",(845) 895-2021,STATE,OPEN,550,ULSTER,"36111",USA,"922140",CORRECTIONAL INSTITUTIONS,http://www.doccs.ny.gov/PREA/PREA_Final_Audit_Reports.html,10/18/2017,IMAGERY,2017-12-20T00:00:00.000Z,http://www.doccs.ny.gov/faclist.html,MEDIUM,608,0.0112037243842,4.323207756e-06,71672.9609375,1445.62573237852,"36","111","955400","36111955400","9554",Census Tract 9554,G5020,S,27577816,218627,"+41.6156275","-074.1664531",NY,-74.1625727245318,41.6283968804301,,"2"
1515,1906,"10003946",BROOKS COUNTY JAIL,1003 HOLLOWAY DRIVE,QUITMAN,GA,"31643",NOT AVAILABLE,(229) 263-8153,COUNTY,OPEN,92,BROOKS,"13027",USA,"922140",CORRECTIONAL INSTITUTIONS,http://www.brookscountyga.us/#departments,2/22/2018,IMAGERY,2018-02-22T00:00:00.000Z,http://www.brookscountyga.us/#departments,NOT AVAILABLE,-999,0.00267494937631,3.91195034e-07,5642.94921875,320.654230545157,"13","027","960500","13027960500","9605",Census Tract 9605,G5020,S,106886083,347926,"+30.7769129","-083.5298134",GA,-83.5474869685323,30.7874099127825,,"1"
1516,1907,"10004501",BULLOCH COUNTY CORRECTIONAL INSTITUTE,17301 UNITED STATES HIGHWAY 301 NORTH,STATESBORO,GA,"30458",NOT AVAILABLE,(912) 764-6217,COUNTY,OPEN,161,BULLOCH,"13031",USA,"922140",CORRECTIONAL INSTITUTIONS,http://www.dcor.state.ga.us/Research/Monthly,2/1/2018,IMAGERY,2018-02-22T00:00:00.000Z,http://bullochcounty.net/correctional-institute/,MEDIUM,183,0.00228880496367,3.30845763e-07,4859.357421875,273.713217626065,"13","031","110200","13031110200","1102",Census Tract 1102,G5020,S,106007059,2691045,"+32.5178585","-081.7702690",GA,-81.7671706319792,32.4668287268486,,"2"
1517,1908,"10003935",CALHOUN COUNTY JAIL,28959 NORTH BERMUDA STREET,MORGAN,GA,"39866",NOT AVAILABLE,(229) 849-2480,COUNTY,OPEN,-999,CALHOUN,"13037",USA,"922140",CORRECTIONAL INSTITUTIONS,http://www.dcor.state.ga.us/facility-finder,2/22/2018,IMAGERY,2018-02-22T00:00:00.000Z,http://www.calhouncountygasheriff.com/index.htm,NOT AVAILABLE,-999,0.00119736841505,8.7205338e-08,1267.953125,143.719569654291,"13","037","950100","13037950100","9501",Census Tract 9501,G5020,S,480739622,7127620,"+31.5256326","-084.5590576",GA,-84.5999091348889,31.5392025844999,,"2"
1518,1909,"10004552",CAMDEN COUNTY DETENTION FACILITY,209 EAST 4TH STREET,WOODBINE,GA,"31569",NOT AVAILABLE,(912) 510-5100,COUNTY,OPEN,144,CAMDEN,"13039",USA,"922140",CORRECTIONAL INSTITUTIONS,http://www.camdensheriff.org/,2/22/2018,IMAGERY,2018-02-22T00:00:00.000Z,http://www.camdensheriff.org/,NOT AVAILABLE,153,0.00316070134057,3.84361456e-07,5554.78515625,374.310368865316,"13","039","010200","13039010200","102",Census Tract 102,G5020,S,350600019,46235555,"+30.9200392","-081.6150638",GA,-81.7213058465889,30.9671808975515,,"1"
1519,1910,"10005163",MISSAUKEE COUNTY JAIL,110 SOUTH PINE STREET,LAKE CITY,MI,"49651",NOT AVAILABLE,(231) 839-4338 EXT 2,COUNTY,OPEN,34,MISSAUKEE,"26113",USA,"922140",CORRECTIONAL INSTITUTIONS,http://www.michigan.gov/documents/corrections/JPIS_-_CY_2010_344047_7.pdf,2/15/2016,IMAGERY/OTHER,2018-03-21T00:00:00.000Z,http://www.missaukee.org/departments/sheriff/index.html,NOT AVAILABLE,34,0.00247260111037,2.74169268e-07,4749.8671875,328.084136906187,"26","113","960200","26113960200","9602",Census Tract 9602,G5020,S,92847008,15047269,"+44.3240427","-085.2687633",MI,-85.2130080708756,44.3333905817593,,"1"
1520,1911,"10006896",WRANGELL CORRECTIONAL CENTER,431 ZIMOVIA HIGHWAY,WRANGELL,AK,"99929",NOT AVAILABLE,NOT AVAILABLE,LOCAL,OPEN,-999,WRANGELL BOROUGH,"02275",USA,"922140",CORRECTIONAL INSTITUTIONS,http://www.wrangell.com/publicsafety/welcome-wrangell-police-department,5/11/2018,IMAGERY,2018-05-11T00:00:00.000Z,NOT AVAILABLE,NOT AVAILABLE,-999,0.00222934778022,2.50253359e-07,5614.1484375,328.673182863397,"02","275","000300","02275000300","3",Census Tract 3,G5020,S,6619997018,2384375227,"+56.3174160","-132.3439780",AK,-132.377690059023,56.469473353842,,"1"
1521,1912,"10006615",FINGER LAKES RESIDENTIAL CENTER,250 AUBURN ROAD,LANSING,NY,"14882",NOT AVAILABLE,(607) 533-5000,STATE,OPEN,37,TOMPKINS,"36109",USA,"922140",CORRECTIONAL INSTITUTIONS,http://ocfs.ny.gov/main/rehab/prea.asp,6/17/2015,IMAGERY,2017-12-20T00:00:00.000Z,http://ocfs.ny.gov/main/rehab/regionalListing1.asp,JUVENILE,150,0.0117519844466,6.973043447e-06,117290.59375,1620.34307904102,"36","109","002300","36109002300","23",Census Tract 23,G5020,S,169940682,19074296,"+42.5786235","-076.5103607",NY,-76.497289265683,42.5474220994496,,"1"
1522,1913,"10006676",SAN LUIS REGIONAL DETENTION CENTER,406 N AVENUE D,SAN LUIS,AZ,"85349",NOT AVAILABLE,(928) 627-2101,MULTI,OPEN,-999,YUMA,"04027",USA,"922140",CORRECTIONAL INSTITUTIONS,http://www.lasallecorrections.com/our-locations-table/,1/23/2018,IMAGERY,2018-01-23T00:00:00.000Z,http://www.lasallecorrections.com/our-locations-table/,NOT AVAILABLE,860,0.00755634356049,3.231350073e-06,47470.37109375,920.155372074997,"04","027","980005","04027980005","9800.05",Census Tract 9800.05,G5020,S,56315499,0,"+32.4621698","-114.6193818",AZ,-114.684959401783,32.4845473438717,,"2"
1523,1914,"10003920",CARROLL COUNTY CORRECTIONAL INSTITUTION,96 HORSLEY MILL ROAD,CARROLLTON,GA,"30117",NOT AVAILABLE,(770) 830-5905,COUNTY,OPEN,249,CARROLL,"13045",USA,"922140",CORRECTIONAL INSTITUTIONS,"http://www.dcor.state.ga.us/Research/Monthly, http://www.carrollcountyga.com/285/Prison-Correctional-Institute",2/1/2018,IMAGERY,2018-02-22T00:00:00.000Z,http://www.carrollcountyga.com/285/Prison-Correctional-Institute,MEDIUM,240,0.00349426891448,6.23252319e-07,9270.3203125,422.169971059167,"13","045","910701","13045910701","9107.01",Census Tract 9107.01,G5020,S,65014370,477230,"+33.5725958","-084.9995241",GA,-85.0465977306082,33.5786971145741,,"2"
1524,1915,"10003731",AUTAUGA COUNTY METRO JAIL,136 NORTH COURT STREET,PRATTVILLE,AL,"36067",NOT AVAILABLE,(334) 361-2600,COUNTY,OPEN,160,AUTAUGA,"01001",USA,"922140",CORRECTIONAL INSTITUTIONS,"https://www.autaugasheriff.org/metro-jail, http://www.autaugaco.org/Default.asp?ID=180&pg=Metro+Jail&hilite=jail",1/23/2018,IMAGERY,2018-01-23T00:00:00.000Z,https://www.autaugasheriff.org/metro-jail,NOT AVAILABLE,138,0.00264027750869,4.08034128e-07,5992.8828125,325.900951317148,"01","001","020200","01001020200","202",Census Tract 202,G5020,S,3325680,5669,"+32.4757580","-086.4724678",AL,-86.4744348481756,32.4639701238477,,"1"
1525,1916,"10003749",BALDWIN COUNTY CORRECTIONS CENTER,200 HAND AVE.,BAY MINETTE,AL,"36507",NOT AVAILABLE,(251) 580-2581,COUNTY,OPEN,-999,BALDWIN,"01003",USA,"922140",CORRECTIONAL INSTITUTIONS,http://baldwincountyal.gov/Government/a-to-z-guide/j/jail,1/23/2018,IMAGERY,2018-01-23T00:00:00.000Z,http://sheriff.baldwincountyal.gov/divisions-details/correctionsdetails,NOT AVAILABLE,700,0.00443507219919,1.223347203e-06,17664.62109375,532.388148882281,"01","003","010500","01003010500","105",Census Tract 105,G5020,S,17224861,147934,"+30.8969612","-087.7737368",AL,-87.7744277723024,30.8850518079172,"4","1"
1526,1917,"10001212",BIBB COUNTY JAIL,94 BIBB LANE,BRENT,AL,"35034",NOT AVAILABLE,(205) 926-9581,COUNTY,OPEN,-999,BIBB,"01007",USA,"922140",CORRECTIONAL INSTITUTIONS,http://bibbcosoal.org/,2/15/2016,IMAGERY,2018-01-23T00:00:00.000Z,http://bibbcosoal.org/,NOT AVAILABLE,88,0.00227618647598,3.07968165e-07,4546.5,267.194119622402,"01","007","010004","01007010004","100.04",Census Tract 100.04,G5020,S,504192830,2208353,"+32.9481242","-087.2799971",AL,-87.1578184920517,32.92269396813,,"2"
1527,1918,"10003933",CHATTAHOOCHEE COUNTY SHERIFF,379 BROAD ST.,CUSSETA,GA,"31805",NOT AVAILABLE,(706) 989-3644,COUNTY,OPEN,-999,CHATTAHOOCHEE,"13053",USA,"922140",CORRECTIONAL INSTITUTIONS,http://www.dcor.state.ga.us/facility-finder,2/22/2018,UNVERIFIED,2018-02-22T00:00:00.000Z,NOT AVAILABLE,NOT AVAILABLE,-999,0.00177331014581,1.833077e-07,2687.58984375,211.547700348248,"13","053","020100","13053020100","201",Census Tract 201,G5020,S,154273471,2004242,"+32.2725435","-084.7487963",GA,-84.7765481003012,32.3064523278554,,"1"
1528,1919,"10003921",CARROLL COUNTY JAIL,1000 NEWNAN ROAD,CARROLLTON,GA,"30116",NOT AVAILABLE,(770) 830-5888,COUNTY,OPEN,537,CARROLL,"13045",USA,"922140",CORRECTIONAL INSTITUTIONS,http://carrollsheriff.info/index.php,2/22/2018,IMAGERY,2018-02-22T00:00:00.000Z,http://carrollsheriff.info/index.php,MAXIMUM,645,0.00435544566457,1.12569232e-06,16741.7421875,522.647409649335,"13","045","910701","13045910701","9107.01",Census Tract 9107.01,G5020,S,65014370,477230,"+33.5725958","-084.9995241",GA,-85.0467988293711,33.5687334434649,,"2"
1529,1920,"10003180",CORTLAND COUNTY CORRECTIONAL FACILITY,54 GREENBUSH ST,CORTLAND,NY,"13045",NOT AVAILABLE,(607) 756-3438,COUNTY,OPEN,80,CORTLAND,"36023",USA,"922140",CORRECTIONAL INSTITUTIONS,"https://data.ny.gov/Public-Safety/Jail-Population-By-County-Beginning-1997/nymx-kgkn/data, https://www.cortland-co.org/351/County-Sheriffs-Office",4/10/2018,IMAGERY,2018-04-10T00:00:00.000Z,https://www.cortland-co.org/351/County-Sheriffs-Office,NOT AVAILABLE,90,0.00253981937998,2.48219343e-07,4178.62109375,322.278948910828,"36","023","970600","36023970600","9706",Census Tract 9706,G5020,S,1331961,0,"+42.5993688","-076.1735548",NY,-76.1757938047481,42.5985477857699,,"1"
1530,1921,"10002143",CHATHAM COUNTY JAIL,1050 CARL GRIFFIN DR,SAVANNAH,GA,"31405",NOT AVAILABLE,(912) 652-7700,COUNTY,OPEN,1739,CHATHAM,"13051",USA,"922140",CORRECTIONAL INSTITUTIONS,http://www.chathamsheriff.org/,2/22/2018,IMAGERY,2018-02-22T00:00:00.000Z,http://www.chathamsheriff.org/,MAXIMUM,1992,0.0133832703583,8.110796957e-06,118604.298828125,1602.01288275749,"13","051","010501","13051010501","105.01",Census Tract 105.01,G5020,S,33598831,687051,"+32.0535751","-081.1761253",GA,-81.1682252543478,32.0664153512212,,"2"
1531,1922,"10001409",CHATTOOGA COUNTY JAIL / SHERIFF,35 W WASHINGTON ST,SUMMERVILLE,GA,"30747",NOT AVAILABLE,(706) 857-0717,COUNTY,OPEN,-999,CHATTOOGA,"13055",USA,"922140",CORRECTIONAL INSTITUTIONS,http://www.chattoogasheriff.com/,2/22/2018,IMAGERY,2018-02-22T00:00:00.000Z,http://www.chattoogasheriff.com/,NOT AVAILABLE,-999,0.00148587534467,1.37656668e-07,2069.40625,180.436638934069,"13","055","010400","13055010400","104",Census Tract 104,G5020,S,53835762,154305,"+34.4976401","-085.3864221",GA,-85.3487571892094,34.4805941359211,,"1"
1532,1923,"10004915",HANCOCK COUNTY JAIL,123 E MAIN ST,GREENFIELD,IN,"46140",NOT AVAILABLE,(317) 477-1158,COUNTY,OPEN,302,HANCOCK,"18059",USA,"922140",CORRECTIONAL INSTITUTIONS,http://sheriffweb.hancockcoingov.org/ShfWeb2.nsf/xHome.xsp,3/5/2018,IMAGERY,2018-03-05T00:00:00.000Z,http://sheriffweb.hancockcoingov.org/ShfWeb2.nsf/xHome.xsp,NOT AVAILABLE,257,0.00404565535366,4.19592212e-07,6766.296875,507.98875336527,"18","059","410500","18059410500","4105",Census Tract 4105,G5020,S,5375901,5093,"+39.7787686","-085.7690627",IN,-85.7671428406147,39.7848397634767,,"1"
1533,1924,"10002909",FRIO COUNTY DETENTION CENTER,502 S CEDAR ST,PEARSALL,TX,"78061",NOT AVAILABLE,NOT AVAILABLE,COUNTY,OPEN,2,FRIO,"48163",USA,"922140",CORRECTIONAL INSTITUTIONS,"https://www.tcjs.state.tx.us/index.php?linkID=325, https://texasjailproject.org/list_of_county_jails/",3/1/2018,IMAGERY/OTHER,2018-04-26T00:00:00.000Z,NOT AVAILABLE,MAXIMUM,391,0.00515959840663,1.286977523e-06,18214.66796875,624.812124729343,"48","163","950100","48163950100","9501",Census Tract 9501,G5020,S,1426854818,1321120,"+28.8732381","-098.9368440",TX,-99.0913852136424,28.8872849697328,"3","1"
1534,1925,"10006255",CHEROKEE COUNTY DETENTION CENTER,110 CEDAR BLUFF RD,CENTRE,AL,"35960",NOT AVAILABLE,(256) 927-6435,COUNTY,OPEN,83,CHEROKEE,"01019",USA,"922140",CORRECTIONAL INSTITUTIONS,"http://www.cherokeecountyalsheriff.com/roster.php, http://www.cherokeecountyalsheriff.com/page.php?id=5",1/24/2018,IMAGERY/OTHER,2018-01-24T00:00:00.000Z,http://www.cherokeecountyalsheriff.com/page.php?id=5,NOT AVAILABLE,114,0.00252698340635,3.55947225e-07,5330.13671875,308.240196230742,"01","019","956000","01019956000","9560",Census Tract 9560,G5020,S,62085184,15223218,"+34.1660879","-085.6541706",AL,-85.6779697005107,34.1530511175148,,"1"
1535,1926,"10006616",HIGHLAND RESIDENTIAL CENTER,629 NORTH CHODIKEE LAKE ROAD,HIGHLAND,NY,"12528",NOT AVAILABLE,(845) 691-6006,STATE,OPEN,39,ULSTER,"36111",USA,"922140",CORRECTIONAL INSTITUTIONS,http://ocfs.ny.gov/main/rehab/prea.asp,6/13/2017,IMAGERY,2017-12-20T00:00:00.000Z,http://ocfs.ny.gov/main/rehab/regionalListing1.asp,JUVENILE,50,0.0387157856887,1.6946153363e-05,281546.80859375,5416.42574958681,"36","111","953700","36111953700","9537",Census Tract 9537,G5020,S,68842504,4220119,"+41.7304772","-074.0048609",NY,-73.982330141691,41.7661538078747,,"1"
1536,1927,"10003723",CHILTON COUNTY JAIL,301 CITY STREET,CLANTON,AL,"35045",NOT AVAILABLE,(205) 755-1053,COUNTY,OPEN,-999,CHILTON,"01021",USA,"922140",CORRECTIONAL INSTITUTIONS,http://www.chiltoncountyso.org/corrections,1/24/2018,IMAGERY,2018-01-24T00:00:00.000Z,http://www.chiltoncountyso.org/corrections,NOT AVAILABLE,180,0.00380186106136,9.18102313e-07,13540.6171875,458.423306373242,"01","021","060101","01021060101","601.01",Census Tract 601.01,G5020,S,55899112,209294,"+32.8154498","-086.6415349",AL,-86.6255843532879,32.836224549596,,"1"
1537,1928,"10003720",JAMES C. MORGAN CHAMBERS COUNTY DETENTION FACILITY,105 ALABAMA AVENUE WEST,LAFAYETTE,AL,"36862",NOT AVAILABLE,(334) 861-4336,COUNTY,OPEN,-999,CHAMBERS,"01017",USA,"922140",CORRECTIONAL INSTITUTIONS,http://www.chamberscountysheriff.org/jail.html,1/24/2018,IMAGERY,2018-01-24T00:00:00.000Z,http://www.chamberscountysheriff.org/jail.html,NOT AVAILABLE,-999,0.00409001052634,8.18374388e-07,12078.37890625,478.513587232343,"01","017","954000","01017954000","9540",Census Tract 9540,G5020,S,676131584,2617357,"+32.8660782","-085.4616055",AL,-85.4035793088006,32.8993797603666,,"1"
1538,1929,"10003146",INDUSTRY RESIDENTIAL CENTER,375 RUSH SCOTTSVILLE RD,RUSH,NY,"14543",NOT AVAILABLE,(585) 533-2600,STATE,OPEN,42,MONROE,"36055",USA,"922140",CORRECTIONAL INSTITUTIONS,http://ocfs.ny.gov/main/rehab/prea.asp,8/29/2017,IMAGERY,2017-12-20T00:00:00.000Z,http://ocfs.ny.gov/main/rehab/regionalListing1.asp,JUVENILE,50,0.0291220685667,3.6426878048e-05,617211.01171875,3903.2584335243,"36","055","013300","36055013300","133",Census Tract 133,G5020,S,78558656,966740,"+42.9713291","-077.6731429",NY,-77.7166431847395,42.9996429465198,,"3"
1539,1930,"10003904",CHEROKEE COUNTY ADULT DETENTION CENTER,498 CHATTIN DRIVE,CANTON,GA,"30115",NOT AVAILABLE,(770) 345-3308,COUNTY,OPEN,-999,CHEROKEE,"13057",USA,"922140",CORRECTIONAL INSTITUTIONS,http://www.cherokeega-sheriff.org/,2/22/2018,IMAGERY,2018-02-22T00:00:00.000Z,http://www.cherokeega-sheriff.org/,MAXIMUM,512,0.00714548159061,1.657773432e-06,24836.75390625,865.330143650162,"13","057","090601","13057090601","906.01",Census Tract 906.01,G5020,S,21740103,256461,"+34.2078484","-084.4869765",GA,-84.4920308653952,34.1950553127461,,"1"
1540,1931,"10003852",MONROE COUNTY INMATE DORMITORY FACILITY,7000 E DUNBAR RD,MONROE,MI,"48161",NOT AVAILABLE,(734) 240-8000,COUNTY,OPEN,182,MONROE,"26115",USA,"922140",CORRECTIONAL INSTITUTIONS,"http://www.michigan.gov/documents/corrections/JPIS_-_CY_2010_344047_7.pdf, http://www.co.monroe.mi.us/officials_and_departments/officials/sheriff/index.php",2/15/2016,IMAGERY,2018-03-21T00:00:00.000Z,http://www.co.monroe.mi.us/officials_and_departments/officials/sheriff/index.php,MINIMUM,400,0.00542805743345,1.313540562e-06,21867.69921875,664.194552382166,"26","115","831800","26115831800","8318",Census Tract 8318,G5020,S,6638123,1710435,"+41.8937515","-083.3639464",MI,-83.3930859766981,41.8959127240362,"6","1"
1541,1932,"10006401",CLEBURNE COUNTY JAIL,140 LAMBERT DR,HEFLIN,AL,"36264",NOT AVAILABLE,(256) 463-7336,COUNTY,OPEN,67,CLEBURNE,"01029",USA,"922140",CORRECTIONAL INSTITUTIONS,http://www.cleburnecountyso.org/cur_inmates.html,1/24/2018,IMAGERY,2018-01-24T00:00:00.000Z,http://www.cleburnecountyso.org/,NOT AVAILABLE,-999,0.00257755113261,3.350116e-07,4987.61328125,308.442045390425,"01","029","959600","01029959600","9596",Census Tract 9596,G5020,S,243826727,915596,"+33.6989979","-085.5727972",AL,-85.5692697592249,33.6582508590336,,"1"
1542,1933,"10005698",CHOCTAW COUNTY JAIL,117 SOUTH MULBERRY AVE,BUTLER,AL,"36904",NOT AVAILABLE,(205) 459-2166,COUNTY,OPEN,-999,CHOCTAW,"01023",USA,"922140",CORRECTIONAL INSTITUTIONS,http://www.choctawso.com/,1/24/2018,UNVERIFIED,2018-01-24T00:00:00.000Z,http://www.choctawso.com/,NOT AVAILABLE,-999,0.0019310954381,2.24144517e-07,3278.45703125,233.817478652197,"01","023","956800","01023956800","9568",Census Tract 9568,G5020,S,752715861,7297622,"+32.0656633","-088.2128479",AL,-88.2228088572912,32.0885578775633,,"1"
1543,1934,"10003719",CLAY COUNTY DETENTION CENTER,41771 STATE HIGHWAY 77,ASHLAND,AL,"36251",NOT AVAILABLE,(256) 354-7713,COUNTY,OPEN,-999,CLAY,"01027",USA,"922140",CORRECTIONAL INSTITUTIONS,http://www.clayso.net/,1/24/2018,IMAGERY,2018-01-24T00:00:00.000Z,http://www.clayso.net/,NOT AVAILABLE,480,0.0031807301671,5.38689547e-07,7984.390625,386.939388805451,"01","027","959000","01027959000","9590",Census Tract 9590,G5020,S,179658298,1129596,"+33.3093759","-085.8820883",AL,-85.8566707468305,33.2731534697394,,"1"
1544,1935,"10005636",HARRISON COUNTY JAIL,1445 GARDNER LANE,CORYDON,IN,"47112",NOT AVAILABLE,(812) 738-2195,COUNTY,OPEN,-999,HARRISON,"18061",USA,"922140",CORRECTIONAL INSTITUTIONS,http://www.hcsdin.net/,3/5/2018,IMAGERY,2018-03-05T00:00:00.000Z,http://www.hcsdin.net/,NOT AVAILABLE,175,0.0034184945829,4.99339305e-07,7876.48046875,427.553596941737,"18","061","060300","18061060300","603",Census Tract 603,G5020,S,168199408,547220,"+38.1712947","-086.2368647",IN,-86.143321697621,38.2230281214614,,"1"
1545,1936,"10000752",TABERG RESIDENTIAL CENTER FOR GIRLS,10011 TABERG FLORENCE RD,TABERG,NY,"13471",NOT AVAILABLE,(315) 245-0084,STATE,OPEN,12,ONEIDA,"36065",USA,"922140",CORRECTIONAL INSTITUTIONS,http://ocfs.ny.gov/main/rehab/prea.asp,7/20/2016,IMAGERY,2017-12-20T00:00:00.000Z,http://ocfs.ny.gov/main/rehab/regionalListing1.asp,JUVENILE,24,0.00977241047471,2.466934117e-06,42035.75,1283.08375551588,"36","065","024400","36065024400","244",Census Tract 244,G5020,S,298080240,1041317,"+43.3876328","-075.6879515",NY,-75.667600380629,43.3440265644815,,"1"
1546,1937,"10003914",CLARKE COUNTY CORRECTIONAL INSTITUTION,2825 COUNTY FARM ROAD,ATHENS,GA,"30601",NOT AVAILABLE,(706) 613-3400,COUNTY,OPEN,126,CLARKE,"13059",USA,"922140",CORRECTIONAL INSTITUTIONS,http://www.dcor.state.ga.us/Research/Monthly,6/22/2016,IMAGERY,2018-02-22T00:00:00.000Z,https://www.athensclarkecounty.com/356/Corrections,MEDIUM,115,0.00768782121592,2.587059994e-06,38644.921875,956.35274107753,"13","059","140500","13059140500","1405",Census Tract 1405,G5020,S,21229385,213743,"+33.9673636","-083.3253653",GA,-83.3303083599963,33.9447170279982,,"2"
1547,1938,"10006677",TUSCUMBIA CITY JAIL,218 S. DICKSON STREET,TUSCUMBIA,AL,"35674",NOT AVAILABLE,(256) 383-3121,LOCAL,OPEN,-999,COLBERT,"01033",USA,"922140",CORRECTIONAL INSTITUTIONS,http://cityoftuscumbia.org/?page_id=83,1/24/2018,IMAGERY,2018-01-24T00:00:00.000Z,http://cityoftuscumbia.org/?page_id=83,NOT AVAILABLE,-999,0.00110429332214,5.8430374e-08,881.03515625,129.831757624456,"01","033","020500","01033020500","205",Census Tract 205,G5020,S,23612763,610520,"+34.7223356","-087.7237520",AL,-87.7017721385571,34.7305506620368,,"2"
1548,1939,"10003186",DELAWARE COUNTY CORRECTIONAL FACILITY,280 PHOEBE LANE,DELHI,NY,"13753",NOT AVAILABLE,(607) 832-5863,COUNTY,OPEN,87,DELAWARE,"36025",USA,"922140",CORRECTIONAL INSTITUTIONS,"https://data.ny.gov/Public-Safety/Jail-Population-By-County-Beginning-1997/nymx-kgkn/data, http://www.co.delaware.ny.us/departments/shrf/reports.htm",4/10/2018,IMAGERY,2018-04-10T00:00:00.000Z,http://www.co.delaware.ny.us/departments/shrf/shrf.htm,NOT AVAILABLE,121,0.00519225301703,1.090955446e-06,18275.84375,671.188309489638,"36","025","970800","36025970800","9708",Census Tract 9708,G5020,S,165449486,1037095,"+42.2723546","-074.9075479",NY,-74.9104638906686,42.2917029350115,,"1"
1549,1940,"10004388",GAINES COUNTY JAIL,305 EAST AVENUE A,SEMINOLE,TX,"79360",NOT AVAILABLE,NOT AVAILABLE,COUNTY,OPEN,38,GAINES,"48165",USA,"922140",CORRECTIONAL INSTITUTIONS,"https://www.tcjs.state.tx.us/index.php?linkID=325, http://www.co.gaines.tx.us/default.aspx?Gaines_County/Sheriff, http://www.newswest9.com/story/30049305/new-gaines-county-jail-complete-in-seminole",3/1/2018,IMAGERY/OTHER,2018-04-26T00:00:00.000Z,NOT AVAILABLE,NOT AVAILABLE,96,0.00232361730788,2.87898229e-07,4240.49609375,283.421983422075,"48","165","950300","48165950300","9503",Census Tract 9503,G5020,S,5989818,0,"+32.7187160","-102.6518225",TX,-102.641504492706,32.7195380504207,,"1"
1550,1941,"10004919",HENDRICKS COUNTY JAIL,925 E MAIN ST,DANVILLE,IN,"46122",NOT AVAILABLE,NOT AVAILABLE,COUNTY,OPEN,246,HENDRICKS,"18063",USA,"922140",CORRECTIONAL INSTITUTIONS,http://www.co.hendricks.in.us/department/index.php?structureid=59,3/5/2018,IMAGERY,2018-03-05T00:00:00.000Z,http://www.co.hendricks.in.us/department/index.php?structureid=59,NOT AVAILABLE,-999,0.0020479904007,2.13450984e-07,3440.79296875,257.680255360626,"18","063","210502","18063210502","2105.02",Census Tract 2105.02,G5020,S,49663379,310100,"+39.7398193","-086.5185986",IN,-86.5039868830052,39.7585425402337,,"2"
1551,1942,"10003745",CONECUH COUNTY DETENTION CENTER,104 LIBERTY STREET,EVERGREEN,AL,"36401",NOT AVAILABLE,(251) 578-1260,COUNTY,OPEN,-999,CONECUH,"01035",USA,"922140",CORRECTIONAL INSTITUTIONS,http://www.alabamasheriffs.com/county_map/,1/24/2018,IMAGERY,2018-01-24T00:00:00.000Z,http://www.alabamasheriffs.com/county_map/,NOT AVAILABLE,-999,0.00238676836517,2.8848662e-07,4189.921875,281.204061758559,"01","035","960500","01035960500","9605",Census Tract 9605,G5020,S,90543663,334237,"+31.4626914","-086.9984985",AL,-86.9540708626358,31.4362135584413,,"1"
1552,1943,"10002289",DUTCHESS COUNTY JAIL,150 N HAMILTON ST,POUGHKEEPSIE,NY,"12601",NOT AVAILABLE,(845) 486-3900,COUNTY,OPEN,412,DUTCHESS,"36027",USA,"922140",CORRECTIONAL INSTITUTIONS,"http://www.criminaljustice.ny.gov/crimnet/ojsa/jail_pop_y.pdf, http://www.dutchessny.gov/CountyGov/Departments/Sheriff/SHIndex.htm",4/10/2018,IMAGERY,2018-04-10T00:00:00.000Z,http://www.dutchessny.gov/CountyGov/Departments/Sheriff/SHIndex.htm,MAXIMUM,257,0.00658651078846,1.754432972e-06,29123.3984375,854.55674507484,"36","027","220201","36027220201","2202.01",Census Tract 2202.01,G5020,S,1166323,0,"+41.7105131","-073.9238613",NY,-73.9214290887262,41.7108367094002,,"1"
1553,1944,"10006619",RED HOOK RESIDENTIAL CENTER,531 TURKEY HILL ROAD,RED HOOK,NY,"12571",NOT AVAILABLE,(845) 758-4151,STATE,OPEN,7,DUTCHESS,"36027",USA,"922140",CORRECTIONAL INSTITUTIONS,http://ocfs.ny.gov/main/rehab/prea.asp,7/28/2015,IMAGERY,2017-12-20T00:00:00.000Z,http://ocfs.ny.gov/main/rehab/regionalListing1.asp,JUVENILE,22,0.00338571710711,6.48393253e-07,10815.4296875,419.652896508224,"36","027","150005","36027150005","1500.05",Census Tract 1500.05,G5020,S,33444875,393558,"+42.0032371","-073.8458280",NY,-73.815830562062,42.0199180610922,,"1"
1554,1945,"10006617",SGT. HENRY JOHNSON YOUTH LEADERSHIP ACADEMY,57081 STATE HIGHWAY 10,SOUTH KORTRIGHT,NY,"13842",NOT AVAILABLE,(607) 538-1401,STATE,OPEN,-999,DELAWARE,"36025",USA,"922140",CORRECTIONAL INSTITUTIONS,http://ocfs.ny.gov/main/rehab/regionalListing1.asp,12/20/2017,IMAGERY,2017-12-20T00:00:00.000Z,http://ocfs.ny.gov/main/rehab/regionalListing1.asp,JUVENILE,26,0.00554021096095,1.315176867e-06,22051.3828125,739.420724881565,"36","025","970200","36025970200","9702",Census Tract 9702,G5020,S,312229664,1025620,"+42.3808093","-074.8611393",NY,-74.7184226521354,42.347000824456,,"1"
1555,1946,"10003163",ERIE COUNTY CORRECTIONAL FACILITY,11581 WALDEN AVE,ALDEN,NY,"14004",NOT AVAILABLE,(716) 858-7618,COUNTY,OPEN,606,ERIE,"36029",USA,"922140",CORRECTIONAL INSTITUTIONS,http://www2.erie.gov/sheriff/,4/10/2018,IMAGERY,2018-04-10T00:00:00.000Z,http://www2.erie.gov/sheriff/,MEDIUM,884,0.0137573435577,4.389840165e-06,74299.6640625,1700.11684108006,"36","029","014904","36029014904","149.04",Census Tract 149.04,G5020,S,3568790,45008,"+42.9283887","-078.5507537",NY,-78.5567970468926,42.9324585305397,,"3"
1556,1947,"10006618",BRENTWOOD RESIDENTIAL CENTER,1230 COMMACK ROAD,DIX HILLS,NY,"11746","8215",(631) 667-1188,STATE,OPEN,15,SUFFOLK,"36103",USA,"922140",CORRECTIONAL INSTITUTIONS,http://ocfs.ny.gov/main/rehab/prea.asp,7/14/2016,IMAGERY,2017-12-20T00:00:00.000Z,http://ocfs.ny.gov/main/rehab/regionalListing1.asp,JUVENILE,25,0.00326350354658,5.58890126e-07,9147.515625,403.147334340558,"36","103","112210","36103112210","1122.10",Census Tract 1122.10,G5020,S,10865767,0,"+40.7935221","-073.3227356",NY,-73.3033566320183,40.7888605484879,,"1"
1557,1948,"10001501",ERIE COUNTY HOLDING CENTER,40 DELAWARE AVE,BUFFALO,NY,"14202",NOT AVAILABLE,(716) 858-7618,COUNTY,OPEN,397,ERIE,"36029",USA,"922140",CORRECTIONAL INSTITUTIONS,http://www2.erie.gov/sheriff/,4/10/2018,IMAGERY,2018-04-10T00:00:00.000Z,http://www2.erie.gov/sheriff/,MAXIMUM,638,0.00282837940482,4.10385637e-07,6940.51171875,370.700969258079,"36","029","016500","36029016500","165",Census Tract 165,G5020,S,1893940,14136,"+42.8845969","-078.8730209",NY,-78.8793219751484,42.8843850879279,"6","1"
1558,1949,"10006620",ELLA MCQUEEN RECEPTION CENTER FOR BOYS AND GIRLS,41 HOWARD AVENUE,BROOKLYN,NY,"11221",NOT AVAILABLE,(718) 574-2060,STATE,OPEN,11,KINGS,"36047",USA,"922140",CORRECTIONAL INSTITUTIONS,http://ocfs.ny.gov/main/rehab/prea.asp,7/12/2016,IMAGERY,2017-12-20T00:00:00.000Z,http://ocfs.ny.gov/main/rehab/regionalListing1.asp,JUVENILE,33,0.00209975185838,1.69201033e-07,2765.1171875,276.253957658648,"36","047","037500","36047037500","375",Census Tract 375,G5020,S,158802,0,"+40.6876200","-073.9215167",NY,-73.9205652305114,40.6870412541697,,"1"
1559,1950,"10000765",GOSHEN SECURE CENTER,97 CROSS RD,GOSHEN,NY,"10924",NOT AVAILABLE,(845) 615-3000,STATE,OPEN,48,ORANGE,"36071",USA,"922140",CORRECTIONAL INSTITUTIONS,http://ocfs.ny.gov/main/rehab/prea.asp,6/7/2016,IMAGERY,2017-12-20T00:00:00.000Z,http://ocfs.ny.gov/main/rehab/regionalListing1.asp,JUVENILE,85,0.00800093037358,3.919875029e-06,64723.125,989.4681666283,"36","071","011900","36071011900","119",Census Tract 119,G5020,S,89144286,653569,"+41.3828665","-074.3615366",NY,-74.3861949943872,41.3655964677576,,"2"
1560,1951,"10002279",ADIRONDACK WILDERNESS CHALLENGE,516 NORRISVILLE RD,SCHUYLER FALLS,NY,"12985",NOT AVAILABLE,NOT AVAILABLE,STATE,CLOSED,0,CLINTON,"36019",USA,"922140",CORRECTIONAL INSTITUTIONS,http://www.pressrepublican.com/news/local_news/state-to-close-local-residential-youth-program/article_3206c902-d0cb-5b65-8863-6f5397047dfd.html,6/30/2009,IMAGERY,2017-12-20T00:00:00.000Z,NOT AVAILABLE,JUVENILE,-999,0.00139619873554,9.9869817e-08,1738.8125,177.893239406813,"36","019","101700","36019101700","1017",Census Tract 1017,G5020,S,95732394,782926,"+44.6597454","-073.5844214",NY,-73.6058971455096,44.6228941554059,,"2"
1561,1952,"10003722",COOSA COUNTY JAIL,296 SCHOOL STREET,ROCKFORD,AL,"35136",NOT AVAILABLE,(256) 377-2211,COUNTY,OPEN,35,COOSA,"01037",USA,"922140",CORRECTIONAL INSTITUTIONS,http://www.coosacountyso.org/,1/24/2018,IMAGERY,2018-01-24T00:00:00.000Z,http://www.coosacountyso.org/,NOT AVAILABLE,-999,0.00218357182481,2.11496855e-07,3121.14453125,265.058542713264,"01","037","961200","01037961200","9612",Census Tract 9612,G5020,S,649873003,14725427,"+32.8242614","-086.2061986",AL,-86.2210608119126,32.8897557591991,,"1"
1562,1953,"10002278",ADIRONDACK RESIDENTIAL CENTER,518 NORRISVILLE RD,SCHUYLER FALLS,NY,"12985",NOT AVAILABLE,NOT AVAILABLE,STATE,CLOSED,0,CLINTON,"36019",USA,"922140",CORRECTIONAL INSTITUTIONS,https://www.governor.ny.gov/news/governor-cuomo-announces-new-addiction-treatment-facility-north-country,2/12/2016,IMAGERY,2017-12-20T00:00:00.000Z,NOT AVAILABLE,JUVENILE,-999,0.00118310365145,8.1861559e-08,1425.26953125,153.601388451661,"36","019","101700","36019101700","1017",Census Tract 1017,G5020,S,95732394,782926,"+44.6597454","-073.5844214",NY,-73.6065083533911,44.6227294824708,,"2"
1563,1954,"10003915",CLARKE COUNTY JAIL,3015 LEXINGTON ROAD,ATHENS,GA,"30605",NOT AVAILABLE,(706) 613-3270,COUNTY,OPEN,413,CLARKE,"13059",USA,"922140",CORRECTIONAL INSTITUTIONS,https://www.athensclarkecounty.com/205/Sheriff,2/22/2018,IMAGERY,2018-02-22T00:00:00.000Z,https://www.athensclarkecounty.com/205/Sheriff,NOT AVAILABLE,-999,0.00868940219389,3.410455159e-06,50944.97265625,1058.92902501015,"13","059","140500","13059140500","1405",Census Tract 1405,G5020,S,21229385,213743,"+33.9673636","-083.3253653",GA,-83.3280411870199,33.94533124905,,"2"
1564,1955,"10004470",CLAYTON COUNTY JAIL,9157 TARA BOULEVARD,JONESBORO,GA,"30236",NOT AVAILABLE,(770) 477-4413,COUNTY,OPEN,236,CLAYTON,"13063",USA,"922140",CORRECTIONAL INSTITUTIONS,http://www.claytonsheriff.com/index.html,2/22/2018,IMAGERY,2018-02-22T00:00:00.000Z,http://www.claytonsheriff.com/index.html,NOT AVAILABLE,1947,0.00589553158103,2.393178882e-06,35566.1640625,705.214575500424,"13","063","040612","13063040612","406.12",Census Tract 406.12,G5020,S,7072864,19576,"+33.5209285","-084.3626158",GA,-84.3586395735851,33.505218661777,,"1"
1565,1956,"10006621",COLUMBIA GIRLS SECURE CENTER,419 SPOOK ROCK RD,CLAVERACK,NY,"12513",NOT AVAILABLE,(518) 851-3211,STATE,OPEN,11,COLUMBIA,"36021",USA,"922140",CORRECTIONAL INSTITUTIONS,http://ocfs.ny.gov/main/rehab/prea.asp,6/14/2017,IMAGERY,2017-12-20T00:00:00.000Z,http://ocfs.ny.gov/main/rehab/regionalListing1.asp,JUVENILE,16,0.00577830321879,1.505307381e-06,25185.83984375,696.601440773466,"36","021","001000","36021001000","10",Census Tract 10,G5020,S,123176575,1009324,"+42.2188419","-073.6899142",NY,-73.7563708982327,42.2134540693121,,"2"
1566,1957,"10002119",CLAYTON COUNTY PRISON,11420 SLR BLVD,LOVEJOY,GA,"30250",NOT AVAILABLE,(770) 473-5777,COUNTY,OPEN,237,CLAYTON,"13063",USA,"922140",CORRECTIONAL INSTITUTIONS,"http://www.dcor.state.ga.us/Research/Monthly, http://www.claytoncountyga.gov/departments/corrections-department/clayton-county-prison.aspx",2/1/2018,IMAGERY,2018-02-22T00:00:00.000Z,http://www.claytoncountyga.gov/departments/corrections-department/clayton-county-prison.aspx,MEDIUM,242,0.00577380232224,2.080377492e-06,30895.3359375,685.747184971781,"13","063","040606","13063040606","406.06",Census Tract 406.06,G5020,S,24197568,766682,"+33.4677661","-084.3120126",GA,-84.3027074332127,33.443120590848,,"3"
1567,1958,"10004426",GILLESPIE COUNTY JAIL,1601 EAST MAIN STREET,FREDERICKSBURG,TX,"78624",NOT AVAILABLE,(830) 997-7585,COUNTY,OPEN,70,GILLESPIE,"48171",USA,"922140",CORRECTIONAL INSTITUTIONS,"https://www.tcjs.state.tx.us/index.php?linkID=325, https://texasjailproject.org/list_of_county_jails/",3/1/2018,IMAGERY,2018-04-27T00:00:00.000Z,NOT AVAILABLE,NOT AVAILABLE,96,0.00404024651887,5.3192362e-07,7630.73046875,472.163923359335,"48","171","950400","48171950400","9504",Census Tract 9504,G5020,S,76278524,459388,"+30.2675065","-098.8228553",TX,-98.8493130442531,30.250986744363,,"1"
1568,1959,"10006622",MACCORMICK SECURE CENTER,300 SOUTH ROAD,BROOKTONDALE,NY,"14817",NOT AVAILABLE,(607) 539-7121,STATE,OPEN,22,TOMPKINS,"36109",USA,"922140",CORRECTIONAL INSTITUTIONS,http://ocfs.ny.gov/main/rehab/prea.asp,6/6/2017,IMAGERY,2017-12-20T00:00:00.000Z,http://ocfs.ny.gov/main/rehab/regionalListing1.asp,JUVENILE,39,0.00647360326276,2.567800396e-06,43040.03125,862.042576701915,"36","109","001900","36109001900","19",Census Tract 19,G5020,S,267413984,744646,"+42.3601164","-076.3770753",NY,-76.3189917612575,42.3266444535177,,"1"
1569,1960,"10005788",FRANKLIN COUNTY JAIL / SHERIFF,45 BARE HILL ROAD,MALONE,NY,"12953",NOT AVAILABLE,NOT AVAILABLE,COUNTY,OPEN,94,FRANKLIN,"36033",USA,"922140",CORRECTIONAL INSTITUTIONS,http://www.criminaljustice.ny.gov/crimnet/ojsa/jail_pop_y.pdf,4/10/2018,IMAGERY,2018-04-10T00:00:00.000Z,http://franklincountysheriffsoffices.us/,NOT AVAILABLE,-999,0.00553340800053,1.748221109e-06,30567.67578125,735.922703285287,"36","033","950502","36033950502","9505.02",Census Tract 9505.02,G5020,S,114073486,1379600,"+44.8056453","-074.3255971",NY,-74.3191427481732,44.8689203253425,,"4"
1570,1961,"10000750",CENTRAL NEW YORK PSYCHIATRIC CENTER,"9005 OLD RIVER RD, PO BOX 300",MARCY,NY,"13403",NOT AVAILABLE,(315) 765-3600,STATE,OPEN,-999,ONEIDA,"36065",USA,"922140",CORRECTIONAL INSTITUTIONS,https://www.omh.ny.gov/omhweb/facilities/cnpc/,12/21/2017,IMAGERY,2017-12-21T00:00:00.000Z,https://www.omh.ny.gov/omhweb/facilities/cnpc/,MAXIMUM,220,0.011536535225,6.54453158e-06,111193.51171875,1461.71354336353,"36","065","026600","36065026600","266",Census Tract 266,G5020,S,2598046,0,"+43.1632615","-075.3043813",NY,-75.3027757421143,43.1672828607581,,"3"
1571,1962,"10005242",HILLSIDE BIRCHVIEW JUVENILE DETENTION FACILITY,7432 COUNTY HOUSE ROAD,AUBURN,NY,"13021",NOT AVAILABLE,NOT AVAILABLE,STATE,OPEN,-999,CAYUGA,"36011",USA,"922140",CORRECTIONAL INSTITUTIONS,https://www.hillside.com/about-us/family-agencies/regions-affiliates/hcc/,12/21/2017,IMAGERY/OTHER,2017-12-21T00:00:00.000Z,https://www.hillside.com/about-us/family-agencies/regions-affiliates/hcc/,JUVENILE,40,0.004061971974,7.32065856e-07,12398.94921875,514.278698855223,"36","011","040600","36011040600","406",Census Tract 406,G5020,S,74642555,61548,"+42.9775784","-076.5183651",NY,-76.5385655790548,42.9745805167647,,"4"
1572,1963,"10003147",INDUSTRY SECURE CENTER,101 RYDER HILL RD,RUSH,NY,"14543",NOT AVAILABLE,NOT AVAILABLE,STATE,OPEN,41,MONROE,"36055",USA,"922140",CORRECTIONAL INSTITUTIONS,http://newyork.webschoolpro.com/NY261701978752/about.html,11/13/2015,IMAGERY,2017-12-21T00:00:00.000Z,NOT AVAILABLE,JUVENILE,-999,0.00926809495801,5.312683501e-06,90006.953125,1237.26336245741,"36","055","013300","36055013300","133",Census Tract 133,G5020,S,78558656,966740,"+42.9713291","-077.6731429",NY,-77.7144132890314,42.9925336113417,,"3"
1573,1964,"10003213",NASSAU COUNTY MERCYFIRST-WHISTON HALL NSD,525 CONVENT RD,SYOSSET,NY,"11791",NOT AVAILABLE,NOT AVAILABLE,STATE,OPEN,6,NASSAU,"36059",USA,"922140",CORRECTIONAL INSTITUTIONS,http://www.mercyfirst.org/,11/13/2015,IMAGERY,2017-12-21T00:00:00.000Z,http://www.mercyfirst.org/,JUVENILE,-999,0.0115443995581,2.337410733e-06,38276.06640625,1444.21159438032,"36","059","518400","36059518400","5184",Census Tract 5184,G5020,S,3114568,0,"+40.8233116","-073.4918911",NY,-73.4873913924404,40.8218378990385,,"1"
1574,1965,"10001497",AUBURN RESIDENTIAL CENTER,6734 PINE RIDGE RD,AUBURN,NY,"13021",NOT AVAILABLE,NOT AVAILABLE,STATE,CLOSED,0,CAYUGA,"36011",USA,"922140",CORRECTIONAL INSTITUTIONS,http://www.syracuse.com/news/index.ssf/2008/03/auburn_residential_center_has.html,6/30/2009,IMAGERY,2017-12-21T00:00:00.000Z,NOT AVAILABLE,JUVENILE,22,0.00220235561018,1.72952409e-07,2927.83203125,277.374173387985,"36","011","040600","36011040600","406",Census Tract 406,G5020,S,74642555,61548,"+42.9775784","-076.5183651",NY,-76.5067870217514,42.9441268326391,,"4"
1575,1966,"10003234",BAYVIEW CORRECTIONAL FACILITY,550 W 20TH ST,NEW YORK,NY,"10011",NOT AVAILABLE,NOT AVAILABLE,STATE,CLOSED,0,NEW YORK,"36061",USA,"922140",CORRECTIONAL INSTITUTIONS,https://www.nytimes.com/2015/11/11/realestate/commercial/former-prison-for-women-to-become-a-place-that-serves-them.html,11/10/2015,IMAGERY,2017-12-21T00:00:00.000Z,NOT AVAILABLE,MEDIUM,323,0.00173570608849,1.62444955e-07,2657.08203125,214.81981642515,"36","061","009900","36061009900","99",Census Tract 99,G5020,S,1002373,1130336,"+40.7495435","-074.0091035",NY,-74.0075405633577,40.7464260166194,,"1"
1576,1967,"10002294",BROOKLYN COMMUNITY CORRECTIONAL CENTER,988 MYRTLE AVE,BROOKLYN,NY,"11206",NOT AVAILABLE,(718) 574-4886,STATE,CLOSED,0,KINGS,"36047",USA,"922140",CORRECTIONAL INSTITUTIONS,http://www.samaritanvillage.org/where-good-lives,11/13/2015,IMAGERY/OTHER,2017-12-21T00:00:00.000Z,NOT AVAILABLE,MINIMUM,-999,0.000879693668516,4.1979882e-08,686.12890625,116.801912252165,"36","047","028300","36047028300","283",Census Tract 283,G5020,S,121875,0,"+40.6952563","-073.9404379",NY,-73.9417791497791,40.6960239541586,,"1"
1577,1968,"10000743",CAMP GABRIELS,737 STATE HWY 86,GABRIELS,NY,"12939",NOT AVAILABLE,NOT AVAILABLE,STATE,CLOSED,0,FRANKLIN,"36033",USA,"922140",CORRECTIONAL INSTITUTIONS,http://www.doccs.ny.gov/FactSheets/PrisonClosure09.html,11/13/2015,IMAGERY,2017-12-21T00:00:00.000Z,NOT AVAILABLE,MINIMUM,336,0.0129150827444,1.117158292e-05,193886.43359375,1671.63663317902,"36","033","950800","36033950800","9508",Census Tract 9508,G5020,S,641601918,27180988,"+44.5201027","-074.0697740",NY,-74.1862771843037,44.4371789885574,,"1"
1578,1969,"10006145",CAMP GEORGETOWN,3191 CRUMB HILL RD,GEORGETOWN,NY,"13072",NOT AVAILABLE,NOT AVAILABLE,STATE,CLOSED,0,CHENANGO,"36053",USA,"922140",CORRECTIONAL INSTITUTIONS,http://www.syracuse.com/news/index.ssf/2013/05/camp_georgetown_sells_for_2410.html,5/9/2013,IMAGERY,2017-12-21T00:00:00.000Z,NOT AVAILABLE,MINIMUM,262,0.0164497431814,1.2340967334e-05,208194.6171875,2159.27131137207,"36","053","030800","36053030800","308",Census Tract 308,G5020,S,294809940,3273172,"+42.7960459","-075.7297030",NY,-75.7823671701645,42.7306906526831,,"1"
1579,1970,"10004550",CLINCH COUNTY JAIL,115 COURT SQUARE,HOMERVILLE,GA,"31634",NOT AVAILABLE,(912) 487-5316,COUNTY,OPEN,-999,CLINCH,"13065",USA,"922140",CORRECTIONAL INSTITUTIONS,http://www.dcor.state.ga.us/facility-finder,2/22/2018,IMAGERY,2018-02-22T00:00:00.000Z,http://clinchsheriffoffice.tripod.com/,NOT AVAILABLE,-999,0.00130700386963,1.04550079e-07,1512.060546875,155.837820148611,"13","065","970100","13065970100","9701",Census Tract 9701,G5020,S,774930042,4526537,"+31.0667367","-082.7730713",GA,-82.7488003854616,31.0368032200718,,"1"
1580,1971,"10002111",COBB COUNTY WORK RELEASE CENTER,1825 COUNTY SERVICES PKWY,MARIETTA,GA,"30080",NOT AVAILABLE,(770) 499-4340,COUNTY,OPEN,115,COBB,"13067",USA,"922140",CORRECTIONAL INSTITUTIONS,http://www.cobbsheriff.org/,2/22/2018,IMAGERY,2018-02-22T00:00:00.000Z,http://www.cobbsheriff.org/,MINIMUM,384,0.00292474118297,4.04062953e-07,6033.2265625,356.306085425508,"13","067","030905","13067030905","309.05",Census Tract 309.05,G5020,S,6105166,27393,"+33.9073366","-084.5863344",GA,-84.5808835453619,33.9083602199209,,"4"
1581,1972,"10000746",HARRIET TUBMAN RESIDENTIAL CENTER,6706 PINE RIDGE RD,AUBURN,NY,"13021",NOT AVAILABLE,NOT AVAILABLE,STATE,CLOSED,0,CAYUGA,"36011",USA,"922140",CORRECTIONAL INSTITUTIONS,http://correctionalnews.com/2017/09/27/harriet-tubman-residential-center-gets-new-life/,9/27/2017,IMAGERY,2017-12-21T00:00:00.000Z,NOT AVAILABLE,JUVENILE,25,0.00298887415822,2.78039525e-07,4706.9375,376.772846450555,"36","011","040600","36011040600","406",Census Tract 406,G5020,S,74642555,61548,"+42.9775784","-076.5183651",NY,-76.5037043476796,42.9457206403471,,"4"
1582,1973,"10003206",MID-ORANGE CORRECTIONAL FACILITY,900 KINGS HWY,WARWICK,NY,"10990",NOT AVAILABLE,(315) 768-8581,STATE,CLOSED,0,ORANGE,"36071",USA,"922140",CORRECTIONAL INSTITUTIONS,https://www.csmonitor.com/USA/Justice/2016/0101/When-a-prison-closes-what-happens-to-the-prison-town,1/1/2016,IMAGERY,2017-12-21T00:00:00.000Z,NOT AVAILABLE,MEDIUM,750,0.0198231901332,1.6212988904e-05,267337.171875,2435.72192276214,"36","071","014700","36071014700","147",Census Tract 147,G5020,S,30855754,765122,"+41.2796965","-074.2905283",NY,-74.2995355401877,41.276942946937,,"1"
1583,1974,"10003184",MONTEREY SHOCK INCARCERATION CORRECTIONAL FACILITY,2150 EVERGREEN HILL RD,BEAVER DAMS,NY,"14812",NOT AVAILABLE,NOT AVAILABLE,STATE,CLOSED,0,SCHUYLER,"36097",USA,"922140",CORRECTIONAL INSTITUTIONS,http://www.doccs.ny.gov/PressRel/2013/Prison_Closure_Announcement.html,7/26/2013,IMAGERY,2017-12-21T00:00:00.000Z,NOT AVAILABLE,MINIMUM,300,0.00857911388655,2.448511567e-06,41047.30078125,1139.6126325351,"36","097","950300","36097950300","9503",Census Tract 9503,G5020,S,236633985,7035659,"+42.3748912","-077.0350237",NY,-77.0169924595584,42.336979087414,,"1"
1584,1975,"10003153",MT. MCGREGOR CORRECTIONAL FACILITY,1000 MT. MCGREGOR RD,WILTON,NY,"12831",NOT AVAILABLE,NOT AVAILABLE,STATE,CLOSED,0,SARATOGA,"36091",USA,"922140",CORRECTIONAL INSTITUTIONS,http://www.doccs.ny.gov/PressRel/2013/Prison_Closure_Announcement.html,7/26/2013,IMAGERY,2017-12-21T00:00:00.000Z,NOT AVAILABLE,MEDIUM,544,0.0171654803752,6.139274987e-06,104366.5234375,2238.35923755969,"36","091","060101","36091060101","601.01",Census Tract 601.01,G5020,S,84649566,2499191,"+43.2389775","-073.6671447",NY,-73.7473910012279,43.2014828700048,,"1"
1585,1976,"10003150",ONEIDA CORRECTIONAL FACILITY,6100 SCHOOL RD,ROME,NY,"13340",NOT AVAILABLE,NOT AVAILABLE,STATE,CLOSED,0,ONEIDA,"36065",USA,"922140",CORRECTIONAL INSTITUTIONS,http://www.doccs.ny.gov/RulesRegs/20120801_CCS-20-12-00004.html,4/27/2012,IMAGERY,2017-12-21T00:00:00.000Z,NOT AVAILABLE,MEDIUM,1200,0.0210403355409,2.0782290616e-05,353197.375,2664.38712665531,"36","065","025900","36065025900","259",Census Tract 259,G5020,S,2173458,0,"+43.1823069","-075.4828586",NY,-75.4838593538244,43.1846102529403,,"2"
1586,1977,"10003177",SUMMIT SHOCK INCARCERATION CORRECTIONAL FACILITY,137 EAGLE HEIGHTS RD,SUMMIT,NY,"12175",NOT AVAILABLE,NOT AVAILABLE,STATE,CLOSED,0,SCHOHARIE,"36095",USA,"922140",CORRECTIONAL INSTITUTIONS,http://www.doccs.ny.gov/RulesRegs/20120801_CCS-20-12-00004.html,4/27/2012,IMAGERY,2017-12-21T00:00:00.000Z,NOT AVAILABLE,MINIMUM,-999,0.00874045211623,3.498371998e-06,58860.609375,1111.22003896543,"36","095","740600","36095740600","7406",Census Tract 7406,G5020,S,368179660,1683284,"+42.5266583","-074.5073423",NY,-74.5369104394623,42.5643173353815,,"1"
1587,1978,"10006678",ROBERT E. LEWIS RESIDENTIAL TREATMENT ACADEMY,4629 MCCLELLAN BLVD,ANNISTON,AL,"36204",NOT AVAILABLE,(256) 236-7190,STATE,OPEN,20,CALHOUN,"01015",USA,"922140",CORRECTIONAL INSTITUTIONS,http://cvys.net/index.html,8/15/2016,IMAGERY/OTHER,2018-01-24T00:00:00.000Z,http://cvys.net/index.html,JUVENILE,30,0.00141098039006,8.8596357e-08,1319.73828125,171.77971901922,"01","015","000700","01015000700","7",Census Tract 7,G5020,S,45784584,107461,"+33.7077538","-085.7919352",AL,-85.8208805888201,33.7062204543008,"1","3"
1588,1979,"10004548",COLQUITT COUNTY CORRECTIONAL INSTITUTION,200 SOUTH VANDENBERG DRIVE,MOULTRIE,GA,"31768",NOT AVAILABLE,(229) 616-7490,COUNTY,OPEN,191,COLQUITT,"13071",USA,"922140",CORRECTIONAL INSTITUTIONS,"http://www.dcor.state.ga.us/Research/Monthly, http://www.ccboc.com/departments/county_prison.php",2/1/2018,IMAGERY,2018-02-22T00:00:00.000Z,http://www.ccboc.com/departments/county_prison.php,MEDIUM,190,0.00662111302662,1.985258588e-06,28739.9765625,789.505441707603,"13","071","970600","13071970600","9706",Census Tract 9706,G5020,S,205733792,3364049,"+31.0873618","-083.7537116",GA,-83.7078659413251,31.1297308183944,,"1"
1589,1980,"10006747",HENDRICKS COUNTY WORK RELEASE FACILITY,200 E CAMPUS BLVD,DANVILLE,IN,"46122",NOT AVAILABLE,(317) 745-8700,COUNTY,OPEN,-999,HENDRICKS,"18063",USA,"922140",CORRECTIONAL INSTITUTIONS,http://www.co.hendricks.in.us/department/index.php?structureid=31,3/5/2018,IMAGERY,2018-03-05T00:00:00.000Z,http://www.co.hendricks.in.us/department/index.php?structureid=31,NOT AVAILABLE,-999,0.00235353057285,3.14121553e-07,5063.48828125,299.214173005534,"18","063","210502","18063210502","2105.02",Census Tract 2105.02,G5020,S,49663379,310100,"+39.7398193","-086.5185986",IN,-86.5026586203489,39.7574195384162,,"2"
1590,1981,"10006796",MONROE COUNTY YOUTH CENTER,3600 S CUSTER ROAD,MONROE,MI,"48161",NOT AVAILABLE,(734) 240-3220,COUNTY,OPEN,-999,MONROE,"26115",USA,"922140",CORRECTIONAL INSTITUTIONS,http://www.co.monroe.mi.us/officials_and_departments/departments/youth_center/index.php,3/21/2018,IMAGERY,2018-03-21T00:00:00.000Z,http://www.co.monroe.mi.us/officials_and_departments/departments/youth_center/index.php,JUVENILE,45,0.00347316872154,4.03122526e-07,6714.9609375,442.921821768096,"26","115","832400","26115832400","8324",Census Tract 8324,G5020,S,20789848,84193,"+41.8955237","-083.4498432",MI,-83.4587162453199,41.9320766773761,,"1"
1591,1982,"10003161",GENESEE COUNTY JAIL,14 W MAIN ST,BATAVIA,NY,"14021",NOT AVAILABLE,(585) 343-0838,COUNTY,OPEN,78,GENESEE,"36037",USA,"922140",CORRECTIONAL INSTITUTIONS,"http://www.criminaljustice.ny.gov/crimnet/ojsa/jail_pop_y.pdf, http://co.genesee.ny.us/departments/sheriff/index.php",4/10/2018,IMAGERY,2018-04-10T00:00:00.000Z,http://co.genesee.ny.us/departments/sheriff/index.php,NOT AVAILABLE,87,0.00194983432705,1.49702195e-07,2536.50390625,255.588761547784,"36","037","950600","36037950600","9506",Census Tract 9506,G5020,S,1592901,0,"+43.0066396","-078.1868680",NY,-78.1880641995526,42.9988277013485,,"1"
1592,1983,"10003405",BELMONT CAMP,68518 BANNOCK RD,ST. CLAIRSVILLE,OH,"43950",NOT AVAILABLE,(740) 695-5169,STATE,OPEN,491,BELMONT,"39013",USA,"922140",CORRECTIONAL INSTITUTIONS,http://www.drc.ohio.gov/reports/population,12/4/2017,IMAGERY,2017-12-21T00:00:00.000Z,http://www.drc.ohio.gov/institutions,MINIMUM,-999,0.005743211329,2.345156826e-06,37982.2890625,720.751674064439,"39","013","012200","39013012200","122",Census Tract 122,G5020,S,94456870,771202,"+40.0380398","-080.9247267",OH,-80.9770134817346,40.0817524445723,,"5"
1593,1984,"10002428",BELMONT CORRECTIONAL INSTITUTION,68518 BANNOCK RD,ST. CLAIRSVILLE,OH,"43950",NOT AVAILABLE,(740) 695-5169,STATE,OPEN,2209,BELMONT,"39013",USA,"922140",CORRECTIONAL INSTITUTIONS,http://www.drc.ohio.gov/reports/population,12/4/2017,IMAGERY,2017-12-21T00:00:00.000Z,http://www.drc.ohio.gov/institutions,CLOSE,-999,0.0161990163673,1.6219193421e-05,262699.59375,2049.44840873912,"39","013","012200","39013012200","122",Census Tract 122,G5020,S,94456870,771202,"+40.0380398","-080.9247267",OH,-80.9765990727186,40.0850310950816,,"5"
1594,1985,"10004547",COLQUITT COUNTY JAIL,200 VETERANS PARKWAY NORTH,MOULTRIE,GA,"31776",NOT AVAILABLE,(229) 616-7430,COUNTY,OPEN,37,COLQUITT,"13071",USA,"922140",CORRECTIONAL INSTITUTIONS,http://www.ccboc.com/departments/sheriff/index.php,2/22/2018,IMAGERY,2018-02-22T00:00:00.000Z,http://www.ccboc.com/departments/sheriff/index.php,NOT AVAILABLE,-999,0.00629833912386,1.737017451e-06,25160.205078125,771.84645184418,"13","071","970400","13071970400","9704",Census Tract 9704,G5020,S,74463951,1021793,"+31.2017275","-083.7008836",GA,-83.7609344058939,31.1822943779828,,"1"
1595,1986,"10004912",HENRY COUNTY JAIL,127 N 12TH ST,NEW CASTLE,IN,"47362",NOT AVAILABLE,(765) 521-7032,COUNTY,OPEN,-999,HENRY,"18065",USA,"922140",CORRECTIONAL INSTITUTIONS,http://www.henryco.org/index.html,3/5/2018,IMAGERY,2018-03-05T00:00:00.000Z,http://www.henryco.org/index.html,NOT AVAILABLE,130,0.00221050912732,2.0717781e-07,3348.10546875,270.712594458132,"18","065","976000","18065976000","9760",Census Tract 9760,G5020,S,3023730,5038,"+39.9304668","-085.3756040",IN,-85.3722811005036,39.9320710231595,"2","2"
1596,1987,"10002432",CHILLICOTHE CORRECTIONAL INSTITUTION / RTU,15802 STATE ROUTE N 104,CHILLICOTHE,OH,"45601",NOT AVAILABLE,(740) 774-7080,STATE,OPEN,2715,ROSS,"39141",USA,"922140",CORRECTIONAL INSTITUTIONS,http://www.drc.ohio.gov/reports/population,12/4/2017,IMAGERY,2017-12-21T00:00:00.000Z,http://www.drc.ohio.gov/institutions,CLOSE,2895,0.0275198579476,3.1192519962e-05,499999.4296875,3586.92823313113,"39","141","955602","39141955602","9556.02",Census Tract 9556.02,G5020,S,6377097,173187,"+39.3673874","-083.0023887",OH,-83.0018289145024,39.3691527811847,,"3"
1597,1988,"10005621",HENRY COUNTY JAIL ANNEX,1124 BROAD STREET,NEW CASTLE,IN,"47362",NOT AVAILABLE,(765) 521-7032,COUNTY,NOT AVAILABLE,-999,HENRY,"18065",USA,"922140",CORRECTIONAL INSTITUTIONS,http://www.henryco.org/jail-annex.html,2/15/2016,IMAGERY,2018-03-05T00:00:00.000Z,http://www.henryco.org/jail-annex.html,NOT AVAILABLE,150,0.00139886159924,9.9370768e-08,1605.875,189.636532538821,"18","065","976000","18065976000","9760",Census Tract 9760,G5020,S,3023730,5038,"+39.9304668","-085.3756040",IN,-85.3719798547748,39.931531629586,"2","2"
1598,1989,"10003827",MONTCALM COUNTY JAIL,649 N STATE ST,STANTON,MI,"48888",NOT AVAILABLE,(989) 831-7592,COUNTY,OPEN,-999,MONTCALM,"26117",USA,"922140",CORRECTIONAL INSTITUTIONS,http://www.montcalm.us/government/sheriff/index.php,3/21/2018,IMAGERY,2018-03-21T00:00:00.000Z,http://www.montcalm.us/government/sheriff/index.php,NOT AVAILABLE,205,0.00607962943763,6.75415274e-07,11500.86328125,795.317887360593,"26","117","970800","26117970800","9708",Census Tract 9708,G5020,S,93552601,3364441,"+43.2578089","-085.0979030",MI,-85.0863959478796,43.3018320663392,,"1"
1599,1990,"10004466",COLUMBIA COUNTY JAIL,2273 COUNTY CAMP ROAD,APPLING,GA,"30802",NOT AVAILABLE,(706) 541-3920,COUNTY,OPEN,336,COLUMBIA,"13073",USA,"922140",CORRECTIONAL INSTITUTIONS,http://www.columbiacountyso.org/sheriff-s-office,2/22/2018,IMAGERY,2018-02-22T00:00:00.000Z,http://www.columbiacountyso.org/sheriff-s-office,CLOSE,338,0.00707740929906,2.366391274e-06,35180.46484375,857.359885053496,"13","073","030402","13073030402","304.02",Census Tract 304.02,G5020,S,215748852,213312,"+33.5560587","-082.3159264",GA,-82.3071107112578,33.5356900805231,,"1"
1600,1991,"10002718",GRAYSON COUNTY DETENTION CENTER,200 S CROCKETT ST,SHERMAN,TX,"75090",NOT AVAILABLE,(903) 893-4388,COUNTY,OPEN,354,GRAYSON,"48181",USA,"922140",CORRECTIONAL INSTITUTIONS,"https://www.tcjs.state.tx.us/index.php?linkID=325, https://texasjailproject.org/list_of_county_jails/",3/1/2018,IMAGERY,2018-04-27T00:00:00.000Z,http://www.co.grayson.tx.us/page/gcso.home,NOT AVAILABLE,487,0.00523409567659,1.044009815e-06,15538.75390625,651.736719996961,"48","181","002000","48181002000","20",Census Tract 20,G5020,S,4050524,0,"+33.6365446","-096.6056726",TX,-96.6104947574143,33.6344190437849,,"1"
1601,1992,"10006679",COOSA VALLEY YOUTH SERVICES - ATTENTION HOME,4621 MCCLELLAN BLVD,ANNISTON,AL,"36204",NOT AVAILABLE,(256) 236-5437,STATE,OPEN,14,CALHOUN,"01015",USA,"922140",CORRECTIONAL INSTITUTIONS,http://cvys.net/index.html,8/15/2016,IMAGERY/OTHER,2018-01-24T00:00:00.000Z,http://cvys.net/index.html,JUVENILE,14,0.00135367306541,6.9119721e-08,1029.60546875,163.281536732653,"01","015","000700","01015000700","7",Census Tract 7,G5020,S,45784584,107461,"+33.7077538","-085.7919352",AL,-85.8209096735542,33.704510931445,"1","3"
1602,1993,"10005241",HERKIMER COUNTY JAIL,320 NORTH MAIN STREET,HERKIMER,NY,"13350",NOT AVAILABLE,(315) 867-1252,COUNTY,OPEN,31,HERKIMER,"36043",USA,"922140",CORRECTIONAL INSTITUTIONS,"http://www.criminaljustice.ny.gov/crimnet/ojsa/jail_pop_y.pdf, http://herkimercounty.org/content/Departments/View/27",4/10/2018,IMAGERY,2018-04-10T00:00:00.000Z,NOT AVAILABLE,NOT AVAILABLE,-999,0.00370054928693,3.8185361e-07,6473.17578125,475.372534863177,"36","043","011200","36043011200","112",Census Tract 112,G5020,S,25719518,427730,"+43.0456953","-075.0278155",NY,-74.9879619860046,43.0290725184045,,"1"
1603,1994,"10003424",CORRECTIONAL RECEPTION CENTER,11271 STATE ROUTE 762,ORIENT,OH,"43146",NOT AVAILABLE,(614) 877-2441,STATE,OPEN,1656,PICKAWAY,"39129",USA,"922140",CORRECTIONAL INSTITUTIONS,http://www.drc.ohio.gov/reports/population,12/4/2017,IMAGERY,2017-12-21T00:00:00.000Z,http://www.drc.ohio.gov/institutions,MAXIMUM,-999,0.0184873959848,1.8380960762e-05,296476.4765625,2209.38673315571,"39","129","021300","39129021300","213",Census Tract 213,G5020,S,5147772,167257,"+39.7949776","-083.1481965",OH,-83.1492565397677,39.8001804323076,,"2"
1604,1995,"10003356",GRAFTON REINTEGRATION CENTER,2000 S AVON-BELDEN RD,GRAFTON,OH,"44044",NOT AVAILABLE,(440) 748-1161,STATE,OPEN,661,LORAIN,"39093",USA,"922140",CORRECTIONAL INSTITUTIONS,"http://www.drc.ohio.gov/reports/population, http://www.drc.ohio.gov/prea",12/4/2017,IMAGERY,2017-12-21T00:00:00.000Z,NOT AVAILABLE,MEDIUM,-999,0.0151804030407,1.4374238039e-05,237040.6796875,1965.93457953723,"39","093","095100","39093095100","951",Census Tract 951,G5020,S,72918208,297370,"+41.2499039","-082.0285866",OH,-82.0251891114421,41.2831540728437,,"2"
1605,1996,"10003412",FRANKLIN MEDICAL CENTER (ZONE A),1990 HARMON AVE,COLUMBUS,OH,"43223",NOT AVAILABLE,(614) 445-5960,STATE,OPEN,598,FRANKLIN,"39049",USA,"922140",CORRECTIONAL INSTITUTIONS,http://www.drc.ohio.gov/reports/population,12/4/2017,IMAGERY,2017-12-21T00:00:00.000Z,http://www.drc.ohio.gov/institutions,NOT AVAILABLE,-999,0.00537947855767,1.966374699e-06,31772.4140625,686.797087640903,"39","049","008340","39049008340","83.40",Census Tract 83.40,G5020,S,8188094,430198,"+39.9247568","-083.0331914",OH,-83.0149081895452,39.9205536687148,,"2"
1606,1997,"10003357",GRAFTON CORRECTIONAL INSTITUTION,2500 S AVON BELDEN RD,GRAFTON,OH,"44044",NOT AVAILABLE,(440) 748-1161,STATE,OPEN,1141,LORAIN,"39093",USA,"922140",CORRECTIONAL INSTITUTIONS,"http://www.drc.ohio.gov/reports/population, http://www.drc.ohio.gov/prea",12/4/2017,IMAGERY,2017-12-21T00:00:00.000Z,http://www.drc.ohio.gov/institutions,CLOSE,1234,0.0149865810116,1.529749416e-05,252246.41796875,1985.01763941717,"39","093","095100","39093095100","951",Census Tract 951,G5020,S,72918208,297370,"+41.2499039","-082.0285866",OH,-82.0293875342925,41.2782092122397,,"2"
1607,1998,"10006400",COVINGTON COUNTY JAIL,290 HILLCREST DRIVE,ANDALUSIA,AL,"36420",NOT AVAILABLE,(334) 428-2640,COUNTY,OPEN,-999,COVINGTON,"01039",USA,"922140",CORRECTIONAL INSTITUTIONS,http://www.covcounty.com/county-jail,1/24/2018,IMAGERY,2018-01-24T00:00:00.000Z,http://www.covcounty.com/county-jail,NOT AVAILABLE,-999,0.00362139292409,6.5800048e-07,9544.0859375,436.420331026723,"01","039","962100","01039962100","9621",Census Tract 9621,G5020,S,15429743,163537,"+31.3264450","-086.5072740",AL,-86.5029995537076,31.3122413464869,,"1"
1608,1999,"10003433",LEBANON CORRECTIONAL INSTITUTION,3791 STATE ROUTE 63,LEBANON,OH,"45036",NOT AVAILABLE,(513) 932-1211,STATE,OPEN,2344,WARREN,"39165",USA,"922140",CORRECTIONAL INSTITUTIONS,http://www.drc.ohio.gov/reports/population,12/4/2017,IMAGERY,2017-12-21T00:00:00.000Z,http://www.drc.ohio.gov/institutions,MAXIMUM,-999,0.016071984419,1.557604593e-05,249905.25390625,2003.6929046439,"39","165","031700","39165031700","317",Census Tract 317,G5020,S,7768069,823,"+39.4372809","-084.3038189",OH,-84.2996446717391,39.4329903776112,,"4"
1609,2000,"10004546",COOK COUNTY JAIL / SHERIFF,1000 COUNTY FARM ROAD,ADEL,GA,"31620",NOT AVAILABLE,(229) 896-7471,COUNTY,OPEN,114,COOK,"13075",USA,"922140",CORRECTIONAL INSTITUTIONS,http://www.cookcogasheriff.com/index.shtml,2/22/2018,IMAGERY,2018-02-22T00:00:00.000Z,http://www.cookcogasheriff.com/index.shtml,NOT AVAILABLE,-999,0.00318259758237,5.82382325e-07,8430.5703125,380.302309113246,"13","075","960200","13075960200","9602",Census Tract 9602,G5020,S,124869662,3139592,"+31.1630441","-083.4829405",GA,-83.4379968687808,31.1252795418556,,"1"
1610,1210,"10003603",JAMES RIVER CORRECTIONAL CENTER,2521 CIRCLE DR,JAMESTOWN,ND,"58401",NOT AVAILABLE,(701) 253-3660,STATE,OPEN,439,STUTSMAN,"38093",USA,"922140",CORRECTIONAL INSTITUTIONS,"http://www.nd.gov/docr/media/stats.html, http://www.nd.gov/docr/adult/",12/31/2016,IMAGERY,2017-12-13T00:00:00.000Z,http://www.nd.gov/docr/adult/,MAXIMUM,424,0.0143421175468,6.698516922e-06,121448.03125,1899.16047898344,"38","093","967300","38093967300","9673",Census Tract 9673,G5020,S,22396407,0,"+46.9174162","-098.6722581",ND,-98.6850704567864,46.8832292460769,,"2"
1611,1211,"10001548",MARYLAND CORRECTIONAL INSTITUTION - HAGERSTOWN,18601 ROXBURY RD,HAGERSTOWN,MD,"21746",NOT AVAILABLE,(240) 420-1000,STATE,OPEN,1913,WASHINGTON,"24043",USA,"922140",CORRECTIONAL INSTITUTIONS,http://dpscs.maryland.gov/publicinfo/publications/annuals.shtml#doc,6/30/2016,IMAGERY/OTHER,2017-12-05T00:00:00.000Z,http://www.dpscs.maryland.gov/locations/prisons.shtml,MEDIUM,1800,0.0194191374101,1.7051935406e-05,274088.8671875,2428.71433564212,"24","043","011000","24043011000","110",Census Tract 110,G5020,S,4425974,0,"+39.5596859","-077.7147954",MD,-77.7225431696353,39.5609503237705,,"5"
1612,1212,"10001560",MARYLAND CORRECTIONAL INSTITUTION - JESSUP,"P O BOX 549, HOUSE OF CORRECTION RD",JESSUP,MD,"20794",NOT AVAILABLE,(410) 799-7610,STATE,OPEN,997,ANNE ARUNDEL,"24003",USA,"922140",CORRECTIONAL INSTITUTIONS,http://dpscs.maryland.gov/publicinfo/publications/annuals.shtml#doc,6/30/2016,IMAGERY/OTHER,2017-12-05T00:00:00.000Z,http://www.dpscs.maryland.gov/locations/prisons.shtml,MEDIUM,1038,0.0119095031271,8.71643172e-06,139266.359375,1483.69120102266,"24","003","740400","24003740400","7404",Census Tract 7404,G5020,S,2705357,0,"+39.1354606","-076.7778306",MD,-76.7728627380724,39.1410030289785,,"8"
1613,1213,"10003453",MILL CREEK YOUTH CENTER,790 W 12TH ST,OGDEN,UT,"84404",NOT AVAILABLE,(801) 334-0210,STATE,OPEN,32,WEBER,"49057",USA,"922140",CORRECTIONAL INSTITUTIONS,https://jjs.utah.gov/research-reports,1/17/2018,IMAGERY,2018-01-17T00:00:00.000Z,https://jjs.utah.gov/research-reports-2,JUVENILE,58,0.00787072129337,2.657355577e-06,43798.1015625,1021.25526749109,"49","057","200300","49057200300","2003",Census Tract 2003,G5020,S,10602671,0,"+41.2611528","-111.9931474",UT,-111.998205956973,41.2482602059772,,"1"
1614,1214,"10001701",WASATCH YOUTH CENTER,3534 S 700 W,SALT LAKE CITY,UT,"84119",NOT AVAILABLE,(801) 265-5830,STATE,OPEN,22,SALT LAKE,"49035",USA,"922140",CORRECTIONAL INSTITUTIONS,https://jjs.utah.gov/research-reports,1/17/2018,IMAGERY,2018-01-17T00:00:00.000Z,https://jjs.utah.gov/research-reports-2,JUVENILE,46,0.00725378964702,1.555583984e-06,25424.4453125,896.998955530309,"49","035","111600","49035111600","1116",Census Tract 1116,G5020,S,6781146,0,"+40.6921706","-111.9033505",UT,-111.912974019644,40.6941432412416,"4","3"
1615,1215,"10006718",PUEBLO COUNTY WORK RELEASE FACILITY,"1600 WEST 24TH STREET, BUILDING 106",PUEBLO,CO,"81003",NOT AVAILABLE,NOT AVAILABLE,COUNTY,OPEN,-999,PUEBLO,"08101",USA,"922140",CORRECTIONAL INSTITUTIONS,https://www.sheriff.co.pueblo.co.us/index.html,2/20/2018,UNVERIFIED,2018-02-20T00:00:00.000Z,https://www.sheriff.co.pueblo.co.us/index.html,NOT AVAILABLE,80,0.00309728505947,4.18001797e-07,6599.51953125,376.997222853722,"08","101","000300","08101000300","3",Census Tract 3,G5020,S,1226785,0,"+38.2864927","-104.6295680",CO,-104.63352385049,38.2895375275886,,"6"
1616,1216,"10003447",CACHE VALLEY YOUTH CENTER,2051 N 600 W,LOGAN,UT,"84321",NOT AVAILABLE,(435) 713-6260,STATE,OPEN,7,CACHE,"49005",USA,"922140",CORRECTIONAL INSTITUTIONS,https://jjs.utah.gov/research-reports,1/17/2018,IMAGERY,2018-01-17T00:00:00.000Z,https://jjs.utah.gov/research-reports-2,JUVENILE,16,0.00484100019784,5.01972018e-07,8340.41796875,628.293209733266,"49","005","000300","49005000300","3",Census Tract 3,G5020,S,256385096,15677206,"+41.8218418","-111.9791309",UT,-111.850355018112,41.7703125284875,,"2"
1617,1217,"10003461",SALT LAKE VALLEY DETENTION CENTER / GENESIS YOUTH CENTER,3450 S 900 W,SALT LAKE CITY,UT,"84119",NOT AVAILABLE,(801) 261-5100,STATE,OPEN,79,SALT LAKE,"49035",USA,"922140",CORRECTIONAL INSTITUTIONS,https://jjs.utah.gov/research-reports,1/17/2018,IMAGERY,2018-01-17T00:00:00.000Z,https://jjs.utah.gov/research-reports-2,JUVENILE,112,0.00622824662878,1.199976616e-06,19612.87109375,779.497903938618,"49","035","111600","49035111600","1116",Census Tract 1116,G5020,S,6781146,0,"+40.6921706","-111.9033505",UT,-111.9183853064,40.6957508581719,"4","3"
1618,1218,"10001699",WEBER VALLEY YOUTH DETENTION CENTER,5470 S 2700 W,ROY,UT,"84067",NOT AVAILABLE,(801) 825-2794,STATE,OPEN,17,WEBER,"49057",USA,"922140",CORRECTIONAL INSTITUTIONS,https://jjs.utah.gov/research-reports,1/17/2018,IMAGERY,2018-01-17T00:00:00.000Z,https://jjs.utah.gov/research-reports-2,JUVENILE,24,0.00374170460925,3.54244841e-07,5831.125,468.098320573261,"49","057","210703","49057210703","2107.03",Census Tract 2107.03,G5020,S,1544988,0,"+41.1684391","-112.0489915",UT,-112.044270622681,41.1643673548374,,"1"
1619,1219,"10004722",RICHLAND COUNTY JAIL,211 WEST MARKET STREET,OLNEY,IL,"62450",NOT AVAILABLE,(618) 395-7483,COUNTY,OPEN,22,RICHLAND,"17159",USA,"922140",CORRECTIONAL INSTITUTIONS,http://www.richlandcso.com/default.htm,3/2/2018,IMAGERY,2018-03-02T00:00:00.000Z,http://www.richlandcso.com/default.htm,NOT AVAILABLE,60,0.00182494529502,1.67226481e-07,2656.41796875,223.331289081469,"17","159","978200","17159978200","9782",Census Tract 9782,G5020,S,3826929,0,"+38.7242524","-088.0731832",IL,-88.0856287667504,38.7300396325486,"2","1"
1620,1220,"10001881",SOUTHWESTERN REGIONAL JAIL,1300 GASTON CAPERTON DR,HOLDEN,WV,"25625",NOT AVAILABLE,(304) 239-3032,COUNTY,OPEN,400,LOGAN,"54045",USA,"922140",CORRECTIONAL INSTITUTIONS,http://rja.wv.gov/Pages/About-Us.aspx,1/23/2018,IMAGERY,2018-01-23T00:00:00.000Z,http://rja.wv.gov/facilityinfo/Pages/default.aspx,NOT AVAILABLE,500,0.00664666436449,2.103462901e-06,32991.00390625,829.725685121786,"54","045","956200","54045956200","9562",Census Tract 9562,G5020,S,64143580,162337,"+37.8385716","-082.0667855",WV,-82.0957509406457,37.805224727395,,"1"
1621,1221,"10003602",MISSOURI RIVER CORRECTIONAL CENTER,1800 48TH AVE SW,BISMARCK,ND,"58506",NOT AVAILABLE,(701) 328-9696,STATE,OPEN,187,BURLEIGH,"38015",USA,"922140",CORRECTIONAL INSTITUTIONS,"http://www.nd.gov/docr/media/stats.html, http://www.nd.gov/docr/adult/",12/31/2016,IMAGERY,2017-12-13T00:00:00.000Z,http://www.nd.gov/docr/adult/,MINIMUM,191,0.00857264802597,2.2676342e-06,41014.68359375,1136.57476477025,"38","015","011200","38015011200","112",Census Tract 112,G5020,S,57775602,11831608,"+46.7220607","-100.7536162",ND,-100.822780794463,46.7537877918322,,"1"
1622,1222,"10001559",MARYLAND CORRECTIONAL INSTITUTION FOR WOMEN,7943 BROCK BRIDGE RD,JESSUP,MD,"20794",NOT AVAILABLE,(410) 379-3800,STATE,OPEN,777,ANNE ARUNDEL,"24003",USA,"922140",CORRECTIONAL INSTITUTIONS,http://dpscs.maryland.gov/publicinfo/publications/annuals.shtml#doc,6/30/2016,IMAGERY/OTHER,2017-12-05T00:00:00.000Z,http://www.dpscs.maryland.gov/locations/prisons.shtml,MAXIMUM,800,0.0122042733898,9.638299956e-06,153973.8046875,1529.64397952109,"24","003","740400","24003740400","7404",Census Tract 7404,G5020,S,2705357,0,"+39.1354606","-076.7778306",MD,-76.7758663284263,39.1310857377118,,"8"
1623,1223,"10000095",MARBLE VALLEY REGIONAL CORRECTIONAL FACILITY,167 STATE ST,RUTLAND,VT,"05701",NOT AVAILABLE,(802) 786-5830,STATE,OPEN,130,RUTLAND,"50021",USA,"922140",CORRECTIONAL INSTITUTIONS,http://www.doc.state.vt.us/about/reports/,12/30/2016,IMAGERY,2018-01-17T00:00:00.000Z,http://www.doc.state.vt.us/custody-supervision/facilities,NOT AVAILABLE,118,0.00439151865615,9.51576967e-07,16286.0078125,598.030839764648,"50","021","963200","50021963200","9632",Census Tract 9632,G5020,S,5979867,173425,"+43.6202311","-072.9932497",VT,-72.9907897250825,43.6096902934651,"5","1"
1624,1224,"10001914",CHITTENDEN REGIONAL CORRECTIONAL FACILITY,7 FARRELL ST,SOUTH BURLINGTON,VT,"05403",NOT AVAILABLE,(802) 863-7356,STATE,OPEN,142,CHITTENDEN,"50007",USA,"922140",CORRECTIONAL INSTITUTIONS,http://www.doc.state.vt.us/about/reports/,12/30/2016,IMAGERY,2018-01-17T00:00:00.000Z,http://www.doc.state.vt.us/custody-supervision/facilities,NOT AVAILABLE,185,0.00473542931087,1.12363788e-06,19504.23828125,615.409754564785,"50","007","003304","50007003304","33.04",Census Tract 33.04,G5020,S,8492205,33471266,"+44.4502368","-073.2769460",VT,-73.2056378948393,44.4465271010308,,"1"
1625,1225,"10001546",MARYLAND CORRECTIONAL TRAINING CENTER,18800 ROXBURY RD,HAGERSTOWN,MD,"21746",NOT AVAILABLE,(240) 420-1601,STATE,OPEN,2436,WASHINGTON,"24043",USA,"922140",CORRECTIONAL INSTITUTIONS,http://dpscs.maryland.gov/publicinfo/publications/annuals.shtml#doc,6/30/2016,IMAGERY/OTHER,2017-12-05T00:00:00.000Z,http://www.dpscs.maryland.gov/locations/prisons.shtml,MEDIUM,2417,0.0205239359724,2.2485835932e-05,361452.3515625,2504.74377801613,"24","043","011000","24043011000","110",Census Tract 110,G5020,S,4425974,0,"+39.5596859","-077.7147954",MD,-77.714873973904,39.5648348604576,,"5"
1626,1226,"10002198",RIO BLANCO COUNTY DETENTION CENTER,355 4TH STREET,MEEKER,CO,"81641",NOT AVAILABLE,(970) 878-9550,COUNTY,OPEN,-999,RIO BLANCO,"08103",USA,"922140",CORRECTIONAL INSTITUTIONS,http://www.co.rio-blanco.co.us/297/Sheriffs-Office,2/20/2018,IMAGERY,2018-02-20T00:00:00.000Z,http://www.co.rio-blanco.co.us/297/Sheriffs-Office,NOT AVAILABLE,-999,0.0036400530155,4.4136374e-07,7143.796875,451.950822520881,"08","103","951100","08103951100","9511",Census Tract 9511,G5020,S,5156079830,4833853,"+39.9734231","-107.9122899",CO,-107.91191303248,40.038344508221,"2","1"
1627,1227,"10005029",WASHINGTON COUNTY JAIL,83 COURT STREET,MACHIAS,ME,"04654",NOT AVAILABLE,(207) 255-4422,COUNTY,OPEN,45,WASHINGTON,"23029",USA,"922140",CORRECTIONAL INSTITUTIONS,http://wcsheriffsoffice.blogspot.com/,10/31/2014,IMAGERY/OTHER,2018-03-20T00:00:00.000Z,https://washingtoncountysheriff.wordpress.com/,NOT AVAILABLE,-999,0.00243770580932,1.85241771e-07,3230.39453125,317.586144496689,"23","029","956200","23029956200","9562",Census Tract 9562,G5020,S,118573091,4555685,"+44.7297602","-067.4900109",ME,-67.4593665612663,44.7162246875337,"6","1"
1628,1228,"10003597",TYGART VALLEY REGIONAL JAIL,400 ABBEY ROAD,BELINGTON,WV,"26250",NOT AVAILABLE,(304) 637-0382,COUNTY,OPEN,444,RANDOLPH,"54083",USA,"922140",CORRECTIONAL INSTITUTIONS,http://rja.wv.gov/Pages/About-Us.aspx,1/23/2018,IMAGERY/OTHER,2018-01-23T00:00:00.000Z,http://rja.wv.gov/facilityinfo/Pages/default.aspx,NOT AVAILABLE,300,0.00681538073471,2.127732852e-06,33899.3828125,841.748670222232,"54","083","965900","54083965900","9659",Census Tract 9659,G5020,S,593019576,34445,"+38.7885314","-080.0788759",WV,-79.9514329134655,38.9405561570675,,"1"
1629,1229,"10000645",ROCK ISLAND COUNTY JAIL,1317 3RD AVENUE,ROCK ISLAND,IL,"61201",NOT AVAILABLE,(309) 558-3456,COUNTY,OPEN,260,ROCK ISLAND,"17161",USA,"922140",CORRECTIONAL INSTITUTIONS,http://www.rockislandcounty.org/Sheriff/Home/,3/2/2018,IMAGERY,2018-03-02T00:00:00.000Z,http://www.rockislandcounty.org/Sheriff/Home/,NOT AVAILABLE,329,0.00347305942041,4.00250904e-07,6623.3984375,422.112932448653,"17","161","022600","17161022600","226",Census Tract 226,G5020,S,2376370,1129925,"+41.5069280","-090.5865704",IL,-90.5807102547232,41.5091944847915,"1","1"
1630,1230,"10002236",RIO GRANDE COUNTY JAIL,640 CHERRY STREET,DEL NORTE,CO,"81132",NOT AVAILABLE,(719) 657-4000,COUNTY,OPEN,-999,RIO GRANDE,"08105",USA,"922140",CORRECTIONAL INSTITUTIONS,https://www.riograndecounty.org/departments/elected-officials/sheriff,2/20/2018,IMAGERY,2018-02-20T00:00:00.000Z,https://www.riograndecounty.org/departments/elected-officials/sheriff,NOT AVAILABLE,-999,0.00193427105961,1.89378555e-07,2965.08203125,245.797927711488,"08","105","976800","08105976800","9768",Census Tract 9768,G5020,S,10987825,13585,"+37.6748574","-106.3741193",CO,-106.350472019832,37.6765179544451,,"1"
1631,1231,"10006833",UNION COUNTY JUVENILE DETENTION CENTER,1075 EDWARD STREET,LINDEN,NJ,"07036",NOT AVAILABLE,(908) 523-1630,COUNTY,OPEN,-999,UNION,"34039",USA,"922140",CORRECTIONAL INSTITUTIONS,http://ucnj.org/department-of-corrections/,4/6/2018,IMAGERY,2018-04-06T00:00:00.000Z,http://ucnj.org/department-of-corrections/,JUVENILE,-999,0.00460026281145,1.019232239e-06,16637.48046875,564.639380668752,"34","039","035400","34039035400","354",Census Tract 354,G5020,S,16770692,1873147,"+40.6213262","-074.2251144",NJ,-74.2536396308703,40.6105890084607,,"1"
1632,1232,"10000918","MD RECEPTION, DIAGNOSTIC AND CLASSIFICATION CENTER",550 E MADISON ST,BALTIMORE,MD,"21202",NOT AVAILABLE,(410) 878-3500,STATE,OPEN,352,BALTIMORE CITY,"24510",USA,"922140",CORRECTIONAL INSTITUTIONS,http://dpscs.maryland.gov/publicinfo/publications/annuals.shtml#doc,6/30/2016,IMAGERY/OTHER,2017-12-05T00:00:00.000Z,http://www.dpscs.maryland.gov/locations/prisons.shtml,MAXIMUM,700,0.00215537647378,2.27919272e-07,3649.78515625,267.739238030975,"24","510","100300","24510100300","1003",Census Tract 1003,G5020,S,156309,0,"+39.2995112","-076.6091250",MD,-76.6071075197475,39.2992688961169,,"7"
1633,1233,"10006587",BISMARCK TRANSITION CENTER,2001 LEE AVENUE,BISMARCK,ND,"58504",NOT AVAILABLE,(701) 222-3440,STATE,OPEN,83,BURLEIGH,"38015",USA,"922140",CORRECTIONAL INSTITUTIONS,"http://www.nd.gov/docr/media/stats.html, https://www.nd.gov/docr/adult/transfacs/btc.html",12/31/2016,IMAGERY,2017-12-13T00:00:00.000Z,http://www.cccscorp.com/programs/,MINIMUM,162,0.00267521400693,3.41567069e-07,6182.26171875,356.416066841918,"38","015","010800","38015010800","108",Census Tract 108,G5020,S,4179660,0,"+46.7949479","-100.7662807",ND,-100.760541176243,46.7915391365931,,"1"
1634,1234,"10000092",NORTHEAST CORRECTIONAL COMPLEX WORK CAMP,1266 US ROUTE 5,ST. JOHNSBURY,VT,"05819",NOT AVAILABLE,(802) 748-8151,STATE,OPEN,55,CALEDONIA,"50005",USA,"922140",CORRECTIONAL INSTITUTIONS,http://www.doc.state.vt.us/about/reports/,12/30/2016,IMAGERY,2018-01-17T00:00:00.000Z,http://www.doc.state.vt.us/custody-supervision/facilities,MINIMUM,112,0.00338640410061,5.82950669e-07,10109.984375,434.137830885833,"50","005","957400","50005957400","9574",Census Tract 9574,G5020,S,47505596,429033,"+44.4605583","-072.0392927",VT,-72.0280261315429,44.3948314996385,"14","2"
1635,1235,"10001543",NORTH BRANCH CORRECTIONAL INSTITUTION,14100 MCMULLEN HWY SW,CUMBERLAND,MD,"21502",NOT AVAILABLE,(301) 729-7400,STATE,OPEN,1252,ALLEGANY,"24001",USA,"922140",CORRECTIONAL INSTITUTIONS,http://dpscs.maryland.gov/publicinfo/publications/annuals.shtml#doc,6/30/2016,IMAGERY/OTHER,2017-12-05T00:00:00.000Z,http://www.dpscs.maryland.gov/locations/prisons.shtml,MAXIMUM,1400,0.0170223564867,1.3838146021e-05,222564.19140625,2140.88553439093,"24","001","001300","24001001300","13",Census Tract 13,G5020,S,9705281,304110,"+39.6170751","-078.8129207",MD,-78.8180238239345,39.6024730286268,,"3"
1636,1236,"10001913",NORTHERN STATE CORRECTIONAL FACILITY,2559 GLEN RD,NEWPORT,VT,"05855",NOT AVAILABLE,(802) 334-3364,STATE,OPEN,414,ORLEANS,"50019",USA,"922140",CORRECTIONAL INSTITUTIONS,http://www.doc.state.vt.us/about/reports/,12/30/2016,IMAGERY,2018-01-17T00:00:00.000Z,http://www.doc.state.vt.us/custody-supervision/facilities,MEDIUM,433,0.00964204480494,4.805166927e-06,84072.9375,1312.57719781281,"50","019","951400","50019951400","9514",Census Tract 9514,G5020,S,6949850,1832217,"+44.9341623","-072.1979341",VT,-72.190935925741,44.9063130260885,"1","1"
1637,1237,"10001116",NORTHWEST STATE CORRECTIONAL FACILITY,3649 LOWER NEWTON RD,SWANTON,VT,"05488",NOT AVAILABLE,(802) 524-6771,STATE,OPEN,215,FRANKLIN,"50011",USA,"922140",CORRECTIONAL INSTITUTIONS,http://www.doc.state.vt.us/about/reports/,12/30/2016,IMAGERY,2018-01-17T00:00:00.000Z,http://www.doc.state.vt.us/custody-supervision/facilities,CLOSE,246,0.0131348022891,9.742639661e-06,170294.41796875,1698.49627425914,"50","011","010600","50011010600","106",Census Tract 106,G5020,S,95885276,60896537,"+44.8113612","-073.1458957",VT,-73.132265495511,44.8500904977824,"2","1"
1638,1238,"10001918",NORTHEAST CORRECTIONAL COMPLEX,1270 US ROUTE 5,ST. JOHNSBURY,VT,"05819",NOT AVAILABLE,(802) 748-8151,STATE,OPEN,118,CALEDONIA,"50005",USA,"922140",CORRECTIONAL INSTITUTIONS,http://www.doc.state.vt.us/about/reports/,12/30/2016,IMAGERY,2018-01-17T00:00:00.000Z,http://www.doc.state.vt.us/custody-supervision/facilities,NOT AVAILABLE,109,0.0050310276864,9.66548656e-07,16763.0234375,652.201499783572,"50","005","957400","50005957400","9574",Census Tract 9574,G5020,S,47505596,429033,"+44.4605583","-072.0392927",VT,-72.0278760414948,44.3962190218616,"14","2"
1639,1239,"10000093",SOUTHEAST STATE CORRECTIONAL FACILITY - WINDSOR,546 STATE FARM RD,WINDSOR,VT,"05089",NOT AVAILABLE,(802) 674-6717,STATE,CLOSED,0,WINDSOR,"50027",USA,"922140",CORRECTIONAL INSTITUTIONS,http://www.vnews.com/Only-staff-remains-and-Windsor-prison-closes-down-208-years-after-the-first-prison-opened-on-State-Street-in-1809-13432197,11/1/2017,IMAGERY,2018-01-17T00:00:00.000Z,http://www.doc.state.vt.us/custody-supervision/facilities/sescf/,NOT AVAILABLE,106,0.0129070259218,8.394658279e-06,143411.4453125,1684.94280979168,"50","027","966000","50027966000","9660",Census Tract 9660,G5020,S,50584090,721170,"+43.4753573","-072.4210442",VT,-72.4254137277462,43.5000754212955,"16","1"
1640,1240,"10004976",DALE CORRECTIONAL FACILITY,103 S MAIN ST,WATERBURY,VT,"05676",NOT AVAILABLE,NOT AVAILABLE,STATE,CLOSED,0,WASHINGTON,"50023",USA,"922140",CORRECTIONAL INSTITUTIONS,https://www.timesargus.com/articles/tentative-deal-would-close-waterburys-dale-womens-prison/,6/30/2009,IMAGERY,2018-01-17T00:00:00.000Z,NOT AVAILABLE,NOT AVAILABLE,-999,0.0187049965428,1.1410969995e-05,197683.65234375,2369.00926422048,"50","023","954300","50023954300","9543",Census Tract 9543,G5020,S,124931279,3936473,"+44.3682806","-072.7524504",VT,-72.7533459915996,44.331366757143,,"1"
1641,1241,"10002191",ROUTT COUNTY JAIL / SHERIFF,2025 SHIELD DRIVE,STEAMBOAT SPRINGS,CO,"80487",NOT AVAILABLE,(970) 879-1090,COUNTY,OPEN,-999,ROUTT,"08107",USA,"922140",CORRECTIONAL INSTITUTIONS,http://www.co.routt.co.us/204/Sheriff,2/20/2018,IMAGERY,2018-02-20T00:00:00.000Z,http://www.co.routt.co.us/204/Sheriff,MAXIMUM,54,0.00242443140089,2.44096287e-07,3978.05859375,313.464955553234,"08","107","000400","08107000400","4",Census Tract 4,G5020,S,100657473,14499,"+40.5043596","-106.9413569",CO,-106.860917090889,40.5019259391191,,"1"
1642,1242,"10001939",YORK COUNTY JAIL AND WOMEN'S REENTRY CENTER,1 LAYMAN WAY,ALFRED,ME,"04002",NOT AVAILABLE,(207) 324-1113,COUNTY,OPEN,340,YORK,"23031",USA,"922140",CORRECTIONAL INSTITUTIONS,http://www.yorkcountymaine.gov/sheriff-s-office,3/20/2018,IMAGERY,2018-03-20T00:00:00.000Z,http://www.yorkcountymaine.gov/sheriff-s-office,NOT AVAILABLE,350,0.010546008098,1.419533467e-06,24232.09765625,1330.64207547827,"23","031","029000","23031029000","290",Census Tract 290,G5020,S,70614155,1682138,"+43.4785681","-070.7270912",ME,-70.7172906702325,43.4533795601814,,"1"
1643,1243,"10001959",BERNALILLO COUNTY YOUTH SERVICES CENTER,5100 2ND ST NW,ALBUQUERQUE,NM,"87107",NOT AVAILABLE,(505) 468-7236,COUNTY,OPEN,33,BERNALILLO,"35001",USA,"922140",CORRECTIONAL INSTITUTIONS,https://www.bernco.gov/youth-services-center/,4/6/2018,IMAGERY,2018-04-06T00:00:00.000Z,https://www.bernco.gov/youth-services-center/,JUVENILE,78,0.00766398326037,1.660343204e-06,25158.3515625,906.035160425694,"35","001","003201","35001003201","32.01",Census Tract 32.01,G5020,S,1739788,0,"+35.1349467","-106.6440301",NM,-106.637092932447,35.1327546560792,,"1"
1644,1244,"10004040",POPLAR HILL PRE-RELEASE UNIT,24090 NANTICOKE RD,QUANTICO,MD,"21856",NOT AVAILABLE,(410) 845-4580,STATE,OPEN,194,WICOMICO,"24045",USA,"922140",CORRECTIONAL INSTITUTIONS,http://dpscs.maryland.gov/publicinfo/publications/annuals.shtml#doc,6/30/2016,IMAGERY,2017-12-05T00:00:00.000Z,http://www.dpscs.maryland.gov/locations/prisons.shtml,MINIMUM,192,0.00490769721926,3.49973916e-07,5530.9609375,598.74828684527,"24","045","010800","24045010800","108",Census Tract 108,G5020,S,263141495,51174907,"+38.3188264","-075.7974016",MD,-75.7804328438256,38.3616826717753,,"1"
1645,1245,"10001547",ROXBURY CORRECTIONAL INSTITUTION,18701 ROXBURY RD,HAGERSTOWN,MD,"21746",NOT AVAILABLE,(240) 420-3000,STATE,OPEN,1749,WASHINGTON,"24043",USA,"922140",CORRECTIONAL INSTITUTIONS,http://dpscs.maryland.gov/publicinfo/publications/annuals.shtml#doc,6/30/2016,IMAGERY/OTHER,2017-12-05T00:00:00.000Z,http://www.dpscs.maryland.gov/locations/prisons.shtml,MEDIUM,1700,0.0163997491432,1.6153716299e-05,259633.03515625,2164.54470309188,"24","043","011000","24043011000","110",Census Tract 110,G5020,S,4425974,0,"+39.5596859","-077.7147954",MD,-77.7173262209188,39.5561122463085,,"5"
1646,1246,"10002367",ALFRED D NOYES CHILDREN'S CENTER,9925 BLACKWELL RD,ROCKVILLE,MD,"20850",NOT AVAILABLE,(301) 315-1610,STATE,OPEN,28,MONTGOMERY,"24031",USA,"922140",CORRECTIONAL INSTITUTIONS,"http://www.djs.state.md.us/Pages/Publications.aspx, http://www.djs.state.md.us/Pages/facilities/index.aspx",10/13/2017,IMAGERY,2017-12-05T00:00:00.000Z,http://www.djs.state.md.us/Pages/facilities/index.aspx,JUVENILE,57,0.0042820312207,6.8517466e-07,10941.40625,539.921392686272,"24","031","700817","24031700817","7008.17",Census Tract 7008.17,G5020,S,3807582,32165,"+39.1066029","-077.2013839",MD,-77.2047701258661,39.1028564459088,,"1"
1647,1247,"10001567",SOUTHERN MARYLAND PRE-RELEASE UNIT,14320 OAKS RD,CHARLOTTE HALL,MD,"20622",NOT AVAILABLE,(301) 274-4701,STATE,OPEN,171,CHARLES,"24017",USA,"922140",CORRECTIONAL INSTITUTIONS,http://dpscs.maryland.gov/publicinfo/publications/annuals.shtml#doc,6/30/2016,IMAGERY,2017-12-05T00:00:00.000Z,http://www.dpscs.maryland.gov/locations/prisons.shtml,MINIMUM,165,0.00506430560532,5.32899057e-07,8438.828125,608.092343601404,"24","017","851302","24017851302","8513.02",Census Tract 8513.02,G5020,S,71456561,567589,"+38.5203192","-076.8591522",MD,-76.8130847795055,38.5065142587889,,"1"
1648,1248,"10001542",WESTERN CORRECTIONAL INSTITUTION,13800 MCMULLEN HWY SW,CUMBERLAND,MD,"21502",NOT AVAILABLE,(301) 729-7000,STATE,OPEN,1606,ALLEGANY,"24001",USA,"922140",CORRECTIONAL INSTITUTIONS,http://dpscs.maryland.gov/publicinfo/publications/annuals.shtml#doc,6/30/2016,IMAGERY/OTHER,2017-12-05T00:00:00.000Z,http://www.dpscs.maryland.gov/locations/prisons.shtml,MAXIMUM,1630,0.0184885024451,1.6308255696e-05,262307.8828125,2372.47614939523,"24","001","001300","24001001300","13",Census Tract 13,G5020,S,9705281,304110,"+39.6170751","-078.8129207",MD,-78.8154198379271,39.6067516954474,,"3"
1649,1249,"10002361",BALTIMORE CITY JUVENILE JUSTICE CENTER,300 N GAY ST,BALTIMORE,MD,"21202",NOT AVAILABLE,(443) 263-8706,STATE,OPEN,99,BALTIMORE CITY,"24510",USA,"922140",CORRECTIONAL INSTITUTIONS,"http://www.djs.state.md.us/Pages/Publications.aspx, http://www.djs.state.md.us/Pages/facilities/index.aspx",10/13/2017,IMAGERY/OTHER,2017-12-05T00:00:00.000Z,http://www.djs.state.md.us/Pages/facilities/index.aspx,JUVENILE,120,0.00652067411971,1.679032693e-06,26885.23046875,791.052158011781,"24","510","280500","24510280500","2805",Census Tract 2805,G5020,S,923979,0,"+39.2951239","-076.6029382",MD,-76.6079932777449,39.2941197037693,,"1"
1650,1250,"10004740",BACKBONE MOUNTAIN YOUTH CENTER,124 CAMP 4 ROAD,SWANTON,MD,"21561",NOT AVAILABLE,(301) 359-9190,STATE,OPEN,25,GARRETT,"24023",USA,"922140",CORRECTIONAL INSTITUTIONS,"http://www.djs.state.md.us/Pages/Publications.aspx, http://www.djs.state.md.us/Pages/facilities/index.aspx",10/13/2017,IMAGERY,2017-12-05T00:00:00.000Z,http://www.djs.state.md.us/Pages/facilities/index.aspx,JUVENILE,48,0.00898643855097,2.81113868e-06,45126.72265625,1143.95401537141,"24","023","000400","24023000400","4",Census Tract 4,G5020,S,264684192,2250594,"+39.4334404","-079.1904653",MD,-79.1687050048551,39.4704008407968,,"1"
1651,1251,"10004027","CHARLES H HICKEY, JR. SCHOOL",9700 OLD HARFORD ROAD,PARKVILLE,MD,"21234",NOT AVAILABLE,(410) 663-7700,STATE,OPEN,58,BALTIMORE,"24005",USA,"922140",CORRECTIONAL INSTITUTIONS,"http://www.djs.state.md.us/Pages/Publications.aspx, http://www.djs.state.md.us/Pages/facilities/index.aspx",10/13/2017,IMAGERY,2017-12-05T00:00:00.000Z,http://www.djs.state.md.us/Pages/facilities/index.aspx,JUVENILE,72,0.0183392034907,1.1365079066e-05,182318.796875,2301.60283067922,"24","005","492600","24005492600","4926",Census Tract 4926,G5020,S,4325242,0,"+39.4110303","-076.5318285",MD,-76.5186892890902,39.4235156049604,,"1"
1652,1252,"10001566",CHELTENHAM YOUTH DETENTION CENTER,11003 FRANK TIPPETT RD,CHELTENHAM,MD,"20623",NOT AVAILABLE,(301) 782-2400,STATE,OPEN,42,PRINCE GEORGE'S,"24033",USA,"922140",CORRECTIONAL INSTITUTIONS,"http://www.djs.state.md.us/Pages/Publications.aspx, http://www.turnerconstruction.com/experience/project/678F/cheltenham-youth-detention-center",10/13/2017,IMAGERY,2017-12-05T00:00:00.000Z,http://www.djs.state.md.us/Pages/facilities/index.aspx,JUVENILE,72,0.00871225053503,4.325092586e-06,68713.921875,1054.01817381979,"24","033","801004","24033801004","8010.04",Census Tract 8010.04,G5020,S,36523557,219049,"+38.7250838","-076.8513765",MD,-76.836510356821,38.7396644874752,,"1"
1653,1253,"10003634",TWO BRIDGES REGIONAL JAIL,522 BATH RD,WISCASSET,ME,"04578",NOT AVAILABLE,(207) 882-4268,COUNTY,OPEN,146,LINCOLN,"23015",USA,"922140",CORRECTIONAL INSTITUTIONS,https://www.tbrj.org/,3/20/2018,IMAGERY,2018-03-20T00:00:00.000Z,https://www.tbrj.org/,NOT AVAILABLE,172,0.00611872202154,1.777700867e-06,30613.06640625,787.128797584508,"23","015","975500","23015975500","9755",Census Tract 9755,G5020,S,165484382,29078072,"+44.0174640","-069.7172271",ME,-69.6989492943034,43.9781016074507,"5","2"
1654,1254,"10001886",CROOK COUNTY JAIL,309 CLEVELAND ST,SUNDANCE,WY,"82729",NOT AVAILABLE,NOT AVAILABLE,COUNTY,OPEN,-999,CROOK,"56011",USA,"922140",CORRECTIONAL INSTITUTIONS,http://www.crookcounty.wy.gov/elected_officials/sheriff_s_department/index.php,5/10/2018,IMAGERY,2018-05-10T00:00:00.000Z,NOT AVAILABLE,NOT AVAILABLE,-999,0.00264299588463,2.98560077e-07,5178.796875,332.052157479957,"56","011","950300","56011950300","9503",Census Tract 9503,G5020,S,2189915360,369706,"+44.4406013","-104.3389748",WY,-104.378539679576,44.4053913049994,,"1"
1655,1255,"10001564",THOMAS J. S. WAXTER CHILDREN'S CENTER,375 RED CLAY RD,LAUREL,MD,"20724",NOT AVAILABLE,(301) 362-6160,STATE,OPEN,19,ANNE ARUNDEL,"24003",USA,"922140",CORRECTIONAL INSTITUTIONS,"http://www.djs.state.md.us/Pages/Publications.aspx, http://www.djs.state.md.us/Pages/facilities/index.aspx",10/13/2017,IMAGERY,2017-12-05T00:00:00.000Z,http://www.djs.state.md.us/Pages/facilities/index.aspx,JUVENILE,42,0.00586259434148,1.128106307e-06,18011.6953125,741.198583915132,"24","003","751500","24003751500","7515",Census Tract 7515,G5020,S,12765150,0,"+39.0922977","-076.8003056",MD,-76.8090847282065,39.0918712010591,,"3"
1656,1256,"10004029",J DEWEESE CARTER CENTER,300 SCHEELER RD,CHESTERTOWN,MD,"21620",NOT AVAILABLE,(410) 778-6444,STATE,OPEN,11,KENT,"24029",USA,"922140",CORRECTIONAL INSTITUTIONS,"http://www.djs.state.md.us/Pages/Publications.aspx, http://www.djs.state.md.us/Pages/facilities/index.aspx",10/13/2017,IMAGERY,2017-12-05T00:00:00.000Z,http://www.djs.state.md.us/Pages/facilities/index.aspx,JUVENILE,14,0.00826072009245,1.412714876e-06,22600.62890625,1025.05347620456,"24","029","950300","24029950300","9503",Census Tract 9503,G5020,S,21441968,1753917,"+39.2277772","-076.0714268",MD,-76.0649425607765,39.2314101474535,"4","2"
1657,1257,"10001915",WOODSIDE JUVENILE REHABILITATION CENTER,26 WOODSIDE DR E,COLCHESTER,VT,"05446",NOT AVAILABLE,(802) 655-4990,STATE,OPEN,6,CHITTENDEN,"50007",USA,"922140",CORRECTIONAL INSTITUTIONS,http://dcf.vermont.gov/youth/PREA,4/21/2017,IMAGERY,2018-01-18T00:00:00.000Z,http://dcf.vermont.gov/youth/woodside,JUVENILE,30,0.0038107811456,4.7142943e-07,8190.93359375,479.13454159877,"50","007","002701","50007002701","27.01",Census Tract 27.01,G5020,S,40300359,512126,"+44.5413577","-073.0957383",VT,-73.1443997615887,44.5022144172635,,"1"
1658,1258,"10004741",MEADOW MOUNTAIN YOUTH CENTER,234 RECOVERY ROAD,GRANTSVILLE,MD,"21535",NOT AVAILABLE,(301) 895-5669,STATE,OPEN,22,GARRETT,"24023",USA,"922140",CORRECTIONAL INSTITUTIONS,"http://www.djs.state.md.us/Pages/Publications.aspx, http://www.djs.state.md.us/Pages/facilities/index.aspx",10/13/2017,IMAGERY,2017-12-05T00:00:00.000Z,http://www.djs.state.md.us/Pages/facilities/index.aspx,JUVENILE,40,0.00554643000994,1.595690813e-06,25652.8671875,664.098318077798,"24","023","000300","24023000300","3",Census Tract 3,G5020,S,326802297,1421234,"+39.6209480","-079.0544096",MD,-79.1959849360601,39.5720564650311,,"2"
1659,1259,"10004742",SAVAGE MOUNTAIN YOUTH CENTER,164 FREEDOM LANE,LONACONING,MD,"21539",NOT AVAILABLE,(301) 463-2244,STATE,OPEN,10,GARRETT,"24023",USA,"922140",CORRECTIONAL INSTITUTIONS,"http://www.djs.state.md.us/Pages/Publications.aspx, http://www.djs.state.md.us/Pages/facilities/index.aspx",10/13/2017,IMAGERY,2017-12-05T00:00:00.000Z,http://www.djs.state.md.us/Pages/facilities/index.aspx,JUVENILE,36,0.009468276079,4.204953805e-06,67622.18359375,1159.50210940667,"24","023","000300","24023000300","3",Census Tract 3,G5020,S,326802297,1421234,"+39.6209480","-079.0544096",MD,-79.0231213031897,39.5945068065006,,"2"
1660,1260,"10005711",CATRON COUNTY DETENTION CENTER,101 MAIN ST,RESERVE,NM,"87830",NOT AVAILABLE,(505) 533-6222,COUNTY,OPEN,-999,CATRON,"35003",USA,"922140",CORRECTIONAL INSTITUTIONS,"http://www.nmjustice.net/nmsc/juvenile/program.php?id=6028, https://www.nmlegis.gov/handouts/CCJ%20052716%20Item%203%20NM%20County%20Jails%20An%20Overview.pdf",5/27/2016,IMAGERY,2018-04-06T00:00:00.000Z,NOT AVAILABLE,NOT AVAILABLE,10,0.00131677038178,8.1767463e-08,1218.11328125,156.156670587201,"35","003","976400","35003976400","9764",Census Tract 9764,G5020,S,17933559836,14195265,"+33.9016208","-108.3919284",NM,-108.757709385973,33.7123860491416,,"1"
1661,1261,"10006588",NORTH DAKOTA STATE HOSPITAL - TOMPKINS REHABILITATION AND CORRECTIONS CENTER,2605 CIRCLE DRIVE,JAMESTOWN,ND,"58401",NOT AVAILABLE,(701) 253-3755,STATE,OPEN,102,STUTSMAN,"38093",USA,"922140",CORRECTIONAL INSTITUTIONS,"http://www.nd.gov/docr/media/stats.html, https://www.nd.gov/docr/adult/transfacs/trcc.html",12/31/2016,IMAGERY,2017-12-13T00:00:00.000Z,https://www.nd.gov/docr/adult/transfacs/trcc.html,MINIMUM,90,0.0117016054003,7.147226628e-06,129580.8359375,1615.33212267725,"38","093","967300","38093967300","9673",Census Tract 9673,G5020,S,22396407,0,"+46.9174162","-098.6722581",ND,-98.6882019699825,46.8821056343318,,"2"
1662,1262,"10001248",CHAVES COUNTY ADULT DETENTION CENTER,3701 S ATKINSON,ROSWELL,NM,"88203",NOT AVAILABLE,(575) 624-6517,COUNTY,OPEN,-999,CHAVES,"35005",USA,"922140",CORRECTIONAL INSTITUTIONS,"https://www.co.chaves.nm.us/148/Departments, https://www.nmlegis.gov/handouts/CCJ%20052716%20Item%203%20NM%20County%20Jails%20An%20Overview.pdf",5/27/2016,IMAGERY,2018-04-06T00:00:00.000Z,https://www.co.chaves.nm.us/148/Departments,NOT AVAILABLE,400,0.0083188914375,3.914930903e-06,58078.89453125,1031.92004082245,"35","005","000600","35005000600","6",Census Tract 6,G5020,S,20135621,40199,"+33.3640736","-104.4955418",NM,-104.504300223461,33.3517575873578,,"1"
1663,1263,"10006865",COCHRAN COUNTY JAIL,100 NORTH MAIN STREET,MORTON,TX,"79346",NOT AVAILABLE,NOT AVAILABLE,COUNTY,OPEN,11,COCHRAN,"48079",USA,"922140",CORRECTIONAL INSTITUTIONS,"http://www.co.cochran.tx.us/page/cochran.Sheriff, https://www.tcjs.state.tx.us/index.php?linkID=325",3/1/2018,IMAGERY,2018-04-26T00:00:00.000Z,NOT AVAILABLE,NOT AVAILABLE,13,0.00144700172141,1.1178714e-07,1665.578125,183.599088432427,"48","079","950100","48079950100","9501",Census Tract 9501,G5020,S,2007453828,229068,"+33.6084401","-102.8304490",TX,-102.759779709712,33.7258119322545,,"1"
1664,1264,"10002737",COLLIN COUNTY DETENTION FACILITY,4300 COMMUNITY AVE,MCKINNEY,TX,"75071",NOT AVAILABLE,(972) 547-5200,COUNTY,OPEN,1189,COLLIN,"48085",USA,"922140",CORRECTIONAL INSTITUTIONS,"http://www.collincountytx.gov/sheriff/Pages/default.aspx, https://www.tcjs.state.tx.us/index.php?linkID=325",3/1/2018,IMAGERY,2018-04-26T00:00:00.000Z,http://www.collincountytx.gov/sheriff/Pages/default.aspx,MAXIMUM,1298,0.0116481618328,5.380279718e-06,79720.65234375,1450.79281354077,"48","085","030604","48085030604","306.04",Census Tract 306.04,G5020,S,4734065,99064,"+33.2443529","-096.6431785",TX,-96.6342730023098,33.2456710101725,,"2"
1665,1265,"10006738",ST. CLAIR COUNTY JUVENILE DETENTION CENTER,9006 LEBANON RD,BELLEVILLE,IL,"62223",NOT AVAILABLE,(618) 397-9546,COUNTY,OPEN,-999,ST. CLAIR,"17163",USA,"922140",CORRECTIONAL INSTITUTIONS,http://ipcsa.org/il-probation-directory/,3/2/2018,IMAGERY,2018-03-02T00:00:00.000Z,http://www.co.st-clair.il.us/departments/probation/Pages/default.aspx,JUVENILE,-999,0.00371908118894,4.41385316e-07,6997.43359375,459.49273594193,"17","163","501501","17163501501","5015.01",Census Tract 5015.01,G5020,S,3888649,0,"+38.5822611","-090.0511444",IL,-90.0557299501301,38.5867502867794,,"1"
1666,1266,"10002736",JOHN R ROACH JUVENILE DETENTION CENTER,4700 COMMUNITY AVE,MCKINNEY,TX,"75071",NOT AVAILABLE,(972) 547-5400,COUNTY,OPEN,-999,COLLIN,"48085",USA,"922140",CORRECTIONAL INSTITUTIONS,http://www.tjjd.texas.gov/publications/other/searchfacilityregistryresults.aspx?SelectedFacilityType=YKSBbGCMUWM=&SelectedSortBy=laExhobORj5ZHimppFKN0Q==&IncludeInactive=bZL7qeN3IjY=,4/26/2018,IMAGERY,2018-04-26T00:00:00.000Z,http://www.collincountytx.gov/juvenile_probation/Pages/default.aspx,JUVENILE,144,0.00418194655117,8.4642763e-07,12542.16015625,519.152203427818,"48","085","030604","48085030604","306.04",Census Tract 306.04,G5020,S,4734065,99064,"+33.2443529","-096.6431785",TX,-96.6330549791188,33.2489664968512,,"2"
1667,1267,"10004028",VICTOR CULLEN CENTER,6000 CULLEN DR,SABILLASVILLE,MD,"21780",NOT AVAILABLE,(301) 739-8122,STATE,OPEN,28,FREDERICK,"24021",USA,"922140",CORRECTIONAL INSTITUTIONS,"http://www.djs.state.md.us/Pages/Publications.aspx, http://www.djs.state.md.us/Pages/facilities/index.aspx",10/13/2017,IMAGERY,2017-12-05T00:00:00.000Z,http://www.djs.state.md.us/Pages/facilities/index.aspx,JUVENILE,48,0.0233659221643,1.4296263093e-05,230299.1015625,3044.51882031209,"24","021","752900","24021752900","7529",Census Tract 7529,G5020,S,124351554,353462,"+39.6427210","-077.4410705",MD,-77.457272357857,39.7125770230867,,"1"
1668,1268,"10005832",NEW BEGINNINGS YOUTH DEVELOPMENT CENTER,8400 RIVER ROAD,LAUREL,MD,"20724",NOT AVAILABLE,(202) 299-3100,STATE,OPEN,-999,ANNE ARUNDEL,"24003",USA,"922140",CORRECTIONAL INSTITUTIONS,http://www.aecom.com/future/projects/new-beginnings-youth-development-center/,7/11/2016,IMAGERY/OTHER,2017-12-05T00:00:00.000Z,https://dyrs.dc.gov/service/secure-facilities,JUVENILE,60,0.006175644164,2.276011995e-06,36344.3515625,767.993069293105,"24","003","751500","24003751500","7515",Census Tract 7515,G5020,S,12765150,0,"+39.0922977","-076.8003056",MD,-76.7867177667634,39.1012641892644,,"3"
1669,1269,"10001555",VOLUNTEERS OF AMERICA-CHESAPEAKE RESIDENTIAL RE-ENTRY CENTER,5000 EAST MONUMENT ST,BALTIMORE,MD,"21205",NOT AVAILABLE,(410) 276-5880,STATE,OPEN,-999,BALTIMORE CITY,"24510",USA,"922140",CORRECTIONAL INSTITUTIONS,https://www.voachesapeake.org/rrc,12/5/2017,IMAGERY,2017-12-05T00:00:00.000Z,https://www.voachesapeake.org/rrc,MINIMUM,148,0.00282597045584,4.98524441e-07,7983.26953125,360.134321168331,"24","510","260404","24510260404","2604.04",Census Tract 2604.04,G5020,S,4467271,0,"+39.3000661","-076.5528622",MD,-76.5555481387283,39.3004805476207,"4","1"
1670,1270,"10004033",BALTIMORE CITY DETENTION CENTER,401 E EAGER ST,BALTIMORE,MD,"21202",NOT AVAILABLE,(410) 209-4145,STATE,CLOSED,0,BALTIMORE CITY,"24510",USA,"922140",CORRECTIONAL INSTITUTIONS,http://governor.maryland.gov/2015/08/25/governor-larry-hogan-announces-final-detainee-transfer-from-baltimore-city-detention-center/,8/25/2015,IMAGERY/OTHER,2017-12-05T00:00:00.000Z,http://www.dpscs.state.md.us/locations/bcdc.shtml,MAXIMUM,-999,0.0067382018655,1.491469984e-06,23883.8828125,896.726807405795,"24","510","100300","24510100300","1003",Census Tract 1003,G5020,S,156309,0,"+39.2995112","-076.6091250",MD,-76.6097979576549,39.2998646444684,,"7"
1671,1271,"10001563",OAK HILL YOUTH DETENTION CENTER,3201 OAK HILL DR,LAUREL,MD,"20724",NOT AVAILABLE,NOT AVAILABLE,STATE,CLOSED,0,ANNE ARUNDEL,"24003",USA,"922140",CORRECTIONAL INSTITUTIONS,http://www.washingtonpost.com/wp-dyn/content/article/2009/05/28/AR2009052803747.html,6/30/2009,IMAGERY,2017-12-05T00:00:00.000Z,NOT AVAILABLE,JUVENILE,-999,0.0132240088715,1.1561770096e-05,184634.12109375,1618.78990143714,"24","003","751500","24003751500","7515",Census Tract 7515,G5020,S,12765150,0,"+39.0922977","-076.8003056",MD,-76.775717307756,39.1053382711067,,"3"
1672,1272,"10000915",WESTERN MARYLAND CHILDREN'S CENTER,18420 ROXBURY RD,HAGERSTOWN,MD,"21740",NOT AVAILABLE,(301) 745-6071,STATE,OPEN,20,WASHINGTON,"24043",USA,"922140",CORRECTIONAL INSTITUTIONS,"http://www.djs.state.md.us/Pages/Publications.aspx, http://www.djs.state.md.us/Pages/facilities/index.aspx",10/13/2017,IMAGERY,2017-12-05T00:00:00.000Z,http://www.djs.state.md.us/Pages/facilities/index.aspx,JUVENILE,24,0.00355651201977,5.31374667e-07,8541.9296875,438.770373808504,"24","043","011000","24043011000","110",Census Tract 110,G5020,S,4425974,0,"+39.5596859","-077.7147954",MD,-77.7280223976068,39.567005249618,,"5"
1673,1273,"10006666",HOWARD CENTER - PARK STREET PROGRAM,77 PARK STREET,RUTLAND,VT,"05701",NOT AVAILABLE,(212) 677-5093,STATE,OPEN,7,RUTLAND,"50021",USA,"922140",CORRECTIONAL INSTITUTIONS,http://dcf.vermont.gov/youth/PREA,6/10/2015,IMAGERY,2018-01-18T00:00:00.000Z,http://howardcenter.org/All-Programs,JUVENILE,12,0.0028063405504,4.50045474e-07,7700.6328125,355.449247250277,"50","021","963300","50021963300","9633",Census Tract 9633,G5020,S,7625635,129118,"+43.5978333","-072.9756345",VT,-72.9769232708463,43.595708788927,"4","1"
1674,1274,"10006719",SAGUACHE COUNTY JAIL,530 5TH STREET,SAGUACHE,CO,"81149",NOT AVAILABLE,NOT AVAILABLE,COUNTY,OPEN,-999,SAGUACHE,"08109",USA,"922140",CORRECTIONAL INSTITUTIONS,https://www.saguachecounty.net/index.php/sheriff,2/20/2018,IMAGERY,2018-02-20T00:00:00.000Z,https://www.saguachecounty.net/index.php/sheriff,NOT AVAILABLE,-999,0.00105176675613,6.2551868e-08,984.82421875,133.417043888798,"08","109","977600","08109977600","9776",Census Tract 9776,G5020,S,7204038324,4314125,"+38.1324118","-106.2972506",CO,-106.137929188653,38.0852495764395,"2","1"
1675,1275,"10006269",SAN MIGUEL COUNTY JAIL,684 CR 63L,TELLURIDE,CO,"81435",NOT AVAILABLE,(970) 728-1911,COUNTY,OPEN,13,SAN MIGUEL,"08113",USA,"922140",CORRECTIONAL INSTITUTIONS,https://www.sanmiguelcountyco.gov/201/Sheriff,2/20/2018,IMAGERY/OTHER,2018-02-20T00:00:00.000Z,https://www.sanmiguelcountyco.gov/201/Sheriff,NOT AVAILABLE,37,0.0015308947214,1.35000559e-07,2121.421875,186.95783746028,"08","113","968103","08113968103","9681.03",Census Tract 9681.03,G5020,S,829345976,991507,"+37.9622487","-107.9945187",CO,-107.906072904705,37.9459977342771,"5","1"
1676,1276,"10004032",WILLIAM DONALD SCHAFFER HOUSE,907 DRUID PARK LAKE DR,BALTIMORE,MD,"21217",NOT AVAILABLE,(410) 230-3190,STATE,OPEN,-999,BALTIMORE CITY,"24510",USA,"922140",CORRECTIONAL INSTITUTIONS,http://162.242.255.103/resource/maryland-department-of-juvenile-services-william-donald-schaefer-house/,12/5/2017,IMAGERY,2017-12-05T00:00:00.000Z,http://162.242.255.103/resource/maryland-department-of-juvenile-services-william-donald-schaefer-house/,JUVENILE,20,0.00205621084196,2.33690265e-07,3743.109375,254.158140117262,"24","510","130100","24510130100","1301",Census Tract 1301,G5020,S,301238,0,"+39.3152325","-076.6343935",MD,-76.6375507948176,39.3162923210205,"1","1"
1677,1277,"10002202",SUMMIT COUNTY JAIL / SHERIFF,501 NORTH PARK AVENUE,BRECKENRIDGE,CO,"80424","0210",(970) 453-2232,COUNTY,OPEN,-999,SUMMIT,"08117",USA,"922140",CORRECTIONAL INSTITUTIONS,http://co.summit.co.us/109/Sheriffs-Office,2/20/2018,IMAGERY,2018-02-20T00:00:00.000Z,http://co.summit.co.us/109/Sheriffs-Office,NOT AVAILABLE,95,0.00373225027915,4.91633063e-07,7894.484375,475.592273078319,"08","117","000401","08117000401","4.01",Census Tract 4.01,G5020,S,151025310,447196,"+39.4502392","-106.0644288",CO,-106.046984392566,39.4913272520634,,"1"
1678,1278,"10006547",MARYLAND CORRECTIONAL TRAINING CENTER HED/EHU,18800 ROXBURY ROAD,HAGERSTOWN,MD,"21746",NOT AVAILABLE,(240) 420-1601,STATE,OPEN,387,WASHINGTON,"24043",USA,"922140",CORRECTIONAL INSTITUTIONS,http://mgaleg.maryland.gov/pubs/budgetfiscal/2018fy-budget-docs-capital-q0-department-of-public-safety-and-correctional-services.pdf,12/5/2017,IMAGERY,2017-12-05T00:00:00.000Z,http://www.dpscs.maryland.gov/locations/prisons.shtml,MINIMUM,390,0.00786795978409,3.593589354e-06,57766.0703125,966.809358798998,"24","043","011000","24043011000","110",Census Tract 110,G5020,S,4425974,0,"+39.5596859","-077.7147954",MD,-77.722795723355,39.5652071086568,,"5"
1679,1279,"10006589",FARGO RESIDENTIAL RE-ENTRY FACILITY FOR MALES,123 15TH STREET NORTH,FARGO,ND,"58102",NOT AVAILABLE,(701) 237-9340,STATE,OPEN,23,CASS,"38017",USA,"922140",CORRECTIONAL INSTITUTIONS,"http://www.nd.gov/docr/media/stats.html, http://centreinc.org/Fargo/",12/31/2016,IMAGERY/OTHER,2017-12-13T00:00:00.000Z,http://centreinc.org/Fargo/,MINIMUM,134,0.00293263137087,3.3468271e-07,6067.453125,424.061367396574,"38","017","000600","38017000600","6",Census Tract 6,G5020,S,8943002,0,"+46.8778896","-096.8226165",ND,-96.8033262937021,46.8784195101321,,"3"
1680,1280,"10001938",MOUNTAIN VIEW CORRECTIONAL FACILITY,1182 DOVER RD,CHARLESTON,ME,"04422",NOT AVAILABLE,(207) 285-0880,STATE,OPEN,-999,PENOBSCOT,"23019",USA,"922140",CORRECTIONAL INSTITUTIONS,http://www.maine.gov/corrections/adultfacilities/index.shtml,12/5/2017,IMAGERY,2017-12-05T00:00:00.000Z,http://www.maine.gov/corrections/adultfacilities/index.shtml,MEDIUM,394,0.0225924966463,8.133088375e-06,142762.87890625,2844.81748245122,"23","019","031200","23019031200","312",Census Tract 312,G5020,S,209330453,33017,"+45.0364784","-069.0212103",ME,-69.094449700847,45.0925204622566,,"1"
1681,1281,"10006548",SILVER OAK ACADEMY,999 CROUSE MILL ROAD,KEYMAR,MD,"21757",NOT AVAILABLE,(410) 775-1745,STATE,OPEN,-999,CARROLL,"24013",USA,"922140",CORRECTIONAL INSTITUTIONS,http://silveroakacademy.com/,12/5/2017,IMAGERY,2017-12-05T00:00:00.000Z,http://silveroakacademy.com/,JUVENILE,-999,0.00925974111843,3.597351201e-06,57859.41796875,1129.96900314525,"24","013","510000","24013510000","5100",Census Tract 5100,G5020,S,56579559,150286,"+39.6289823","-077.2397116",MD,-77.2003099763735,39.6045931334211,,"1"
1682,1282,"10000987",CLALLAM BAY CORRECTIONS CENTER,1830 EAGLE CREST WAY,CLALLAM BAY,WA,"98326",NOT AVAILABLE,(360) 963-2000,STATE,OPEN,874,CLALLAM,"53009",USA,"922140",CORRECTIONAL INSTITUTIONS,http://www.doc.wa.gov/information/data/analytics.htm,1/18/2018,IMAGERY,2018-01-18T00:00:00.000Z,http://www.doc.wa.gov/corrections/incarceration/prisons/default.htm,MAXIMUM,900,0.0134309423154,9.288927655e-06,172829.921875,1712.78174242061,"53","009","000200","53009000200","2",Census Tract 2,G5020,S,928616670,32622948,"+48.1811984","-124.4120541",WA,-124.28698033567,48.2391976981578,,"1"
1683,1283,"10000100",BOLDUC CORRECTIONAL FACILITY,516 CUSHING RD,WARREN,ME,"04864",NOT AVAILABLE,(207) 273-5123,STATE,OPEN,192,KNOX,"23013",USA,"922140",CORRECTIONAL INSTITUTIONS,"http://www.maine.gov/corrections/PublicInterest/census/index.htm, http://www.maine.gov/corrections/adultfacilities/index.shtml",3/14/2011,IMAGERY/OTHER,2017-12-05T00:00:00.000Z,http://www.maine.gov/corrections/adultfacilities/index.shtml,MINIMUM,222,0.00636555410602,1.125229683e-06,19406.41015625,831.237765150121,"23","013","970400","23013970400","9704",Census Tract 9704,G5020,S,148690383,7289165,"+44.1224266","-069.2259930",ME,-69.2174466560971,44.0676096985085,"1","2"
1684,1284,"10005714",CHAVES COUNTY JUVENILE DETENTION CENTER,119 E FOURTH ST,ROSWELL,NM,"88201",NOT AVAILABLE,(575) 624-6519,COUNTY,OPEN,-999,CHAVES,"35005",USA,"922140",CORRECTIONAL INSTITUTIONS,http://www.nmjustice.net/nmsc/juvenile/program.php?id=288,2/15/2016,IMAGERY,2018-04-06T00:00:00.000Z,https://www.co.chaves.nm.us/148/Departments,JUVENILE,16,0.00166399975398,1.19511958e-07,1773.90234375,198.417699822901,"35","005","000201","35005000201","2.01",Census Tract 2.01,G5020,S,3155613,7960,"+33.3914504","-104.5324860",NM,-104.521519706608,33.3967317946701,,"1"
1685,1285,"10003768",COLFAX COUNTY VIGIL-MALDONADO DETENTION CENTER,444 HEREFORD STREET,RATON,NM,"87740",NOT AVAILABLE,(575) 445-3691,COUNTY,OPEN,-999,COLFAX,"35007",USA,"922140",CORRECTIONAL INSTITUTIONS,http://www.co.colfax.nm.us/government/departments.php,4/6/2018,IMAGERY,2018-04-06T00:00:00.000Z,http://www.co.colfax.nm.us/government/departments.php,NOT AVAILABLE,42,0.00181586801114,1.53065678e-07,2371.0078125,233.227217371112,"35","007","950500","35007950500","9505",Census Tract 9505,G5020,S,2173884793,3121317,"+36.7239177","-104.2786041",NM,-104.431614873111,36.8704856518435,,"1"
1686,1286,"10004731",SALINE COUNTY JAIL,1 NORTH MAIN STREET,HARRISBURG,IL,"62946",NOT AVAILABLE,(618) 252-8661,COUNTY,OPEN,-999,SALINE,"17165",USA,"922140",CORRECTIONAL INSTITUTIONS,http://www.ilsheriff.org/index.php/directory,3/2/2018,IMAGERY,2018-03-02T00:00:00.000Z,http://www.salinecosheriff.com/default.htm,NOT AVAILABLE,110,0.00231303357473,1.99374693e-07,3124.22265625,284.203271673184,"17","165","955900","17165955900","9559",Census Tract 9559,G5020,S,9389899,498190,"+37.7435632","-088.5287631",IL,-88.5408171385643,37.7387307874108,"1","1"
1687,1287,"10002224",TELLER COUNTY JAIL,288 WEAVERVILLE RD,DIVIDE,CO,"80814",NOT AVAILABLE,(719) 687-7770,COUNTY,OPEN,50,TELLER,"08119",USA,"922140",CORRECTIONAL INSTITUTIONS,https://www.tellercountysheriff.com/,2/15/2016,IMAGERY,2018-02-20T00:00:00.000Z,https://www.tellercountysheriff.com/,MEDIUM,126,0.00231377353779,2.56369053e-07,4084.66015625,303.041900166359,"08","119","010106","08119010106","101.06",Census Tract 101.06,G5020,S,334209917,2009675,"+38.8918585","-105.1690070",CO,-105.151308318449,38.9430297244627,,"1"
1688,1288,"10006667",204 DEPOT STREET PROGRAM,204 DEPOT STREET,BENNINGTON,VT,"05201",NOT AVAILABLE,(802) 442-6156,STATE,OPEN,8,BENNINGTON,"50003",USA,"922140",CORRECTIONAL INSTITUTIONS,http://dcf.vermont.gov/youth/PREA,6/9/2017,IMAGERY,2018-01-18T00:00:00.000Z,http://seallinc.org/,JUVENILE,8,0.000733539272294,3.0202249e-08,510.76953125,91.819760972112,"50","003","971200","50003971200","9712",Census Tract 9712,G5020,S,4342740,107259,"+42.8854297","-073.1952797",VT,-73.1988934111177,42.8823298396874,"4","1"
1689,1289,"10002491",CEDAR CREEK CORRECTIONS CENTER,12200 BORDEAUX RD,LITTLEROCK,WA,"98556","0037",(360) 359-4100,STATE,OPEN,475,THURSTON,"53067",USA,"922140",CORRECTIONAL INSTITUTIONS,http://www.doc.wa.gov/information/data/analytics.htm,1/18/2018,IMAGERY,2018-01-18T00:00:00.000Z,http://www.doc.wa.gov/corrections/incarceration/prisons/default.htm,MINIMUM,480,0.010810449981,4.34256435e-06,78733.8359375,1400.14475292049,"53","067","012730","53067012730","127.30",Census Tract 127.30,G5020,S,109693972,1074693,"+46.8584367","-123.0587556",WA,-123.143094451729,46.8836447725299,,"1"
1690,1290,"10005707",CURRY COUNTY ADULT DETENTION CENTER,801 MITCHELL ST,CLOVIS,NM,"88101",NOT AVAILABLE,NOT AVAILABLE,COUNTY,OPEN,209,CURRY,"35009",USA,"922140",CORRECTIONAL INSTITUTIONS,http://www.curryjail.com/,4/6/2018,IMAGERY,2018-04-06T00:00:00.000Z,http://www.curryjail.com/,NOT AVAILABLE,258,0.00266038712136,3.36912236e-07,5060.32421875,333.244850658294,"35","009","000100","35009000100","1",Census Tract 1,G5020,S,5839051,0,"+34.4067065","-103.2316390",NM,-103.206272714486,34.4063068732048,"2","2"
1691,1291,"10001162",DOWNEAST CORRECTIONAL FACILITY,64 BASE RD,MACHIASPORT,ME,"04655",NOT AVAILABLE,(207) 255-1100,STATE,OPEN,147,WASHINGTON,"23029",USA,"922140",CORRECTIONAL INSTITUTIONS,"http://www.maine.gov/corrections/PublicInterest/census/index.htm, http://www.maine.gov/corrections/adultfacilities/index.shtml",3/14/2011,IMAGERY,2017-12-05T00:00:00.000Z,http://www.maine.gov/corrections/adultfacilities/index.shtml,MINIMUM,148,0.00717231775964,2.470752377e-06,43021.7578125,952.179725274507,"23","029","956100","23029956100","9561",Census Tract 9561,G5020,S,145911160,89655662,"+44.6557620","-067.3789714",ME,-67.3973284747624,44.6283881673501,"2","1"
1692,1292,"10002479",MISSION CREEK CORRECTIONS CENTER FOR WOMEN,3420 NE SAND HILL RD,BELFAIR,WA,"98528",NOT AVAILABLE,(360) 277-2400,STATE,OPEN,317,MASON,"53045",USA,"922140",CORRECTIONAL INSTITUTIONS,http://www.doc.wa.gov/information/data/analytics.htm,1/18/2018,IMAGERY,2018-01-18T00:00:00.000Z,http://www.doc.wa.gov/corrections/incarceration/prisons/default.htm,MINIMUM,300,0.00827780521701,1.930400053e-06,35397.6875,1134.84809511692,"53","045","960400","53045960400","9604",Census Tract 9604,G5020,S,119909871,22269829,"+47.3935980","-122.8491775",WA,-122.864329204932,47.4840436096561,,"1"
1693,1293,"10001165",MAINE CORRECTIONAL CENTER,17 MALLISON FALLS RD,WINDHAM,ME,"04062",NOT AVAILABLE,(207) 893-7000,STATE,OPEN,500,CUMBERLAND,"23005",USA,"922140",CORRECTIONAL INSTITUTIONS,"http://www.maine.gov/corrections/PublicInterest/census/index.htm, http://www.maine.gov/corrections/adultfacilities/index.shtml",3/14/2011,IMAGERY/OTHER,2017-12-05T00:00:00.000Z,http://www.maine.gov/corrections/adultfacilities/index.shtml,MEDIUM,650,0.0137537024032,7.262802003e-06,124544.09375,1799.76126260734,"23","005","004803","23005004803","48.03",Census Tract 48.03,G5020,S,48160958,1005246,"+43.7607182","-070.4082386",ME,-70.4144273326469,43.7269361064671,"6","1"
1694,1294,"10001163",MAINE STATE PRISON,807 CUSHING RD,WARREN,ME,"04864",NOT AVAILABLE,(207) 273-5300,STATE,OPEN,836,KNOX,"23013",USA,"922140",CORRECTIONAL INSTITUTIONS,"http://www.maine.gov/corrections/PublicInterest/census/index.htm, http://www.maine.gov/corrections/adultfacilities/index.shtml",3/14/2011,IMAGERY,2017-12-05T00:00:00.000Z,http://www.maine.gov/corrections/adultfacilities/index.shtml,CLOSE,916,0.0166813878968,1.3583749385e-05,234265.26171875,2074.68441474087,"23","013","970400","23013970400","9704",Census Tract 9704,G5020,S,148690383,7289165,"+44.1224266","-069.2259930",ME,-69.2304077441098,44.0654412079427,"1","2"
1695,1295,"10005034",CENTRAL MAINE PRE-RELEASE CENTER,1 STEVENS STREET,HALLOWELL,ME,"04347",NOT AVAILABLE,NOT AVAILABLE,STATE,CLOSED,0,KENNEBEC,"23011",USA,"922140",CORRECTIONAL INSTITUTIONS,http://www.kjonline.com/news/Hallowells-Pre-Release-Center-closes-causing-relocation-of-prisoners-and-staff---.html,3/12/2014,IMAGERY/OTHER,2017-12-05T00:00:00.000Z,NOT AVAILABLE,MINIMUM,-999,0.00199098073746,2.32255092e-07,4020.90234375,274.805713612542,"23","011","010700","23011010700","107",Census Tract 107,G5020,S,15201100,569567,"+44.2872407","-069.8180401",ME,-69.7977503879357,44.2922465661368,"4","1"
1696,1296,"10006787",ALLEGAN COUNTY CORRECTIONS CENTER,640 RIVER ST,ALLEGAN,MI,"49010",NOT AVAILABLE,(269) 673-0500,COUNTY,OPEN,156,ALLEGAN,"26005",USA,"922140",CORRECTIONAL INSTITUTIONS,http://cms.allegancounty.org/sheriff/corrections/SitePages/Home.aspx#.WrE1IvnwbmE,3/20/2018,IMAGERY,2018-03-20T00:00:00.000Z,http://cms.allegancounty.org/sheriff/corrections/SitePages/Home.aspx#.WrE1IvnwbmE,NOT AVAILABLE,225,0.00599317892753,1.955704131e-06,32892.85546875,782.395233199078,"26","005","031200","26005031200","312",Census Tract 312,G5020,S,11233173,1554094,"+42.5300225","-085.8499779",MI,-85.8475605325108,42.5412881878685,"9","2"
1697,1297,"10001676",MONROE CORRECTIONAL COMPLEX,16550 177TH AVE SE,MONROE,WA,"98272",NOT AVAILABLE,(360) 794-2600,STATE,OPEN,2499,SNOHOMISH,"53061",USA,"922140",CORRECTIONAL INSTITUTIONS,http://www.doc.wa.gov/information/data/analytics.htm,1/18/2018,IMAGERY,2018-01-18T00:00:00.000Z,http://www.doc.wa.gov/corrections/incarceration/prisons/default.htm,MAXIMUM,2436,0.0383850402662,4.2092531787e-05,777200.9453125,5031.65102705015,"53","061","052209","53061052209","522.09",Census Tract 522.09,G5020,S,8504451,156304,"+47.8308462","-122.0133548",WA,-121.999668920684,47.8447825518415,,"1"
1698,1298,"10005708",CURRY COUNTY JUVENILE DETENTION CENTER,700 N MAIN ST,CLOVIS,NM,"88101",NOT AVAILABLE,NOT AVAILABLE,COUNTY,OPEN,10,CURRY,"35009",USA,"922140",CORRECTIONAL INSTITUTIONS,http://www.curryjail.com/,2/15/2016,IMAGERY,2018-04-06T00:00:00.000Z,http://www.curryjail.com/,JUVENILE,17,0.00155676512528,1.12518956e-07,1689.96875,192.842685333115,"35","009","000100","35009000100","1",Census Tract 1,G5020,S,5839051,0,"+34.4067065","-103.2316390",NM,-103.205949764322,34.4051046291069,"2","2"
1699,1299,"10006270",WASHINGTON COUNTY JUSTICE CENTER,26861 US HWY 34,AKRON,CO,"80720",NOT AVAILABLE,(970) 514-3145,COUNTY,OPEN,190,WASHINGTON,"08121",USA,"922140",CORRECTIONAL INSTITUTIONS,http://washcountyjustice.com/,8/4/2016,IMAGERY/OTHER,2018-02-20T00:00:00.000Z,http://washcountyjustice.com/,MAXIMUM,250,0.00443233937525,7.1654002e-07,11618.1953125,559.373255648443,"08","121","924200","08121924200","9242",Census Tract 9242,G5020,S,1891834779,8294230,"+40.1924453","-103.2647949",CO,-103.192152530774,40.1583329832237,,"1"
1700,1300,"10002455",OLYMPIC CORRECTIONS CENTER,11235 HOH MAINLINE,FORKS,WA,"98331",NOT AVAILABLE,(360) 374-7000,STATE,OPEN,392,JEFFERSON,"53031",USA,"922140",CORRECTIONAL INSTITUTIONS,http://www.doc.wa.gov/information/data/analytics.htm,1/18/2018,IMAGERY,2018-01-18T00:00:00.000Z,http://www.doc.wa.gov/corrections/incarceration/prisons/default.htm,MINIMUM,381,0.0147971885051,4.528753256e-06,83415.3515625,1994.32624662715,"53","031","950702","53031950702","9507.02",Census Tract 9507.02,G5020,S,3995269683,187408540,"+47.7421905","-123.8061487",WA,-124.135299467224,47.7177613827843,,"1"
1701,1301,"10005709",DEBACA COUNTY JAIL,248 E AVENUE C,FORT SUMNER,NM,"88119",NOT AVAILABLE,NOT AVAILABLE,COUNTY,NOT AVAILABLE,-999,DE BACA,"35011",USA,"922140",CORRECTIONAL INSTITUTIONS,NOT AVAILABLE,NOT AVAILABLE,UNVERIFIED,2018-04-06T00:00:00.000Z,NOT AVAILABLE,NOT AVAILABLE,-999,0.000828733108462,3.8760048e-08,582.625,99.0342109577729,"35","011","960100","35011960100","9601",Census Tract 9601,G5020,S,6016819475,29089486,"+34.3592729","-104.3686961",NM,-104.243501270622,34.4721937285773,,"1"
1702,1302,"10002722",COOKE COUNTY JAIL,300 COUNTY RD 451,GAINESVILLE,TX,"76240",NOT AVAILABLE,(940) 665-3471,COUNTY,OPEN,162,COOKE,"48097",USA,"922140",CORRECTIONAL INSTITUTIONS,"https://www.tcjs.state.tx.us/index.php?linkID=325, http://www.co.cooke.tx.us/default.aspx?Cooke_County/DetentionCtr",3/1/2018,IMAGERY,2018-04-26T00:00:00.000Z,http://www.co.cooke.tx.us/default.aspx?Cooke_County/DetentionCtr,NOT AVAILABLE,212,0.00352748685491,5.98569143e-07,8910.4921875,432.615722457234,"48","097","000400","48097000400","4",Census Tract 4,G5020,S,33012395,26645,"+33.6616023","-097.1763687",TX,-97.1684424783871,33.6493533934692,"1","1"
1703,1303,"10006590",FARGO RESIDENTIAL RE-ENTRY FACILITY FOR FEMALES,3501 WESTRAC DRIVE,FARGO,ND,"58103",NOT AVAILABLE,(701) 365-4199,STATE,OPEN,18,CASS,"38017",USA,"922140",CORRECTIONAL INSTITUTIONS,"http://www.nd.gov/docr/media/stats.html, http://centreinc.org/Fargo/",12/31/2016,IMAGERY/OTHER,2017-12-13T00:00:00.000Z,http://centreinc.org/Fargo/,MINIMUM,72,0.00222916539262,2.19588531e-07,3980.0234375,313.944860668347,"38","017","000600","38017000600","6",Census Tract 6,G5020,S,8943002,0,"+46.8778896","-096.8226165",ND,-96.8383727848402,46.8664692261169,,"3"
1704,1304,"10005035",RIVERVIEW PSYCHIATRIC CENTER,250 ARSENAL STREET,AUGUSTA,ME,"04330",NOT AVAILABLE,(207) 624-3900,STATE,OPEN,77,KENNEBEC,"23011",USA,"922140",CORRECTIONAL INSTITUTIONS,"http://www.maine.gov/dhhs/riverview/quarterly-report/index.html, http://www.maine.gov/dhhs/riverview/index.shtml",10/20/2017,IMAGERY/OTHER,2017-12-05T00:00:00.000Z,http://www.maine.gov/dhhs/riverview/index.shtml,NOT AVAILABLE,92,0.00646165040906,1.506911768e-06,26091.765625,850.422653591742,"23","011","010500","23011010500","105",Census Tract 105,G5020,S,33708601,1647062,"+44.2983512","-069.7073145",ME,-69.7709673085209,44.2999669071642,"2","1"
1705,1305,"10006591",MANDAN RESIDENTIAL RE-ENTRY FACILITY,100 6TH AVENUE SE,MANDAN,ND,"58554",NOT AVAILABLE,(701) 663-8120,STATE,OPEN,12,MORTON,"38059",USA,"922140",CORRECTIONAL INSTITUTIONS,"http://www.nd.gov/docr/media/stats.html, http://centreinc.org/Mandan/",12/31/2016,IMAGERY/OTHER,2017-12-13T00:00:00.000Z,http://centreinc.org/Mandan/,MINIMUM,76,0.00326762495652,6.63159421e-07,12010.58984375,424.510523845915,"38","059","020300","38059020300","203",Census Tract 203,G5020,S,82240051,2756244,"+46.7841887","-100.8831954",ND,-100.879816635248,46.8256780295163,,"2"
1706,1306,"10004702",SANGAMON COUNTY JUVENILE DETENTION CENTER,2201 SOUTH DIRKSEN PARKWAY,SPRINGFIELD,IL,"62703","4564",(217) 747-8000,COUNTY,OPEN,22,SANGAMON,"17167",USA,"922140",CORRECTIONAL INSTITUTIONS,http://co.sangamon.il.us/departments/m-r/probation-and-court-services,3/2/2018,IMAGERY,2018-03-02T00:00:00.000Z,http://co.sangamon.il.us/departments/m-r/probation-and-court-services,JUVENILE,48,0.00501070075224,6.76458406e-07,10907.5078125,620.791893599491,"17","167","002400","17167002400","24",Census Tract 24,G5020,S,4642390,0,"+39.7800012","-089.6180738",IL,-89.6090702234613,39.7783183618354,,"1"
1707,1307,"10002193",WELD COUNTY NORTH JAIL COMPLEX,2110 O STREET,GREELEY,CO,"80631",NOT AVAILABLE,(970) 356-4015,COUNTY,OPEN,-999,WELD,"08123",USA,"922140",CORRECTIONAL INSTITUTIONS,https://www.weldsheriff.com/,2/20/2018,IMAGERY,2018-02-20T00:00:00.000Z,https://www.weldsheriff.com/,NOT AVAILABLE,80,0.00955285758314,2.827629373e-06,46047.015625,1174.97435067973,"08","123","000600","08123000600","6",Census Tract 6,G5020,S,4736002,93911,"+40.4430580","-104.7043493",CO,-104.710378099701,40.4508426036188,,"2"
1708,1308,"10001681",STAFFORD CREEK CORRECTIONS CENTER,191 CONSTANTINE WAY,ABERDEEN,WA,"98520",NOT AVAILABLE,(360) 537-1800,STATE,OPEN,1979,GRAYS HARBOR,"53027",USA,"922140",CORRECTIONAL INSTITUTIONS,http://www.doc.wa.gov/information/data/analytics.htm,1/18/2018,IMAGERY/OTHER,2018-01-18T00:00:00.000Z,http://www.doc.wa.gov/corrections/incarceration/prisons/default.htm,MAXIMUM,1972,0.023393241197,2.5466868674e-05,462059.9140625,3019.94633652854,"53","027","001600","53027001600","16",Census Tract 16,G5020,S,294666915,80908428,"+46.8732512","-123.9699988",WA,-123.919239119647,46.921650040525,,"1"
1709,1309,"10004695",SCHUYLER COUNTY JAIL,216 WEST LAFAYETTE STREET,RUSHVILLE,IL,"62681",NOT AVAILABLE,(217) 322-4366,COUNTY,OPEN,-999,SCHUYLER,"17169",USA,"922140",CORRECTIONAL INSTITUTIONS,http://www.ilsheriff.org/index.php/directory,3/2/2018,IMAGERY,2018-03-02T00:00:00.000Z,NOT AVAILABLE,NOT AVAILABLE,34,0.0011318482283,8.0015083e-08,1296.66796875,144.887009566439,"17","169","970200","17169970200","9702",Census Tract 9702,G5020,S,17528433,37235,"+40.1362410","-090.5427545",IL,-90.5644225688492,40.1203909230933,,"1"
1710,1310,"10001897",GOSHEN COUNTY DETENTION CENTER,2120 E B ST,TORRINGTON,WY,"82240",NOT AVAILABLE,(307) 532-5917,COUNTY,OPEN,37,GOSHEN,"56015",USA,"922140",CORRECTIONAL INSTITUTIONS,http://www.goshensheriff.org/index.php/departments,5/10/2018,IMAGERY/OTHER,2018-05-10T00:00:00.000Z,http://www.goshensheriff.org/index.php,NOT AVAILABLE,90,0.00176056330571,1.34767788e-07,2249.58203125,229.374932336004,"56","015","957900","56015957900","9579",Census Tract 9579,G5020,S,88640591,875967,"+42.0401606","-104.0893488",WY,-104.182023982986,42.0653291726033,,"2"
1711,1311,"10002816",CORYELL COUNTY JAIL,510 LEON ST,GATESVILLE,TX,"76528",NOT AVAILABLE,(254) 865-7201 EXT 232,COUNTY,OPEN,76,CORYELL,"48099",USA,"922140",CORRECTIONAL INSTITUTIONS,https://www.tcjs.state.tx.us/index.php?linkID=325,3/1/2018,IMAGERY/OTHER,2018-04-26T00:00:00.000Z,http://coryellcountysheriff.com/,NOT AVAILABLE,92,0.00209504162254,2.40514716e-07,3493.09375,257.080516625609,"48","099","010300","48099010300","103",Census Tract 103,G5020,S,72505902,116989,"+31.4335228","-097.7707734",TX,-97.7508779054804,31.4335270571258,,"1"
1712,1312,"10002197",YUMA COUNTY JAIL / SHERIFF,"310 ASH STREET, SUITE G",WRAY,CO,"80758",NOT AVAILABLE,(970) 332-4805,COUNTY,OPEN,10,YUMA,"08125",USA,"922140",CORRECTIONAL INSTITUTIONS,http://www.yumacountysheriff.net/,2/20/2018,IMAGERY,2018-02-20T00:00:00.000Z,http://www.yumacountysheriff.net/,NOT AVAILABLE,-999,0.00175174097028,1.58124282e-07,2560.8671875,229.139605871149,"08","125","963100","08125963100","9631",Census Tract 9631,G5020,S,3445560646,9770022,"+40.0103234","-102.2561784",CO,-102.220370721075,40.0785326322544,,"1"
1713,1313,"10000264",ALGER CORRECTIONAL FACILITY,N6141 INDUSTRIAL PARK DR,MUNISING,MI,"49862",NOT AVAILABLE,(906) 387-5000,STATE,OPEN,886,ALGER,"26003",USA,"922140",CORRECTIONAL INSTITUTIONS,"http://www.michigan.gov/corrections/0,4551,7-119-1441---,00.html",12/31/2016,IMAGERY,2017-12-06T00:00:00.000Z,"http://www.michigan.gov/corrections/0,4551,7-119-68854_1381_1385---,00.html",MAXIMUM,1246,0.0148819328038,1.2337234448e-05,221606.01171875,2066.61872744296,"26","003","000300","26003000300","3",Census Tract 3,G5020,S,831237320,24193850,"+46.2637474","-086.8393449",MI,-86.6396173225428,46.3786156449416,"2","1"
1714,1314,"10001679",WASHINGTON CORRECTIONS CENTER,2321 WEST DAYTON AIRPORT RD,SHELTON,WA,"98584",NOT AVAILABLE,(360) 426-4433,STATE,OPEN,1924,MASON,"53045",USA,"922140",CORRECTIONAL INSTITUTIONS,http://www.doc.wa.gov/information/data/analytics.htm,1/18/2018,IMAGERY,2018-01-18T00:00:00.000Z,http://www.doc.wa.gov/corrections/incarceration/prisons/default.htm,MAXIMUM,1398,0.0305689936253,4.6340086711e-05,845782.546875,3997.51317508181,"53","045","960600","53045960600","9606",Census Tract 9606,G5020,S,50205028,702399,"+47.2399899","-123.1519080",WA,-123.192684772149,47.2381712295331,,"1"
1715,1315,"10006592",GRAND FORKS RESIDENTIAL TRANSITION PROGRAM,201 S 4TH STREET,GRAND FORKS,ND,"58201",NOT AVAILABLE,(701) 775-2681,STATE,OPEN,18,GRAND FORKS,"38035",USA,"922140",CORRECTIONAL INSTITUTIONS,"http://www.nd.gov/docr/media/stats.html, http://centreinc.org/GrandForks/",12/31/2016,IMAGERY/OTHER,2017-12-13T00:00:00.000Z,http://centreinc.org/GrandForks/,MINIMUM,16,0.001577808476,1.44490064e-07,2671.90625,211.318248100324,"38","035","010600","38035010600","106",Census Tract 106,G5020,S,1212062,52498,"+47.9189705","-097.0278242",ND,-97.0279463469979,47.9228815781432,,"2"
1716,1316,"10001364",BELLAMY CREEK CORRECTIONAL FACILITY,1727 W BLUEWATER HWY,IONIA,MI,"48846",NOT AVAILABLE,(616) 527-2510,STATE,OPEN,1753,IONIA,"26067",USA,"922140",CORRECTIONAL INSTITUTIONS,"http://www.michigan.gov/corrections/0,4551,7-119-1441---,00.html",12/31/2016,IMAGERY,2017-12-06T00:00:00.000Z,"http://www.michigan.gov/corrections/0,4551,7-119-68854_1381_1385---,00.html",CLOSE,1888,0.0267172137391,2.3998822841e-05,406487.69921875,3392.571427529,"26","067","982200","26067982200","9822",Census Tract 9822,G5020,S,1987066,0,"+42.9792254","-085.1044377",MI,-85.1043768935139,42.9778708247028,,"3"
1717,1317,"10001346",BARAGA CORRECTIONAL FACILITY,13924 WADAGA RD,BARAGA,MI,"49908","9204",(906) 353-7070,STATE,OPEN,787,BARAGA,"26013",USA,"922140",CORRECTIONAL INSTITUTIONS,"http://www.michigan.gov/corrections/0,4551,7-119-1441---,00.html",12/31/2016,IMAGERY,2017-12-06T00:00:00.000Z,"http://www.michigan.gov/corrections/0,4551,7-119-68854_1381_1385---,00.html",MAXIMUM,868,0.0218584806619,1.4227189493e-05,257368.9375,2829.4214972822,"26","013","000200","26013000200","2",Census Tract 2,G5020,S,1243652674,64225265,"+46.6032533","-088.4835894",MI,-88.5112163798181,46.7625486668433,"8","1"
1718,1318,"10004139",COMMUNITY CORRECTIONS CENTER - LINCOLN,2720 W VAN DORN ST,LINCOLN,NE,"68522",NOT AVAILABLE,(402) 471-0740,STATE,OPEN,381,LANCASTER,"31109",USA,"922140",CORRECTIONAL INSTITUTIONS,https://corrections.nebraska.gov/public-information/statistics-reports/ndcs-reports,9/30/2017,IMAGERY,2017-12-13T00:00:00.000Z,https://corrections.nebraska.gov/facilities,MINIMUM,300,0.00558026574149,1.248668401e-06,20436.40234375,669.515861613307,"31","109","003401","31109003401","34.01",Census Tract 34.01,G5020,S,9772375,31408,"+40.7952920","-096.7715464",NE,-96.7603877820296,40.7859141410594,,"3"
1719,1319,"10004707",SHELBY COUNTY JAIL,151 NORTH MORGAN STREET,SHELBYVILLE,IL,"62565",NOT AVAILABLE,(217) 774-3941,COUNTY,OPEN,-999,SHELBY,"17173",USA,"922140",CORRECTIONAL INSTITUTIONS,http://www.ilsheriff.org/index.php/directory,3/2/2018,IMAGERY,2018-03-02T00:00:00.000Z,http://www.scso87.org/,NOT AVAILABLE,27,0.00166359441511,1.28531356e-07,2061.42578125,207.168356222957,"17","173","959300","17173959300","9593",Census Tract 9593,G5020,S,17668906,68907,"+39.4062937","-088.8027798",IL,-88.7916934307495,39.4074027470884,,"1"
1720,1320,"10001362",CENTRAL MICHIGAN CORRECTIONAL FACILITY,320 N HUBBARD,ST LOUIS,MI,"48880",NOT AVAILABLE,(989) 681-6668,STATE,OPEN,2542,GRATIOT,"26057",USA,"922140",CORRECTIONAL INSTITUTIONS,"http://www.michigan.gov/corrections/0,4551,7-119-1441---,00.html",12/31/2016,IMAGERY,2017-12-06T00:00:00.000Z,"http://www.michigan.gov/corrections/0,4551,7-119-68854_1381_1385---,00.html",MINIMUM,2566,0.0214810985258,2.0577868711e-05,351042.24609375,2643.07875057989,"26","057","000400","26057000400","4",Census Tract 4,G5020,S,566259,0,"+43.4150020","-084.5924849",MI,-84.5926954708796,43.4134939086837,,"2"
1721,1321,"10003796",DOA ANA COUNTY DETENTION CENTER,1850 COPPER LOOP,LAS CRUCES,NM,"88005",NOT AVAILABLE,NOT AVAILABLE,COUNTY,OPEN,758,DONA ANA,"35013",USA,"922140",CORRECTIONAL INSTITUTIONS,https://www.donaanacounty.org/detention,4/6/2018,IMAGERY,2018-04-06T00:00:00.000Z,https://www.donaanacounty.org/detention,MAXIMUM,896,0.0110595251365,4.40710662e-06,64612.3046875,1319.1595275303,"35","013","000201","35013000201","2.01",Census Tract 2.01,G5020,S,8448224,51532,"+32.2970398","-106.7970623",NM,-106.805497103536,32.3023221765626,,"1"
1722,1322,"10002156",BAKER COUNTY DETENTION CENTER,1 SHERIFF'S OFFICE DRIVE,MACCLENNY,FL,"32063",NOT AVAILABLE,(904) 259-3311,COUNTY,OPEN,469,BAKER,"12003",USA,"922140",CORRECTIONAL INSTITUTIONS,"http://www.dc.state.fl.us/pub/jails/, http://www.bakerso.com/",2/20/2018,IMAGERY,2018-02-20T00:00:00.000Z,http://www.bakerso.com/,NOT AVAILABLE,508,0.0079451092567,1.421621656e-06,20403.306640625,945.088147583769,"12","003","040101","12003040101","401.01",Census Tract 401.01,G5020,S,75834324,0,"+30.3211359","-082.0993295",FL,-82.1216275323696,30.2963490350533,,"1"
1723,1323,"10004415",CROCKETT COUNTY JAIL,903 AVENUE D,OZONA,TX,"76943",NOT AVAILABLE,NOT AVAILABLE,COUNTY,OPEN,-999,CROCKETT,"48105",USA,"922140",CORRECTIONAL INSTITUTIONS,"https://www.tcjs.state.tx.us/index.php?linkID=325, http://www.ozona.com/directoryListings/index/county-officials",3/1/2018,IMAGERY,2018-04-26T00:00:00.000Z,NOT AVAILABLE,NOT AVAILABLE,13,0.00184886760218,1.83262237e-07,2641.453125,221.900969087161,"48","105","950100","48105950100","9501",Census Tract 9501,G5020,S,7270935061,53329,"+30.7175316","-101.4042113",TX,-101.200082061857,30.7115299491019,,"1"
1724,1324,"10004377",CROSBY COUNTY JAIL,201 WEST ASPEN STREET,CROSBYTON,TX,"79322",NOT AVAILABLE,NOT AVAILABLE,COUNTY,OPEN,6,CROSBY,"48107",USA,"922140",CORRECTIONAL INSTITUTIONS,"https://www.tcjs.state.tx.us/index.php?linkID=325, https://texasjailproject.org/list_of_county_jails/",3/1/2018,IMAGERY,2018-04-26T00:00:00.000Z,NOT AVAILABLE,NOT AVAILABLE,11,0.00140561997523,1.15493886e-07,1719.46484375,176.192044314524,"48","107","950100","48107950100","9501",Census Tract 9501,G5020,S,1056088719,3813785,"+33.6331748","-101.1785157",TX,-101.240336754097,33.6584796241206,,"1"
1725,1325,"10004126",COMMUNITY CORRECTIONS CENTER - OMAHA,2320 AVENUE J,OMAHA,NE,"68110",NOT AVAILABLE,(402) 595-2010,STATE,OPEN,163,DOUGLAS,"31055",USA,"922140",CORRECTIONAL INSTITUTIONS,https://corrections.nebraska.gov/public-information/statistics-reports/ndcs-reports,9/30/2017,IMAGERY,2017-12-13T00:00:00.000Z,https://corrections.nebraska.gov/facilities,MINIMUM,135,0.00343365753968,3.29148915e-07,5427.90625,430.864656753736,"31","055","000500","31055000500","5",Census Tract 5,G5020,S,17635488,2547792,"+41.3024254","-095.8927626",NE,-95.9004566982512,41.2835531146302,"3","3"
1726,1326,"10002506",WASHINGTON STATE PENITENTIARY,1313 N 13TH AVE,WALLA WALLA,WA,"99362",NOT AVAILABLE,(509) 525-3610,STATE,OPEN,2593,WALLA WALLA,"53071",USA,"922140",CORRECTIONAL INSTITUTIONS,http://www.doc.wa.gov/information/data/analytics.htm,1/18/2018,IMAGERY,2018-01-18T00:00:00.000Z,http://www.doc.wa.gov/corrections/incarceration/prisons/default.htm,MAXIMUM,2439,0.0323885601061,4.7675827938e-05,851720.5703125,4131.19755815238,"53","071","920400","53071920400","9204",Census Tract 9204,G5020,S,2273790,0,"+46.0795897","-118.3682705",WA,-118.364223510062,46.0798678849253,,"1"
1727,1327,"10004137",DIAGNOSTIC AND EVALUATION CENTER,3220 W VAN DORN ST,LINCOLN,NE,"68522","9284",(402) 471-3330,STATE,OPEN,489,LANCASTER,"31109",USA,"922140",CORRECTIONAL INSTITUTIONS,https://corrections.nebraska.gov/public-information/statistics-reports/ndcs-reports,9/30/2017,IMAGERY,2017-12-13T00:00:00.000Z,https://corrections.nebraska.gov/facilities,MAXIMUM,275,0.00694697098542,2.607115065e-06,42669.60546875,852.449088831476,"31","109","003401","31109003401","34.01",Census Tract 34.01,G5020,S,9772375,31408,"+40.7952920","-096.7715464",NE,-96.7668594934096,40.7860996094466,,"3"
1728,1328,"10003846",CHARLES EGELER RECEPTION & GUIDANCE CENTER,3855 COOPER ST,JACKSON,MI,"49201","7547",(517) 780-5600,STATE,OPEN,950,JACKSON,"26075",USA,"922140",CORRECTIONAL INSTITUTIONS,"http://www.michigan.gov/corrections/0,4551,7-119-1441---,00.html",12/31/2016,IMAGERY,2017-12-06T00:00:00.000Z,"http://www.michigan.gov/corrections/0,4551,7-119-68854_1381_1385---,00.html",MEDIUM,1485,0.0187636717521,1.353918931e-05,226839.4375,2370.49679971435,"26","075","005800","26075005800","58",Census Tract 58,G5020,S,2383646,2914,"+42.2958029","-084.3894236",MI,-84.3892004062952,42.2997952507055,,"5"
1729,1329,"10002440",BELLINGHAM WORK RELEASE,1127 N GARDEN ST,BELLINGHAM,WA,"98225",NOT AVAILABLE,(360) 676-2150,STATE,OPEN,25,WHATCOM,"53073",USA,"922140",CORRECTIONAL INSTITUTIONS,http://www.doc.wa.gov/corrections/prea/resources.htm,4/21/2016,IMAGERY,2018-01-18T00:00:00.000Z,http://www.doc.wa.gov/corrections/incarceration/work-release/locations.htm,MINIMUM,25,0.000827311903032,3.7110706e-08,697.421875,107.985347882451,"53","073","001000","53073001000","10",Census Tract 10,G5020,S,2481598,0,"+48.7369217","-122.4797992",WA,-122.477257095239,48.7459024254544,,"1"
1730,1330,"10002460",BROWNSTONE WORK RELEASE,223 S BROWNE  ST,SPOKANE,WA,"99201",NOT AVAILABLE,(509) 381-6220,STATE,OPEN,61,SPOKANE,"53063",USA,"922140",CORRECTIONAL INSTITUTIONS,http://www.doc.wa.gov/corrections/prea/resources.htm,5/19/2015,IMAGERY,2018-01-18T00:00:00.000Z,http://www.doc.wa.gov/corrections/incarceration/work-release/locations.htm,MINIMUM,80,0.00119422260855,8.1088391e-08,1491.7421875,174.061005802153,"53","063","003500","53063003500","35",Census Tract 35,G5020,S,1628094,107706,"+47.6575712","-117.4215755",WA,-117.413146914004,47.65381922639,"4","1"
1731,1331,"10003947",BAY COUNTY JAIL,5700 STAR LANE,PANAMA CITY,FL,"32404",NOT AVAILABLE,(850) 785-5245,COUNTY,OPEN,900,BAY,"12005",USA,"922140",CORRECTIONAL INSTITUTIONS,http://www.bayso.org/index.html,2/20/2018,IMAGERY,2018-02-20T00:00:00.000Z,http://www.bayso.org/index.html,MAXIMUM,1200,0.0105842563036,3.66169905e-06,52515.849609375,1301.31988733504,"12","005","000500","12005000500","5",Census Tract 5,G5020,S,338037965,28527612,"+30.1593438","-085.4816570",FL,-85.5619705118186,30.2265509976221,,"1"
1732,1332,"10002495",AHTANUM VIEW CORRECTIONS CENTER,2009 S 64TH AVE,YAKIMA,WA,"98903",NOT AVAILABLE,NOT AVAILABLE,STATE,CLOSED,0,YAKIMA,"53077",USA,"922140",CORRECTIONAL INSTITUTIONS,http://www.nbcrightnow.com/story/12053876/ahtanum-view-prison-shuts-down-employees-say-goodbye,2/26/2010,IMAGERY,2018-01-18T00:00:00.000Z,NOT AVAILABLE,MINIMUM,120,0.00213124124197,2.27874132e-07,4107.4140625,293.660095249518,"53","077","002802","53077002802","28.02",Census Tract 28.02,G5020,S,29882944,0,"+46.5714185","-120.6263655",WA,-120.593121465429,46.5678155174885,,"2"
1733,1333,"10002166",BREVARD COUNTY JAIL COMPLEX,860 CAMP RD,COCOA,FL,"32927",NOT AVAILABLE,(321) 690-1500,COUNTY,OPEN,1679,BREVARD,"12009",USA,"922140",CORRECTIONAL INSTITUTIONS,"http://www.dc.state.fl.us/pub/jails/, http://www.brevardsheriff.com/home/commands-services/",2/20/2018,IMAGERY,2018-02-20T00:00:00.000Z,http://www.brevardsheriff.com/home/commands-services/,MAXIMUM,1701,0.0131794853188,5.884823865e-06,82940.263671875,1571.79867869327,"12","009","062109","12009062109","621.09",Census Tract 621.09,G5020,S,11169442,0,"+28.4536614","-080.7850991",FL,-80.7818139457685,28.4484529311797,"1","5"
1734,1334,"10006788",ALLEGAN COUNTY JUVENILE DETENTION CENTER,2243 33RD ST,ALLEGAN,MI,"49010",NOT AVAILABLE,(269) 686-4630,COUNTY,OPEN,-999,ALLEGAN,"26005",USA,"922140",CORRECTIONAL INSTITUTIONS,http://cms.allegancounty.org/sites/Office/CC/Family/Detention/SitePages/Home.aspx#.WrE2ZfnwbmE,3/20/2018,IMAGERY,2018-03-20T00:00:00.000Z,http://cms.allegancounty.org/sites/Office/CC/Family/Detention/SitePages/Home.aspx#.WrE2ZfnwbmE,JUVENILE,22,0.00436411603196,6.7679221e-07,11390.34765625,571.375923792993,"26","005","031100","26005031100","311",Census Tract 311,G5020,S,167214539,6310756,"+42.5030860","-085.8252949",MI,-85.8683427975824,42.5819492604384,"4","1"
1735,1335,"10005154",ANTRIM COUNTY JAIL,107 GROVE STREET,BELLAIRE,MI,"49615",NOT AVAILABLE,(231) 533-8627,COUNTY,OPEN,-999,ANTRIM,"26009",USA,"922140",CORRECTIONAL INSTITUTIONS,http://www.michigan.gov/documents/corrections/JPIS_-_CY_2010_344047_7.pdf,3/20/2018,IMAGERY/OTHER,2018-03-20T00:00:00.000Z,http://www.antrimcounty.org/sheriff.asp,NOT AVAILABLE,56,0.00174283335759,1.69112472e-07,2962.44921875,232.153310261534,"26","009","960400","26009960400","9604",Census Tract 9604,G5020,S,118203576,13728155,"+44.9599099","-085.1876894",MI,-85.2076193832573,44.9757985549315,"1","1"
1736,1336,"10005169",ARENAC COUNTY JAIL,126 GROVE STREET,STANDISH,MI,"48658",NOT AVAILABLE,(989) 846-3002,COUNTY,OPEN,-999,ARENAC,"26011",USA,"922140",CORRECTIONAL INSTITUTIONS,http://www.arenaccountygov.com/sheriff/,3/20/2018,IMAGERY/OTHER,2018-03-20T00:00:00.000Z,http://www.arenaccountygov.com/sheriff/,NOT AVAILABLE,46,0.00237518564398,1.77366286e-07,3054.62109375,303.289668534277,"26","011","970500","26011970500","9705",Census Tract 9705,G5020,S,126793398,5715608,"+43.9555590","-083.9533585",MI,-83.9565181856004,43.9836550921047,"10","2"
1737,1337,"10004138",LINCOLN CORRECTIONAL CENTER,3216 W VAN DORN ST,LINCOLN,NE,"68522",NOT AVAILABLE,(402) 471-2861,STATE,OPEN,510,LANCASTER,"31109",USA,"922140",CORRECTIONAL INSTITUTIONS,https://corrections.nebraska.gov/public-information/statistics-reports/ndcs-reports,9/30/2017,IMAGERY,2017-12-13T00:00:00.000Z,https://corrections.nebraska.gov/facilities,MAXIMUM,468,0.0117918727673,8.383379529e-06,137211.3125,1487.54168035391,"31","109","003401","31109003401","34.01",Census Tract 34.01,G5020,S,9772375,31408,"+40.7952920","-096.7715464",NE,-96.7659643220346,40.7879871498447,,"3"
1738,1338,"10002084",CHIPPEWA CORRECTIONAL FACILITY,4269 W. M-80,KINCHELOE,MI,"49784",NOT AVAILABLE,(906) 495-2275,STATE,OPEN,2322,CHIPPEWA,"26033",USA,"922140",CORRECTIONAL INSTITUTIONS,"http://www.michigan.gov/corrections/0,4551,7-119-1441---,00.html",12/31/2016,IMAGERY,2017-12-06T00:00:00.000Z,"http://www.michigan.gov/corrections/0,4551,7-119-68854_1381_1385---,00.html",MAXIMUM,2366,0.0247249007876,1.9937478014e-05,357331.1015625,3029.08723429809,"26","033","980200","26033980200","9802",Census Tract 9802,G5020,S,349853,0,"+46.2576809","-084.4548573",MI,-84.4554376644334,46.2573961932114,,"1"
1739,1339,"10002189",BROWARD COUNTY MAIN JAIL,555 SE 1ST AVE,FT. LAUDERDALE,FL,"33301",NOT AVAILABLE,(954) 831-5900,COUNTY,OPEN,1414,BROWARD,"12011",USA,"922140",CORRECTIONAL INSTITUTIONS,http://www.sheriff.org/DOD/Pages/Jail-Facilities.aspx,2/20/2018,IMAGERY,2018-02-20T00:00:00.000Z,http://www.sheriff.org/DOD/Pages/Jail-Facilities.aspx,MAXIMUM,1538,0.00349591292651,5.49788446e-07,7587.662109375,409.39595878982,"12","011","042500","12011042500","425",Census Tract 425,G5020,S,2004339,0,"+26.1222046","-080.1412557",FL,-80.1422807485202,26.1160821631257,,"1"
1740,1340,"10001738",NEBRASKA CORRECTIONAL CENTER FOR WOMEN,1107 RECHARGE RD,YORK,NE,"68467","8003",(402) 362-3317,STATE,OPEN,340,YORK,"31185",USA,"922140",CORRECTIONAL INSTITUTIONS,https://corrections.nebraska.gov/public-information/statistics-reports/ndcs-reports,9/30/2017,IMAGERY,2017-12-13T00:00:00.000Z,https://corrections.nebraska.gov/facilities,MAXIMUM,318,0.0123831900195,7.904144516e-06,129516.203125,1526.37805498478,"31","185","969800","31185969800","9698",Census Tract 9698,G5020,S,47847226,385430,"+40.8468799","-097.5868809",NE,-97.6286685682688,40.8640905655256,,"2"
1741,1341,"10002459",ELEANOR CHASE HOUSE WORK RELEASE,427 W 7TH AVE,SPOKANE,WA,"99204",NOT AVAILABLE,(509) 381-6300,STATE,OPEN,26,SPOKANE,"53063",USA,"922140",CORRECTIONAL INSTITUTIONS,http://www.doc.wa.gov/corrections/prea/resources.htm,5/20/2015,IMAGERY,2018-01-18T00:00:00.000Z,http://www.doc.wa.gov/corrections/incarceration/work-release/locations.htm,MINIMUM,40,0.00185226807481,1.36299609e-07,2507.2265625,242.175506400366,"53","063","003200","53063003200","32",Census Tract 32,G5020,S,1241810,0,"+47.6492994","-117.4146338",WA,-117.418994230166,47.649125389758,,"1"
1742,1342,"10002470",HELEN B RATCLIFF WORK RELEASE,1531 13TH AVE S,SEATTLE,WA,"98144",NOT AVAILABLE,(206) 320-6600,STATE,OPEN,40,KING,"53033",USA,"922140",CORRECTIONAL INSTITUTIONS,http://www.doc.wa.gov/corrections/prea/resources.htm,3/28/2017,IMAGERY,2018-01-18T00:00:00.000Z,http://www.doc.wa.gov/corrections/incarceration/work-release/locations.htm,MINIMUM,47,0.0012463600001,7.7773252e-08,1429,170.734263852239,"53","033","009400","53033009400","94",Census Tract 94,G5020,S,1723075,0,"+47.5881924","-122.3098671",WA,-122.316312313797,47.5889742767778,,"1"
1743,1343,"10004127",NEBRASKA CORRECTIONAL YOUTH FACILITY,2610 N 20TH ST E,OMAHA,NE,"68110",NOT AVAILABLE,(402) 595-2000,STATE,OPEN,50,DOUGLAS,"31055",USA,"922140",CORRECTIONAL INSTITUTIONS,https://corrections.nebraska.gov/public-information/statistics-reports/ndcs-reports,9/30/2017,IMAGERY,2017-12-13T00:00:00.000Z,https://corrections.nebraska.gov/facilities,JUVENILE,70,0.00751685624022,2.451902283e-06,40433.0546875,919.336058454743,"31","055","000500","31055000500","5",Census Tract 5,G5020,S,17635488,2547792,"+41.3024254","-095.8927626",NE,-95.9060597514343,41.282519154705,"3","3"
1744,1344,"10000538",NORTH BROWARD BUREAU,1550 NW 30TH AVE,POMPANO BEACH,FL,"33069",NOT AVAILABLE,(954) 831-5900,COUNTY,OPEN,954,BROWARD,"12011",USA,"922140",CORRECTIONAL INSTITUTIONS,http://www.sheriff.org/DOD/Pages/Jail-Facilities.aspx,2/20/2018,IMAGERY,2018-02-20T00:00:00.000Z,http://www.sheriff.org/DOD/Pages/Jail-Facilities.aspx,MEDIUM,1200,0.00718323519484,2.102090494e-06,29043.955078125,847.39691224959,"12","011","030600","12011030600","306",Census Tract 306,G5020,S,7647622,410888,"+26.2542849","-080.1574777",FL,-80.1627192996775,26.2480460864745,"1","3"
1745,1345,"10006739",STARK COUNTY JAIL,130 W. JEFFERSON,TOULON,IL,"61483",NOT AVAILABLE,(309) 286-2541,COUNTY,OPEN,-999,STARK,"17175",USA,"922140",CORRECTIONAL INSTITUTIONS,http://www.ilsheriff.org/index.php/directory,3/2/2018,IMAGERY,2018-03-02T00:00:00.000Z,NOT AVAILABLE,NOT AVAILABLE,13,0.00094677530984,4.2281063e-08,695.21875,120.083129437497,"17","175","951400","17175951400","9514",Census Tract 9514,G5020,S,337466017,659612,"+41.1616917","-089.7977965",IL,-89.8660489989688,41.0931269331618,,"1"
1746,1346,"10005144",BARAGA COUNTY JAIL,940 US HIGHWAY 41,L'ANSE,MI,"49946",NOT AVAILABLE,(906) 524-6100 EXT 695,COUNTY,OPEN,21,BARAGA,"26013",USA,"922140",CORRECTIONAL INSTITUTIONS,http://www.michigan.gov/documents/corrections/JPIS_-_CY_2010_344047_7.pdf,3/4/2016,IMAGERY/OTHER,2018-03-20T00:00:00.000Z,https://www.baragacounty.org/government/departments/county-sheriff/,NOT AVAILABLE,26,0.0015244247657,1.12371784e-07,2032.29296875,200.392243003152,"26","013","000100","26013000100","1",Census Tract 1,G5020,S,1083261692,85290785,"+46.7423282","-088.2372940",MI,-88.4407742664857,46.7488632203049,"6","1"
1747,1347,"10005717",EDDY COUNTY DETENTION CENTER,201 N MAIN,CARLSBAD,NM,"88220",NOT AVAILABLE,(575) 887-7556,COUNTY,OPEN,-999,EDDY,"35015",USA,"922140",CORRECTIONAL INSTITUTIONS,"http://www.co.eddy.nm.us/148/Departments, https://www.nmlegis.gov/handouts/CCJ%20052716%20Item%203%20NM%20County%20Jails%20An%20Overview.pdf",5/27/2016,IMAGERY,2018-04-06T00:00:00.000Z,http://www.co.eddy.nm.us/148/Departments,NOT AVAILABLE,301,0.00507657942681,6.4039803e-07,9401.30078125,623.000508026026,"35","015","000100","35015000100","1",Census Tract 1,G5020,S,2245582,182831,"+32.4244435","-104.2260142",NM,-104.226996136429,32.4220344571688,,"1"
1748,1348,"10002752",WEST TOWER DETENTION FACILITY,111 W COMMERCE ST,DALLAS,TX,"75202",NOT AVAILABLE,NOT AVAILABLE,COUNTY,OPEN,-999,DALLAS,"48113",USA,"922140",CORRECTIONAL INSTITUTIONS,http://www.dallascounty.org/department/sheriff/sheriff_index.php,4/26/2018,IMAGERY/OTHER,2018-04-26T00:00:00.000Z,http://www.dallascounty.org/department/sheriff/sheriff_index.php,MAXIMUM,1530,0.00436928124431,7.75232367e-07,11425.95703125,518.616095045043,"48","113","010000","48113010000","100",Census Tract 100,G5020,S,31397013,463801,"+32.8114428","-096.8620144",TX,-96.815674279612,32.7775557170481,"2","6"
1749,1349,"10002088",CARSON CITY CORRECTIONAL FACILITY,10274 BOYER RD,CARSON CITY,MI,"48811","9746",(989) 584-3941,STATE,OPEN,2240,MONTCALM,"26117",USA,"922140",CORRECTIONAL INSTITUTIONS,"http://www.michigan.gov/corrections/0,4551,7-119-1441---,00.html",12/31/2016,IMAGERY,2017-12-06T00:00:00.000Z,"http://www.michigan.gov/corrections/0,4551,7-119-68854_1381_1385---,00.html",CLOSE,2248,0.025191156366,2.5111931238e-05,426612.0859375,3052.65524370166,"26","117","971000","26117971000","9710",Census Tract 9710,G5020,S,209477396,823642,"+43.1703843","-084.9428764",MI,-84.8706099130872,43.1605526562761,"4","1"
1750,1350,"10000278",COOPER STREET CORRECTIONAL FACILITY,3100 COOPER ST,JACKSON,MI,"49201",NOT AVAILABLE,(517) 780-6175,STATE,OPEN,1739,JACKSON,"26075",USA,"922140",CORRECTIONAL INSTITUTIONS,"http://www.michigan.gov/corrections/0,4551,7-119-1441---,00.html",12/31/2016,IMAGERY,2017-12-06T00:00:00.000Z,"http://www.michigan.gov/corrections/0,4551,7-119-68854_1381_1385---,00.html",MINIMUM,1754,0.0135558548575,1.0505416547e-05,175999.87890625,1695.881393297,"26","075","005800","26075005800","58",Census Tract 58,G5020,S,2383646,2914,"+42.2958029","-084.3894236",MI,-84.396993758367,42.2959408210009,,"5"
1751,1351,"10001739",NEBRASKA STATE PENITENTIARY,4201 S 14TH ST,LINCOLN,NE,"68502",NOT AVAILABLE,(402) 471-3161,STATE,OPEN,1341,LANCASTER,"31109",USA,"922140",CORRECTIONAL INSTITUTIONS,https://corrections.nebraska.gov/public-information/statistics-reports/ndcs-reports,9/30/2017,IMAGERY,2017-12-13T00:00:00.000Z,https://corrections.nebraska.gov/facilities,MAXIMUM,1139,0.0145576768227,1.2561522453e-05,205539.1796875,1857.1409799963,"31","109","003601","31109003601","36.01",Census Tract 36.01,G5020,S,194262,0,"+40.7700166","-096.7038431",NE,-96.7041152167605,40.7696855622503,,"1"
1752,1352,"10002493",OLYMPIA WORK RELEASE,1800 11TH AVE SW,OLYMPIA,WA,"98502",NOT AVAILABLE,(360) 586-2731,STATE,OPEN,25,THURSTON,"53067",USA,"922140",CORRECTIONAL INSTITUTIONS,http://www.doc.wa.gov/corrections/prea/resources.htm,4/19/2016,IMAGERY,2018-01-18T00:00:00.000Z,http://www.doc.wa.gov/corrections/incarceration/work-release/locations.htm,MINIMUM,25,0.00131543659604,9.6569518e-08,1755.921875,169.454942947322,"53","067","010520","53067010520","105.20",Census Tract 105.20,G5020,S,3715505,586278,"+47.0375908","-122.9174763",WA,-122.925364673,47.0377828592886,,"2"
1753,1353,"10001375",DETROIT DETENTION CENTER,17601 MOUND RD,DETROIT,MI,"48212",NOT AVAILABLE,(313) 368-8300,STATE,OPEN,-999,WAYNE,"26163",USA,"922140",CORRECTIONAL INSTITUTIONS,"http://www.michigan.gov/corrections/0,4551,7-119-68854_1381_1385---,00.html",12/6/2017,IMAGERY,2017-12-06T00:00:00.000Z,"http://www.michigan.gov/corrections/0,4551,7-119-68854_1381_1385---,00.html",NOT AVAILABLE,-999,0.017193526939,8.524620526e-06,143105.8984375,2028.90094676387,"26","163","506400","26163506400","5064",Census Tract 5064,G5020,S,1824589,0,"+42.4225996","-083.0523153",MI,-83.0476790559486,42.4237281969817,"1","2"
1754,1354,"10001376",DETROIT RE-ENTRY CENTER,17600 RYAN RD,DETROIT,MI,"48212",NOT AVAILABLE,(313) 368-3200,STATE,OPEN,-999,WAYNE,"26163",USA,"922140",CORRECTIONAL INSTITUTIONS,"http://www.michigan.gov/corrections/0,4551,7-119-68854_1381_1385---,00.html",3/1/2014,IMAGERY,2017-12-06T00:00:00.000Z,"http://www.michigan.gov/corrections/0,4551,7-119-68854_1381_1385---,00.html",MEDIUM,1044,0.0170505941001,8.938328196e-06,150050.39453125,2017.56877527171,"26","163","506400","26163506400","5064",Census Tract 5064,G5020,S,1824589,0,"+42.4225996","-083.0523153",MI,-83.0578476989054,42.4234892360742,"1","2"
1755,1355,"10004125",OMAHA CORRECTIONAL CENTER,2323 AVENUE J,OMAHA,NE,"68110","0099",(402) 595-3963,STATE,OPEN,772,DOUGLAS,"31055",USA,"922140",CORRECTIONAL INSTITUTIONS,https://corrections.nebraska.gov/public-information/statistics-reports/ndcs-reports,9/30/2017,IMAGERY,2017-12-13T00:00:00.000Z,https://corrections.nebraska.gov/facilities,MEDIUM,666,0.0130459273031,9.922341715e-06,163621.01171875,1622.46346803084,"31","055","000500","31055000500","5",Census Tract 5,G5020,S,17635488,2547792,"+41.3024254","-095.8927626",NE,-95.898650190349,41.28124336828,"3","3"
1756,1356,"10002154",CALHOUN COUNTY JAIL,20776 CENTRAL AVENUE EAST,BLOUNTSTOWN,FL,"32424","2276",(850) 674-5049,COUNTY,OPEN,72,CALHOUN,"12013",USA,"922140",CORRECTIONAL INSTITUTIONS,http://www.calhounsheriff.com/index.html,2/20/2018,IMAGERY,2018-02-20T00:00:00.000Z,http://www.calhounsheriff.com/index.html,NOT AVAILABLE,-999,0.00217196579636,1.86285092e-07,2677.626953125,267.083296271168,"12","013","010300","12013010300","103",Census Tract 103,G5020,S,390315344,10375495,"+30.3717920","-085.0982814",FL,-85.0426025071762,30.4439247984844,"1","4"
1757,1357,"10005990",PROGRESS HOUSE WORK RELEASE,5601 6TH AVENUE,TACOMA,WA,"98406",NOT AVAILABLE,(253) 593-2844,STATE,OPEN,68,PIERCE,"53053",USA,"922140",CORRECTIONAL INSTITUTIONS,http://www.doc.wa.gov/corrections/prea/resources.htm,8/29/2017,IMAGERY/OTHER,2018-01-18T00:00:00.000Z,http://www.doc.wa.gov/corrections/incarceration/work-release/locations.htm,MINIMUM,86,0.00243683359069,1.92268144e-07,3510.4296875,315.754478327018,"53","053","060906","53053060906","609.06",Census Tract 609.06,G5020,S,1573418,0,"+47.2633152","-122.5097996",WA,-122.512060841213,47.2564261698174,,"2"
1758,1358,"10002472",REYNOLDS WORK RELEASE,410 4TH AVE,SEATTLE,WA,"98104",NOT AVAILABLE,(206) 464-6320,STATE,OPEN,94,KING,"53033",USA,"922140",CORRECTIONAL INSTITUTIONS,http://www.doc.wa.gov/corrections/prea/resources.htm,3/29/2017,IMAGERY,2018-01-18T00:00:00.000Z,http://www.doc.wa.gov/corrections/incarceration/work-release/locations.htm,MINIMUM,99,0.00116968194654,7.2542422e-08,1333.203125,150.534470160694,"53","033","008100","53033008100","81",Census Tract 81,G5020,S,827622,368891,"+47.6058683","-122.3393353",WA,-122.328953618513,47.6022139176715,,"3"
1759,1359,"10002505",TRI-CITIES WORK RELEASE,524 E BRUNEAU AVE,KENNEWICK,WA,"99336",NOT AVAILABLE,(509) 585-2211,STATE,OPEN,25,BENTON,"53005",USA,"922140",CORRECTIONAL INSTITUTIONS,http://www.doc.wa.gov/corrections/prea/resources.htm,11/17/2015,IMAGERY,2018-01-18T00:00:00.000Z,http://www.doc.wa.gov/corrections/incarceration/work-release/locations.htm,MINIMUM,30,0.00260578572193,3.76422927e-07,6740.609375,376.324833618351,"53","005","011300","53005011300","113",Census Tract 113,G5020,S,5250708,1791651,"+46.2088971","-119.1124925",WA,-119.10847248429,46.2097475387828,,"1"
1760,1360,"10003851",BERRIEN COUNTY JAIL,919 PORT ST,ST. JOSEPH,MI,"49085",NOT AVAILABLE,(269) 983-7141 EXT 7777,COUNTY,OPEN,275,BERRIEN,"26021",USA,"922140",CORRECTIONAL INSTITUTIONS,http://bcsheriff.org/253/Sheriffs-Office,3/20/2018,IMAGERY/OTHER,2018-03-20T00:00:00.000Z,http://bcsheriff.org/253/Sheriffs-Office,NOT AVAILABLE,341,0.0029391256089,4.36052842e-07,7283.80078125,375.288696696623,"26","021","000800","26021000800","8",Census Tract 8,G5020,S,5253722,3462761,"+42.1088434","-086.4842214",MI,-86.4762554046632,42.1096986268258,"3","1"
1761,1361,"10001742",TECUMSEH STATE CORRECTIONAL INSTITUTION,2725 HWY 50,TECUMSEH,NE,"68450",NOT AVAILABLE,(402) 335-5998,STATE,OPEN,1017,JOHNSON,"31097",USA,"922140",CORRECTIONAL INSTITUTIONS,https://corrections.nebraska.gov/public-information/statistics-reports/ndcs-reports,9/30/2017,IMAGERY,2017-12-13T00:00:00.000Z,https://corrections.nebraska.gov/facilities,MAXIMUM,976,0.017794574,1.8191093162e-05,296021.90625,2202.88692829385,"31","097","967600","31097967600","9676",Census Tract 9676,G5020,S,249454347,459385,"+40.3376380","-096.1537256",NE,-96.1852747193869,40.4022316636058,,"2"
1762,1362,"10005716",GRANT COUNTY JAIL / JUVENILE DETENTION CENTER,209 N BLACK ST,SILVER CITY,NM,"88061",NOT AVAILABLE,(505) 534-3803,COUNTY,NOT AVAILABLE,-999,GRANT,"35017",USA,"922140",CORRECTIONAL INSTITUTIONS,http://www.nmjustice.net/nmsc/juvenile/program.php?id=421,2/15/2016,UNVERIFIED,2018-04-06T00:00:00.000Z,NOT AVAILABLE,NOT AVAILABLE,10,0.00200548037091,1.64637505e-07,2426.3515625,243.575377031834,"35","017","964400","35017964400","9644",Census Tract 9644,G5020,S,13374604,41691,"+32.7637077","-108.2746224",NM,-108.281483572113,32.7704791337154,"12","1"
1763,1363,"10002188",CHARLOTTE COUNTY JAIL,26601 AIRPORT RD,PUNTA GORDA,FL,"33982",NOT AVAILABLE,(941) 833-6300,COUNTY,OPEN,640,CHARLOTTE,"12015",USA,"922140",CORRECTIONAL INSTITUTIONS,"http://www.dc.state.fl.us/pub/jails/, https://www.ccso.org/",2/20/2018,IMAGERY,2018-02-20T00:00:00.000Z,https://www.ccso.org/,MAXIMUM,960,0.0121190009425,3.411572397e-06,47411.72265625,1423.29836124128,"12","015","010501","12015010501","105.01",Census Tract 105.01,G5020,S,46558647,1559585,"+26.9103630","-081.9928748",FL,-82.0067906053492,26.9142834365438,,"1"
1764,1364,"10002476",ECHO GLEN CHILDREN'S CENTER,33010 SE 99TH ST,SNOQUALMIE,WA,"98065",NOT AVAILABLE,(425) 831-2500,STATE,OPEN,139,KING,"53033",USA,"922140",CORRECTIONAL INSTITUTIONS,https://www.dshs.wa.gov/ra/juvenile-rehabilitation/prison-rape-elimination-act-compliance,12/2/2016,IMAGERY,2018-01-18T00:00:00.000Z,https://www.dshs.wa.gov/ra/juvenile-rehabilitation/institutions,JUVENILE,125,0.0246086906295,1.7383140927e-05,318961.34375,3366.28301777489,"53","033","032602","53033032602","326.02",Census Tract 326.02,G5020,S,30197235,640789,"+47.5350747","-121.8783343",WA,-121.89932746707,47.5182191124533,,"1"
1765,1365,"10002502",CAMP OUTLOOK,1270 N EPHRATA ST,CONNELL,WA,"99326",NOT AVAILABLE,(509) 234-5200,STATE,CLOSED,0,FRANKLIN,"53021",USA,"922140",CORRECTIONAL INSTITUTIONS,https://www.dshs.wa.gov/ra/juvenile-rehabilitation/prison-rape-elimination-act-compliance,1/18/2018,IMAGERY,2018-01-18T00:00:00.000Z,NOT AVAILABLE,JUVENILE,-999,0.0038867921532,6.2023412e-07,11200.9765625,491.16848561969,"53","021","020800","53021020800","208",Census Tract 208,G5020,S,1177246221,12043386,"+46.6393457","-119.0316968",WA,-118.852726608647,46.6709758348483,,"2"
1766,1366,"10002497",GREEN HILL SCHOOL,375 SW 11TH ST,CHEHALIS,WA,"98532",NOT AVAILABLE,(360) 740-3400,STATE,OPEN,172,LEWIS,"53041",USA,"922140",CORRECTIONAL INSTITUTIONS,https://www.dshs.wa.gov/ra/juvenile-rehabilitation/prison-rape-elimination-act-compliance,1/14/2016,IMAGERY,2018-01-18T00:00:00.000Z,https://www.dshs.wa.gov/ra/juvenile-rehabilitation/institutions,JUVENILE,244,0.0176176432703,2.0605300016e-05,371971.1015625,2330.08155508791,"53","041","971000","53041971000","9710",Census Tract 9710,G5020,S,9689413,271655,"+46.6377853","-122.9545579",WA,-122.960668860815,46.6498091654497,,"2"
1767,1367,"10005718",HIDALGO COUNTY DETENTION CENTER,83 OLD HWY 70,LORDSBURG,NM,"88045",NOT AVAILABLE,(575) 542-3050,COUNTY,OPEN,-999,HIDALGO,"35023",USA,"922140",CORRECTIONAL INSTITUTIONS,"http://www.hidalgocounty.org/index.php/services/law-enforcement/, https://www.nmlegis.gov/handouts/CCJ%20052716%20Item%203%20NM%20County%20Jails%20An%20Overview.pdf",5/27/2016,IMAGERY,2018-04-06T00:00:00.000Z,http://www.hidalgocounty.org/index.php/services/law-enforcement/,NOT AVAILABLE,158,0.00418111523771,1.04012378e-06,15255.125,501.867927478515,"35","023","970000","35023970000","9700",Census Tract 9700,G5020,S,8893107714,23582051,"+31.8980519","-108.7519293",NM,-108.666379415042,32.3374602601694,,"1"
1768,1368,"10002500",NASELLE YOUTH CAMP,11 YOUTH CAMP DRIVE,NASELLE,WA,"98638",NOT AVAILABLE,(360) 484-3223,STATE,OPEN,66,PACIFIC,"53049",USA,"922140",CORRECTIONAL INSTITUTIONS,https://www.dshs.wa.gov/ra/juvenile-rehabilitation/prison-rape-elimination-act-compliance,5/14/2015,IMAGERY,2018-01-18T00:00:00.000Z,https://www.dshs.wa.gov/ra/juvenile-rehabilitation/institutions,JUVENILE,76,0.0110253748804,4.324875201e-06,77705.6796875,1387.07871816767,"53","049","950400","53049950400","9504",Census Tract 9504,G5020,S,1502696361,114963698,"+46.4979194","-123.6740272",WA,-123.824147763991,46.3933037095716,,"1"
1769,1369,"10002484",LINCOLN PARK WORK RELEASE,3706 S YAKIMA AVE,TACOMA,WA,"98418",NOT AVAILABLE,(253) 671-7290,STATE,CLOSED,0,PIERCE,"53053",USA,"922140",CORRECTIONAL INSTITUTIONS,http://www.thenewstribune.com/opinion/article150294352.html,5/14/2017,IMAGERY,2018-01-18T00:00:00.000Z,http://www.doc.wa.gov/facilities/workrelease/raplincolnparkwr/default.asp,MINIMUM,-999,0.00151757534715,9.3069626e-08,1698.2421875,191.430169781236,"53","053","061800","53053061800","618",Census Tract 618,G5020,S,1383817,0,"+47.2267872","-122.4518338",WA,-122.443673662012,47.2241281846356,,"2"
1770,1370,"10003789",LEA COUNTY DETENTION CENTER,1401 S COMMERCIAL,LOVINGTON,NM,"88260",NOT AVAILABLE,(575) 396-8669,COUNTY,OPEN,318,LEA,"35025",USA,"922140",CORRECTIONAL INSTITUTIONS,https://www.leacounty.net/p/departments/law-and-safety,4/4/2018,IMAGERY,2018-04-06T00:00:00.000Z,https://www.leacounty.net/p/departments/law-and-safety,NOT AVAILABLE,432,0.00669818599999,1.419289618e-06,20955.609375,825.647288995795,"35","025","001003","35025001003","10.03",Census Tract 10.03,G5020,S,5125169,53573,"+32.9371831","-103.3513931",NM,-103.339084046846,32.9344835401778,,"1"
1771,1371,"10001262",SOUTH TOWER DETENTION FACILITY,111 W COMMERCE ST,DALLAS,TX,"75202",NOT AVAILABLE,NOT AVAILABLE,COUNTY,OPEN,-999,DALLAS,"48113",USA,"922140",CORRECTIONAL INSTITUTIONS,http://www.dallascounty.org/department/sheriff/sheriff_index.php,4/26/2018,IMAGERY/OTHER,2018-04-26T00:00:00.000Z,http://www.dallascounty.org/department/sheriff/sheriff_index.php,NOT AVAILABLE,2304,0.00357694518747,5.54735196e-07,8176.046875,415.806072105811,"48","113","010000","48113010000","100",Census Tract 100,G5020,S,31397013,463801,"+32.8114428","-096.8620144",TX,-96.8153081758766,32.7769396406696,"2","6"
1772,1372,"10003826",EARNEST C. BROOKS CORRECTIONAL FACILITY,2500 S SHERIDAN DR,MUSKEGON HEIGHTS,MI,"49444",NOT AVAILABLE,(231) 773-9200,STATE,OPEN,1218,MUSKEGON,"26121",USA,"922140",CORRECTIONAL INSTITUTIONS,"http://www.michigan.gov/corrections/0,4551,7-119-1441---,00.html",12/31/2016,IMAGERY/OTHER,2017-12-06T00:00:00.000Z,"http://www.michigan.gov/corrections/0,4551,7-119-68854_1381_1385---,00.html",MAXIMUM,1246,0.0148626083808,1.3779832077e-05,234288.7578125,1928.00446675196,"26","121","000402","26121000402","4.02",Census Tract 4.02,G5020,S,5956593,1520,"+43.2113094","-086.2022528",MI,-86.1726647733021,43.2103929290749,"5","3"
1773,1373,"10002492",MAPLE LANE COMPETENCY RESTORATION PROGRAM,20311 OLD HWY 9 SW,CENTRALIA,WA,"98531",NOT AVAILABLE,(360) 664-4641,STATE,OPEN,-999,THURSTON,"53067",USA,"922140",CORRECTIONAL INSTITUTIONS,http://www.correctcarers.com/mlcrp/,1/18/2018,IMAGERY,2018-01-18T00:00:00.000Z,http://www.correctcarers.com/mlcrp/,NOT AVAILABLE,30,0.00264333229614,2.89614004e-07,5242.140625,348.56656509636,"53","067","012720","53067012720","127.20",Census Tract 127.20,G5020,S,77375951,1514204,"+46.7868064","-123.0756090",WA,-123.030433389325,46.7935562312458,,"1"
1774,1374,"10000280",FLORENCE CRANE CORRECTIONAL FACILITY,38 FOURTH ST,COLDWATER,MI,"49036",NOT AVAILABLE,(517) 279-9165,STATE,CLOSED,0,BRANCH,"26023",USA,"922140",CORRECTIONAL INSTITUTIONS,"http://www.michigan.gov/corrections/0,4551,7-119-68854_1381_1385---,00.html",12/6/2017,IMAGERY,2017-12-06T00:00:00.000Z,"http://michigan.gov/corrections/0,4551,7-119-68854_1381_1385-5364--,00.html",MINIMUM,1063,0.0184663027823,1.384355476e-05,230689.94921875,2259.22163033526,"26","023","951300","26023951300","9513",Census Tract 9513,G5020,S,85087940,2781568,"+41.9579786","-085.0716287",MI,-84.9907217417796,41.9577850944084,"1","4"
1775,1375,"10002458",PINE LODGE CORRECTIONS CENTER FOR WOMEN,751 S PINE ST,MEDICAL LAKE,WA,"99022",NOT AVAILABLE,NOT AVAILABLE,STATE,CLOSED,0,SPOKANE,"53063",USA,"922140",CORRECTIONAL INSTITUTIONS,http://www.spokesman.com/stories/2010/apr/12/pine-lodge-prison-close-under-spending-plan/,4/12/2010,IMAGERY,2018-01-18T00:00:00.000Z,NOT AVAILABLE,MINIMUM,359,0.012521656361,5.338598194e-06,98049.1484375,1645.28391148736,"53","063","013900","53063013900","139",Census Tract 139,G5020,S,39234223,5740639,"+47.5438426","-117.6671406",WA,-117.69514637682,47.5673080699635,,"2"
1776,1376,"10001743",WORK ETHIC CAMP,2309 N HWY 83,MCCOOK,NE,"69001",NOT AVAILABLE,(308) 345-8405,STATE,OPEN,192,RED WILLOW,"31145",USA,"922140",CORRECTIONAL INSTITUTIONS,https://corrections.nebraska.gov/public-information/statistics-reports/ndcs-reports,9/30/2017,IMAGERY,2017-12-14T00:00:00.000Z,https://corrections.nebraska.gov/facilities,MINIMUM,200,0.00664965901701,2.640534324e-06,42858.609375,847.739046328278,"31","145","963200","31145963200","9632",Census Tract 9632,G5020,S,24593025,0,"+40.2231109","-100.6380888",NE,-100.647997609044,40.2282825698149,,"1"
1777,1377,"10006740",VERMILION COUNTY JUVENILE DETENTION CENTER,150 SAGER,DANVILLE,IL,"61832",NOT AVAILABLE,(217) 431-6691,COUNTY,OPEN,-999,VERMILION,"17183",USA,"922140",CORRECTIONAL INSTITUTIONS,http://ipcsa.org/il-probation-directory/,3/5/2018,IMAGERY,2018-03-05T00:00:00.000Z,NOT AVAILABLE,JUVENILE,-999,0.00227169594527,2.85452243e-07,4625.87109375,283.456517510077,"17","183","000100","17183000100","1",Census Tract 1,G5020,S,1970260,51234,"+40.1230198","-087.6302178",IL,-87.6274948200402,40.1211634271189,"6","2"
1778,1378,"10004578",CLAY COUNTY JAIL / SHERIFF,901 NORTH ORANGE AVENUE,GREEN COVE SPRINGS,FL,"32043",NOT AVAILABLE,(904) 213-5906,COUNTY,OPEN,372,CLAY,"12019",USA,"922140",CORRECTIONAL INSTITUTIONS,"http://www.dc.state.fl.us/pub/jails/, https://www.claysheriff.com/",2/20/2018,IMAGERY,2018-02-20T00:00:00.000Z,https://www.claysheriff.com/,NOT AVAILABLE,480,0.00462182170924,9.45689797e-07,13532.427734375,558.406847440731,"12","019","031400","12019031400","314",Census Tract 314,G5020,S,6881253,4227012,"+29.9954459","-081.6846689",FL,-81.6868650112222,30.0034426223385,"4","1"
1779,1379,"10002485",SECURE COMMUNITY TRANSITION FACILITY - PIERCE COUNTY,11150 N 20TH AVE,LOWER PENINSULA,WA,"98303",NOT AVAILABLE,NOT AVAILABLE,STATE,OPEN,11,PIERCE,"53053",USA,"922140",CORRECTIONAL INSTITUTIONS,https://www.dshs.wa.gov/fsa/office-capital-programs/secure-community-transition-facility-pierce-county,6/1/2015,IMAGERY,2018-01-18T00:00:00.000Z,https://www.dshs.wa.gov/ra/facilities,NOT AVAILABLE,24,0.0035840478408,7.45325722e-07,13598.0234375,463.078241575444,"53","053","072603","53053072603","726.03",Census Tract 726.03,G5020,S,91149394,108018989,"+47.2094984","-122.6842971",WA,-122.68638846481,47.2170166586519,,"3"
1780,1380,"10004637",COLLIER COUNTY IMMOKALEE JAIL,302 STOCKADE RD,IMMOKALEE,FL,"34142",NOT AVAILABLE,(239) 657-2878,COUNTY,OPEN,109,COLLIER,"12021",USA,"922140",CORRECTIONAL INSTITUTIONS,https://www.colliersheriff.org/my-ccso,2/20/2018,IMAGERY,2018-02-20T00:00:00.000Z,https://www.colliersheriff.org/my-ccso,MAXIMUM,-999,0.00579019316614,1.714787592e-06,23722.97265625,685.828042911299,"12","021","011202","12021011202","112.02",Census Tract 112.02,G5020,S,1316252775,24798581,"+26.2762049","-081.3420540",FL,-81.4116383477869,26.3959060062303,,"2"
1781,1381,"10003850",BERRIEN COUNTY JUVENILE CENTER,6414 DEANS HILL RD,ST. JOSEPH,MI,"49102",NOT AVAILABLE,(269) 471-2831,COUNTY,OPEN,48,BERRIEN,"26021",USA,"922140",CORRECTIONAL INSTITUTIONS,https://www.berriencounty.org/596/Juvenile-Center,3/20/2018,IMAGERY,2018-03-20T00:00:00.000Z,https://www.berriencounty.org/596/Juvenile-Center,JUVENILE,42,0.00583755499112,6.99366813e-07,11653.71875,758.028605865893,"26","021","010600","26021010600","106",Census Tract 106,G5020,S,90820040,4402124,"+41.9387013","-086.2878857",MI,-86.3048934522222,41.9546111454228,,"1"
1782,1382,"10003788",LINCOLN COUNTY DETENTION CENTER,511 HANGAR RD,CARRIZOZO,NM,"88301",NOT AVAILABLE,(575) 648-6510,COUNTY,OPEN,-999,LINCOLN,"35027",USA,"922140",CORRECTIONAL INSTITUTIONS,http://www.lasallecorrections.com/our-locations-table/,4/6/2018,IMAGERY,2018-04-06T00:00:00.000Z,NOT AVAILABLE,MEDIUM,144,0.00367059093221,6.61734309e-07,9850.55078125,440.534276128594,"35","027","960200","35027960200","9602",Census Tract 9602,G5020,S,6394814332,189796,"+33.9119459","-105.6609608",NM,-105.889387095578,33.6472790614324,,"1"
1783,1383,"10000277",G ROBERT COTTON CORRECTIONAL FACILITY,3500 N ELM RD,JACKSON,MI,"49201",NOT AVAILABLE,(517) 780-5000,STATE,OPEN,1796,JACKSON,"26075",USA,"922140",CORRECTIONAL INSTITUTIONS,"http://www.michigan.gov/corrections/0,4551,7-119-1441---,00.html",12/31/2016,IMAGERY,2017-12-06T00:00:00.000Z,"http://www.michigan.gov/corrections/0,4551,7-119-68854_1381_1385---,00.html",MAXIMUM,1842,0.01747270148,1.8833715518e-05,315487.15625,2274.28041307957,"26","075","005800","26075005800","58",Census Tract 58,G5020,S,2383646,2914,"+42.2958029","-084.3894236",MI,-84.3899626934911,42.2881678188725,,"5"
1784,1384,"10004134",NEBRASKA YOUTH REHABILITATION AND TREATMENT CENTER,2802 30TH AVE,KEARNEY,NE,"68845",NOT AVAILABLE,(308) 865-5313,STATE,OPEN,98,BUFFALO,"31019",USA,"922140",CORRECTIONAL INSTITUTIONS,http://dhhs.ne.gov/children_family_services/Pages/jus_yrtc_yrtckindex.aspx,12/14/2017,IMAGERY,2017-12-14T00:00:00.000Z,http://dhhs.ne.gov/children_family_services/Pages/jus_yrtc_yrtckindex.aspx,JUVENILE,172,0.0103781977622,6.815670962e-06,111413.859375,1345.51886069566,"31","019","969204","31019969204","9692.04",Census Tract 9692.04,G5020,S,35485451,173274,"+40.7168226","-099.1403432",NE,-99.1237868235691,40.7053039949999,,"1"
1785,1385,"10001387",GUS HARRISON CORRECTIONAL FACILITY,2727 E BEECHER ST,ADRIAN,MI,"49221",NOT AVAILABLE,(517) 265-3900,STATE,OPEN,2331,LENAWEE,"26091",USA,"922140",CORRECTIONAL INSTITUTIONS,"http://www.michigan.gov/corrections/0,4551,7-119-1441---,00.html",12/31/2016,IMAGERY,2017-12-06T00:00:00.000Z,"http://www.michigan.gov/corrections/0,4551,7-119-68854_1381_1385---,00.html",MAXIMUM,2368,0.0225104633387,2.4719024649e-05,411456.80859375,2964.77246660937,"26","091","061700","26091061700","617",Census Tract 617,G5020,S,82335445,670473,"+41.8527313","-084.0730603",MI,-84.0072921897291,41.8860846440301,,"2"
1786,1386,"10000272",IONIA CORRECTIONAL FACILITY,1576 W BLUEWATER HWY,IONIA,MI,"48846",NOT AVAILABLE,(616) 527-6331,STATE,OPEN,681,IONIA,"26067",USA,"922140",CORRECTIONAL INSTITUTIONS,"http://www.michigan.gov/corrections/0,4551,7-119-1441---,00.html",12/31/2016,IMAGERY,2017-12-06T00:00:00.000Z,"http://www.michigan.gov/corrections/0,4551,7-119-68854_1381_1385---,00.html",MAXIMUM,706,0.0142356111351,1.2479642783e-05,211401.1328125,1811.03370158374,"26","067","982200","26067982200","9822",Census Tract 9822,G5020,S,1987066,0,"+42.9792254","-085.1044377",MI,-85.1016535475337,42.9844122592332,,"3"
1787,1387,"10004140",YOUTH REHABILITATION & TREATMENT CENTER - GENEVA,855 N 1ST ST,GENEVA,NE,"68361",NOT AVAILABLE,(402) 759-3164,STATE,OPEN,33,FILLMORE,"31059",USA,"922140",CORRECTIONAL INSTITUTIONS,http://dhhs.ne.gov/children_family_services/Pages/jus_yrtc_yrtcgindex.aspx,12/14/2017,IMAGERY/OTHER,2017-12-14T00:00:00.000Z,http://dhhs.ne.gov/children_family_services/Pages/jus_yrtc_yrtcgindex.aspx,JUVENILE,82,0.0128041534729,9.374530906e-06,152855.09765625,1609.00214219545,"31","059","091700","31059091700","917",Census Tract 917,G5020,S,771921544,1557068,"+40.5185128","-097.7017406",NE,-97.6126267404569,40.5360365827068,"2","2"
1788,1388,"10000529",COLLIER COUNTY NAPLES JAIL,3347 TAMIAMI TRAIL E,NAPLES,FL,"34112","4434",(239) 252-9504,COUNTY,OPEN,763,COLLIER,"12021",USA,"922140",CORRECTIONAL INSTITUTIONS,https://www.colliersheriff.org/my-ccso,2/20/2018,IMAGERY,2018-02-20T00:00:00.000Z,https://www.colliersheriff.org/my-ccso,MAXIMUM,-999,0.00580045714037,1.35640028e-06,18721.845703125,686.873915601836,"12","021","010604","12021010604","106.04",Census Tract 106.04,G5020,S,2552539,135823,"+26.1301732","-081.7566346",FL,-81.7635944592883,26.1290775542458,,"2"
1789,1389,"10003847",CALHOUN COUNTY JUVENILE HOME,14555 18 1/2 MILE RD,MARSHALL,MI,"49068",NOT AVAILABLE,(269) 781-0920,COUNTY,OPEN,-999,CALHOUN,"26025",USA,"922140",CORRECTIONAL INSTITUTIONS,https://www.calhouncountymi.gov/government/juvenile_home/,3/20/2018,IMAGERY,2018-03-20T00:00:00.000Z,https://www.calhouncountymi.gov/government/juvenile_home/,JUVENILE,42,0.00339273055498,4.72039038e-07,7906.62109375,434.69638109776,"26","025","003900","26025003900","39",Census Tract 39,G5020,S,14270744,105407,"+42.2855857","-084.9601997",MI,-84.9373831676862,42.2834528392275,"3","1"
1790,1390,"10004638",COLLIER HALFWAY HOUSE,323 SERGEANT JOE JONES RD,IMMOKALEE,FL,"34142",NOT AVAILABLE,(239) 377-1050,COUNTY,CLOSED,0,COLLIER,"12021",USA,"922140",CORRECTIONAL INSTITUTIONS,https://www.publicschoolreview.com/collier-halfway-house-profile,2/20/2018,IMAGERY,2018-02-20T00:00:00.000Z,https://www.nefec.org/school/11/9029/collier-halfway-house/,JUVENILE,30,0.00391198802833,8.70051318e-07,12036.4765625,453.208048221354,"12","021","011202","12021011202","112.02",Census Tract 112.02,G5020,S,1316252775,24798581,"+26.2762049","-081.3420540",FL,-81.4115521327116,26.3947867645601,,"2"
1791,1391,"10003797",LUNA COUNTY DETENTION CENTER,1700 4TH ST NE,DEMING,NM,"88030",NOT AVAILABLE,NOT AVAILABLE,COUNTY,OPEN,304,LUNA,"35029",USA,"922140",CORRECTIONAL INSTITUTIONS,http://www.lunacountynm.us/departments/index.php,4/6/2018,IMAGERY,2018-04-06T00:00:00.000Z,http://www.lunacountynm.us/departments/index.php,NOT AVAILABLE,385,0.0052002580854,1.464484094e-06,21464.671875,620.029743566334,"35","029","000600","35029000600","6",Census Tract 6,G5020,S,5486839,0,"+32.2748578","-107.7432467",NM,-107.737285841334,32.2766800444053,,"1"
1792,1392,"10002753",GEORGE ALLEN JAIL (GOVERNMENT CENTER JAIL),600 COMMERCE ST,DALLAS,TX,"75202",NOT AVAILABLE,NOT AVAILABLE,COUNTY,CLOSED,0,DALLAS,"48113",USA,"922140",CORRECTIONAL INSTITUTIONS,http://www.dallascounty.org/department/sheriff/detention.php,4/26/2018,IMAGERY/OTHER,2018-04-26T00:00:00.000Z,NOT AVAILABLE,NOT AVAILABLE,800,0.00338321516932,5.91517544e-07,8718.26171875,399.850842926351,"48","113","003101","48113003101","31.01",Census Tract 31.01,G5020,S,936791,0,"+32.7798397","-096.7992069",TX,-96.8065109586305,32.7778771547092,"7","1"
1793,1393,"10006741",WAYNE COUNTY JAIL,305 EAST COURT STREET,FAIRFIELD,IL,"62837",NOT AVAILABLE,(618) 842-6631,COUNTY,OPEN,-999,WAYNE,"17191",USA,"922140",CORRECTIONAL INSTITUTIONS,http://www.ilsheriff.org/index.php/directory,3/5/2018,IMAGERY,2018-03-05T00:00:00.000Z,NOT AVAILABLE,NOT AVAILABLE,30,0.00127226975984,1.00218766e-07,1584.2734375,157.15586472985,"17","191","955100","17191955100","9551",Census Tract 9551,G5020,S,16835310,176484,"+38.3972654","-088.3635998",IL,-88.3575660284588,38.3809795384998,,"1"
1794,1394,"10001345",KINROSS CORRECTIONAL FACILITY,4533 W. INDUSTRIAL PARK DRIVE,KINCHELOE,MI,"49788",NOT AVAILABLE,(906) 495-2282,STATE,OPEN,1509,CHIPPEWA,"26033",USA,"922140",CORRECTIONAL INSTITUTIONS,"http://www.michigan.gov/corrections/0,4551,7-119-1441---,00.html",12/31/2016,IMAGERY,2017-12-06T00:00:00.000Z,"http://www.michigan.gov/corrections/0,4551,7-119-68854_1381_1385---,00.html",MEDIUM,1602,0.0127317253336,1.0932475341e-05,195908.4609375,1661.69494893517,"26","033","980300","26033980300","9803",Census Tract 9803,G5020,S,295328,0,"+46.2490166","-084.4543156",MI,-84.4546902012834,46.2490849506574,,"1"
1795,1395,"10006668",SPECIAL COMMITMENT CENTER - TOTAL CONFINEMENT FACILITY,11150 N 20TH AVE,MCNEIL ISLAND,WA,"98303",NOT AVAILABLE,NOT AVAILABLE,STATE,OPEN,-999,PIERCE,"53053",USA,"922140",CORRECTIONAL INSTITUTIONS,https://www.dshs.wa.gov/fsa/office-capital-programs/total-confinement-facility,1/18/2018,IMAGERY/OTHER,2018-01-18T00:00:00.000Z,https://www.dshs.wa.gov/ra/facilities,NOT AVAILABLE,315,0.0117855628188,9.754343783e-06,177955.625,1604.69670299673,"53","053","072603","53053072603","726.03",Census Tract 726.03,G5020,S,91149394,108018989,"+47.2094984","-122.6842971",WA,-122.688123381819,47.215060784636,,"3"
1796,1396,"10006593",LINCOLN REGIONAL CENTER,WEST PROSPECTOR PLACE AND FOLSOM STREET,LINCOLN,NE,"68509","4949",(402) 479-5410,STATE,OPEN,-999,LANCASTER,"31109",USA,"922140",CORRECTIONAL INSTITUTIONS,http://dhhs.ne.gov/behavioral_health/Pages/beh_rc_lrcserv.aspx,12/14/2017,IMAGERY,2017-12-14T00:00:00.000Z,http://dhhs.ne.gov/behavioral_health/Pages/beh_rc_lrcserv.aspx,NOT AVAILABLE,250,0.0206949130481,2.5806551664e-05,422332.1484375,2742.65886348559,"31","109","003500","31109003500","35",Census Tract 35,G5020,S,783310,0,"+40.7819860","-096.7344412",NE,-96.7325387181289,40.780882335784,,"1"
1797,1397,"10001389",LAKELAND CORRECTIONAL FACILITY,141 FIRST ST,COLDWATER,MI,"49036",NOT AVAILABLE,(517) 278-6942,STATE,OPEN,1460,BRANCH,"26023",USA,"922140",CORRECTIONAL INSTITUTIONS,"http://www.michigan.gov/corrections/0,4551,7-119-1441---,00.html",12/31/2016,IMAGERY,2017-12-06T00:00:00.000Z,"http://www.michigan.gov/corrections/0,4551,7-119-68854_1381_1385---,00.html",MEDIUM,1466,0.0218727331095,2.0418303111e-05,340292.9375,2688.47027996057,"26","023","951300","26023951300","9513",Census Tract 9513,G5020,S,85087940,2781568,"+41.9579786","-085.0716287",MI,-84.9959657227724,41.9654429577033,"1","4"
1798,1398,"10004568",COLUMBIA COUNTY JAIL,389 NORTHWEST QUINTEN STREET,LAKE CITY,FL,"32055",NOT AVAILABLE,(386) 755-7000,COUNTY,OPEN,229,COLUMBIA,"12023",USA,"922140",CORRECTIONAL INSTITUTIONS,https://www.columbiasheriff.org/,2/20/2018,IMAGERY,2018-02-20T00:00:00.000Z,https://www.columbiasheriff.org/,MAXIMUM,256,0.00411406609159,8.17739907e-07,11727.294921875,493.518791796519,"12","023","110202","12023110202","1102.02",Census Tract 1102.02,G5020,S,132143333,1011942,"+30.2757156","-082.7112939",FL,-82.6436841703299,30.2208281135935,,"1"
1799,1399,"10005181",CASS COUNTY JAIL,321 N M62,CASSOPOLIS,MI,"49031",NOT AVAILABLE,(269) 445-2481,COUNTY,OPEN,103,CASS,"26027",USA,"922140",CORRECTIONAL INSTITUTIONS,http://www.michigan.gov/documents/corrections/JPIS_-_CY_2010_344047_7.pdf,2/15/2016,IMAGERY/OTHER,2018-03-20T00:00:00.000Z,http://www.ccso.info/Home.aspx,MAXIMUM,103,0.0034775521294,4.84776819e-07,8073.48046875,426.995506060965,"26","027","002100","26027002100","21",Census Tract 21,G5020,S,155834064,6052406,"+41.9049517","-086.0387907",MI,-86.0187527069615,41.9192593100122,,"1"
1800,1400,"10004733",WILLIAMSON COUNTY JAIL,404 N. VAN BUREN,MARION,IL,"62959",NOT AVAILABLE,(618) 997-6541,COUNTY,OPEN,-999,WILLIAMSON,"17199",USA,"922140",CORRECTIONAL INSTITUTIONS,http://www.wcsheriff.com/home.html,3/5/2018,IMAGERY,2018-03-05T00:00:00.000Z,http://www.wcsheriff.com/home.html,NOT AVAILABLE,244,0.00325919704219,5.00306668e-07,7839.22265625,408.164522679462,"17","199","021000","17199021000","210",Census Tract 210,G5020,S,34590532,542004,"+37.7481321","-088.9777973",IL,-88.9285679570499,37.7331501747953,,"1"
1801,1401,"10006892",LARAMIE COUNTY JUVENILE SERVICES CENTER,13794 PRAIRIE CENTER CIRCLE,CHEYENNE,WY,"82009",NOT AVAILABLE,(307) 775-7301,COUNTY,OPEN,-999,LARAMIE,"56021",USA,"922140",CORRECTIONAL INSTITUTIONS,http://www.laramiecounty.com/_officials/Sheriff/_pdfs/JuvenileServiceCenter/INFO%20PAMPHLET%20Updated%2001%2011%2016.pdf,5/10/2018,IMAGERY,2018-05-10T00:00:00.000Z,NOT AVAILABLE,JUVENILE,-999,0.00298602832594,2.99522294e-07,4929.23828125,376.577482701626,"56","021","002000","56021002000","20",Census Tract 20,G5020,S,2729588322,1205491,"+41.2408635","-104.3404666",WY,-104.646763696478,41.1497658128097,,"2"
1802,1402,"10003770",MCKINLEY COUNTY ADULT DETENTION CENTER,255 SOUTH BOARDMAN DR,GALLUP,NM,"87301",NOT AVAILABLE,NOT AVAILABLE,COUNTY,OPEN,-999,MCKINLEY,"35031",USA,"922140",CORRECTIONAL INSTITUTIONS,https://www.co.mckinley.nm.us/148/Departments,4/6/2018,IMAGERY/OTHER,2018-04-06T00:00:00.000Z,https://www.co.mckinley.nm.us/148/Departments,NOT AVAILABLE,328,0.00312859799243,5.73586906e-07,8733.796875,388.113729592389,"35","031","945600","35031945600","9456",Census Tract 9456,G5020,S,12321526,0,"+35.5297673","-108.6672089",NM,-108.708311069689,35.5272221999284,,"1"
1803,1403,"10006742",WHITESIDE COUNTY JAIL,400 N. CHERRY ST,MORRISON,IL,"61270",NOT AVAILABLE,(815) 772-5203,COUNTY,OPEN,-999,WHITESIDE,"17195",USA,"922140",CORRECTIONAL INSTITUTIONS,http://www.ilsheriff.org/index.php/directory,3/5/2018,IMAGERY,2018-03-05T00:00:00.000Z,https://www.whiteside.org/departments.html,NOT AVAILABLE,129,0.00231500152319,2.53495688e-07,4214.5234375,310.927198571058,"17","195","000200","17195000200","2",Census Tract 2,G5020,S,191386871,300790,"+41.8688919","-089.9490361",IL,-89.963376027989,41.8102380815253,,"1"
1804,1404,"10000398",MONTGOMERY CORRECTIONAL CENTER,4727 LANNIE RD,JACKSONVILLE,FL,"32218",NOT AVAILABLE,(904) 766-5048,LOCAL,OPEN,512,DUVAL,"12031",USA,"922140",CORRECTIONAL INSTITUTIONS,http://www.coj.net/departments/sheriffs-office/department-of-corrections,2/20/2018,IMAGERY,2018-02-20T00:00:00.000Z,http://www.coj.net/departments/sheriffs-office/department-of-corrections,NOT AVAILABLE,648,0.0135675164613,4.754981819e-06,68414.255859375,1626.93458796995,"12","031","010301","12031010301","103.01",Census Tract 103.01,G5020,S,131488905,2173082,"+30.5303592","-081.6816428",FL,-81.7262541624349,30.5393123245591,,"2"
1805,1405,"10000401",JOHN E GOODE PRETRIAL DETENTION FACILITY,500 E ADAMS ST,JACKSONVILLE,FL,"32202",NOT AVAILABLE,(904) 630-5747,LOCAL,OPEN,2426,DUVAL,"12031",USA,"922140",CORRECTIONAL INSTITUTIONS,http://www.coj.net/departments/sheriffs-office/department-of-corrections,2/20/2018,IMAGERY,2018-02-20T00:00:00.000Z,http://www.coj.net/departments/sheriffs-office/department-of-corrections,MAXIMUM,2189,0.0036548424214,6.88843188e-07,9889.328125,426.038039092723,"12","031","001000","12031001000","10",Census Tract 10,G5020,S,1175361,9188,"+30.3316498","-081.6517170",FL,-81.6506195045691,30.3256948113048,"4","2"
1806,1406,"10001366",MACOMB CORRECTIONAL FACILITY,34625 26 MILE RD,NEW HAVEN,MI,"48048",NOT AVAILABLE,(586) 749-4900,STATE,OPEN,1355,MACOMB,"26099",USA,"922140",CORRECTIONAL INSTITUTIONS,"http://www.michigan.gov/corrections/0,4551,7-119-1441---,00.html",12/31/2016,IMAGERY,2017-12-06T00:00:00.000Z,"http://www.michigan.gov/corrections/0,4551,7-119-68854_1381_1385---,00.html",MAXIMUM,1422,0.0172396951801,1.4783913388e-05,249382.46875,2276.87698781825,"26","099","218000","26099218000","2180",Census Tract 2180,G5020,S,24475422,215194,"+42.7310169","-082.7767810",MI,-82.7634685724431,42.7244371519444,"1","1"
1807,1407,"10005150",CHARLEVOIX COUNTY JAIL,1000 GRANT STREET,CHARLEVOIX,MI,"49720",NOT AVAILABLE,(231) 547-4461,COUNTY,OPEN,-999,CHARLEVOIX,"26029",USA,"922140",CORRECTIONAL INSTITUTIONS,http://www.charlevoixcounty.org/charlevoix_county_sheriff/index.php,3/20/2018,IMAGERY/OTHER,2018-03-20T00:00:00.000Z,http://www.charlevoixcounty.org/charlevoix_county_sheriff/index.php,NOT AVAILABLE,89,0.00332110531745,3.18648958e-07,5614.8125,447.926527376071,"26","029","001500","26029001500","15",Census Tract 15,G5020,S,3981064,1274894,"+45.3141410","-085.2515752",MI,-85.263456964261,45.310276042902,,"1"
1808,1408,"10006669",SECURE COMMUNITY TRANSITION FACILITY - KING COUNTY,132 SOUTH SPOKANE STREET,SEATTLE,WA,"98134",NOT AVAILABLE,NOT AVAILABLE,STATE,OPEN,-999,KING,"53033",USA,"922140",CORRECTIONAL INSTITUTIONS,https://www.dshs.wa.gov/fsa/office-capital-programs/secure-community-transition-facility-king-county,1/18/2018,IMAGERY/OTHER,2018-01-18T00:00:00.000Z,https://www.dshs.wa.gov/ra/facilities,NOT AVAILABLE,6,0.00174960985057,1.42117455e-07,2610.3671875,246.562465514821,"53","033","009300","53033009300","93",Census Tract 93,G5020,S,9429074,719984,"+47.5771253","-122.3309360",WA,-122.33261198437,47.571969361726,"3","1"
1809,1409,"10001342",MARQUETTE BRANCH PRISON,1960 US HWY 41 S,MARQUETTE,MI,"49855",NOT AVAILABLE,(906) 226-6531,STATE,OPEN,1060,MARQUETTE,"26103",USA,"922140",CORRECTIONAL INSTITUTIONS,"http://www.michigan.gov/corrections/0,4551,7-119-1441---,00.html",12/31/2016,IMAGERY,2017-12-06T00:00:00.000Z,"http://www.michigan.gov/corrections/0,4551,7-119-68854_1381_1385---,00.html",CLOSE,1172,0.0177589690189,1.3005493087e-05,234175.71484375,2365.68169437879,"26","103","002800","26103002800","28",Census Tract 28,G5020,S,21909565,3579663,"+46.5183000","-087.4207247",MI,-87.3814177822378,46.5106102903112,,"2"
1810,1410,"10006594",WHITEHALL PSYCHIATRIC RESIDENTIAL TREATMENT FACILITY,5845 HUNTINGTON AVE,LINCOLN,NE,"68507",NOT AVAILABLE,(402) 471-6969,STATE,OPEN,-999,LANCASTER,"31109",USA,"922140",CORRECTIONAL INSTITUTIONS,http://dhhs.ne.gov/behavioral_health/Pages/beh_rc_lrcserv.aspx,12/14/2017,IMAGERY,2017-12-14T00:00:00.000Z,http://dhhs.ne.gov/behavioral_health/Pages/beh_rc_lrcserv.aspx,JUVENILE,24,0.00858605059907,4.514521548e-06,73943.25390625,1087.7503498541,"31","109","000201","31109000201","2.01",Census Tract 2.01,G5020,S,2554980,0,"+40.8440359","-096.6355120",NE,-96.6402364241811,40.8362642081092,,"1"
1811,1411,"10004663",WINNEBAGO COUNTY JUVENILE DETENTION CENTER,5350 NORTHROCK DRIVE,ROCKFORD,IL,"61103",NOT AVAILABLE,(815) 516-2980,COUNTY,OPEN,-999,WINNEBAGO,"17201",USA,"922140",CORRECTIONAL INSTITUTIONS,http://wincoil.us/departments/,3/5/2018,IMAGERY,2018-03-05T00:00:00.000Z,http://wincoil.us/departments/,JUVENILE,48,0.00340043140831,4.76990855e-07,7996.328125,433.554757987805,"17","201","003801","17201003801","38.01",Census Tract 38.01,G5020,S,97724304,1131968,"+42.3826655","-089.1071181",IL,-89.0701609968078,42.3365951848488,,"1"
1812,1412,"10000348",ESCAMBIA COUNTY ROAD PRISON,601 HIGHWAY 297-A,CANTONMENT,FL,"32533",NOT AVAILABLE,(850) 937-2100,COUNTY,OPEN,228,ESCAMBIA,"12033",USA,"922140",CORRECTIONAL INSTITUTIONS,https://myescambia.com/our-services/corrections,2/20/2018,IMAGERY,2018-02-21T00:00:00.000Z,https://myescambia.com/our-services/corrections,NOT AVAILABLE,-999,0.00387693972756,6.77092958e-07,9747.916015625,465.120017739773,"12","033","003700","12033003700","37",Census Tract 37,G5020,S,17169473,562975,"+30.5881547","-087.3252581",FL,-87.3318035820472,30.5987100709258,,"1"
1813,1413,"10002750",DR JEROME MCNEIL JR DETENTION CENTER,2600 LONE STAR DR,DALLAS,TX,"75212",NOT AVAILABLE,(214) 698-4430,COUNTY,OPEN,295,DALLAS,"48113",USA,"922140",CORRECTIONAL INSTITUTIONS,http://www.tjjd.texas.gov/publications/other/searchfacilityregistryresults.aspx?SelectedFacilityType=YKSBbGCMUWM=&SelectedSortBy=laExhobORj5ZHimppFKN0Q==&IncludeInactive=bZL7qeN3IjY=,4/26/2018,IMAGERY,2018-04-26T00:00:00.000Z,NOT AVAILABLE,JUVENILE,322,0.00771393080038,2.553418886e-06,37630.50390625,921.928312379721,"48","113","020500","48113020500","205",Census Tract 205,G5020,S,5439922,144058,"+32.7833893","-096.8622702",TX,-96.8680411855587,32.7688055088602,"1","1"
1814,1414,"10005172",CLARE COUNTY CORRECTIONAL FACILITY,255 WEST MAIN STREET,HARRISON,MI,"48625",NOT AVAILABLE,(989) 539-7166,COUNTY,OPEN,163,CLARE,"26035",USA,"922140",CORRECTIONAL INSTITUTIONS,http://www.michigan.gov/documents/corrections/JPIS_-_CY_2010_344047_7.pdf,3/20/2018,IMAGERY/OTHER,2018-03-20T00:00:00.000Z,http://claresheriff.org/,NOT AVAILABLE,176,0.00334912940846,4.08903117e-07,7046.4140625,448.557690147481,"26","035","001300","26035001300","13",Census Tract 13,G5020,S,58577511,2426656,"+44.0017580","-084.7699611",MI,-84.8044021070991,44.0190377972561,,"1"
1815,1415,"10000999",COLUMBIA CORRECTIONAL INSTITUTION,2925 COLUMBIA DR,PORTAGE,WI,"53901","0950",(608) 742-9100,STATE,OPEN,839,COLUMBIA,"55021",USA,"922140",CORRECTIONAL INSTITUTIONS,https://doc.wi.gov/Pages/DataResearch/DataAndReports.aspx,1/12/2018,IMAGERY,2018-01-18T00:00:00.000Z,https://doc.wi.gov/Pages/OffenderInformation/AdultInstitutions/AdultFacilities.aspx,MAXIMUM,541,0.0154248652162,1.5164378318e-05,259347.0859375,1945.25772607974,"55","021","970400","55021970400","9704",Census Tract 9704,G5020,S,34266983,4295143,"+43.5533930","-089.4817003",WI,-89.48969737394,43.5662353392052,,"1"
1816,1416,"10003834",MICHIGAN REFORMATORY,1342 W MAIN ST,IONIA,MI,"48846",NOT AVAILABLE,(616) 527-2500,STATE,OPEN,1193,IONIA,"26067",USA,"922140",CORRECTIONAL INSTITUTIONS,"http://www.michigan.gov/corrections/0,4551,7-119-1441---,00.html",12/31/2016,IMAGERY,2017-12-06T00:00:00.000Z,"http://www.michigan.gov/corrections/0,4551,7-119-68854_1381_1385---,00.html",CLOSE,1337,0.0124123942186,7.95353758e-06,134711.44140625,1612.77740595951,"26","067","032100","26067032100","321",Census Tract 321,G5020,S,15568486,680948,"+42.9640599","-085.1093269",MI,-85.0941814357653,42.9758265559242,"1","3"
1817,1417,"10006595",NORFOLK REGIONAL CENTER,1700 N VICTORY ROAD,NORFOLK,NE,"68702","1209",(402) 370-3400,STATE,OPEN,-999,MADISON,"31119",USA,"922140",CORRECTIONAL INSTITUTIONS,http://dhhs.ne.gov/behavioral_health/Pages/beh_rc_nrcserv.aspx,12/14/2017,IMAGERY,2017-12-14T00:00:00.000Z,http://dhhs.ne.gov/behavioral_health/Pages/beh_rc_nrcserv.aspx,NOT AVAILABLE,120,0.00602398016703,1.587941208e-06,26500.328125,780.147282849318,"31","119","960600","31119960600","9606",Census Tract 9606,G5020,S,16904551,0,"+42.0431155","-097.3852666",NE,-97.3841650605934,42.0509580034699,,"1"
1818,1418,"10004118",NH STATE PRISON FOR MEN,281 N STATE ST,CONCORD,NH,"03302",NOT AVAILABLE,(603) 271-1801,STATE,OPEN,1412,MERRIMACK,"33013",USA,"922140",CORRECTIONAL INSTITUTIONS,https://www.nh.gov/nhdoc/facilities/index.html,7/1/2017,IMAGERY,2017-12-14T00:00:00.000Z,https://www.nh.gov/nhdoc/facilities/index.html,MAXIMUM,1205,0.0142601220676,7.769789676e-06,132140.46875,1816.18295558576,"33","013","032600","33013032600","326",Census Tract 326,G5020,S,14201645,2083068,"+43.2264912","-071.5751980",NH,-71.5588179560643,43.2271084896493,,"3"
1819,1419,"10003824",MUSKEGON CORRECTIONAL FACILITY,2400 S SHERIDAN DR,MUSKEGON,MI,"49442",NOT AVAILABLE,(231) 773-3201,STATE,OPEN,1297,MUSKEGON,"26121",USA,"922140",CORRECTIONAL INSTITUTIONS,"http://www.michigan.gov/corrections/0,4551,7-119-1441---,00.html",12/31/2016,IMAGERY/OTHER,2017-12-06T00:00:00.000Z,"http://www.michigan.gov/corrections/0,4551,7-119-68854_1381_1385---,00.html",MEDIUM,1321,0.0209760084961,1.7337135184e-05,294770.05078125,2578.734091525,"26","121","000402","26121000402","4.02",Census Tract 4.02,G5020,S,5956593,1520,"+43.2113094","-086.2022528",MI,-86.1788551685351,43.2101680185964,"5","3"
1820,1420,"10001451",GILCHRIST COUNTY JAIL,9239 S US HWY 129,TRENTON,FL,"32693",NOT AVAILABLE,(352) 463-3490,COUNTY,OPEN,10,GILCHRIST,"12041",USA,"922140",CORRECTIONAL INSTITUTIONS,http://www.gcso.us/,2/21/2018,IMAGERY,2018-02-21T00:00:00.000Z,http://www.gcso.us/,MAXIMUM,-999,0.00188677764929,1.38996281e-07,1981.017578125,225.496012870608,"12","041","950204","12041950204","9502.04",Census Tract 9502.04,G5020,S,145952817,1449477,"+29.6452541","-082.8155766",FL,-82.8187482308513,29.6023961199833,"1","1"
1821,1421,"10006720",ESCAMBIA COUNTY WORK RELEASE FACILITY,1211 W. FAIRFIELD DR,PENSACOLA,FL,"32501",NOT AVAILABLE,(850) 595-4419,COUNTY,OPEN,267,ESCAMBIA,"12033",USA,"922140",CORRECTIONAL INSTITUTIONS,https://myescambia.com/our-services/corrections,2/20/2018,IMAGERY,2018-02-21T00:00:00.000Z,https://myescambia.com/our-services/corrections,NOT AVAILABLE,-999,0.00266212727177,4.22598315e-07,6074.384765625,317.270551214782,"12","033","001600","12033001600","16",Census Tract 16,G5020,S,2313544,3051,"+30.4409358","-087.2305399",FL,-87.2321966875065,30.4444997388187,"6","5"
1822,1422,"10006670",MARTIN HALL JUVENILE DETENTION FACILITY,201 SOUTH PINE STREET,MEDICAL LAKE,WA,"99022",NOT AVAILABLE,(509) 299-7733,STATE,OPEN,13,SPOKANE,"53063",USA,"922140",CORRECTIONAL INSTITUTIONS,http://www.cccscorp.com/programs/mhall/,8/10/2016,IMAGERY/OTHER,2018-01-18T00:00:00.000Z,http://www.cccscorp.com/programs/mhall/,JUVENILE,68,0.0027409974967,3.25969159e-07,5987.1953125,373.307412366973,"53","063","013900","53063013900","139",Census Tract 139,G5020,S,39234223,5740639,"+47.5438426","-117.6671406",WA,-117.695990097317,47.5709403012275,,"2"
1823,1423,"10004121",NH CORRECTIONAL FACILITY FOR WOMEN,317 MAST RD,GOFFSTOWN,NH,"03045",NOT AVAILABLE,(603) 668-6137,STATE,OPEN,162,HILLSBOROUGH,"33011",USA,"922140",CORRECTIONAL INSTITUTIONS,https://www.nh.gov/nhdoc/facilities/index.html,7/1/2017,IMAGERY,2017-12-14T00:00:00.000Z,https://www.nh.gov/nhdoc/facilities/index.html,CLOSE,105,0.00611634785031,1.435489734e-06,24326.94140625,754.251478885666,"33","011","002800","33011002800","28",Census Tract 28,G5020,S,18280337,394810,"+42.9974717","-071.5377193",NH,-71.539626870853,43.0102726274093,"1","1"
1824,1424,"10004583",FLAGLER COUNTY DETENTION FACILITY,1002 JUSTICE LANE,BUNNELL,FL,"32110",NOT AVAILABLE,(386) 437-4116,COUNTY,OPEN,219,FLAGLER,"12035",USA,"922140",CORRECTIONAL INSTITUTIONS,http://www.flaglersheriff.com/divisions/court-and-correction,2/21/2018,IMAGERY,2018-02-21T00:00:00.000Z,http://www.flaglersheriff.com/divisions/court-and-correction,NOT AVAILABLE,400,0.00464479689052,1.338041659e-06,19041.958984375,553.354813967285,"12","035","060207","12035060207","602.07",Census Tract 602.07,G5020,S,293697372,2912295,"+29.3456542","-081.2418371",FL,-81.2561790160137,29.4524610300751,"7","1"
1825,1425,"10003835",CLINTON COUNTY JAIL,1347 E TOWNSEND RD,ST. JOHNS,MI,"48879",NOT AVAILABLE,(989) 227-6580,COUNTY,OPEN,182,CLINTON,"26037",USA,"922140",CORRECTIONAL INSTITUTIONS,https://www.clinton-county.org/241/Sheriffs-Office,3/20/2018,IMAGERY,2018-03-20T00:00:00.000Z,https://www.clinton-county.org/241/Sheriffs-Office,NOT AVAILABLE,236,0.00432169156225,5.80895039e-07,9840.8671875,536.671069905459,"26","037","010901","26037010901","109.01",Census Tract 109.01,G5020,S,78243584,50024,"+42.9789853","-084.5363518",MI,-84.5343390269575,42.988866741823,,"1"
1826,1426,"10004688",WOODFORD COUNTY CORRECTIONAL FACILITY,111 EAST COURT STREET,EUREKA,IL,"61530",NOT AVAILABLE,(309) 467-2116,COUNTY,OPEN,-999,WOODFORD,"17203",USA,"922140",CORRECTIONAL INSTITUTIONS,http://www.ilsheriff.org/index.php/directory,3/5/2018,IMAGERY,2018-03-05T00:00:00.000Z,http://www.woodford-county.org/215/Corrections,NOT AVAILABLE,86,0.00279667208019,3.33943131e-07,5460.2734375,370.789891112061,"17","203","030601","17203030601","306.01",Census Tract 306.01,G5020,S,107361660,157898,"+40.7206345","-089.2458431",IL,-89.2720091155638,40.7224067592903,,"1"
1827,1427,"10004116",NORTHERN NH CORRECTIONAL FACILITY,138 EAST MILAN RD,BERLIN,NH,"03570",NOT AVAILABLE,(603) 752-2906,STATE,OPEN,641,COOS,"33007",USA,"922140",CORRECTIONAL INSTITUTIONS,"https://www.nh.gov/nhdoc/facilities/index.html, https://www.nh.gov/nhdoc/divisions/publicinformation/index.html",7/1/2017,IMAGERY,2017-12-14T00:00:00.000Z,https://www.nh.gov/nhdoc/facilities/index.html,CLOSE,662,0.0119735036576,5.106644808e-06,88742.5546875,1545.21829102786,"33","007","950600","33007950600","9506",Census Tract 9506,G5020,S,17836698,752097,"+44.4884299","-071.1564285",NH,-71.1450772954245,44.5128499599324,"2","3"
1828,1428,"10001001",FOX LAKE CORRECTIONAL INSTITUTION,W 10237 LAKE EMILY RD,FOX LAKE,WI,"53933","0147",(920) 928-3151,STATE,OPEN,1306,DODGE,"55027",USA,"922140",CORRECTIONAL INSTITUTIONS,https://doc.wi.gov/Pages/DataResearch/DataAndReports.aspx,1/12/2018,IMAGERY,2018-01-18T00:00:00.000Z,https://doc.wi.gov/Pages/OffenderInformation/AdultInstitutions/AdultFacilities.aspx,MEDIUM,979,0.023258625395,3.8804087873e-05,664176.296875,3081.20564679808,"55","027","960500","55027960500","9605",Census Tract 9605,G5020,S,88399953,14226397,"+43.5990044","-088.9373438",WI,-88.9120734250287,43.6145568936741,,"1"
1829,1429,"10001341",NEWBERRY CORRECTIONAL FACILITY,13747 E. COUNTY ROAD 428,NEWBERRY,MI,"49868",NOT AVAILABLE,(906) 293-6200,STATE,OPEN,1098,LUCE,"26095",USA,"922140",CORRECTIONAL INSTITUTIONS,"http://www.michigan.gov/corrections/0,4551,7-119-1441---,00.html",12/31/2016,IMAGERY,2017-12-06T00:00:00.000Z,"http://www.michigan.gov/corrections/0,4551,7-119-68854_1381_1385---,00.html",MEDIUM,1108,0.0130472532777,9.372555016e-06,168204.63671875,1739.2621137938,"26","095","960100","26095960100","9601",Census Tract 9601,G5020,S,675580507,10509351,"+46.3987452","-085.4449347",MI,-85.5077348623387,46.3304537342107,"1","1"
1830,1430,"10000523",HENDRY COUNTY JAIL,101 S BRIDGE ST,LABELLE,FL,"33935",NOT AVAILABLE,NOT AVAILABLE,COUNTY,OPEN,257,HENDRY,"12051",USA,"922140",CORRECTIONAL INSTITUTIONS,http://www.hendrysheriff.org/,2/21/2018,IMAGERY,2018-02-21T00:00:00.000Z,http://www.hendrysheriff.org/,MAXIMUM,-999,0.00327990659429,5.98094388e-07,8300.623046875,391.072018830447,"12","051","000402","12051000402","4.02",Census Tract 4.02,G5020,S,33278179,3063464,"+26.7435667","-081.4678386",FL,-81.4364883258934,26.760392436958,,"1"
1831,1431,"10000992",GREEN BAY CORRECTIONAL INSTITUTION,2833 RIVERSIDE DR,GREEN BAY,WI,"54307","9033",(920) 432-4877,STATE,OPEN,1096,BROWN,"55009",USA,"922140",CORRECTIONAL INSTITUTIONS,https://doc.wi.gov/Pages/DataResearch/DataAndReports.aspx,1/12/2018,IMAGERY,2018-01-18T00:00:00.000Z,https://doc.wi.gov/Pages/OffenderInformation/AdultInstitutions/AdultFacilities.aspx,MAXIMUM,749,0.0171828429634,1.4239498651e-05,247269.63671875,2145.50962827114,"55","009","021100","55009021100","211",Census Tract 211,G5020,S,210104,0,"+44.4704276","-088.0366393",WI,-88.035449413797,44.4699100700506,,"1"
1832,1432,"10001458",GLADES COUNTY DETENTION CENTER,1297 EAST STATE ROAD 78,MOORE HAVEN,FL,"33471",NOT AVAILABLE,(863) 946-1600,COUNTY,OPEN,63,GLADES,"12043",USA,"922140",CORRECTIONAL INSTITUTIONS,http://www.gladessheriff.org/?page=1&pageid=2,2/21/2018,IMAGERY,2018-02-21T00:00:00.000Z,http://www.gladessheriff.org/?page=1&pageid=2,MAXIMUM,546,0.00703982009458,2.091005605e-06,29039.9140625,836.046215074088,"12","043","000300","12043000300","3",Census Tract 3,G5020,S,713122847,10936178,"+27.0399248","-081.1770999",FL,-81.1244130342354,26.8385253680157,"3","2"
1833,1433,"10001447",GULF COUNTY JAIL,1000 CECIL G COSTIN SR BLVD,PORT SAINT JOE,FL,"32456",NOT AVAILABLE,(850) 227-1124,COUNTY,OPEN,42,GULF,"12045",USA,"922140",CORRECTIONAL INSTITUTIONS,http://www.dc.state.fl.us/pub/jails/,2/21/2018,IMAGERY,2018-02-21T00:00:00.000Z,http://dos.myflorida.com/library-archives/research/florida-information/government/local-resources/county-jails-and-inmate-searches/,MAXIMUM,-999,0.0031062246789,5.5546074e-07,7933.341796875,377.097107961507,"12","045","960300","12045960300","9603",Census Tract 9603,G5020,S,570497197,134056531,"+29.8243304","-085.2028016",FL,-85.2898630820548,29.8145008233002,,"2"
1834,1434,"10005712",SOCORRO COUNTY DETENTION CENTER,1001 GREFCO RD,SOCORRO,NM,"87801",NOT AVAILABLE,(575) 835-0945,COUNTY,OPEN,70,SOCORRO,"35053",USA,"922140",CORRECTIONAL INSTITUTIONS,"http://www.socorrocounty.net/departments/detention, https://www.nmlegis.gov/handouts/CCJ%20052716%20Item%203%20NM%20County%20Jails%20An%20Overview.pdf",5/27/2016,IMAGERY,2018-04-09T00:00:00.000Z,http://www.socorrocounty.net/departments/detention,NOT AVAILABLE,90,0.00242245878871,2.39986657e-07,3588.37109375,298.230931939699,"35","053","978301","35053978301","9783.01",Census Tract 9783.01,G5020,S,170854666,25853,"+34.0235851","-106.9597599",NM,-106.922689158451,34.027972619446,,"1"
1835,1435,"10004566",HAMILTON COUNTY JAIL,3995 COUNTY ROUTE 51 NORTH,JASPER,FL,"32052",NOT AVAILABLE,(386) 792-7130,COUNTY,OPEN,50,HAMILTON,"12047",USA,"922140",CORRECTIONAL INSTITUTIONS,http://hamiltonsheriff.com/index.htm,2/21/2018,IMAGERY,2018-02-21T00:00:00.000Z,http://hamiltonsheriff.com/index.htm,NOT AVAILABLE,-999,0.00295273415805,3.01849759e-07,4342.40625,353.532496018969,"12","047","960100","12047960100","9601",Census Tract 9601,G5020,S,658855538,2557636,"+30.4972554","-082.9056706",FL,-82.9415024865024,30.526335398138,"1","5"
1836,1436,"10000493",HARDEE COUNTY DETENTION FACILITY,900 E SUMMIT ST,WAUCHULA,FL,"33873",NOT AVAILABLE,(863) 767-0942,COUNTY,OPEN,118,HARDEE,"12049",USA,"922140",CORRECTIONAL INSTITUTIONS,"http://www.dc.state.fl.us/pub/jails/, http://www.hardeeso.com/departments/index.html",2/21/2018,IMAGERY,2018-02-21T00:00:00.000Z,http://www.hardeeso.com/departments/index.html,MAXIMUM,190,0.00413132385685,8.2843987e-07,11578.2890625,489.178791190645,"12","049","970400","12049970400","9704",Census Tract 9704,G5020,S,410469838,408719,"+27.4342821","-081.9357662",FL,-81.8019011357106,27.5430438073595,"1","1"
1837,1437,"10002754",LYLE B MEDLOCK RESIDENTIAL TREATMENT CENTER,1508-B EAST LANGDON RD,DALLAS,TX,"75241",NOT AVAILABLE,NOT AVAILABLE,COUNTY,OPEN,161,DALLAS,"48113",USA,"922140",CORRECTIONAL INSTITUTIONS,http://www.dallascounty.org/department/juvenile/institutiional.php,4/26/2018,IMAGERY,2018-04-26T00:00:00.000Z,http://www.dallascounty.org/department/juvenile/institutiional.php,JUVENILE,96,0.00478905466461,1.065504485e-06,15684.9453125,575.435488203485,"48","113","016902","48113016902","169.02",Census Tract 169.02,G5020,S,25139276,1817916,"+32.6469938","-096.7003825",TX,-96.7065593391238,32.668137127243,,"3"
1838,1438,"10000267",OAKS CORRECTIONAL FACILITY,1500 CABERFAE HWY,MANISTEE,MI,"49660",NOT AVAILABLE,(231) 723-8272,STATE,OPEN,1039,MANISTEE,"26101",USA,"922140",CORRECTIONAL INSTITUTIONS,"http://www.michigan.gov/corrections/0,4551,7-119-1441---,00.html",12/31/2016,IMAGERY,2017-12-06T00:00:00.000Z,"http://www.michigan.gov/corrections/0,4551,7-119-68854_1381_1385---,00.html",CLOSE,1060,0.015778499105,1.3826430676e-05,239179.8359375,1978.40895530946,"26","101","000500","26101000500","5",Census Tract 5,G5020,S,363249353,6469839,"+44.2988929","-086.0292984",MI,-86.2700159320772,44.2457089874724,"4","1"
1839,1439,"10000998",KETTLE MORAINE CORRECTIONAL INSTITUTION,W9071 FOREST DR,PLYMOUTH,WI,"53073",NOT AVAILABLE,(920) 526-3244,STATE,OPEN,1174,SHEBOYGAN,"55117",USA,"922140",CORRECTIONAL INSTITUTIONS,https://doc.wi.gov/Pages/DataResearch/DataAndReports.aspx,1/12/2018,IMAGERY,2018-01-18T00:00:00.000Z,https://doc.wi.gov/Pages/OffenderInformation/AdultInstitutions/AdultFacilities.aspx,MEDIUM,783,0.0227295509191,3.0112393316e-05,516312.48046875,2989.11506616,"55","117","010400","55117010400","104",Census Tract 104,G5020,S,190565509,3483743,"+43.8005415","-088.0912212",WI,-88.1503983919994,43.719819375596,,"1"
1840,1440,"10001347",OJIBWAY CORRECTIONAL FACILITY,N 5705 OJIBWAY RD,MARENISCO,MI,"49947","9771",(906) 787-2217,STATE,OPEN,1112,GOGEBIC,"26053",USA,"922140",CORRECTIONAL INSTITUTIONS,"http://www.michigan.gov/corrections/0,4551,7-119-1441---,00.html",12/31/2016,IMAGERY,2017-12-06T00:00:00.000Z,"http://www.michigan.gov/corrections/0,4551,7-119-68854_1381_1385---,00.html",MINIMUM,1142,0.0119314700696,8.31596332e-06,149174.71875,1610.64119920376,"26","053","950100","26053950100","9501",Census Tract 9501,G5020,S,1183103354,68621896,"+46.2974099","-089.3488416",MI,-89.7065064907281,46.3056249183755,,"1"
1841,1441,"10006596",NORTH END TRANSITIONAL HOUSING UNIT / WORK CENTER,1 PERIMETER ROAD,CONCORD,NH,"03302",NOT AVAILABLE,(603) 271-3957,STATE,OPEN,45,MERRIMACK,"33013",USA,"922140",CORRECTIONAL INSTITUTIONS,https://www.nh.gov/nhdoc/facilities/index.html,7/1/2017,IMAGERY/OTHER,2017-12-14T00:00:00.000Z,https://www.nh.gov/nhdoc/facilities/index.html,MINIMUM,48,0.00129915878145,7.0507539e-08,1199.09375,166.707257733544,"33","013","032600","33013032600","326",Census Tract 326,G5020,S,14201645,2083068,"+43.2264912","-071.5751980",NH,-71.555647421853,43.2258265577544,,"3"
1842,1442,"10006135",ADAMS COUNTY JAIL,911 W PEACEKEEPERS WAY,DECATUR,IN,"46733","0608",(260) 724-5345,COUNTY,OPEN,-999,ADAMS,"18001",USA,"922140",CORRECTIONAL INSTITUTIONS,https://www.co.adams.in.us/186/Sheriffs-Department,3/5/2018,IMAGERY,2018-03-05T00:00:00.000Z,https://www.co.adams.in.us/186/Sheriffs-Department,NOT AVAILABLE,-999,0.00379922177657,8.86099469e-07,14507.58984375,481.876259493961,"18","001","030300","18001030300","303",Census Tract 303,G5020,S,24641573,52005,"+40.8151602","-084.9116931",IN,-84.9302594969117,40.8096938887324,"10","1"
1843,1443,"10004897",ALLEN COUNTY WORK RELEASE CENTER,12103 LIMA RD,FORT WAYNE,IN,"46818",NOT AVAILABLE,(260) 449-7453,COUNTY,OPEN,83,ALLEN,"18003",USA,"922140",CORRECTIONAL INSTITUTIONS,http://www.allencountysheriff.org/,6/28/2017,IMAGERY,2018-03-05T00:00:00.000Z,http://www.allencountysheriff.org/,MINIMUM,104,0.00867396658703,2.003944e-06,33001.1953125,1107.61824184146,"18","003","010307","18003010307","103.07",Census Tract 103.07,G5020,S,5852603,23944,"+41.1856653","-085.1787113",IN,-85.1697519670459,41.1938051486335,,"1"
1844,1444,"10001007",MILWAUKEE SECURE DETENTION FACILITY,1015 N 10TH ST,MILWAUKEE,WI,"53205","0740",(414) 212-3535,STATE,OPEN,1093,MILWAUKEE,"55079",USA,"922140",CORRECTIONAL INSTITUTIONS,https://doc.wi.gov/Pages/DataResearch/DataAndReports.aspx,1/12/2018,IMAGERY/OTHER,2018-01-18T00:00:00.000Z,https://doc.wi.gov/Pages/OffenderInformation/AdultInstitutions/AdultFacilities.aspx,MEDIUM,1040,0.00360105546515,7.45073104e-07,12633.51171875,472.917339082598,"55","079","186300","55079186300","1863",Census Tract 1863,G5020,S,1192482,35023,"+43.0408345","-087.9174316",WI,-87.9249296910288,43.0438935245123,"2","2"
1845,1445,"10000466",HERNANDO COUNTY DETENTION CENTER,16425 SPRING HILL DR,BROOKSVILLE,FL,"34604",NOT AVAILABLE,(352) 544-2334,COUNTY,OPEN,632,HERNANDO,"12053",USA,"922140",CORRECTIONAL INSTITUTIONS,"http://www.dc.state.fl.us/pub/jails/, http://www.hernandosheriff.org/jail/",2/21/2018,IMAGERY,2018-02-21T00:00:00.000Z,http://www.hernandosheriff.org/jail/,MAXIMUM,744,0.00493147816439,1.410640521e-06,19888.103515625,584.98440243513,"12","053","040911","12053040911","409.11",Census Tract 409.11,G5020,S,22923070,134623,"+28.4711974","-082.4579738",FL,-82.4514055584058,28.4837287552647,,"2"
1846,1446,"10000491",HIGHLANDS COUNTY DETENTION FACILITY,338 S ORANGE ST,SEBRING,FL,"33870",NOT AVAILABLE,(863) 402-7201,COUNTY,OPEN,424,HIGHLANDS,"12055",USA,"922140",CORRECTIONAL INSTITUTIONS,http://www.dc.state.fl.us/pub/jails/,2/21/2018,IMAGERY,2018-02-21T00:00:00.000Z,http://www.highlandssheriff.org/index.php,MAXIMUM,-999,0.00429190695396,1.022271086e-06,14280.857421875,504.777686171334,"12","055","960800","12055960800","9608",Census Tract 9608,G5020,S,2521678,1511211,"+27.5027312","-081.4490529",FL,-81.4359277784754,27.4935239417205,,"1"
1847,1447,"10000482",HILLSBOROUGH COUNTY JAIL DIVISION III,1301 N MORGAN ST,TAMPA,FL,"33602",NOT AVAILABLE,NOT AVAILABLE,COUNTY,CLOSED,0,HILLSBOROUGH,"12057",USA,"922140",CORRECTIONAL INSTITUTIONS,"https://florida.hometownlocator.com/maps/feature-map,ftc,3,fid,2333800,n,hillsborough%20county%20sheriff's%20office%20jail%20division%20iii.cfm",2/15/2016,UNVERIFIED,2018-02-21T00:00:00.000Z,NOT AVAILABLE,MAXIMUM,-999,0.00494456155117,1.4535695e-06,20392.26953125,579.331274553723,"12","057","005101","12057005101","51.01",Census Tract 51.01,G5020,S,1866372,140886,"+27.9484920","-082.4568348",FL,-82.4573235065213,27.9558624971093,"2","1"
1848,1448,"10001353",CRAWFORD COUNTY JAIL,200 W MICHIGAN AVE,GRAYLING,MI,"49738",NOT AVAILABLE,(989) 348-4822,COUNTY,OPEN,65,CRAWFORD,"26039",USA,"922140",CORRECTIONAL INSTITUTIONS,http://www.crawfordsheriff.org/homepage.htm,3/20/2018,IMAGERY,2018-03-20T00:00:00.000Z,http://www.crawfordsheriff.org/homepage.htm,MAXIMUM,51,0.00402500293018,4.2088819e-07,7332.671875,519.934516641815,"26","039","960200","26039960200","9602",Census Tract 9602,G5020,S,114158922,8752584,"+44.7008389","-084.7737915",MI,-84.7165836220498,44.6600187551569,,"2"
1849,1449,"10005703",TAOS COUNTY JUVENILE DETENTION CENTER,"105 ALBRIGHT ST, SUITE P",TAOS,NM,"87571",NOT AVAILABLE,(575) 737-6420,COUNTY,OPEN,16,TAOS,"35055",USA,"922140",CORRECTIONAL INSTITUTIONS,https://www.taoscounty.org/index.php/services/juvenile-detention-center,4/9/2018,IMAGERY,2018-04-09T00:00:00.000Z,https://www.taoscounty.org/index.php/services/juvenile-detention-center,JUVENILE,18,0.00350851111147,4.66769915e-07,7186.09375,424.995873851187,"35","055","952600","35055952600","9526",Census Tract 9526,G5020,S,66361363,0,"+36.3603796","-105.6529445",NM,-105.575652929949,36.3975621697381,,"2"
1850,1450,"10001386",PARNALL CORRECTIONAL FACILITY,1780 E PARNALL RD,JACKSON,MI,"49201",NOT AVAILABLE,(517) 780-6004,STATE,OPEN,1675,JACKSON,"26075",USA,"922140",CORRECTIONAL INSTITUTIONS,"http://www.michigan.gov/corrections/0,4551,7-119-1441---,00.html",12/31/2016,IMAGERY/OTHER,2017-12-06T00:00:00.000Z,"http://www.michigan.gov/corrections/0,4551,7-119-68854_1381_1385---,00.html",MINIMUM,1695,0.0337967030429,2.4107707775e-05,403867.22265625,4130.43687150294,"26","075","005800","26075005800","58",Census Tract 58,G5020,S,2383646,2914,"+42.2958029","-084.3894236",MI,-84.3882782406004,42.2935485207355,,"5"
1851,1451,"10000266",PUGSLEY CORRECTIONAL FACILITY,7401 EAST WALTON RD,KINGSLEY,MI,"49649",NOT AVAILABLE,(231) 263-5253,STATE,CLOSED,0,GRAND TRAVERSE,"26055",USA,"922140",CORRECTIONAL INSTITUTIONS,"http://www.michigan.gov/corrections/0,4551,7-119-68854_1381_1385---,00.html",9/24/2016,IMAGERY,2017-12-06T00:00:00.000Z,"http://michigan.gov/corrections/0,4551,7-119-68854_1381_1385-5259--,00.html",MINIMUM,1344,0.0131513630196,1.0851449949e-05,188673.3046875,1729.12701468976,"26","055","550300","26055550300","5503",Census Tract 5503,G5020,S,325539098,4506545,"+44.5484406","-085.5996279",MI,-85.4279151104032,44.543246032499,,"1"
1852,1452,"10004122",JOHN H. SUNUNU YOUTH SERVICES CENTER,1056 N RIVER RD,MANCHESTER,NH,"03104",NOT AVAILABLE,NOT AVAILABLE,STATE,OPEN,60,HILLSBOROUGH,"33011",USA,"922140",CORRECTIONAL INSTITUTIONS,https://www.dhhs.nh.gov/djjs/institutional/documents/prea-audit-summary.pdf,8/8/2014,IMAGERY/OTHER,2017-12-14T00:00:00.000Z,https://www.dhhs.nh.gov/djjs/institutional/index.htm,JUVENILE,144,0.0186468955952,5.401389916e-06,91548.94921875,2373.91446262384,"33","011","000102","33011000102","1.02",Census Tract 1.02,G5020,S,4386233,281848,"+43.0281489","-071.4662260",NH,-71.4720817911589,43.0187994011986,,"1"
1853,1453,"10000483","HILLSBOROUGH COUNTY JAIL, FALKENBURG ROAD",520 N FALKENBURG RD,TAMPA,FL,"33619",NOT AVAILABLE,(813) 247-8300,COUNTY,OPEN,2155,HILLSBOROUGH,"12057",USA,"922140",CORRECTIONAL INSTITUTIONS,http://www.hcso.tampa.fl.us/Departments/Department-of-Detention-Services.aspx,2/21/2018,IMAGERY,2018-02-21T00:00:00.000Z,http://www.hcso.tampa.fl.us/Departments/Department-of-Detention-Services.aspx,MAXIMUM,3072,0.0219397948245,1.9622012438e-05,275290.99609375,2623.54904954288,"12","057","012211","12057012211","122.11",Census Tract 122.11,G5020,S,9679178,126831,"+27.9617855","-082.3442931",FL,-82.3376654215502,27.9605107833619,"1","6"
1854,1454,"10006597",CONCORD TRANSITIONAL WORK CENTER,275 NORTH STATE STREET,CONCORD,NH,"03302",NOT AVAILABLE,(603) 271-1924,STATE,OPEN,153,MERRIMACK,"33013",USA,"922140",CORRECTIONAL INSTITUTIONS,https://www.nh.gov/nhdoc/facilities/index.html,7/1/2017,UNVERIFIED,2017-12-14T00:00:00.000Z,https://www.nh.gov/nhdoc/facilities/index.html,MINIMUM,130,0.00226746918624,2.22351374e-07,3781.41796875,286.707496838553,"33","013","032600","33013032600","326",Census Tract 326,G5020,S,14201645,2083068,"+43.2264912","-071.5751980",NH,-71.5550902640427,43.2254355214709,,"3"
1855,1455,"10006389",CALUMET TRANSITIONAL HOUSING UNIT,126 LOWELL STREET,MANCHESTER,NH,"03104",NOT AVAILABLE,(603) 271-1928,STATE,OPEN,69,HILLSBOROUGH,"33011",USA,"922140",CORRECTIONAL INSTITUTIONS,https://www.nh.gov/nhdoc/facilities/index.html,7/1/2017,IMAGERY,2017-12-14T00:00:00.000Z,https://www.nh.gov/nhdoc/facilities/index.html,MINIMUM,64,0.0010725958633,7.3195961e-08,1240.1015625,144.013942131105,"33","011","001400","33011001400","14",Census Tract 14,G5020,S,488562,0,"+42.9874112","-071.4595137",NH,-71.4586977032637,42.9938823043642,,"1"
1856,1456,"10001737",SHEA FARM TRANSITIONAL HOUSING UNIT,60 IRON WORKS RD,CONCORD,NH,"03302",NOT AVAILABLE,(603) 271-6368,STATE,OPEN,49,MERRIMACK,"33013",USA,"922140",CORRECTIONAL INSTITUTIONS,https://www.nh.gov/nhdoc/facilities/index.html,7/1/2017,IMAGERY,2017-12-14T00:00:00.000Z,https://www.nh.gov/nhdoc/facilities/index.html,MINIMUM,40,0.00180976240699,1.55406238e-07,2640.94921875,244.126990890735,"33","013","032100","33013032100","321",Census Tract 321,G5020,S,4338900,36041,"+43.1854102","-071.5404665",NH,-71.5518074410117,43.1800279395047,"1","1"
1857,1457,"10001003",OAKHILL CORRECTIONAL INSTITUTION,5212 COUNTY HWY M,OREGON,WI,"53575","0140",(608) 835-3101,STATE,OPEN,721,DANE,"55025",USA,"922140",CORRECTIONAL INSTITUTIONS,https://doc.wi.gov/Pages/DataResearch/DataAndReports.aspx,1/12/2018,IMAGERY,2018-01-18T00:00:00.000Z,https://doc.wi.gov/Pages/OffenderInformation/AdultInstitutions/AdultFacilities.aspx,MINIMUM,344,0.0186476048128,1.636864448e-05,277177.0703125,2432.07633235586,"55","025","012502","55025012502","125.02",Census Tract 125.02,G5020,S,29406508,360653,"+42.9372009","-089.4059846",WI,-89.394253322673,42.9617307280942,,"3"
1858,1458,"10002571",OSHKOSH CORRECTIONAL INSTITUTION,1730 W SNELL RD,OSHKOSH,WI,"54901",NOT AVAILABLE,(920) 231-4010,STATE,OPEN,2031,WINNEBAGO,"55139",USA,"922140",CORRECTIONAL INSTITUTIONS,https://doc.wi.gov/Pages/DataResearch/DataAndReports.aspx,1/12/2018,IMAGERY,2018-01-18T00:00:00.000Z,https://doc.wi.gov/Pages/OffenderInformation/AdultInstitutions/AdultFacilities.aspx,MEDIUM,1494,0.0294558738825,4.3522030583e-05,750658.45703125,3621.56915851354,"55","139","001700","55139001700","17",Census Tract 17,G5020,S,25539499,11250470,"+44.0779637","-088.5912929",WI,-88.5571425848966,44.0716197330506,,"3"
