FID,OBJECTID,FACILITYID,NAME,ADDRESS,CITY,STATE,ZIP,ZIP4,TELEPHONE,TYPE,STATUS,POPULATION,COUNTY,COUNTYFIPS,COUNTRY,NAICS_CODE,NAICS_DESC,SOURCE,SOURCEDATE,VAL_METHOD,VAL_DATE,WEBSITE,SECURELVL,CAPACITY,Shape_Leng,Shape_Area,Shape__Are,Shape__Len,STATEFP,COUNTYFP,TRACTCE,GEOID,CENSUS_TRACT_NAME,NAMELSAD,MTFCC,FUNCSTAT,ALAND,AWATER,INTPTLAT,INTPTLON,x,geometry,
1001,989,10006583,CABARRUS REGIONAL JUVENILE DETENTION CENTER,822 MCWHORTER ROAD,CONCORD,NC,28027,NOT AVAILABLE,(704) 720-0807,STATE,OPEN,-999,CABARRUS,37025,USA,922140,CORRECTIONAL INSTITUTIONS,https://www.ncdps.gov/Juvenile-Justice/Juvenile-Facility-Operations/Juvenile-Detention-Centers,12/12/17,UNVERIFIED,2017-12-12T00:00:00.000Z,https://www.ncdps.gov/Juvenile-Justice/Juvenile-Facility-Operations/Juvenile-Detention-Centers,JUVENILE,30,0.001968788,2.46E-07,3735.3125,244.3505904,37,25,42000,37025042000,420,Census Tract 420,G5020,S,16774875,0,35.3758415,-80.6155081,NC,c(-80.6023877439985, 35.363388433228)
1002,990,10003650,BLACKBURN CORRECTIONAL COMPLEX,3111 SPURR RD,LEXINGTON,KY,40511,NOT AVAILABLE,(859) 246-2366,STATE,OPEN,591,FAYETTE,21067,USA,922140,CORRECTIONAL INSTITUTIONS,https://corrections.ky.gov/about/Pages/ResearchandStatistics.aspx,11/29/17,IMAGERY,2017-12-01T00:00:00.000Z,https://corrections.ky.gov/depts/AI/Pages/default.aspx,MINIMUM,594,0.029853797,4.26E-05,671080.7031,3695.560625,21,67,3701,21067003701,37.01,Census Tract 37.01,G5020,S,83180923,341040,38.0893188,-84.577521,KY,c(-84.5372045261834, 38.113159349729)
1003,991,10001476,MORGAN COUNTY JAIL,300 WEST COURT STREET,JACKSONVILLE,IL,62650,NOT AVAILABLE,(217) 243-4143,COUNTY,OPEN,40,MORGAN,17137,USA,922140,CORRECTIONAL INSTITUTIONS,http://morgancounty-il.com/departments/sheriffs-office/,3/6/17,IMAGERY,2018-03-02T00:00:00.000Z,http://morgancounty-il.com/departments/sheriffs-office/,NOT AVAILABLE,65,0.001731601,1.86E-07,2992.269531,215.0897045,17,137,951700,17137951700,9517,Census Tract 9517,G5020,S,4034361,0,39.7449241,-90.2359585,IL,c(-90.2318633716002, 39.7352352807736)
1004,992,10000205,POLUNSKY PRISON,3872 FM 350 S,LIVINGSTON,TX,77351,NOT AVAILABLE,(936) 967-8082,STATE,OPEN,2904,POLK,48373,USA,922140,CORRECTIONAL INSTITUTIONS,"https://www.texastribune.org/library/data/texas-prisons/units/, http://www.tdcj.state.tx.us/unit_directory/index.html",9/15/16,IMAGERY/OTHER,2018-01-11T00:00:00.000Z,http://www.tdcj.state.tx.us/unit_directory/index.html,MAXIMUM,2984,0.018070561,2.27E-05,327078.3867,2155.116568,48,373,210203,48373210203,2102.03,Census Tract 2102.03,G5020,S,30096769,3381697,30.7248147,-95.0118864,TX,c(-95.0147478953749, 30.6985564176018)
1005,993,10000996,WINNEBAGO COUNTY WORK RELEASE CENTER,90 W COUNTY RD Y,OSHKOSH,WI,54901,NOT AVAILABLE,NOT AVAILABLE,COUNTY,CLOSED,0,WINNEBAGO,55139,USA,922140,CORRECTIONAL INSTITUTIONS,https://www.co.winnebago.wi.us/sheriff/corrections-division,5/9/18,IMAGERY,2018-05-09T00:00:00.000Z,NOT AVAILABLE,MINIMUM,210,0.003132005,5.80E-07,10012.41016,410.124698,55,139,1700,55139001700,17,Census Tract 17,G5020,S,25539499,11250470,44.0779637,-88.5912929,WI,c(-88.5441379075063, 44.0836259067607)
1006,994,10000920,CHARLES COUNTY DETENTION CENTER / ANNEX,6905 CRAIN HWY,LA PLATA,MD,20646,NOT AVAILABLE,NOT AVAILABLE,COUNTY,OPEN,333,CHARLES,24017,USA,922140,CORRECTIONAL INSTITUTIONS,http://dlslibrary.state.md.us/publications/JCR/2016/2016_309.pdf,8/30/16,IMAGERY,2018-03-19T00:00:00.000Z,https://www.ccso.us/,NOT AVAILABLE,490,0.009055937,2.25E-06,35703.75391,1103.278845,24,17,851001,24017851001,8510.01,Census Tract 8510.01,G5020,S,17078758,22848,38.5327464,-77.0000423,MD,c(-76.9848983349559, 38.5238995681034)
1007,995,10000110,EASTERN KENTUCKY CORRECTIONAL COMPLEX,200 ROAD TO JUSTICE,WEST LIBERTY,KY,41472,NOT AVAILABLE,(606) 743-2800,STATE,OPEN,1672,MORGAN,21175,USA,922140,CORRECTIONAL INSTITUTIONS,https://corrections.ky.gov/about/Pages/ResearchandStatistics.aspx,11/29/17,IMAGERY,2017-12-01T00:00:00.000Z,https://corrections.ky.gov/depts/AI/Pages/default.aspx,MEDIUM,1674,0.016348611,1.16E-05,182363.8555,1987.162216,21,175,950400,21175950400,9504,Census Tract 9504,G5020,S,123066214,969954,37.8933925,-83.2233795,KY,c(-83.2693099568385, 37.9038891107805)
1008,996,10000117,GREEN RIVER CORRECTIONAL COMPLEX,1200 RIVER RD,CENTRAL CITY,KY,42330,NOT AVAILABLE,(270) 754-5415,STATE,OPEN,962,MUHLENBERG,21177,USA,922140,CORRECTIONAL INSTITUTIONS,https://corrections.ky.gov/about/Pages/ResearchandStatistics.aspx,11/29/17,IMAGERY,2017-12-01T00:00:00.000Z,https://corrections.ky.gov/depts/AI/Pages/default.aspx,MEDIUM,947,0.016680383,1.54E-05,240286.1602,2116.571794,21,177,960200,21177960200,9602,Census Tract 9602,G5020,S,100018371,3996597,37.3257843,-87.1543609,KY,c(-87.1134167400553, 37.3143803015481)
1009,997,10000121,WESTERN KENTUCKY CORRECTIONAL COMPLEX,374 NEW BETHEL CHURCH RD,FREDONIA,KY,42411,NOT AVAILABLE,(270) 388-9781,STATE,OPEN,677,LYON,21143,USA,922140,CORRECTIONAL INSTITUTIONS,https://corrections.ky.gov/about/Pages/ResearchandStatistics.aspx,11/29/17,IMAGERY,2017-12-01T00:00:00.000Z,https://corrections.ky.gov/depts/AI/Pages/default.aspx,MEDIUM,670,0.014326626,9.16E-06,142342.5898,1772.28479,21,143,960100,21143960100,9601,Census Tract 9601,G5020,S,233634397,24341031,37.0924072,-88.1354755,KY,c(-88.0401480155724, 37.1364597911947)
1010,998,10000106,KENTUCKY CORRECTIONAL INSTITUTION FOR WOMEN,3000 ASH AVE,PEWEE VALLEY,KY,40056,NOT AVAILABLE,(502) 241-8454,STATE,OPEN,719,SHELBY,21211,USA,922140,CORRECTIONAL INSTITUTIONS,https://corrections.ky.gov/about/Pages/ResearchandStatistics.aspx,11/29/17,IMAGERY,2017-12-01T00:00:00.000Z,https://corrections.ky.gov/depts/AI/Pages/default.aspx,MAXIMUM,691,0.016869306,1.07E-05,168995.5469,2084.737874,21,211,40502,21211040502,405.02,Census Tract 405.02,G5020,S,111577004,1983193,38.2666389,-85.3564226,KY,c(-85.4571197207601, 38.2854755973986)
1011,999,10000107,LITTLE SANDY CORRECTIONAL COMPLEX,505 PRISON CONNECTOR,SANDY HOOK,KY,41171,NOT AVAILABLE,(606) 738-6133,STATE,OPEN,1001,ELLIOTT,21063,USA,922140,CORRECTIONAL INSTITUTIONS,https://corrections.ky.gov/about/Pages/ResearchandStatistics.aspx,11/29/17,IMAGERY,2017-12-01T00:00:00.000Z,https://corrections.ky.gov/depts/AI/Pages/default.aspx,MEDIUM,987,0.015813695,1.66E-05,260798.1758,1920.461028,21,63,920100,21063920100,9201,Census Tract 9201,G5020,S,336102284,1383202,38.1386646,-83.1682357,KY,c(-83.0810042244929, 38.1339203321236)
1012,1000,10003647,AUDUBON YOUTH DEVELOPMENT CENTER,8711 LAGRANGE RD,LOUISVILLE,KY,40242,NOT AVAILABLE,(502) 429-7287,STATE,OPEN,41,JEFFERSON,21111,USA,922140,CORRECTIONAL INSTITUTIONS,https://schools.jefferson.kyschools.us/special/sac/audubon.html,12/1/17,IMAGERY,2017-12-01T00:00:00.000Z,https://schools.jefferson.kyschools.us/special/sac/audubon.html,JUVENILE,80,0.007938426,2.55E-06,40310.36328,995.672528,21,111,10005,21111010005,100.05,Census Tract 100.05,G5020,S,2987077,27208,38.2719112,-85.5850573,KY,c(-85.5895922447588, 38.2694511144469)
1013,1001,10000116,NORTHPOINT TRAINING CENTER,710 WALTER REED RD,BURGIN,KY,40310,NOT AVAILABLE,(859) 239-7012,STATE,OPEN,1237,BOYLE,21021,USA,922140,CORRECTIONAL INSTITUTIONS,https://corrections.ky.gov/about/Pages/ResearchandStatistics.aspx,11/29/17,IMAGERY,2017-12-01T00:00:00.000Z,https://corrections.ky.gov/depts/AI/Pages/default.aspx,MEDIUM,1226,0.012795585,1.02E-05,159015.2461,1600.908962,21,21,930100,21021930100,9301,Census Tract 9301,G5020,S,30984369,1123263,37.6862626,-84.7520071,KY,c(-84.7463568131888, 37.7100209207808)
1014,1002,10000102,ROEDERER CORRECTIONAL COMPLEX,P.O. BOX 69,LAGRANGE,KY,40031,NOT AVAILABLE,(502) 222-0170,STATE,OPEN,1209,OLDHAM,21185,USA,922140,CORRECTIONAL INSTITUTIONS,https://corrections.ky.gov/about/Pages/ResearchandStatistics.aspx,11/29/17,IMAGERY,2017-12-01T00:00:00.000Z,https://corrections.ky.gov/depts/AI/Pages/default.aspx,MAXIMUM,1138,0.015403609,7.83E-06,123737.543,1854.371796,21,185,30200,21185030200,302,Census Tract 302,G5020,S,16921933,417139,38.4099243,-85.4320345,KY,c(-85.4297630493541, 38.4031279906084)
1015,1003,10002360,FREDERICK COUNTY ADULT DETENTION CENTER,7300 MARCIE'S CHOICE LN,FREDERICK,MD,21704,NOT AVAILABLE,(301) 600-2550,COUNTY,OPEN,374,FREDERICK,24021,USA,922140,CORRECTIONAL INSTITUTIONS,http://dlslibrary.state.md.us/publications/JCR/2016/2016_309.pdf,8/30/16,IMAGERY,2018-03-19T00:00:00.000Z,https://frederickcountymd.gov/677/Sheriff-Adult-Detention,MAXIMUM,405,0.006145934,1.80E-06,28873.17188,763.3799242,24,21,751003,24021751003,7510.03,Census Tract 7510.03,G5020,S,14194045,33282,39.3871801,-77.396194,MD,c(-77.4122372318628, 39.3658543404829)
1016,1004,10001802,NEW HANOVER REGIONAL JUVENILE DETENTION CENTER,3830 JUVENILE CENTER RD,CASTLE HAYNE,NC,28429,NOT AVAILABLE,(910) 675-0594,STATE,OPEN,-999,NEW HANOVER,37129,USA,922140,CORRECTIONAL INSTITUTIONS,https://www.ncdps.gov/Juvenile-Justice/Juvenile-Facility-Operations/Juvenile-Detention-Centers,12/12/17,IMAGERY,2017-12-12T00:00:00.000Z,https://www.ncdps.gov/Juvenile-Justice/Juvenile-Facility-Operations/Juvenile-Detention-Centers,JUVENILE,18,0.001898814,1.35E-07,2022.148438,233.3545335,37,129,11603,37129011603,116.03,Census Tract 116.03,G5020,S,26459101,154938,34.2987251,-77.8913034,NC,c(-77.8917256692888, 34.3219876819842)
1017,1005,10005047,GREEN RIVER YOUTH DEVELOPMENT CENTER,363 BOY CAMP ROAD,CROMWELL,KY,42333,NOT AVAILABLE,(270) 526-3826,STATE,OPEN,23,BUTLER,21031,USA,922140,CORRECTIONAL INSTITUTIONS,https://djj.ky.gov/Pages/PREA.aspx,4/21/15,IMAGERY,2017-12-01T00:00:00.000Z,https://djj.ky.gov/Facilities/Pages/Youth-Development-Centers.aspx,JUVENILE,40,0.0084747,3.68E-06,57278.58594,1060.990101,21,31,930100,21031930100,9301,Census Tract 9301,G5020,S,233654280,1649164,37.3162232,-86.6220725,KY,c(-86.7367740031218, 37.2899948849165)
1018,1006,10004185,PITT REGIONAL JUVENILE DETENTION CENTER,451 BELVOIR RD,GREENVILLE,NC,27834,NOT AVAILABLE,(252) 830-6590,STATE,OPEN,-999,PITT,37147,USA,922140,CORRECTIONAL INSTITUTIONS,https://www.ncdps.gov/Juvenile-Justice/Juvenile-Facility-Operations/Juvenile-Detention-Centers,12/12/17,IMAGERY,2017-12-12T00:00:00.000Z,https://www.ncdps.gov/Juvenile-Justice/Juvenile-Facility-Operations/Juvenile-Detention-Centers,JUVENILE,18,0.001942918,1.81E-07,2763.933594,236.9768296,37,147,800,37147000800,8,Census Tract 8,G5020,S,27132764,1217040,35.6385498,-77.3659853,NC,c(-77.3778288547514, 35.6406480388936)
1019,1007,10004327,LAKE CUMBERLAND YOUTH DEVELOPMENT CENTER,9000 HIGHWAY 1546,MONTICELLO,KY,42633,NOT AVAILABLE,(606) 348-4201,STATE,OPEN,26,WAYNE,21231,USA,922140,CORRECTIONAL INSTITUTIONS,https://djj.ky.gov/Pages/PREA.aspx,6/16/17,IMAGERY,2017-12-01T00:00:00.000Z,https://djj.ky.gov/Facilities/Pages/Youth-Development-Centers.aspx,JUVENILE,40,0.008725244,2.19E-06,33887.90234,1093.359951,21,231,920400,21231920400,9204,Census Tract 9204,G5020,S,253618957,16558029,36.7443434,-84.9687675,KY,c(-85.018662508968, 36.853090025672)
1020,1008,10005684,OWENSBORO TREATMENT CENTER,3001 LEITCHFIELD ROAD,OWENSBORO,KY,42303,NOT AVAILABLE,(270) 687-7311,STATE,OPEN,21,DAVIESS,21059,USA,922140,CORRECTIONAL INSTITUTIONS,https://djj.ky.gov/Pages/PREA.aspx?Paged=TRUE&p_SortBehavior=0&p_FileLeafRef=Morehead%20YDC%202016%2epdf&p_ID=28&PageFirstRow=31&&View={2A6FDF3C-C8B7-4DC5-9FC3-92531E2BBB46},5/23/15,IMAGERY,2017-12-01T00:00:00.000Z,NOT AVAILABLE,JUVENILE,30,0.011172865,6.88E-06,107872.4609,1449.027196,21,59,1401,21059001401,14.01,Census Tract 14.01,G5020,S,16449838,2392521,37.7766612,-87.0577968,KY,c(-87.063173297118, 37.7568314690374)
1021,1009,10005054,MAYFIELD YOUTH DEVELOPMENT CENTER,3179 STATE ROAD 45 SOUTH,MAYFIELD,KY,42066,NOT AVAILABLE,(270) 247-3237,STATE,OPEN,20,GRAVES,21083,USA,922140,CORRECTIONAL INSTITUTIONS,https://djj.ky.gov/Pages/PREA.aspx,2/22/16,IMAGERY,2017-12-01T00:00:00.000Z,https://djj.ky.gov/Facilities/Pages/Youth-Development-Centers.aspx,JUVENILE,30,0.006215133,2.13E-06,32932.80469,793.6218127,21,83,20200,21083020200,202,Census Tract 202,G5020,S,50876504,530683,36.7033475,-88.6783874,KY,c(-88.6764020931147, 36.7141695036429)
1022,1010,10004312,MOREHEAD YOUTH DEVELOPMENT CENTER,495 FOREST HILLS DR,MOREHEAD,KY,40351,NOT AVAILABLE,(606) 783-8565,STATE,OPEN,6,ROWAN,21205,USA,922140,CORRECTIONAL INSTITUTIONS,https://djj.ky.gov/Pages/PREA.aspx,6/17/16,IMAGERY,2017-12-01T00:00:00.000Z,https://djj.ky.gov/Facilities/Pages/Youth-Development-Centers.aspx,JUVENILE,40,0.01086908,6.72E-06,105990.7461,1329.523325,21,205,950200,21205950200,9502,Census Tract 9502,G5020,S,112832542,978987,38.1940445,-83.4781722,KY,c(-83.4808072615256, 38.1877563344769)
1023,1011,10003639,NORTHERN KENTUCKY YOUTH DEVELOPMENT CENTER,15600 TURNER ROAD,CRITTENDEN,KY,40130,NOT AVAILABLE,(859) 356-3172,STATE,OPEN,24,KENTON,21117,USA,922140,CORRECTIONAL INSTITUTIONS,https://djj.ky.gov/Pages/PREA.aspx?Paged=TRUE&p_SortBehavior=0&p_FileLeafRef=Morehead%20YDC%202016%2epdf&p_ID=28&PageFirstRow=31&&View={2A6FDF3C-C8B7-4DC5-9FC3-92531E2BBB46},5/15/16,IMAGERY,2017-12-01T00:00:00.000Z,https://djj.ky.gov/Facilities/Pages/Youth-Development-Centers.aspx,JUVENILE,40,0.007163034,2.07E-06,32901.07813,863.9988804,21,117,63701,21117063701,637.01,Census Tract 637.01,G5020,S,78999109,834038,38.8373811,-84.565367,KY,c(-84.6058366608075, 38.7980600112821)
1024,1012,10006714,GARFIELD COUNTY COMMUNITY CORRECTIONS FACILITY,0244 COUNTY ROAD 333A,RIFLE,CO,81650,NOT AVAILABLE,(970) 625-0334,COUNTY,OPEN,-999,GARFIELD,8045,USA,922140,CORRECTIONAL INSTITUTIONS,https://www.garfield-county.com/criminal-justice/residential.aspx,2/19/18,IMAGERY/OTHER,2018-02-19T00:00:00.000Z,https://www.garfield-county.com/criminal-justice/residential.aspx,MINIMUM,60,0.00142633,1.25E-07,2004.496094,182.772391,8,45,952002,8045952002,9520.02,Census Tract 9520.02,G5020,S,1064344396,4550086,39.6694299,-107.8585608,CO,c(-107.71635400302, 39.5159116298181)
1025,1013,10003645,BOYD REGIONAL JUVENILE DETENTION CENTER,2420 ROBERTS DR,ASHLAND,KY,41102,NOT AVAILABLE,(606) 920-2085,STATE,OPEN,18,BOYD,21019,USA,922140,CORRECTIONAL INSTITUTIONS,https://djj.ky.gov/Pages/PREA.aspx,4/3/17,IMAGERY,2017-12-01T00:00:00.000Z,https://djj.ky.gov/Facilities/Pages/Detention-Centers.aspx,JUVENILE,36,0.002977636,3.54E-07,5604.09375,389.2112606,21,19,30800,21019030800,308,Census Tract 308,G5020,S,4624956,0,38.465276,-82.6668733,KY,c(-82.6671948226634, 38.4744082426451)
1026,1014,10003638,CAMPBELL REGIONAL JUVENILE DETENTION CENTER,590 COLUMBIA ST,NEWPORT,KY,41071,6371,(859) 292-6371,STATE,OPEN,18,CAMPBELL,21037,USA,922140,CORRECTIONAL INSTITUTIONS,https://djj.ky.gov/Pages/PREA.aspx,9/14/15,IMAGERY,2017-12-01T00:00:00.000Z,https://djj.ky.gov/Facilities/Pages/Detention-Centers.aspx,JUVENILE,52,0.002704913,3.33E-07,5309.789063,331.7665342,21,37,50100,21037050100,501,Census Tract 501,G5020,S,524921,270118,39.0894248,-84.5005224,KY,c(-84.4966350098368, 39.0895857337142)
1027,1015,10003651,FAYETTE REGIONAL JUVENILE DETENTION CENTER,3475 SPURR RD,LEXINGTON,KY,40511,NOT AVAILABLE,(859) 246-2806,STATE,OPEN,40,FAYETTE,21067,USA,922140,CORRECTIONAL INSTITUTIONS,https://djj.ky.gov/Pages/PREA.aspx,4/12/17,IMAGERY,2017-12-01T00:00:00.000Z,https://djj.ky.gov/Facilities/Pages/Detention-Centers.aspx,JUVENILE,60,0.008281759,4.05E-06,63773.44531,1006.685933,21,67,3701,21067003701,37.01,Census Tract 37.01,G5020,S,83180923,341040,38.0893188,-84.577521,KY,c(-84.5468880709404, 38.1124329242959)
1028,1016,10003657,LINCOLN VILLAGE REGIONAL JUVENILE DETENTION CENTER,820 NEW GLENDALE RD,ELIZABETHTOWN,KY,42701,NOT AVAILABLE,(270) 766-5280,STATE,OPEN,25,HARDIN,21093,USA,922140,CORRECTIONAL INSTITUTIONS,https://djj.ky.gov/Pages/PREA.aspx,5/24/15,IMAGERY,2017-12-01T00:00:00.000Z,https://djj.ky.gov/Facilities/Pages/Detention-Centers.aspx,JUVENILE,48,0.003104078,4.48E-07,7015.484375,390.7263889,21,93,1600,21093001600,16,Census Tract 16,G5020,S,357383005,4557888,37.5538636,-85.955185,KY,c(-85.8602363356691, 37.668954577676)
1029,1017,10004705,MOULTRIE COUNTY JAIL,1505 WEST HAGERMAN ROAD,SULLIVAN,IL,61951,NOT AVAILABLE,(217) 728-4386,COUNTY,OPEN,19,MOULTRIE,17139,USA,922140,CORRECTIONAL INSTITUTIONS,http://www.moultriesheriff.com/Moultrie_County_Detention_Center/Moultrie_County_Detention_Center_and_Sheriffs_Office.html,2/26/18,IMAGERY,2018-03-02T00:00:00.000Z,http://www.moultriesheriff.com/Moultrie_County_Detention_Center/Moultrie_County_Detention_Center_and_Sheriffs_Office.html,NOT AVAILABLE,56,0.001907914,2.15E-07,3465.378906,240.8240219,17,139,977100,17139977100,9771,Census Tract 9771,G5020,S,208631328,17436030,39.5976418,-88.6827173,IL,c(-88.6305897689615, 39.6076721335284)
1030,1018,10002947,AMADOR R RODRIGUEZ BOOT CAMP / ED CTR,2310 W HWY 77,SAN BENITO,TX,78586,NOT AVAILABLE,(956) 361-3509,COUNTY,OPEN,-999,CAMERON,48061,USA,922140,CORRECTIONAL INSTITUTIONS,http://www.co.cameron.tx.us/iJDC/index.html,4/25/18,IMAGERY,2018-04-25T00:00:00.000Z,http://www.co.cameron.tx.us/iJDC/index.html,JUVENILE,40,0.004166377,7.90E-07,10906.59375,486.3183369,48,61,11700,48061011700,117,Census Tract 117,G5020,S,8149404,35477,26.1492004,-97.6527166,TX,c(-97.6576866421091, 26.163734989918)
1031,1019,10003680,MCCRACKEN REGIONAL JUVENILE DETENTION CENTER,500 COUNTRY PARK RD,PADUCAH,KY,42001,NOT AVAILABLE,(270) 575-7111,STATE,OPEN,28,MCCRACKEN,21145,USA,922140,CORRECTIONAL INSTITUTIONS,https://djj.ky.gov/Pages/PREA.aspx,6/18/16,IMAGERY,2017-12-01T00:00:00.000Z,https://djj.ky.gov/Facilities/Pages/Detention-Centers.aspx,JUVENILE,52,0.0025232,3.26E-07,5060.746094,323.7697296,21,145,31400,21145031400,314,Census Tract 314,G5020,S,58572192,9827404,37.095235,-88.6896751,KY,c(-88.6716849361883, 37.0897357653573)
1032,1020,10001944,WARREN REGIONAL JUVENILE DETENTION CENTER,1020 KENTUCKY ST,BOWLING GREEN,KY,42101,NOT AVAILABLE,(270) 746-7155,STATE,OPEN,16,WARREN,21227,USA,922140,CORRECTIONAL INSTITUTIONS,https://djj.ky.gov/Pages/PREA.aspx?Paged=TRUE&p_SortBehavior=0&p_FileLeafRef=Morehead%20YDC%202016%2epdf&p_ID=28&PageFirstRow=31&&View={2A6FDF3C-C8B7-4DC5-9FC3-92531E2BBB46},11/10/15,IMAGERY,2017-12-01T00:00:00.000Z,https://djj.ky.gov/Facilities/Pages/Detention-Centers.aspx,JUVENILE,48,0.003075466,3.77E-07,5851.238281,377.9956099,21,227,10100,21227010100,101,Census Tract 101,G5020,S,975850,0,36.9921321,-86.4466206,KY,c(-86.4453352133983, 36.9943574756506)
1033,1021,10003678,ADAIR YOUTH DEVELOPMENT CENTER,401 APPLEBY DRIVE,COLUMBIA,KY,42728,NOT AVAILABLE,(270) 384-0811,STATE,OPEN,18,ADAIR,21001,USA,922140,CORRECTIONAL INSTITUTIONS,https://djj.ky.gov/Pages/PREA.aspx,6/19/16,IMAGERY,2017-12-01T00:00:00.000Z,https://djj.ky.gov/Facilities/Pages/Youth-Development-Centers.aspx,JUVENILE,80,0.008276551,3.40E-06,52827.125,993.4097627,21,1,970401,21001970401,9704.01,Census Tract 9704.01,G5020,S,105370188,706583,37.0523709,-85.328457,KY,c(-85.3046994240901, 37.0847747364444)
1034,1022,10005044,CADET LEADERSHIP & EDUCATION PROGRAM,2665 KENTUCKY HIGHWAY 30 WEST,JACKSON,KY,41339,NOT AVAILABLE,(606) 295-2267,STATE,OPEN,17,BREATHITT,21025,USA,922140,CORRECTIONAL INSTITUTIONS,https://djj.ky.gov/Pages/PREA.aspx,3/31/17,IMAGERY,2017-12-01T00:00:00.000Z,https://djj.ky.gov/Facilities/Pages/Cadet-Leadership-and-Education-Program.aspx,JUVENILE,40,0.00310253,5.92E-07,9245.550781,388.3398545,21,25,920300,21025920300,9203,Census Tract 9203,G5020,S,50436970,1097432,37.5801106,-83.3677041,KY,c(-83.4155517184327, 37.5388943189673)
1035,1023,10002416,B B RAYBURN CORRECTIONAL CENTER,27268 STATE HWY 21 N,ANGIE,LA,70426,NOT AVAILABLE,(985) 661-6300,STATE,OPEN,1313,WASHINGTON,22117,USA,922140,CORRECTIONAL INSTITUTIONS,http://doc.louisiana.gov/briefing-book,9/27/17,IMAGERY,2017-12-01T00:00:00.000Z,http://www.doc.la.gov/contact/correctional-facilities/,MEDIUM,1314,0.019555892,1.51E-05,217487.2969,2390.786236,22,117,950101,22117950101,9501.01,Census Tract 9501.01,G5020,S,164047118,4078495,30.8959922,-89.8078318,LA,c(-89.8158427329166, 30.9216982269932)
1036,1024,10000115,LEE ADJUSTMENT CENTER,168 LEE ADJUSTMENT CENTER DRIVE,BEATTYVILLE,KY,41311,NOT AVAILABLE,(606) 464-2866,STATE,OPEN,-999,LEE,21129,USA,922140,CORRECTIONAL INSTITUTIONS,http://www.cca.com/locations,12/1/17,IMAGERY,2017-12-01T00:00:00.000Z,http://www.cca.com/locations,CLOSE,816,0.011146509,5.12E-06,80037.875,1408.719823,21,129,950100,21129950100,9501,Census Tract 9501,G5020,S,240027797,2017036,37.6384906,-83.7388335,KY,c(-83.7057956442269, 37.6066831035134)
1037,1025,10000967,ALLEN CORRECTIONAL CENTER,3751 LAUDERDALE WOODYARD RD,KINDER,LA,70648,NOT AVAILABLE,(337) 639-2943,STATE,OPEN,1579,ALLEN,22003,USA,922140,CORRECTIONAL INSTITUTIONS,http://www.doc.la.gov/contact/correctional-facilities/,12/1/17,IMAGERY,2017-12-01T00:00:00.000Z,http://www.doc.la.gov/contact/correctional-facilities/,MAXIMUM,1576,0.019341724,2.06E-05,296029.4648,2257.117529,22,3,950500,22003950500,9505,Census Tract 9505,G5020,S,367334934,2694924,30.5129489,-92.8239587,LA,c(-92.7896727051345, 30.5614831946338)
1038,1026,10004094,DIXON CORRECTIONAL INSTITUTE,5568 STATE HWY 68,JACKSON,LA,70748,NOT AVAILABLE,(225) 634-1200,STATE,OPEN,1778,EAST FELICIANA,22037,USA,922140,CORRECTIONAL INSTITUTIONS,http://doc.louisiana.gov/briefing-book,9/27/17,IMAGERY,2017-12-01T00:00:00.000Z,http://www.doc.la.gov/contact/correctional-facilities/,MAXIMUM,1800,0.0254899,1.51E-05,218272.4844,3156.592857,22,37,951502,22037951502,9515.02,Census Tract 9515.02,G5020,S,249990723,539496,30.7679514,-91.1400292,LA,c(-91.207513733718, 30.8132389993568)
1039,1027,10000948,DAVID WADE CORRECTIONAL CENTER,670 BELL HILL RD,HOMER,LA,71040,NOT AVAILABLE,(318) 927-0400,STATE,OPEN,1227,CLAIBORNE,22027,USA,922140,CORRECTIONAL INSTITUTIONS,http://doc.louisiana.gov/briefing-book,9/27/17,IMAGERY,2017-12-01T00:00:00.000Z,http://www.doc.la.gov/contact/correctional-facilities/,MAXIMUM,1224,0.014292897,1.32E-05,194814.4805,1796.345283,22,27,950200,22027950200,9502,Census Tract 9502,G5020,S,670867932,996219,32.8878543,-93.1083133,LA,c(-93.0195443845712, 32.9017308831769)
1040,1028,10000185,POWLEDGE PRISON,1400 FM 3452,PALESTINE,TX,75803,NOT AVAILABLE,(903) 723-5074,STATE,OPEN,1101,ANDERSON,48001,USA,922140,CORRECTIONAL INSTITUTIONS,"https://www.texastribune.org/library/data/texas-prisons/units/, http://www.tdcj.state.tx.us/unit_directory/index.html",9/15/16,IMAGERY,2018-01-11T00:00:00.000Z,http://www.tdcj.state.tx.us/unit_directory/index.html,MEDIUM,1137,0.018194535,1.27E-05,184884.9141,2213.687177,48,1,950401,48001950401,9504.01,Census Tract 9504.01,G5020,S,16549991,296734,31.7346372,-95.8157096,TX,c(-95.8043563625123, 31.7330412191954)
1041,1029,10003998,MIDDLESEX COUNTY ADULT CORRECTION CENTER,ROUTE 130 AND APPLE ORCHARD LANE,NORTH BRUNSWICK,NJ,8902,NOT AVAILABLE,(732) 951-3360,COUNTY,OPEN,1182,MIDDLESEX,34023,USA,922140,CORRECTIONAL INSTITUTIONS,"http://www.njcjwa.org/jails.html, http://www.drugpolicy.org/sites/default/files/New_Jersey_Jail_Population_Analysis_March_2013.pdf",2/15/16,IMAGERY,2018-04-06T00:00:00.000Z,http://www.middlesexcountynj.gov/Government/Departments/PSH/Pages/default.aspx,NOT AVAILABLE,1436,0.009987547,3.35E-06,54520.76953,1266.360638,34,23,6203,34023006203,62.03,Census Tract 62.03,G5020,S,8825349,251940,40.4317957,-74.4953637,NJ,c(-74.4891992979146, 40.4206184259162)
1042,1030,10002550,WOOD COUNTY JAIL,400 MARKET ST,WISCONSIN RAPIDS,WI,54495,NOT AVAILABLE,(715) 421-8730,COUNTY,OPEN,110,WOOD,55141,USA,922140,CORRECTIONAL INSTITUTIONS,http://woodcountysheriffsdepartment.com/index.php,5/9/18,IMAGERY,2018-05-09T00:00:00.000Z,http://woodcountysheriffsdepartment.com/index.php,MAXIMUM,132,0.004669257,6.46E-07,11210.80859,625.3660063,55,141,11000,55141011000,110,Census Tract 110,G5020,S,31159110,3049044,44.4178296,-89.7716656,WI,c(-89.8209809357008, 44.3925534255032)
1043,1031,10000963,LOUISIANA STATE PENITENTIARY,17544 TUNICA TRACE,ANGOLA,LA,70712,NOT AVAILABLE,(225) 655-4411,STATE,OPEN,6073,WEST FELICIANA,22125,USA,922140,CORRECTIONAL INSTITUTIONS,http://doc.louisiana.gov/briefing-book,9/27/17,IMAGERY,2017-12-01T00:00:00.000Z,http://www.doc.la.gov/contact/correctional-facilities/,MAXIMUM,6312,0.095834875,0.000111835,1616110.473,11529.89329,22,125,951702,22125951702,9517.02,Census Tract 9517.02,G5020,S,153958243,24292876,30.9404596,-91.6143742,LA,c(-91.5973261360141, 30.9597693686425)
1044,1032,10001768,WAKE JUVENILE DETENTION CENTER,700 BEACON LAKE DR,RALEIGH,NC,27610,NOT AVAILABLE,(919) 212-3104,STATE,OPEN,-999,WAKE,37183,USA,922140,CORRECTIONAL INSTITUTIONS,https://www.ncdps.gov/Juvenile-Justice/Juvenile-Facility-Operations/Juvenile-Detention-Centers,12/13/17,IMAGERY,2017-12-13T00:00:00.000Z,https://www.ncdps.gov/Juvenile-Justice/Juvenile-Facility-Operations/Juvenile-Detention-Centers,JUVENILE,24,0.002196152,1.28E-07,1956.347656,273.5509993,37,183,54106,37183054106,541.06,Census Tract 541.06,G5020,S,14612163,253550,35.776322,-78.551957,NC,c(-78.5724472216194, 35.789016455308)
1045,1033,10000242,RAMSEY PRISON,1100 FM 655,ROSHARON,TX,77583,NOT AVAILABLE,(281) 595-3491,STATE,OPEN,1798,BRAZORIA,48039,USA,922140,CORRECTIONAL INSTITUTIONS,"https://www.texastribune.org/library/data/texas-prisons/units/, http://www.tdcj.state.tx.us/unit_directory/index.html",9/15/16,IMAGERY,2018-01-11T00:00:00.000Z,http://www.tdcj.state.tx.us/unit_directory/index.html,MAXIMUM,1891,0.015401995,8.06E-06,114472.8438,1808.765923,48,39,661900,48039661900,6619,Census Tract 6619,G5020,S,302423802,5519691,29.3464118,-95.493318,TX,c(-95.5370186381264, 29.3104475741816)
1046,1034,10006216,CHATHAM YOUTH DEVELOPMENT CENTER,560 PROGRESS BLVD.,SILER CITY,NC,27344,NOT AVAILABLE,(919) 742-6220,STATE,OPEN,61,CHATHAM,37037,USA,922140,CORRECTIONAL INSTITUTIONS,https://www.ncdps.gov/annual-report-youth-development-centers-october-2017,10/1/17,IMAGERY,2017-12-13T00:00:00.000Z,https://www.ncdps.gov/Juvenile-Justice/Juvenile-Facility-Operations/Youth-Development-Centers,JUVENILE,32,0.003069406,5.70E-07,8705.476563,377.2850987,37,37,20300,37037020300,203,Census Tract 203,G5020,S,144605335,721831,35.6925992,-79.4750166,NC,c(-79.4241130438035, 35.7201380216309)
1047,1035,10002200,GILPIN COUNTY JUSTICE CENTER,2960 DORY HILL ROAD,GOLDEN,CO,80403,NOT AVAILABLE,(303) 582-3576,COUNTY,OPEN,-999,GILPIN,8047,USA,922140,CORRECTIONAL INSTITUTIONS,http://www.gilpincountysheriff.com/divisions,2/19/18,IMAGERY,2018-02-19T00:00:00.000Z,http://www.gilpincountysheriff.com/divisions,NOT AVAILABLE,55,0.003435161,5.87E-07,9478.851563,432.3377391,8,47,13800,8047013800,138,Census Tract 138,G5020,S,388556733,942056,39.8611555,-105.5288778,CO,c(-105.48219864877, 39.8392004524424)
1048,1036,10000156,ROACH UNIT,15845 FM 164,CHILDRESS,TX,79201,NOT AVAILABLE,(940) 937-6364,STATE,OPEN,1369,CHILDRESS,48075,USA,922140,CORRECTIONAL INSTITUTIONS,"https://www.texastribune.org/library/data/texas-prisons/units/, http://www.tdcj.state.tx.us/unit_directory/index.html",9/15/16,IMAGERY,2018-01-11T00:00:00.000Z,http://www.tdcj.state.tx.us/unit_directory/index.html,MEDIUM,1384,0.013166019,1.12E-05,168032.3906,1622.963602,48,75,950100,48075950100,9501,Census Tract 9501,G5020,S,1777318679,44346232,34.5246235,-100.2081658,TX,c(-100.275923902388, 34.4313264441225)
1049,1037,10002208,JEFFERSON COUNTY DETENTION FACILITY,200 JEFFERSON COUNTY PARKWAY,GOLDEN,CO,80419,NOT AVAILABLE,(303) 277-0211,COUNTY,OPEN,1470,JEFFERSON,8059,USA,922140,CORRECTIONAL INSTITUTIONS,https://www.jeffco.us/650/Sheriff,2/15/16,IMAGERY,2018-02-19T00:00:00.000Z,https://www.jeffco.us/650/Sheriff,MAXIMUM,1300,0.009459389,2.07E-06,33406.48047,1224.67461,8,59,10000,8059010000,100,Census Tract 100,G5020,S,4928603,20413,39.742483,-105.2105614,CO,c(-105.201294219705, 39.730869031133)
1050,1038,10004664,HULSE JUVENILE DETENTION CENTER,24647 NORTH MILWAUKEE AVENUE,VERNON HILLS,IL,60061,NOT AVAILABLE,(847) 377-7800,COUNTY,OPEN,-999,LAKE,17097,USA,922140,CORRECTIONAL INSTITUTIONS,http://19thcircuitcourt.state.il.us/1194/Juvenile-Detention,3/2/18,IMAGERY,2018-03-02T00:00:00.000Z,http://19thcircuitcourt.state.il.us/1194/Juvenile-Detention,JUVENILE,-999,0.004442094,1.32E-06,22136.13281,562.6852849,17,97,866200,17097866200,8662,Census Tract 8662,G5020,S,32750859,580968,42.2360556,-87.9107093,IL,c(-87.9364572877153, 42.220982221669)
1051,1039,10002220,GUNNISON COUNTY DETENTION CENTER,510 BIDWELL,GUNNISON,CO,81230,NOT AVAILABLE,(970) 641-1108,COUNTY,OPEN,16,GUNNISON,8051,USA,922140,CORRECTIONAL INSTITUTIONS,http://www.gunnisoncounty.org/165/Detention-Services,2/16/18,IMAGERY,2018-02-19T00:00:00.000Z,http://www.gunnisoncounty.org/165/Detention-Services,NOT AVAILABLE,-999,0.002051497,2.24E-07,3545.8125,261.3433657,8,51,963700,8051963700,9637,Census Tract 9637,G5020,S,14498887,0,38.5443384,-106.9270308,CO,c(-106.932335930927, 38.5395347075559)
1052,1040,10002196,GRAND COUNTY JAIL,670 SPRING STREET,HOT SULPHUR SPRINGS,CO,80451,NOT AVAILABLE,(970) 725-3343,COUNTY,OPEN,-999,GRAND,8049,USA,922140,CORRECTIONAL INSTITUTIONS,http://co.grand.co.us/255/Sheriff,2/19/18,IMAGERY,2018-02-19T00:00:00.000Z,http://co.grand.co.us/255/Sheriff,NOT AVAILABLE,-999,0.001884724,2.21E-07,3581.625,240.0403581,8,49,202,8049000202,2.02,Census Tract 2.02,G5020,S,653965686,223268,39.9432243,-105.8783655,CO,c(-106.104490104039, 40.0720849050539)
1053,1041,10002744,CASS COUNTY JAIL,600 HWY 8 NORTH,LINDEN,TX,75563,NOT AVAILABLE,(903) 756-7511,COUNTY,OPEN,68,CASS,48067,USA,922140,CORRECTIONAL INSTITUTIONS,"https://www.tcjs.state.tx.us/index.php?linkID=325, https://texasjailproject.org/list_of_county_jails/",3/1/18,IMAGERY,2018-04-25T00:00:00.000Z,NOT AVAILABLE,NOT AVAILABLE,96,0.002601616,2.63E-07,3888.953125,304.2156542,48,67,950600,48067950600,9506,Census Tract 9506,G5020,S,705649660,2492577,32.9856172,-94.3504148,TX,c(-94.375705855972, 33.0186980105717)
1054,1042,10002879,CHAMBERS COUNTY JAIL,201 N COURT,ANAHUAC,TX,77514,NOT AVAILABLE,NOT AVAILABLE,COUNTY,OPEN,84,CHAMBERS,48071,USA,922140,CORRECTIONAL INSTITUTIONS,"https://www.tcjs.state.tx.us/index.php?linkID=325, http://www.co.chambers.tx.us/default.aspx?name=sheriff",3/1/18,IMAGERY,2018-04-25T00:00:00.000Z,NOT AVAILABLE,NOT AVAILABLE,148,0.002750802,3.67E-07,5246.3125,330.7953295,48,71,710500,48071710500,7105,Census Tract 7105,G5020,S,644472113,32908192,29.6525309,-94.5779034,TX,c(-94.6851545805458, 29.7701808032245)
1055,1043,10000049,MONROE COUNTY SHERIFF'S DEPARTMENT,216 MAIN ST,UNION,WV,24983,NOT AVAILABLE,NOT AVAILABLE,COUNTY,NOT AVAILABLE,-999,MONROE,54063,USA,922140,CORRECTIONAL INSTITUTIONS,NOT AVAILABLE,NOT AVAILABLE,IMAGERY/OTHER,2018-05-10T00:00:00.000Z,NOT AVAILABLE,NOT AVAILABLE,-999,0.001348476,8.13E-08,1271.671875,164.1911503,54,63,950200,54063950200,9502,Census Tract 9502,G5020,S,454261482,607924,37.5777595,-80.6230295,WV,c(-80.5432406396092, 37.591171166838)
1056,1044,10005933,BRIDGE CITY CENTER FOR YOUTH,3225 RIVER ROAD,BRIDGE CITY,LA,70094,NOT AVAILABLE,(504) 436-4253,STATE,OPEN,124,JEFFERSON,22051,USA,922140,CORRECTIONAL INSTITUTIONS,https://ojj.la.gov/about-ojj/administrative-functions/ojj-secure-care-facilities/,12/4/17,IMAGERY/OTHER,2017-12-04T00:00:00.000Z,https://ojj.la.gov/about-ojj/administrative-functions/ojj-secure-care-facilities/,JUVENILE,-999,0.011447902,8.78E-06,125494.7207,1376.01614,22,51,28200,22051028200,282,Census Tract 282,G5020,S,14461933,5004029,29.9227436,-90.1622868,LA,c(-90.1674502629397, 29.9378673447651)
1057,1045,10002095,BOSTON PRE-RELEASE CENTER,430 CANTERBURY ST,ROSLINDALE,MA,2131,NOT AVAILABLE,(617) 822-5000,STATE,OPEN,106,SUFFOLK,25025,USA,922140,CORRECTIONAL INSTITUTIONS,http://www.mass.gov/eopss/law-enforce-and-cj/prisons/rsch-data/weekly-count-sheets.html,9/4/17,IMAGERY,2017-12-04T00:00:00.000Z,https://www.mass.gov/prison/locations,MINIMUM,175,0.003939679,2.93E-07,4914.222656,502.2809022,25,25,981100,25025981100,9811,Census Tract 9811,G5020,S,2712308,19090,42.2879942,-71.1034042,MA,c(-71.1013836827548, 42.2924953358224)
1058,1046,10001643,TENSAS / J.B. EVANS CORRECTIONAL CENTER,500 ROUTH ST,NEWELTON,LA,71357,NOT AVAILABLE,(318) 467-3355,STATE,OPEN,-999,TENSAS,22107,USA,922140,CORRECTIONAL INSTITUTIONS,http://www.doc.la.gov/wp-content/uploads/stats/1k.pdf,3/25/15,UNVERIFIED,2017-12-04T00:00:00.000Z,NOT AVAILABLE,MEDIUM,388,0.005102666,1.26E-06,18497.08984,606.6492418,22,107,100,22107000100,1,Census Tract 1,G5020,S,360559297,55348295,32.0409052,-91.1493287,LA,c(-91.2435748511352, 32.0650455768698)
1059,1047,10000949,SWANSON CENTER FOR YOUTH AT MONROE,4701 S GRAND ST,MONROE,LA,71202,NOT AVAILABLE,(318) 362-5000,STATE,OPEN,156,OUACHITA,22073,USA,922140,CORRECTIONAL INSTITUTIONS,https://ojj.la.gov/about-ojj/administrative-functions/ojj-secure-care-facilities/,12/4/17,IMAGERY,2017-12-04T00:00:00.000Z,https://ojj.la.gov/about-ojj/administrative-functions/ojj-secure-care-facilities/,JUVENILE,426,0.0176438,1.58E-05,232268.0586,2096.641395,22,73,11000,22073011000,110,Census Tract 110,G5020,S,20119418,1187229,32.4350254,-92.1190566,LA,c(-92.1093761659431, 32.4542143929048)
1060,1048,10004747,WARE YOUTH CENTER,3565 UNITED STATES HIGHWAY 71,COUSHATTA,LA,71019,NOT AVAILABLE,(318) 932-4411,STATE,OPEN,-999,RED RIVER,22081,USA,922140,CORRECTIONAL INSTITUTIONS,http://www.wareyouthcenter.com/Group_Home.php,12/4/17,IMAGERY,2017-12-04T00:00:00.000Z,http://www.wareyouthcenter.com/Home_Page.php,JUVENILE,40,0.018275681,1.64E-05,239494.9688,2140.712194,22,81,960300,22081960300,9603,Census Tract 9603,G5020,S,103388525,6804577,32.0115509,-93.3237631,LA,c(-93.3742096965451, 32.0808443703648)
1061,1049,10006385,SWANSON CENTER FOR YOUTH AT COLUMBIA,132 HWY 850,COLUMBIA,LA,71418,NOT AVAILABLE,(318) 649-4310,STATE,OPEN,-999,CALDWELL,22021,USA,922140,CORRECTIONAL INSTITUTIONS,https://ojj.la.gov/about-ojj/administrative-functions/ojj-secure-care-facilities/,12/4/17,IMAGERY,2017-12-04T00:00:00.000Z,https://ojj.la.gov/about-ojj/administrative-functions/ojj-secure-care-facilities/,JUVENILE,-999,0.007191982,3.06E-06,44742.08203,862.7647322,22,21,300,22021000300,3,Census Tract 3,G5020,S,318165075,3054654,31.9959904,-92.0854092,LA,c(-92.1086287405697, 32.0756926803372)
1062,1050,10002417,C PAUL PHELPS CORRECTIONAL CENTER,14925 STATE HWY 27 N,DEQUINCY,LA,70633,NOT AVAILABLE,NOT AVAILABLE,STATE,CLOSED,0,BEAUREGARD,22011,USA,922140,CORRECTIONAL INSTITUTIONS,http://www.nola.com/politics/index.ssf/2012/11/c_paul_phelps_prison_shuts_dow.html,11/1/12,IMAGERY,2017-12-04T00:00:00.000Z,NOT AVAILABLE,MEDIUM,-999,0.020245349,1.33E-05,191884.3672,2437.014469,22,11,960700,22011960700,9607,Census Tract 9607,G5020,S,926503087,1823101,30.5507508,-93.3141606,LA,c(-93.431764438931, 30.4973844486134)
1063,1051,10003997,MIDDLESEX COUNTY JUVENILE DETENTION CENTER,APPLE ORCHARD LANE,NORTH BRUNSWICK,NJ,8902,NOT AVAILABLE,NOT AVAILABLE,COUNTY,OPEN,56,MIDDLESEX,34023,USA,922140,CORRECTIONAL INSTITUTIONS,"http://www.middlesexcountynj.gov/Government/Departments/PSH/Pages/default.aspx, http://www.nj.gov/lps/jjc/2011-AnnualDetentionStatisticsReport.pdf",2/15/16,IMAGERY,2018-04-06T00:00:00.000Z,http://www.middlesexcountynj.gov/Government/Departments/PSH/Pages/default.aspx,JUVENILE,100,0.005795535,1.42E-06,23170.44141,751.6472923,34,23,6203,34023006203,62.03,Census Tract 62.03,G5020,S,8825349,251940,40.4317957,-74.4953637,NJ,c(-74.4892605706019, 40.4285907547362)
1064,1052,10000175,ROBERTSON PRISON,12071 FM 3522,ABILENE,TX,79601,NOT AVAILABLE,(325) 548-9035,STATE,OPEN,2971,JONES,48253,USA,922140,CORRECTIONAL INSTITUTIONS,"https://www.texastribune.org/library/data/texas-prisons/units/, http://www.tdcj.state.tx.us/unit_directory/index.html",9/15/16,IMAGERY,2018-01-11T00:00:00.000Z,http://www.tdcj.state.tx.us/unit_directory/index.html,MAXIMUM,2984,0.018201658,2.31E-05,340061.0391,2197.487949,48,253,20102,48253020102,201.02,Census Tract 201.02,G5020,S,4927870,1396799,32.5487573,-99.6251588,TX,c(-99.63324737641, 32.5563504595955)
1065,1053,10001101,MARION COUNTY JAIL,217 ADAMS ST,FAIRMONT,WV,26554,NOT AVAILABLE,NOT AVAILABLE,COUNTY,CLOSED,0,MARION,54049,USA,922140,CORRECTIONAL INSTITUTIONS,http://www.timeswv.com/news/officials-looking-into-reopening-county-jail/article_6f3f0752-8584-11e7-bd37-7b501a24f70d.html,3/20/17,IMAGERY,2018-05-10T00:00:00.000Z,NOT AVAILABLE,NOT AVAILABLE,-999,0.001704166,1.75E-07,2814.800781,213.3311863,54,49,20100,54049020100,201,Census Tract 201,G5020,S,659636,69574,39.4841213,-80.1462241,WV,c(-80.1432339008558, 39.4849948525017)
1066,1054,10006785,FREDERICK COUNTY WORK RELEASE FACILITY,7300 MARCIE'S CHOICE LN,FREDERICK,MD,21704,NOT AVAILABLE,NOT AVAILABLE,COUNTY,OPEN,55,FREDERICK,24021,USA,922140,CORRECTIONAL INSTITUTIONS,http://dlslibrary.state.md.us/publications/JCR/2016/2016_309.pdf,8/30/16,IMAGERY,2018-03-19T00:00:00.000Z,https://frederickcountymd.gov/677/Sheriff-Adult-Detention,MINIMUM,128,0.001818057,1.93E-07,3090.070313,232.3990844,24,21,751003,24021751003,7510.03,Census Tract 7510.03,G5020,S,14194045,33282,39.3871801,-77.396194,MD,c(-77.4152012900179, 39.3649178507036)
1067,1055,10000038,NICHOLAS COUNTY SHERIFF'S DEPARTMENT,700 MAIN ST,SUMMERSVILLE,WV,26651,NOT AVAILABLE,NOT AVAILABLE,COUNTY,NOT AVAILABLE,-999,NICHOLAS,54067,USA,922140,CORRECTIONAL INSTITUTIONS,NOT AVAILABLE,NOT AVAILABLE,IMAGERY/OTHER,2018-05-10T00:00:00.000Z,NOT AVAILABLE,NOT AVAILABLE,-999,0.001625391,1.29E-07,2032.851563,206.3145188,54,67,950200,54067950200,9502,Census Tract 9502,G5020,S,262683665,8153687,38.284321,-80.9143166,WV,c(-80.8512299812083, 38.2806648100753)
1068,1056,10002097,BRIDGEWATER STATE HOSPITAL,20 ADMINISTRATION RD,BRIDGEWATER,MA,2324,NOT AVAILABLE,(508) 279-4500,STATE,OPEN,191,PLYMOUTH,25023,USA,922140,CORRECTIONAL INSTITUTIONS,http://www.mass.gov/eopss/law-enforce-and-cj/prisons/rsch-data/weekly-count-sheets.html,9/4/17,IMAGERY,2017-12-04T00:00:00.000Z,https://www.mass.gov/prison/locations,MEDIUM,319,0.011682873,9.07E-06,151172.3438,1466.012389,25,23,525300,25023525300,5253,Census Tract 5253,G5020,S,6959548,328265,41.9500489,-70.9519064,MA,c(-70.9553389624858, 41.9423626854701)
1069,1057,10000199,SAN SABA TRANSFER FACILITY,206 S WALLACE CREEK RD,SAN SABA,TX,76877,NOT AVAILABLE,(325) 372-4255,STATE,OPEN,546,SAN SABA,48411,USA,922140,CORRECTIONAL INSTITUTIONS,"https://www.texastribune.org/library/data/texas-prisons/units/, http://www.tdcj.state.tx.us/unit_directory/index.html",9/15/16,IMAGERY,2018-01-11T00:00:00.000Z,http://www.tdcj.state.tx.us/unit_directory/index.html,MEDIUM,606,0.009820881,3.66E-06,53058.65625,1193.760868,48,411,950200,48411950200,9502,Census Tract 9502,G5020,S,2911439248,8069095,31.1551375,-98.8192922,TX,c(-98.7627057328552, 31.1997168798557)
1070,1058,10006584,LENOIR YOUTH DEVELOPMENT CENTER,3055 DOBBS FARM ROAD,KINSTON,NC,28504,NOT AVAILABLE,(252) 208-4920,STATE,OPEN,54,LENOIR,37107,USA,922140,CORRECTIONAL INSTITUTIONS,https://www.ncdps.gov/annual-report-youth-development-centers-october-2017,10/1/17,IMAGERY/OTHER,2017-12-13T00:00:00.000Z,https://www.ncdps.gov/Juvenile-Justice/Juvenile-Facility-Operations/Youth-Development-Centers,JUVENILE,44,0.002998216,5.18E-07,7869.96875,363.6049635,37,107,10900,37107010900,109,Census Tract 109,G5020,S,79446497,25968,35.3514224,-77.6123942,NC,c(-77.6306272534489, 35.3084324530665)
1071,1059,10001401,LEMUEL SHATTUCK HOSPITAL CORRECTIONAL UNIT,180 MORTON ST,JAMAICA PLAIN,MA,2130,NOT AVAILABLE,(617) 522-7585,STATE,OPEN,19,SUFFOLK,25025,USA,922140,CORRECTIONAL INSTITUTIONS,http://www.mass.gov/eopss/law-enforce-and-cj/prisons/rsch-data/weekly-count-sheets.html,9/4/17,IMAGERY,2017-12-04T00:00:00.000Z,https://www.mass.gov/prison/locations,MEDIUM,29,0.00424809,9.78E-07,16393.33594,567.8934434,25,25,980300,25025980300,9803,Census Tract 9803,G5020,S,2081297,27540,42.3006134,-71.094613,MA,c(-71.1018611595633, 42.299543319431)
1072,1060,10002099,MASSACHUSETTS ALCOHOL AND SUBSTANCE ABUSE CENTER,2 ADMINISTRATION RD,BRIDGEWATER,MA,2324,NOT AVAILABLE,(508) 279-3500,STATE,CLOSED,0,PLYMOUTH,25023,USA,922140,CORRECTIONAL INSTITUTIONS,http://www.enterprisenews.com/news/20170504/nine-briefly-escape-from-state-substance-abuse-facility-amid-move-to-plymouth,5/4/17,IMAGERY,2017-12-04T00:00:00.000Z,http://www.mass.gov/eopss/law-enforce-and-cj/prisons/doc-facilities/massachusetts-alcohol-and-substance-abuse-center.html,MINIMUM,236,0.014684387,4.78E-06,79608.26953,1967.903324,25,23,525300,25023525300,5253,Census Tract 5253,G5020,S,6959548,328265,41.9500489,-70.9519064,MA,c(-70.9557920751758, 41.9531965983985)
1073,1061,10000594,LAS ANIMAS COUNTY JAIL,"2309 EAST MAIN STREET, GARCIA JUSTICE CENTER",TRINIDAD,CO,81082,NOT AVAILABLE,(719) 846-2211,COUNTY,OPEN,-999,LAS ANIMAS,8071,USA,922140,CORRECTIONAL INSTITUTIONS,http://www.lasanimascounty.net/index.php?option=com_content&view=category&layout=blog&id=16&Itemid=138,2/20/18,IMAGERY,2018-02-20T00:00:00.000Z,http://www.lasanimascounty.net/index.php?option=com_content&view=category&layout=blog&id=16&Itemid=138,NOT AVAILABLE,-999,0.004270894,4.42E-07,6869.335938,540.7699128,8,71,500,8071000500,5,Census Tract 5,G5020,S,72835256,0,37.1267215,-104.4307432,CO,c(-104.485045613641, 37.182620952177)
1074,1062,10006715,LAKE COUNTY JAIL,505 HARRISON AVENUE,LEADVILLE,CO,80461,NOT AVAILABLE,(719) 486-4127,COUNTY,OPEN,-999,LAKE,8065,USA,922140,CORRECTIONAL INSTITUTIONS,http://www.lakecountyco.com/sheriff/,2/20/18,IMAGERY,2018-02-20T00:00:00.000Z,http://www.lakecountyco.com/sheriff/,NOT AVAILABLE,-999,0.00180226,1.41E-07,2249.226563,228.0840754,8,65,961700,8065961700,9617,Census Tract 9617,G5020,S,39955749,13043,39.2395898,-106.3084435,CO,c(-106.292230927315, 39.2480856432482)
1075,1063,10002802,SANCHEZ STATE JAIL,3901 STATE JAIL RD,EL PASO,TX,79938,8456,(915) 856-0046,STATE,OPEN,988,EL PASO,48141,USA,922140,CORRECTIONAL INSTITUTIONS,"https://www.texastribune.org/library/data/texas-prisons/units/, http://www.tdcj.state.tx.us/unit_directory/index.html",9/15/16,IMAGERY,2018-01-11T00:00:00.000Z,http://www.tdcj.state.tx.us/unit_directory/index.html,MAXIMUM,1100,0.009848329,6.08E-06,88652.33594,1188.360457,48,141,10339,48141010339,103.39,Census Tract 103.39,G5020,S,47351243,0,31.8261423,-106.255518,TX,c(-106.254049304199, 31.8149532713052)
1076,1064,10002194,LARIMER COUNTY JAIL,2405 MIDPOINT DRIVE,FORT COLLINS,CO,80525,NOT AVAILABLE,(970) 498-5200,COUNTY,OPEN,557,LARIMER,8069,USA,922140,CORRECTIONAL INSTITUTIONS,https://www.larimer.org/sheriff,2/20/18,IMAGERY,2018-02-20T00:00:00.000Z,https://www.larimer.org/sheriff,NOT AVAILABLE,617,0.006504085,1.83E-06,29892.82031,820.2278828,8,69,1605,8069001605,16.05,Census Tract 16.05,G5020,S,15352611,900078,40.5418247,-105.016006,CO,c(-105.033214632076, 40.5642415532385)
1077,1065,10006502,LA PLATA COUNTY JAIL,742 TURNER DR,DURANGO,CO,81303,NOT AVAILABLE,(970) 247-1161,COUNTY,OPEN,-999,LA PLATA,8067,USA,922140,CORRECTIONAL INSTITUTIONS,http://lpcso.org/divisions,2/20/18,IMAGERY,2018-02-20T00:00:00.000Z,http://lpcso.org/divisions,NOT AVAILABLE,293,0.004863004,1.19E-06,18477.625,623.3784579,8,67,971100,8067971100,9711,Census Tract 9711,G5020,S,24345833,59060,37.2554292,-107.8890742,CO,c(-107.878422917563, 37.2476394293641)
1078,1066,10003999,MONMOUTH COUNTY YOUTH DETENTION CENTER,119 DUTCH LANE RD,FREEHOLD,NJ,7728,NOT AVAILABLE,NOT AVAILABLE,COUNTY,CLOSED,0,MONMOUTH,34025,USA,922140,CORRECTIONAL INSTITUTIONS,http://www.nj.com/news/index.ssf/2010/01/monmouth_juvenile_detainees_to.html,1/28/10,IMAGERY,2018-04-06T00:00:00.000Z,NOT AVAILABLE,JUVENILE,40,0.005114318,9.15E-07,14860.34766,649.7800694,34,25,810402,34025810402,8104.02,Census Tract 8104.02,G5020,S,12538756,28947,40.2705616,-74.2434757,NJ,c(-74.2594385365595, 40.2719183085289)
1079,1067,10000046,MINGO COUNTY COURTHOUSE,75 E 2ND AVE,WILLIAMSON,WV,25661,NOT AVAILABLE,NOT AVAILABLE,COUNTY,NOT AVAILABLE,-999,MINGO,54059,USA,922140,CORRECTIONAL INSTITUTIONS,http://www.mingocountywv.com/,3/4/16,UNVERIFIED,2018-05-10T00:00:00.000Z,NOT AVAILABLE,NOT AVAILABLE,-999,0.001451364,1.25E-07,1958.945313,182.128387,54,59,957400,54059957400,9574,Census Tract 9574,G5020,S,23031468,0,37.6854468,-82.2666336,WV,c(-82.278500749379, 37.6726844375469)
1080,1068,10000008,MINERAL COUNTY HOLDING FACILITY,100 EAST STREET,KEYSER,WV,26726,NOT AVAILABLE,NOT AVAILABLE,COUNTY,NOT AVAILABLE,-999,MINERAL,54057,USA,922140,CORRECTIONAL INSTITUTIONS,NOT AVAILABLE,NOT AVAILABLE,IMAGERY/OTHER,2018-05-10T00:00:00.000Z,NOT AVAILABLE,NOT AVAILABLE,-999,0.001305724,1.03E-07,1654.351563,162.7065218,54,57,10500,54057010500,105,Census Tract 105,G5020,S,137015559,103993,39.3730798,-79.0310138,WV,c(-78.9730423410913, 39.4394581244413)
1081,1069,10004208,DOBBS YOUTH DEVELOPMENT CENTER,3060 DOBBS FARM RD,KINSTON,NC,28504,NOT AVAILABLE,(252) 522-0511,STATE,CLOSED,0,LENOIR,37107,USA,922140,CORRECTIONAL INSTITUTIONS,https://www.ncdps.gov/annual-report-youth-development-centers-october-2017,10/1/17,IMAGERY,2017-12-13T00:00:00.000Z,"https://www.ncdps.gov/Index2.cfm?a=000003,002476,003108,003110",JUVENILE,43,0.019801947,1.55E-05,235865.0664,2392.71141,37,107,10900,37107010900,109,Census Tract 109,G5020,S,79446497,25968,35.3514224,-77.6123942,NC,c(-77.6318658424939, 35.3116205696365)
1082,1070,10001404,MASAC AT PLYMOUTH,1 BUMP POND RD,PLYMOUTH,MA,2360,NOT AVAILABLE,(508) 291-2441,STATE,OPEN,262,PLYMOUTH,25023,USA,922140,CORRECTIONAL INSTITUTIONS,http://www.mass.gov/eopss/law-enforce-and-cj/prisons/rsch-data/weekly-count-sheets.html,9/4/17,IMAGERY,2017-12-04T00:00:00.000Z,https://www.mass.gov/prison/locations,MINIMUM,275,0.01084629,4.07E-06,67788.48438,1406.495936,25,23,530600,25023530600,5306,Census Tract 5306,G5020,S,98785674,6797569,41.8698585,-70.6603338,MA,c(-70.6605552118173, 41.8495406680599)
1083,1071,10001408,MCI - CEDAR JUNCTION,2405 MAIN ST,SOUTH WALPOLE,MA,2071,NOT AVAILABLE,(508) 660-8000,STATE,OPEN,711,NORFOLK,25021,USA,922140,CORRECTIONAL INSTITUTIONS,http://www.mass.gov/eopss/law-enforce-and-cj/prisons/rsch-data/weekly-count-sheets.html,9/4/17,IMAGERY,2017-12-04T00:00:00.000Z,https://www.mass.gov/prison/locations,MAXIMUM,646,0.016039462,1.48E-05,247574.3086,2039.424665,25,21,411302,25021411302,4113.02,Census Tract 4113.02,G5020,S,12932836,162200,42.133485,-71.2769727,MA,c(-71.2897965583048, 42.1062558380284)
1084,1072,10004444,MCI - FRAMINGHAM,99 LORING DRIVE,FRAMINGHAM,MA,1701,NOT AVAILABLE,(508) 532-5100,STATE,OPEN,478,MIDDLESEX,25017,USA,922140,CORRECTIONAL INSTITUTIONS,http://www.mass.gov/eopss/law-enforce-and-cj/prisons/rsch-data/weekly-count-sheets.html,9/4/17,IMAGERY,2017-12-04T00:00:00.000Z,https://www.mass.gov/prison/locations,MEDIUM,572,0.01150766,7.58E-06,126932.1875,1538.930309,25,17,383101,25017383101,3831.01,Census Tract 3831.01,G5020,S,2815540,9845,42.2673461,-71.4076209,MA,c(-71.4074191869709, 42.2675128887611)
1085,1073,10004743,GARRETT COUNTY JAIL,311 EAST ALDER STREET,OAKLAND,MD,21550,NOT AVAILABLE,(301) 334-5055,COUNTY,OPEN,42,GARRETT,24023,USA,922140,CORRECTIONAL INSTITUTIONS,http://dlslibrary.state.md.us/publications/JCR/2016/2016_309.pdf,8/30/16,IMAGERY,2018-03-19T00:00:00.000Z,https://www.garrettcounty.org/sheriffs-office,MAXIMUM,64,0.003416704,3.70E-07,5940.363281,418.2703431,24,23,600,24023000600,6,Census Tract 6,G5020,S,216143504,481147,39.4460403,-79.4357541,MD,c(-79.4065386289217, 39.4074498745189)
1086,1074,10002215,LINCOLN COUNTY JAIL,103 THIRD AVENUE,HUGO,CO,80821,NOT AVAILABLE,(719) 743-2846,COUNTY,OPEN,-999,LINCOLN,8073,USA,922140,CORRECTIONAL INSTITUTIONS,http://lincolnsheriff.net/index.html,2/20/18,IMAGERY,2018-02-20T00:00:00.000Z,http://lincolnsheriff.net/index.html,NOT AVAILABLE,40,0.004100989,6.94E-07,11089.39453,513.046749,8,73,961800,8073961800,9618,Census Tract 9618,G5020,S,5736438020,19096919,38.9629061,-103.530972,CO,c(-103.473832970654, 39.1322877464987)
1087,1075,10000245,SCOTT PRISON,6999 RETRIEVE,ANGLETON,TX,77515,NOT AVAILABLE,(979) 849-9306,STATE,OPEN,1071,BRAZORIA,48039,USA,922140,CORRECTIONAL INSTITUTIONS,"https://www.texastribune.org/library/data/texas-prisons/units/, http://www.tdcj.state.tx.us/unit_directory/index.html",9/15/16,IMAGERY,2018-01-11T00:00:00.000Z,http://www.tdcj.state.tx.us/unit_directory/index.html,MAXIMUM,1130,0.01329675,4.85E-06,68718.49219,1592.104259,48,39,663100,48039663100,6631,Census Tract 6631,G5020,S,89028282,12587760,29.077443,-95.472529,TX,c(-95.4825132138511, 29.0909350517963)
1088,1076,10002363,HOWARD COUNTY DETENTION CENTER,7301 WATERLOO RD,JESSUP,MD,20794,NOT AVAILABLE,(410) 313-5200,COUNTY,OPEN,283,HOWARD,24027,USA,922140,CORRECTIONAL INSTITUTIONS,http://dlslibrary.state.md.us/publications/JCR/2016/2016_309.pdf,8/30/16,IMAGERY,2018-03-19T00:00:00.000Z,https://www.howardcountymd.gov/Departments/Corrections,NOT AVAILABLE,343,0.006950335,1.61E-06,25778.80078,875.9941478,24,27,601203,24027601203,6012.03,Census Tract 6012.03,G5020,S,8891346,4381,39.1784051,-76.7637098,MD,c(-76.7817795136261, 39.1695480948077)
1089,1077,10006737,KNOX COUNTY MARY DAVIS DETENTION HOME,1319 E. 5TH STREET,GALESBURG,IL,61401,NOT AVAILABLE,(309) 343-5112,COUNTY,OPEN,-999,KNOX,17095,USA,922140,CORRECTIONAL INSTITUTIONS,http://www.co.knox.il.us/mary-davis-detention-home/,3/2/18,IMAGERY,2018-03-02T00:00:00.000Z,http://www.co.knox.il.us/mary-davis-detention-home/,JUVENILE,-999,0.002834533,3.16E-07,5190.769531,359.0638747,17,95,1000,17095001000,10,Census Tract 10,G5020,S,6921362,0,40.9303488,-90.3599107,IL,c(-90.3496863699499, 40.9333921582968)
1090,1078,10000021,LEWIS COUNTY SHERIFF,110 CENTER AVE,WESTON,WV,26452,NOT AVAILABLE,NOT AVAILABLE,COUNTY,NOT AVAILABLE,-999,LEWIS,54041,USA,922140,CORRECTIONAL INSTITUTIONS,NOT AVAILABLE,NOT AVAILABLE,IMAGERY/OTHER,2018-05-10T00:00:00.000Z,NOT AVAILABLE,NOT AVAILABLE,-999,0.001123013,6.82E-08,1088.011719,139.5045907,54,41,967400,54041967400,9674,Census Tract 9674,G5020,S,27730536,187515,39.0484851,-80.4339206,WV,c(-80.466908840996, 39.0363473055626)
1091,1079,10002101,MCI - NORFOLK,2 CLARK ST,NORFOLK,MA,2056,NOT AVAILABLE,(508) 660-5900,STATE,OPEN,1417,NORFOLK,25021,USA,922140,CORRECTIONAL INSTITUTIONS,http://www.mass.gov/eopss/law-enforce-and-cj/prisons/rsch-data/weekly-count-sheets.html,9/4/17,IMAGERY,2017-12-04T00:00:00.000Z,https://www.mass.gov/prison/locations,MEDIUM,1473,0.01782267,1.60E-05,266788.4297,2258.465369,25,21,409101,25021409101,4091.01,Census Tract 4091.01,G5020,S,20875886,733000,42.1167622,-71.3168858,MA,c(-71.3041713610019, 42.1191290297871)
1092,1080,10001393,MCI - SHIRLEY,1 HARVARD RD,SHIRLEY,MA,1464,NOT AVAILABLE,(978) 425-4341,STATE,OPEN,1476,MIDDLESEX,25017,USA,922140,CORRECTIONAL INSTITUTIONS,http://www.mass.gov/eopss/law-enforce-and-cj/prisons/rsch-data/weekly-count-sheets.html,9/4/17,IMAGERY,2017-12-04T00:00:00.000Z,https://www.mass.gov/prison/locations,MEDIUM,1455,0.022040154,1.76E-05,296654.4219,2590.067572,25,17,388200,25017388200,3882,Census Tract 3882,G5020,S,40967067,204574,42.5736544,-71.6409862,MA,c(-71.6447857559965, 42.5277754710656)
1093,1081,10004449,NORTH CENTRAL CORRECTIONAL INSTITUTION,500 COLONY ROAD,GARDNER,MA,1440,NOT AVAILABLE,(978) 630-6000,STATE,OPEN,959,WORCESTER,25027,USA,922140,CORRECTIONAL INSTITUTIONS,http://www.mass.gov/eopss/law-enforce-and-cj/prisons/rsch-data/weekly-count-sheets.html,9/4/17,IMAGERY,2017-12-04T00:00:00.000Z,https://www.mass.gov/prison/locations,MEDIUM,1012,0.014419203,1.33E-05,223729.6406,1824.082795,25,27,707500,25027707500,7075,Census Tract 7075,G5020,S,27895453,1085182,42.5925766,-71.9674534,MA,c(-71.9416300008503, 42.5797906425079)
1094,1082,10006585,EDGECOMBE YOUTH DEVELOPMENT CENTER,78 POSITIVE WAY,ROCKY MOUNT,NC,27801,NOT AVAILABLE,(252) 544-5730,STATE,OPEN,67,EDGECOMBE,37065,USA,922140,CORRECTIONAL INSTITUTIONS,https://www.ncdps.gov/annual-report-youth-development-centers-october-2017,10/1/17,IMAGERY,2017-12-13T00:00:00.000Z,https://www.ncdps.gov/Juvenile-Justice/Juvenile-Facility-Operations/Youth-Development-Centers,JUVENILE,44,0.002939978,5.22E-07,7994.011719,366.5458924,37,65,20600,37065020600,206,Census Tract 206,G5020,S,139240553,276156,35.9942385,-77.6905098,NC,c(-77.7714258298301, 35.9940204373143)
1095,1083,10002940,SEGOVIA PRE-RELEASE FACILITY,1201 E EL CIBOLO RD,EDINBURG,TX,78542,NOT AVAILABLE,(956) 316-2400,STATE,OPEN,1167,HIDALGO,48215,USA,922140,CORRECTIONAL INSTITUTIONS,"https://www.texastribune.org/library/data/texas-prisons/units/, http://www.tdcj.state.tx.us/unit_directory/index.html",9/15/16,IMAGERY,2018-01-11T00:00:00.000Z,http://www.tdcj.state.tx.us/unit_directory/index.html,MEDIUM,1224,0.00942759,5.72E-06,79130.78711,1108.168772,48,215,23512,48215023512,235.12,Census Tract 235.12,G5020,S,33519019,0,26.4243643,-98.0958984,TX,c(-98.120560800203, 26.4173751285151)
1096,1084,10002219,MESA COUNTY JAIL / SHERIFF,215 RICE STREET,GRAND JUNCTION,CO,81501,NOT AVAILABLE,NOT AVAILABLE,COUNTY,OPEN,574,MESA,8077,USA,922140,CORRECTIONAL INSTITUTIONS,http://sheriff.mesacounty.us/jail/,2/20/18,IMAGERY,2018-02-20T00:00:00.000Z,http://sheriff.mesacounty.us/jail/,NOT AVAILABLE,440,0.006471368,1.95E-06,31048.21875,834.3273874,8,77,900,8077000900,9,Census Tract 9,G5020,S,16764091,1363149,39.1013837,-108.6167119,CO,c(-108.574093223375, 39.0683510887901)
1097,1085,10004041,ST. MARY'S COUNTY DETENTION CENTER,41880 BALDRIDGE ST,LEONARDTOWN,MD,20650,NOT AVAILABLE,(301) 475-4200 EXT 2200,COUNTY,OPEN,198,ST. MARY'S,24037,USA,922140,CORRECTIONAL INSTITUTIONS,http://dlslibrary.state.md.us/publications/JCR/2016/2016_309.pdf,8/30/16,IMAGERY,2018-03-20T00:00:00.000Z,https://www.firstsheriff.com/corrections.asp,NOT AVAILABLE,245,0.005009678,6.94E-07,10952.94922,621.5367952,24,37,875500,24037875500,8755,Census Tract 8755,G5020,S,88296359,396771,38.3156097,-76.6275785,MD,c(-76.6278693442997, 38.3028899919663)
1098,1086,10004666,OGLE COUNTY JAIL,107 SOUTH 5TH STREET,OREGON,IL,61061,NOT AVAILABLE,(815) 732-2135,COUNTY,OPEN,64,OGLE,17141,USA,922140,CORRECTIONAL INSTITUTIONS,"http://oglecounty.org/departments/sheriff/ogle-county-jail/, http://www.ilsheriff.org/index.php/directory",12/31/17,IMAGERY,2018-03-02T00:00:00.000Z,http://oglecounty.org/departments/sheriff/ogle-county-jail/,NOT AVAILABLE,109,0.001447671,1.27E-07,2117.386719,193.8865558,17,141,961400,17141961400,9614,Census Tract 9614,G5020,S,21404647,906334,42.0178323,-89.3090238,IL,c(-89.3332090542483, 42.0136405099885)
1099,1087,10002218,MESA COUNTY ALTERNATIVE SENTENCING UNIT,650 SOUTH AVENUE,GRAND JUNCTION,CO,81501,NOT AVAILABLE,NOT AVAILABLE,COUNTY,CLOSED,0,MESA,8077,USA,922140,CORRECTIONAL INSTITUTIONS,http://www.mcsonews.com/2016/04/alternative-sentencing-unit-no-longer.html,4/8/16,IMAGERY,2018-02-20T00:00:00.000Z,http://sheriff.mesacounty.us/jail/template.aspx?id=5232,NOT AVAILABLE,-999,0.001509931,1.41E-07,2249.199219,189.7591718,8,77,800,8077000800,8,Census Tract 8,G5020,S,15875844,315678,39.0509375,-108.5105025,CO,c(-108.563076063127, 39.0641132712048)
1100,1088,10004042,WORCESTER COUNTY JAIL,5022 JOYNER RD,SNOW HILL,MD,21863,NOT AVAILABLE,(410) 632-1300,COUNTY,OPEN,184,WORCESTER,24047,USA,922140,CORRECTIONAL INSTITUTIONS,http://dlslibrary.state.md.us/publications/JCR/2016/2016_309.pdf,8/30/16,IMAGERY,2018-03-20T00:00:00.000Z,http://www.co.worcester.md.us/departments,NOT AVAILABLE,480,0.008376323,2.12E-06,33428.54297,1040.095369,24,47,951300,24047951300,9513,Census Tract 9513,G5020,S,15375010,914127,38.1618108,-75.3968682,MD,c(-75.3758057937819, 38.1697860621626)
1101,1089,10001472,PEORIA COUNTY JUVENILE DETENTION CENTER,223 NORTH MAXWELL ROAD,PEORIA,IL,61604,NOT AVAILABLE,(309) 634-4200,COUNTY,OPEN,43,PEORIA,17143,USA,922140,CORRECTIONAL INSTITUTIONS,http://www.10thcircuitcourtil.org/198/Prison-Rape-Elimination-Act-PREA,6/16/16,IMAGERY,2018-03-02T00:00:00.000Z,http://www.10thcircuitcourtil.org/190/Juvenile-Detention-Center,JUVENILE,63,0.004315478,6.17E-07,10087.5625,531.5524995,17,143,4500,17143004500,45,Census Tract 45,G5020,S,31193605,0,40.7041267,-89.692448,IL,c(-89.6960424964278, 40.6894833266957)
1102,1090,10003635,CUMBERLAND COUNTY JAIL,36 COUNTY WAY,PORTLAND,ME,4102,NOT AVAILABLE,(207) 774-5939,COUNTY,OPEN,340,CUMBERLAND,23005,USA,922140,CORRECTIONAL INSTITUTIONS,http://www.cumberlandso.org/31/Corrections-Division,3/20/18,IMAGERY,2018-03-20T00:00:00.000Z,http://www.cumberlandso.org/31/Corrections-Division,MAXIMUM,500,0.007372659,1.71E-06,29363.75,931.0680895,23,5,2002,23005002002,20.02,Census Tract 20.02,G5020,S,8388219,928710,43.653008,-70.3135329,ME,c(-70.2817508321055, 43.650791762868)
1103,1091,10001392,NORTHEASTERN CORRECTIONAL INSTITUTION,1 BARRETTS MILL RD,WEST CONCORD,MA,1742,NOT AVAILABLE,(978) 371-7941,STATE,OPEN,193,MIDDLESEX,25017,USA,922140,CORRECTIONAL INSTITUTIONS,http://www.mass.gov/eopss/law-enforce-and-cj/prisons/rsch-data/weekly-count-sheets.html,9/4/17,IMAGERY,2017-12-04T00:00:00.000Z,https://www.mass.gov/prison/locations,MINIMUM,277,0.012708002,7.34E-06,123325.4961,1630.015197,25,17,361300,25017361300,3613,Census Tract 3613,G5020,S,34660437,1781059,42.4776669,-71.3424997,MA,c(-71.3979683963659, 42.4722627128396)
1104,1092,10002792,SKYVIEW PSYCHIATRIC FACILITY,379 FM 2972 WEST,RUSK,TX,75785,3666,(903) 683-5781,STATE,OPEN,466,CHEROKEE,48073,USA,922140,CORRECTIONAL INSTITUTIONS,"https://www.texastribune.org/library/data/texas-prisons/units/, http://www.tdcj.state.tx.us/unit_directory/index.html",9/15/16,IMAGERY,2018-01-11T00:00:00.000Z,http://www.tdcj.state.tx.us/unit_directory/index.html,MAXIMUM,562,0.013035294,9.04E-06,131833.25,1537.756029,48,73,950900,48073950900,9509,Census Tract 9509,G5020,S,29349902,57206,31.8041275,-95.0905697,TX,c(-95.1647222174059, 31.81132658011)
1105,1093,10004204,STONEWALL JACKSON YOUTH DEVELOPMENT CENTER,850 HOLSHOUSER ROAD,CONCORD,NC,28027,NOT AVAILABLE,(704) 652-4300,STATE,OPEN,227,CABARRUS,37025,USA,922140,CORRECTIONAL INSTITUTIONS,https://www.ncdps.gov/annual-report-youth-development-centers-october-2017,10/1/17,IMAGERY,2017-12-13T00:00:00.000Z,https://www.ncdps.gov/Juvenile-Justice/Juvenile-Facility-Operations/Youth-Development-Centers,JUVENILE,128,0.023118828,1.92E-05,292057.5508,2829.736872,37,25,42000,37025042000,420,Census Tract 420,G5020,S,16774875,0,35.3758415,-80.6155081,NC,c(-80.6005273982073, 35.3639349668862)
1106,1094,10004451,OLD COLONY CORRECTIONAL CENTER,1 ADMINISTRATION ROAD,BRIDGEWATER,MA,2324,NOT AVAILABLE,(508) 279-6000,STATE,OPEN,702,PLYMOUTH,25023,USA,922140,CORRECTIONAL INSTITUTIONS,http://www.mass.gov/eopss/law-enforce-and-cj/prisons/rsch-data/weekly-count-sheets.html,9/4/17,IMAGERY,2017-12-04T00:00:00.000Z,https://www.mass.gov/prison/locations,MEDIUM,757,0.012633959,9.80E-06,163267.4609,1577.375918,25,23,525300,25023525300,5253,Census Tract 5253,G5020,S,6959548,328265,41.9500489,-70.9519064,MA,c(-70.9555808243045, 41.9492869139956)
1107,1095,10004011,OCEAN COUNTY JAIL,114 HOOPER AVE,TOMS RIVER,NJ,8754,NOT AVAILABLE,NOT AVAILABLE,COUNTY,OPEN,-999,OCEAN,34029,USA,922140,CORRECTIONAL INSTITUTIONS,"http://www.co.ocean.nj.us/corrections/index.htm, http://m.pressofatlanticcity.com/news/breaking/cape-jail-looks-to-expand-to-ease-overcrowding-increase-security/article_80e0cee6-6112-11e2-a242-001a4bcf887a.html?mode=jqm",2/15/16,IMAGERY,2018-04-06T00:00:00.000Z,http://www.co.ocean.nj.us/CorrectionsWebSite/,MAXIMUM,700,0.005305577,1.08E-06,17497.90234,662.683488,34,29,723100,34029723100,7231,Census Tract 7231,G5020,S,3707977,39058,39.9566515,-74.1894156,NJ,c(-74.1947123510476, 39.9538555840328)
1108,1096,10002758,SMITH PRISON,1313 COUNTY RD 19,LAMESA,TX,79331,1898,(806) 872-6741,STATE,OPEN,1254,DAWSON,48115,USA,922140,CORRECTIONAL INSTITUTIONS,"https://www.texastribune.org/library/data/texas-prisons/units/, http://www.tdcj.state.tx.us/unit_directory/index.html",9/15/16,IMAGERY,2018-01-11T00:00:00.000Z,http://www.tdcj.state.tx.us/unit_directory/index.html,MAXIMUM,2234,0.015832878,1.53E-05,225709.1094,1888.689336,48,115,950402,48115950402,9504.02,Census Tract 9504.02,G5020,S,81959645,183008,32.7116702,-101.9935199,TX,c(-101.910745664694, 32.7266689785758)
1109,1097,10002710,CHILDRESS COUNTY JAIL,1005 AVENUE F NE,CHILDRESS,TX,79201,NOT AVAILABLE,NOT AVAILABLE,COUNTY,OPEN,51,CHILDRESS,48075,USA,922140,CORRECTIONAL INSTITUTIONS,"https://www.tcjs.state.tx.us/index.php?linkID=325, http://www.childresscountytexas.us/Sheriff/Sheriff.htm",3/1/18,IMAGERY,2018-04-26T00:00:00.000Z,NOT AVAILABLE,NOT AVAILABLE,94,0.002197993,2.17E-07,3257.148438,265.55328,48,75,950200,48075950200,9502,Census Tract 9502,G5020,S,26635948,214423,34.4111893,-100.2078504,TX,c(-100.193535700026, 34.4230053482997)
1110,1098,10000690,PERRY COUNTY JAIL,12 EAST WATER STREET,PINCKNEYVILLE,IL,62274,NOT AVAILABLE,(618) 357-5212,COUNTY,OPEN,-999,PERRY,17145,USA,922140,CORRECTIONAL INSTITUTIONS,http://www.ilsheriff.org/index.php/directory,3/2/18,IMAGERY,2018-03-02T00:00:00.000Z,https://perrycountysheriffsoffice.com/,NOT AVAILABLE,56,0.001497184,1.40E-07,2198.433594,190.2984135,17,145,30200,17145030200,302,Census Tract 302,G5020,S,147609032,1880476,38.0941512,-89.3610405,IL,c(-89.3812574999218, 38.0797224465672)
1111,1099,10004010,OCEAN COUNTY JUVENILE DETENTION CENTER,165 SUNSET AVE,TOMS RIVER,NJ,8754,NOT AVAILABLE,(732) 341-1365,COUNTY,OPEN,21,OCEAN,34029,USA,922140,CORRECTIONAL INSTITUTIONS,"http://www.co.ocean.nj.us/ocjs/JSOverview.aspx, http://www.nj.gov/lps/jjc/2011-AnnualDetentionStatisticsReport.pdf",2/15/16,IMAGERY/OTHER,2018-04-06T00:00:00.000Z,http://www.co.ocean.nj.us/ocjs/JSOverview.aspx,JUVENILE,30,0.005107048,1.03E-06,16644.76172,621.4743695,34,29,722002,34029722002,7220.02,Census Tract 7220.02,G5020,S,10591298,58166,40.0158088,-74.2240866,NJ,c(-74.2242619985998, 40.0063324514752)
1112,1100,10000022,RANDOLPH COUNTY SHERIFF'S DEPARTMENT,25 HIGH STREET,ELKINS,WV,26241,NOT AVAILABLE,NOT AVAILABLE,COUNTY,NOT AVAILABLE,-999,RANDOLPH,54083,USA,922140,CORRECTIONAL INSTITUTIONS,NOT AVAILABLE,NOT AVAILABLE,IMAGERY/OTHER,2018-05-10T00:00:00.000Z,NOT AVAILABLE,NOT AVAILABLE,-999,0.002966006,2.46E-07,3925.007813,367.6999064,54,83,966100,54083966100,9661,Census Tract 9661,G5020,S,3734398,0,38.9296131,-79.852674,WV,c(-79.8430199535352, 38.92327870047)
1113,1101,10000011,TYLER COUNTY JAIL / SHERIFF,121 COURT ST,MIDDLEBOURNE,WV,26149,NOT AVAILABLE,NOT AVAILABLE,COUNTY,NOT AVAILABLE,-999,TYLER,54095,USA,922140,CORRECTIONAL INSTITUTIONS,http://www.tylercountywv.com/admin/sheriff-tax-office.htm,3/4/16,UNVERIFIED,2018-05-10T00:00:00.000Z,NOT AVAILABLE,NOT AVAILABLE,-999,0.001295753,8.98E-08,1441.972656,158.4850612,54,95,961900,54095961900,9619,Census Tract 9619,G5020,S,257141077,6258679,39.5141063,-80.9200073,WV,c(-80.9032562321206, 39.492132222911)
1114,1102,10000282,PONDVILLE CORRECTIONAL CENTER,1 INDUSTRIES DR,NORFOLK,MA,2056,NOT AVAILABLE,(508) 660-3924,STATE,OPEN,150,NORFOLK,25021,USA,922140,CORRECTIONAL INSTITUTIONS,http://www.mass.gov/eopss/law-enforce-and-cj/prisons/rsch-data/weekly-count-sheets.html,9/4/17,IMAGERY,2017-12-04T00:00:00.000Z,https://www.mass.gov/prison/locations,MINIMUM,204,0.008062823,1.94E-06,32370.68359,1018.061031,25,21,409101,25021409101,4091.01,Census Tract 4091.01,G5020,S,20875886,733000,42.1167622,-71.3168858,MA,c(-71.2930257719373, 42.1084424133523)
1115,1103,10006348,BURKE CRV CENTER,5161 WESTERN AVE,MORGANTON,NC,28655,NOT AVAILABLE,(828) 433-4036,STATE,OPEN,155,BURKE,37023,USA,922140,CORRECTIONAL INSTITUTIONS,"http://webapps6.doc.state.nc.us/apps/asqExt/ASQ, https://www.ncdps.gov/Adult-Corrections/Community-Corrections/Confinement-in-Response-to-Violation-CRV",10/31/17,IMAGERY,2017-12-13T00:00:00.000Z,https://www.ncdps.gov/Adult-Corrections/Community-Corrections/Confinement-in-Response-to-Violation-CRV,MINIMUM,248,0.005422459,1.80E-06,27526.79297,661.8434018,37,23,21301,37023021301,213.01,Census Tract 213.01,G5020,S,41597597,0,35.6808305,-81.6823365,NC,c(-81.6804208949018, 35.6772600458501)
1116,1104,10001794,ROBESON CRV CENTER,803 NC HWY 711,LUMBERTON,NC,28360,NOT AVAILABLE,(910) 618-5535,STATE,OPEN,145,ROBESON,37155,USA,922140,CORRECTIONAL INSTITUTIONS,"http://webapps6.doc.state.nc.us/apps/asqExt/ASQ, https://www.ncdps.gov/Adult-Corrections/Community-Corrections/Confinement-in-Response-to-Violation-CRV",10/31/17,IMAGERY,2017-12-13T00:00:00.000Z,https://www.ncdps.gov/Adult-Corrections/Community-Corrections/Confinement-in-Response-to-Violation-CRV,MINIMUM,192,0.006550176,1.73E-06,26033.6875,796.5886264,37,155,960600,37155960600,9606,Census Tract 9606,G5020,S,70493022,5388,34.6702499,-79.1045572,NC,c(-79.0737554396604, 34.6245429600544)
1117,1105,10004443,SOUTH MIDDLESEX CORRECTIONAL CENTER,135 WESTERN AVENUE,FRAMINGHAM,MA,1701,NOT AVAILABLE,(508) 875-2883,STATE,OPEN,112,MIDDLESEX,25017,USA,922140,CORRECTIONAL INSTITUTIONS,http://www.mass.gov/eopss/law-enforce-and-cj/prisons/rsch-data/weekly-count-sheets.html,9/4/17,IMAGERY,2017-12-04T00:00:00.000Z,https://www.mass.gov/prison/locations,MINIMUM,185,0.003732112,4.12E-07,6903.75,471.5313187,25,17,383101,25017383101,3831.01,Census Tract 3831.01,G5020,S,2815540,9845,42.2673461,-71.4076209,MA,c(-71.4059207136379, 42.2652753329448)
1118,1106,10004150,CHARLES A DILLON YOUTH DEVELOPMENT CENTER,100 DILLON DR,BUTNER,NC,27509,NOT AVAILABLE,(919) 575-3166,STATE,CLOSED,0,GRANVILLE,37077,USA,922140,CORRECTIONAL INSTITUTIONS,https://www.ncdps.gov/press-release/north-carolina-invests-giving-troubled-youth-second-chance,4/14/16,IMAGERY,2017-12-13T00:00:00.000Z,"https://www.ncdps.gov/Index2.cfm?a=000003,002476,003108,003110",JUVENILE,90,0.012093641,4.78E-06,73321.08594,1524.053913,37,77,970704,37077970704,9707.04,Census Tract 9707.04,G5020,S,7857872,18933,36.1547908,-78.7934856,NC,c(-78.7924784368011, 36.1494039765315)
1119,1107,10002900,STEVENSON PRISON,1525 FM 766,CUERO,TX,77954,NOT AVAILABLE,(361) 275-2075,STATE,OPEN,1363,DEWITT,48123,USA,922140,CORRECTIONAL INSTITUTIONS,"https://www.texastribune.org/library/data/texas-prisons/units/, http://www.tdcj.state.tx.us/unit_directory/index.html",9/15/16,IMAGERY,2018-01-11T00:00:00.000Z,http://www.tdcj.state.tx.us/unit_directory/index.html,MEDIUM,1384,0.012893621,1.04E-05,147086.7656,1519.170227,48,123,970200,48123970200,9702,Census Tract 9702,G5020,S,430504902,1135978,29.169844,-97.406001,TX,c(-97.2976500229214, 29.1343014662004)
1120,1108,10004209,GASTON REG JUVENILE DETENTION CENTER,135 CAMP SERTOMA RD,DALLAS,NC,28034,NOT AVAILABLE,(704) 922-7832,STATE,CLOSED,0,GASTON,37071,USA,922140,CORRECTIONAL INSTITUTIONS,http://www.wbtv.com/story/29755154/new-juvenile-detention-center-slated-to-open-in-concord,9/9/15,IMAGERY,2017-12-13T00:00:00.000Z,"https://www.ncdps.gov/Index2.cfm?a=000003,002476,003108,003109",JUVENILE,24,0.0020539,1.86E-07,2821.265625,251.2679286,37,71,30402,37071030402,304.02,Census Tract 304.02,G5020,S,34509843,196129,35.325771,-81.2399149,NC,c(-81.2097188214415, 35.3204229610599)
1121,1109,10006716,MESA COUNTY COMMUNITY CORRECTIONS - POWELL BUILDING,650 SOUTH AVENUE,GRAND JUNCTION,CO,81501,NOT AVAILABLE,NOT AVAILABLE,COUNTY,OPEN,-999,MESA,8077,USA,922140,CORRECTIONAL INSTITUTIONS,http://cjsd.mesacounty.us/ResidentialServices.aspx,2/20/18,IMAGERY,2018-02-20T00:00:00.000Z,http://cjsd.mesacounty.us/ResidentialServices.aspx,NOT AVAILABLE,-999,0.001875149,2.04E-07,3253.058594,230.7015961,8,77,800,8077000800,8,Census Tract 8,G5020,S,15875844,315678,39.0509375,-108.5105025,CO,c(-108.561563219336, 39.063750911491)
1122,1110,10004697,PIATT COUNTY JAIL,1216 RAYMOND ROAD,MONTICELLO,IL,61856,NOT AVAILABLE,(217) 762-7822,COUNTY,OPEN,-999,PIATT,17147,USA,922140,CORRECTIONAL INSTITUTIONS,http://sheriff.piattcounty.org/,3/2/18,IMAGERY,2018-03-02T00:00:00.000Z,http://sheriff.piattcounty.org/,NOT AVAILABLE,76,0.002556465,3.24E-07,5241.714844,325.331406,17,147,954600,17147954600,9546,Census Tract 9546,G5020,S,65445815,12863,40.0150673,-88.5767335,IL,c(-88.5785335205763, 40.0073053429771)
1123,1111,10000039,WAYNE COUNTY SHERIFF'S OFFICE,700 HENDRICKS ST,WAYNE,WV,25570,NOT AVAILABLE,NOT AVAILABLE,COUNTY,NOT AVAILABLE,-999,WAYNE,54099,USA,922140,CORRECTIONAL INSTITUTIONS,http://www.waynecountywv.org/sheriff.php,3/1/16,IMAGERY,2018-05-10T00:00:00.000Z,NOT AVAILABLE,NOT AVAILABLE,-999,0.001698342,1.59E-07,2515.769531,211.1516669,54,99,20600,54099020600,206,Census Tract 206,G5020,S,78375415,0,38.2731242,-82.4777472,WV,c(-82.442677725774, 38.2210272270588)
1124,1112,10000030,WEBSTER COUNTY SHERIFF DEPARTMENT,2 COURT SQUARE,WEBSTER SPRINGS,WV,26288,NOT AVAILABLE,NOT AVAILABLE,COUNTY,NOT AVAILABLE,-999,WEBSTER,54101,USA,922140,CORRECTIONAL INSTITUTIONS,http://www.webstercounty.wv.gov/countygovernmentagencies/Pages/sheriff.aspx,3/4/16,IMAGERY,2018-05-10T00:00:00.000Z,NOT AVAILABLE,NOT AVAILABLE,-999,0.001553497,1.32E-07,2085.101563,191.3643034,54,101,970200,54101970200,9702,Census Tract 9702,G5020,S,289445092,1808446,38.5064641,-80.2961161,WV,c(-80.4119588390632, 38.4780294254322)
1125,1113,10001396,SOUZA-BARANOWSKI CORRECTIONAL CENTER,1 HARVARD RD,SHIRLEY,MA,1464,NOT AVAILABLE,(978) 514-6500,STATE,OPEN,1075,WORCESTER,25027,USA,922140,CORRECTIONAL INSTITUTIONS,http://www.mass.gov/eopss/law-enforce-and-cj/prisons/rsch-data/weekly-count-sheets.html,9/4/17,IMAGERY,2017-12-04T00:00:00.000Z,https://www.mass.gov/prison/locations,MAXIMUM,1410,0.011112778,7.36E-06,123713.8555,1425.158797,25,27,713100,25027713100,7131,Census Tract 7131,G5020,S,71144123,1335617,42.4835693,-71.6755848,MA,c(-71.6480585863139, 42.5233984515712)
1126,1114,10000229,STILES UNIT,3060 FM 3514,BEAUMONT,TX,77705,NOT AVAILABLE,(409) 722-5255,STATE,OPEN,2819,JEFFERSON,48245,USA,922140,CORRECTIONAL INSTITUTIONS,"https://www.texastribune.org/library/data/texas-prisons/units/, http://www.tdcj.state.tx.us/unit_directory/index.html",9/15/16,IMAGERY,2018-01-11T00:00:00.000Z,http://www.tdcj.state.tx.us/unit_directory/index.html,MEDIUM,2981,0.017913225,2.25E-05,322413.8906,2138.520326,48,245,11203,48245011203,112.03,Census Tract 112.03,G5020,S,3496273,130615,29.985982,-94.050079,TX,c(-94.0524959671409, 29.9884368536444)
1127,1115,10003864,CENTER FOR HUMAN DEVELOPMENT - TERRI THOMAS SCHOOL,280 TINKHAM ROAD,SPRINGFIELD,MA,1129,NOT AVAILABLE,(413) 731-4952,STATE,OPEN,15,HAMPDEN,25013,USA,922140,CORRECTIONAL INSTITUTIONS,http://chd.org/child-adolescent-and-family-services/juvenile-justice/,12/4/17,IMAGERY,2017-12-04T00:00:00.000Z,http://chd.org/child-adolescent-and-family-services/juvenile-justice/,JUVENILE,-999,0.007379297,2.37E-06,39659.72656,960.2117453,25,13,801604,25013801604,8016.04,Census Tract 8016.04,G5020,S,5228797,55126,42.1022055,-72.4895603,MA,c(-72.4808376796128, 42.1101363124483)
1128,1116,10002096,JUDGE JOHN CONNELLY YOUTH CENTER,450 CANTERBURY ST,ROSLINDALE,MA,2131,NOT AVAILABLE,(617) 474-8101,STATE,OPEN,75,SUFFOLK,25025,USA,922140,CORRECTIONAL INSTITUTIONS,https://www.publiccounsel.net/ya/wp-content/uploads/sites/6/2015/05/DYS-Metro-Region-Contact-List-4.20151.pdf,12/4/17,IMAGERY,2017-12-04T00:00:00.000Z,NOT AVAILABLE,JUVENILE,-999,0.005048153,8.58E-07,14378.8125,642.6921778,25,25,981100,25025981100,9811,Census Tract 9811,G5020,S,2712308,19090,42.2879942,-71.1034042,MA,c(-71.1024261722255, 42.2914814953593)
1129,1117,10004034,BALTIMORE CENTRAL BOOKING AND INTAKE CENTER,300 E MADISON ST,BALTIMORE,MD,21202,NOT AVAILABLE,(410) 545-8080,STATE,OPEN,166,BALTIMORE CITY,24510,USA,922140,CORRECTIONAL INSTITUTIONS,http://dpscs.maryland.gov/publicinfo/publications/annuals.shtml#doc,6/30/16,IMAGERY/OTHER,2017-12-04T00:00:00.000Z,http://www.dpscs.maryland.gov/locations/prisons.shtml,MAXIMUM,895,0.005381363,6.52E-07,10434.20313,731.9568709,24,510,100300,24510100300,1003,Census Tract 1003,G5020,S,156309,0,39.2995112,-76.609125,MD,c(-76.6105000381893, 39.3000825569821)
1130,1118,10000178,ESTES PRISON,1100 HWY 1807,VENUS,TX,76084,NOT AVAILABLE,(972) 366-3334,STATE,OPEN,1023,JOHNSON,48251,USA,922140,CORRECTIONAL INSTITUTIONS,"https://www.texastribune.org/library/data/texas-prisons/units/, http://www.tdcj.state.tx.us/unit_directory/index.html",9/15/16,IMAGERY/OTHER,2018-01-11T00:00:00.000Z,http://www.mtctrains.com/corrections/#locations,MINIMUM,1040,0.008885848,4.87E-06,71529.17578,1069.927193,48,251,130408,48251130408,1304.08,Census Tract 1304.08,G5020,S,115026303,380022,32.4276183,-97.1177286,TX,c(-97.0959698666291, 32.407451929268)
1131,1119,10004181,MARION MINIMUM SECURITY UNIT,4019 STATE HWY 226 S,MARION,NC,28752,NOT AVAILABLE,(828) 659-7810,STATE,OPEN,-999,MCDOWELL,37111,USA,922140,CORRECTIONAL INSTITUTIONS,https://www.ncdps.gov/Adult-Corrections/Prisons/Prison-Facilities,12/13/17,IMAGERY,2017-12-13T00:00:00.000Z,https://www.ncdps.gov/Adult-Corrections/Prisons/Prison-Facilities,MINIMUM,116,0.007593724,1.63E-06,24789.54297,930.5887883,37,111,970901,37111970901,9709.01,Census Tract 9709.01,G5020,S,198541245,667822,35.6212043,-81.9095781,NC,c(-81.9536078462669, 35.6521395746038)
1132,1120,10001477,PIKE COUNTY JAIL,204 EAST ADAMS STREET,PITTSFIELD,IL,62363,NOT AVAILABLE,(217) 285-5011,COUNTY,OPEN,-999,PIKE,17149,USA,922140,CORRECTIONAL INSTITUTIONS,http://www.ilsheriff.org/index.php/directory,3/2/18,IMAGERY,2018-03-02T00:00:00.000Z,http://www.pikecountyil.org/pike-county-sheriff/,NOT AVAILABLE,62,0.001576964,1.15E-07,1845.859375,199.0531038,17,149,952700,17149952700,9527,Census Tract 9527,G5020,S,29912100,144487,39.6126418,-90.8052704,IL,c(-90.8042066311398, 39.6082556885499)
1133,1121,10004735,POPE COUNTY JAIL,216 EAST DECATUR STREET,GOLCONDA,IL,62938,NOT AVAILABLE,(618) 683-4321,COUNTY,OPEN,-999,POPE,17151,USA,922140,CORRECTIONAL INSTITUTIONS,http://www.ilsheriff.org/index.php/directory?option=com_countysheriffs&view=countysheriffs,3/2/18,UNVERIFIED,2018-03-02T00:00:00.000Z,NOT AVAILABLE,NOT AVAILABLE,-999,0.000926887,5.27E-08,821.9023438,117.9448316,17,151,971300,17151971300,9713,Census Tract 9713,G5020,S,333545835,10811618,37.2750214,-88.5409917,IL,c(-88.4849908110561, 37.3688403949803)
1134,1122,10006786,CUMBERLAND COUNTY COMMUNITY CORRECTION CENTER,20 COUNTY WAY,PORTLAND,ME,4102,NOT AVAILABLE,(207) 774-5939 EXT 2131,COUNTY,OPEN,-999,CUMBERLAND,23005,USA,922140,CORRECTIONAL INSTITUTIONS,http://www.cumberlandso.org/176/Community-Corrections,3/20/18,IMAGERY/OTHER,2018-03-20T00:00:00.000Z,http://www.cumberlandso.org/176/Community-Corrections,MINIMUM,-999,0.001310799,8.90E-08,1524.851563,169.8757682,23,5,2002,23005002002,20.02,Census Tract 20.02,G5020,S,8388219,928710,43.653008,-70.3135329,ME,c(-70.2813896248715, 43.6524219344509)
1135,1123,10004739,PULASKI COUNTY DETENTION CENTER,20 JUSTICE DRIVE,ULLIN,IL,62992,NOT AVAILABLE,(618) 845-3512,COUNTY,OPEN,185,PULASKI,17153,USA,922140,CORRECTIONAL INSTITUTIONS,http://www.pulaskicountyil.net/pulaski-county-detention-center.html,12/2/16,IMAGERY,2018-03-02T00:00:00.000Z,http://www.pulaskicountyil.net/pulaski-county-detention-center.html,MAXIMUM,240,0.004517844,7.07E-07,11012.42188,568.1052369,17,153,971100,17153971100,9711,Census Tract 9711,G5020,S,243893617,2438951,37.22419,-89.1949567,IL,c(-89.1638792954855, 37.2690325813114)
1136,1124,10003984,PASSAIC COUNTY JAIL,11 MARSHALL ST,PATERSON,NJ,7501,NOT AVAILABLE,NOT AVAILABLE,COUNTY,OPEN,862,PASSAIC,34031,USA,922140,CORRECTIONAL INSTITUTIONS,http://www.pcsheriff.org/home.html,1/31/16,IMAGERY,2018-04-06T00:00:00.000Z,http://www.pcsheriff.org/home.html,MAXIMUM,1242,0.004561009,3.96E-07,6501.515625,574.7333772,34,31,181800,34031181800,1818,Census Tract 1818,G5020,S,421768,22980,40.9156717,-74.1761223,NJ,c(-74.1738478727564, 40.9126799382289)
1137,1125,10002731,TELFORD PRISON,3899 STATE HWY 98,NEW BOSTON,TX,75570,NOT AVAILABLE,(903) 628-3171,STATE,OPEN,2626,BOWIE,48037,USA,922140,CORRECTIONAL INSTITUTIONS,"https://www.texastribune.org/library/data/texas-prisons/units/, http://www.tdcj.state.tx.us/unit_directory/index.html",9/15/16,IMAGERY,2018-01-11T00:00:00.000Z,http://www.tdcj.state.tx.us/unit_directory/index.html,MAXIMUM,2872,0.018369709,2.35E-05,349168.793,2231.00756,48,37,11501,48037011501,115.01,Census Tract 115.01,G5020,S,163973513,1034203,33.4494554,-94.4805444,TX,c(-94.4735606847588, 33.4206841708399)
1138,1126,10001751,CALEDONIA CORRECTIONAL INSTITUTION - MINIMUM,"1984 CALEDONIA DR, STATE RD 1141",TILLERY,NC,27882,NOT AVAILABLE,(252) 826-5621,STATE,OPEN,-999,HALIFAX,37083,USA,922140,CORRECTIONAL INSTITUTIONS,https://www.ncdps.gov/Adult-Corrections/Prisons/Prison-Facilities,12/13/17,IMAGERY,2017-12-13T00:00:00.000Z,https://www.ncdps.gov/Adult-Corrections/Prisons/Prison-Facilities,MINIMUM,-999,0.011314138,5.91E-06,90873.18359,1402.245093,37,83,931000,37083931000,9310,Census Tract 9310,G5020,S,337828908,296036,36.2733034,-77.5165168,NC,c(-77.4633319854786, 36.2905251517648)
1139,1127,10001773,BLACK MOUNTAIN CORRECTIONAL CENTER FOR WOMEN,1449 N FORK RD,BLACK MOUNTAIN,NC,28711,NOT AVAILABLE,NOT AVAILABLE,STATE,CLOSED,0,BUNCOMBE,37021,USA,922140,CORRECTIONAL INSTITUTIONS,"https://www2.ncdps.gov/Index2.cfm?a=000003,002240,002324",11/13/15,IMAGERY,2017-12-13T00:00:00.000Z,"https://www.ncdps.gov/Index2.cfm?a=000003,002240,002324",MINIMUM,80,0.006040731,1.98E-06,30247.8125,745.8688109,37,21,3104,37021003104,31.04,Census Tract 31.04,G5020,S,55235712,876857,35.6877735,-82.3555208,NC,c(-82.3602531432952, 35.6107615618694)
1140,1128,10006546,BALTIMORE PRETRIAL COMPLEX,531 EAST MADISON STREET,BALTIMORE,MD,21202,NOT AVAILABLE,(410) 209-4130,STATE,OPEN,313,BALTIMORE CITY,24510,USA,922140,CORRECTIONAL INSTITUTIONS,http://dpscs.maryland.gov/publicinfo/publications/annuals.shtml#doc,6/30/16,IMAGERY,2017-12-04T00:00:00.000Z,http://www.dpscs.maryland.gov/locations/prisons.shtml,NOT AVAILABLE,-999,0.00277893,4.59E-07,7351.175781,344.6443439,24,510,100300,24510100300,1003,Census Tract 1003,G5020,S,156309,0,39.2995112,-76.609125,MD,c(-76.6084346824991, 39.2985478657336)
1141,1129,10001795,BLADEN CORRECTIONAL CENTER,5853 US HWY 701 N,ELIZABETHTOWN,NC,28337,NOT AVAILABLE,NOT AVAILABLE,STATE,CLOSED,0,BLADEN,37017,USA,922140,CORRECTIONAL INSTITUTIONS,"https://www2.ncdps.gov/Index2.cfm?a=000003,002240,002324",11/13/15,IMAGERY,2017-12-13T00:00:00.000Z,"https://www.ncdps.gov/Index2.cfm?a=000003,002240,002324",MINIMUM,172,0.004510019,1.15E-06,17263.84375,546.2484215,37,17,950100,37017950100,9501,Census Tract 9501,G5020,S,818510240,16611052,34.6257087,-78.397963,NC,c(-78.5190162691112, 34.6547012982744)
1142,1130,10004681,PUTNAM COUNTY JAIL,120 NORTH 4TH STREET,HENNEPIN,IL,61327,NOT AVAILABLE,(815) 925-7084,COUNTY,OPEN,-999,PUTNAM,17155,USA,922140,CORRECTIONAL INSTITUTIONS,http://www.ilsheriff.org/index.php/directory,3/2/18,IMAGERY,2018-03-02T00:00:00.000Z,https://www.co.putnam.il.us/county-offices/sheriff-s-office,NOT AVAILABLE,5,0.00223112,1.62E-07,2668.679688,265.3271446,17,155,954600,17155954600,9546,Census Tract 9546,G5020,S,292437277,29010204,41.1772988,-89.3148393,IL,c(-89.3423500607698, 41.2532443543043)
1143,1131,10006717,MESA COUNTY COMMUNITY CORRECTIONS - CHIPETA BUILDING,436 SOUTH 7TH STREET,GRAND JUNCTION,CO,81501,NOT AVAILABLE,NOT AVAILABLE,COUNTY,OPEN,-999,MESA,8077,USA,922140,CORRECTIONAL INSTITUTIONS,http://cjsd.mesacounty.us/ResidentialServices.aspx,2/20/18,IMAGERY,2018-02-20T00:00:00.000Z,http://cjsd.mesacounty.us/ResidentialServices.aspx,NOT AVAILABLE,-999,0.00138487,9.77E-08,1560.019531,166.8245346,8,77,800,8077000800,8,Census Tract 8,G5020,S,15875844,315678,39.0509375,-108.5105025,CO,c(-108.560641367364, 39.0636421846368)
1144,1132,10000241,C T TERRELL PRISON,1300 FM 655,ROSHARON,TX,77583,NOT AVAILABLE,(281) 595-3481,STATE,OPEN,1570,BRAZORIA,48039,USA,922140,CORRECTIONAL INSTITUTIONS,"https://www.texastribune.org/library/data/texas-prisons/units/, http://www.tdcj.state.tx.us/unit_directory/index.html",9/15/16,IMAGERY,2018-01-11T00:00:00.000Z,http://www.tdcj.state.tx.us/unit_directory/index.html,MEDIUM,1603,0.020967514,1.16E-05,164233.1836,2471.140165,48,39,661900,48039661900,6619,Census Tract 6619,G5020,S,302423802,5519691,29.3464118,-95.493318,TX,c(-95.5386196630314, 29.2992221002003)
1145,1133,10005030,FRANKLIN COUNTY DETENTION CENTER,121 COUNTY WAY,FARMINGTON,ME,4938,NOT AVAILABLE,(207) 778-3032,COUNTY,OPEN,42,FRANKLIN,23007,USA,922140,CORRECTIONAL INSTITUTIONS,http://www.franklincounty.maine.gov/dispatch-log-jail-bookings,3/18/18,IMAGERY/OTHER,2018-03-20T00:00:00.000Z,http://www.franklincounty.maine.gov/dispatch-log-jail-bookings,NOT AVAILABLE,-999,0.003259573,6.29E-07,10973.24609,420.9731988,23,7,971200,23007971200,9712,Census Tract 9712,G5020,S,144199921,382855,44.6769355,-70.1414906,ME,c(-70.1572787062391, 44.6971649936289)
1146,1134,10005032,HANCOCK COUNTY JAIL,50 STATE STREET,ELLSWORTH,ME,4605,NOT AVAILABLE,(207) 667-7588,COUNTY,OPEN,45,HANCOCK,23009,USA,922140,CORRECTIONAL INSTITUTIONS,https://co.hancock.me.us/site/index.php/state-police-so-call-sharing-agreement-8,3/20/18,IMAGERY/OTHER,2018-03-20T00:00:00.000Z,https://co.hancock.me.us/site/index.php/state-police-so-call-sharing-agreement-8,NOT AVAILABLE,-999,0.004563183,5.00E-07,8691.371094,585.7851555,23,9,965503,23009965503,9655.03,Census Tract 9655.03,G5020,S,41103798,6821051,44.5429412,-68.4087965,ME,c(-68.4260717900116, 44.542922635101)
1147,1135,10000020,WIRT COUNTY SHERIFF DEPARTMENT,1 COURT STREET,ELIZABETH,WV,26143,NOT AVAILABLE,NOT AVAILABLE,COUNTY,NOT AVAILABLE,-999,WIRT,54105,USA,922140,CORRECTIONAL INSTITUTIONS,http://www.littlekanawha.com/wirtphone.htm,3/1/16,UNVERIFIED,2018-05-10T00:00:00.000Z,NOT AVAILABLE,NOT AVAILABLE,-999,0.001423821,1.10E-07,1752.335938,176.6101658,54,105,30101,54105030101,301.01,Census Tract 301.01,G5020,S,363340368,2969702,39.0013168,-81.4200134,WV,c(-81.3940684792896, 39.0635986015078)
1148,1136,10003983,KEOGH DWYER CORRECTIONAL FACILITY,41 HIGH ST,NEWTON,NJ,7860,NOT AVAILABLE,NOT AVAILABLE,COUNTY,OPEN,116,SUSSEX,34037,USA,922140,CORRECTIONAL INSTITUTIONS,http://www.sussexcountysheriff.com/,4/6/18,IMAGERY/OTHER,2018-04-06T00:00:00.000Z,http://www.sussexcountysheriff.com/,NOT AVAILABLE,225,0.003683593,3.95E-07,6494.226563,464.1891905,34,37,373700,34037373700,3737,Census Tract 3737,G5020,S,3820497,38566,41.059797,-74.7578985,NJ,c(-74.7549164389182, 41.0589083529865)
1149,1137,10001980,MCLENNAN RESIDENTIAL TREATMENT CENTER,116 BURLESON RD,MART,TX,76664,NOT AVAILABLE,(254) 297-8200,STATE,OPEN,65,MCLENNAN,48309,USA,922140,CORRECTIONAL INSTITUTIONS,http://www.tjjd.texas.gov/programs/prea.aspx,1/14/16,IMAGERY,2018-01-12T00:00:00.000Z,http://www.tjjd.texas.gov/programs/facilities_list.aspx,JUVENILE,185,0.009938695,6.07E-06,88324.40625,1197.497518,48,309,3601,48309003601,36.01,Census Tract 36.01,G5020,S,106873839,1823592,31.5506146,-96.8798056,TX,c(-96.844552186307, 31.5455023415424)
1150,1138,10004188,WESTERN AREA MULTIPURPOSE JUVENILE CRISIS AND ASSESMENT CENTER,20 LEES CREEK RD,ASHEVILLE,NC,28806,NOT AVAILABLE,(828) 338-8340,STATE,OPEN,-999,BUNCOMBE,37021,USA,922140,CORRECTIONAL INSTITUTIONS,https://www.ncdps.gov/press-release/thursday-open-house-scheduled-western-area-multipurpose-juvenile-crisis-and-assessment,8/22/16,IMAGERY,2017-12-13T00:00:00.000Z,NOT AVAILABLE,JUVENILE,4,0.002609886,4.46E-07,6796.101563,313.9188454,37,21,2607,37021002607,26.07,Census Tract 26.07,G5020,S,16386367,409683,35.6342979,-82.6148321,NC,c(-82.6283370182689, 35.6152254101505)
1151,1139,10004205,CABARRUS CORRECTIONAL CENTER,130 DUTCH RD,MOUNT PLEASANT,NC,28124,NOT AVAILABLE,NOT AVAILABLE,STATE,CLOSED,0,CABARRUS,37025,USA,922140,CORRECTIONAL INSTITUTIONS,"https://www2.ncdps.gov/Index2.cfm?a=000003,002240,002324",11/13/15,IMAGERY,2017-12-13T00:00:00.000Z,"https://www.ncdps.gov/Index2.cfm?a=000003,002240,002324",MINIMUM,-999,0.005072705,1.46E-06,22163.34375,642.1483384,37,25,41701,37025041701,417.01,Census Tract 417.01,G5020,S,73024968,0,35.39808,-80.4047449,NC,c(-80.412675758894, 35.3977890504657)
1152,1140,10000155,TULIA TRANSFER FACILITY,4000 HWY 86 W,TULIA,TX,79088,NOT AVAILABLE,(806) 995-4109,STATE,OPEN,594,SWISHER,48437,USA,922140,CORRECTIONAL INSTITUTIONS,"https://www.texastribune.org/library/data/texas-prisons/units/, http://www.tdcj.state.tx.us/unit_directory/index.html",9/15/16,IMAGERY,2018-01-12T00:00:00.000Z,http://www.tdcj.state.tx.us/unit_directory/index.html,MEDIUM,606,0.007886101,3.40E-06,51195.97656,981.7168025,48,437,950200,48437950200,9502,Census Tract 9502,G5020,S,1469235836,18328645,34.6100135,-101.7496792,TX,c(-101.812788964524, 34.5312299923385)
1153,1141,10004203,CHARLOTTE CORRECTIONAL CENTER,4100 MEADOW OAK DR,CHARLOTTE,NC,28208,NOT AVAILABLE,NOT AVAILABLE,STATE,CLOSED,0,MECKLENBURG,37119,USA,922140,CORRECTIONAL INSTITUTIONS,"https://www2.ncdps.gov/Index2.cfm?a=000003,002240,002324",11/13/15,IMAGERY,2017-12-13T00:00:00.000Z,"https://www.ncdps.gov/Index2.cfm?a=000003,002240,002324",MINIMUM,252,0.005140772,1.25E-06,18954.57813,646.2263256,37,119,3903,37119003903,39.03,Census Tract 39.03,G5020,S,5408345,1162,35.2076512,-80.9206437,NC,c(-80.921175051279, 35.1932168787186)
1154,1142,10001552,BALTIMORE CITY CORRECTIONAL CENTER,901 GREENMOUNT AVE,BALTIMORE,MD,21202,NOT AVAILABLE,(410) 332-4340,STATE,OPEN,503,BALTIMORE CITY,24510,USA,922140,CORRECTIONAL INSTITUTIONS,http://dpscs.maryland.gov/publicinfo/publications/annuals.shtml#doc,6/30/16,IMAGERY/OTHER,2017-12-05T00:00:00.000Z,http://www.dpscs.maryland.gov/locations/prisons.shtml,MINIMUM,495,0.004990809,1.01E-06,16098.38281,670.6614744,24,510,100200,24510100200,1002,Census Tract 1002,G5020,S,304692,0,39.2998552,-76.6022617,MD,c(-76.606461805167, 39.3001316629359)
1155,1143,10004218,DUPLIN CORRECTIONAL CENTER,364 HWY 11 S & 903,KENANSVILLE,NC,28349,NOT AVAILABLE,NOT AVAILABLE,STATE,CLOSED,0,DUPLIN,37061,USA,922140,CORRECTIONAL INSTITUTIONS,"https://www2.ncdps.gov/Index2.cfm?a=000003,002240,002324",11/13/15,IMAGERY,2017-12-13T00:00:00.000Z,"https://www.ncdps.gov/Index2.cfm?a=000003,002240,002324",MINIMUM,328,0.010751295,3.05E-06,46168.74219,1320.132648,37,61,90400,37061090400,904,Census Tract 904,G5020,S,315331422,2337852,34.9479257,-77.9329503,NC,c(-77.9808914682011, 34.9447914383857)
1156,1144,10002897,YOUNG MEDICAL FACILITY COMPLEX,5509 ATTWATER AVE,DICKINSON,TX,77539,NOT AVAILABLE,(409) 948-0001,STATE,OPEN,449,GALVESTON,48167,USA,922140,CORRECTIONAL INSTITUTIONS,"https://www.texastribune.org/library/data/texas-prisons/units/, http://www.tdcj.state.tx.us/unit_directory/index.html",9/15/16,IMAGERY,2018-01-12T00:00:00.000Z,http://www.tdcj.state.tx.us/unit_directory/index.html,MAXIMUM,455,0.009873011,3.20E-06,45561.80469,1180.686766,48,167,721900,48167721900,7219,Census Tract 7219,G5020,S,70076911,5559975,29.4376953,-94.9821525,TX,c(-94.9815284674452, 29.4264016069659)
1157,1145,10002885,VANCE UNIT,2 JESTER RD,RICHMOND,TX,77406,NOT AVAILABLE,(281) 277-3030,STATE,OPEN,270,FORT BEND,48157,USA,922140,CORRECTIONAL INSTITUTIONS,"https://www.texastribune.org/library/data/texas-prisons/units/, http://www.tdcj.state.tx.us/unit_directory/index.html",9/15/16,IMAGERY,2018-01-12T00:00:00.000Z,http://www.tdcj.state.tx.us/unit_directory/index.html,MEDIUM,378,0.006844125,2.24E-06,31981.21094,801.3535593,48,157,672900,48157672900,6729,Census Tract 6729,G5020,S,47282806,1085553,29.6700035,-95.7080888,TX,c(-95.6926977169904, 29.6211924954287)
1158,1146,10002713,WHEELER STATE JAIL,986 COUNTY RD AA,PLAINVIEW,TX,79072,NOT AVAILABLE,(806) 293-1081,STATE,OPEN,533,HALE,48189,USA,922140,CORRECTIONAL INSTITUTIONS,"https://www.texastribune.org/library/data/texas-prisons/units/, http://www.tdcj.state.tx.us/unit_directory/index.html",9/15/16,IMAGERY,2018-01-12T00:00:00.000Z,http://www.tdcj.state.tx.us/unit_directory/index.html,MEDIUM,576,0.007797943,3.32E-06,49797.19922,945.3988637,48,189,950600,48189950600,9506,Census Tract 9506,G5020,S,1078681516,76997,34.1956637,-101.7858491,TX,c(-101.64626956034, 34.180299197517)
1159,1147,10006503,MOFFAT COUNTY DETENTION FACILITY,800 WEST 1ST STREET,CRAIG,CO,81625,NOT AVAILABLE,(970) 824-4498,COUNTY,OPEN,-999,MOFFAT,8081,USA,922140,CORRECTIONAL INSTITUTIONS,http://www.moffatcountysheriff.com/index.html,2/20/18,IMAGERY,2018-02-20T00:00:00.000Z,http://www.moffatcountysheriff.com/index.html,NOT AVAILABLE,101,0.002935504,5.46E-07,8904.195313,368.0231686,8,81,300,8081000300,3,Census Tract 3,G5020,S,401673348,1773556,40.5254675,-107.5290111,CO,c(-107.556427681148, 40.5061277514024)
1160,1148,10001979,MCLENNAN COUNTY STATE JUVENILE CORRECTIONAL FACILITY,116 BURLESON RD,MART,TX,76664,NOT AVAILABLE,(254) 297-8200,STATE,OPEN,225,MCLENNAN,48309,USA,922140,CORRECTIONAL INSTITUTIONS,http://www.tjjd.texas.gov/programs/prea.aspx,1/14/16,IMAGERY,2018-01-12T00:00:00.000Z,http://www.tjjd.texas.gov/programs/facilities_list.aspx,JUVENILE,368,0.011758256,8.22E-06,119516.7539,1408.261532,48,309,3601,48309003601,36.01,Census Tract 36.01,G5020,S,106873839,1823592,31.5506146,-96.8798056,TX,c(-96.8423967107064, 31.5466997074247)
1161,1149,10000188,BROWNWOOD HALFWAY HOUSE,910 FM 3254,BROWNWOOD,TX,76801,NOT AVAILABLE,(325) 641-6462,STATE,OPEN,7,BROWN,48049,USA,922140,CORRECTIONAL INSTITUTIONS,http://www.tjjd.texas.gov/programs/prea.aspx,3/8/17,IMAGERY/OTHER,2018-01-12T00:00:00.000Z,http://www.tjjd.texas.gov/programs/facilities_list.aspx,JUVENILE,10,0.0012578,9.87E-08,1437.710938,152.0893712,48,49,950600,48049950600,9506,Census Tract 9506,G5020,S,6651492,0,31.7302058,-98.9950847,TX,c(-99.0093082685809, 31.712332129207)
1162,1150,10001765,FOUNTAIN CORRECTIONAL CENTER FOR WOMEN,300 FOUNTAIN SCHOOL RD,ROCKY MOUNT,NC,27804,NOT AVAILABLE,(252) 442-9712,STATE,CLOSED,0,EDGECOMBE,37065,USA,922140,CORRECTIONAL INSTITUTIONS,"https://www2.ncdps.gov/Index2.cfm?a=000003,002240,002324",11/13/15,IMAGERY,2017-12-13T00:00:00.000Z,"https://www.ncdps.gov/Index2.cfm?a=000003,002240,002324",MINIMUM,510,0.018762482,1.03E-05,157759.2148,2325.204755,37,65,20600,37065020600,206,Census Tract 206,G5020,S,139240553,276156,35.9942385,-77.6905098,NC,c(-77.7711577944805, 35.9971636952005)
1163,1151,10004167,DURHAM CORRECTIONAL CENTER,3900 GUESS RD,DURHAM,NC,27705,NOT AVAILABLE,NOT AVAILABLE,STATE,CLOSED,0,DURHAM,37063,USA,922140,CORRECTIONAL INSTITUTIONS,"https://www2.ncdps.gov/Index2.cfm?a=000003,002240,002324",11/13/15,IMAGERY,2017-12-13T00:00:00.000Z,"https://www.ncdps.gov/Index2.cfm?a=000003,002240,002324",MINIMUM,216,0.00497968,1.27E-06,19401.35156,605.3702039,37,63,1711,37063001711,17.11,Census Tract 17.11,G5020,S,3925302,23975,36.0589447,-78.9315016,NC,c(-78.9259919270464, 36.0657536626681)
1164,1152,10001756,GUILFORD CORRECTIONAL CENTER,4250 CAMP BURTON RD,MCLEANSVILLE,NC,27301,NOT AVAILABLE,NOT AVAILABLE,STATE,CLOSED,0,GUILFORD,37081,USA,922140,CORRECTIONAL INSTITUTIONS,"https://www2.ncdps.gov/Index2.cfm?a=000003,002240,002324",11/13/15,IMAGERY,2017-12-13T00:00:00.000Z,"https://www.ncdps.gov/Index2.cfm?a=000003,002240,002324",MINIMUM,-999,0.004513075,1.06E-06,16263.09375,561.728894,37,81,15402,37081015402,154.02,Census Tract 154.02,G5020,S,36621641,383501,36.1238624,-79.7037658,NC,c(-79.7014261171699, 36.1162326509936)
1165,1153,10004225,MCCAIN CORRECTIONAL HOSPITAL,855 OLD HWY 211,RAEFORD,NC,28376,NOT AVAILABLE,NOT AVAILABLE,STATE,CLOSED,0,HOKE,37093,USA,922140,CORRECTIONAL INSTITUTIONS,"https://www2.ncdps.gov/Index2.cfm?a=000003,002240,002324",11/13/15,IMAGERY,2017-12-13T00:00:00.000Z,"https://www.ncdps.gov/Index2.cfm?a=000003,002240,002324",MINIMUM,411,0.009482112,1.89E-06,28664.71094,1162.952795,37,93,970201,37093970201,9702.01,Census Tract 9702.01,G5020,S,136000735,376827,35.0376466,-79.3534211,NC,c(-79.3460994044016, 35.0597282645899)
1166,1154,10004035,METROPOLITAN TRANSITION CENTER,954 FORREST ST,BALTIMORE,MD,21202,NOT AVAILABLE,(410) 230-1452,STATE,OPEN,202,BALTIMORE CITY,24510,USA,922140,CORRECTIONAL INSTITUTIONS,http://dpscs.maryland.gov/publicinfo/publications/annuals.shtml#doc,6/30/16,IMAGERY/OTHER,2017-12-05T00:00:00.000Z,http://www.dpscs.maryland.gov/locations/prisons.shtml,MINIMUM,580,0.008695689,3.29E-06,52764.42969,1105.736088,24,510,100300,24510100300,1003,Census Tract 1003,G5020,S,156309,0,39.2995112,-76.609125,MD,c(-76.6085661424695, 39.3000616247293)
1167,1155,10001558,BROCKBRIDGE CORRECTIONAL FACILITY,7930 BROCK BRIDGE RD,JESSUP,MD,20794,NOT AVAILABLE,(410) 799-1363,STATE,OPEN,660,ANNE ARUNDEL,24003,USA,922140,CORRECTIONAL INSTITUTIONS,http://dpscs.maryland.gov/publicinfo/publications/annuals.shtml#doc,6/30/16,IMAGERY,2017-12-05T00:00:00.000Z,http://www.dpscs.maryland.gov/locations/prisons.shtml,MINIMUM,536,0.007605858,3.77E-06,60170.50781,989.515619,24,3,740400,24003740400,7404,Census Tract 7404,G5020,S,2705357,0,39.1354606,-76.7778306,MD,c(-76.774637592225, 39.1351931872676)
1168,1156,10002362,BALTIMORE PRE-RELEASE UNIT FOR WOMEN,301 N CALVERTON RD,BALTIMORE,MD,21223,NOT AVAILABLE,NOT AVAILABLE,STATE,CLOSED,0,BALTIMORE CITY,24510,USA,922140,CORRECTIONAL INSTITUTIONS,http://www.dpscs.maryland.gov/locations/prisons.shtml,12/5/17,IMAGERY,2017-12-05T00:00:00.000Z,NOT AVAILABLE,MINIMUM,144,0.003063207,4.11E-07,6578.136719,385.4838613,24,510,200200,24510200200,2002,Census Tract 2002,G5020,S,925146,0,39.2908648,-76.6588372,MD,c(-76.6599746726596, 39.2927365442858)
1169,1157,10004223,EVERGREEN REHABILITATION CENTER,20513 US HWY 301N,ST. PAUL'S,NC,28384,NOT AVAILABLE,NOT AVAILABLE,STATE,CLOSED,0,ROBESON,37155,USA,922140,CORRECTIONAL INSTITUTIONS,http://www.corrections.com/news/article/29031-nc-division-of-prisons-sets-closing-dates-at-four-prisons,8/9/11,IMAGERY,2017-12-13T00:00:00.000Z,http://evergreenrehabilitationcenter.org/,NOT AVAILABLE,-999,0.005840803,2.08E-06,31376.54297,720.5052913,37,155,960102,37155960102,9601.02,Census Tract 9601.02,G5020,S,83098606,178386,34.8178866,-79.0088383,NC,c(-78.9807109009417, 34.8472675850384)
1170,1158,10005520,SAMARKAND YOUTH DEVELOPMENT CENTER,3600 SAMARKAND ROAD,EAGLE SPRINGS,NC,27242,NOT AVAILABLE,NOT AVAILABLE,STATE,CLOSED,0,MOORE,37125,USA,922140,CORRECTIONAL INSTITUTIONS,"http://www.juvjus.state.nc.us/facilities/youth_development_centers.html, http://wmtgradio.wordpress.com/2013/07/31/samarkand-campus-to-be-used-as-law-enforcement-training-center/",11/13/15,IMAGERY,2017-12-13T00:00:00.000Z,NOT AVAILABLE,JUVENILE,70,0.029132933,3.67E-05,556552.1719,3643.332963,37,125,950302,37125950302,9503.02,Census Tract 9503.02,G5020,S,164327118,3917938,35.2244145,-79.5967386,NC,c(-79.6946601175534, 35.258196310739)
1171,1159,10001022,NORTH CAROLINA CORRECTIONAL INSTITUTION FOR WOMEN - MINIMUM,1201 S STATE ST,RALEIGH,NC,27610,NOT AVAILABLE,(919) 733-4340,STATE,OPEN,-999,WAKE,37183,USA,922140,CORRECTIONAL INSTITUTIONS,"https://www.ncdps.gov/Adult-Corrections/Prisons/Prison-Facilities, https://www2.ncdps.gov/Index2.cfm?a=000003,002240,002324",12/13/17,IMAGERY,2017-12-13T00:00:00.000Z,https://www.ncdps.gov/Adult-Corrections/Prisons/Prison-Facilities,MINIMUM,-999,0.005188445,1.06E-06,16184.97266,661.8071916,37,183,50800,37183050800,508,Census Tract 508,G5020,S,2216937,10158,35.7644588,-78.6256548,NC,c(-78.6239037506701, 35.7639443799419)
1172,1160,10001781,WAYNE CORRECTIONAL CENTER,700 STEVENS MILL RD,GOLDSBORO,NC,27530,NOT AVAILABLE,NOT AVAILABLE,STATE,CLOSED,0,WAYNE,37191,USA,922140,CORRECTIONAL INSTITUTIONS,"https://www2.ncdps.gov/Index2.cfm?a=000003,002240,002324",11/13/15,IMAGERY,2017-12-13T00:00:00.000Z,"https://www.ncdps.gov/Index2.cfm?a=000003,002240,002324",MEDIUM,428,0.006800132,2.83E-06,42980.51563,830.1097735,37,191,1101,37191001101,11.01,Census Tract 11.01,G5020,S,95956843,781079,35.4098402,-78.0995289,NC,c(-78.0349884785441, 35.3850435819051)
1173,1161,10005031,OXFORD COUNTY HOLDING FACILITY,26 WESTERN AVENUE,SOUTH PARIS,ME,4281,NOT AVAILABLE,(207) 743-9554,COUNTY,NOT AVAILABLE,10,OXFORD,23017,USA,922140,CORRECTIONAL INSTITUTIONS,NOT AVAILABLE,NOT AVAILABLE,IMAGERY/OTHER,2018-03-20T00:00:00.000Z,NOT AVAILABLE,MINIMUM,-999,0.001675281,1.43E-07,2468.808594,215.8746005,23,17,966200,23017966200,9662,Census Tract 9662,G5020,S,105603388,511305,44.2480012,-70.4908157,ME,c(-70.519052825447, 44.221508940785)
1174,1162,10004179,WESTERN YOUTH INSTITUTION,5155 WESTERN AVE,MORGANTON,NC,28655,NOT AVAILABLE,NOT AVAILABLE,STATE,CLOSED,0,BURKE,37023,USA,922140,CORRECTIONAL INSTITUTIONS,"https://www2.ncdps.gov/Index2.cfm?a=000003,002240,002324",11/13/15,IMAGERY,2017-12-13T00:00:00.000Z,"https://www.ncdps.gov/Index2.cfm?a=000003,002240,002324",JUVENILE,785,0.011054668,6.73E-06,102640.8555,1354.343311,37,23,21301,37023021301,213.01,Census Tract 213.01,G5020,S,41597597,0,35.6808305,-81.6823365,NC,c(-81.6823144079709, 35.6793393911802)
1175,1163,10002359,CENTRAL MARYLAND CORRECTIONAL FACILITY,7301 BUTTERCUP RD,SYKESVILLE,MD,21784,NOT AVAILABLE,(410) 781-4444,STATE,OPEN,497,CARROLL,24013,USA,922140,CORRECTIONAL INSTITUTIONS,http://dpscs.maryland.gov/publicinfo/publications/annuals.shtml#doc,6/30/16,IMAGERY,2017-12-05T00:00:00.000Z,http://www.dpscs.maryland.gov/locations/prisons.shtml,MINIMUM,475,0.010362405,5.66E-06,90709.03125,1291.544638,24,13,505203,24013505203,5052.03,Census Tract 5052.03,G5020,S,7058920,14506,39.3851259,-76.9492567,MD,c(-76.9556899414847, 39.3725144999526)
1176,1164,10001293,EDNA TAMAYO HOUSE,1438 N 77TH SUNSHINE STRIP,HARLINGEN,TX,78550,NOT AVAILABLE,(956) 425-6567,STATE,OPEN,21,CAMERON,48061,USA,922140,CORRECTIONAL INSTITUTIONS,http://www.tjjd.texas.gov/programs/prea.aspx,5/11/17,IMAGERY,2018-01-12T00:00:00.000Z,http://www.tjjd.texas.gov/programs/facilities_list.aspx,JUVENILE,24,0.001141081,6.89E-08,951.8867188,131.7300857,48,61,10601,48061010601,106.01,Census Tract 106.01,G5020,S,5841161,31874,26.2195655,-97.701677,TX,c(-97.6927245479435, 26.2074510785646)
1177,1165,10002364,PATUXENT INSTITUTION,7555 WATERLOO RD,JESSUP,MD,20794,NOT AVAILABLE,(410) 799-3400,STATE,OPEN,915,HOWARD,24027,USA,922140,CORRECTIONAL INSTITUTIONS,"http://dpscs.maryland.gov/publicinfo/publications/annuals.shtml#doc, http://dpscs.maryland.gov/publicinfo/publications/pdfs/pax_annual_report_2013.pdf",4/1/14,IMAGERY/OTHER,2017-12-05T00:00:00.000Z,http://www.dpscs.maryland.gov/locations/prisons.shtml,MAXIMUM,1113,0.0152774,1.29E-05,205423.9414,1871.312185,24,27,601203,24027601203,6012.03,Census Tract 6012.03,G5020,S,8891346,4381,39.1784051,-76.7637098,MD,c(-76.7780723029179, 39.1646364566185)
1178,1166,10001554,DISMAS HOUSE - EAST,1415 N CAROLINE ST,BALTIMORE,MD,21213,NOT AVAILABLE,NOT AVAILABLE,STATE,CLOSED,0,BALTIMORE CITY,24510,USA,922140,CORRECTIONAL INSTITUTIONS,http://www.dpscs.maryland.gov/locations/prisons.shtml,4/1/14,IMAGERY,2017-12-05T00:00:00.000Z,NOT AVAILABLE,MINIMUM,45,0.0018788,1.70E-07,2728.621094,231.5457695,24,510,80700,24510080700,807,Census Tract 807,G5020,S,298756,0,39.3070324,-76.5932887,MD,c(-76.5977948685554, 39.3069251756833)
1179,1167,10001551,DISMAS HOUSE - WEST,105 S MOUNT ST,BALTIMORE,MD,21223,NOT AVAILABLE,NOT AVAILABLE,STATE,CLOSED,0,BALTIMORE CITY,24510,USA,922140,CORRECTIONAL INSTITUTIONS,http://www.dpscs.maryland.gov/locations/prisons.shtml,4/1/14,IMAGERY,2017-12-05T00:00:00.000Z,NOT AVAILABLE,NOT AVAILABLE,-999,0.001934349,1.88E-07,3011.859375,241.0252837,24,510,190300,24510190300,1903,Census Tract 1903,G5020,S,375717,0,39.2839729,-76.6444254,MD,c(-76.6432804289606, 39.2860554049244)
1180,1168,10006353,DORSEY RUN CORRECTIONAL FACILITY,2020 TOULSON ROAD,JESSUP,MD,20794,NOT AVAILABLE,(410) 379-6020,STATE,OPEN,553,ANNE ARUNDEL,24003,USA,922140,CORRECTIONAL INSTITUTIONS,http://dpscs.maryland.gov/publicinfo/publications/annuals.shtml#doc,6/30/16,IMAGERY,2017-12-05T00:00:00.000Z,http://www.dpscs.maryland.gov/locations/prisons.shtml,MINIMUM,480,0.005690114,1.68E-06,26881.43359,712.7682509,24,3,740400,24003740400,7404,Census Tract 7404,G5020,S,2705357,0,39.1354606,-76.7778306,MD,c(-76.7769733357037, 39.1390625129442)
1181,1169,10002803,SCHAEFFER HALFWAY HOUSE,12451 GARMENT RD,EL PASO,TX,79938,NOT AVAILABLE,(915) 856-9324,STATE,OPEN,17,EL PASO,48141,USA,922140,CORRECTIONAL INSTITUTIONS,http://www.tjjd.texas.gov/programs/prea.aspx,2/3/15,IMAGERY,2018-01-12T00:00:00.000Z,http://www.tjjd.texas.gov/programs/facilities_list.aspx,JUVENILE,24,0.002124382,2.04E-07,2981.554688,258.0970924,48,141,10339,48141010339,103.39,Census Tract 103.39,G5020,S,47351243,0,31.8261423,-106.255518,TX,c(-106.258081061463, 31.8109624388423)
1182,1170,10001261,WILLOUGHBY HOUSE,8100 W ELIZABETH LN,FORT WORTH,TX,76116,NOT AVAILABLE,(817) 244-4992,STATE,OPEN,12,TARRANT,48439,USA,922140,CORRECTIONAL INSTITUTIONS,http://www.tjjd.texas.gov/programs/prea.aspx,2/4/16,IMAGERY,2018-01-12T00:00:00.000Z,http://www.tjjd.texas.gov/programs/facilities_list.aspx,JUVENILE,20,0.001525891,1.09E-07,1601.417969,187.4471383,48,439,105201,48439105201,1052.01,Census Tract 1052.01,G5020,S,2286690,0,32.7309752,-97.4585258,TX,c(-97.4554265054057, 32.7251485492872)
1183,1171,10001255,MCFADDEN RANCH,3505 N HAYNES RD,ROANOKE,TX,76262,NOT AVAILABLE,(817) 491-9387,STATE,OPEN,47,DENTON,48121,USA,922140,CORRECTIONAL INSTITUTIONS,http://www.tjjd.texas.gov/programs/prea.aspx,6/7/17,IMAGERY,2018-01-12T00:00:00.000Z,http://www.tjjd.texas.gov/programs/facilities_list.aspx,JUVENILE,48,0.003265257,5.17E-07,7638.636719,391.8409828,48,121,20307,48121020307,203.07,Census Tract 203.07,G5020,S,45514047,2917797,33.0314845,-97.2088044,TX,c(-97.1951446884075, 33.0353743943927)
1184,1172,10002824,CROCKETT STATE SCHOOL,1701 SW LOOP 304,CROCKETT,TX,75835,NOT AVAILABLE,NOT AVAILABLE,STATE,CLOSED,0,HOUSTON,48225,USA,922140,CORRECTIONAL INSTITUTIONS,"http://www.ktre.com/story/24536064/regional-juvenile-facility-moving-to-old-crockett-state-school-building, http://messenger-news.com/2017/09/23/strike-three/",9/23/17,IMAGERY,2018-01-12T00:00:00.000Z,NOT AVAILABLE,JUVENILE,-999,0.013204361,1.08E-05,157323.6641,1573.618455,48,225,950500,48225950500,9505,Census Tract 9505,G5020,S,704339883,4626367,31.3085512,-95.3712626,TX,c(-95.4714912356371, 31.2974332064697)
1185,1173,10005732,TYC CORSICANA RESIDENTIAL TREATMENT CENTER,4000 WEST 2ND AVENUE,CORSICANA,TX,75110,NOT AVAILABLE,NOT AVAILABLE,STATE,CLOSED,0,NAVARRO,48349,USA,922140,CORRECTIONAL INSTITUTIONS,"http://www.tyc.state.tx.us/programs/corsicana/index.html#history, http://www.publicintegrity.org/2014/02/12/14227/closing-troubled-symbol-texas-juvenile-justice",2/12/14,IMAGERY/OTHER,2018-01-12T00:00:00.000Z,NOT AVAILABLE,JUVENILE,-999,0.016845014,1.55E-05,227235.6875,1993.71539,48,349,970300,48349970300,9703,Census Tract 9703,G5020,S,232357395,2294799,32.1057703,-96.5876216,TX,c(-96.511567143197, 32.0764805028319)
1186,1174,10001970,NORTH TEXAS INTERMEDIATE SANCTION FACILITY,4700 BLUE MOUND RD,FORT WORTH,TX,76106,NOT AVAILABLE,NOT AVAILABLE,STATE,CLOSED,0,TARRANT,48439,USA,922140,CORRECTIONAL INSTITUTIONS,http://www.texasprisonbidness.org/facility/north-texas-intermediate-sanction-facility-closed,1/12/18,IMAGERY,2018-01-12T00:00:00.000Z,http://www.tdcj.state.tx.us/divisions/pf/pf_unit_list.html#intermediate,MINIMUM,424,0.012084027,5.12E-06,75492.10547,1433.506397,48,439,105001,48439105001,1050.01,Census Tract 1050.01,G5020,S,6636976,18923,32.827879,-97.3435243,TX,c(-97.3402648937071, 32.8262683779136)
1187,1175,10001569,EASTERN CORRECTIONAL INSTITUTION,30420 REVELLS NECK RD,WESTOVER,MD,21890,NOT AVAILABLE,(410) 845-4000,STATE,OPEN,2604,SOMERSET,24039,USA,922140,CORRECTIONAL INSTITUTIONS,http://dpscs.maryland.gov/publicinfo/publications/annuals.shtml#doc,6/30/16,IMAGERY/OTHER,2017-12-05T00:00:00.000Z,http://www.dpscs.maryland.gov/locations/prisons.shtml,MEDIUM,3310,0.019444215,2.15E-05,338607.3008,2381.35583,24,39,980400,24039980400,9804,Census Tract 9804,G5020,S,16063293,238214,38.1416567,-75.6915888,MD,c(-75.7044004804211, 38.1573851852169)
1188,1176,10001288,HECTOR GARZA CENTER,620 E. AFTON OAKS BLVD,SAN ANTONIO,TX,78232,NOT AVAILABLE,(210) 568-8600,STATE,OPEN,-999,BEXAR,48029,USA,922140,CORRECTIONAL INSTITUTIONS,https://www.geogroup.com/Locations,1/12/18,IMAGERY,2018-01-12T00:00:00.000Z,https://www.geogroup.com/Locations,JUVENILE,139,0.0025941,4.61E-07,6572.40625,308.3406981,48,29,191702,48029191702,1917.02,Census Tract 1917.02,G5020,S,8096293,17128,29.598005,-98.4944432,TX,c(-98.4827781970748, 29.6068322454258)
1189,1177,10001570,EASTERN CORRECTIONAL INSTITUTION - ANNEX,30420 REVELLS NECK RD,WESTOVER,MD,21890,NOT AVAILABLE,(410) 845-4000,STATE,OPEN,597,SOMERSET,24039,USA,922140,CORRECTIONAL INSTITUTIONS,http://dpscs.maryland.gov/publicinfo/publications/annuals.shtml#doc,6/30/16,IMAGERY/OTHER,2017-12-05T00:00:00.000Z,http://www.dpscs.maryland.gov/locations/prisons.shtml,MINIMUM,608,0.011299448,6.77E-06,106733.5156,1442.146631,24,39,980400,24039980400,9804,Census Tract 9804,G5020,S,16063293,238214,38.1416567,-75.6915888,MD,c(-75.6952517591208, 38.1570986145147)
1190,1178,10002740,WEST TEXAS INTERMEDIATE SANCTION FACILITY,2002 LAMESA HWY,BROWNFIELD,TX,79316,NOT AVAILABLE,(806) 637-4032,STATE,CLOSED,0,TERRY,48445,USA,922140,CORRECTIONAL INSTITUTIONS,http://amarillo.com/local-news/news/2017-06-02/brownfield-lose-250k-plus-annually-state-prison-closes-today,6/2/17,IMAGERY,2018-01-12T00:00:00.000Z,http://tdcj.state.tx.us/unit_directory/xn.html,NOT AVAILABLE,275,0.004771695,1.18E-06,17483.84766,580.9757421,48,445,950300,48445950300,9503,Census Tract 9503,G5020,S,15930625,15523,33.1772301,-102.2901075,TX,c(-102.284175949082, 33.1586198232398)
1191,1179,10002869,KEGANS STATE JAIL,707 TOP ST,HOUSTON,TX,77002,NOT AVAILABLE,(713) 224-6584,STATE,NOT AVAILABLE,0,HARRIS,48201,USA,922140,CORRECTIONAL INSTITUTIONS,"https://www.texastribune.org/library/data/texas-prisons/units/kegans/, http://www.tdcj.state.tx.us/unit_directory/index.html",9/15/16,IMAGERY,2018-01-12T00:00:00.000Z,http://www.tdcj.state.tx.us/unit_directory/index.html,MEDIUM,667,0.002954953,5.43E-07,7753.664063,352.2494797,48,201,210100,48201210100,2101,Census Tract 2101,G5020,S,662528,36430,29.7663846,-95.3513042,TX,c(-95.3556694539066, 29.764217135512)
1192,1180,10006586,CENTRAL REGIONAL HOSPITAL,300 VEAZEY ROAD,BUTNER,NC,27509,NOT AVAILABLE,(919) 764-2000,STATE,OPEN,-999,GRANVILLE,37077,USA,922140,CORRECTIONAL INSTITUTIONS,https://files.nc.gov/ncdhhs/CRH%20Treatment%20Units_0.pdf,12/13/17,IMAGERY,2017-12-13T00:00:00.000Z,https://www.ncdhhs.gov/divisions/dsohf/facilities,NOT AVAILABLE,76,0.009133286,4.43E-06,67979.53906,1127.290692,37,77,970703,37077970703,9707.03,Census Tract 9707.03,G5020,S,27835002,2971324,36.1209084,-78.7724734,NC,c(-78.7722101297397, 36.1460838920145)
1193,1181,10002238,MONTEZUMA COUNTY DETENTION CENTER,730 EAST DRISCOLL STREET,CORTEZ,CO,81321,NOT AVAILABLE,(970) 564-4979,COUNTY,OPEN,-999,MONTEZUMA,8083,USA,922140,CORRECTIONAL INSTITUTIONS,http://www.montezumasheriff.org/departments-contacts/,2/20/18,IMAGERY,2018-02-20T00:00:00.000Z,http://www.montezumasheriff.org/departments-contacts/,NOT AVAILABLE,104,0.003367566,4.14E-07,6458.828125,420.5314482,8,83,969300,8083969300,9693,Census Tract 9693,G5020,S,41739017,61341,37.3779662,-108.5815318,CO,c(-108.575957842321, 37.3593234459581)
1194,1182,10005028,PISCATAQUIS COUNTY JAIL,52 COURT STREET,DOVER-FOXCROFT,ME,4426,NOT AVAILABLE,(207) 564-3304,COUNTY,OPEN,26,PISCATAQUIS,23021,USA,922140,CORRECTIONAL INSTITUTIONS,https://www.piscataquis.us/sheriff-s-office,3/20/18,IMAGERY/OTHER,2018-03-20T00:00:00.000Z,https://www.piscataquis.us/sheriff-s-office,NOT AVAILABLE,-999,0.004368619,3.47E-07,6099.105469,582.4166852,23,21,960700,23021960700,9607,Census Tract 9607,G5020,S,175617646,8732271,45.1780248,-69.1926964,ME,c(-69.2241418887378, 45.1828186724008)
1195,1183,10005824,SUSSEX COUNTY JUVENILE DETENTION CENTER,135 MORRIS TURNPIKE,NEWTON,NJ,7860,NOT AVAILABLE,NOT AVAILABLE,COUNTY,CLOSED,0,SUSSEX,34037,USA,922140,CORRECTIONAL INSTITUTIONS,"http://www.sussex.nj.us/Cit-e-Access/webpage.cfm?TID=7&TPID=6594, http://www.nj.gov/lps/jjc/2011-AnnualDetentionStatisticsReport.pdf",2/15/16,IMAGERY,2018-04-06T00:00:00.000Z,NOT AVAILABLE,JUVENILE,-999,0.00311558,5.79E-07,9522.042969,393.9853362,34,37,372300,34037372300,3723,Census Tract 3723,G5020,S,67560338,313298,41.1600507,-74.717388,NJ,c(-74.7578595887602, 41.1286139739481)
1196,1184,10000048,WYOMING COUNTY JAIL,P O BOX 529,PINEVILLE,WV,24874,NOT AVAILABLE,NOT AVAILABLE,COUNTY,NOT AVAILABLE,-999,WYOMING,54109,USA,922140,CORRECTIONAL INSTITUTIONS,"http://www.wyomingcounty.wv.gov/elected_officials/sheriff/Pages/default.aspx, http://en.wikipedia.org/wiki/Wyoming_County_Courthouse_and_Jail",3/4/16,IMAGERY,2018-05-10T00:00:00.000Z,NOT AVAILABLE,NOT AVAILABLE,-999,0.001438072,1.13E-07,1769.042969,176.8241655,54,109,3100,54109003100,31,Census Tract 31,G5020,S,319936573,1318724,37.5517187,-81.5793264,WV,c(-81.538027305302, 37.5839521817153)
1197,1185,10006504,MONTROSE COUNTY JAIL,1200 NORTH GRAND AVE,MONTROSE,CO,81401,NOT AVAILABLE,NOT AVAILABLE,COUNTY,OPEN,-999,MONTROSE,8085,USA,922140,CORRECTIONAL INSTITUTIONS,http://www.co.montrose.co.us/352/Detention-Center,2/20/18,IMAGERY,2018-02-20T00:00:00.000Z,http://www.co.montrose.co.us/352/Detention-Center,NOT AVAILABLE,-999,0.003386724,6.34E-07,10034.07422,432.8857983,8,85,966300,8085966300,9663,Census Tract 9663,G5020,S,11421425,0,38.4915708,-107.8807735,CO,c(-107.890290664921, 38.4871754819753)
1198,1186,10001556,EASTERN PRE-RELEASE UNIT,700 FLAT IRON SQUARE RD,CHURCH HILL,MD,21623,NOT AVAILABLE,(410) 810-5400,STATE,OPEN,180,QUEEN ANNE'S,24035,USA,922140,CORRECTIONAL INSTITUTIONS,http://dpscs.maryland.gov/publicinfo/publications/annuals.shtml#doc,6/30/16,IMAGERY,2017-12-05T00:00:00.000Z,http://www.dpscs.maryland.gov/locations/prisons.shtml,MINIMUM,165,0.004636541,3.12E-07,4986.757813,554.0300672,24,35,810300,24035810300,8103,Census Tract 8103,G5020,S,136456720,4902779,39.1409149,-75.9786731,MD,c(-75.9858928151246, 39.1137326924366)
1199,1187,10001561,HERMAN L TOULSON CORRECTIONAL FACILITY,2001 TOULSON RD,JESSUP,MD,20794,NOT AVAILABLE,NOT AVAILABLE,STATE,CLOSED,0,ANNE ARUNDEL,24003,USA,922140,CORRECTIONAL INSTITUTIONS,http://www.dpscs.state.md.us/locations/tcf.shtml,4/1/14,IMAGERY/OTHER,2017-12-05T00:00:00.000Z,NOT AVAILABLE,MINIMUM,384,0.007445192,3.57E-06,57109.78906,964.927825,24,3,740400,24003740400,7404,Census Tract 7404,G5020,S,2705357,0,39.1354606,-76.7778306,MD,c(-76.7739977367079, 39.1382303787196)
1200,1188,10003601,NORTH DAKOTA STATE PENITENTIARY,3100 RAILROAD AVE,BISMARCK,ND,58506,5521,(701) 328-6100,STATE,OPEN,753,BURLEIGH,38015,USA,922140,CORRECTIONAL INSTITUTIONS,"http://www.nd.gov/docr/media/stats.html, http://www.nd.gov/docr/adult/",12/31/16,IMAGERY,2017-12-13T00:00:00.000Z,http://www.nd.gov/docr/adult/,MAXIMUM,520,0.014644237,1.08E-05,194864.8125,1964.344119,38,15,10900,38015010900,109,Census Tract 109,G5020,S,5903294,0,46.8158823,-100.7417552,ND,c(-100.741540475416, 46.7999670097596)
1201,1189,10002234,OTERO COUNTY JAIL / SHERIFF,222 EAST 2ND STREET,LA JUNTA,CO,81050,NOT AVAILABLE,(719) 384-5941,COUNTY,OPEN,-999,OTERO,8089,USA,922140,CORRECTIONAL INSTITUTIONS,https://www.oterogov.com/elected-officials/sheriff,2/20/18,IMAGERY,2018-02-20T00:00:00.000Z,https://www.oterogov.com/elected-officials/sheriff,NOT AVAILABLE,34,0.001165768,7.64E-08,1201.371094,148.9087584,8,89,968600,8089968600,9686,Census Tract 9686,G5020,S,5083549,71234,37.9814479,-103.5400401,CO,c(-103.539581823196, 37.9866967780735)
1202,1190,10001482,RANDOLPH COUNTY JAIL,200 WEST BUENA VISTA STREET,CHESTER,IL,62233,NOT AVAILABLE,(618) 826-5484,COUNTY,OPEN,23,RANDOLPH,17157,USA,922140,CORRECTIONAL INSTITUTIONS,"http://am.randolphco.org/index.php/gov-menu/electedofficials/2015-12-04-01-54-52, http://www.ilsheriff.org/index.php/directory",3/2/18,IMAGERY,2018-03-02T00:00:00.000Z,http://am.randolphco.org/index.php/gov-menu/electedofficials/2015-12-04-01-54-52,NOT AVAILABLE,44,0.001684516,1.73E-07,2715.394531,208.5140447,17,157,951300,17157951300,9513,Census Tract 9513,G5020,S,28735963,11060957,37.8637548,-89.7737805,IL,c(-89.8282439484707, 37.9037224364872)
1203,1191,10000590,PUEBLO COUNTY DETENTION CENTER,909 COURT ST,PUEBLO,CO,81003,NOT AVAILABLE,(719) 583-6125,COUNTY,OPEN,545,PUEBLO,8101,USA,922140,CORRECTIONAL INSTITUTIONS,https://www.sheriff.co.pueblo.co.us/index.html,2/20/18,IMAGERY,2018-02-20T00:00:00.000Z,https://www.sheriff.co.pueblo.co.us/index.html,MAXIMUM,780,0.003761933,7.50E-07,11833.20313,474.1580953,8,101,3500,8101003500,35,Census Tract 35,G5020,S,4999062,337903,38.2663099,-104.6083782,CO,c(-104.610769538636, 38.2752510039739)
1204,1192,10003631,SOMERSET COUNTY JAIL,131 E MADISON RD,MADISON,ME,4950,NOT AVAILABLE,(207) 474-7409,COUNTY,OPEN,165,SOMERSET,23025,USA,922140,CORRECTIONAL INSTITUTIONS,http://www.somersetcounty-me.org/somerset-county-jail.html#!slide_09,3/20/18,IMAGERY,2018-03-20T00:00:00.000Z,http://www.somersetcounty-me.org/somerset-county-jail.html#!slide_09,MEDIUM,234,0.006264764,2.00E-06,34873.92188,836.2201922,23,25,966500,23025966500,9665,Census Tract 9665,G5020,S,134378091,7613725,44.8263541,-69.7997127,ME,c(-69.7262223573239, 44.7924446599052)
1205,1193,10006665,JACK HARWELL DETENTION CENTER,3101 MARLIN HWY,WACO,TX,76705,NOT AVAILABLE,(254) 759-5900,MULTI,OPEN,-999,MCLENNAN,48309,USA,922140,CORRECTIONAL INSTITUTIONS,http://www.lasallecorrections.com/our-locations-table/,1/12/18,IMAGERY,2018-01-12T00:00:00.000Z,http://www.lasallecorrections.com/our-locations-table/,MAXIMUM,816,0.006497729,2.45E-06,35559.65234,785.1423705,48,309,1800,48309001800,18,Census Tract 18,G5020,S,34754003,1373795,31.5515506,-97.0490627,TX,c(-97.0813132481585, 31.5491567500422)
1206,1194,10002212,PARK COUNTY JAIL / SHERIFF,1180 COUNTY ROAD 16,FAIRPLAY,CO,80440,NOT AVAILABLE,(719) 836-4373,COUNTY,OPEN,-999,PARK,8093,USA,922140,CORRECTIONAL INSTITUTIONS,http://www.parkco.us/88/Sheriffs-Office,2/20/18,IMAGERY,2018-02-20T00:00:00.000Z,http://www.parkco.us/88/Sheriffs-Office,NOT AVAILABLE,-999,0.003648,7.19E-07,11503.87891,451.7165238,8,93,300,8093000300,3,Census Tract 3,G5020,S,282700248,1212542,39.262142,-106.0641967,CO,c(-105.988908137206, 39.2236135707697)
1207,1195,10001876,CENTRAL REGIONAL JAIL,1255 DYER HILL RD,SUTTON,WV,26601,NOT AVAILABLE,(304) 765-7904,COUNTY,OPEN,310,BRAXTON,54007,USA,922140,CORRECTIONAL INSTITUTIONS,http://rja.wv.gov/Pages/About-Us.aspx,1/22/18,IMAGERY/OTHER,2018-01-22T00:00:00.000Z,http://rja.wv.gov/facilityinfo/Pages/default.aspx,NOT AVAILABLE,200,0.005774626,2.14E-06,33900.6875,729.678231,54,7,967900,54007967900,9679,Census Tract 9679,G5020,S,570900559,6471528,38.7602528,-80.5620615,WV,c(-80.6567633182697, 38.6974484556243)
1208,1196,10006864,CLAY COUNTY JAIL,215 WEST GILBERT STREET,HENRIETTA,TX,76365,NOT AVAILABLE,NOT AVAILABLE,COUNTY,OPEN,22,CLAY,48077,USA,922140,CORRECTIONAL INSTITUTIONS,"https://www.sheriff.co.clay.tx.us/, https://www.tcjs.state.tx.us/index.php?linkID=325",3/1/18,IMAGERY,2018-04-26T00:00:00.000Z,https://www.sheriff.co.clay.tx.us/,NOT AVAILABLE,38,0.001542736,1.19E-07,1777.429688,189.4682367,48,77,30200,48077030200,302,Census Tract 302,G5020,S,39347950,595974,33.8275374,-98.1839936,TX,c(-98.1971185250563, 33.8153716051528)
1209,1197,10000009,EASTERN REGIONAL JAIL,94 GRAPEVINE ROAD,MARTINSBURG,WV,25405,NOT AVAILABLE,(304) 267-0046,COUNTY,OPEN,392,BERKELEY,54003,USA,922140,CORRECTIONAL INSTITUTIONS,http://rja.wv.gov/Pages/About-Us.aspx,1/22/18,IMAGERY,2018-01-22T00:00:00.000Z,http://rja.wv.gov/facilityinfo/Pages/default.aspx,NOT AVAILABLE,500,0.007165356,1.99E-06,31865.93359,900.8116364,54,3,972000,54003972000,9720,Census Tract 9720,G5020,S,52668500,0,39.4099438,-77.9467129,WV,c(-77.9559094454654, 39.4357670602975)
1210,1198,10005831,MARYLAND  HOUSE OF CORRECTION - JESSUP,"P O BOX 549, HOUSE OF CORRECTION RD",JESSUP,MD,20794,NOT AVAILABLE,NOT AVAILABLE,STATE,CLOSED,0,ANNE ARUNDEL,24003,USA,922140,CORRECTIONAL INSTITUTIONS,http://www.washingtonpost.com/wp-dyn/content/article/2007/03/18/AR2007031800137.html,4/1/14,IMAGERY/OTHER,2017-12-05T00:00:00.000Z,NOT AVAILABLE,MEDIUM,1068,0.009806945,4.95E-06,79150.96875,1218.830271,24,3,740400,24003740400,7404,Census Tract 7404,G5020,S,2705357,0,39.1354606,-76.7778306,MD,c(-76.7788515034376, 39.1434842831089)
1211,1199,10001553,CENTRAL HOME DETENTION UNIT,2100 GUILFORD AVE,BALTIMORE,MD,21218,NOT AVAILABLE,(443) 263-3800,STATE,OPEN,192,BALTIMORE CITY,24510,USA,922140,CORRECTIONAL INSTITUTIONS,http://dpscs.maryland.gov/publicinfo/publications/annuals.shtml#doc,6/30/16,IMAGERY,2017-12-05T00:00:00.000Z,http://www.dpscs.maryland.gov/locations/prisons.shtml,NOT AVAILABLE,-999,0.002715322,3.19E-07,5113.789063,352.9065856,24,510,120400,24510120400,1204,Census Tract 1204,G5020,S,281026,0,39.3138354,-76.612384,MD,c(-76.6129747003945, 39.313890594934)
1212,1200,10003607,DAKOTA WOMEN'S CORRECTIONAL AND REHABILITATION CENTER,440 MCKENZIE ST,NEW ENGLAND,ND,58647,NOT AVAILABLE,(701) 579-5100,STATE,OPEN,113,HETTINGER,38041,USA,922140,CORRECTIONAL INSTITUTIONS,"http://www.nd.gov/docr/media/stats.html, http://www.nd.gov/docr/adult/",12/31/16,IMAGERY,2017-12-13T00:00:00.000Z,http://www.nd.gov/docr/adult/,MINIMUM,126,0.007443825,2.19E-06,39439.35156,1088.328807,38,41,964800,38041964800,9648,Census Tract 9648,G5020,S,1520086943,1400395,46.4620206,-102.667444,ND,c(-102.867200592457, 46.5354115787339)
1213,1605,10006549,MINNESOTA SECURITY HOSPITAL,100 FREEMAN DRIVE,ST. PETER,MN,56082,1599,(507) 985-2000,STATE,OPEN,369,NICOLLET,27103,USA,922140,CORRECTIONAL INSTITUTIONS,http://www.twincities.com/2017/04/07/big-bucks-needed-to-solve-security-hospital-problems/,4/8/17,IMAGERY,2017-12-07T00:00:00.000Z,http://www.dhs.state.mn.us/main/idcplg?IdcService=GET_DYNAMIC_CONVERSION&RevisionSelectionMethod=LatestReleased&dDocName=id_000261,NOT AVAILABLE,-999,0.009572261,4.04E-06,69999.89453,1237.655935,27,103,480400,27103480400,4804,Census Tract 4804,G5020,S,11811073,212189,44.3094034,-93.9817859,MN,c(-93.9760671769206, 44.3048303651076)
1214,1606,10006606,SOUTHERN TRANSITIONAL,800A BUFFALO AVENUE,EGG HARBOR,NJ,8215,NOT AVAILABLE,(609) 965-5200,STATE,OPEN,15,ATLANTIC,34001,USA,922140,CORRECTIONAL INSTITUTIONS,http://www.nj.gov/oag/jjc/prea.html,3/10/16,IMAGERY/OTHER,2017-12-18T00:00:00.000Z,http://www.nj.gov/oag/jjc/residential_community_list.html,JUVENILE,32,0.002866013,2.75E-07,4426.308594,359.4324068,34,1,10600,34001010600,106,Census Tract 106,G5020,S,28103807,1477247,39.5636873,-74.5958654,NJ,c(-74.6332935009006, 39.5366895521592)
1215,1209,10002617,CENTRAL UTAH CORRECTIONAL FACILITY,255 E 300 N ST,GUNNISON,UT,84634,NOT AVAILABLE,(435) 528-6000,STATE,OPEN,1700,SANPETE,49039,USA,922140,CORRECTIONAL INSTITUTIONS,"https://crbiprod.utah.gov/cognos10/cgi-bin/cognos.cgi?b_action=xts.run&m=portal/cc.xts&gohome=, https://corrections.utah.gov/",1/17/18,IMAGERY,2018-01-17T00:00:00.000Z,https://corrections.utah.gov/,MAXIMUM,1600,0.025579987,2.77E-05,442572.7266,3190.701884,49,39,972300,49039972300,9723,Census Tract 9723,G5020,S,943267591,22463203,39.2282925,-111.8534084,UT,c(-111.811498049382, 39.1662429720597)
1216,1607,10001618,CREMER THERAPEUTIC COMMUNITY CENTER,689 ROUTE O,FULTON,MO,65251,NOT AVAILABLE,(573) 592-4013,STATE,OPEN,174,CALLAWAY,29027,USA,922140,CORRECTIONAL INSTITUTIONS,https://doc.mo.gov/OD/PREA-2015.php,4/14/15,IMAGERY,2017-12-07T00:00:00.000Z,https://doc.mo.gov/DAI/Institutional_Facilities.php,MINIMUM,180,0.003865132,4.96E-07,7889.628906,467.9431842,29,27,70300,29027070300,703,Census Tract 703,G5020,S,31216261,443222,38.8513012,-91.9235718,MO,c(-91.9384583277674, 38.844986475887)
1217,1608,10001598,DEERFIELD WORK CENTER FOR MEN,15172 OLD BELFIELD RD,CAPRON,VA,23829,NOT AVAILABLE,(434) 658-4368,STATE,OPEN,199,SOUTHAMPTON,51175,USA,922140,CORRECTIONAL INSTITUTIONS,https://vadoc.virginia.gov/about/facts/,6/15/17,IMAGERY,2018-01-19T00:00:00.000Z,https://vadoc.virginia.gov/facilities/,MINIMUM,216,0.006471026,2.25E-06,34714.65625,791.1294971,51,175,200300,51175200300,2003,Census Tract 2003,G5020,S,10719196,84844,36.7371266,-77.2510665,VA,c(-77.2484144955825, 36.7235530790968)
1218,1609,10003324,DEERFIELD CORRECTIONAL CENTER,21360 DEERFIELD DR,CAPRON,VA,23829,NOT AVAILABLE,(434) 658-4368,STATE,OPEN,1059,SOUTHAMPTON,51175,USA,922140,CORRECTIONAL INSTITUTIONS,https://vadoc.virginia.gov/about/facts/,4/27/17,IMAGERY,2018-01-19T00:00:00.000Z,https://vadoc.virginia.gov/facilities/,MEDIUM,1080,0.014915389,9.34E-06,144471.3164,1779.626935,51,175,200300,51175200300,2003,Census Tract 2003,G5020,S,10719196,84844,36.7371266,-77.2510665,VA,c(-77.2456620291206, 36.7295077415658)
1219,1610,10003845,JACKSON COUNTY JAIL-WESLEY STREET,212 W WESLEY ST,JACKSON,MI,49201,NOT AVAILABLE,(517) 768-7900,COUNTY,OPEN,-999,JACKSON,26075,USA,922140,CORRECTIONAL INSTITUTIONS,https://www.co.jackson.mi.us/167/Sheriff,3/20/18,IMAGERY,2018-03-20T00:00:00.000Z,https://www.co.jackson.mi.us/167/Sheriff,NOT AVAILABLE,200,0.003243304,4.39E-07,7342.171875,399.350071,26,75,600,26075000600,6,Census Tract 6,G5020,S,911647,2556,42.2470057,-84.4073077,MI,c(-84.4096273362033, 42.245018558478)
1220,1611,10002010,NORTHWESTERN MINNESOTA JUVENILE CENTER,1231 5TH STREET NORTHWEST,BEMIDJI,MN,56601,NOT AVAILABLE,(218) 751-3196,LOCAL,OPEN,58,BELTRAMI,27007,USA,922140,CORRECTIONAL INSTITUTIONS,http://www.nmjconline.org/index.php,12/7/17,IMAGERY,2017-12-07T00:00:00.000Z,http://www.nmjconline.org/index.php,JUVENILE,65,0.004283304,9.58E-07,17566.16797,588.5526246,27,7,450702,27007450702,4507.02,Census Tract 4507.02,G5020,S,30329141,7556743,47.477949,-94.9009071,MN,c(-94.9042333766697, 47.4774680906573)
1221,1612,10001630,POTOSI CORRECTIONAL CENTER,11593 STATE HWY O,MINERAL POINT,MO,63660,NOT AVAILABLE,(573) 438-6000,STATE,OPEN,-999,WASHINGTON,29221,USA,922140,CORRECTIONAL INSTITUTIONS,https://doc.mo.gov/OD/PREA-2015.php,3/26/15,IMAGERY,2017-12-07T00:00:00.000Z,https://doc.mo.gov/DAI/Institutional_Facilities.php,MAXIMUM,852,0.015406044,1.34E-05,210813.1406,1904.175204,29,221,460300,29221460300,4603,Census Tract 4603,G5020,S,30950363,331906,37.9357592,-90.7745867,MO,c(-90.7369268357817, 37.9366948036602)
1222,1613,10001608,CROSSROADS CORRECTIONAL CENTER,1115 E PENCE RD,CAMERON,MO,64429,NOT AVAILABLE,(816) 632-2727,STATE,OPEN,1463,DEKALB,29063,USA,922140,CORRECTIONAL INSTITUTIONS,https://doc.mo.gov/OD/PREA-2015.php,1/14/15,IMAGERY,2017-12-07T00:00:00.000Z,https://doc.mo.gov/DAI/Institutional_Facilities.php,MAXIMUM,1400,0.013383235,1.29E-05,207376.6289,1699.444999,29,63,80100,29063080100,801,Census Tract 801,G5020,S,541711484,5945715,39.9123487,-94.3128169,MO,c(-94.223671166948, 39.7657210141641)
1223,1614,10004065,EASTERN RECEPTION DIAGNOSTIC / CORRECTIONAL CTR,2727 HWY K,BONNE TERRE,MO,63628,NOT AVAILABLE,(573) 358-5516,STATE,OPEN,2986,ST. FRANCOIS,29187,USA,922140,CORRECTIONAL INSTITUTIONS,https://doc.mo.gov/OD/PREA-2017.php,6/14/17,IMAGERY,2017-12-07T00:00:00.000Z,https://doc.mo.gov/DAI/Institutional_Facilities.php,MAXIMUM,3100,0.01717554,1.99E-05,312334.6133,2140.274715,29,187,950300,29187950300,9503,Census Tract 9503,G5020,S,31158248,48697,37.9327142,-90.5475823,MO,c(-90.5146845833307, 37.9245330863162)
1224,1615,10001631,FARMINGTON CORRECTIONAL CENTER,1012 W COLUMBIA ST,FARMINGTON,MO,63640,NOT AVAILABLE,(573) 218-7100,STATE,OPEN,2622,ST. FRANCOIS,29187,USA,922140,CORRECTIONAL INSTITUTIONS,https://doc.mo.gov/OD/PREA-2017.php,3/24/17,IMAGERY,2017-12-07T00:00:00.000Z,https://doc.mo.gov/DAI/Institutional_Facilities.php,MEDIUM,2655,0.029970113,4.01E-05,628053.0195,3673.921598,29,187,950902,29187950902,9509.02,Census Tract 9509.02,G5020,S,7530979,0,37.7751996,-90.4322357,MO,c(-90.4363852546672, 37.7669929583832)
1225,1616,10001617,FULTON RECEPTION AND DIAGNOSTIC CENTER,1393 HWY O,FULTON,MO,65251,NOT AVAILABLE,(573) 592-4040,STATE,OPEN,1400,CALLAWAY,29027,USA,922140,CORRECTIONAL INSTITUTIONS,https://doc.mo.gov/OD/PREA-2015.php,4/16/15,IMAGERY,2017-12-07T00:00:00.000Z,https://doc.mo.gov/DAI/Institutional_Facilities.php,MINIMUM,1302,0.015476581,1.52E-05,242141.0508,1899.300868,29,27,70300,29027070300,703,Census Tract 703,G5020,S,31216261,443222,38.8513012,-91.9235718,MO,c(-91.9221143064947, 38.8459874499843)
1226,1617,10001626,JEFFERSON CITY CORRECTIONAL CENTER,8200 NO MORE VICTIMS RD,JEFFERSON CITY,MO,65101,NOT AVAILABLE,(573) 751-3224,STATE,OPEN,1941,COLE,29051,USA,922140,CORRECTIONAL INSTITUTIONS,https://doc.mo.gov/OD/PREA-2017.php,2/28/17,IMAGERY,2017-12-07T00:00:00.000Z,https://doc.mo.gov/DAI/Institutional_Facilities.php,MAXIMUM,2052,0.017805678,1.92E-05,304806.9531,2249.858846,29,51,20198,29051020198,201.98,Census Tract 201.98,G5020,S,98459697,5397372,38.512942,-92.0783234,MO,c(-92.0469363727961, 38.5518771296583)
1227,1618,10001606,MARYVILLE TREATMENT CENTER,30227 US HWY 136,MARYVILLE,MO,64468,NOT AVAILABLE,(660) 582-6542,STATE,OPEN,520,NODAWAY,29147,USA,922140,CORRECTIONAL INSTITUTIONS,https://doc.mo.gov/OD/PREA-2015.php,5/7/15,IMAGERY,2017-12-07T00:00:00.000Z,https://doc.mo.gov/DAI/Institutional_Facilities.php,MINIMUM,525,0.010736266,3.96E-06,64371.15234,1344.41702,29,147,470500,29147470500,4705,Census Tract 4705,G5020,S,833691913,786403,40.323348,-94.7426572,MO,c(-94.814128915527, 40.3457412964127)
1228,1619,10000941,MOBERLY CORRECTIONAL CENTER,5201 SOUTH MORLEY ST,MOBERLY,MO,65270,NOT AVAILABLE,(660) 263-3778,STATE,OPEN,1790,RANDOLPH,29175,USA,922140,CORRECTIONAL INSTITUTIONS,https://doc.mo.gov/OD/PREA-2015.php,7/16/15,IMAGERY,2017-12-07T00:00:00.000Z,https://doc.mo.gov/DAI/Institutional_Facilities.php,MEDIUM,1800,0.021026207,2.59E-05,414485.2109,2607.765271,29,175,490600,29175490600,4906,Census Tract 4906,G5020,S,443457790,659113,39.3313712,-92.4967373,MO,c(-92.4405879627373, 39.3622745973917)
1229,1620,10000942,TIPTON CORRECTIONAL CENTER,619 N OSAGE AVE,TIPTON,MO,65081,NOT AVAILABLE,(660) 433-2031,STATE,OPEN,1225,MONITEAU,29135,USA,922140,CORRECTIONAL INSTITUTIONS,https://doc.mo.gov/OD/PREA-2015.php,7/9/15,IMAGERY,2017-12-07T00:00:00.000Z,https://doc.mo.gov/DAI/Institutional_Facilities.php,MINIMUM,1222,0.016144792,1.38E-05,219149.2344,2111.91863,29,135,385400,29135385400,3854,Census Tract 3854,G5020,S,134739476,436008,38.617382,-92.7783375,MO,c(-92.7800729168649, 38.6675628564653)
1230,1621,10000923,DILLWYN CORRECTIONAL CENTER,1522 PRISON RD,DILLWYN,VA,23936,NOT AVAILABLE,(434) 983-4200,STATE,OPEN,917,BUCKINGHAM,51029,USA,922140,CORRECTIONAL INSTITUTIONS,https://vadoc.virginia.gov/about/facts/,9/19/17,IMAGERY,2018-01-19T00:00:00.000Z,https://vadoc.virginia.gov/facilities/,MEDIUM,933,0.016263964,1.72E-05,268361.4688,1996.62765,51,29,930201,51029930201,9302.01,Census Tract 9302.01,G5020,S,248642700,1426405,37.5051575,-78.4235283,VA,c(-78.4705204083207, 37.5746224514044)
1231,1622,10006721,MONROE COUNTY KEY WEST DETENTION CENTER,5501 COLLEGE ROAD,KEY WEST,FL,33040,NOT AVAILABLE,NOT AVAILABLE,COUNTY,OPEN,-999,MONROE,12087,USA,922140,CORRECTIONAL INSTITUTIONS,https://www.keysso.net/jail/detention_center_index.htm,2/21/18,IMAGERY,2018-02-21T00:00:00.000Z,https://www.keysso.net/jail/detention_center_index.htm,NOT AVAILABLE,596,0.005362127,1.04E-06,14210.59961,630.1716421,12,87,971900,12087971900,9719,Census Tract 9719,G5020,S,2657828,3385536,24.5772104,-81.7515563,FL,c(-81.751502566937, 24.5764919842998)
1232,1623,10005764,NYE COUNTY JAIL - SOUTH AREA COMMAND,1520 E BASIN ROAD,PAHRUMP,NV,89060,NOT AVAILABLE,(775) 751-7027,COUNTY,OPEN,-999,NYE,32023,USA,922140,CORRECTIONAL INSTITUTIONS,http://www.nyecounty.net/109/Sheriff,4/9/18,IMAGERY,2018-04-09T00:00:00.000Z,http://www.nyecountysheriffsoffice.com/home.html,NOT AVAILABLE,-999,0.004125286,6.83E-07,10495.76953,517.5528212,32,23,960401,32023960401,9604.01,Census Tract 9604.01,G5020,S,1415466805,385982,36.4957124,-116.015716,NV,c(-115.986909710144, 36.2205215496304)
1233,1624,10002927,JUDGE RICARDO H GARCIA REGIONAL JUVENILE DETENTION CENTER,599 S FM 1329,SAN DIEGO,TX,78384,NOT AVAILABLE,(361) 279-2040,COUNTY,OPEN,28,DUVAL,48131,USA,922140,CORRECTIONAL INSTITUTIONS,"http://www.co.duval.tx.us/default.aspx?name=Juvenile.Facility, http://www.tjjd.texas.gov/publications/other/searchfacilityregistryresults.aspx?SelectedFacilityType=YKSBbGCMUWM=&SelectedSortBy=laExhobORj5ZHimppFKN0Q==&IncludeInactive=bZL7qeN3IjY=",7/29/16,IMAGERY,2018-04-26T00:00:00.000Z,http://www.co.duval.tx.us/default.aspx?name=Juvenile.Facility,JUVENILE,50,0.002431133,3.41E-07,4776.382813,289.5328205,48,131,950100,48131950100,9501,Census Tract 9501,G5020,S,880761436,2356507,27.8873624,-98.3460839,TX,c(-98.2541801786039, 27.7154829384281)
1234,1625,10001612,"WESTERN RECEPTION, DIAGNOSTIC / CORRECTIONAL CTR",3401 FARAON ST,ST. JOSEPH,MO,64506,NOT AVAILABLE,(816) 387-2158,STATE,OPEN,2051,BUCHANAN,29021,USA,922140,CORRECTIONAL INSTITUTIONS,https://doc.mo.gov/OD/PREA-2015.php,10/10/15,IMAGERY,2017-12-07T00:00:00.000Z,https://doc.mo.gov/DAI/Institutional_Facilities.php,MINIMUM,1968,0.016556191,1.41E-05,227515.168,2018.292106,29,21,600,29021000600,6,Census Tract 6,G5020,S,5364093,12139,39.7829384,-94.8135023,MO,c(-94.8107934674161, 39.7743524884086)
1235,1626,10004926,DEARBORN COUNTY LAW ENFORCEMENT CENTER,301 W HIGH ST,LAWRENCEBURG,IN,47025,NOT AVAILABLE,(812) 537-8700,COUNTY,OPEN,333,DEARBORN,18029,USA,922140,CORRECTIONAL INSTITUTIONS,http://www.dearborncountysheriff.org/,3/5/18,IMAGERY,2018-03-05T00:00:00.000Z,http://www.dearborncountysheriff.org/,NOT AVAILABLE,200,0.001811906,2.26E-07,3614.125,227.875732,18,29,80300,18029080300,803,Census Tract 803,G5020,S,19085687,1201184,39.0974888,-84.8804338,IN,c(-84.8509715716357, 39.0909474635451)
1236,1627,10006607,VINELAND PREPARATORY ACADEMY,2000 MAPLE AVENUE,VINELAND,NJ,8361,NOT AVAILABLE,(856) 696-6624,STATE,OPEN,20,CUMBERLAND,34011,USA,922140,CORRECTIONAL INSTITUTIONS,http://www.nj.gov/oag/jjc/prea.html,3/10/16,IMAGERY,2017-12-18T00:00:00.000Z,http://www.nj.gov/oag/jjc/residential_community_list.html,JUVENILE,60,0.004110974,9.73E-07,15625.94141,534.1284312,34,11,40700,34011040700,407,Census Tract 407,G5020,S,15817201,162650,39.4891903,-74.9736358,NJ,c(-74.987997344727, 39.4930146517308)
1237,1628,10001615,"WOMEN'S EASTERN RECEPTION, DIAGNOSTIC / CORRECTIONAL CENTER",1101 E HWY 54,VANDALIA,MO,63382,NOT AVAILABLE,(573) 594-6686,STATE,OPEN,1767,AUDRAIN,29007,USA,922140,CORRECTIONAL INSTITUTIONS,https://doc.mo.gov/OD/PREA-2016.php,5/6/16,IMAGERY,2017-12-07T00:00:00.000Z,https://doc.mo.gov/DAI/Institutional_Facilities.php,MAXIMUM,1560,0.017106552,1.60E-05,256990.7383,2109.434666,29,7,950100,29007950100,9501,Census Tract 9501,G5020,S,32573196,129771,39.3059738,-91.4929857,MO,c(-91.4766407574844, 39.3179052242028)
1238,1629,10003268,FLUVANNA CORRECTIONAL CENTER FOR WOMEN,144 PRISON LANE,TROY,VA,22974,NOT AVAILABLE,(434) 984-3700,STATE,OPEN,1181,FLUVANNA,51065,USA,922140,CORRECTIONAL INSTITUTIONS,https://vadoc.virginia.gov/about/facts/,9/27/17,IMAGERY,2018-01-19T00:00:00.000Z,https://vadoc.virginia.gov/facilities/,MAXIMUM,1315,0.012940059,1.00E-05,158004.7773,1665.478889,51,65,20101,51065020101,201.01,Census Tract 201.01,G5020,S,111925060,1236961,37.9429399,-78.2669199,VA,c(-78.2701794058318, 37.9826392961826)
1239,1630,10003310,GREEN ROCK CORRECTIONAL CENTER,475 GREEN ROCK LANE,CHATHAM,VA,24531,NOT AVAILABLE,(434) 797-2000,STATE,OPEN,1030,PITTSYLVANIA,51143,USA,922140,CORRECTIONAL INSTITUTIONS,https://vadoc.virginia.gov/about/facts/,12/1/14,IMAGERY,2018-01-19T00:00:00.000Z,https://vadoc.virginia.gov/facilities/,CLOSE,1038,0.010836908,7.90E-06,122210.5586,1343.50099,51,143,10500,51143010500,105,Census Tract 105,G5020,S,166780189,1539493,36.8334644,-79.4072695,VA,c(-79.4219061778487, 36.7999467418384)
1240,1631,10003327,GREENSVILLE CORRECTIONAL CENTER,901 CORRECTIONS WAY,JARRATT,VA,23870,9614,(434) 535-7000,STATE,OPEN,2976,GREENSVILLE,51081,USA,922140,CORRECTIONAL INSTITUTIONS,https://vadoc.virginia.gov/about/facts/,1/19/18,IMAGERY,2018-01-19T00:00:00.000Z,https://vadoc.virginia.gov/facilities/,CLOSE,-999,0.022515114,3.51E-05,542693.6758,2778.379236,51,81,880102,51081880102,8801.02,Census Tract 8801.02,G5020,S,393965,0,36.7986024,-77.4861902,VA,c(-77.4863652319298, 36.7987278786161)
1241,1632,10001603,GREENSVILLE WORK CENTER,901 CORRECTIONS WAY,JARRATT,VA,23870,9614,(434) 535-7000,STATE,OPEN,210,GREENSVILLE,51081,USA,922140,CORRECTIONAL INSTITUTIONS,https://vadoc.virginia.gov/about/facts/,1/19/18,IMAGERY/OTHER,2018-01-19T00:00:00.000Z,https://vadoc.virginia.gov/facilities/,MINIMUM,-999,0.004958353,1.50E-06,23245.01563,609.8689564,51,81,880101,51081880101,8801.01,Census Tract 8801.01,G5020,S,295138100,2251859,36.7836335,-77.5615704,VA,c(-77.4866859784139, 36.7944661316548)
1242,1633,10001895,SUBLETTE COUNTY DETENTION CENTER,35 1/2 S TYLER AVE,PINEDALE,WY,82941,NOT AVAILABLE,(307) 367-4378,COUNTY,OPEN,-999,SUBLETTE,56035,USA,922140,CORRECTIONAL INSTITUTIONS,http://www.sublettewyo.com/index.aspx?NID=139,5/11/18,IMAGERY,2018-05-11T00:00:00.000Z,NOT AVAILABLE,NOT AVAILABLE,52,0.00371682,3.83E-07,6476.617188,468.575495,56,35,102,56035000102,1.02,Census Tract 1.02,G5020,S,6178754926,114671145,42.9571465,-109.6510146,WY,c(-109.860585754604, 42.8660273173225)
1243,1634,10004925,DEARBORN COUNTY JUVENILE DETENTION CENTER,219 W HIGH ST,LAWRENCEBURG,IN,47025,NOT AVAILABLE,(812) 537-8740,COUNTY,OPEN,7,DEARBORN,18029,USA,922140,CORRECTIONAL INSTITUTIONS,http://www.in.gov/idoc/dys/2481.htm,3/5/18,IMAGERY,2018-03-05T00:00:00.000Z,NOT AVAILABLE,JUVENILE,20,0.001220952,7.16E-08,1143.253906,152.0816935,18,29,80300,18029080300,803,Census Tract 803,G5020,S,19085687,1201184,39.0974888,-84.8804338,IN,c(-84.8503098361331, 39.0908738643478)
1244,1635,10001887,TETON COUNTY DETENTION CENTER,175 S WILLOW ST,JACKSON,WY,83001,NOT AVAILABLE,(307) 733-2141,COUNTY,OPEN,10,TETON,56039,USA,922140,CORRECTIONAL INSTITUTIONS,http://www.tetonsheriff.org/,5/11/18,IMAGERY,2018-05-11T00:00:00.000Z,http://www.tetonsheriff.org/,MAXIMUM,45,0.001020817,6.50E-08,1109.253906,136.2327055,56,39,967800,56039967800,9678,Census Tract 9678,G5020,S,77818842,840400,43.4286916,-110.7408967,WY,c(-110.759369415366, 43.4779466344382)
1245,1636,10001889,WASHAKIE COUNTY JAIL,100 N 10TH ST,WORLAND,WY,82401,NOT AVAILABLE,NOT AVAILABLE,COUNTY,OPEN,-999,WASHAKIE,56043,USA,922140,CORRECTIONAL INSTITUTIONS,http://www.washakiecounty.net/sheriff,5/11/18,IMAGERY,2018-05-11T00:00:00.000Z,NOT AVAILABLE,NOT AVAILABLE,-999,0.002538389,2.61E-07,4490.113281,332.6434684,56,43,301,56043000301,3.01,Census Tract 3.01,G5020,S,1993203,0,44.0143691,-107.9563794,WY,c(-107.955196675731, 44.0174771522186)
1246,1637,10006550,ST. JOSEPH COMMUNITY SUPERVISION CENTER,3305 FARAON STREET,ST. JOSEPH,MO,64506,NOT AVAILABLE,(816) 271-3131,STATE,OPEN,29,BUCHANAN,29021,USA,922140,CORRECTIONAL INSTITUTIONS,https://doc.mo.gov/OD/PREA-2016.php,6/28/16,IMAGERY,2017-12-07T00:00:00.000Z,https://doc.mo.gov/Facilities.php,NOT AVAILABLE,30,0.002566621,2.69E-07,4331.644531,322.2021182,29,21,600,29021000600,6,Census Tract 6,G5020,S,5364093,12139,39.7829384,-94.8135023,MO,c(-94.8143444210278, 39.770930386844)
1247,1638,10006608,VOORHEES RESIDENTIAL COMMUNITY HOME,201 ROUTE 513,GLEN GARDNER,NJ,8826,NOT AVAILABLE,(908) 638-4625,STATE,OPEN,19,HUNTERDON,34019,USA,922140,CORRECTIONAL INSTITUTIONS,http://www.nj.gov/oag/jjc/prea.html,4/1/15,IMAGERY/OTHER,2017-12-18T00:00:00.000Z,http://www.nj.gov/oag/jjc/residential_community_list.html,JUVENILE,27,0.005987284,1.60E-06,26173.47656,728.7890685,34,19,10200,34019010200,102,Census Tract 102,G5020,S,83878772,708777,40.7263694,-74.8944081,NJ,c(-74.8914656003316, 40.6815528471801)
1248,1639,10003262,HAYNESVILLE CORRECTIONAL CENTER,421 BARNFIELD RD,HAYNESVILLE,VA,22472,NOT AVAILABLE,(804) 333-3577,STATE,OPEN,942,RICHMOND,51159,USA,922140,CORRECTIONAL INSTITUTIONS,https://vadoc.virginia.gov/about/facts/,10/22/15,IMAGERY,2018-01-19T00:00:00.000Z,https://vadoc.virginia.gov/facilities/,MEDIUM,938,0.016777368,1.73E-05,272526.0352,2070.14814,51,159,40200,51159040200,402,Census Tract 402,G5020,S,145706017,1070479,37.9147998,-76.6278355,VA,c(-76.6706534245167, 37.9574746812694)
1249,1640,10006235,MONROE COUNTY MARATHON DETENTION FACILITY,3981 OCEAN TERRACE,MARATHON,FL,33050,NOT AVAILABLE,(305) 289-2420,COUNTY,OPEN,40,MONROE,12087,USA,922140,CORRECTIONAL INSTITUTIONS,https://www.keysso.net/jail/detention_center_index.htm,2/21/18,UNVERIFIED,2018-02-21T00:00:00.000Z,https://www.keysso.net/jail/detention_center_index.htm,NOT AVAILABLE,52,0.001304443,1.00E-07,1366.921875,153.6295263,12,87,971300,12087971300,9713,Census Tract 9713,G5020,S,5361731,24290345,24.7071065,-81.1238335,FL,c(-81.0878279423116, 24.7115668003184)
1250,1641,10005625,DECATUR COUNTY JAIL,119 EAST RAILROAD STREET,GREENSBURG,IN,47240,NOT AVAILABLE,(812) 663-8125,COUNTY,OPEN,-999,DECATUR,18031,USA,922140,CORRECTIONAL INSTITUTIONS,http://www.decaturcountysheriff.com/index.html,3/5/18,IMAGERY,2018-03-05T00:00:00.000Z,http://www.decaturcountysheriff.com/index.html,NOT AVAILABLE,-999,0.002150658,2.39E-07,3833.78125,266.564098,18,31,969400,18031969400,9694,Census Tract 9694,G5020,S,220573032,353063,39.2710724,-85.4137787,IN,c(-85.4833726200588, 39.3351373130926)
1251,1642,10003263,HAYNESVILLE CORRECTIONAL UNIT #17,CAMP SEVENTEEN RD,HAYNESVILLE,VA,22472,NOT AVAILABLE,(804) 333-3577,STATE,OPEN,111,RICHMOND,51159,USA,922140,CORRECTIONAL INSTITUTIONS,https://vadoc.virginia.gov/about/facts/,10/21/15,IMAGERY,2018-01-19T00:00:00.000Z,https://vadoc.virginia.gov/facilities/,MINIMUM,114,0.006551818,1.82E-06,28527.24609,812.973716,51,159,40200,51159040200,402,Census Tract 402,G5020,S,145706017,1070479,37.9147998,-76.6278355,VA,c(-76.673763502838, 37.9561370506531)
1252,1643,10006234,MONROE COUNTY PLANTATION KEY DETENTION FACILITY,53 HIGH POINT ROAD,PLANTATION KEY,FL,33070,NOT AVAILABLE,(305) 853-3266,COUNTY,OPEN,37,MONROE,12087,USA,922140,CORRECTIONAL INSTITUTIONS,https://www.keysso.net/jail/detention_center_index.htm,2/21/18,IMAGERY,2018-02-21T00:00:00.000Z,https://www.keysso.net/jail/detention_center_index.htm,NOT AVAILABLE,47,0.002030108,2.15E-07,2937.775391,237.0161468,12,87,970800,12087970800,9708,Census Tract 9708,G5020,S,7532993,25786322,24.9782176,-80.5555867,FL,c(-80.5512860728027, 24.9798471960226)
1253,1644,10002782,EASTLAND COUNTY JAIL,201 W WHITE,EASTLAND,TX,76448,NOT AVAILABLE,(254) 629-3298,COUNTY,OPEN,39,EASTLAND,48133,USA,922140,CORRECTIONAL INSTITUTIONS,"https://www.tcjs.state.tx.us/index.php?linkID=325, http://www.eastlandcountytexas.com/page/eastland.Sheriff",3/1/18,IMAGERY,2018-04-26T00:00:00.000Z,NOT AVAILABLE,NOT AVAILABLE,97,0.002465274,2.79E-07,4094.628906,298.024602,48,133,950200,48133950200,9502,Census Tract 9502,G5020,S,394650747,8274017,32.417369,-98.8061548,TX,c(-98.8194701716866, 32.4029211403656)
1254,1645,10005604,DEKALB COUNTY JAIL,215 EAST 8TH STREET,AUBURN,IN,46706,NOT AVAILABLE,(815) 895-2155,COUNTY,OPEN,-999,DEKALB,18033,USA,922140,CORRECTIONAL INSTITUTIONS,http://www.co.dekalb.in.us/department/index.php?structureid=32,3/5/18,IMAGERY,2018-03-05T00:00:00.000Z,http://www.co.dekalb.in.us/department/index.php?structureid=32,NOT AVAILABLE,-999,0.002917992,3.54E-07,5848.289063,356.4594692,18,33,20500,18033020500,205,Census Tract 205,G5020,S,10331746,0,41.3716224,-85.06563,IN,c(-85.0538057781676, 41.3661272562449)
1255,1646,10006551,HANNIBAL COMMUNITY SUPERVISION CENTER,2002 WARREN BARRET DRIVE,HANNIBAL,MO,63401,NOT AVAILABLE,(573) 248-2450,STATE,OPEN,27,MARION,29127,USA,922140,CORRECTIONAL INSTITUTIONS,https://doc.mo.gov/OD/PREA-2015.php,8/13/15,IMAGERY,2017-12-07T00:00:00.000Z,https://doc.mo.gov/Facilities.php,NOT AVAILABLE,50,0.002484964,2.70E-07,4348.492188,308.4696022,29,127,960800,29127960800,9608,Census Tract 9608,G5020,S,9440774,1739835,39.6963696,-91.3492235,MO,c(-91.3733176176454, 39.6991442772109)
1256,1647,10000054,WESTON COUNTY DETENTION CENTER,25 N SUMNER AVE,NEWCASTLE,WY,82701,NOT AVAILABLE,NOT AVAILABLE,COUNTY,OPEN,-999,WESTON,56045,USA,922140,CORRECTIONAL INSTITUTIONS,http://westongov.com/_departments/_county_sheriff/index.asp,5/11/18,IMAGERY,2018-05-11T00:00:00.000Z,NOT AVAILABLE,NOT AVAILABLE,38,0.001584021,1.26E-07,2163.867188,204.1806303,56,45,951300,56045951300,9513,Census Tract 9513,G5020,S,110794048,183772,43.8596486,-104.2445128,WY,c(-104.203371908268, 43.8560943380865)
1257,1648,10006552,FARMINGTON COMMUNITY SUPERVISION CENTER,1430 DOUBET ROAD,FARMINGTON,MO,63640,NOT AVAILABLE,(573) 218-5006,STATE,OPEN,27,ST. FRANCOIS,29187,USA,922140,CORRECTIONAL INSTITUTIONS,https://doc.mo.gov/OD/PREA-2015.php,8/10/15,IMAGERY,2017-12-07T00:00:00.000Z,https://doc.mo.gov/Facilities.php,NOT AVAILABLE,30,0.002520918,2.64E-07,4133.1875,312.5230185,29,187,950400,29187950400,9504,Census Tract 9504,G5020,S,163757138,665984,37.8160464,-90.5382692,MO,c(-90.4330785700518, 37.7635897264647)
1258,1649,10006609,WARREN RESIDENTIAL COMMUNITY HOME,509 BRASS CASTLE ROAD,OXFORD,NJ,7863,NOT AVAILABLE,(908) 453-2032,STATE,OPEN,27,WARREN,34041,USA,922140,CORRECTIONAL INSTITUTIONS,http://www.nj.gov/oag/jjc/prea.html,4/2/15,IMAGERY/OTHER,2017-12-18T00:00:00.000Z,http://www.nj.gov/oag/jjc/residential_community_list.html,JUVENILE,30,0.002845608,4.93E-07,8060.914063,359.6074235,34,41,31601,34041031601,316.01,Census Tract 316.01,G5020,S,70878203,1387592,40.8211975,-75.0305025,NJ,c(-75.0279851393737, 40.7829485638931)
1259,1650,10000924,INDIAN CREEK CORRECTIONAL CENTER,801 SANDERSON RD,CHESAPEAKE,VA,23328,6481,(757) 421-0095,STATE,OPEN,1000,CHESAPEAKE,51550,USA,922140,CORRECTIONAL INSTITUTIONS,https://vadoc.virginia.gov/about/facts/,6/23/15,IMAGERY,2018-01-19T00:00:00.000Z,https://vadoc.virginia.gov/facilities/,MEDIUM,1008,0.016710805,1.71E-05,263997.3828,2032.341329,51,550,21102,51550021102,211.02,Census Tract 211.02,G5020,S,150040744,3213526,36.6297744,-76.1418442,VA,c(-76.17807889029, 36.6143982485182)
1260,1651,10001244,WESTERN NM CORRECTIONAL FACILITY,2111 LOBO CANYON RD,GRANTS,NM,87020,NOT AVAILABLE,(505) 876-8300,STATE,OPEN,357,CIBOLA,35006,USA,922140,CORRECTIONAL INSTITUTIONS,"http://cd.nm.gov/prea/prea.html, http://cd.nm.gov/apd/facilities.html",4/30/15,IMAGERY,2017-12-18T00:00:00.000Z,http://cd.nm.gov/apd/facilities.html,CLOSE,440,0.015742961,9.18E-06,139148.1094,1914.889115,35,6,974700,35006974700,9747,Census Tract 9747,G5020,S,7327296888,3874773,34.931701,-108.2048759,NM,c(-107.798370565259, 35.1803002635348)
1261,1652,10001583,KEEN MOUNTAIN CORRECTIONAL CENTER,STATE ROUTE 629,OAKWOOD,VA,24631,NOT AVAILABLE,(276) 498-7411,STATE,OPEN,723,BUCHANAN,51027,USA,922140,CORRECTIONAL INSTITUTIONS,https://vadoc.virginia.gov/about/facts/,11/18/14,IMAGERY,2018-01-19T00:00:00.000Z,https://vadoc.virginia.gov/facilities/,CLOSE,870,0.012276162,1.04E-05,161608.5117,1538.014397,51,27,10600,51027010600,106,Census Tract 106,G5020,S,213549061,848993,37.1912863,-81.9915297,VA,c(-81.9796886988228, 37.2234136289745)
1262,1653,10003775,"PENITENTIARY OF NEW MEXICO, LEVEL II UNIT",4311 STATE HWY 14,SANTA FE,NM,87504,NOT AVAILABLE,(505) 827-8201,STATE,OPEN,191,SANTA FE,35049,USA,922140,CORRECTIONAL INSTITUTIONS,http://cd.nm.gov/apd/facilities.html,12/18/17,IMAGERY,2017-12-18T00:00:00.000Z,http://cd.nm.gov/apd/facilities.html,MINIMUM,-999,0.007358048,2.56E-06,38964.03906,861.723998,35,49,980000,35049980000,9800,Census Tract 9800,G5020,S,1764640,0,35.5659004,-106.0658843,NM,c(-106.064360419576, 35.5665369114748)
1263,1654,10006554,POPLAR BLUFF COMMUNITY SUPERVISION CENTER,1441 BLACK RIVER INDUSTRIAL PARK DRIVE,POPLAR BLUFF,MO,63901,NOT AVAILABLE,(573) 840-9555,STATE,OPEN,38,BUTLER,29023,USA,922140,CORRECTIONAL INSTITUTIONS,https://doc.mo.gov/OD/PREA-2016.php,7/6/16,IMAGERY,2017-12-07T00:00:00.000Z,https://doc.mo.gov/Facilities.php,NOT AVAILABLE,30,0.002630567,2.84E-07,4393.921875,324.1075458,29,23,950500,29023950500,9505,Census Tract 9505,G5020,S,22787546,359144,36.7617135,-90.3654367,MO,c(-90.3741895826717, 36.7700841647158)
1264,1655,10001596,LAWRENCEVILLE CORRECTIONAL CENTER,1607 PLANTERS RD,LAWRENCEVILLE,VA,23868,NOT AVAILABLE,(434) 848-9349,STATE,OPEN,1563,BRUNSWICK,51025,USA,922140,CORRECTIONAL INSTITUTIONS,"https://vadoc.virginia.gov/about/facts/, https://www.geogroup.com/Locations",1/19/18,IMAGERY/OTHER,2018-01-19T00:00:00.000Z,https://www.geogroup.com/Locations,MEDIUM,1536,0.013276583,1.18E-05,181920.0469,1711.539697,51,25,930202,51025930202,9302.02,Census Tract 9302.02,G5020,S,2193311,0,36.7826422,-77.8198356,VA,c(-77.8155388063194, 36.7819881191099)
1265,1656,10006553,KENNETT COMMUNITY SUPERVISION CENTER,1401 LAURA DRIVE,KENNETT,MO,63857,NOT AVAILABLE,(573) 888-4900,STATE,OPEN,41,DUNKLIN,29069,USA,922140,CORRECTIONAL INSTITUTIONS,https://doc.mo.gov/OD/PREA-2016.php,7/7/16,IMAGERY,2017-12-07T00:00:00.000Z,https://doc.mo.gov/Facilities.php,NOT AVAILABLE,30,0.002691423,2.78E-07,4277.351563,330.5218592,29,69,360500,29069360500,3605,Census Tract 3605,G5020,S,12604488,2635,36.2476673,-90.057023,MO,c(-90.0480380492821, 36.2526798893065)
1266,1657,10006791,JACKSON COUNTY YOUTH CENTER,930 FLEMING AVENUE,JACKSON,MI,49202,NOT AVAILABLE,(517) 788-4460,COUNTY,OPEN,-999,JACKSON,26075,USA,922140,CORRECTIONAL INSTITUTIONS,https://www.co.jackson.mi.us/593/Youth-Center,3/20/18,IMAGERY,2018-03-20T00:00:00.000Z,https://www.co.jackson.mi.us/593/Youth-Center,JUVENILE,50,0.005201625,5.67E-07,9497.320313,661.8907795,26,75,400,26075000400,4,Census Tract 4,G5020,S,2913482,1136,42.2609849,-84.3850012,MI,c(-84.387627629346, 42.2628793145095)
1267,1658,10004563,NASSAU COUNTY JAIL AND DETENTION CENTER,76212 NICHOLAS CUTINHA ROAD,YULEE,FL,32097,NOT AVAILABLE,(904) 548-4002,COUNTY,OPEN,238,NASSAU,12089,USA,922140,CORRECTIONAL INSTITUTIONS,http://nassauso.com/,2/21/18,IMAGERY,2018-02-21T00:00:00.000Z,http://nassauso.com/,NOT AVAILABLE,-999,0.004351762,7.91E-07,11386.97461,517.7410881,12,89,50301,12089050301,503.01,Census Tract 503.01,G5020,S,306889990,5609724,30.657083,-81.6667846,FL,c(-81.6310290451424, 30.6110155704252)
1268,1659,10004907,DELAWARE COUNTY JUVENILE DETENTION CENTER,3412 W KILGORE AVE,MUNCIE,IN,47304,NOT AVAILABLE,(765) 741-4940,COUNTY,OPEN,27,DELAWARE,18035,USA,922140,CORRECTIONAL INSTITUTIONS,http://www.in.gov/idoc/dys/2481.htm,3/5/18,IMAGERY,2018-03-05T00:00:00.000Z,http://www.yocinc.org/programs/,JUVENILE,42,0.001920419,2.20E-07,3570.824219,253.7969115,18,35,500,18035000500,5,Census Tract 5,G5020,S,5709845,55670,40.1794879,-85.4234599,IN,c(-85.4264487533321, 40.1822336576035)
1269,1660,10002795,ECTOR COUNTY DETENTION CENTER,2500 S US HWY 385,ODESSA,TX,79760,NOT AVAILABLE,NOT AVAILABLE,COUNTY,OPEN,576,ECTOR,48135,USA,922140,CORRECTIONAL INSTITUTIONS,"https://www.tcjs.state.tx.us/index.php?linkID=325, http://www.ectorcountysheriff.us/index.html",3/1/18,IMAGERY,2018-04-26T00:00:00.000Z,http://www.ectorcountysheriff.us/index.html,NOT AVAILABLE,667,0.009183969,3.21E-06,46817.13672,1094.836243,48,135,3000,48135003000,30,Census Tract 30,G5020,S,490134773,3722873,31.9704514,-102.3207293,TX,c(-102.359053435069, 31.8207194657002)
1270,1661,10006835,PERSHING COUNTY JAIL / SHERIFF,395 9TH ST,LOVELOCK,NV,89419,NOT AVAILABLE,NOT AVAILABLE,COUNTY,OPEN,-999,PERSHING,32027,USA,922140,CORRECTIONAL INSTITUTIONS,http://www.pershingcounty.net/government/sheriff_s_office/index.php,4/9/18,IMAGERY,2018-04-09T00:00:00.000Z,http://www.pershingcounty.net/government/sheriff_s_office/index.php,NOT AVAILABLE,-999,0.001461024,9.01E-08,1462.035156,184.0579043,32,27,960100,32027960100,9601,Census Tract 9601,G5020,S,15634691964,79934815,40.439639,-118.4094765,NV,c(-118.476245206093, 40.1792316590115)
1271,1662,10003774,"PENITENTIARY OF NEW MEXICO, LEVEL V UNIT",4311 STATE HWY 14,SANTA FE,NM,87504,NOT AVAILABLE,(505) 827-8201,STATE,OPEN,300,SANTA FE,35049,USA,922140,CORRECTIONAL INSTITUTIONS,http://cd.nm.gov/apd/facilities.html,12/18/17,IMAGERY,2017-12-18T00:00:00.000Z,http://cd.nm.gov/apd/facilities.html,MAXIMUM,-999,0.015916995,1.46E-05,222962.4336,1963.41403,35,49,980000,35049980000,9800,Census Tract 9800,G5020,S,1764640,0,35.5659004,-106.0658843,NM,c(-106.068090437461, 35.561054617473)
1272,1663,10001592,LUNENBURG CORRECTIONAL CENTER,690 FALLS RD,VICTORIA,VA,23974,NOT AVAILABLE,(434) 696-2045,STATE,OPEN,975,LUNENBURG,51111,USA,922140,CORRECTIONAL INSTITUTIONS,https://vadoc.virginia.gov/about/facts/,3/9/17,IMAGERY,2018-01-19T00:00:00.000Z,https://vadoc.virginia.gov/facilities/,MEDIUM,987,0.014817477,1.34E-05,207960.1641,1809.426851,51,111,930100,51111930100,9301,Census Tract 9301,G5020,S,268530656,516104,37.012911,-78.1703092,VA,c(-78.2115047771151, 37.0151390748783)
1273,1664,10003320,MARION CORRECTIONAL TREATMENT CENTER,110 WRIGHT ST,MARION,VA,24354,3145,(276) 783-7154,STATE,OPEN,264,SMYTH,51173,USA,922140,CORRECTIONAL INSTITUTIONS,https://vadoc.virginia.gov/about/facts/,5/17/17,IMAGERY,2018-01-19T00:00:00.000Z,https://vadoc.virginia.gov/facilities/,MAXIMUM,379,0.005708321,2.29E-06,35389.44531,710.2408791,51,173,30500,51173030500,305,Census Tract 305,G5020,S,145393386,166406,36.7751698,-81.4105629,VA,c(-81.5088713671812, 36.8298562974884)
1274,1665,10003333,PATRICK HENRY CORRECTIONAL UNIT #28,18155 A L PHILPOTT HWY,RIDGEWAY,VA,24148,NOT AVAILABLE,(276) 957-2234,STATE,OPEN,136,HENRY,51089,USA,922140,CORRECTIONAL INSTITUTIONS,https://vadoc.virginia.gov/about/facts/,9/21/15,IMAGERY,2018-01-19T00:00:00.000Z,https://vadoc.virginia.gov/facilities/,MINIMUM,138,0.007263815,1.34E-06,20703.37109,898.5170573,51,89,10700,51089010700,107,Census Tract 107,G5020,S,143886706,233350,36.5837201,-79.9752725,VA,c(-79.9552193522649, 36.6227616825859)
1275,1666,10003278,MEDICAL COLLEGE OF VIRGINIA SECURITY WARD,401 N 12TH ST,RICHMOND,VA,23219,NOT AVAILABLE,(804) 828-0804,STATE,OPEN,15,RICHMOND CITY,51760,USA,922140,CORRECTIONAL INSTITUTIONS,https://vadoc.virginia.gov/about/facts/,1/19/18,IMAGERY,2018-01-19T00:00:00.000Z,https://vadoc.virginia.gov/facilities/,NOT AVAILABLE,-999,0.002089602,2.63E-07,4103.246094,257.1576938,51,760,30200,51760030200,302,Census Tract 302,G5020,S,1311451,0,37.5456964,-77.4359931,VA,c(-77.4303147283447, 37.5404365378593)
1276,1667,10001589,NOTTOWAY CORRECTIONAL CENTER,2892 SCHUTT RD,BURKEVILLE,VA,23922,NOT AVAILABLE,(434) 767-5543,STATE,OPEN,1432,NOTTOWAY,51135,USA,922140,CORRECTIONAL INSTITUTIONS,https://vadoc.virginia.gov/about/facts/,6/2/17,IMAGERY,2018-01-19T00:00:00.000Z,https://vadoc.virginia.gov/facilities/,MAXIMUM,1475,0.012633726,1.01E-05,156534.2188,1526.722385,51,135,300,51135000300,3,Census Tract 3,G5020,S,250996170,981898,37.1681572,-78.168813,VA,c(-78.1747556307715, 37.1831469969172)
1277,1668,10006555,FULTON COMMUNITY SUPERVISION CENTER,1397 STATE ROAD O,FULTON,MO,65251,NOT AVAILABLE,(573) 592-4061,STATE,OPEN,25,CALLAWAY,29027,USA,922140,CORRECTIONAL INSTITUTIONS,https://doc.mo.gov/OD/PREA-2015.php,8/11/15,IMAGERY,2017-12-07T00:00:00.000Z,https://doc.mo.gov/Facilities.php,NOT AVAILABLE,32,0.002692638,2.83E-07,4505.699219,336.0858389,29,27,70300,29027070300,703,Census Tract 703,G5020,S,31216261,443222,38.8513012,-91.9235718,MO,c(-91.9223130024818, 38.8437005181787)
1278,1669,10005834,POCAHONTAS STATE CORRECTIONAL CENTER,317 OLD MOUNTAIN ROAD,POCAHONTAS,VA,24635,518,(276) 945-9173,STATE,OPEN,1026,TAZEWELL,51185,USA,922140,CORRECTIONAL INSTITUTIONS,https://vadoc.virginia.gov/about/facts/,5/11/17,IMAGERY,2018-01-19T00:00:00.000Z,https://vadoc.virginia.gov/facilities/,MEDIUM,1034,0.009555559,6.49E-06,101124.4258,1171.548059,51,185,20100,51185020100,201,Census Tract 201,G5020,S,78913093,288257,37.2762244,-81.3869013,VA,c(-81.3654337321761, 37.297191353181)
1279,1670,10003848,KALAMAZOO COUNTY JAIL,1500 LAMONT AVE,KALAMAZOO,MI,49048,NOT AVAILABLE,(269) 383-8821,COUNTY,OPEN,307,KALAMAZOO,26077,USA,922140,CORRECTIONAL INSTITUTIONS,http://www.kalcounty.com/sheriff/index.php,3/21/18,IMAGERY,2018-03-21T00:00:00.000Z,http://www.kalcounty.com/sheriff/index.php,NOT AVAILABLE,400,0.008124094,1.51E-06,25361.11328,1073.670182,26,77,1801,26077001801,18.01,Census Tract 18.01,G5020,S,4637940,72573,42.2635037,-85.5533897,MI,c(-85.5495035788532, 42.2758530146377)
1280,1671,10001581,POWHATAN RECEPTION CENTER,3600 WOODS WAY,STATE FARM,VA,23160,NOT AVAILABLE,(804) 598-4251,STATE,OPEN,326,POWHATAN,51145,USA,922140,CORRECTIONAL INSTITUTIONS,https://vadoc.virginia.gov/about/facts/,7/26/16,IMAGERY,2018-01-19T00:00:00.000Z,https://vadoc.virginia.gov/facilities/,MAXIMUM,518,0.00368723,8.40E-07,13150.91797,458.7694409,51,145,500300,51145500300,5003,Census Tract 5003,G5020,S,33482296,200018,37.6621939,-77.9403515,VA,c(-77.8342818404358, 37.6276937175537)
1281,1672,10001901,JEFFREY C. WARDLE ACADEMY,3304 INTERSTATE 80 SERVICE RD,CHEYENNE,WY,82009,NOT AVAILABLE,NOT AVAILABLE,COUNTY,CLOSED,0,LARAMIE,56021,USA,922140,CORRECTIONAL INSTITUTIONS,https://www.publicschoolreview.com/jeffrey-c-wardle-academy-cornerstone-programs-profile,5/11/18,IMAGERY,2018-05-11T00:00:00.000Z,NOT AVAILABLE,JUVENILE,96,0.003811693,3.34E-07,5497.410156,486.650465,56,21,2000,56021002000,20,Census Tract 20,G5020,S,2729588322,1205491,41.2408635,-104.3404666,WY,c(-104.652078891624, 41.160586470991)
1282,1673,10004060,TRANSITION CENTER OF ST. LOUIS,1621 NORTH FIRST ST,ST. LOUIS,MO,63102,NOT AVAILABLE,(314) 877-0300,STATE,OPEN,372,ST. LOUIS CITY,29510,USA,922140,CORRECTIONAL INSTITUTIONS,https://doc.mo.gov/OD/PREA-2016.php,7/8/16,IMAGERY,2017-12-07T00:00:00.000Z,https://doc.mo.gov/Facilities.php,MINIMUM,538,0.007174241,2.69E-06,42687.62891,958.3220934,29,510,126600,29510126600,1266,Census Tract 1266,G5020,S,3182569,582265,38.6484011,-90.1908571,MO,c(-90.1842703385525, 38.6427383235377)
1283,1674,10005841,BRUCE NORMILE JUVENILE JUSTICE CENTER,1400 SOUTH BOUNDARY STREET,KIRKSVILLE,MO,63501,NOT AVAILABLE,(660) 665-4224,STATE,OPEN,-999,ADAIR,29001,USA,922140,CORRECTIONAL INSTITUTIONS,http://www.juvenilecircuit2.org/juvenile-center-history,12/7/17,IMAGERY,2017-12-07T00:00:00.000Z,http://www.juvenilecircuit2.org/,JUVENILE,16,0.002689176,2.88E-07,4668.722656,342.5218995,29,1,950500,29001950500,9505,Census Tract 9505,G5020,S,68944894,2433866,40.1823975,-92.617057,MO,c(-92.5965295496622, 40.184978027973)
1284,1675,10003773,"PENITENTIARY OF NEW MEXICO, LEVEL VI UNIT",4311 STATE HWY 14,SANTA FE,NM,87504,NOT AVAILABLE,(505) 827-8201,STATE,OPEN,300,SANTA FE,35049,USA,922140,CORRECTIONAL INSTITUTIONS,http://cd.nm.gov/apd/facilities.html,12/18/17,IMAGERY,2017-12-18T00:00:00.000Z,http://cd.nm.gov/apd/facilities.html,MAXIMUM,-999,0.01626197,1.46E-05,222563.5352,1995.577425,35,49,980000,35049980000,9800,Census Tract 9800,G5020,S,1764640,0,35.5659004,-106.0658843,NM,c(-106.069106670158, 35.5690483675224)
1285,1676,10003776,"PENITENTIARY OF NEW MEXICO, OLD MAIN UNIT",4311 STATE HWY 14,SANTA FE,NM,87504,NOT AVAILABLE,(505) 827-8201,STATE,CLOSED,0,SANTA FE,35049,USA,922140,CORRECTIONAL INSTITUTIONS,http://cd.nm.gov/pio/old_main.html,12/18/17,IMAGERY,2017-12-18T00:00:00.000Z,http://corrections.state.nm.us/prisons/pnm.html,NOT AVAILABLE,-999,0.01628791,1.46E-05,221976.3984,1995.718524,35,49,980000,35049980000,9800,Census Tract 9800,G5020,S,1764640,0,35.5659004,-106.0658843,NM,c(-106.061689751155, 35.5620166173106)
1286,1677,10000497,OKEECHOBEE COUNTY JAIL,504 NW 4TH ST,OKEECHOBEE,FL,34972,NOT AVAILABLE,NOT AVAILABLE,COUNTY,OPEN,244,OKEECHOBEE,12093,USA,922140,CORRECTIONAL INSTITUTIONS,"http://www.dc.state.fl.us/pub/jails/, https://www.okeesheriff.org/",2/21/18,IMAGERY,2018-02-21T00:00:00.000Z,https://www.okeesheriff.org/,MAXIMUM,232,0.005333067,9.87E-07,13754.14063,630.0625368,12,93,910202,12093910202,9102.02,Census Tract 9102.02,G5020,S,22853535,162502,27.2613205,-80.8798465,FL,c(-80.8360789421129, 27.2476447107447)
1287,1678,10001960,CENTRAL NM CORRECTIONAL FACILITY / MAIN / LEVEL II UNIT,1525 MORRIS RD,LOS LUNAS,NM,87031,NOT AVAILABLE,(505) 383-3359,STATE,OPEN,955,VALENCIA,35061,USA,922140,CORRECTIONAL INSTITUTIONS,http://cd.nm.gov/prea/prea.html,7/27/16,IMAGERY,2017-12-18T00:00:00.000Z,http://cd.nm.gov/apd/facilities.html,MAXIMUM,966,0.025439392,2.41E-05,363705.2188,3185.416977,35,61,970700,35061970700,9707,Census Tract 9707,G5020,S,42329824,16449,34.743406,-106.7620613,NM,c(-106.766265770325, 34.7877375704015)
1288,1679,10003307,RED ONION STATE PRISON,10800 H JACK ROSE HWY,POUND,VA,24279,NOT AVAILABLE,(276) 796-7510,STATE,OPEN,851,WISE,51195,USA,922140,CORRECTIONAL INSTITUTIONS,https://vadoc.virginia.gov/about/facts/,9/22/15,IMAGERY,2018-01-19T00:00:00.000Z,https://vadoc.virginia.gov/facilities/,MAXIMUM,987,0.010804469,7.94E-06,123379.1367,1339.826426,51,195,930700,51195930700,9307,Census Tract 9307,G5020,S,96928037,450039,37.1147032,-82.5668741,VA,c(-82.5499112926803, 37.1117073014791)
1289,1680,10006218,RIVER NORTH CORRECTIONAL CENTER,329 DELL BROOK LANE,INDEPENDENCE,VA,24348,NOT AVAILABLE,(276) 773-2518,STATE,OPEN,897,GRAYSON,51077,USA,922140,CORRECTIONAL INSTITUTIONS,https://vadoc.virginia.gov/about/facts/,3/16/16,IMAGERY,2018-01-19T00:00:00.000Z,https://vadoc.virginia.gov/facilities/,MEDIUM,1000,0.010062119,5.75E-06,88796.23438,1212.761814,51,77,60201,51077060201,602.01,Census Tract 602.01,G5020,S,195750619,2939470,36.6615826,-81.103939,VA,c(-81.126827525826, 36.6151737218856)
1290,1681,10005635,DUBOIS COUNTY JAIL,255 BRUCKE STRASSE,JASPER,IN,47546,NOT AVAILABLE,(812) 482-3522,COUNTY,OPEN,77,DUBOIS,18037,USA,922140,CORRECTIONAL INSTITUTIONS,"http://www.duboiscountysd.com/index.html, http://www.duboiscountyin.org/offices/corrections.html",3/5/18,IMAGERY,2018-03-05T00:00:00.000Z,http://www.duboiscountysd.com/index.html,NOT AVAILABLE,98,0.004815358,6.45E-07,10196.30078,598.4381438,18,37,953400,18037953400,9534,Census Tract 9534,G5020,S,18429356,334464,38.3772534,-86.9315039,IN,c(-86.92799681549, 38.3845132269526)
1291,1682,10006556,CAMP AVERY PARK CAMP,198 AVERY LANE,TROY,MO,63379,NOT AVAILABLE,(636) 528-8800,STATE,OPEN,24,LINCOLN,29113,USA,922140,CORRECTIONAL INSTITUTIONS,https://dss.mo.gov/reports/prison-rape-elimination-act-reports/prea-audit-full-compliance-reports/,2/17/17,IMAGERY,2017-12-07T00:00:00.000Z,NOT AVAILABLE,JUVENILE,36,0.00326333,5.03E-07,8021.835938,401.9917111,29,113,810304,29113810304,8103.04,Census Tract 8103.04,G5020,S,162623003,1248797,39.0186404,-90.8904584,MO,c(-90.9147649559388, 39.0190969297256)
1292,1683,10002794,ECTOR COUNTY YOUTH CENTER,1401 E YUKON RD,ODESSA,TX,79762,NOT AVAILABLE,(432) 362-6356,COUNTY,OPEN,-999,ECTOR,48135,USA,922140,CORRECTIONAL INSTITUTIONS,http://www.tjjd.texas.gov/publications/other/searchfacilityregistryresults.aspx?SelectedFacilityType=YKSBbGCMUWM=&SelectedSortBy=laExhobORj5ZHimppFKN0Q==&IncludeInactive=bZL7qeN3IjY=,4/26/18,IMAGERY,2018-04-26T00:00:00.000Z,NOT AVAILABLE,JUVENILE,21,0.005239612,8.40E-07,12265.89453,631.656221,48,135,2501,48135002501,25.01,Census Tract 25.01,G5020,S,16978123,144818,31.9225461,-102.3865496,TX,c(-102.379652089545, 31.9146855082229)
1293,1684,10005761,STOREY COUNTY JAIL,911 STATE ROUTE 341 S,VIRGINIA CITY,NV,89440,NOT AVAILABLE,NOT AVAILABLE,COUNTY,OPEN,-999,STOREY,32029,USA,922140,CORRECTIONAL INSTITUTIONS,http://www.storeycounty.org/313/Sheriff,4/9/18,IMAGERY,2018-04-09T00:00:00.000Z,http://www.storeycounty.org/313/Sheriff,NOT AVAILABLE,25,0.002280419,2.71E-07,4346.300781,280.0817622,32,29,970200,32029970200,9702,Census Tract 9702,G5020,S,683680818,1881020,39.4383853,-119.5246462,NV,c(-119.650849586829, 39.2976676982316)
1294,1685,10005902,DELMINA WOODS YOUTH FACILITY,8872 STATE HIGHWAY H,FORSYTH,MO,65653,NOT AVAILABLE,(417) 634-3196,STATE,OPEN,18,CHRISTIAN,29213,USA,922140,CORRECTIONAL INSTITUTIONS,https://dss.mo.gov/reports/prison-rape-elimination-act-reports/prea-audit-full-compliance-reports/,4/20/17,IMAGERY,2017-12-07T00:00:00.000Z,NOT AVAILABLE,JUVENILE,24,0.008301189,2.99E-06,46332.49609,978.7522394,29,43,20500,29043020500,205,Census Tract 205,G5020,S,607326656,98306,36.8855946,-93.1231988,MO,c(-93.1095963350687, 36.8302519709404)
1295,1686,10003787,"CENTRAL NM CORRECTIONAL FACILITY, LEVEL I UNIT",3201 HIGHWAY 314 SW,LOS LUNAS,NM,87031,NOT AVAILABLE,(505) 865-2728,STATE,OPEN,350,VALENCIA,35061,USA,922140,CORRECTIONAL INSTITUTIONS,http://cd.nm.gov/prea/prea.html,7/27/16,IMAGERY,2017-12-18T00:00:00.000Z,http://cd.nm.gov/apd/facilities.html,MINIMUM,336,0.012100348,7.22E-06,108894.0625,1490.940229,35,61,970700,35061970700,9707,Census Tract 9707,G5020,S,42329824,16449,34.743406,-106.7620613,NM,c(-106.750979829026, 34.770149507677)
1296,1687,10004053,FULTON TREATMENT CENTER,1650 STATE HWY O,FULTON,MO,65251,NOT AVAILABLE,(573) 592-4188,STATE,OPEN,23,CALLAWAY,29027,USA,922140,CORRECTIONAL INSTITUTIONS,"https://dss.mo.gov/reports/prison-rape-elimination-act-reports/prea-audit-full-compliance-reports/, https://dss.mo.gov/re/dysar.htm",6/30/16,IMAGERY,2017-12-07T00:00:00.000Z,NOT AVAILABLE,JUVENILE,30,0.005244671,1.61E-06,25671.11328,664.6631633,29,27,70300,29027070300,703,Census Tract 703,G5020,S,31216261,443222,38.8513012,-91.9235718,MO,c(-91.925469827783, 38.8373798529914)
1297,1688,10003289,RUSTBURG CORRECTIONAL UNIT #9,479 CAMP NINE RD,RUSTBURG,VA,24588,NOT AVAILABLE,(434) 332-7354,STATE,OPEN,149,CAMPBELL,51031,USA,922140,CORRECTIONAL INSTITUTIONS,https://vadoc.virginia.gov/about/facts/,7/6/17,IMAGERY/OTHER,2018-01-19T00:00:00.000Z,https://vadoc.virginia.gov/facilities/,MINIMUM,157,0.005730124,1.18E-06,18301.07031,676.5596543,51,31,20102,51031020102,201.02,Census Tract 201.02,G5020,S,176108956,237634,37.2552932,-79.0137313,VA,c(-79.067832750689, 37.2673148840305)
1298,1689,10003769,SPRINGER CORRECTIONAL CENTER,201 ROAD HWY 468,SPRINGER,NM,87747,NOT AVAILABLE,(575) 483-3100,STATE,OPEN,271,COLFAX,35007,USA,922140,CORRECTIONAL INSTITUTIONS,http://cd.nm.gov/prea/prea.html,6/9/16,IMAGERY,2017-12-18T00:00:00.000Z,http://cd.nm.gov/apd/facilities.html,MINIMUM,294,0.016065966,1.58E-05,242694.707,1954.806786,35,7,950700,35007950700,9507,Census Tract 9507,G5020,S,6035917903,23114442,36.4792323,-104.7523081,NM,c(-104.626328093365, 36.3869920103021)
1299,1690,10000925,ST. BRIDES CORRECTIONAL CENTER,701 SANDERSON RD,CHESAPEAKE,VA,23328,6482,(757) 421-6600,STATE,OPEN,1174,CHESAPEAKE,51550,USA,922140,CORRECTIONAL INSTITUTIONS,https://vadoc.virginia.gov/about/facts/,11/18/14,IMAGERY,2018-01-19T00:00:00.000Z,https://vadoc.virginia.gov/facilities/,MEDIUM,1214,0.014113986,1.19E-05,183261.5313,1738.263349,51,550,21102,51550021102,211.02,Census Tract 211.02,G5020,S,150040744,3213526,36.6297744,-76.1418442,VA,c(-76.1829587199312, 36.6104820294424)
1300,1691,10004892,ELKHART COUNTY CORRECTIONS CENTER,26861 C.R. 26,ELKHART,IN,46517,NOT AVAILABLE,(574) 891-2100,COUNTY,OPEN,782,ELKHART,18039,USA,922140,CORRECTIONAL INSTITUTIONS,http://www.elkhartcountysheriff.com/divisions/corrections/,3/5/18,IMAGERY,2018-03-05T00:00:00.000Z,http://www.elkhartcountysheriff.com/divisions/corrections/,MAXIMUM,936,0.012430231,3.49E-06,57925.75,1569.009016,18,39,2200,18039002200,22,Census Tract 22,G5020,S,18977486,0,41.6365601,-85.9825909,IN,c(-85.9812815392239, 41.625129450016)
1301,1692,10002990,WASHOE COUNTY DETENTION FACILITY,911 PARR BLVD,RENO,NV,89512,NOT AVAILABLE,(775) 328-2971,COUNTY,OPEN,1085,WASHOE,32031,USA,922140,CORRECTIONAL INSTITUTIONS,https://www.washoesheriff.com/,4/9/18,IMAGERY,2018-04-09T00:00:00.000Z,https://www.washoesheriff.com/,MAXIMUM,1124,0.011043858,5.59E-06,89881.91406,1349.954271,32,31,2617,32031002617,26.17,Census Tract 26.17,G5020,S,10449566,0,39.5862498,-119.8180511,NV,c(-119.811771403834, 39.5742274947579)
1302,1693,10006557,GENTRY RESIDENTIAL TREATMENT CENTER,2001 DYS DRIVE,CABOOL,MO,65689,NOT AVAILABLE,(417) 962-4344,STATE,OPEN,20,TEXAS,29215,USA,922140,CORRECTIONAL INSTITUTIONS,https://dss.mo.gov/reports/prison-rape-elimination-act-reports/prea-audit-full-compliance-reports/,4/20/17,IMAGERY,2017-12-07T00:00:00.000Z,NOT AVAILABLE,JUVENILE,24,0.003487825,7.81E-07,12142.71875,427.8374777,29,215,480400,29215480400,4804,Census Tract 4804,G5020,S,618574865,566797,37.1444221,-92.0928699,MO,c(-92.091196125273, 37.1164808729348)
1303,1694,10006792,KALAMAZOO COUNTY JUVENILE HOME,1424 GULL ROAD,KALAMAZOO,MI,49048,NOT AVAILABLE,(269) 385-8550,COUNTY,OPEN,-999,KALAMAZOO,26077,USA,922140,CORRECTIONAL INSTITUTIONS,http://www.kalcounty.com/courts/kcjh/,3/21/18,IMAGERY,2018-03-21T00:00:00.000Z,http://www.kalcounty.com/courts/kcjh/,JUVENILE,40,0.007979084,1.35E-06,22585.78516,973.5961794,26,77,100,26077000100,1,Census Tract 1,G5020,S,1685637,55834,42.2987687,-85.5624219,MI,c(-85.5617886597533, 42.3036935912741)
1304,1695,10004062,HILLSBORO TREATMENT CENTER,10434 STATE RD BB,HILLSBORO,MO,63050,NOT AVAILABLE,(636) 797-9813,STATE,OPEN,18,JEFFERSON,29099,USA,922140,CORRECTIONAL INSTITUTIONS,https://dss.mo.gov/reports/prison-rape-elimination-act-reports/prea-audit-full-compliance-reports/,6/8/15,IMAGERY,2017-12-07T00:00:00.000Z,NOT AVAILABLE,JUVENILE,24,0.004075412,8.07E-07,12738.03125,495.9514205,29,99,700502,29099700502,7005.02,Census Tract 7005.02,G5020,S,82533986,1261214,38.283633,-90.585431,MO,c(-90.5687756167473, 38.2359680526091)
1305,1696,10001593,SUSSEX I STATE PRISON,24414 MUSSELWHITE DR,WAVERLY,VA,23891,1111,(804) 834-9967,STATE,OPEN,1131,SUSSEX,51183,USA,922140,CORRECTIONAL INSTITUTIONS,https://vadoc.virginia.gov/about/facts/,5/23/17,IMAGERY,2018-01-19T00:00:00.000Z,https://vadoc.virginia.gov/facilities/,MAXIMUM,1227,0.013094903,1.08E-05,168231.3047,1615.209737,51,183,870202,51183870202,8702.02,Census Tract 8702.02,G5020,S,1454865,0,37.0458906,-77.2024823,VA,c(-77.1988084727693, 37.0463099590334)
1306,1697,10001594,SUSSEX II STATE PRISON,24427 MUSSELWHITE DR,WAVERLY,VA,23891,2222,(804) 834-2678,STATE,OPEN,1258,SUSSEX,51183,USA,922140,CORRECTIONAL INSTITUTIONS,https://vadoc.virginia.gov/about/facts/,11/3/15,IMAGERY,2018-01-19T00:00:00.000Z,https://vadoc.virginia.gov/facilities/,MAXIMUM,1302,0.015832203,1.13E-05,174690.7344,1947.451504,51,183,870202,51183870202,8702.02,Census Tract 8702.02,G5020,S,1454865,0,37.0458906,-77.2024823,VA,c(-77.2054553889404, 37.0520819430954)
1307,1698,10005867,HOGAN STREET REGIONAL YOUTH CENTER,1839 HOGAN STREET,SAINT LOUIS,MO,65109,NOT AVAILABLE,(314) 340-7434,STATE,OPEN,35,ST. LOUIS CITY,29510,USA,922140,CORRECTIONAL INSTITUTIONS,https://dss.mo.gov/reports/prison-rape-elimination-act-reports/prea-audit-full-compliance-reports/,11/15/16,IMAGERY/OTHER,2017-12-07T00:00:00.000Z,NOT AVAILABLE,JUVENILE,36,0.002201948,2.93E-07,4648.816406,273.355131,29,510,126600,29510126600,1266,Census Tract 1266,G5020,S,3182569,582265,38.6484011,-90.1908571,MO,c(-90.2006734591455, 38.6466254866784)
1308,1699,10003795,"SOUTHERN NM CORRECTIONAL FACILITY, LEVEL III UNIT",1983 JOE R SILVA BLVD,LAS CRUCES,NM,88004,639,(575) 523-3200,STATE,OPEN,440,DONA ANA,35013,USA,922140,CORRECTIONAL INSTITUTIONS,http://cd.nm.gov/prea/prea.html,7/21/17,IMAGERY,2017-12-18T00:00:00.000Z,http://cd.nm.gov/apd/facilities.html,MAXIMUM,480,0.018494703,2.18E-05,319996.1445,2262.993123,35,13,1500,35013001500,15,Census Tract 15,G5020,S,1586024543,733685,32.3444876,-107.0502871,NM,c(-106.951674255445, 32.2495844373636)
1309,1700,10002171,"ORANGE COUNTY DETENTION CENTER, MAIN FACILITY",3723 VISION BLVD,ORLANDO,FL,32839,NOT AVAILABLE,(407) 836-3400,COUNTY,OPEN,1000,ORANGE,12095,USA,922140,CORRECTIONAL INSTITUTIONS,http://www.orangecountyfl.net/JailInmateServices.aspx#.Wo3LVvnwbmG,2/21/18,IMAGERY,2018-02-21T00:00:00.000Z,http://www.orangecountyfl.net/JailInmateServices.aspx#.Wo3LVvnwbmG,MAXIMUM,1053,0.009738817,3.56E-06,50190.61523,1166.116462,12,95,14503,12095014503,145.03,Census Tract 145.03,G5020,S,1654519,364870,28.5020716,-81.4102035,FL,c(-81.4143157407685, 28.5056108554164)
1310,1701,10001249,ROSWELL CORRECTIONAL CENTER,578 W CHICKASAW RD,HAGERMAN,NM,88232,NOT AVAILABLE,(575) 625-3100,STATE,OPEN,339,CHAVES,35005,USA,922140,CORRECTIONAL INSTITUTIONS,http://cd.nm.gov/prea/prea.html,2/18/16,IMAGERY,2017-12-18T00:00:00.000Z,http://cd.nm.gov/apd/facilities.html,MINIMUM,340,0.008178757,2.47E-06,36543.57422,998.6925648,35,5,1300,35005001300,13,Census Tract 13,G5020,S,510045044,1011474,33.1759645,-104.3968082,NM,c(-104.543213515304, 33.1407417277514)
1311,1702,10001591,WALLENS RIDGE STATE PRISON,272 DOGWOOD DR,BIG STONE GAP,VA,24219,NOT AVAILABLE,(276) 523-3310,STATE,OPEN,1062,WISE,51195,USA,922140,CORRECTIONAL INSTITUTIONS,https://vadoc.virginia.gov/about/facts/,4/28/16,IMAGERY,2018-01-19T00:00:00.000Z,https://vadoc.virginia.gov/facilities/,MAXIMUM,1212,0.01043857,7.79E-06,120561.8516,1290.452033,51,195,931200,51195931200,9312,Census Tract 9312,G5020,S,38086329,349192,36.8553326,-82.781025,VA,c(-82.7867515707181, 36.842101399777)
1312,1703,10002167,"ORANGE COUNTY DETENTION CENTER, PHOENIX FACILITY",3723 VISION BLVD,ORLANDO,FL,32839,NOT AVAILABLE,(407) 836-3400,COUNTY,OPEN,286,ORANGE,12095,USA,922140,CORRECTIONAL INSTITUTIONS,http://www.orangecountyfl.net/JailInmateServices.aspx#.Wo3LVvnwbmG,2/21/18,IMAGERY,2018-02-21T00:00:00.000Z,http://www.orangecountyfl.net/JailInmateServices.aspx#.Wo3LVvnwbmG,NOT AVAILABLE,288,0.004358446,5.68E-07,8011.269531,520.4255554,12,95,14503,12095014503,145.03,Census Tract 145.03,G5020,S,1654519,364870,28.5020716,-81.4102035,FL,c(-81.4163876777344, 28.5028785427058)
1313,1704,10004893,ELKHART COUNTY JUVENILE DETENTION CENTER,114 N 2ND ST,GOSHEN,IN,46526,NOT AVAILABLE,(574) 534-1312,COUNTY,NOT AVAILABLE,14,ELKHART,18039,USA,922140,CORRECTIONAL INSTITUTIONS,"http://www.in.gov/idoc/dys/2481.htm, http://wsbt.com/news/local/elkhart-county-moving-to-build-new-juvenile-detention-center",3/5/18,IMAGERY,2018-03-05T00:00:00.000Z,NOT AVAILABLE,JUVENILE,17,0.000854544,4.30E-08,712.40625,114.9585522,18,39,100,18039000100,1,Census Tract 1,G5020,S,1859611,29700,41.5817738,-85.8352019,IN,c(-85.8369813613864, 41.5873609328185)
1314,1705,10006456,DAPHNE CORRECTIONS CENTER,1502 US HWY 98,DAPHNE,AL,36526,NOT AVAILABLE,NOT AVAILABLE,LOCAL,OPEN,-999,BALDWIN,1003,USA,922140,CORRECTIONAL INSTITUTIONS,http://daphnepolice.org/,5/11/18,IMAGERY,2018-05-11T00:00:00.000Z,http://daphnepolice.org/,NOT AVAILABLE,74,0.002886264,3.82E-07,5500.308594,347.1609459,1,3,10800,1003010800,108,Census Tract 108,G5020,S,18088470,3922795,30.5939161,-87.9006394,AL,c(-87.8966636178388, 30.6000217584974)
1315,1706,10006558,LANGSFORD HOUSE YOUTH CENTER,525 SE 2ND STREET,LEES SUMMIT,MO,64063,NOT AVAILABLE,(816) 622-0999,STATE,OPEN,8,JACKSON,29095,USA,922140,CORRECTIONAL INSTITUTIONS,https://dss.mo.gov/reports/prison-rape-elimination-act-reports/prea-audit-full-compliance-reports/,12/6/16,IMAGERY,2017-12-07T00:00:00.000Z,NOT AVAILABLE,JUVENILE,12,0.001232527,9.17E-08,1460.816406,153.392611,29,95,13703,29095013703,137.03,Census Tract 137.03,G5020,S,3811728,0,38.9156844,-94.3717465,MO,c(-94.3679715998737, 38.9153272433213)
1316,1707,10006559,CORNERSTONE,1250 EAST BROWN SCHOOL RD,COLUMBIA,MO,65202,NOT AVAILABLE,(573) 449-3756,STATE,OPEN,12,BOONE,29019,USA,922140,CORRECTIONAL INSTITUTIONS,"https://dss.mo.gov/reports/prison-rape-elimination-act-reports/prea-audit-full-compliance-reports/, https://dss.mo.gov/re/dysar.htm",6/30/16,IMAGERY,2017-12-07T00:00:00.000Z,NOT AVAILABLE,JUVENILE,10,0.003000488,4.15E-07,6616.40625,389.7369232,29,19,1504,29019001504,15.04,Census Tract 15.04,G5020,S,9455490,0,38.9852378,-92.3096514,MO,c(-92.322437358576, 38.9997893391328)
1317,1708,10005875,GREEN GABLES LODGE,275 GREEN GABLE DRIVE,MACKS CREEK,MO,65786,NOT AVAILABLE,(573) 363-5352,STATE,CLOSED,0,CAMDEN,29029,USA,922140,CORRECTIONAL INSTITUTIONS,https://dss.mo.gov/re/pdf/dys/youth-services-annual-report-fy16.pdf,3/15/16,IMAGERY,2017-12-07T00:00:00.000Z,NOT AVAILABLE,JUVENILE,12,0.006779862,1.89E-06,29660.72266,810.0662161,29,29,950800,29029950800,9508,Census Tract 9508,G5020,S,554064558,7240703,37.9744196,-92.880974,MO,c(-92.8753390105537, 37.9498395550767)
1318,1709,10003781,NORTHWEST NEW MEXICO CORRECTIONAL CENTER,1700 EAST OLD HIGHWAY 66,GRANTS,NM,87020,NOT AVAILABLE,(505) 287-2941,STATE,OPEN,-999,CIBOLA,35006,USA,922140,CORRECTIONAL INSTITUTIONS,http://www.corecivic.com/facilities,12/18/17,IMAGERY,2017-12-18T00:00:00.000Z,http://www.corecivic.com/facilities,MAXIMUM,-999,0.007903936,3.91E-06,59206.76172,985.4993809,35,6,974201,35006974201,9742.01,Census Tract 9742.01,G5020,S,27406062,0,35.1344415,-107.8132278,NM,c(-107.816946901337, 35.140787248017)
1319,1710,10001246,GUADALUPE COUNTY CORRECTIONAL FACILITY,SOUTH HWY 54,SANTA ROSA,NM,88435,NOT AVAILABLE,(575) 472-1001,STATE,OPEN,588,GUADALUPE,35019,USA,922140,CORRECTIONAL INSTITUTIONS,"http://cd.nm.gov/pio/docs/2013-2014_Annual_Report.pdf, https://www.geogroup.com/Locations",10/13/17,IMAGERY/OTHER,2017-10-13T00:00:00.000Z,https://www.geogroup.com/Locations,CLOSE,600,0.008816989,5.10E-06,77113.64844,1099.604918,35,19,961600,35019961600,9616,Census Tract 9616,G5020,S,7847072129,2887948,34.8697822,-104.7849677,NM,c(-104.702851479621, 34.9078715553342)
1320,1711,10002380,BON AIR JUVENILE CORRECTIONAL CENTER,1900 CHATSWORTH AVE,RICHMOND,VA,23235,NOT AVAILABLE,(804) 323-2550,STATE,OPEN,178,CHESTERFIELD,51041,USA,922140,CORRECTIONAL INSTITUTIONS,http://www.djj.virginia.gov/pages/residential/residential-services.htm,11/20/15,IMAGERY,2018-01-22T00:00:00.000Z,http://www.djj.virginia.gov/pages/residential/residential-services.htm,JUVENILE,284,0.014257248,8.73E-06,136411.3711,1810.785728,51,41,100907,51041100907,1009.07,Census Tract 1009.07,G5020,S,4947313,32335,37.5066609,-77.5649254,VA,c(-77.5701657867358, 37.5160694689405)
1321,1712,10002168,ORANGE COUNTY FEMALE DETENTION CENTER,3723 VISION BLVD,ORLANDO,FL,32839,NOT AVAILABLE,(407) 836-3400,COUNTY,OPEN,473,ORANGE,12095,USA,922140,CORRECTIONAL INSTITUTIONS,http://www.orangecountyfl.net/JailInmateServices.aspx#.Wo3LVvnwbmG,2/21/18,IMAGERY,2018-02-21T00:00:00.000Z,http://www.orangecountyfl.net/JailInmateServices.aspx#.Wo3LVvnwbmG,MAXIMUM,652,0.004539007,1.01E-06,14204.75977,533.6701963,12,95,14504,12095014504,145.04,Census Tract 145.04,G5020,S,3605078,140540,28.4959138,-81.4205899,FL,c(-81.4165253204305, 28.50553198486)
1322,1713,10003831,KENT COUNTY CORRECTIONAL FACILITY,703 BALL AVE NE,GRAND RAPIDS,MI,49503,NOT AVAILABLE,(616) 632-6400,COUNTY,OPEN,1071,KENT,26081,USA,922140,CORRECTIONAL INSTITUTIONS,https://www.accesskent.com/Sheriff/,3/21/18,IMAGERY,2018-03-21T00:00:00.000Z,https://www.accesskent.com/Sheriff/,MAXIMUM,1100,0.010191924,2.90E-06,49184.71094,1316.511217,26,81,1101,26081001101,11.01,Census Tract 11.01,G5020,S,3922246,3962,42.9870456,-85.6306662,MI,c(-85.6322821991424, 42.9752093715595)
1323,1714,10003798,JAN EVANS JUVENILE JUSTICE CENTER,650 FERRARI MCLEOD BLVD,RENO,NV,89512,NOT AVAILABLE,(775) 325-7810,COUNTY,OPEN,-999,WASHOE,32031,USA,922140,CORRECTIONAL INSTITUTIONS,https://www.washoecounty.us/juvenilesvs/index.php,4/9/18,IMAGERY,2018-04-09T00:00:00.000Z,https://www.washoecounty.us/juvenilesvs/index.php,JUVENILE,108,0.006913819,1.44E-06,23096.5625,856.1622692,32,31,2617,32031002617,26.17,Census Tract 26.17,G5020,S,10449566,0,39.5862498,-119.8180511,NV,c(-119.809076677332, 39.5699419274145)
1324,1715,10006139,FAYETTE COUNTY JAIL,123 WEST FOURTH STREET,CONNERSVILLE,IN,47331,NOT AVAILABLE,(765) 825-1110,COUNTY,OPEN,-999,FAYETTE,18041,USA,922140,CORRECTIONAL INSTITUTIONS,http://connersvillecommunity.com/Fayette_County/Justice_System/Jail,3/5/18,IMAGERY,2018-03-05T00:00:00.000Z,NOT AVAILABLE,NOT AVAILABLE,-999,0.003147477,4.80E-07,7728.75,388.3339579,18,41,954500,18041954500,9545,Census Tract 9545,G5020,S,12062515,0,39.6240145,-85.134023,IN,c(-85.1411043029162, 39.6404527628063)
1325,1716,10006457,FOLEY CITY JAIL,200 EAST SECTION AVENUE,FOLEY,AL,36535,NOT AVAILABLE,(251) 970-3040,LOCAL,OPEN,-999,BALDWIN,1003,USA,922140,CORRECTIONAL INSTITUTIONS,http://www.cityoffoley.org/CityServices/PoliceDepartment.aspx,5/11/18,IMAGERY,2018-05-11T00:00:00.000Z,NOT AVAILABLE,NOT AVAILABLE,55,0.002344954,3.60E-07,5171.148438,276.642179,1,3,11501,1003011501,115.01,Census Tract 115.01,G5020,S,38605086,96924,30.4324484,-87.6790139,AL,c(-87.6818689803998, 30.4133990007459)
1326,1717,10005863,MISSOURI HILLS CAMPUS - BISSEL HALL,13298 BELLEFONTAINE ROAD,SAINT LOUIS,MO,63138,NOT AVAILABLE,(314) 355-8088,STATE,OPEN,26,ST. LOUIS,29189,USA,922140,CORRECTIONAL INSTITUTIONS,"https://dss.mo.gov/reports/prison-rape-elimination-act-reports/prea-audit-full-compliance-reports/, https://dss.mo.gov/re/dysar.htm",6/30/16,IMAGERY/OTHER,2017-12-07T00:00:00.000Z,NOT AVAILABLE,JUVENILE,20,0.000977941,5.67E-08,902.1914063,121.8820437,29,189,210100,29189210100,2101,Census Tract 2101,G5020,S,39086010,4961325,38.8034745,-90.1576849,MO,c(-90.2153278838023, 38.8271083846366)
1327,1718,10003282,CENTRAL ADMISSION AND PLACEMENT UNIT,1601 OLD BON AIR RD,NORTH CHESTERFIELD,VA,23235,NOT AVAILABLE,(804) 323-2104,STATE,OPEN,-999,CHESTERFIELD,51041,USA,922140,CORRECTIONAL INSTITUTIONS,http://www.djj.virginia.gov/pages/residential/residential-services.htm,1/22/18,IMAGERY,2018-01-22T00:00:00.000Z,http://www.djj.virginia.gov/pages/residential/residential-services.htm,JUVENILE,-999,0.013352273,4.38E-06,68439.98828,1667.412057,51,41,100907,51041100907,1009.07,Census Tract 1009.07,G5020,S,4947313,32335,37.5066609,-77.5649254,VA,c(-77.5724514520526, 37.517276747514)
1328,1719,10005866,MISSOURI HILLS CAMPUS - FORT BELLEFONTAINE,13290 BELLEFONTAINE ROAD,SAINT LOUIS,MO,63138,NOT AVAILABLE,(314) 355-7807,STATE,OPEN,24,ST. LOUIS,29189,USA,922140,CORRECTIONAL INSTITUTIONS,"https://dss.mo.gov/reports/prison-rape-elimination-act-reports/prea-audit-full-compliance-reports/, https://dss.mo.gov/re/dysar.htm",6/30/16,IMAGERY/OTHER,2017-12-07T00:00:00.000Z,NOT AVAILABLE,JUVENILE,20,0.000922521,5.10E-08,812.03125,118.415526,29,189,210100,29189210100,2101,Census Tract 2101,G5020,S,39086010,4961325,38.8034745,-90.1576849,MO,c(-90.2160741642643, 38.8260866344144)
1329,1720,10005862,MISSOURI HILLS CAMPUS - LEWIS AND CLARK HALL,13311 BELLEFONTAINE ROAD,SAINT LOUIS,MO,63138,NOT AVAILABLE,(314) 355-7809,STATE,OPEN,10,ST. LOUIS,29189,USA,922140,CORRECTIONAL INSTITUTIONS,"https://dss.mo.gov/reports/prison-rape-elimination-act-reports/prea-audit-full-compliance-reports/, https://dss.mo.gov/re/dysar.htm",6/30/16,IMAGERY/OTHER,2017-12-07T00:00:00.000Z,NOT AVAILABLE,JUVENILE,10,0.000894058,4.74E-08,754.6601563,110.8908784,29,189,210100,29189210100,2101,Census Tract 2101,G5020,S,39086010,4961325,38.8034745,-90.1576849,MO,c(-90.2176290968719, 38.8283595388112)
1330,1721,10005854,MONTGOMERY CITY YOUTH CAMP,300 NIEDERGERKE DRIVE,MONTGOMERY CITY,MO,63361,NOT AVAILABLE,(573) 564-5262,STATE,OPEN,17,MONTGOMERY,29139,USA,922140,CORRECTIONAL INSTITUTIONS,https://dss.mo.gov/reports/prison-rape-elimination-act-reports/prea-audit-full-compliance-reports/,2/15/17,IMAGERY/OTHER,2017-12-08T00:00:00.000Z,NOT AVAILABLE,JUVENILE,36,0.006628156,2.49E-06,39676.80859,841.4983399,29,139,970200,29139970200,9702,Census Tract 9702,G5020,S,231045129,1695506,39.0079397,-91.5157703,MO,c(-91.4963862480305, 38.9589740751341)
1331,1722,10005713,LINCOLN PINES YOUTH CENTER,200 BLACK JACK PERSHING RD,CAPITAN,NM,88316,NOT AVAILABLE,NOT AVAILABLE,STATE,CLOSED,0,LINCOLN,35027,USA,922140,CORRECTIONAL INSTITUTIONS,https://cyfd.org/about-cyfd/publications-reports,12/18/17,IMAGERY,2017-12-18T00:00:00.000Z,NOT AVAILABLE,JUVENILE,24,0.006706842,3.28E-06,48761.14844,813.252551,35,27,960300,35027960300,9603,Census Tract 9603,G5020,S,3866600573,300319,33.7095505,-105.239397,NM,c(-105.541839672261, 33.4851406125586)
1332,1723,10006560,DATEMA HOUSE,918 SOUTH JEFFERSON,SPRINGFIELD,MO,65806,NOT AVAILABLE,(417) 895-6830,STATE,OPEN,11,GREENE,29077,USA,922140,CORRECTIONAL INSTITUTIONS,https://dss.mo.gov/reports/prison-rape-elimination-act-reports/prea-audit-full-compliance-reports/,4/17/17,IMAGERY,2017-12-07T00:00:00.000Z,NOT AVAILABLE,JUVENILE,12,0.001364292,9.64E-08,1499.457031,163.2367664,29,77,200,29077000200,2,Census Tract 2,G5020,S,997356,0,37.2004083,-93.2830719,MO,c(-93.2897261526161, 37.197910039476)
1333,1724,10002379,BEAUMONT JUVENILE CORRECTIONAL CENTER,3500 BEAUMONT RD,BEAUMONT,VA,23014,NOT AVAILABLE,(804) 556-3316,STATE,CLOSED,0,POWHATAN,51145,USA,922140,CORRECTIONAL INSTITUTIONS,http://www.richmond.com/news/local/central-virginia/powhatan/powhatan-today/beaumont-correctional-in-powhatan-county-closes-its-doors/article_235360fa-57bb-11e7-aabe-27b0eec0a0bb.html,6/22/17,IMAGERY,2018-01-22T00:00:00.000Z,http://www.djj.virginia.gov/ResidentialPages/Beaumont.aspx#beaumontvisitation,JUVENILE,284,0.026083778,1.19E-05,185720.4688,3231.730661,51,145,500300,51145500300,5003,Census Tract 5003,G5020,S,33482296,200018,37.6621939,-77.9403515,VA,c(-77.9102509124847, 37.6650763955583)
1334,1725,10002173,"ORANGE COUNTY JAIL, WHITCOMB FACILITY",3855 S JOHN YOUNG PKWY,ORLANDO,FL,32839,NOT AVAILABLE,(407) 836-3400,COUNTY,OPEN,-999,ORANGE,12095,USA,922140,CORRECTIONAL INSTITUTIONS,http://www.orangecountyfl.net/JailInmateServices.aspx#.Wo3LVvnwbmG,2/21/18,IMAGERY,2018-02-21T00:00:00.000Z,http://www.orangecountyfl.net/JailInmateServices.aspx#.Wo3LVvnwbmG,NOT AVAILABLE,224,0.00265715,4.26E-07,6011.044922,312.4853811,12,95,14503,12095014503,145.03,Census Tract 145.03,G5020,S,1654519,364870,28.5020716,-81.4102035,FL,c(-81.4166998508643, 28.5045225704076)
1335,1726,10006561,GIRARDOT CENTER FOR YOUTH AND FAMILIES,609 NORTH MIDDLE STREET,CAPE GIRARDEAU,MO,63701,NOT AVAILABLE,(573) 290-5680,STATE,OPEN,23,CAPE GIRARDEAU,29031,USA,922140,CORRECTIONAL INSTITUTIONS,https://dss.mo.gov/reports/prison-rape-elimination-act-reports/prea-audit-full-compliance-reports/,10/27/16,IMAGERY/OTHER,2017-12-08T00:00:00.000Z,NOT AVAILABLE,JUVENILE,24,0.003580107,4.27E-07,6646.867188,451.5928485,29,31,880900,29031880900,8809,Census Tract 8809,G5020,S,3070727,814377,37.320625,-89.5113124,MO,c(-89.5234770358319, 37.3124247484484)
1336,1727,10004044,RIVERBEND TREATMENT CENTER,5910 MITCHELL AVE,SAINT JOSEPH,MO,64507,NOT AVAILABLE,(816) 387-2917,STATE,OPEN,30,BUCHANAN,29021,USA,922140,CORRECTIONAL INSTITUTIONS,"https://dss.mo.gov/reports/prison-rape-elimination-act-reports/prea-audit-full-compliance-reports/, https://dss.mo.gov/re/dysar.htm",6/30/16,IMAGERY,2017-12-08T00:00:00.000Z,NOT AVAILABLE,JUVENILE,30,0.006558439,2.25E-06,36230.70313,804.056543,29,21,2700,29021002700,27,Census Tract 27,G5020,S,350739494,4510296,39.6898354,-94.6730597,MO,c(-94.752122422389, 39.7544048860791)
1337,1728,10003783,NM YOUTH DIAGNOSTIC DEVELOPMENT CENTER,4000 EDITH NE,ALBUQUERQUE,NM,87197,NOT AVAILABLE,(505) 841-2400,STATE,OPEN,76,BERNALILLO,35001,USA,922140,CORRECTIONAL INSTITUTIONS,https://cyfd.org/about-cyfd/publications-reports,12/18/17,IMAGERY,2017-12-18T00:00:00.000Z,http://www.nmjustice.net/nmsc/juvenile/program.php?id=6207,JUVENILE,108,0.013697337,5.77E-06,87452.01172,1691.07177,35,1,3400,35001003400,34,Census Tract 34,G5020,S,8255142,61240,35.1219385,-106.6185228,NM,c(-106.631485526627, 35.1197807865438)
1338,1729,10006562,MT. VERNON TREATMENT CENTER,500 STATE DRIVE,MT. VERNON,MO,65712,NOT AVAILABLE,(417) 466-0292,STATE,OPEN,31,LAWRENCE,29109,USA,922140,CORRECTIONAL INSTITUTIONS,https://dss.mo.gov/reports/prison-rape-elimination-act-reports/prea-audit-full-compliance-reports/,5/4/17,IMAGERY,2017-12-08T00:00:00.000Z,NOT AVAILABLE,JUVENILE,36,0.006236678,2.04E-06,31729.38672,788.6964213,29,109,470200,29109470200,4702,Census Tract 4702,G5020,S,233873609,456481,37.1111335,-93.7913144,MO,c(-93.8355043216729, 37.1112754343248)
1339,1730,10001621,ROSA PARKS CENTER,211 W 12TH ST,FULTON,MO,65251,NOT AVAILABLE,(573) 592-7227,STATE,OPEN,12,CALLAWAY,29027,USA,922140,CORRECTIONAL INSTITUTIONS,https://dss.mo.gov/reports/prison-rape-elimination-act-reports/prea-audit-full-compliance-reports/,2/13/17,IMAGERY,2017-12-08T00:00:00.000Z,NOT AVAILABLE,JUVENILE,12,0.000712841,2.75E-08,437.5390625,86.49729364,29,27,70400,29027070400,704,Census Tract 704,G5020,S,20297487,298035,38.8478672,-91.9631391,MO,c(-91.9508239421911, 38.8581961394627)
1340,1731,10005848,NORTHWEST REGIONAL YOUTH CENTER,4901 NORTHEAST BARRY ROAD,KANSAS CITY,MO,64156,1279,(816) 437-3656,STATE,OPEN,28,CLAY,29047,USA,922140,CORRECTIONAL INSTITUTIONS,"https://dss.mo.gov/reports/prison-rape-elimination-act-reports/prea-audit-full-compliance-reports/, https://dss.mo.gov/re/dysar.htm",6/30/16,IMAGERY,2017-12-08T00:00:00.000Z,NOT AVAILABLE,JUVENILE,30,0.006617723,1.77E-06,28383.01953,797.3417099,29,47,21205,29047021205,212.05,Census Tract 212.05,G5020,S,13980823,15983,39.2560738,-94.5425055,MO,c(-94.5221812208341, 39.2449416978304)
1341,1732,10000462,ORANGE COUNTY WORK RELEASE CENTER,130 W KALEY ST,ORLANDO,FL,32806,NOT AVAILABLE,(407) 836-3400,COUNTY,OPEN,46,ORANGE,12095,USA,922140,CORRECTIONAL INSTITUTIONS,"http://www.dc.state.fl.us/pub/jails/, http://www.orangecountyfl.net/JailInmateServices.aspx#.Wo3LVvnwbmG",2/21/18,IMAGERY,2018-02-21T00:00:00.000Z,http://www.orangecountyfl.net/JailInmateServices.aspx#.Wo3LVvnwbmG,MINIMUM,308,0.003070602,5.69E-07,8020.607422,364.9274777,12,95,18500,12095018500,185,Census Tract 185,G5020,S,3968937,55785,28.5224061,-81.3877536,FL,c(-81.3802234853854, 28.5194366788997)
1342,1733,10003284,CHESTERFIELD WOMEN'S DETENTION AND DIVERSION CENTER,7000 COURTHOUSE RD,CHESTERFIELD,VA,23832,NOT AVAILABLE,(804) 796-4242,STATE,OPEN,84,CHESTERFIELD,51041,USA,922140,CORRECTIONAL INSTITUTIONS,https://vadoc.virginia.gov/about/facts/,12/3/14,IMAGERY,2018-01-22T00:00:00.000Z,https://vadoc.virginia.gov/community/community-facilities.shtm,MINIMUM,160,0.003550016,6.15E-07,9596.867188,442.5094882,51,41,100821,51041100821,1008.21,Census Tract 1008.21,G5020,S,63932814,1294683,37.3647362,-77.5685609,VA,c(-77.5585293618552, 37.401065107003)
1343,1734,10004070,WENDELL E SEARS YOUTH CENTER,9400 SEARS LN,POPLAR BLUFF,MO,63901,NOT AVAILABLE,(573) 840-9280,STATE,OPEN,53,BUTLER,29023,USA,922140,CORRECTIONAL INSTITUTIONS,https://dss.mo.gov/reports/prison-rape-elimination-act-reports/prea-audit-full-compliance-reports/,10/25/16,IMAGERY,2017-12-08T00:00:00.000Z,NOT AVAILABLE,JUVENILE,60,0.007475885,2.61E-06,40419.03125,886.7738638,29,23,950201,29023950201,9502.01,Census Tract 9502.01,G5020,S,274223997,995155,36.841074,-90.5647154,MO,c(-90.5116099876615, 36.8609461222174)
1344,1735,10003256,COLD SPRINGS DETENTION AND DIVERSION CENTER,192 SPITLER CIRCLE,GREENVILLE,VA,24440,NOT AVAILABLE,(540) 569-3702,STATE,OPEN,112,AUGUSTA,51015,USA,922140,CORRECTIONAL INSTITUTIONS,https://vadoc.virginia.gov/about/facts/,1/22/18,IMAGERY,2018-01-22T00:00:00.000Z,https://vadoc.virginia.gov/community/community-facilities.shtm,MINIMUM,-999,0.004230681,1.12E-06,17573.53906,536.1930102,51,15,71000,51015071000,710,Census Tract 710,G5020,S,354893778,553264,38.0057096,-79.1963657,VA,c(-79.1501149748945, 37.9919075228841)
1345,1736,10006867,EDWARDS COUNTY DETENTION CENTER,404 WEST AUSTIN ST,ROCKSPRINGS,TX,78880,NOT AVAILABLE,(830) 683-4104,COUNTY,OPEN,7,EDWARDS,48137,USA,922140,CORRECTIONAL INSTITUTIONS,"http://www.edwardscountysheriff.org/, https://www.tcjs.state.tx.us/index.php?linkID=325",3/1/18,IMAGERY,2018-04-26T00:00:00.000Z,http://www.edwardscountysheriff.org/,NOT AVAILABLE,25,0.00109632,6.04E-08,864.1015625,131.4282066,48,137,950300,48137950300,9503,Census Tract 9503,G5020,S,5485259735,5199798,29.9858774,-100.3073732,TX,c(-100.210900370495, 30.0173163352106)
1346,1737,10004932,FLOYD COUNTY JAIL,311 HAUSS SQUARE,NEW ALBANY,IN,47150,NOT AVAILABLE,(812) 948-5404,COUNTY,OPEN,-999,FLOYD,18043,USA,922140,CORRECTIONAL INSTITUTIONS,https://www.fcsdin.org/,3/5/18,IMAGERY,2018-03-05T00:00:00.000Z,https://www.fcsdin.org/,NOT AVAILABLE,234,0.004224632,6.90E-07,10893.25391,535.9222186,18,43,70500,18043070500,705,Census Tract 705,G5020,S,3003299,9015,38.2888875,-85.8250394,IN,c(-85.8253971894313, 38.2845324787217)
1347,1738,10003247,HARRISONBURG DETENTION AND DIVERSION CENTER,6624 BEARD WOODS LANE,HARRISONBURG,VA,22802,NOT AVAILABLE,(540) 833-2011,STATE,OPEN,115,ROCKINGHAM,51165,USA,922140,CORRECTIONAL INSTITUTIONS,https://vadoc.virginia.gov/about/facts/,4/6/16,IMAGERY,2018-01-22T00:00:00.000Z,https://vadoc.virginia.gov/community/community-facilities.shtm,MINIMUM,124,0.00656089,1.79E-06,28306.96484,819.2202141,51,165,10600,51165010600,106,Census Tract 106,G5020,S,91077605,234708,38.5164322,-78.8525662,VA,c(-78.816557865761, 38.5318659734177)
1348,1739,10006563,SIERRA OSAGE TREATMENT CENTER,9200 SEARS LANE,POPLAR BLUFF,MO,63901,NOT AVAILABLE,(573) 840-9717,STATE,OPEN,20,BUTLER,29023,USA,922140,CORRECTIONAL INSTITUTIONS,https://dss.mo.gov/reports/prison-rape-elimination-act-reports/prea-audit-full-compliance-reports/,10/26/16,IMAGERY,2017-12-08T00:00:00.000Z,NOT AVAILABLE,JUVENILE,24,0.005327237,1.14E-06,17726.16016,678.8027138,29,23,950201,29023950201,9502.01,Census Tract 9502.01,G5020,S,274223997,995155,36.841074,-90.5647154,MO,c(-90.5094546595805, 36.8598284186703)
1349,1740,10005864,MISSOURI HILLS CAMPUS - SPANISH LAKE,13312 BELLEFONTAINE ROAD,SAINT LOUIS,MO,63138,NOT AVAILABLE,(314) 355-2642,STATE,OPEN,24,ST. LOUIS,29189,USA,922140,CORRECTIONAL INSTITUTIONS,"https://dss.mo.gov/reports/prison-rape-elimination-act-reports/prea-audit-full-compliance-reports/, https://dss.mo.gov/re/dysar.htm",6/30/16,IMAGERY/OTHER,2017-12-08T00:00:00.000Z,NOT AVAILABLE,JUVENILE,20,0.000811474,3.89E-08,618.4570313,101.4537401,29,189,210100,29189210100,2101,Census Tract 2101,G5020,S,39086010,4961325,38.8034745,-90.1576849,MO,c(-90.2124619532338, 38.826250713477)
1350,1741,10005865,MISSOURI HILLS CAMPUS - TWIN RIVERS,13290 BELLEFONTAINE ROAD,SAINT LOUIS,MO,63138,NOT AVAILABLE,(314) 355-4189,STATE,OPEN,19,ST. LOUIS,29189,USA,922140,CORRECTIONAL INSTITUTIONS,"https://dss.mo.gov/reports/prison-rape-elimination-act-reports/prea-audit-full-compliance-reports/, https://dss.mo.gov/re/dysar.htm",6/30/16,IMAGERY/OTHER,2017-12-08T00:00:00.000Z,NOT AVAILABLE,JUVENILE,20,0.000755708,3.53E-08,560.9335938,97.35464315,29,189,210100,29189210100,2101,Census Tract 2101,G5020,S,39086010,4961325,38.8034745,-90.1576849,MO,c(-90.2117734508508, 38.8256486959552)
1351,1742,10004050,WAVERLY REGIONAL YOUTH CENTER,109 W KELLING AVE,WAVERLY,MO,64096,NOT AVAILABLE,(660) 493-2272,STATE,OPEN,46,LAFAYETTE,29107,USA,922140,CORRECTIONAL INSTITUTIONS,"https://dss.mo.gov/reports/prison-rape-elimination-act-reports/prea-audit-full-compliance-reports/, https://dss.mo.gov/re/dysar.htm",6/30/16,IMAGERY,2017-12-08T00:00:00.000Z,NOT AVAILABLE,JUVENILE,40,0.003264075,5.20E-07,8318.636719,395.3743932,29,107,90300,29107090300,903,Census Tract 903,G5020,S,237067879,6315854,39.1751392,-93.5886403,MO,c(-93.5192172900826, 39.21017669451)
1352,1743,10005887,COMMUNITY LEARNING CENTER,3990 WEST SUNSHINE STREET,SPRINGFIELD,MO,65807,NOT AVAILABLE,(417) 888-4055,STATE,OPEN,10,GREENE,29077,USA,922140,CORRECTIONAL INSTITUTIONS,https://dss.mo.gov/reports/prison-rape-elimination-act-reports/prea-audit-full-compliance-reports/,5/5/17,IMAGERY,2017-12-08T00:00:00.000Z,NOT AVAILABLE,JUVENILE,12,0.00119533,7.79E-08,1212.296875,145.6883304,29,77,4201,29077004201,42.01,Census Tract 42.01,G5020,S,8337985,2096,37.168673,-93.3615114,MO,c(-93.3610177401463, 37.1792745598982)
1353,1744,10002172,BOOKING / RELEASE CENTER,3855 SOUTH JOHN YOUNG PARKWAY,ORLANDO,FL,32839,NOT AVAILABLE,(407) 836-3400,COUNTY,OPEN,590,ORANGE,12095,USA,922140,CORRECTIONAL INSTITUTIONS,http://www.orangecountyfl.net/JailInmateServices.aspx#.Wo3LVvnwbmG,2/21/18,IMAGERY,2018-02-21T00:00:00.000Z,http://www.orangecountyfl.net/JailInmateServices.aspx#.Wo3LVvnwbmG,MAXIMUM,592,0.003516687,7.43E-07,10470.55078,414.6624314,12,95,14503,12095014503,145.03,Census Tract 145.03,G5020,S,1654519,364870,28.5020716,-81.4102035,FL,c(-81.4164113276596, 28.5038352875391)
1354,1745,10004609,OSCEOLA COUNTY CORRECTIONAL FACILITY,402 SIMPSON RD,KISSIMMEE,FL,34744,NOT AVAILABLE,(407) 742-4444,COUNTY,OPEN,781,OSCEOLA,12097,USA,922140,CORRECTIONAL INSTITUTIONS,http://www.osceola.org/agencies-departments/corrections/index.stml,8/10/17,IMAGERY,2018-02-21T00:00:00.000Z,http://www.osceola.org/agencies-departments/corrections/index.stml,MAXIMUM,873,0.008259046,3.64E-06,51293.68555,974.3933511,12,97,42900,12097042900,429,Census Tract 429,G5020,S,25455312,11324519,28.2874147,-81.3302518,FL,c(-81.3525165378466, 28.2957356971099)
1355,1746,10003253,STAFFORD DETENTION AND DIVERSION CENTER,384 ESKIMO HILL RD,STAFFORD,VA,22554,NOT AVAILABLE,(540) 659-2093,STATE,OPEN,109,STAFFORD,51179,USA,922140,CORRECTIONAL INSTITUTIONS,https://vadoc.virginia.gov/about/facts/,6/20/17,IMAGERY,2018-01-22T00:00:00.000Z,https://vadoc.virginia.gov/community/community-facilities.shtm,MINIMUM,116,0.006055298,1.47E-06,23226.35938,749.9419129,51,179,10106,51179010106,101.06,Census Tract 101.06,G5020,S,61293479,7427236,38.3790248,-77.3640763,VA,c(-77.4203426211139, 38.3802168048697)
1356,1747,10003829,KENT COUNTY JUVENILE DETENTION CENTER,1501 CEDAR ST NE,GRAND RAPIDS,MI,49503,1390,(616) 632-5750,COUNTY,OPEN,51,KENT,26081,USA,922140,CORRECTIONAL INSTITUTIONS,https://www.accesskent.com/Courts/JuvenileDetention/,3/21/18,IMAGERY,2018-03-21T00:00:00.000Z,https://www.accesskent.com/Courts/JuvenileDetention/,JUVENILE,69,0.00668939,1.32E-06,22349.95703,867.7134035,26,81,1101,26081001101,11.01,Census Tract 11.01,G5020,S,3922246,3962,42.9870456,-85.6306662,MI,c(-85.6326206313421, 42.9819812132127)
1357,1748,10006138,FOUNTAIN COUNTY JAIL,216 UNION STREET,COVINGTON,IN,47932,NOT AVAILABLE,(765) 793-3545,COUNTY,OPEN,-999,FOUNTAIN,18045,USA,922140,CORRECTIONAL INSTITUTIONS,http://www.indianasheriffs.org/county-sheriff-map.aspx,3/5/18,IMAGERY,2018-03-05T00:00:00.000Z,NOT AVAILABLE,NOT AVAILABLE,-999,0.00166754,1.56E-07,2522.222656,205.2409478,18,45,957800,18045957800,9578,Census Tract 9578,G5020,S,122811639,1633697,40.1582526,-87.3507488,IN,c(-87.3977561646277, 40.1351978280467)
1358,1749,10001363,LAPEER COUNTY JAIL,3231 JOHN CONLEY DR,LAPEER,MI,48446,NOT AVAILABLE,(810) 664-1801,COUNTY,OPEN,-999,LAPEER,26087,USA,922140,CORRECTIONAL INSTITUTIONS,http://lapeercountyweb.org/LapNew/index.php/departments/lapeer-county-sheriff,3/21/18,IMAGERY,2018-03-21T00:00:00.000Z,http://lapeercountyweb.org/LapNew/index.php/departments/lapeer-county-sheriff,NOT AVAILABLE,123,0.003124624,4.25E-07,7200.375,412.2346323,26,87,336500,26087336500,3365,Census Tract 3365,G5020,S,309085,0,43.034784,-83.3490585,MI,c(-83.352370592191, 43.03361448663)
1359,1750,10003007,SPRING MOUNTAIN YOUTH CAMP,2400 ANGEL PEAK PL,LAS VEGAS,NV,89124,NOT AVAILABLE,(702) 455-5555,COUNTY,OPEN,-999,CLARK,32003,USA,922140,CORRECTIONAL INSTITUTIONS,http://www.clarkcountynv.gov/jjs/services/Pages/default.aspx,4/9/18,IMAGERY,2018-04-09T00:00:00.000Z,http://www.clarkcountynv.gov/jjs/services/Pages/default.aspx,JUVENILE,100,0.008642389,2.97E-06,45745.64453,1020.114436,32,3,7500,32003007500,75,Census Tract 75,G5020,S,1769004048,15624,36.2560768,-115.6098388,NV,c(-115.584155859692, 36.3186029580643)
1360,1751,10003242,WHITE POST MENS DETENTION CENTER,201 RAY OF HOPE LANE,WHITE POST,VA,22663,NOT AVAILABLE,(540) 868-7026,STATE,CLOSED,0,CLARKE,51043,USA,922140,CORRECTIONAL INSTITUTIONS,http://www.nvdaily.com/news/local-news/2014/10/white-post-mens-diversion-center-to-close/,10/16/14,IMAGERY,2018-01-22T00:00:00.000Z,https://vadoc.virginia.gov/community/community-facilities.shtm,MINIMUM,69,0.007646053,1.70E-06,27127.60938,977.9727798,51,43,10200,51043010200,102,Census Tract 102,G5020,S,161803842,1490423,39.0765553,-78.0625801,VA,c(-78.1376515049449, 39.0532840880875)
1361,1752,10006672,APPALACHIAN DETENTION AND DIVERSION CENTER,924 CLIFTON FARM ROAD,HONAKER,VA,24260,NOT AVAILABLE,(276) 889-7671,STATE,OPEN,53,RUSSELL,51167,USA,922140,CORRECTIONAL INSTITUTIONS,https://vadoc.virginia.gov/about/facts/,6/6/17,IMAGERY,2018-01-22T00:00:00.000Z,https://vadoc.virginia.gov/community/community-facilities.shtm,MINIMUM,106,0.00573095,1.67E-06,25977.02734,706.746424,51,167,30402,51167030402,304.02,Census Tract 304.02,G5020,S,202622155,1945578,36.9579691,-81.8912387,VA,c(-81.9288306486019, 36.9976597395323)
1362,1753,10003332,MECKLENBURG CORRECTIONAL CENTER,960 PRISON RD,BOYDTON,VA,23917,NOT AVAILABLE,NOT AVAILABLE,STATE,CLOSED,0,MECKLENBURG,51117,USA,922140,CORRECTIONAL INSTITUTIONS,"http://www.vadoc.state.va.us/facilities/central/mecklenburg/default.shtm, http://hamptonroads.com/2011/12/correctional-center-near-emporia-close",12/13/11,IMAGERY,2018-01-22T00:00:00.000Z,NOT AVAILABLE,MAXIMUM,-999,0.011219355,8.51E-06,131515.6406,1365.889072,51,117,930600,51117930600,9306,Census Tract 9306,G5020,S,270034063,48384309,36.6354841,-78.3953766,VA,c(-78.3637353336158, 36.6607067895573)
1363,1754,10000922,CULPEPER JUVENILE CORRECTIONAL CENTER,12240 COFFEEWOOD DR,MITCHELLS,VA,22729,NOT AVAILABLE,NOT AVAILABLE,STATE,CLOSED,0,CULPEPER,51047,USA,922140,CORRECTIONAL INSTITUTIONS,http://www.starexponent.com/news/planned-culpeper-women-s-prison-delayed-again/article_4be9a536-f2ff-5e34-bb7a-495e64ff134a.html,7/12/17,IMAGERY,2018-01-22T00:00:00.000Z,NOT AVAILABLE,JUVENILE,250,0.010932109,6.61E-06,104407.4688,1366.662224,51,47,930501,51047930501,9305.01,Census Tract 9305.01,G5020,S,135615386,792586,38.3621033,-78.0684367,VA,c(-78.0262610048324, 38.3616208257044)
1364,1755,10001600,SOUTHAMPTON MEN'S DETENTION CENTER,14380 TERRAPIN DR,CAPRON,VA,23829,NOT AVAILABLE,(434) 658-4174,STATE,CLOSED,0,SOUTHAMPTON,51175,USA,922140,CORRECTIONAL INSTITUTIONS,https://vadoc.virginia.gov/news/press-releases/16Aug9_southamptoncoldsprings.shtm,8/9/16,IMAGERY,2018-01-22T00:00:00.000Z,http://vadoc.virginia.gov/facilities/eastern/southampton/,NOT AVAILABLE,-999,0.006358052,2.42E-06,37359.39063,771.0240643,51,175,200300,51175200300,2003,Census Tract 2003,G5020,S,10719196,84844,36.7371266,-77.2510665,VA,c(-77.2592183816823, 36.7171557043779)
1365,1756,10006564,WILSON CREEK,3992 WEST SUNSHINE,SPRINGFIELD,MO,65807,NOT AVAILABLE,(417) 888-4050,STATE,OPEN,7,GREENE,29077,USA,922140,CORRECTIONAL INSTITUTIONS,"https://dss.mo.gov/reports/prison-rape-elimination-act-reports/prea-audit-full-compliance-reports/, https://dss.mo.gov/re/dysar.htm",6/30/16,IMAGERY,2017-12-08T00:00:00.000Z,NOT AVAILABLE,JUVENILE,10,0.000962291,5.70E-08,886.921875,122.3058827,29,77,4201,29077004201,42.01,Census Tract 42.01,G5020,S,8337985,2096,37.168673,-93.3615114,MO,c(-93.3612706968363, 37.1784044641311)
1366,1757,10004048,NORTHEAST COMMUNITY TREATMENT CENTER,710 S CLARK ST,MEXICO,MO,65265,NOT AVAILABLE,NOT AVAILABLE,STATE,CLOSED,0,AUDRAIN,29007,USA,922140,CORRECTIONAL INSTITUTIONS,"https://dss.mo.gov/re/pdf/dys/youth-services-annual-report-fy13.pdf, https://dss.mo.gov/re/pdf/dys/youth-services-annual-report-fy14.pdf",12/8/17,IMAGERY,2017-12-08T00:00:00.000Z,NOT AVAILABLE,JUVENILE,-999,0.001405338,1.09E-07,1745.511719,171.4106185,29,7,950700,29007950700,9507,Census Tract 9507,G5020,S,29058314,928854,39.1441034,-91.8647962,MO,c(-91.8848571958948, 39.1666080856502)
1367,1758,10000514,PALM BEACH COUNTY CENTRAL DETENTION CENTER,673 FAIRGROUNDS RD,WEST PALM BEACH,FL,33411,NOT AVAILABLE,(561) 992-1580,COUNTY,CLOSED,0,PALM BEACH,12099,USA,922140,CORRECTIONAL INSTITUTIONS,http://www.pbso.org/inside-pbso/corrections/general/,2/21/18,IMAGERY,2018-02-21T00:00:00.000Z,http://www.pbso.org/index.cfm?fa=corrections_IMB&ID=317,MAXIMUM,967,0.011380495,7.47E-06,103627.1914,1363.306583,12,99,7818,12099007818,78.18,Census Tract 78.18,G5020,S,5591854,196372,26.6952972,-80.1962779,FL,c(-80.1935441266637, 26.686166845332)
1368,1759,10003264,NATURAL BRIDGE JUVENILE CORRECTIONAL CENTER,1425 ARNOLDS VALLEY RD,NATURAL BRIDGE STATION,VA,24579,NOT AVAILABLE,NOT AVAILABLE,STATE,CLOSED,0,ROCKBRIDGE,51163,USA,922140,CORRECTIONAL INSTITUTIONS,http://www.roanoke.com/webmin/news/juvenile-detention-center-shuttered/article_3ce1a30a-457b-5ffc-a2a2-8f87baf4980c.html,9/16/09,IMAGERY,2018-01-22T00:00:00.000Z,NOT AVAILABLE,JUVENILE,71,0.008464081,2.83E-06,44294.57422,1036.874971,51,163,930400,51163930400,9304,Census Tract 9304,G5020,S,214328099,2362635,37.6325969,-79.4611352,VA,c(-79.5083438578063, 37.5850973476601)
1369,1760,10003294,TAZEWELL CORRECTIONAL UNIT #31,1245 CLEARFORK RD,TAZEWELL,VA,24651,NOT AVAILABLE,NOT AVAILABLE,STATE,CLOSED,0,TAZEWELL,51185,USA,922140,CORRECTIONAL INSTITUTIONS,https://vadoc.virginia.gov/about/facts/managementInformationSummaries/2009.pdf,6/30/09,IMAGERY,2018-01-22T00:00:00.000Z,NOT AVAILABLE,MINIMUM,-999,0.005330999,9.99E-07,15527.00781,668.3903848,51,185,21100,51185021100,211,Census Tract 211,G5020,S,126653989,175318,37.1729181,-81.3874435,VA,c(-81.3982326457869, 37.1443493749938)
1370,1761,10000520,PALM BEACH COUNTY MAIN DETENTION CENTER,3228 GUN CLUB RD,WEST PALM BEACH,FL,33406,3001,(561) 688-4400,COUNTY,OPEN,1769,PALM BEACH,12099,USA,922140,CORRECTIONAL INSTITUTIONS,http://www.pbso.org/,2/21/18,IMAGERY,2018-02-21T00:00:00.000Z,http://www.pbso.org/,MAXIMUM,2166,0.011198502,4.24E-06,58740.20117,1314.664481,12,99,3800,12099003800,38,Census Tract 38,G5020,S,6337336,379833,26.669807,-80.0944886,FL,c(-80.0923486096156, 26.6707115415766)
1371,1762,10006141,FRANKLIN COUNTY JAIL / SHERIFF,371 MAIN STREET,BROOKVILLE,IN,47012,NOT AVAILABLE,(765) 647-4138,COUNTY,OPEN,-999,FRANKLIN,18047,USA,922140,CORRECTIONAL INSTITUTIONS,http://www.franklincounty.in.gov/countyoffices/sheriff/,3/5/18,IMAGERY,2018-03-05T00:00:00.000Z,http://www.franklincounty.in.gov/countyoffices/sheriff/,NOT AVAILABLE,-999,0.001934372,1.93E-07,3100.667969,233.9362958,18,47,969700,18047969700,9697,Census Tract 9697,G5020,S,17756344,120607,39.4272991,-84.9834891,IN,c(-85.012419659954, 39.4182549288148)
1372,1763,10006565,FULTON STATE HOSPITAL,600 EAST 5TH STREET,FULTON,MO,65251,NOT AVAILABLE,(573) 592-4100,STATE,OPEN,-999,CALLAWAY,29027,USA,922140,CORRECTIONAL INSTITUTIONS,https://dmh.mo.gov/fulton/,12/8/17,IMAGERY,2017-12-08T00:00:00.000Z,https://dmh.mo.gov/fulton/,NOT AVAILABLE,-999,0.015664433,1.38E-05,219937.3867,1947.020644,29,27,70300,29027070300,703,Census Tract 703,G5020,S,31216261,443222,38.8513012,-91.9235718,MO,c(-91.9372467589036, 38.8469599047085)
1373,1764,10005856,BIGGS FORENSIC CENTER,600 EAST 5TH STREET,FULTON,MO,65251,NOT AVAILABLE,(573) 592-4100,STATE,OPEN,-999,CALLAWAY,29027,USA,922140,CORRECTIONAL INSTITUTIONS,https://dmh.mo.gov/fulton/,12/8/17,IMAGERY,2017-12-08T00:00:00.000Z,https://dmh.mo.gov/fulton/,MAXIMUM,186,0.008845689,4.78E-06,76084.08203,1089.269135,29,27,70300,29027070300,703,Census Tract 703,G5020,S,31216261,443222,38.8513012,-91.9235718,MO,c(-91.9324364323105, 38.8456790673995)
1374,1765,10005609,FULTON COUNTY JAIL,815 MADISON ST,ROCHESTER,IN,46975,NOT AVAILABLE,(574) 224-5630,COUNTY,OPEN,133,FULTON,18049,USA,922140,CORRECTIONAL INSTITUTIONS,http://www.co.fulton.in.us/department/division.php?structureid=56,3/5/18,IMAGERY,2018-03-05T00:00:00.000Z,http://www.co.fulton.in.us/department/division.php?structureid=56,NOT AVAILABLE,35,0.001839555,1.94E-07,3186.660156,236.5020539,18,49,953100,18049953100,9531,Census Tract 9531,G5020,S,9461949,17413,41.0581803,-86.2145572,IN,c(-86.2140098768288, 41.0655438664994)
1375,1766,10006610,CAMINO NUEVO YOUTH CENTER,4050 EDITH BLVD,ALBUQUERQUE,NM,87107,NOT AVAILABLE,(505) 383-3829,STATE,OPEN,65,BERNALILLO,35001,USA,922140,CORRECTIONAL INSTITUTIONS,https://cyfd.org/about-cyfd/publications-reports,12/18/17,IMAGERY,2017-12-18T00:00:00.000Z,http://www.nmjustice.net/nmsc/juvenile/program.php?id=5327,JUVENILE,96,0.004548015,1.15E-06,17463.71484,553.5222683,35,1,3400,35001003400,34,Census Tract 34,G5020,S,8255142,61240,35.1219385,-106.6185228,NM,c(-106.629877536643, 35.1181485088525)
1376,1767,10001106,ANTHONY CORRECTIONAL CENTER,313 ANTHONY CENTER DRIVE,WHITE SULPHUR SPRINGS,WV,24986,NOT AVAILABLE,(304) 536-3911,STATE,OPEN,220,GREENBRIER,54025,USA,922140,CORRECTIONAL INSTITUTIONS,"http://www.wvdoc.com/wvdoc/PrisonsandFacilities/tabid/36/Default.aspx, http://www.wvdoc.com/wvdoc/OfficeofResearchPlanning/tabid/70/Default.aspx",1/22/18,IMAGERY,2018-01-22T00:00:00.000Z,http://www.wvdoc.com/wvdoc/PrisonsandFacilities/tabid/36/Default.aspx,MINIMUM,220,0.008378952,3.53E-06,55424.89453,1037.711335,54,25,950100,54025950100,9501,Census Tract 9501,G5020,S,626540245,3722915,37.9468237,-80.1831961,WV,c(-80.1265952224308, 37.9632409867839)
1377,1768,10003178,ALBANY COUNTY CORRECTIONAL FACILITY,840 ALBANY SHAKER RD,ALBANY,NY,12211,NOT AVAILABLE,(518) 869-2600,COUNTY,OPEN,800,ALBANY,36001,USA,922140,CORRECTIONAL INSTITUTIONS,http://www.albanycounty.com/Government/Departments/CountySheriff.aspx,4/9/18,IMAGERY/OTHER,2018-04-09T00:00:00.000Z,http://www.albanycounty.com/Government/Departments/CountySheriff.aspx,NOT AVAILABLE,1043,0.009883916,5.30E-06,89514.53516,1228.330618,36,1,13703,36001013703,137.03,Census Tract 137.03,G5020,S,16133183,120545,42.7453514,-73.8147594,NY,c(-73.816578193508, 42.7516426885158)
1378,1769,10000516,PALM BEACH COUNTY WEST DETENTION CENTER,38811 JAMES WHEELER WAY,BELLE GLADE,FL,33430,NOT AVAILABLE,(561) 992-1580,COUNTY,OPEN,614,PALM BEACH,12099,USA,922140,CORRECTIONAL INSTITUTIONS,http://www.pbso.org/,2/21/18,IMAGERY,2018-02-21T00:00:00.000Z,http://www.pbso.org/,MAXIMUM,998,0.005650907,1.44E-06,20030.05859,673.4855323,12,99,8101,12099008101,81.01,Census Tract 81.01,G5020,S,92915262,0,26.7302019,-80.6509221,FL,c(-80.6652052545599, 26.7244824293956)
1379,1770,10006894,HOMER COMMUNITY JAIL,4060 HEATH ST,HOMER,AK,99603,NOT AVAILABLE,(907) 235-4158,LOCAL,OPEN,-999,KENAI PENINSULA BOROUGH,2122,USA,922140,CORRECTIONAL INSTITUTIONS,https://www.cityofhomer-ak.gov/police,5/11/18,IMAGERY,2018-05-11T00:00:00.000Z,NOT AVAILABLE,NOT AVAILABLE,7,0.001286641,1.01E-07,2471.601563,203.0606137,2,122,1000,2122001000,10,Census Tract 10,G5020,S,25118829,56904033,59.620443,-151.4572638,AK,c(-151.529276335626, 59.6493468401619)
1380,1771,10002776,ELLIS COUNTY JAIL,300 S JACKSON ST,WAXAHACHIE,TX,75165,NOT AVAILABLE,(972) 825-4931,COUNTY,OPEN,463,ELLIS,48139,USA,922140,CORRECTIONAL INSTITUTIONS,http://elliscountysheriff.com/index.php,4/26/18,IMAGERY,2018-04-26T00:00:00.000Z,http://elliscountysheriff.com/index.php,MAXIMUM,856,0.004896755,8.85E-07,12983.92188,593.6989053,48,139,60400,48139060400,604,Census Tract 604,G5020,S,22056589,1259938,32.3607682,-96.8256498,TX,c(-96.847976060248, 32.3834800476874)
1381,1772,10001108,BECKLEY CORRECTIONAL CENTER,111 S EISENHOWER DRIVE,BECKLEY,WV,25801,NOT AVAILABLE,(304) 256-6780,STATE,OPEN,137,RALEIGH,54081,USA,922140,CORRECTIONAL INSTITUTIONS,http://www.wvdoc.com/wvdoc/PrisonsandFacilities/tabid/36/Default.aspx,1/22/18,IMAGERY,2018-01-22T00:00:00.000Z,http://www.wvdoc.com/wvdoc/PrisonsandFacilities/tabid/36/Default.aspx,MINIMUM,137,0.003638742,2.58E-07,4052.25,440.0609463,54,81,400,54081000400,4,Census Tract 4,G5020,S,2937358,1310,37.7866509,-81.173387,WV,c(-81.1653284791696, 37.7850453214811)
1382,1773,10000477,PINELLAS COUNTY JAIL,14400 49TH ST N,CLEARWATER,FL,33762,2877,(727) 464-6415,COUNTY,OPEN,3000,PINELLAS,12103,USA,922140,CORRECTIONAL INSTITUTIONS,https://www.pcsoweb.com/,2/21/18,IMAGERY,2018-02-21T00:00:00.000Z,https://www.pcsoweb.com/,MAXIMUM,4389,0.019941731,8.73E-06,122449.9375,2325.689507,12,103,24510,12103024510,245.1,Census Tract 245.10,G5020,S,2568703,104440,27.9045518,-82.7068218,FL,c(-82.7050968694745, 27.9026644843336)
1383,1774,10004054,GUHLEMAN FORENSIC CENTER,600 EAST 5TH ST,FULTON,MO,65251,NOT AVAILABLE,(573) 592-4100,STATE,OPEN,-999,CALLAWAY,29027,USA,922140,CORRECTIONAL INSTITUTIONS,https://dmh.mo.gov/fulton/,12/8/17,IMAGERY/OTHER,2017-12-08T00:00:00.000Z,https://dmh.mo.gov/fulton/,MEDIUM,91,0.007676177,3.79E-06,60325.26563,940.9278872,29,27,70300,29027070300,703,Census Tract 703,G5020,S,31216261,443222,38.8513012,-91.9235718,MO,c(-91.9327377830073, 38.8429704764302)
1384,1775,10002179,CENTRAL COUNTY JAIL,2390 BOB PHILLIPS RD,BARTOW,FL,33830,NOT AVAILABLE,(863) 534-6123,COUNTY,OPEN,782,POLK,12105,USA,922140,CORRECTIONAL INSTITUTIONS,"http://www.dc.state.fl.us/pub/jails/, http://www.polksheriff.org/InsidePCSO/Detention/Pages/Detention.aspx",2/21/18,IMAGERY,2018-02-21T00:00:00.000Z,http://www.polksheriff.org/InsidePCSO/Detention/Pages/Detention.aspx,MAXIMUM,800,0.009704907,4.61E-06,64584.83984,1157.74698,12,105,15200,12105015200,152,Census Tract 152,G5020,S,9993533,342454,27.8827922,-81.8193579,FL,c(-81.8194719569099, 27.8825395282106)
1385,1776,10001619,HEARNES FORENSIC CENTER,600 EAST 5TH ST,FULTON,MO,65251,NOT AVAILABLE,(573) 592-4100,STATE,OPEN,-999,CALLAWAY,29027,USA,922140,CORRECTIONAL INSTITUTIONS,https://dmh.mo.gov/fulton/,12/8/17,IMAGERY,2017-12-08T00:00:00.000Z,https://dmh.mo.gov/fulton/,NOT AVAILABLE,24,0.007213418,2.69E-06,42730.95703,936.4896733,29,27,70300,29027070300,703,Census Tract 703,G5020,S,31216261,443222,38.8513012,-91.9235718,MO,c(-91.9305734603743, 38.8416756356932)
1386,1777,10003836,MACOMB COUNTY JUVENILE JUSTICE CENTER,400 NORTH ROSE,MOUNT CLEMENS,MI,48043,NOT AVAILABLE,(586) 469-5375,COUNTY,OPEN,87,MACOMB,26099,USA,922140,CORRECTIONAL INSTITUTIONS,http://jjc.macombgov.org/JJC-Home,3/21/18,IMAGERY,2018-03-21T00:00:00.000Z,http://jjc.macombgov.org/JJC-Home,JUVENILE,140,0.008959439,1.96E-06,32943.17969,1133.90176,26,99,245200,26099245200,2452,Census Tract 2452,G5020,S,2042692,3275,42.6068764,-82.8926592,MI,c(-82.8932384770817, 42.6158228100301)
1387,1778,10004931,GIBSON COUNTY JAIL,112 E EMERSON ST,PRINCETON,IN,47670,NOT AVAILABLE,(812) 385-3496,COUNTY,OPEN,140,GIBSON,18051,USA,922140,CORRECTIONAL INSTITUTIONS,http://www.gibsoncountysheriff.com/index.php?page=1,3/5/18,IMAGERY,2018-03-05T00:00:00.000Z,http://www.gibsoncountysheriff.com/index.php?page=1,NOT AVAILABLE,100,0.003155845,4.19E-07,6618.964844,384.437513,18,51,50501,18051050501,505.01,Census Tract 505.01,G5020,S,9235449,125437,38.3486676,-87.5482947,IN,c(-87.566919724029, 38.3575244402186)
1388,1779,10006793,MAURICE SPEAR CAMPUS,1910 AIRPORT ROAD,ADRIAN,MI,49221,NOT AVAILABLE,(517) 265-5171,COUNTY,OPEN,-999,LENAWEE,26091,USA,922140,CORRECTIONAL INSTITUTIONS,https://www.lenawee.mi.us/229/Maurice-Spear-Campus,3/21/18,IMAGERY,2018-03-21T00:00:00.000Z,https://www.lenawee.mi.us/229/Maurice-Spear-Campus,JUVENILE,66,0.008603064,4.51E-06,75130.10547,1147.389742,26,91,61700,26091061700,617,Census Tract 617,G5020,S,82335445,670473,41.8527313,-84.0730603,MI,c(-84.0687763778653, 41.8760454090026)
1389,1780,10005148,MACKINAC COUNTY JAIL,100 SOUTH MARLEY STREET,SAINT IGNACE,MI,49781,NOT AVAILABLE,(906) 643-7325,COUNTY,OPEN,24,MACKINAC,26097,USA,922140,CORRECTIONAL INSTITUTIONS,http://www.michigan.gov/documents/corrections/JPIS_-_CY_2010_344047_7.pdf,3/21/18,IMAGERY/OTHER,2018-03-21T00:00:00.000Z,http://www.mackinaccounty.net/departments/sheriffs-office/,NOT AVAILABLE,28,0.002494216,2.28E-07,4054.003906,351.6634646,26,97,950500,26097950500,9505,Census Tract 9505,G5020,S,99626779,39650680,45.770763,-84.4779593,MI,c(-84.7334379760538, 45.8660380839239)
1390,1781,10001343,MARQUETTE COUNTY JAIL,236 W BARAGA AVE,MARQUETTE,MI,49855,NOT AVAILABLE,NOT AVAILABLE,COUNTY,OPEN,-999,MARQUETTE,26103,USA,922140,CORRECTIONAL INSTITUTIONS,http://www.co.marquette.mi.us/departments/sheriff_s_office/index.php#.WrJtdfnwbmE,3/21/18,UNVERIFIED,2018-03-21T00:00:00.000Z,http://www.co.marquette.mi.us/departments/sheriff_s_office/index.php#.WrJtdfnwbmE,NOT AVAILABLE,80,0.001955608,2.05E-07,3696.953125,280.1185857,26,103,300,26103000300,3,Census Tract 3,G5020,S,1796546,2594021,46.5402528,-87.3914966,MI,c(-87.3978763173478, 46.5418552061268)
1391,1782,10005245,ALLEGANY COUNTY JAIL,4884 STATE ROUTE 19S,BELMONT,NY,14813,9506,NOT AVAILABLE,COUNTY,OPEN,121,ALLEGANY,36003,USA,922140,CORRECTIONAL INSTITUTIONS,http://www.alleganyco.com/departments/sheriffs-office/,4/9/18,IMAGERY,2018-04-09T00:00:00.000Z,http://www.alleganyco.com/departments/sheriffs-office/,NOT AVAILABLE,-999,0.008491339,1.70E-06,28452.56641,1066.00364,36,3,950600,36003950600,9506,Census Tract 9506,G5020,S,155813034,235822,42.2035897,-78.044259,NY,c(-78.016300623236, 42.2130779135135)
1392,1783,10005383,BRIDEWELL DETENTION FACILITY,4203 ROLEKE DRIVE,BETHANY,MO,64424,NOT AVAILABLE,NOT AVAILABLE,STATE,CLOSED,0,HARRISON,29081,USA,922140,CORRECTIONAL INSTITUTIONS,"http://www.desmoinescatholicworker.org/Frankreport3.pdf, http://www.newspressnow.com/news/local_news/article_8a1314d4-add2-5f28-8925-a816fa4f9d5b.html",1/1/13,IMAGERY,2017-12-08T00:00:00.000Z,NOT AVAILABLE,NOT AVAILABLE,240,0.003398753,7.15E-07,11609.27734,431.3613297,29,81,950300,29081950300,9503,Census Tract 9503,G5020,S,18115270,281442,40.2703547,-94.0262133,MO,c(-94.0091589818601, 40.2719714845319)
1393,1784,10001625,CENTRAL MISSOURI CORRECTIONAL CENTER,2600 STATE HWY 179,JEFFERSON CITY,MO,65109,NOT AVAILABLE,NOT AVAILABLE,STATE,CLOSED,0,COLE,29051,USA,922140,CORRECTIONAL INSTITUTIONS,https://www.sos.mo.gov/BlueBook/2011-2012/6_Corr.pdf,1/1/13,IMAGERY,2017-12-08T00:00:00.000Z,NOT AVAILABLE,MAXIMUM,1000,0.013087728,7.01E-06,111209.2031,1607.67065,29,51,20600,29051020600,206,Census Tract 206,G5020,S,165734182,4152848,38.6344528,-92.3634544,MO,c(-92.2783686982984, 38.6400078337772)
1394,1785,10006284,SAIPAN CORRECTIONAL FACILITY,NOT AVAILABLE,SUSUPE,MP,96950,NOT AVAILABLE,(670) 236-9700,STATE,OPEN,-999,NOT AVAILABLE,NOT AVAILABLE,MNP,922140,CORRECTIONAL INSTITUTIONS,https://www.justice.gov/crt/guam-findings-letter,12/8/17,IMAGERY,2017-12-08T00:00:00.000Z,http://www.doc.gov.mp/,NOT AVAILABLE,64,0.003409545,6.79E-07,8723.861328,385.7419747,69,110,800,69110000800,8,Census Tract 8,G5020,S,1844665,185857,15.1548769,145.708529,MP,c(145.707343970345, 15.1576899969308)
1395,1786,10004248,CENTRAL MISSISSIPPI CORRECTIONAL FACILITY,3794 STATE HWY 468,PEARL,MS,39208,NOT AVAILABLE,(601) 932-2880,STATE,OPEN,3484,RANKIN,28121,USA,922140,CORRECTIONAL INSTITUTIONS,http://www.mdoc.ms.gov/Admin-Finance/Pages/Monthly-Facts.aspx,12/4/17,IMAGERY,2017-12-08T00:00:00.000Z,http://www.mdoc.ms.gov/Pages/Facility-Locations.aspx,MAXIMUM,3750,0.03743,4.32E-05,632376.3086,4455.114028,28,121,20500,28121020500,205,Census Tract 205,G5020,S,13991499,860,32.2314015,-90.0823643,MS,c(-90.0589954765916, 32.2277132022424)
1396,1787,10001807,MISSISSIPPI STATE PENITENTIARY,US HWY 49 W,PARCHMAN,MS,38738,NOT AVAILABLE,(662) 745-6611,STATE,OPEN,3289,SUNFLOWER,28133,USA,922140,CORRECTIONAL INSTITUTIONS,http://www.mdoc.ms.gov/Admin-Finance/Pages/Monthly-Facts.aspx,12/4/17,IMAGERY,2017-12-08T00:00:00.000Z,http://www.mdoc.ms.gov/Pages/Facility-Locations.aspx,MAXIMUM,3590,0.107479158,0.000402279,6007875.461,13149.71888,28,133,950100,28133950100,9501,Census Tract 9501,G5020,S,473509512,1439657,33.8807374,-90.5523808,MS,c(-90.5455116883473, 33.9265661032126)
1397,1788,10005615,GRANT COUNTY JAIL,214 EAST 4TH ST,MARION,IN,46952,NOT AVAILABLE,(765) 668-6583,COUNTY,OPEN,281,GRANT,18053,USA,922140,CORRECTIONAL INSTITUTIONS,http://sheriff.grantcounty27.us/,3/5/18,IMAGERY,2018-03-05T00:00:00.000Z,http://sheriff.grantcounty27.us/,NOT AVAILABLE,-999,0.001818443,1.71E-07,2785.925781,229.6924911,18,53,100,18053000100,1,Census Tract 1,G5020,S,3217164,0,40.5582045,-85.6624695,IN,c(-85.6577681999302, 40.5575398030614)
1398,1789,10006673,CHARLESTON CORRECTIONAL CENTER,1356 HANSFORD STREET,CHARLESTON,WV,25301,NOT AVAILABLE,(304) 340-6921,STATE,OPEN,-999,KANAWHA,54039,USA,922140,CORRECTIONAL INSTITUTIONS,http://www.wvdoc.com/wvdoc/OfficeofResearchPlanning/tabid/70/Default.aspx,1/22/18,IMAGERY/OTHER,2018-01-22T00:00:00.000Z,http://www.wvdoc.com/wvdoc/OfficeofResearchPlanning/tabid/70/Default.aspx,MINIMUM,128,0.003369909,5.97E-07,9437.15625,421.6920911,54,39,1200,54039001200,12,Census Tract 12,G5020,S,867755,0,38.3456835,-81.6200424,WV,c(-81.6191454590805, 38.3478214120252)
1399,1790,10003190,BROOME COUNTY CORRECTIONAL FACILITY,155 LT. VANWINKLE DRIVE,BINGHAMTON,NY,13905,NOT AVAILABLE,NOT AVAILABLE,COUNTY,OPEN,505,BROOME,36007,USA,922140,CORRECTIONAL INSTITUTIONS,"https://data.ny.gov/Public-Safety/Jail-Population-By-County-Beginning-1997/nymx-kgkn/data, http://www.gobroomecounty.com/sheriff",4/9/18,IMAGERY,2018-04-09T00:00:00.000Z,http://www.gobroomecounty.com/sheriff,MAXIMUM,536,0.010051958,3.31E-06,55265.97266,1339.191303,36,7,12800,36007012800,128,Census Tract 128,G5020,S,12342855,259439,42.1305335,-75.9181575,NY,c(-75.9167917295249, 42.1314698211536)
1400,1791,10006611,JOHN PAUL TAYLOR CENTER,10015 ROBERT LARSON BLVD,LAS CRUCES,NM,88007,NOT AVAILABLE,(575) 827-7629,STATE,OPEN,46,DONA ANA,35013,USA,922140,CORRECTIONAL INSTITUTIONS,https://cyfd.org/about-cyfd/publications-reports,12/18/17,IMAGERY,2017-12-18T00:00:00.000Z,http://www.nmjustice.net/nmsc/juvenile/program.php?id=5243,JUVENILE,48,0.005690773,2.04E-06,29868.71875,693.8316591,35,13,1500,35013001500,15,Census Tract 15,G5020,S,1586024543,733685,32.3444876,-107.0502871,NM,c(-106.940605750113, 32.2675195840898)
1401,1792,10000431,PUTNAM COUNTY JAIL,130 ORIE GRIFFIN BLVD,PALATKA,FL,32177,NOT AVAILABLE,(386) 329-0854,COUNTY,OPEN,312,PUTNAM,12107,USA,922140,CORRECTIONAL INSTITUTIONS,http://www.dc.state.fl.us/pub/jails/,2/21/18,IMAGERY,2018-02-21T00:00:00.000Z,http://putnamsheriff.org/en/home/,MAXIMUM,-999,0.006501408,1.59E-06,22635.96289,774.6784656,12,107,950600,12107950600,9506,Census Tract 9506,G5020,S,40695289,1478482,29.6455851,-81.6924491,FL,c(-81.6623670672099, 29.6686271041906)
1402,1793,10000028,DENMAR CORRECTIONAL CENTER,4319 DENMAR ROAD,HILLSBORO,WV,24946,NOT AVAILABLE,(304) 653-4201,STATE,OPEN,232,POCAHONTAS,54075,USA,922140,CORRECTIONAL INSTITUTIONS,http://www.wvdoc.com/wvdoc/OfficeofResearchPlanning/tabid/70/Default.aspx,1/22/18,IMAGERY,2018-01-22T00:00:00.000Z,http://www.wvdoc.com/wvdoc/PrisonsandFacilities/tabid/36/Default.aspx,MEDIUM,216,0.009435804,3.24E-06,50981.27734,1159.818939,54,75,960300,54075960300,9603,Census Tract 9603,G5020,S,641751299,2100988,38.1889625,-80.2060484,WV,c(-80.2205037682501, 38.0856056974197)
1403,1794,10000476,SOUTH COUNTY JAIL,1103 US HWY 98 W,FROSTPROOF,FL,33843,NOT AVAILABLE,(863) 635-6920,COUNTY,OPEN,1783,POLK,12105,USA,922140,CORRECTIONAL INSTITUTIONS,"http://www.dc.state.fl.us/pub/jails/, http://www.polksheriff.org/InsidePCSO/Detention/Pages/Detention.aspx",2/21/18,IMAGERY,2018-02-21T00:00:00.000Z,http://www.polksheriff.org/InsidePCSO/Detention/Pages/Detention.aspx,MAXIMUM,1776,0.009964123,6.18E-06,86491.63477,1165.147105,12,105,15802,12105015802,158.02,Census Tract 158.02,G5020,S,143065765,1882487,27.697419,-81.6272222,FL,c(-81.5935116931081, 27.7310985701241)
1404,1795,10002186,ST. LUCIE COUNTY JAIL,900 N ROCK RD,FORT PIERCE,FL,34945,NOT AVAILABLE,(772) 462-3450,COUNTY,OPEN,1256,ST. LUCIE,12111,USA,922140,CORRECTIONAL INSTITUTIONS,http://www.dc.state.fl.us/pub/jails/,2/21/18,IMAGERY,2018-02-21T00:00:00.000Z,https://www.stluciesheriff.com/,MAXIMUM,-999,0.010102733,5.99E-06,83646.67578,1185.005978,12,111,380800,12111380800,3808,Census Tract 3808,G5020,S,30249928,114865,27.4530032,-80.4034731,FL,c(-80.4101211529673, 27.4533842590538)
1405,1796,10005614,GRANT COUNTY JUVENILE DETENTION CENTER,501 SOUTH ADAMS ST,MARION,IN,46952,NOT AVAILABLE,(765) 662-9864,COUNTY,OPEN,18,GRANT,18053,USA,922140,CORRECTIONAL INSTITUTIONS,http://www.in.gov/idoc/dys/2481.htm,3/5/18,IMAGERY,2018-03-05T00:00:00.000Z,NOT AVAILABLE,JUVENILE,46,0.0031884,4.30E-07,7015.761719,403.9490191,18,53,100,18053000100,1,Census Tract 1,G5020,S,3217164,0,40.5582045,-85.6624695,IN,c(-85.6580321617628, 40.5564521042684)
1406,1797,10005627,GREENE COUNTY JAIL,204 COUNTY ROAD 70 EAST,BLOOMFIELD,IN,47424,NOT AVAILABLE,(812) 384-4411,COUNTY,OPEN,-999,GREENE,18055,USA,922140,CORRECTIONAL INSTITUTIONS,http://www.co.greene.in.us/department/index.php?structureid=16,3/5/18,IMAGERY,2018-03-05T00:00:00.000Z,http://www.co.greene.in.us/department/index.php?structureid=16,NOT AVAILABLE,-999,0.002285479,2.88E-07,4596.734375,289.5430962,18,55,955400,18055955400,9554,Census Tract 9554,G5020,S,29902053,253197,39.0319299,-86.9324003,IN,c(-86.9283454023411, 39.0244832097769)
1407,1798,10002805,EL PASO COUNTY DETENTION FACILITY,601 E OVERLAND AVE,EL PASO,TX,79901,NOT AVAILABLE,NOT AVAILABLE,COUNTY,OPEN,836,EL PASO,48141,USA,922140,CORRECTIONAL INSTITUTIONS,"http://epcounty.com/sheriff/reports/2015%20EPCSO%20Annual%20Report.pdf, http://epcounty.com/sheriff/default.asp",4/26/18,IMAGERY,2018-04-26T00:00:00.000Z,http://epcounty.com/sheriff/default.asp,MAXIMUM,1000,0.002153111,2.54E-07,3703.816406,253.6221164,48,141,1700,48141001700,17,Census Tract 17,G5020,S,1127843,0,31.7595497,-106.4874258,TX,c(-106.482992907306, 31.7585293218526)
1408,1799,10006612,NEW MEXICO BEHAVIORAL HEALTH INSTITUTE - FORENSIC DIVISION,3695 HOT SPRINGS BLVD,LAS VEGAS,NM,87701,NOT AVAILABLE,(505) 454-2100,STATE,OPEN,-999,SAN MIGUEL,35047,USA,922140,CORRECTIONAL INSTITUTIONS,https://nmhealth.org/about/ofm/ltcf/nmbhi/#overview,12/18/17,IMAGERY,2017-12-18T00:00:00.000Z,https://nmhealth.org/about/ofm/ltcf/nmbhi/#overview,MAXIMUM,80,0.003990296,9.26E-07,14110.69922,497.1981112,35,47,957800,35047957800,9578,Census Tract 9578,G5020,S,12800686,6746,35.6218692,-105.2395017,NM,c(-105.242180098171, 35.6081714331777)
1409,1800,10003185,CATTARAUGUS COUNTY JAIL,301 COURT ST,LITTLE VALLEY,NY,14755,1090,(716) 938-9194,COUNTY,OPEN,134,CATTARAUGUS,36009,USA,922140,CORRECTIONAL INSTITUTIONS,"https://data.ny.gov/Public-Safety/Jail-Population-By-County-Beginning-1997/nymx-kgkn/data, http://www.cattco.org/sheriffs-office",4/9/18,IMAGERY,2018-04-09T00:00:00.000Z,http://www.cattco.org/sheriffs-office,MAXIMUM,150,0.00349511,4.17E-07,6979.289063,436.8704904,36,9,960600,36009960600,9606,Census Tract 9606,G5020,S,248756719,540529,42.2291131,-78.8273951,NY,c(-78.8006890633941, 42.2522570765174)
1410,1801,10006674,HUTTONSVILLE WORK CAMP,"US HWY 250 S, P.O. BOX 1",HUTTONSVILLE,WV,26273,NOT AVAILABLE,(304) 335-2291,STATE,OPEN,-999,RANDOLPH,54083,USA,922140,CORRECTIONAL INSTITUTIONS,http://www.wvdoc.com/wvdoc/PrisonsandFacilities/tabid/36/Default.aspx,1/22/18,IMAGERY/OTHER,2018-01-22T00:00:00.000Z,http://www.wvdoc.com/wvdoc/PrisonsandFacilities/tabid/36/Default.aspx,MINIMUM,48,0.00121501,8.61E-08,1366.4375,149.5167306,54,83,966500,54083966500,9665,Census Tract 9665,G5020,S,939354356,11999,38.624994,-79.9675131,WV,c(-79.9795810962174, 38.6968911930181)
1411,1802,10002987,CARLIN CONSERVATION CAMP,124 SUZIE CREEK RD,CARLIN,NV,89822,NOT AVAILABLE,(775) 754-6307,STATE,OPEN,111,ELKO,32007,USA,922140,CORRECTIONAL INSTITUTIONS,"http://doc.nv.gov/About/Statistics/Quarterly_Reports_by_Fiscal_Year/Quarterly_Reports_by_Fiscal_Year/, http://doc.nv.gov/Facilities/Home/",12/31/16,IMAGERY/OTHER,2017-12-18T00:00:00.000Z,http://doc.nv.gov/Facilities/Home/,MINIMUM,150,0.005195441,1.45E-06,23731.19531,657.4007525,32,7,951600,32007951600,9516,Census Tract 9516,G5020,S,1148319425,252002,40.685529,-116.0170133,NV,c(-116.083772252644, 40.7281267564375)
1412,1803,10003595,MARTINSBURG CORRECTIONAL CENTER,38 GRAPEVINE ROAD,MARTINSBURG,WV,25401,NOT AVAILABLE,(304) 267-0156,STATE,OPEN,121,BERKELEY,54003,USA,922140,CORRECTIONAL INSTITUTIONS,http://www.wvdoc.com/wvdoc/PrisonsandFacilities/tabid/36/Default.aspx,1/22/18,IMAGERY/OTHER,2018-01-22T00:00:00.000Z,http://www.wvdoc.com/wvdoc/PrisonsandFacilities/tabid/36/Default.aspx,MEDIUM,120,0.004283455,1.04E-06,16742.07813,541.697857,54,3,972000,54003972000,9720,Census Tract 9720,G5020,S,52668500,0,39.4099438,-77.9467129,WV,c(-77.9566976495037, 39.4347514743218)
1413,1804,10006146,SALEM CORRECTIONAL CENTER,7 INDUSTRIAL BOULEVARD,INDUSTRIAL,WV,26426,NOT AVAILABLE,(304) 782-2371,STATE,OPEN,-999,HARRISON,54017,USA,922140,CORRECTIONAL INSTITUTIONS,http://www.wvdoc.com/wvdoc/OfficeofResearchPlanning/tabid/70/Default.aspx,1/22/18,IMAGERY/OTHER,2018-01-22T00:00:00.000Z,http://www.wvdoc.com/wvdoc/PrisonsandFacilities/tabid/36/Default.aspx,MEDIUM,388,0.014779838,4.76E-06,76149.70703,1875.906213,54,17,965000,54017965000,9650,Census Tract 9650,G5020,S,543675086,1057224,39.2690673,-80.659054,WV,c(-80.5789554397836, 39.2815948433485)
1414,1805,10002988,HUMBOLDT CONSERVATION CAMP,8105 CONSERVATION RD,WINNEMUCCA,NV,89446,NOT AVAILABLE,(775) 623-6530,STATE,OPEN,122,HUMBOLDT,32013,USA,922140,CORRECTIONAL INSTITUTIONS,"http://doc.nv.gov/About/Statistics/Quarterly_Reports_by_Fiscal_Year/Quarterly_Reports_by_Fiscal_Year/, http://doc.nv.gov/Facilities/Home/",12/31/16,IMAGERY/OTHER,2017-12-18T00:00:00.000Z,http://doc.nv.gov/Facilities/Home/,MINIMUM,152,0.006836248,2.34E-06,38337.01172,886.8253948,32,13,10500,32013010500,105,Census Tract 105,G5020,S,20371991255,26185681,41.5141573,-118.2841989,NV,c(-117.921760958646, 40.9002154852912)
1415,1806,10001879,MT. OLIVE CORRECTIONAL COMPLEX,1 MOUNTAINSIDE WAY,MT. OLIVE,WV,25185,NOT AVAILABLE,(304) 442-7213,STATE,OPEN,1022,FAYETTE,54019,USA,922140,CORRECTIONAL INSTITUTIONS,http://www.wvdoc.com/wvdoc/PrisonsandFacilities/tabid/36/Default.aspx,1/22/18,IMAGERY,2018-01-22T00:00:00.000Z,http://www.wvdoc.com/wvdoc/PrisonsandFacilities/tabid/36/Default.aspx,MAXIMUM,1030,0.01577242,1.55E-05,243746.3438,1964.548833,54,19,20800,54019020800,208,Census Tract 208,G5020,S,108800187,2738226,38.1876852,-81.2454706,WV,c(-81.2379934296658, 38.2349712748815)
1416,1807,10006191,PARKERSBURG CORRECTIONAL CENTER,225 HOLIDAY HILLS DRIVE,PARKERSBURG,WV,26104,NOT AVAILABLE,(304) 420-2443,STATE,OPEN,186,WOOD,54107,USA,922140,CORRECTIONAL INSTITUTIONS,http://www.wvdoc.com/wvdoc/OfficeofResearchPlanning/tabid/70/Default.aspx,1/22/18,IMAGERY,2018-01-22T00:00:00.000Z,http://www.wvdoc.com/wvdoc/PrisonsandFacilities/tabid/36/Default.aspx,MINIMUM,-999,0.004490042,1.05E-06,16827.95313,573.5178987,54,107,10602,54107010602,106.02,Census Tract 106.02,G5020,S,130712376,35586,39.2751747,-81.3821505,WV,c(-81.5015701010551, 39.2650421186687)
1417,1808,10006794,MARQUETTE COUNTY COMMUNITY CORRECTIONS DETENTION CENTER,BASIL ROAD,MARQUETTE,MI,49855,NOT AVAILABLE,NOT AVAILABLE,COUNTY,OPEN,-999,MARQUETTE,26103,USA,922140,CORRECTIONAL INSTITUTIONS,http://www.co.marquette.mi.us/departments/sheriff_s_office/index.php#.WrJu9fnwbmE,3/21/18,UNVERIFIED,2018-03-21T00:00:00.000Z,http://www.co.marquette.mi.us/departments/sheriff_s_office/index.php#.WrJu9fnwbmE,MINIMUM,60,0.007332475,2.46E-06,44302.22266,927.2016039,26,103,1200,26103001200,12,Census Tract 12,G5020,S,476331426,4213208,46.3710141,-87.2280967,MI,c(-87.3038308257961, 46.4673457646472)
1418,1809,10000340,SANTA ROSA COUNTY JAIL,5755 E MILTON RD,MILTON,FL,32583,NOT AVAILABLE,(850) 983-1100,COUNTY,OPEN,741,SANTA ROSA,12113,USA,922140,CORRECTIONAL INSTITUTIONS,"http://www.dc.state.fl.us/pub/jails/, http://santarosasheriff.org/",2/21/18,IMAGERY,2018-02-21T00:00:00.000Z,http://santarosasheriff.org/,MAXIMUM,682,0.006514741,1.80E-06,25980.9375,762.0099118,12,113,10808,12113010808,108.08,Census Tract 108.08,G5020,S,184173671,1902644,30.6450492,-86.8915051,FL,c(-86.974503069896, 30.6435913406928)
1419,1810,10000014,PRUNTYTOWN CORRECTIONAL CENTER,2006 TRAP SPRINGS RD,GRAFTON,WV,26354,NOT AVAILABLE,(304) 265-6111,STATE,OPEN,369,TAYLOR,54091,USA,922140,CORRECTIONAL INSTITUTIONS,http://www.wvdoc.com/wvdoc/PrisonsandFacilities/tabid/36/Default.aspx,1/22/18,IMAGERY/OTHER,2018-01-22T00:00:00.000Z,http://www.wvdoc.com/wvdoc/PrisonsandFacilities/tabid/36/Default.aspx,MEDIUM,369,0.016114953,1.14E-05,181857.5273,2012.307673,54,91,964800,54091964800,9648,Census Tract 9648,G5020,S,130876703,47178,39.2768555,-80.1008205,WV,c(-80.0741278851055, 39.3304164807477)
1420,1811,10002282,CAYUGA COUNTY JAIL,7445 COUNTY HOUSE RD,AUBURN,NY,13021,NOT AVAILABLE,NOT AVAILABLE,COUNTY,OPEN,176,CAYUGA,36011,USA,922140,CORRECTIONAL INSTITUTIONS,"https://data.ny.gov/Public-Safety/Jail-Population-By-County-Beginning-1997/nymx-kgkn/data, http://cayugasheriff.com/",4/9/18,IMAGERY,2018-04-09T00:00:00.000Z,http://cayugasheriff.com/,MAXIMUM,214,0.006010146,1.31E-06,22203.29297,767.2276991,36,11,40600,36011040600,406,Census Tract 406,G5020,S,74642555,61548,42.9775784,-76.5183651,NY,c(-76.5435352011805, 42.9797907162057)
1421,1812,10004631,SARASOTA COUNTY JAIL,2020 MAIN STREET,SARASOTA,FL,34237,NOT AVAILABLE,(941) 861-4601,COUNTY,OPEN,950,SARASOTA,12115,USA,922140,CORRECTIONAL INSTITUTIONS,http://www.sarasotasheriff.org/,2/21/18,IMAGERY,2018-02-21T00:00:00.000Z,http://www.sarasotasheriff.org/,NOT AVAILABLE,1026,0.003270702,6.22E-07,8674.867188,380.9401597,12,115,102,12115000102,1.02,Census Tract 1.02,G5020,S,2394608,33449,27.3362532,-82.5318689,FL,c(-82.5294791739086, 27.3360540167597)
1422,1813,10003012,JEAN CONSERVATION CAMP,3 PRISON RD,JEAN,NV,89019,NOT AVAILABLE,(702) 874-2509,STATE,OPEN,184,CLARK,32003,USA,922140,CORRECTIONAL INSTITUTIONS,"http://doc.nv.gov/About/Statistics/Quarterly_Reports_by_Fiscal_Year/Quarterly_Reports_by_Fiscal_Year/, http://doc.nv.gov/Facilities/Home/",12/31/16,IMAGERY/OTHER,2017-12-18T00:00:00.000Z,http://doc.nv.gov/Facilities/Home/,MINIMUM,240,0.006906668,2.53E-06,38701.33594,851.021408,32,3,5703,32003005703,57.03,Census Tract 57.03,G5020,S,3643510265,59123623,35.557329,-114.9269665,NV,c(-115.315355527907, 35.7731930254538)
1423,1814,10000013,ST MARY'S CORRECTIONAL CENTER,2880 N. PLEASANTS HIGHWAY,ST. MARYS,WV,26170,NOT AVAILABLE,(304) 684-5500,STATE,OPEN,610,PLEASANTS,54073,USA,922140,CORRECTIONAL INSTITUTIONS,http://www.wvdoc.com/wvdoc/PrisonsandFacilities/tabid/36/Default.aspx,1/22/18,IMAGERY,2018-01-22T00:00:00.000Z,http://www.wvdoc.com/wvdoc/PrisonsandFacilities/tabid/36/Default.aspx,MEDIUM,-999,0.013893242,9.30E-06,149142.5273,1689.462172,54,73,962100,54073962100,9621,Census Tract 9621,G5020,S,200124851,3788364,39.3945458,-81.0788381,WV,c(-81.1695418052698, 39.4306545536934)
1424,1815,10003002,PIOCHE CONSERVATION CAMP,1 HARDTIMES RD,PIOCHE,NV,89043,NOT AVAILABLE,(775) 962-5125,STATE,OPEN,213,LINCOLN,32017,USA,922140,CORRECTIONAL INSTITUTIONS,"http://doc.nv.gov/About/Statistics/Quarterly_Reports_by_Fiscal_Year/Quarterly_Reports_by_Fiscal_Year/, http://doc.nv.gov/Facilities/Home/",12/31/16,IMAGERY/OTHER,2017-12-18T00:00:00.000Z,http://doc.nv.gov/Facilities/Home/,MINIMUM,238,0.00557433,1.40E-06,21936.89844,693.5120663,32,17,950100,32017950100,9501,Census Tract 9501,G5020,S,9519523961,1748646,38.1591637,-114.4983787,NV,c(-114.417956800098, 37.9558212085813)
1425,1816,10001102,"J M ""CHICK"" BUCKBEE JUVENILE CENTER",144 JERRY LANE,AUGUSTA,WV,26704,NOT AVAILABLE,(304) 496-1341,STATE,OPEN,21,HAMPSHIRE,54027,USA,922140,CORRECTIONAL INSTITUTIONS,"http://djs.wv.gov/annualreport/Pages/default.aspx, http://djs.wv.gov/facilities/Pages/default.aspx",1/22/18,IMAGERY,2018-01-22T00:00:00.000Z,http://djs.wv.gov/facilities/Pages/default.aspx,JUVENILE,24,0.003186551,5.36E-07,8579.273438,401.2974798,54,27,968300,54027968300,9683,Census Tract 9683,G5020,S,274814642,2628378,39.4017937,-78.6149911,WV,c(-78.6444891627115, 39.3031807461183)
1426,1817,10002997,STEWART CONSERVATION CAMP,1721 SNYDER AVE,CARSON CITY,NV,89702,NOT AVAILABLE,(775) 887-9310,STATE,OPEN,357,CARSON CITY,32510,USA,922140,CORRECTIONAL INSTITUTIONS,"http://doc.nv.gov/About/Statistics/Quarterly_Reports_by_Fiscal_Year/Quarterly_Reports_by_Fiscal_Year/, http://doc.nv.gov/Facilities/Home/",12/31/16,IMAGERY/OTHER,2017-12-18T00:00:00.000Z,http://doc.nv.gov/Facilities/Home/,MINIMUM,360,0.005348026,1.23E-06,19610.91797,667.6945699,32,510,800,32510000800,8,Census Tract 8,G5020,S,27200669,330453,39.1289289,-119.7254128,NV,c(-119.746854114983, 39.1063283192232)
1427,1818,10000041,GENE SPADARO JUVENILE CENTER,106 MARTIN DR.,MOUNT HOPE,WV,25880,NOT AVAILABLE,(304) 877-6890,STATE,OPEN,25,FAYETTE,54019,USA,922140,CORRECTIONAL INSTITUTIONS,"http://djs.wv.gov/annualreport/Pages/default.aspx, http://djs.wv.gov/facilities/Pages/default.aspx",1/22/18,IMAGERY/OTHER,2018-01-22T00:00:00.000Z,http://djs.wv.gov/facilities/Pages/default.aspx,JUVENILE,23,0.003737396,5.58E-07,8763.722656,462.9073229,54,19,20500,54019020500,205,Census Tract 205,G5020,S,10864999,8262,37.8932594,-81.1617432,WV,c(-81.1666881835735, 37.8853833435022)
1428,1819,10000042,DONALD R. KUHN JUVENILE CENTER,1 LORY PL,JULIAN,WV,25529,NOT AVAILABLE,(304) 369-2976,STATE,OPEN,40,BOONE,54005,USA,922140,CORRECTIONAL INSTITUTIONS,"http://djs.wv.gov/annualreport/Pages/default.aspx, http://djs.wv.gov/facilities/Pages/default.aspx",1/22/18,IMAGERY/OTHER,2018-01-22T00:00:00.000Z,http://djs.wv.gov/facilities/Pages/default.aspx,JUVENILE,48,0.005128966,1.46E-06,22997.05469,635.5717908,54,5,958300,54005958300,9583,Census Tract 9583,G5020,S,189874396,399614,38.0591906,-81.9169329,WV,c(-81.8379775772097, 38.1377125102133)
1429,1820,10004908,HAMILTON COUNTY JAIL,18100 CUMBERLAND RD,NOBLESVILLE,IN,46060,NOT AVAILABLE,(317) 773-1872,COUNTY,OPEN,325,HAMILTON,18057,USA,922140,CORRECTIONAL INSTITUTIONS,https://www.hamiltoncounty.in.gov/547/Divisions,3/5/18,IMAGERY,2018-03-05T00:00:00.000Z,https://www.hamiltoncounty.in.gov/547/Divisions,MAXIMUM,296,0.006484783,1.29E-06,20867.79297,829.743832,18,57,110600,18057110600,1106,Census Tract 1106,G5020,S,3224514,56585,40.0529469,-86.0042555,IN,c(-85.9941965611646, 40.0531621309192)
1430,1821,10006192,KENNETH HONEY RUBENSTEIN JUVENILE CENTER,141 FORESTRY CAMP RD,DAVIS,WV,26260,NOT AVAILABLE,(304) 259-5241,STATE,OPEN,39,TUCKER,54093,USA,922140,CORRECTIONAL INSTITUTIONS,"http://djs.wv.gov/annualreport/Pages/default.aspx, http://djs.wv.gov/facilities/Pages/default.aspx",1/22/18,IMAGERY,2018-01-22T00:00:00.000Z,http://djs.wv.gov/facilities/Pages/default.aspx,JUVENILE,84,0.008907203,1.94E-06,30990.23047,1104.254163,54,93,965300,54093965300,9653,Census Tract 9653,G5020,S,531464876,712920,39.0571354,-79.5052641,WV,c(-79.4427206724013, 39.1494810534493)
1431,1822,10000037,ROBERT L. SHELL JUVENILE CENTER,2 O'HANLON PLACE,BARBOURSVILLE,WV,25504,NOT AVAILABLE,(304) 733-0871,STATE,OPEN,25,CABELL,54011,USA,922140,CORRECTIONAL INSTITUTIONS,"http://djs.wv.gov/annualreport/Pages/default.aspx, http://djs.wv.gov/facilities/Pages/default.aspx",1/22/18,IMAGERY/OTHER,2018-01-22T00:00:00.000Z,http://djs.wv.gov/facilities/Pages/default.aspx,JUVENILE,23,0.003048103,4.10E-07,6483.792969,371.0855242,54,11,10400,54011010400,104,Census Tract 104,G5020,S,22595367,510034,38.3899476,-82.2637306,WV,c(-82.2916483875027, 38.4181365739425)
1432,1823,10005167,MASON COUNTY JAIL,306 NORTH DELIA STREET,LUDINGTON,MI,49431,NOT AVAILABLE,NOT AVAILABLE,COUNTY,OPEN,57,MASON,26105,USA,922140,CORRECTIONAL INSTITUTIONS,"http://www.michigan.gov/documents/corrections/JPIS_-_CY_2010_344047_7.pdf, http://masoncountysheriff.org/",2/15/16,IMAGERY/OTHER,2018-03-21T00:00:00.000Z,http://masoncountysheriff.org/,MAXIMUM,104,0.002320669,2.66E-07,4585.808594,301.1719918,26,105,950400,26105950400,9504,Census Tract 9504,G5020,S,4845345,0,43.9635406,-86.4381881,MI,c(-86.443059206962, 43.9580450303291)
1433,1824,10006895,SITKA COMMUNITY JAIL,304 LAKE ST 102,SITKA,AK,99835,NOT AVAILABLE,NOT AVAILABLE,LOCAL,OPEN,-999,SITKA BOROUGH,2220,USA,922140,CORRECTIONAL INSTITUTIONS,http://www.sitkapd.com/index.html,5/11/18,UNVERIFIED,2018-05-11T00:00:00.000Z,NOT AVAILABLE,NOT AVAILABLE,-999,0.002237596,2.44E-07,5560.617188,305.3884662,2,220,200,2220000200,2,Census Tract 2,G5020,S,17090447,32681043,57.0478562,-135.366338,AK,c(-135.333567923727, 57.0526576888711)
1434,1825,10002160,JOHN E POLK CORRECTIONAL FACILITY,211 ESLINGER WAY,SANFORD,FL,32773,NOT AVAILABLE,(407) 665-1200,COUNTY,OPEN,932,SEMINOLE,12117,USA,922140,CORRECTIONAL INSTITUTIONS,"http://www.dc.state.fl.us/pub/jails/, https://www.seminolesheriff.org/page.aspx?id=92",2/22/18,IMAGERY,2018-02-22T00:00:00.000Z,https://www.seminolesheriff.org/page.aspx?id=92,MAXIMUM,1396,0.009211428,2.95E-06,41737.35938,1093.764822,12,117,20803,12117020803,208.03,Census Tract 208.03,G5020,S,10306133,854090,28.7423008,-81.3136934,FL,c(-81.2991609479625, 28.7475371662882)
1435,1826,10000050,SAM PERDUE JUVENILE CENTER,843 SHELTER RD,PRINCETON,WV,24739,NOT AVAILABLE,(304) 425-9721,STATE,OPEN,16,MERCER,54055,USA,922140,CORRECTIONAL INSTITUTIONS,http://djs.wv.gov/annualreport/Pages/default.aspx,1/20/15,IMAGERY,2018-01-22T00:00:00.000Z,http://djs.wv.gov/facilities/Pages/default.aspx,JUVENILE,20,0.002476141,3.38E-07,5265.398438,308.5328967,54,55,2300,54055002300,23,Census Tract 23,G5020,S,61172070,177057,37.3269275,-81.1185319,WV,c(-81.1273149146736, 37.3317750380554)
1436,1827,10001453,SUMTER COUNTY DETENTION CENTER,219 E ANDERSON AVE,BUSHNELL,FL,33513,NOT AVAILABLE,(352) 569-1700,COUNTY,OPEN,385,SUMTER,12119,USA,922140,CORRECTIONAL INSTITUTIONS,http://www.dc.state.fl.us/pub/jails/,2/22/18,IMAGERY,2018-02-22T00:00:00.000Z,http://www.sumtercountysheriff.org/index.php,MEDIUM,-999,0.006862314,1.99E-06,28061.12109,810.7483478,12,119,910500,12119910500,9105,Census Tract 9105,G5020,S,189420678,3141955,28.7122844,-82.0449203,FL,c(-82.1091375278027, 28.6624401814389)
1437,1828,10003006,THREE LAKES VALLEY CONSERVATION & BOOT CAMP,20825 COLD CREEK RD,INDIAN SPRINGS,NV,89070,NOT AVAILABLE,(702) 879-5472,STATE,OPEN,330,CLARK,32003,USA,922140,CORRECTIONAL INSTITUTIONS,"http://doc.nv.gov/About/Statistics/Quarterly_Reports_by_Fiscal_Year/Quarterly_Reports_by_Fiscal_Year/, http://doc.nv.gov/Facilities/Home/",12/31/16,IMAGERY/OTHER,2017-12-18T00:00:00.000Z,http://doc.nv.gov/Facilities/Home/,MINIMUM,192,0.013805878,8.85E-06,136428.8516,1694.288994,32,3,5818,32003005818,58.18,Census Tract 58.18,G5020,S,527248957,0,36.4693209,-115.7785508,NV,c(-115.561132140825, 36.5145202788763)
1438,1829,10004544,ATKINSON COUNTY JAIL,20 SMITH AVE W,PEARSON,GA,31642,NOT AVAILABLE,(912) 422-3291,COUNTY,OPEN,-999,ATKINSON,13003,USA,922140,CORRECTIONAL INSTITUTIONS,http://atkinsonsheriff.org/index.html,2/22/18,IMAGERY,2018-02-22T00:00:00.000Z,http://atkinsonsheriff.org/index.html,NOT AVAILABLE,-999,0.001201114,8.97E-08,1300.421875,144.2981316,13,3,960200,13003960200,9602,Census Tract 9602,G5020,S,402068873,1423792,31.2627888,-82.883197,GA,c(-82.8535312935638, 31.2957419104249)
1439,1830,10004581,UNION COUNTY JAIL,50 NORTHWEST 1ST STREET,LAKE BUTLER,FL,32054,NOT AVAILABLE,(386) 496-2501,COUNTY,OPEN,37,UNION,12125,USA,922140,CORRECTIONAL INSTITUTIONS,"http://www.dc.state.fl.us/pub/jails/, http://www.unionsheriff.us/corrections.html",2/22/18,IMAGERY,2018-02-22T00:00:00.000Z,http://www.unionsheriff.us/corrections.html,NOT AVAILABLE,36,0.00226916,3.14E-07,4495.964844,269.174113,12,125,960200,12125960200,9602,Census Tract 9602,G5020,S,293238434,14779126,30.0614072,-82.3799754,FL,c(-82.338554013516, 30.0235543437473)
1440,1831,10000447,VOLUSIA COUNTY CORRECTIONAL FACILITY,1354 INDIAN LAKE RD,DAYTONA BEACH,FL,32124,NOT AVAILABLE,(386) 254-1569,COUNTY,OPEN,514,VOLUSIA,12127,USA,922140,CORRECTIONAL INSTITUTIONS,"http://www.dc.state.fl.us/pub/jails/, https://www.volusia.org/services/public-protection/corrections/",2/22/18,IMAGERY,2018-02-22T00:00:00.000Z,https://www.volusia.org/services/public-protection/corrections/,MAXIMUM,595,0.007460114,2.40E-06,34023.0293,873.2996199,12,127,83206,12127083206,832.06,Census Tract 832.06,G5020,S,191436609,733033,29.1712727,-81.2246774,FL,c(-81.1468086465055, 29.1386933802403)
1441,1832,10004560,WALTON COUNTY JAIL,796 TRIPLE G ROAD,DEFUNIAK SPRINGS,FL,32433,NOT AVAILABLE,(850) 892-8196,COUNTY,OPEN,513,WALTON,12131,USA,922140,CORRECTIONAL INSTITUTIONS,http://waltonso.org/,2/22/18,IMAGERY,2018-02-22T00:00:00.000Z,http://waltonso.org/,MAXIMUM,584,0.005925066,1.56E-06,22562.37891,714.6307991,12,131,950200,12131950200,9502,Census Tract 9502,G5020,S,85423564,2346806,30.7405605,-86.081399,FL,c(-86.1032896963516, 30.7835064605583)
1442,1833,10004541,BAKER COUNTY SHERIFFS OFFICE,STATE HIGHWAY 200,NEWTON,GA,39870,NOT AVAILABLE,(229) 734-3002,COUNTY,NOT AVAILABLE,-999,BAKER,13007,USA,922140,CORRECTIONAL INSTITUTIONS,http://bakercountysheriffoffice.org/,2/15/16,UNVERIFIED,2018-02-22T00:00:00.000Z,http://bakercountysheriffoffice.org/index.php,NOT AVAILABLE,-999,0.003677479,8.33E-07,12086.27734,443.5743118,13,7,960100,13007960100,9601,Census Tract 9601,G5020,S,470625163,14157745,31.3322322,-84.3614663,GA,c(-84.4130634904247, 31.2870047901606)
1443,1834,10002804,EL PASO COUNTY ANNEX JAIL,12501 E MONTANA,EL PASO,TX,79938,NOT AVAILABLE,NOT AVAILABLE,COUNTY,OPEN,1195,EL PASO,48141,USA,922140,CORRECTIONAL INSTITUTIONS,"http://epcounty.com/sheriff/reports/2015%20EPCSO%20Annual%20Report.pdf, http://epcounty.com/sheriff/default.asp",4/26/18,IMAGERY,2018-04-26T00:00:00.000Z,http://epcounty.com/sheriff/default.asp,MAXIMUM,1450,0.012549311,6.69E-06,97560.30469,1519.34513,48,141,10339,48141010339,103.39,Census Tract 103.39,G5020,S,47351243,0,31.8261423,-106.255518,TX,c(-106.253126538738, 31.8106299764869)
1444,1835,10005175,MECOSTA COUNTY JAIL,225 SOUTH STEWART,BIG RAPIDS,MI,49307,NOT AVAILABLE,(231) 592-0156,COUNTY,OPEN,-999,MECOSTA,26107,USA,922140,CORRECTIONAL INSTITUTIONS,http://www.michigan.gov/documents/corrections/JPIS_-_CY_2010_344047_7.pdf,2/15/16,IMAGERY/OTHER,2018-03-21T00:00:00.000Z,http://www.mecostacounty.org/mecostacountysheriff.html,NOT AVAILABLE,97,0.005181465,6.81E-07,11668.26953,657.6438992,26,107,960600,26107960600,9606,Census Tract 9606,G5020,S,6196362,76614,43.6912652,-85.4998622,MI,c(-85.4781129494605, 43.696264074137)
1445,1836,10002288,CHAUTAUQUA COUNTY JAIL,15 E CHAUTAUQUA ST,MAYVILLE,NY,14757,NOT AVAILABLE,NOT AVAILABLE,COUNTY,OPEN,221,CHAUTAUQUA,36013,USA,922140,CORRECTIONAL INSTITUTIONS,http://www.sheriff.us/,4/9/18,IMAGERY,2018-04-09T00:00:00.000Z,http://www.sheriff.us/,NOT AVAILABLE,-999,0.00401433,6.04E-07,10111.64063,511.1742793,36,13,36401,36013036401,364.01,Census Tract 364.01,G5020,S,106172128,18497058,42.2232066,-79.5251619,NY,c(-79.5034354127548, 42.2544476194323)
1446,1837,10002998,TONOPAH CONSERVATION CAMP,"HC 76, BOX 8045",TONOPAH,NV,89049,NOT AVAILABLE,(775) 482-6700,STATE,OPEN,147,NYE,32023,USA,922140,CORRECTIONAL INSTITUTIONS,"http://doc.nv.gov/About/Statistics/Quarterly_Reports_by_Fiscal_Year/Quarterly_Reports_by_Fiscal_Year/, http://doc.nv.gov/Facilities/Home/",12/31/16,IMAGERY/OTHER,2017-12-18T00:00:00.000Z,http://doc.nv.gov/Facilities/Home/,MINIMUM,152,0.006023667,2.06E-06,32467.34766,760.007885,32,23,960200,32023960200,9602,Census Tract 9602,G5020,S,7769110001,4386983,38.1235057,-116.677517,NV,c(-117.107415235281, 38.1686809810388)
1447,1838,10000261,FLORENCE MCCLURE WOMEN'S CORRECTIONAL CENTER,4370 SMILEY RD,LAS VEGAS,NV,89115,1808,(702) 668-7200,STATE,OPEN,991,CLARK,32003,USA,922140,CORRECTIONAL INSTITUTIONS,"http://doc.nv.gov/About/Statistics/Quarterly_Reports_by_Fiscal_Year/Quarterly_Reports_by_Fiscal_Year/, http://doc.nv.gov/Facilities/Home/",12/31/16,IMAGERY/OTHER,2017-12-18T00:00:00.000Z,http://doc.nv.gov/Facilities/Home/,CLOSE,950,0.009829927,5.95E-06,91448.11328,1242.592141,32,3,6001,32003006001,60.01,Census Tract 60.01,G5020,S,9762953,0,36.2514327,-115.0680887,NV,c(-115.076968425195, 36.2575180687806)
1448,1839,10003004,HIGH DESERT STATE PRISON,22010 COLD CREEK RD,INDIAN SPRINGS,NV,89070,NOT AVAILABLE,(702) 879-6789,STATE,OPEN,3669,CLARK,32003,USA,922140,CORRECTIONAL INSTITUTIONS,"http://doc.nv.gov/About/Statistics/Quarterly_Reports_by_Fiscal_Year/Quarterly_Reports_by_Fiscal_Year/, http://doc.nv.gov/Facilities/Home/",12/31/16,IMAGERY/OTHER,2017-12-18T00:00:00.000Z,http://doc.nv.gov/Facilities/Home/,MEDIUM,4176,0.029134978,4.28E-05,659706.5156,3681.004989,32,3,5818,32003005818,58.18,Census Tract 58.18,G5020,S,527248957,0,36.4693209,-115.7785508,NV,c(-115.584661897706, 36.5160221787812)
1449,1840,10000010,VICKI DOUGLAS JUVENILE CENTER,900 EMMETT ROUSCH DR,MARTINSBURG,WV,25401,NOT AVAILABLE,(304) 267-0164,STATE,OPEN,17,BERKELEY,54003,USA,922140,CORRECTIONAL INSTITUTIONS,"http://djs.wv.gov/annualreport/Pages/default.aspx, http://djs.wv.gov/facilities/Pages/default.aspx",1/22/18,IMAGERY/OTHER,2018-01-22T00:00:00.000Z,http://djs.wv.gov/facilities/Pages/default.aspx,JUVENILE,23,0.00301647,4.88E-07,7834.128906,382.6593023,54,3,971500,54003971500,9715,Census Tract 9715,G5020,S,3342854,0,39.457727,-77.9562893,WV,c(-77.9640033178039, 39.4460121974118)
1450,1841,10000033,TIGER MORTON JUVENILE CENTER,60 MANFRED HOLLAND WAY,DUNBAR,WV,25064,NOT AVAILABLE,(304) 766-2616,STATE,OPEN,26,KANAWHA,54039,USA,922140,CORRECTIONAL INSTITUTIONS,"http://djs.wv.gov/annualreport/Pages/default.aspx, http://djs.wv.gov/facilities/Pages/default.aspx",1/22/18,IMAGERY/OTHER,2018-01-22T00:00:00.000Z,http://djs.wv.gov/facilities/Pages/default.aspx,JUVENILE,23,0.002595185,3.82E-07,6033.085938,317.4587518,54,39,10400,54039010400,104,Census Tract 104,G5020,S,9127078,645091,38.3831307,-81.7671022,WV,c(-81.7599464009897, 38.3746340778123)
1451,1842,10003799,ELY STATE PRISON,4569 N STATE ROUTE,ELY,NV,89301,NOT AVAILABLE,(775) 289-8800,STATE,OPEN,1142,WHITE PINE,32033,USA,922140,CORRECTIONAL INSTITUTIONS,"http://doc.nv.gov/About/Statistics/Quarterly_Reports_by_Fiscal_Year/Quarterly_Reports_by_Fiscal_Year/, http://doc.nv.gov/Facilities/Home/",12/31/16,IMAGERY/OTHER,2017-12-18T00:00:00.000Z,http://doc.nv.gov/Facilities/Home/,MAXIMUM,1183,0.019325595,2.28E-05,365497.5703,2408.705114,32,33,970200,32033970200,9702,Census Tract 9702,G5020,S,6168942491,740704,39.1151145,-115.1951682,NV,c(-114.938471865471, 39.3855374734377)
1452,1843,10001105,CHARLESTON WORK RELEASE CENTER,607 BROOKS ST,CHARLESTON,WV,25301,NOT AVAILABLE,(304) 558-2763,STATE,CLOSED,0,KANAWHA,54039,USA,922140,CORRECTIONAL INSTITUTIONS,http://www.wvdoc.com/wvdoc/PrisonsandFacilities/CharlestonCorrectionalCenter/tabid/199/Default.aspx,1/23/18,IMAGERY,2018-01-23T00:00:00.000Z,http://www.wvdoc.com/wvdoc/PrisonsandFacilities/CharlestonWorkReleaseCenter/tabid/46/Default.aspx,MINIMUM,66,0.000957033,4.29E-08,677.5820313,119.1871187,54,39,900,54039000900,9,Census Tract 9,G5020,S,1468599,175251,38.3514903,-81.6352653,WV,c(-81.6263881090662, 38.3495940741165)
1453,1844,10000260,NORTHERN NEVADA TRANSITIONAL HOUSING,225 SUNSHINE LANE,RENO,NV,89502,NOT AVAILABLE,(775) 688-1140,STATE,OPEN,104,WASHOE,32031,USA,922140,CORRECTIONAL INSTITUTIONS,"http://doc.nv.gov/About/Statistics/Quarterly_Reports_by_Fiscal_Year/Quarterly_Reports_by_Fiscal_Year/, http://doc.nv.gov/Facilities/Home/",12/31/16,IMAGERY/OTHER,2017-12-19T00:00:00.000Z,http://doc.nv.gov/Facilities/Home/,MINIMUM,112,0.002625316,2.91E-07,4680.613281,341.6305827,32,31,2107,32031002107,21.07,Census Tract 21.07,G5020,S,2374872,127559,39.5190407,-119.7835119,NV,c(-119.788673047324, 39.5268589677385)
1454,1845,10002991,LOVELOCK CORRECTIONAL CENTER,1200 PRISON RD,LOVELOCK,NV,89419,NOT AVAILABLE,(775) 273-1300,STATE,OPEN,1681,PERSHING,32027,USA,922140,CORRECTIONAL INSTITUTIONS,"http://doc.nv.gov/About/Statistics/Quarterly_Reports_by_Fiscal_Year/Quarterly_Reports_by_Fiscal_Year/, http://doc.nv.gov/Facilities/Home/",12/31/16,IMAGERY/OTHER,2017-12-19T00:00:00.000Z,http://doc.nv.gov/Facilities/Home/,CLOSE,1680,0.01741459,1.56E-05,252867.6719,2196.171793,32,27,960100,32027960100,9601,Census Tract 9601,G5020,S,15634691964,79934815,40.439639,-118.4094765,NV,c(-118.388806316321, 40.2230722052171)
1455,1846,10002994,NEVADA STATE PRISON,3301 E 5TH ST,CARSON CITY,NV,89701,NOT AVAILABLE,NOT AVAILABLE,STATE,CLOSED,0,CARSON CITY,32510,USA,922140,CORRECTIONAL INSTITUTIONS,http://doc.nv.gov/Facilities/Home/,12/19/17,IMAGERY/OTHER,2017-12-19T00:00:00.000Z,NOT AVAILABLE,MEDIUM,841,0.015104883,9.86E-06,157629.9688,1889.583719,32,510,600,32510000600,6,Census Tract 6,G5020,S,6857070,98474,39.158215,-119.7471228,NV,c(-119.73604176665, 39.1596427865462)
1456,1847,10002995,WARM SPRINGS CORRECTIONAL CENTER,3301 E 5TH ST,CARSON CITY,NV,89701,NOT AVAILABLE,(775) 684-3000,STATE,OPEN,573,CARSON CITY,32510,USA,922140,CORRECTIONAL INSTITUTIONS,"http://doc.nv.gov/About/Statistics/Quarterly_Reports_by_Fiscal_Year/Quarterly_Reports_by_Fiscal_Year/, http://doc.nv.gov/Facilities/Home/",12/31/16,IMAGERY/OTHER,2017-12-19T00:00:00.000Z,http://doc.nv.gov/Facilities/Home/,MEDIUM,532,0.01283407,8.21E-06,131155.4375,1577.758264,32,510,600,32510000600,6,Census Tract 6,G5020,S,6857070,98474,39.158215,-119.7471228,NV,c(-119.737223245193, 39.1567770888514)
1457,1848,10002996,NORTHERN NEVADA CORRECTIONAL CENTER,1721 SNYDER AVE,CARSON CITY,NV,89701,NOT AVAILABLE,(775) 887-9297,STATE,OPEN,1411,CARSON CITY,32510,USA,922140,CORRECTIONAL INSTITUTIONS,"http://doc.nv.gov/About/Statistics/Quarterly_Reports_by_Fiscal_Year/Quarterly_Reports_by_Fiscal_Year/, http://doc.nv.gov/Facilities/Home/",12/31/16,IMAGERY/OTHER,2017-12-19T00:00:00.000Z,http://doc.nv.gov/Facilities/Home/,MEDIUM,1619,0.021031058,2.03E-05,323682.7109,2648.834996,32,510,800,32510000800,8,Census Tract 8,G5020,S,27200669,330453,39.1289289,-119.7254128,NV,c(-119.744029291276, 39.1088521155999)
1458,1849,10003005,SOUTHERN DESERT CORRECTIONAL CENTER,20825 COLD CREEK RD,INDIAN SPRINGS,NV,89070,NOT AVAILABLE,(702) 879-3800,STATE,OPEN,2150,CLARK,32003,USA,922140,CORRECTIONAL INSTITUTIONS,"http://doc.nv.gov/About/Statistics/Quarterly_Reports_by_Fiscal_Year/Quarterly_Reports_by_Fiscal_Year/, http://doc.nv.gov/Facilities/Home/",12/31/16,IMAGERY/OTHER,2017-12-19T00:00:00.000Z,http://doc.nv.gov/Facilities/Home/,MEDIUM,2149,0.029071429,2.97E-05,457752.5391,3546.685369,32,3,5818,32003005818,58.18,Census Tract 58.18,G5020,S,527248957,0,36.4693209,-115.7785508,NV,c(-115.554596715744, 36.5148901109888)
1459,1850,10000036,HUNTINGTON WORK RELEASE CENTER,1236 5TH AVE.,HUNTINGTON,WV,25701,NOT AVAILABLE,NOT AVAILABLE,STATE,CLOSED,0,CABELL,54011,USA,922140,CORRECTIONAL INSTITUTIONS,https://www.usnews.com/news/best-states/west-virginia/articles/2017-11-30/west-virginia-inmate-work-release-center-closing,11/30/17,IMAGERY,2018-01-23T00:00:00.000Z,http://www.wvdoc.com/wvdoc/PrisonsandFacilities/HuntingtonWorkReleaseCenter/tabid/48/Default.aspx,MINIMUM,66,0.00130355,7.32E-08,1158.253906,174.3846725,54,11,600,54011000600,6,Census Tract 6,G5020,S,936968,870250,38.4270313,-82.4298843,WV,c(-82.4373557636317, 38.4209142820801)
1460,1851,10000055,WYOMING HONOR FARM,40 HONOR FARM RD,RIVERTON,WY,82501,9411,(307) 856-9578,STATE,OPEN,271,FREMONT,56013,USA,922140,CORRECTIONAL INSTITUTIONS,http://corrections.wyo.gov/home/services-and-programs/prison-rape-elimination-act-prea,8/2/16,IMAGERY,2018-01-23T00:00:00.000Z,http://corrections.wyo.gov/home/institutions,MINIMUM,283,0.026229041,2.57E-05,436544.9805,3432.925304,56,13,940300,56013940300,9403,Census Tract 9403,G5020,S,39409043,1099316,43.0642073,-108.3438485,WY,c(-108.369896122592, 43.059427370194)
1461,1852,10003000,CALIENTE YOUTH CENTER,500 YOUTH CENTER DRIVE,CALIENTE,NV,89008,NOT AVAILABLE,(775) 726-8200,STATE,OPEN,115,LINCOLN,32017,USA,922140,CORRECTIONAL INSTITUTIONS,"http://dcfs.nv.gov/Programs/JJS/, http://dcfs.nv.gov/Programs/JJS/PREAHome/",12/12/17,IMAGERY,2017-12-19T00:00:00.000Z,http://dcfs.nv.gov/Programs/JJS/,JUVENILE,140,0.00992504,4.92E-06,77047.35938,1213.198609,32,17,950200,32017950200,9502,Census Tract 9502,G5020,S,18020818284,8054067,37.4680496,-115.0589325,NV,c(-114.503565881762, 37.6195743261215)
1462,1853,10003902,BANKS COUNTY JAIL / SHERIFF,160 WINDMILL FARM ROAD,HOMER,GA,30547,NOT AVAILABLE,(706) 677-2248,COUNTY,OPEN,-999,BANKS,13011,USA,922140,CORRECTIONAL INSTITUTIONS,http://www.bankscountysheriff.org/home.html,2/22/18,IMAGERY,2018-02-22T00:00:00.000Z,http://www.bankscountysheriff.org/home.html,MAXIMUM,60,0.003033799,5.13E-07,7701.792969,366.9637965,13,11,970200,13011970200,9702,Census Tract 9702,G5020,S,193261789,774820,34.3680144,-83.4828465,GA,c(-83.4712532462173, 34.3140624398691)
1463,1854,10005149,MENOMINEE COUNTY JAIL,831 10TH AVENUE,MENOMINEE,MI,49858,NOT AVAILABLE,(906) 863-4441,COUNTY,OPEN,31,MENOMINEE,26109,USA,922140,CORRECTIONAL INSTITUTIONS,http://www.michigan.gov/documents/corrections/JPIS_-_CY_2010_344047_7.pdf,2/15/16,IMAGERY/OTHER,2018-03-21T00:00:00.000Z,http://www.menomineecounty.com/departments/?department=85bf1f570592,NOT AVAILABLE,51,0.00226275,1.94E-07,3411,296.2328821,26,109,960700,26109960700,9607,Census Tract 9607,G5020,S,4494857,3960694,45.1105726,-87.6072856,MI,c(-87.6127343765191, 45.1072653835196)
1464,1855,10000259,NEVADA YOUTH TRAINING CENTER,100 YOUTH CENTER DRIVE,ELKO,NV,89801,NOT AVAILABLE,(775) 738-6200,STATE,OPEN,51,ELKO,32007,USA,922140,CORRECTIONAL INSTITUTIONS,http://dcfs.nv.gov/Programs/JJS/,12/12/17,IMAGERY,2017-12-19T00:00:00.000Z,http://dcfs.nv.gov/Programs/JJS/,JUVENILE,160,0.016746708,1.23E-05,201061.957,2100.370179,32,7,950702,32007950702,9507.02,Census Tract 9507.02,G5020,S,3351515963,406459,41.0931599,-115.7874914,NV,c(-115.727199123183, 40.8804910627176)
1465,1856,10000057,WYOMING STATE PENITENTIARY,2900 S HIGLEY RD,RAWLINS,WY,82301,400,(307) 328-1441,STATE,OPEN,678,CARBON,56007,USA,922140,CORRECTIONAL INSTITUTIONS,http://corrections.wyo.gov/home/services-and-programs/prison-rape-elimination-act-prea,8/5/16,IMAGERY,2018-01-23T00:00:00.000Z,http://corrections.wyo.gov/home/institutions,MAXIMUM,820,0.035713264,2.81E-05,466020.7734,4347.826086,56,7,967600,56007967600,9676,Census Tract 9676,G5020,S,8643062769,81096253,41.7068338,-107.3673125,WY,c(-107.213795084833, 41.7624628414866)
1466,1857,10004909,HAMILTON COUNTY JUVENILE DETENTION CENTER,18106 CUMBERLAND RD,NOBLESVILLE,IN,46060,NOT AVAILABLE,(317) 776-9828,COUNTY,OPEN,-999,HAMILTON,18057,USA,922140,CORRECTIONAL INSTITUTIONS,https://www.hamiltoncounty.in.gov/547/Divisions,3/5/18,IMAGERY,2018-03-05T00:00:00.000Z,https://www.hamiltoncounty.in.gov/547/Divisions,JUVENILE,86,0.006578188,1.05E-06,17071.64844,827.7681679,18,57,110600,18057110600,1106,Census Tract 1106,G5020,S,3224514,56585,40.0529469,-86.0042555,IN,c(-85.992907692697, 40.0522538512141)
1467,1858,10003008,SUMMIT VIEW YOUTH CENTER,5730 RANGE RD,LAS VEGAS,NV,89115,NOT AVAILABLE,NOT AVAILABLE,STATE,OPEN,34,CLARK,32003,USA,922140,CORRECTIONAL INSTITUTIONS,http://dcfs.nv.gov/Programs/JJS/,12/12/17,IMAGERY,2017-12-19T00:00:00.000Z,http://dcfs.nv.gov/Programs/JJS/,JUVENILE,50,0.007162797,3.37E-06,51858.77734,870.7538054,32,3,3628,32003003628,36.28,Census Tract 36.28,G5020,S,25368319,112001,36.2734327,-115.0598574,NV,c(-115.053986241168, 36.2648334047205)
1468,1859,10000056,WYOMING WOMEN'S CENTER,1000 W GRIFFITH BLVD,LUSK,WY,82225,20,(307) 334-3693,STATE,OPEN,249,NIOBRARA,56027,USA,922140,CORRECTIONAL INSTITUTIONS,http://corrections.wyo.gov/home/services-and-programs/prison-rape-elimination-act-prea,6/30/17,IMAGERY/OTHER,2018-01-23T00:00:00.000Z,http://corrections.wyo.gov/home/institutions,MAXIMUM,275,0.007669384,2.84E-06,47863.94141,954.6405958,56,27,957200,56027957200,9572,Census Tract 9572,G5020,S,6801380673,4969450,43.062159,-104.4683727,WY,c(-104.467310324348, 42.7679410033113)
1469,1860,10003908,BARROW COUNTY DETENTION CENTER,652 BARROW PARK DRIVE,WINDER,GA,30680,NOT AVAILABLE,(770) 307-3080,COUNTY,OPEN,222,BARROW,13013,USA,922140,CORRECTIONAL INSTITUTIONS,http://www.barrowga.org/departments/detention-center.aspx,2/22/18,IMAGERY,2018-02-22T00:00:00.000Z,http://www.barrowga.org/departments/detention-center.aspx,NOT AVAILABLE,372,0.006105704,1.49E-06,22286.55469,737.2484896,13,13,180107,13013180107,1801.07,Census Tract 1801.07,G5020,S,19207623,136185,34.0149923,-83.7895842,GA,c(-83.7613640574186, 34.0010910800172)
1470,1861,10001503,CHEMUNG COUNTY CORRECTIONAL FACILITY,211 WILLIAM ST,ELMIRA,NY,14901,NOT AVAILABLE,(607) 737-2934,COUNTY,OPEN,165,CHEMUNG,36015,USA,922140,CORRECTIONAL INSTITUTIONS,"http://www.chemungcountyny.gov/resources/contact_directory/index.php, https://data.ny.gov/Public-Safety/Jail-Population-By-County-Beginning-1997/nymx-kgkn/data, http://www.chemungsheriff.net/index.asp?pageId=266",4/9/18,IMAGERY,2018-04-09T00:00:00.000Z,http://www.chemungsheriff.net/index.asp?pageId=266,MAXIMUM,262,0.002789775,3.28E-07,5477.628906,350.4759294,36,15,700,36015000700,7,Census Tract 7,G5020,S,2441946,226127,42.0920401,-76.7977247,NY,c(-76.8014055869505, 42.0912082856001)
1471,1862,10005125,EL PASO COUNTY JUVENILE DETENTION CENTER,6400 DELTA DRIVE,EL PASO,TX,79905,NOT AVAILABLE,NOT AVAILABLE,COUNTY,OPEN,-999,EL PASO,48141,USA,922140,CORRECTIONAL INSTITUTIONS,http://www.epcounty.com/jvprobation/,4/26/18,IMAGERY/OTHER,2018-04-26T00:00:00.000Z,http://www.epcounty.com/jvprobation/,JUVENILE,62,0.006915542,1.75E-06,25523.55078,813.747143,48,141,3602,48141003602,36.02,Census Tract 36.02,G5020,S,2955209,198521,31.7547941,-106.4083087,TX,c(-106.408837832519, 31.7590845571179)
1472,1863,10003821,MIDLAND COUNTY JAIL,101 FAST ICE DR,MIDLAND,MI,48642,NOT AVAILABLE,NOT AVAILABLE,COUNTY,OPEN,135,MIDLAND,26111,USA,922140,CORRECTIONAL INSTITUTIONS,https://co.midland.mi.us/Sheriff.aspx,3/21/18,IMAGERY/OTHER,2018-03-21T00:00:00.000Z,https://co.midland.mi.us/Sheriff.aspx,MAXIMUM,274,0.004528029,1.09E-06,18696.17578,621.8736494,26,111,290600,26111290600,2906,Census Tract 2906,G5020,S,21906868,728991,43.5914259,-84.1965115,MI,c(-84.1697944508957, 43.598869175882)
1473,1864,10003903,BARTOW COUNTY JAIL,104 ZENA DRIVE,CARTERSVILLE,GA,30121,NOT AVAILABLE,(770) 382-5050,COUNTY,OPEN,634,BARTOW,13015,USA,922140,CORRECTIONAL INSTITUTIONS,https://www.bartow.org/,2/22/18,IMAGERY,2018-02-22T00:00:00.000Z,https://www.bartow.org/,NOT AVAILABLE,-999,0.007467415,2.98E-06,44713.44922,916.112248,13,15,960402,13015960402,9604.02,Census Tract 9604.02,G5020,S,51460152,422945,34.2353226,-84.7965772,GA,c(-84.7774718430454, 34.1913286067574)
1474,1865,10001254,FANNIN COUNTY SOUTH JAIL ANNEX,725 COUNTY RD 4200,BONHAM,TX,75418,NOT AVAILABLE,(903) 449-4200,COUNTY,OPEN,57,FANNIN,48147,USA,922140,CORRECTIONAL INSTITUTIONS,"https://www.tcjs.state.tx.us/index.php?linkID=325, https://www.geogroup.com/Locations",3/1/18,IMAGERY,2018-04-26T00:00:00.000Z,NOT AVAILABLE,NOT AVAILABLE,96,0.00240566,2.28E-07,3396.722656,287.7486049,48,147,950600,48147950600,9506,Census Tract 9506,G5020,S,163526487,604096,33.5113564,-96.2082036,TX,c(-96.1950163007311, 33.5629996595055)
1475,1866,10004430,FAYETTE COUNTY JAIL,1646 NORTH JEFFERSON,LA GRANGE,TX,78945,NOT AVAILABLE,NOT AVAILABLE,COUNTY,OPEN,31,FAYETTE,48149,USA,922140,CORRECTIONAL INSTITUTIONS,"https://www.tcjs.state.tx.us/index.php?linkID=325, http://www.co.fayette.tx.us/default.aspx?Fayette_County/Sheriff.Corrections",3/1/18,IMAGERY,2018-04-26T00:00:00.000Z,http://www.co.fayette.tx.us/default.aspx?Fayette_County/Sheriff.Corrections,NOT AVAILABLE,45,0.001909196,1.79E-07,2565.757813,228.7312522,48,149,970300,48149970300,9703,Census Tract 9703,G5020,S,38097507,1465725,29.91552,-96.8852933,TX,c(-96.8800891016782, 29.9242286733935)
1476,1867,10004540,BERRIEN COUNTY JAIL,500 COUNTY FARM ROAD,NASHVILLE,GA,31639,NOT AVAILABLE,(229) 686-7664,COUNTY,OPEN,68,BERRIEN,13019,USA,922140,CORRECTIONAL INSTITUTIONS,http://www.interopweb.com/berrienjailpop/,2/22/18,IMAGERY,2018-02-22T00:00:00.000Z,http://berriencountysheriff.com/,NOT AVAILABLE,-999,0.002938746,4.93E-07,7141.304688,359.8488377,13,19,970300,13019970300,9703,Census Tract 9703,G5020,S,150782729,1060103,31.2406903,-83.2961258,GA,c(-83.2644880040574, 31.1929826209609)
1477,1868,10006613,LAKE'S CROSSING CENTER,500 GALLETTI WAY,SPARKS,NV,89431,NOT AVAILABLE,(775) 688-1900,STATE,OPEN,-999,WASHOE,32031,USA,922140,CORRECTIONAL INSTITUTIONS,http://dhhs.nv.gov/Reports/Press_Releases/2015/State_Opens_Stein_Forensic_Unit_in_Las_Vegas/,11/23/15,IMAGERY,2017-12-19T00:00:00.000Z,http://dpbh.nv.gov/Programs/ClinicalBehavioralServ/Clinical_Behavioral_Services_-_Home/,MAXIMUM,86,0.003876815,8.83E-07,14189.97656,484.151876,32,31,3101,32031003101,31.01,Census Tract 31.01,G5020,S,21477031,9695,39.5305792,-119.717487,NV,c(-119.778143851005, 39.5315420920662)
1478,1869,10003182,CHENANGO COUNTY JAIL,279 COUNTY ROAD 46,NORWICH,NY,13815,NOT AVAILABLE,NOT AVAILABLE,COUNTY,OPEN,101,CHENANGO,36017,USA,922140,CORRECTIONAL INSTITUTIONS,"https://data.ny.gov/Public-Safety/Jail-Population-By-County-Beginning-1997/nymx-kgkn/data, http://www.chenangosheriff.us/home.html",4/9/18,IMAGERY,2018-04-09T00:00:00.000Z,http://www.chenangosheriff.us/home.html,NOT AVAILABLE,133,0.010849836,4.53E-06,76083.41406,1358.207967,36,17,970601,36017970601,9706.01,Census Tract 9706.01,G5020,S,138498925,382745,42.5226347,-75.540982,NY,c(-75.5366552880784, 42.5080740602035)
1479,1870,10002882,FORT BEND COUNTY JAIL,1410 WILLIAMS WAY BLVD,RICHMOND,TX,77469,NOT AVAILABLE,(281) 341-4730,COUNTY,OPEN,929,FORT BEND,48157,USA,922140,CORRECTIONAL INSTITUTIONS,https://www.tcjs.state.tx.us/index.php?linkID=325,3/1/18,IMAGERY/OTHER,2018-04-26T00:00:00.000Z,https://www.fortbendcountytx.gov/government/departments/administration-of-justice/sheriff-s-office/bureaus-divisions/detention-division,NOT AVAILABLE,1770,0.007416829,1.96E-06,27904.85547,869.861743,48,157,674700,48157674700,6747,Census Tract 6747,G5020,S,20844131,1178725,29.573369,-95.7243066,TX,c(-95.7531902411718, 29.5735125496201)
1480,1871,10006675,CASPER REENTRY CENTER,10007 LANDMARK LANE,CASPER,WY,82604,NOT AVAILABLE,(307) 268-4840,MULTI,OPEN,249,NATRONA,56025,USA,922140,CORRECTIONAL INSTITUTIONS,http://corrections.wyo.gov/home/services-and-programs/prison-rape-elimination-act-prea,8/3/17,IMAGERY,2018-01-23T00:00:00.000Z,https://www.geogroup.com/Locations,MEDIUM,342,0.005089402,1.33E-06,22551.08594,644.6635222,56,25,1800,56025001800,18,Census Tract 18,G5020,S,10782725593,81231183,42.8993523,-106.9506987,WY,c(-106.490480501445, 42.8924722721311)
1481,1872,10006746,HAMILTON COUNTY COMMUNITY CORRECTIONS,18104 CUMBERLAND ROAD,NOBLESVILLE,IN,46060,NOT AVAILABLE,(317) 776-9760,COUNTY,OPEN,-999,HAMILTON,18057,USA,922140,CORRECTIONAL INSTITUTIONS,https://www.hamiltoncounty.in.gov/181/Community-Corrections,3/5/18,IMAGERY,2018-03-05T00:00:00.000Z,https://www.hamiltoncounty.in.gov/181/Community-Corrections,NOT AVAILABLE,115,0.005783129,6.73E-07,10900.71094,708.1182819,18,57,110600,18057110600,1106,Census Tract 1106,G5020,S,3224514,56585,40.0529469,-86.0042555,IN,c(-85.99439424815, 40.0515544380384)
1482,1873,10003129,CLINTON COUNTY JAIL,25 MCCARTHY DR,PLATTSBURGH,NY,12901,NOT AVAILABLE,NOT AVAILABLE,COUNTY,OPEN,210,CLINTON,36019,USA,922140,CORRECTIONAL INSTITUTIONS,https://www.clintoncountygov.com/sheriff,4/9/18,IMAGERY,2018-04-09T00:00:00.000Z,https://www.clintoncountygov.com/sheriff,MAXIMUM,300,0.007152238,2.42E-06,42209.82422,957.2178749,36,19,100800,36019100800,1008,Census Tract 1008,G5020,S,43113572,33156445,44.7277971,-73.3944159,NY,c(-73.4668689093912, 44.7204659591843)
1483,1874,10005642,WYOMING BOYS SCHOOL,1550 UNITED STATES HIGHWAY 20 SOUTH,WORLAND,WY,82401,NOT AVAILABLE,(307) 347-6144,STATE,OPEN,72,WASHAKIE,56043,USA,922140,CORRECTIONAL INSTITUTIONS,http://dfsweb.wyo.gov/social-services/prison-rape-elimination-act-prea,4/14/16,IMAGERY,2018-01-23T00:00:00.000Z,http://dfsweb.wyo.gov/social-services/wyoming-boys-school,JUVENILE,100,0.021495874,1.83E-05,315232.6758,2646.898017,56,43,200,56043000200,2,Census Tract 2,G5020,S,5780716345,9742603,43.8788305,-107.669052,WY,c(-108.020552354461, 43.9564692365347)
1484,1875,10006614,STEIN FORENSIC UNIT,6161 WEST CHARLESTON BLVD,LAS VEGAS,NV,89146,NOT AVAILABLE,NOT AVAILABLE,STATE,OPEN,12,CLARK,32003,USA,922140,CORRECTIONAL INSTITUTIONS,"https://www.reviewjournal.com/local/local-las-vegas/inside-nevadas-newest-facility-for-mentally-ill-offenders-photos/, http://dhhs.nv.gov/Reports/Press_Releases/2015/State_Opens_Stein_Forensic_Unit_in_Las_Vegas/",11/23/15,IMAGERY/OTHER,2017-12-19T00:00:00.000Z,http://dpbh.nv.gov/Programs/ClinicalBehavioralServ/Clinical_Behavioral_Services_-_Home/,MAXIMUM,47,0.002099365,3.25E-07,4982.367188,258.6170752,32,3,2905,32003002905,29.05,Census Tract 29.05,G5020,S,2712853,0,36.1518241,-115.2343383,NV,c(-115.226878136816, 36.1568659625941)
1485,1876,10003128,CLINTON CORRECTIONAL FACILITY - ANNEX,1074 RT. 374,DANNEMORA,NY,12929,NOT AVAILABLE,(518) 492-2511,STATE,OPEN,839,CLINTON,36019,USA,922140,CORRECTIONAL INSTITUTIONS,http://www.doccs.ny.gov/faclist.html,11/13/15,IMAGERY/OTHER,2017-12-19T00:00:00.000Z,http://www.doccs.ny.gov/faclist.html,MAXIMUM,828,0.013696347,1.08E-05,187889.2578,1740.158763,36,19,100400,36019100400,1004,Census Tract 1004,G5020,S,602736545,19886302,44.8118022,-73.864913,NY,c(-73.7171129084114, 44.7248493233338)
1486,1877,10000745,AUBURN CORRECTIONAL FACILITY,135 STATE ST,AUBURN,NY,13024,9000,(315) 253-8401,STATE,OPEN,1601,CAYUGA,36011,USA,922140,CORRECTIONAL INSTITUTIONS,http://www.doccs.ny.gov/PREA/PREA_Final_Audit_Reports.html,3/10/17,IMAGERY,2017-12-19T00:00:00.000Z,http://www.doccs.ny.gov/faclist.html,MAXIMUM,1766,0.017379847,1.01E-05,170261.1875,2101.555697,36,11,42100,36011042100,421,Census Tract 421,G5020,S,2495958,36656,42.9297297,-76.5819757,NY,c(-76.5742254488021, 42.9345885329474)
1487,1878,10000744,CAPE VINCENT CORRECTIONAL FACILITY,36560 STATE ROUTE 12E,CAPE VINCENT,NY,13618,599,(315) 654-4100,STATE,OPEN,856,JEFFERSON,36045,USA,922140,CORRECTIONAL INSTITUTIONS,http://www.doccs.ny.gov/PREA/PREA_Final_Audit_Reports.html,9/21/16,IMAGERY,2017-12-19T00:00:00.000Z,http://www.doccs.ny.gov/faclist.html,MEDIUM,882,0.022208366,2.39E-05,413955.7188,2889.691828,36,45,60200,36045060200,602,Census Tract 602,G5020,S,253283771,56747658,44.2311986,-76.0547168,NY,c(-76.1879761492496, 44.1978332148522)
1488,1879,10003131,BARE HILL CORRECTIONAL FACILITY,181 BRAND RD,MALONE,NY,12953,20,(518) 483-8411,STATE,OPEN,1424,FRANKLIN,36033,USA,922140,CORRECTIONAL INSTITUTIONS,http://www.doccs.ny.gov/PREA/PREA_Final_Audit_Reports.html,4/28/17,IMAGERY,2017-12-19T00:00:00.000Z,http://www.doccs.ny.gov/faclist.html,MEDIUM,1714,0.031681519,4.07E-05,711047.0898,4189.189093,36,33,950502,36033950502,9505.02,Census Tract 9505.02,G5020,S,114073486,1379600,44.8056453,-74.3255971,NY,c(-74.3241564885265, 44.8803640531206)
1489,1880,10002290,BEDFORD HILLS CORRECTIONAL FACILITY,247 HARRIS RD,BEDFORD HILLS,NY,10507,2400,(914) 241-3100,STATE,OPEN,823,WESTCHESTER,36119,USA,922140,CORRECTIONAL INSTITUTIONS,http://www.doccs.ny.gov/faclist.html,11/13/15,IMAGERY,2017-12-19T00:00:00.000Z,http://www.doccs.ny.gov/faclist.html,MAXIMUM,972,0.015763751,1.12E-05,185192.7891,2075.171461,36,119,983000,36119983000,9830,Census Tract 9830,G5020,S,860069,0,41.2430899,-73.6770955,NY,c(-73.6807852458899, 41.2384033813294)
1490,1881,10003127,CLINTON CORRECTIONAL FACILITY - MAIN,1156 RT. 374,DANNEMORA,NY,12929,2000,(518) 492-2511,STATE,OPEN,2652,CLINTON,36019,USA,922140,CORRECTIONAL INSTITUTIONS,http://www.doccs.ny.gov/PREA/PREA_Final_Audit_Reports.html,2/3/17,IMAGERY/OTHER,2017-12-19T00:00:00.000Z,http://www.doccs.ny.gov/faclist.html,MAXIMUM,2852,0.015373765,1.36E-05,236837.3477,1940.57863,36,19,100400,36019100400,1004,Census Tract 1004,G5020,S,602736545,19886302,44.8118022,-73.864913,NY,c(-73.7213185152457, 44.7235558800746)
1491,1882,10003199,DOWNSTATE CORRECTIONAL FACILITY,121 RED SCHOOLHOUSE ROAD,FISHKILL,NY,12524,445,(845) 831-6600,STATE,OPEN,1196,DUTCHESS,36027,USA,922140,CORRECTIONAL INSTITUTIONS,http://www.doccs.ny.gov/faclist.html,11/13/15,IMAGERY,2017-12-19T00:00:00.000Z,http://www.doccs.ny.gov/faclist.html,MAXIMUM,-999,0.020133897,1.56E-05,258769.9414,2546.783702,36,27,640001,36027640001,6400.01,Census Tract 6400.01,G5020,S,302373,0,41.5319765,-73.9459304,NY,c(-73.9455343863818, 41.5323527125783)
1492,1883,10003195,EASTERN NY CORRECTIONAL FACILITY,30 INSTITUTION RD,NAPANOCH,NY,12458,338,(845) 647-7400,STATE,OPEN,900,ULSTER,36111,USA,922140,CORRECTIONAL INSTITUTIONS,http://www.doccs.ny.gov/PREA/PREA_Final_Audit_Reports.html,10/7/16,IMAGERY,2017-12-19T00:00:00.000Z,http://www.doccs.ny.gov/faclist.html,MAXIMUM,985,0.015120473,1.25E-05,207099.8242,2018.286675,36,111,954500,36111954500,9545,Census Tract 9545,G5020,S,97022998,904455,41.719045,-74.3498504,NY,c(-74.3618269964997, 41.7415225414432)
1493,1884,10003166,COLLINS CORRECTIONAL FACILITY,"P.O. BOX 490, MIDDLE RD",COLLINS,NY,14034,490,(716) 532-4588,STATE,OPEN,1059,ERIE,36029,USA,922140,CORRECTIONAL INSTITUTIONS,http://www.doccs.ny.gov/PREA/PREA_Final_Audit_Reports.html,11/18/16,IMAGERY,2017-12-19T00:00:00.000Z,http://www.doccs.ny.gov/faclist.html,MEDIUM,1107,0.015157951,9.97E-06,167535.5469,1821.46517,36,29,16100,36029016100,161,Census Tract 161,G5020,S,3035322,11202,42.4864712,-78.9336616,NY,c(-78.938952042061, 42.491831852435)
1494,1885,10003188,COXSACKIE CORRECTIONAL FACILITY,11260 ROUTE 9 WEST,COXSACKIE,NY,12051,200,(518) 731-2781,STATE,OPEN,901,GREENE,36039,USA,922140,CORRECTIONAL INSTITUTIONS,http://www.doccs.ny.gov/PREA/PREA_Final_Audit_Reports.html,3/16/16,IMAGERY,2017-12-19T00:00:00.000Z,http://www.doccs.ny.gov/faclist.html,MAXIMUM,1006,0.017202355,1.39E-05,233372.2188,2205.006055,36,39,80800,36039080800,808,Census Tract 808,G5020,S,1634601,0,42.3457567,-73.8306412,NY,c(-73.835787619625, 42.3434320483619)
1495,1886,10003198,FISHKILL CORRECTIONAL FACILITY,18 STRACK DRIVE,BEACON,NY,12508,307,(845) 831-4800,STATE,OPEN,1635,DUTCHESS,36027,USA,922140,CORRECTIONAL INSTITUTIONS,http://www.doccs.ny.gov/PREA/PREA_Final_Audit_Reports.html,4/14/16,IMAGERY/OTHER,2017-12-19T00:00:00.000Z,http://www.doccs.ny.gov/faclist.html,MEDIUM,1840,0.026379772,2.26E-05,374354.5,3355.693527,36,27,640002,36027640002,6400.02,Census Tract 6400.02,G5020,S,2304853,13876,41.5216636,-73.9534317,NY,c(-73.9503969752636, 41.5231558948969)
1496,1887,10003132,FRANKLIN CORRECTIONAL FACILITY,62 BARE HILL RD,MALONE,NY,12953,10,(518) 483-6040,STATE,OPEN,1453,FRANKLIN,36033,USA,922140,CORRECTIONAL INSTITUTIONS,http://www.doccs.ny.gov/PREA/PREA_Final_Audit_Reports.html,2/10/17,IMAGERY,2017-12-19T00:00:00.000Z,http://www.doccs.ny.gov/faclist.html,MEDIUM,1730,0.025141311,3.35E-05,586198.2891,3358.095171,36,33,950502,36033950502,9505.02,Census Tract 9505.02,G5020,S,114073486,1379600,44.8056453,-74.3255971,NY,c(-74.3134370363682, 44.8689274580718)
1497,1888,10003122,GOUVERNEUR CORRECTIONAL FACILITY,112 SCOTCH SETTLEMENT RD,GOUVERNEUR,NY,13642,370,(315) 287-7351,STATE,OPEN,976,ST. LAWRENCE,36089,USA,922140,CORRECTIONAL INSTITUTIONS,http://www.doccs.ny.gov/PREA/PREA_Final_Audit_Reports.html,9/13/17,IMAGERY,2017-12-19T00:00:00.000Z,http://www.doccs.ny.gov/faclist.html,MEDIUM,1082,0.021255104,2.50E-05,433127.8633,2732.594054,36,89,492700,36089492700,4927,Census Tract 4927,G5020,S,184410078,2824347,44.3550917,-75.4898103,NY,c(-75.4418849922886, 44.3401893473268)
1498,1889,10003189,GREENE CORRECTIONAL FACILITY,165 PLANK RD,COXSACKIE,NY,12051,8,(518) 731-2741,STATE,OPEN,1648,GREENE,36039,USA,922140,CORRECTIONAL INSTITUTIONS,http://www.doccs.ny.gov/PREA/PREA_Final_Audit_Reports.html,4/7/17,IMAGERY,2017-12-19T00:00:00.000Z,http://www.doccs.ny.gov/faclist.html,MEDIUM,1755,0.030825177,2.58E-05,432469.25,3971.223753,36,39,80800,36039080800,808,Census Tract 808,G5020,S,1634601,0,42.3457567,-73.8306412,NY,c(-73.8222629433349, 42.3465417798981)
1499,1890,10000755,LIVINGSTON CORRECTIONAL FACILITY,7005 SONYEA RD,SONYEA,NY,14556,49,(585) 658-3710,STATE,OPEN,772,LIVINGSTON,36051,USA,922140,CORRECTIONAL INSTITUTIONS,http://www.doccs.ny.gov/PREA/PREA_Final_Audit_Reports.html,10/6/17,IMAGERY,2017-12-19T00:00:00.000Z,http://www.doccs.ny.gov/faclist.html,MEDIUM,874,0.024666899,2.68E-05,451397.2344,3444.860802,36,51,31000,36051031000,310,Census Tract 310,G5020,S,6019437,0,42.6790356,-77.8322178,NY,c(-77.823926525013, 42.687064279494)
1500,1891,10000756,GROVELAND CORRECTIONAL FACILITY,7000 SONYEA RD,SONYEA,NY,14556,50,(585) 658-2871,STATE,OPEN,1054,LIVINGSTON,36051,USA,922140,CORRECTIONAL INSTITUTIONS,http://www.doccs.ny.gov/PREA/PREA_Final_Audit_Reports.html,10/20/16,IMAGERY,2017-12-19T00:00:00.000Z,http://www.doccs.ny.gov/faclist.html,MEDIUM,1106,0.026677681,3.82E-05,643104.4414,3535.59871,36,51,31000,36051031000,310,Census Tract 310,G5020,S,6019437,0,42.6790356,-77.8322178,NY,c(-77.8367344846248, 42.6825009330641)
1501,1892,10006722,BIBB COUNTY DETENTION CENTER,645 HAZEL STREET,MACON,GA,31204,NOT AVAILABLE,(478) 621-5666,COUNTY,OPEN,-999,BIBB,13021,USA,922140,CORRECTIONAL INSTITUTIONS,http://bibbsheriff.us/,2/22/18,IMAGERY,2018-02-22T00:00:00.000Z,http://bibbsheriff.us/,NOT AVAILABLE,192,0.002471492,2.81E-07,4143.5625,289.0487968,13,21,13700,13021013700,137,Census Tract 137,G5020,S,3113580,49917,32.833841,-83.6359378,GA,c(-83.6366728985847, 32.8280365970817)
1502,1893,10000761,HUDSON CORRECTIONAL FACILITY / WORK RELEASE,50 E COURT ST,HUDSON,NY,12534,576,(518) 828-4311,STATE,OPEN,131,COLUMBIA,36021,USA,922140,CORRECTIONAL INSTITUTIONS,http://www.doccs.ny.gov/PREA/PREA_Final_Audit_Reports.html,4/5/17,IMAGERY,2017-12-19T00:00:00.000Z,http://www.doccs.ny.gov/faclist.html,MEDIUM,315,0.022059545,1.47E-05,245289.6328,2832.525954,36,21,1300,36021001300,13,Census Tract 13,G5020,S,3269352,316272,42.2473867,-73.7882806,NY,c(-73.7930983992074, 42.2445896747599)
1503,1894,10003152,MID-STATE CORRECTIONAL FACILITY,9005 OLD RIVER RD,MARCY,NY,13403,216,(315) 768-8581,STATE,OPEN,1584,ONEIDA,36065,USA,922140,CORRECTIONAL INSTITUTIONS,http://www.doccs.ny.gov/PREA/PREA_Final_Audit_Reports.html,3/4/16,IMAGERY,2017-12-19T00:00:00.000Z,http://www.doccs.ny.gov/faclist.html,MEDIUM,1716,0.029271511,2.61E-05,442895.6914,3729.050877,36,65,26600,36065026600,266,Census Tract 266,G5020,S,2598046,0,43.1632615,-75.3043813,NY,c(-75.2971092870382, 43.1687872767874)
1504,1895,10005640,WYOMING GIRLS SCHOOL,3500 BIG HORN AVENUE,SHERIDAN,WY,82801,NOT AVAILABLE,(307) 674-7476,STATE,OPEN,38,SHERIDAN,56033,USA,922140,CORRECTIONAL INSTITUTIONS,http://dfsweb.wyo.gov/social-services/prison-rape-elimination-act-prea,6/23/15,IMAGERY,2018-01-23T00:00:00.000Z,http://dfsweb.wyo.gov/social-services/wyoming-girls-school,JUVENILE,65,0.016970319,1.40E-05,244551.5195,2197.395063,56,33,600,56033000600,6,Census Tract 6,G5020,S,2463544312,3267578,44.8342288,-107.4379982,WY,c(-106.968064176715, 44.7618315356803)
1505,1896,10004506,BLECKLEY COUNTY JAIL,345 STATE HIGHWAY 87 BYPASS NORTH,COCHRAN,GA,31014,NOT AVAILABLE,(478) 934-6282,COUNTY,CLOSED,0,BLECKLEY,13023,USA,922140,CORRECTIONAL INSTITUTIONS,http://courier-herald.com/bookmark/4881617-Bleckley-sheriff-announces-county-jail-close-Local-headline,6/30/09,IMAGERY,2018-02-22T00:00:00.000Z,http://www.dcor.state.ga.us/GDC/FacilityMap/html/S_50000353.html,NOT AVAILABLE,-999,0.00305582,5.21E-07,7652.882813,369.4204431,13,23,790200,13023790200,7902,Census Tract 7902,G5020,S,152309385,2277436,32.4141232,-83.41914,GA,c(-83.3521822336835, 32.4143801143562)
1506,1897,10006795,MIDLAND COUNTY JUVENILE CARE CENTER,3712 E ASHMAN ST,MIDLAND,MI,48640,NOT AVAILABLE,(989) 837-6080,COUNTY,OPEN,-999,MIDLAND,26111,USA,922140,CORRECTIONAL INSTITUTIONS,https://co.midland.mi.us/Courts/ProbateandJuvenileCourt/JuvenileCareCenter.aspx,3/21/18,IMAGERY,2018-03-21T00:00:00.000Z,https://co.midland.mi.us/Courts/ProbateandJuvenileCourt/JuvenileCareCenter.aspx,JUVENILE,22,0.0029881,4.11E-07,7033.238281,391.5979024,26,111,290700,26111290700,2907,Census Tract 2907,G5020,S,4890099,50768,43.6170755,-84.1920233,MI,c(-84.1812134979299, 43.6256455165331)
1507,1898,10003187,COLUMBIA COUNTY JAIL,85 INDUSTRIAL TRACT,HUDSON,NY,12534,NOT AVAILABLE,NOT AVAILABLE,COUNTY,OPEN,104,COLUMBIA,36021,USA,922140,CORRECTIONAL INSTITUTIONS,"https://data.ny.gov/Public-Safety/Jail-Population-By-County-Beginning-1997/nymx-kgkn/data, http://www.columbiacountysheriff.us/",4/9/18,IMAGERY,2018-04-09T00:00:00.000Z,http://www.columbiacountysheriff.us/,MAXIMUM,135,0.005298123,1.68E-06,28155.90234,684.3514834,36,21,1100,36021001100,11,Census Tract 11,G5020,S,48192050,4868947,42.23008,-73.7955201,NY,c(-73.7556924510651, 42.2489476450732)
1508,1899,10003149,MOHAWK CORRECTIONAL FACILITY,6514 ROUTE 26,ROME,NY,13442,NOT AVAILABLE,(315) 339-5232,STATE,OPEN,1389,ONEIDA,36065,USA,922140,CORRECTIONAL INSTITUTIONS,http://www.doccs.ny.gov/PREA/PREA_Final_Audit_Reports.html,2/12/16,IMAGERY,2017-12-20T00:00:00.000Z,http://www.doccs.ny.gov/faclist.html,MEDIUM,1423,0.027395508,3.19E-05,541831.9609,3507.309706,36,65,25900,36065025900,259,Census Tract 259,G5020,S,2173458,0,43.1823069,-75.4828586,NY,c(-75.4818514376063, 43.1810417769803)
1509,1900,10004545,BRANTLEY COUNTY JAIL,95 JOHN WILSON STREET,NAHUNTA,GA,31553,NOT AVAILABLE,(912) 462-5727,COUNTY,OPEN,117,BRANTLEY,13025,USA,922140,CORRECTIONAL INSTITUTIONS,https://brantleyso.org/,2/22/18,IMAGERY,2018-02-22T00:00:00.000Z,https://brantleyso.org/,MAXIMUM,-999,0.004083281,6.14E-07,8903.347656,491.8451794,13,25,960200,13025960200,9602,Census Tract 9602,G5020,S,499794895,5148623,31.2018604,-81.9674237,GA,c(-81.9803358873255, 31.2196325841274)
1510,1901,10004483,BURKE COUNTY JAIL,225 STATE HIGHWAY 24 SOUTH,WAYNESBORO,GA,30830,NOT AVAILABLE,(706) 554-2133,COUNTY,OPEN,-999,BURKE,13033,USA,922140,CORRECTIONAL INSTITUTIONS,http://www.burkecountysheriff.com/index.cfm,2/22/18,IMAGERY,2018-02-22T00:00:00.000Z,http://www.burkecountysheriff.com/index.cfm,NOT AVAILABLE,-999,0.005151363,1.25E-06,18462.34375,631.8505211,13,33,950500,13033950500,9505,Census Tract 9505,G5020,S,371195007,2217746,33.0126673,-81.9713799,GA,c(-81.9957443001642, 33.0756122307605)
1511,1902,10003204,OTISVILLE CORRECTIONAL FACILITY,57 SANITORIUM ROAD,OTISVILLE,NY,10963,8,(845) 386-1490,STATE,OPEN,581,ORANGE,36071,USA,922140,CORRECTIONAL INSTITUTIONS,http://www.doccs.ny.gov/PREA/PREA_Final_Audit_Reports.html,10/20/17,IMAGERY,2017-12-20T00:00:00.000Z,http://www.doccs.ny.gov/faclist.html,MEDIUM,603,0.039309684,2.69E-05,444767.9297,4949.24774,36,71,11500,36071011500,115,Census Tract 115,G5020,S,65096339,937239,41.4563179,-74.5269678,NY,c(-74.5251778903044, 41.4873978770147)
1512,1903,10003209,SING SING CORRECTIONAL FACILITY,354 HUNTER ST,OSSINING,NY,10562,5442,(914) 941-0108,STATE,OPEN,1576,WESTCHESTER,36119,USA,922140,CORRECTIONAL INSTITUTIONS,http://www.doccs.ny.gov/PREA/PREA_Final_Audit_Reports.html,3/24/16,IMAGERY,2017-12-20T00:00:00.000Z,http://www.doccs.ny.gov/faclist.html,MAXIMUM,1747,0.017242726,1.60E-05,263813.2422,2191.438121,36,119,982000,36119982000,9820,Census Tract 9820,G5020,S,264916,0,41.1513369,-73.8684937,NY,c(-73.868396165393, 41.1511320698711)
1513,1904,10001420,BUTTS COUNTY JAIL,835 ERNEST BILES DR,JACKSON,GA,30233,NOT AVAILABLE,(770) 775-8216,COUNTY,OPEN,-999,BUTTS,13035,USA,922140,CORRECTIONAL INSTITUTIONS,http://www.buttscountysheriff.com/,2/22/18,IMAGERY,2018-02-22T00:00:00.000Z,http://www.buttscountysheriff.com/,MAXIMUM,320,0.004663831,1.23E-06,18272.33594,580.6630319,13,35,150200,13035150200,1502,Census Tract 1502,G5020,S,98576517,672071,33.2903551,-83.9582206,GA,c(-83.9462164450275, 33.2948642964747)
1514,1905,10003197,WALLKILL CORRECTIONAL FACILITY,50 MCKENDRICK RD,WALLKILL,NY,12589,286,(845) 895-2021,STATE,OPEN,550,ULSTER,36111,USA,922140,CORRECTIONAL INSTITUTIONS,http://www.doccs.ny.gov/PREA/PREA_Final_Audit_Reports.html,10/18/17,IMAGERY,2017-12-20T00:00:00.000Z,http://www.doccs.ny.gov/faclist.html,MEDIUM,608,0.011203724,4.32E-06,71672.96094,1445.625732,36,111,955400,36111955400,9554,Census Tract 9554,G5020,S,27577816,218627,41.6156275,-74.1664531,NY,c(-74.1625727245318, 41.6283968804301)
1515,1906,10003946,BROOKS COUNTY JAIL,1003 HOLLOWAY DRIVE,QUITMAN,GA,31643,NOT AVAILABLE,(229) 263-8153,COUNTY,OPEN,92,BROOKS,13027,USA,922140,CORRECTIONAL INSTITUTIONS,http://www.brookscountyga.us/#departments,2/22/18,IMAGERY,2018-02-22T00:00:00.000Z,http://www.brookscountyga.us/#departments,NOT AVAILABLE,-999,0.002674949,3.91E-07,5642.949219,320.6542305,13,27,960500,13027960500,9605,Census Tract 9605,G5020,S,106886083,347926,30.7769129,-83.5298134,GA,c(-83.5474869685323, 30.7874099127825)
1516,1907,10004501,BULLOCH COUNTY CORRECTIONAL INSTITUTE,17301 UNITED STATES HIGHWAY 301 NORTH,STATESBORO,GA,30458,NOT AVAILABLE,(912) 764-6217,COUNTY,OPEN,161,BULLOCH,13031,USA,922140,CORRECTIONAL INSTITUTIONS,http://www.dcor.state.ga.us/Research/Monthly,2/1/18,IMAGERY,2018-02-22T00:00:00.000Z,http://bullochcounty.net/correctional-institute/,MEDIUM,183,0.002288805,3.31E-07,4859.357422,273.7132176,13,31,110200,13031110200,1102,Census Tract 1102,G5020,S,106007059,2691045,32.5178585,-81.770269,GA,c(-81.7671706319792, 32.4668287268486)
1517,1908,10003935,CALHOUN COUNTY JAIL,28959 NORTH BERMUDA STREET,MORGAN,GA,39866,NOT AVAILABLE,(229) 849-2480,COUNTY,OPEN,-999,CALHOUN,13037,USA,922140,CORRECTIONAL INSTITUTIONS,http://www.dcor.state.ga.us/facility-finder,2/22/18,IMAGERY,2018-02-22T00:00:00.000Z,http://www.calhouncountygasheriff.com/index.htm,NOT AVAILABLE,-999,0.001197368,8.72E-08,1267.953125,143.7195697,13,37,950100,13037950100,9501,Census Tract 9501,G5020,S,480739622,7127620,31.5256326,-84.5590576,GA,c(-84.5999091348889, 31.5392025844999)
1518,1909,10004552,CAMDEN COUNTY DETENTION FACILITY,209 EAST 4TH STREET,WOODBINE,GA,31569,NOT AVAILABLE,(912) 510-5100,COUNTY,OPEN,144,CAMDEN,13039,USA,922140,CORRECTIONAL INSTITUTIONS,http://www.camdensheriff.org/,2/22/18,IMAGERY,2018-02-22T00:00:00.000Z,http://www.camdensheriff.org/,NOT AVAILABLE,153,0.003160701,3.84E-07,5554.785156,374.3103689,13,39,10200,13039010200,102,Census Tract 102,G5020,S,350600019,46235555,30.9200392,-81.6150638,GA,c(-81.7213058465889, 30.9671808975515)
1519,1910,10005163,MISSAUKEE COUNTY JAIL,110 SOUTH PINE STREET,LAKE CITY,MI,49651,NOT AVAILABLE,(231) 839-4338 EXT 2,COUNTY,OPEN,34,MISSAUKEE,26113,USA,922140,CORRECTIONAL INSTITUTIONS,http://www.michigan.gov/documents/corrections/JPIS_-_CY_2010_344047_7.pdf,2/15/16,IMAGERY/OTHER,2018-03-21T00:00:00.000Z,http://www.missaukee.org/departments/sheriff/index.html,NOT AVAILABLE,34,0.002472601,2.74E-07,4749.867188,328.0841369,26,113,960200,26113960200,9602,Census Tract 9602,G5020,S,92847008,15047269,44.3240427,-85.2687633,MI,c(-85.2130080708756, 44.3333905817593)
1520,1911,10006896,WRANGELL CORRECTIONAL CENTER,431 ZIMOVIA HIGHWAY,WRANGELL,AK,99929,NOT AVAILABLE,NOT AVAILABLE,LOCAL,OPEN,-999,WRANGELL BOROUGH,2275,USA,922140,CORRECTIONAL INSTITUTIONS,http://www.wrangell.com/publicsafety/welcome-wrangell-police-department,5/11/18,IMAGERY,2018-05-11T00:00:00.000Z,NOT AVAILABLE,NOT AVAILABLE,-999,0.002229348,2.50E-07,5614.148438,328.6731829,2,275,300,2275000300,3,Census Tract 3,G5020,S,6619997018,2384375227,56.317416,-132.343978,AK,c(-132.377690059023, 56.469473353842)
1521,1912,10006615,FINGER LAKES RESIDENTIAL CENTER,250 AUBURN ROAD,LANSING,NY,14882,NOT AVAILABLE,(607) 533-5000,STATE,OPEN,37,TOMPKINS,36109,USA,922140,CORRECTIONAL INSTITUTIONS,http://ocfs.ny.gov/main/rehab/prea.asp,6/17/15,IMAGERY,2017-12-20T00:00:00.000Z,http://ocfs.ny.gov/main/rehab/regionalListing1.asp,JUVENILE,150,0.011751984,6.97E-06,117290.5938,1620.343079,36,109,2300,36109002300,23,Census Tract 23,G5020,S,169940682,19074296,42.5786235,-76.5103607,NY,c(-76.497289265683, 42.5474220994496)
1522,1913,10006676,SAN LUIS REGIONAL DETENTION CENTER,406 N AVENUE D,SAN LUIS,AZ,85349,NOT AVAILABLE,(928) 627-2101,MULTI,OPEN,-999,YUMA,4027,USA,922140,CORRECTIONAL INSTITUTIONS,http://www.lasallecorrections.com/our-locations-table/,1/23/18,IMAGERY,2018-01-23T00:00:00.000Z,http://www.lasallecorrections.com/our-locations-table/,NOT AVAILABLE,860,0.007556344,3.23E-06,47470.37109,920.1553721,4,27,980005,4027980005,9800.05,Census Tract 9800.05,G5020,S,56315499,0,32.4621698,-114.6193818,AZ,c(-114.684959401783, 32.4845473438717)
1523,1914,10003920,CARROLL COUNTY CORRECTIONAL INSTITUTION,96 HORSLEY MILL ROAD,CARROLLTON,GA,30117,NOT AVAILABLE,(770) 830-5905,COUNTY,OPEN,249,CARROLL,13045,USA,922140,CORRECTIONAL INSTITUTIONS,"http://www.dcor.state.ga.us/Research/Monthly, http://www.carrollcountyga.com/285/Prison-Correctional-Institute",2/1/18,IMAGERY,2018-02-22T00:00:00.000Z,http://www.carrollcountyga.com/285/Prison-Correctional-Institute,MEDIUM,240,0.003494269,6.23E-07,9270.320313,422.1699711,13,45,910701,13045910701,9107.01,Census Tract 9107.01,G5020,S,65014370,477230,33.5725958,-84.9995241,GA,c(-85.0465977306082, 33.5786971145741)
1524,1915,10003731,AUTAUGA COUNTY METRO JAIL,136 NORTH COURT STREET,PRATTVILLE,AL,36067,NOT AVAILABLE,(334) 361-2600,COUNTY,OPEN,160,AUTAUGA,1001,USA,922140,CORRECTIONAL INSTITUTIONS,"https://www.autaugasheriff.org/metro-jail, http://www.autaugaco.org/Default.asp?ID=180&pg=Metro+Jail&hilite=jail",1/23/18,IMAGERY,2018-01-23T00:00:00.000Z,https://www.autaugasheriff.org/metro-jail,NOT AVAILABLE,138,0.002640278,4.08E-07,5992.882813,325.9009513,1,1,20200,1001020200,202,Census Tract 202,G5020,S,3325680,5669,32.475758,-86.4724678,AL,c(-86.4744348481756, 32.4639701238477)
1525,1916,10003749,BALDWIN COUNTY CORRECTIONS CENTER,200 HAND AVE.,BAY MINETTE,AL,36507,NOT AVAILABLE,(251) 580-2581,COUNTY,OPEN,-999,BALDWIN,1003,USA,922140,CORRECTIONAL INSTITUTIONS,http://baldwincountyal.gov/Government/a-to-z-guide/j/jail,1/23/18,IMAGERY,2018-01-23T00:00:00.000Z,http://sheriff.baldwincountyal.gov/divisions-details/correctionsdetails,NOT AVAILABLE,700,0.004435072,1.22E-06,17664.62109,532.3881489,1,3,10500,1003010500,105,Census Tract 105,G5020,S,17224861,147934,30.8969612,-87.7737368,AL,c(-87.7744277723024, 30.8850518079172)
1526,1917,10001212,BIBB COUNTY JAIL,94 BIBB LANE,BRENT,AL,35034,NOT AVAILABLE,(205) 926-9581,COUNTY,OPEN,-999,BIBB,1007,USA,922140,CORRECTIONAL INSTITUTIONS,http://bibbcosoal.org/,2/15/16,IMAGERY,2018-01-23T00:00:00.000Z,http://bibbcosoal.org/,NOT AVAILABLE,88,0.002276186,3.08E-07,4546.5,267.1941196,1,7,10004,1007010004,100.04,Census Tract 100.04,G5020,S,504192830,2208353,32.9481242,-87.2799971,AL,c(-87.1578184920517, 32.92269396813)
1527,1918,10003933,CHATTAHOOCHEE COUNTY SHERIFF,379 BROAD ST.,CUSSETA,GA,31805,NOT AVAILABLE,(706) 989-3644,COUNTY,OPEN,-999,CHATTAHOOCHEE,13053,USA,922140,CORRECTIONAL INSTITUTIONS,http://www.dcor.state.ga.us/facility-finder,2/22/18,UNVERIFIED,2018-02-22T00:00:00.000Z,NOT AVAILABLE,NOT AVAILABLE,-999,0.00177331,1.83E-07,2687.589844,211.5477003,13,53,20100,13053020100,201,Census Tract 201,G5020,S,154273471,2004242,32.2725435,-84.7487963,GA,c(-84.7765481003012, 32.3064523278554)
1528,1919,10003921,CARROLL COUNTY JAIL,1000 NEWNAN ROAD,CARROLLTON,GA,30116,NOT AVAILABLE,(770) 830-5888,COUNTY,OPEN,537,CARROLL,13045,USA,922140,CORRECTIONAL INSTITUTIONS,http://carrollsheriff.info/index.php,2/22/18,IMAGERY,2018-02-22T00:00:00.000Z,http://carrollsheriff.info/index.php,MAXIMUM,645,0.004355446,1.13E-06,16741.74219,522.6474096,13,45,910701,13045910701,9107.01,Census Tract 9107.01,G5020,S,65014370,477230,33.5725958,-84.9995241,GA,c(-85.0467988293711, 33.5687334434649)
1529,1920,10003180,CORTLAND COUNTY CORRECTIONAL FACILITY,54 GREENBUSH ST,CORTLAND,NY,13045,NOT AVAILABLE,(607) 756-3438,COUNTY,OPEN,80,CORTLAND,36023,USA,922140,CORRECTIONAL INSTITUTIONS,"https://data.ny.gov/Public-Safety/Jail-Population-By-County-Beginning-1997/nymx-kgkn/data, https://www.cortland-co.org/351/County-Sheriffs-Office",4/10/18,IMAGERY,2018-04-10T00:00:00.000Z,https://www.cortland-co.org/351/County-Sheriffs-Office,NOT AVAILABLE,90,0.002539819,2.48E-07,4178.621094,322.2789489,36,23,970600,36023970600,9706,Census Tract 9706,G5020,S,1331961,0,42.5993688,-76.1735548,NY,c(-76.1757938047481, 42.5985477857699)
1530,1921,10002143,CHATHAM COUNTY JAIL,1050 CARL GRIFFIN DR,SAVANNAH,GA,31405,NOT AVAILABLE,(912) 652-7700,COUNTY,OPEN,1739,CHATHAM,13051,USA,922140,CORRECTIONAL INSTITUTIONS,http://www.chathamsheriff.org/,2/22/18,IMAGERY,2018-02-22T00:00:00.000Z,http://www.chathamsheriff.org/,MAXIMUM,1992,0.01338327,8.11E-06,118604.2988,1602.012883,13,51,10501,13051010501,105.01,Census Tract 105.01,G5020,S,33598831,687051,32.0535751,-81.1761253,GA,c(-81.1682252543478, 32.0664153512212)
1531,1922,10001409,CHATTOOGA COUNTY JAIL / SHERIFF,35 W WASHINGTON ST,SUMMERVILLE,GA,30747,NOT AVAILABLE,(706) 857-0717,COUNTY,OPEN,-999,CHATTOOGA,13055,USA,922140,CORRECTIONAL INSTITUTIONS,http://www.chattoogasheriff.com/,2/22/18,IMAGERY,2018-02-22T00:00:00.000Z,http://www.chattoogasheriff.com/,NOT AVAILABLE,-999,0.001485875,1.38E-07,2069.40625,180.4366389,13,55,10400,13055010400,104,Census Tract 104,G5020,S,53835762,154305,34.4976401,-85.3864221,GA,c(-85.3487571892094, 34.4805941359211)
1532,1923,10004915,HANCOCK COUNTY JAIL,123 E MAIN ST,GREENFIELD,IN,46140,NOT AVAILABLE,(317) 477-1158,COUNTY,OPEN,302,HANCOCK,18059,USA,922140,CORRECTIONAL INSTITUTIONS,http://sheriffweb.hancockcoingov.org/ShfWeb2.nsf/xHome.xsp,3/5/18,IMAGERY,2018-03-05T00:00:00.000Z,http://sheriffweb.hancockcoingov.org/ShfWeb2.nsf/xHome.xsp,NOT AVAILABLE,257,0.004045655,4.20E-07,6766.296875,507.9887534,18,59,410500,18059410500,4105,Census Tract 4105,G5020,S,5375901,5093,39.7787686,-85.7690627,IN,c(-85.7671428406147, 39.7848397634767)
1533,1924,10002909,FRIO COUNTY DETENTION CENTER,502 S CEDAR ST,PEARSALL,TX,78061,NOT AVAILABLE,NOT AVAILABLE,COUNTY,OPEN,2,FRIO,48163,USA,922140,CORRECTIONAL INSTITUTIONS,"https://www.tcjs.state.tx.us/index.php?linkID=325, https://texasjailproject.org/list_of_county_jails/",3/1/18,IMAGERY/OTHER,2018-04-26T00:00:00.000Z,NOT AVAILABLE,MAXIMUM,391,0.005159598,1.29E-06,18214.66797,624.8121247,48,163,950100,48163950100,9501,Census Tract 9501,G5020,S,1426854818,1321120,28.8732381,-98.936844,TX,c(-99.0913852136424, 28.8872849697328)
1534,1925,10006255,CHEROKEE COUNTY DETENTION CENTER,110 CEDAR BLUFF RD,CENTRE,AL,35960,NOT AVAILABLE,(256) 927-6435,COUNTY,OPEN,83,CHEROKEE,1019,USA,922140,CORRECTIONAL INSTITUTIONS,"http://www.cherokeecountyalsheriff.com/roster.php, http://www.cherokeecountyalsheriff.com/page.php?id=5",1/24/18,IMAGERY/OTHER,2018-01-24T00:00:00.000Z,http://www.cherokeecountyalsheriff.com/page.php?id=5,NOT AVAILABLE,114,0.002526983,3.56E-07,5330.136719,308.2401962,1,19,956000,1019956000,9560,Census Tract 9560,G5020,S,62085184,15223218,34.1660879,-85.6541706,AL,c(-85.6779697005107, 34.1530511175148)
1535,1926,10006616,HIGHLAND RESIDENTIAL CENTER,629 NORTH CHODIKEE LAKE ROAD,HIGHLAND,NY,12528,NOT AVAILABLE,(845) 691-6006,STATE,OPEN,39,ULSTER,36111,USA,922140,CORRECTIONAL INSTITUTIONS,http://ocfs.ny.gov/main/rehab/prea.asp,6/13/17,IMAGERY,2017-12-20T00:00:00.000Z,http://ocfs.ny.gov/main/rehab/regionalListing1.asp,JUVENILE,50,0.038715786,1.69E-05,281546.8086,5416.42575,36,111,953700,36111953700,9537,Census Tract 9537,G5020,S,68842504,4220119,41.7304772,-74.0048609,NY,c(-73.982330141691, 41.7661538078747)
1536,1927,10003723,CHILTON COUNTY JAIL,301 CITY STREET,CLANTON,AL,35045,NOT AVAILABLE,(205) 755-1053,COUNTY,OPEN,-999,CHILTON,1021,USA,922140,CORRECTIONAL INSTITUTIONS,http://www.chiltoncountyso.org/corrections,1/24/18,IMAGERY,2018-01-24T00:00:00.000Z,http://www.chiltoncountyso.org/corrections,NOT AVAILABLE,180,0.003801861,9.18E-07,13540.61719,458.4233064,1,21,60101,1021060101,601.01,Census Tract 601.01,G5020,S,55899112,209294,32.8154498,-86.6415349,AL,c(-86.6255843532879, 32.836224549596)
1537,1928,10003720,JAMES C. MORGAN CHAMBERS COUNTY DETENTION FACILITY,105 ALABAMA AVENUE WEST,LAFAYETTE,AL,36862,NOT AVAILABLE,(334) 861-4336,COUNTY,OPEN,-999,CHAMBERS,1017,USA,922140,CORRECTIONAL INSTITUTIONS,http://www.chamberscountysheriff.org/jail.html,1/24/18,IMAGERY,2018-01-24T00:00:00.000Z,http://www.chamberscountysheriff.org/jail.html,NOT AVAILABLE,-999,0.004090011,8.18E-07,12078.37891,478.5135872,1,17,954000,1017954000,9540,Census Tract 9540,G5020,S,676131584,2617357,32.8660782,-85.4616055,AL,c(-85.4035793088006, 32.8993797603666)
1538,1929,10003146,INDUSTRY RESIDENTIAL CENTER,375 RUSH SCOTTSVILLE RD,RUSH,NY,14543,NOT AVAILABLE,(585) 533-2600,STATE,OPEN,42,MONROE,36055,USA,922140,CORRECTIONAL INSTITUTIONS,http://ocfs.ny.gov/main/rehab/prea.asp,8/29/17,IMAGERY,2017-12-20T00:00:00.000Z,http://ocfs.ny.gov/main/rehab/regionalListing1.asp,JUVENILE,50,0.029122069,3.64E-05,617211.0117,3903.258434,36,55,13300,36055013300,133,Census Tract 133,G5020,S,78558656,966740,42.9713291,-77.6731429,NY,c(-77.7166431847395, 42.9996429465198)
1539,1930,10003904,CHEROKEE COUNTY ADULT DETENTION CENTER,498 CHATTIN DRIVE,CANTON,GA,30115,NOT AVAILABLE,(770) 345-3308,COUNTY,OPEN,-999,CHEROKEE,13057,USA,922140,CORRECTIONAL INSTITUTIONS,http://www.cherokeega-sheriff.org/,2/22/18,IMAGERY,2018-02-22T00:00:00.000Z,http://www.cherokeega-sheriff.org/,MAXIMUM,512,0.007145482,1.66E-06,24836.75391,865.3301437,13,57,90601,13057090601,906.01,Census Tract 906.01,G5020,S,21740103,256461,34.2078484,-84.4869765,GA,c(-84.4920308653952, 34.1950553127461)
1540,1931,10003852,MONROE COUNTY INMATE DORMITORY FACILITY,7000 E DUNBAR RD,MONROE,MI,48161,NOT AVAILABLE,(734) 240-8000,COUNTY,OPEN,182,MONROE,26115,USA,922140,CORRECTIONAL INSTITUTIONS,"http://www.michigan.gov/documents/corrections/JPIS_-_CY_2010_344047_7.pdf, http://www.co.monroe.mi.us/officials_and_departments/officials/sheriff/index.php",2/15/16,IMAGERY,2018-03-21T00:00:00.000Z,http://www.co.monroe.mi.us/officials_and_departments/officials/sheriff/index.php,MINIMUM,400,0.005428057,1.31E-06,21867.69922,664.1945524,26,115,831800,26115831800,8318,Census Tract 8318,G5020,S,6638123,1710435,41.8937515,-83.3639464,MI,c(-83.3930859766981, 41.8959127240362)
1541,1932,10006401,CLEBURNE COUNTY JAIL,140 LAMBERT DR,HEFLIN,AL,36264,NOT AVAILABLE,(256) 463-7336,COUNTY,OPEN,67,CLEBURNE,1029,USA,922140,CORRECTIONAL INSTITUTIONS,http://www.cleburnecountyso.org/cur_inmates.html,1/24/18,IMAGERY,2018-01-24T00:00:00.000Z,http://www.cleburnecountyso.org/,NOT AVAILABLE,-999,0.002577551,3.35E-07,4987.613281,308.4420454,1,29,959600,1029959600,9596,Census Tract 9596,G5020,S,243826727,915596,33.6989979,-85.5727972,AL,c(-85.5692697592249, 33.6582508590336)
1542,1933,10005698,CHOCTAW COUNTY JAIL,117 SOUTH MULBERRY AVE,BUTLER,AL,36904,NOT AVAILABLE,(205) 459-2166,COUNTY,OPEN,-999,CHOCTAW,1023,USA,922140,CORRECTIONAL INSTITUTIONS,http://www.choctawso.com/,1/24/18,UNVERIFIED,2018-01-24T00:00:00.000Z,http://www.choctawso.com/,NOT AVAILABLE,-999,0.001931095,2.24E-07,3278.457031,233.8174787,1,23,956800,1023956800,9568,Census Tract 9568,G5020,S,752715861,7297622,32.0656633,-88.2128479,AL,c(-88.2228088572912, 32.0885578775633)
1543,1934,10003719,CLAY COUNTY DETENTION CENTER,41771 STATE HIGHWAY 77,ASHLAND,AL,36251,NOT AVAILABLE,(256) 354-7713,COUNTY,OPEN,-999,CLAY,1027,USA,922140,CORRECTIONAL INSTITUTIONS,http://www.clayso.net/,1/24/18,IMAGERY,2018-01-24T00:00:00.000Z,http://www.clayso.net/,NOT AVAILABLE,480,0.00318073,5.39E-07,7984.390625,386.9393888,1,27,959000,1027959000,9590,Census Tract 9590,G5020,S,179658298,1129596,33.3093759,-85.8820883,AL,c(-85.8566707468305, 33.2731534697394)
1544,1935,10005636,HARRISON COUNTY JAIL,1445 GARDNER LANE,CORYDON,IN,47112,NOT AVAILABLE,(812) 738-2195,COUNTY,OPEN,-999,HARRISON,18061,USA,922140,CORRECTIONAL INSTITUTIONS,http://www.hcsdin.net/,3/5/18,IMAGERY,2018-03-05T00:00:00.000Z,http://www.hcsdin.net/,NOT AVAILABLE,175,0.003418495,4.99E-07,7876.480469,427.5535969,18,61,60300,18061060300,603,Census Tract 603,G5020,S,168199408,547220,38.1712947,-86.2368647,IN,c(-86.143321697621, 38.2230281214614)
1545,1936,10000752,TABERG RESIDENTIAL CENTER FOR GIRLS,10011 TABERG FLORENCE RD,TABERG,NY,13471,NOT AVAILABLE,(315) 245-0084,STATE,OPEN,12,ONEIDA,36065,USA,922140,CORRECTIONAL INSTITUTIONS,http://ocfs.ny.gov/main/rehab/prea.asp,7/20/16,IMAGERY,2017-12-20T00:00:00.000Z,http://ocfs.ny.gov/main/rehab/regionalListing1.asp,JUVENILE,24,0.00977241,2.47E-06,42035.75,1283.083756,36,65,24400,36065024400,244,Census Tract 244,G5020,S,298080240,1041317,43.3876328,-75.6879515,NY,c(-75.667600380629, 43.3440265644815)
1546,1937,10003914,CLARKE COUNTY CORRECTIONAL INSTITUTION,2825 COUNTY FARM ROAD,ATHENS,GA,30601,NOT AVAILABLE,(706) 613-3400,COUNTY,OPEN,126,CLARKE,13059,USA,922140,CORRECTIONAL INSTITUTIONS,http://www.dcor.state.ga.us/Research/Monthly,6/22/16,IMAGERY,2018-02-22T00:00:00.000Z,https://www.athensclarkecounty.com/356/Corrections,MEDIUM,115,0.007687821,2.59E-06,38644.92188,956.3527411,13,59,140500,13059140500,1405,Census Tract 1405,G5020,S,21229385,213743,33.9673636,-83.3253653,GA,c(-83.3303083599963, 33.9447170279982)
1547,1938,10006677,TUSCUMBIA CITY JAIL,218 S. DICKSON STREET,TUSCUMBIA,AL,35674,NOT AVAILABLE,(256) 383-3121,LOCAL,OPEN,-999,COLBERT,1033,USA,922140,CORRECTIONAL INSTITUTIONS,http://cityoftuscumbia.org/?page_id=83,1/24/18,IMAGERY,2018-01-24T00:00:00.000Z,http://cityoftuscumbia.org/?page_id=83,NOT AVAILABLE,-999,0.001104293,5.84E-08,881.0351563,129.8317576,1,33,20500,1033020500,205,Census Tract 205,G5020,S,23612763,610520,34.7223356,-87.723752,AL,c(-87.7017721385571, 34.7305506620368)
1548,1939,10003186,DELAWARE COUNTY CORRECTIONAL FACILITY,280 PHOEBE LANE,DELHI,NY,13753,NOT AVAILABLE,(607) 832-5863,COUNTY,OPEN,87,DELAWARE,36025,USA,922140,CORRECTIONAL INSTITUTIONS,"https://data.ny.gov/Public-Safety/Jail-Population-By-County-Beginning-1997/nymx-kgkn/data, http://www.co.delaware.ny.us/departments/shrf/reports.htm",4/10/18,IMAGERY,2018-04-10T00:00:00.000Z,http://www.co.delaware.ny.us/departments/shrf/shrf.htm,NOT AVAILABLE,121,0.005192253,1.09E-06,18275.84375,671.1883095,36,25,970800,36025970800,9708,Census Tract 9708,G5020,S,165449486,1037095,42.2723546,-74.9075479,NY,c(-74.9104638906686, 42.2917029350115)
1549,1940,10004388,GAINES COUNTY JAIL,305 EAST AVENUE A,SEMINOLE,TX,79360,NOT AVAILABLE,NOT AVAILABLE,COUNTY,OPEN,38,GAINES,48165,USA,922140,CORRECTIONAL INSTITUTIONS,"https://www.tcjs.state.tx.us/index.php?linkID=325, http://www.co.gaines.tx.us/default.aspx?Gaines_County/Sheriff, http://www.newswest9.com/story/30049305/new-gaines-county-jail-complete-in-seminole",3/1/18,IMAGERY/OTHER,2018-04-26T00:00:00.000Z,NOT AVAILABLE,NOT AVAILABLE,96,0.002323617,2.88E-07,4240.496094,283.4219834,48,165,950300,48165950300,9503,Census Tract 9503,G5020,S,5989818,0,32.718716,-102.6518225,TX,c(-102.641504492706, 32.7195380504207)
1550,1941,10004919,HENDRICKS COUNTY JAIL,925 E MAIN ST,DANVILLE,IN,46122,NOT AVAILABLE,NOT AVAILABLE,COUNTY,OPEN,246,HENDRICKS,18063,USA,922140,CORRECTIONAL INSTITUTIONS,http://www.co.hendricks.in.us/department/index.php?structureid=59,3/5/18,IMAGERY,2018-03-05T00:00:00.000Z,http://www.co.hendricks.in.us/department/index.php?structureid=59,NOT AVAILABLE,-999,0.00204799,2.13E-07,3440.792969,257.6802554,18,63,210502,18063210502,2105.02,Census Tract 2105.02,G5020,S,49663379,310100,39.7398193,-86.5185986,IN,c(-86.5039868830052, 39.7585425402337)
1551,1942,10003745,CONECUH COUNTY DETENTION CENTER,104 LIBERTY STREET,EVERGREEN,AL,36401,NOT AVAILABLE,(251) 578-1260,COUNTY,OPEN,-999,CONECUH,1035,USA,922140,CORRECTIONAL INSTITUTIONS,http://www.alabamasheriffs.com/county_map/,1/24/18,IMAGERY,2018-01-24T00:00:00.000Z,http://www.alabamasheriffs.com/county_map/,NOT AVAILABLE,-999,0.002386768,2.88E-07,4189.921875,281.2040618,1,35,960500,1035960500,9605,Census Tract 9605,G5020,S,90543663,334237,31.4626914,-86.9984985,AL,c(-86.9540708626358, 31.4362135584413)
1552,1943,10002289,DUTCHESS COUNTY JAIL,150 N HAMILTON ST,POUGHKEEPSIE,NY,12601,NOT AVAILABLE,(845) 486-3900,COUNTY,OPEN,412,DUTCHESS,36027,USA,922140,CORRECTIONAL INSTITUTIONS,"http://www.criminaljustice.ny.gov/crimnet/ojsa/jail_pop_y.pdf, http://www.dutchessny.gov/CountyGov/Departments/Sheriff/SHIndex.htm",4/10/18,IMAGERY,2018-04-10T00:00:00.000Z,http://www.dutchessny.gov/CountyGov/Departments/Sheriff/SHIndex.htm,MAXIMUM,257,0.006586511,1.75E-06,29123.39844,854.5567451,36,27,220201,36027220201,2202.01,Census Tract 2202.01,G5020,S,1166323,0,41.7105131,-73.9238613,NY,c(-73.9214290887262, 41.7108367094002)
1553,1944,10006619,RED HOOK RESIDENTIAL CENTER,531 TURKEY HILL ROAD,RED HOOK,NY,12571,NOT AVAILABLE,(845) 758-4151,STATE,OPEN,7,DUTCHESS,36027,USA,922140,CORRECTIONAL INSTITUTIONS,http://ocfs.ny.gov/main/rehab/prea.asp,7/28/15,IMAGERY,2017-12-20T00:00:00.000Z,http://ocfs.ny.gov/main/rehab/regionalListing1.asp,JUVENILE,22,0.003385717,6.48E-07,10815.42969,419.6528965,36,27,150005,36027150005,1500.05,Census Tract 1500.05,G5020,S,33444875,393558,42.0032371,-73.845828,NY,c(-73.815830562062, 42.0199180610922)
1554,1945,10006617,SGT. HENRY JOHNSON YOUTH LEADERSHIP ACADEMY,57081 STATE HIGHWAY 10,SOUTH KORTRIGHT,NY,13842,NOT AVAILABLE,(607) 538-1401,STATE,OPEN,-999,DELAWARE,36025,USA,922140,CORRECTIONAL INSTITUTIONS,http://ocfs.ny.gov/main/rehab/regionalListing1.asp,12/20/17,IMAGERY,2017-12-20T00:00:00.000Z,http://ocfs.ny.gov/main/rehab/regionalListing1.asp,JUVENILE,26,0.005540211,1.32E-06,22051.38281,739.4207249,36,25,970200,36025970200,9702,Census Tract 9702,G5020,S,312229664,1025620,42.3808093,-74.8611393,NY,c(-74.7184226521354, 42.347000824456)
1555,1946,10003163,ERIE COUNTY CORRECTIONAL FACILITY,11581 WALDEN AVE,ALDEN,NY,14004,NOT AVAILABLE,(716) 858-7618,COUNTY,OPEN,606,ERIE,36029,USA,922140,CORRECTIONAL INSTITUTIONS,http://www2.erie.gov/sheriff/,4/10/18,IMAGERY,2018-04-10T00:00:00.000Z,http://www2.erie.gov/sheriff/,MEDIUM,884,0.013757344,4.39E-06,74299.66406,1700.116841,36,29,14904,36029014904,149.04,Census Tract 149.04,G5020,S,3568790,45008,42.9283887,-78.5507537,NY,c(-78.5567970468926, 42.9324585305397)
1556,1947,10006618,BRENTWOOD RESIDENTIAL CENTER,1230 COMMACK ROAD,DIX HILLS,NY,11746,8215,(631) 667-1188,STATE,OPEN,15,SUFFOLK,36103,USA,922140,CORRECTIONAL INSTITUTIONS,http://ocfs.ny.gov/main/rehab/prea.asp,7/14/16,IMAGERY,2017-12-20T00:00:00.000Z,http://ocfs.ny.gov/main/rehab/regionalListing1.asp,JUVENILE,25,0.003263504,5.59E-07,9147.515625,403.1473343,36,103,112210,36103112210,1122.1,Census Tract 1122.10,G5020,S,10865767,0,40.7935221,-73.3227356,NY,c(-73.3033566320183, 40.7888605484879)
1557,1948,10001501,ERIE COUNTY HOLDING CENTER,40 DELAWARE AVE,BUFFALO,NY,14202,NOT AVAILABLE,(716) 858-7618,COUNTY,OPEN,397,ERIE,36029,USA,922140,CORRECTIONAL INSTITUTIONS,http://www2.erie.gov/sheriff/,4/10/18,IMAGERY,2018-04-10T00:00:00.000Z,http://www2.erie.gov/sheriff/,MAXIMUM,638,0.002828379,4.10E-07,6940.511719,370.7009693,36,29,16500,36029016500,165,Census Tract 165,G5020,S,1893940,14136,42.8845969,-78.8730209,NY,c(-78.8793219751484, 42.8843850879279)
1558,1949,10006620,ELLA MCQUEEN RECEPTION CENTER FOR BOYS AND GIRLS,41 HOWARD AVENUE,BROOKLYN,NY,11221,NOT AVAILABLE,(718) 574-2060,STATE,OPEN,11,KINGS,36047,USA,922140,CORRECTIONAL INSTITUTIONS,http://ocfs.ny.gov/main/rehab/prea.asp,7/12/16,IMAGERY,2017-12-20T00:00:00.000Z,http://ocfs.ny.gov/main/rehab/regionalListing1.asp,JUVENILE,33,0.002099752,1.69E-07,2765.117188,276.2539577,36,47,37500,36047037500,375,Census Tract 375,G5020,S,158802,0,40.68762,-73.9215167,NY,c(-73.9205652305114, 40.6870412541697)
1559,1950,10000765,GOSHEN SECURE CENTER,97 CROSS RD,GOSHEN,NY,10924,NOT AVAILABLE,(845) 615-3000,STATE,OPEN,48,ORANGE,36071,USA,922140,CORRECTIONAL INSTITUTIONS,http://ocfs.ny.gov/main/rehab/prea.asp,6/7/16,IMAGERY,2017-12-20T00:00:00.000Z,http://ocfs.ny.gov/main/rehab/regionalListing1.asp,JUVENILE,85,0.00800093,3.92E-06,64723.125,989.4681666,36,71,11900,36071011900,119,Census Tract 119,G5020,S,89144286,653569,41.3828665,-74.3615366,NY,c(-74.3861949943872, 41.3655964677576)
1560,1951,10002279,ADIRONDACK WILDERNESS CHALLENGE,516 NORRISVILLE RD,SCHUYLER FALLS,NY,12985,NOT AVAILABLE,NOT AVAILABLE,STATE,CLOSED,0,CLINTON,36019,USA,922140,CORRECTIONAL INSTITUTIONS,http://www.pressrepublican.com/news/local_news/state-to-close-local-residential-youth-program/article_3206c902-d0cb-5b65-8863-6f5397047dfd.html,6/30/09,IMAGERY,2017-12-20T00:00:00.000Z,NOT AVAILABLE,JUVENILE,-999,0.001396199,9.99E-08,1738.8125,177.8932394,36,19,101700,36019101700,1017,Census Tract 1017,G5020,S,95732394,782926,44.6597454,-73.5844214,NY,c(-73.6058971455096, 44.6228941554059)
1561,1952,10003722,COOSA COUNTY JAIL,296 SCHOOL STREET,ROCKFORD,AL,35136,NOT AVAILABLE,(256) 377-2211,COUNTY,OPEN,35,COOSA,1037,USA,922140,CORRECTIONAL INSTITUTIONS,http://www.coosacountyso.org/,1/24/18,IMAGERY,2018-01-24T00:00:00.000Z,http://www.coosacountyso.org/,NOT AVAILABLE,-999,0.002183572,2.11E-07,3121.144531,265.0585427,1,37,961200,1037961200,9612,Census Tract 9612,G5020,S,649873003,14725427,32.8242614,-86.2061986,AL,c(-86.2210608119126, 32.8897557591991)
1562,1953,10002278,ADIRONDACK RESIDENTIAL CENTER,518 NORRISVILLE RD,SCHUYLER FALLS,NY,12985,NOT AVAILABLE,NOT AVAILABLE,STATE,CLOSED,0,CLINTON,36019,USA,922140,CORRECTIONAL INSTITUTIONS,https://www.governor.ny.gov/news/governor-cuomo-announces-new-addiction-treatment-facility-north-country,2/12/16,IMAGERY,2017-12-20T00:00:00.000Z,NOT AVAILABLE,JUVENILE,-999,0.001183104,8.19E-08,1425.269531,153.6013885,36,19,101700,36019101700,1017,Census Tract 1017,G5020,S,95732394,782926,44.6597454,-73.5844214,NY,c(-73.6065083533911, 44.6227294824708)
1563,1954,10003915,CLARKE COUNTY JAIL,3015 LEXINGTON ROAD,ATHENS,GA,30605,NOT AVAILABLE,(706) 613-3270,COUNTY,OPEN,413,CLARKE,13059,USA,922140,CORRECTIONAL INSTITUTIONS,https://www.athensclarkecounty.com/205/Sheriff,2/22/18,IMAGERY,2018-02-22T00:00:00.000Z,https://www.athensclarkecounty.com/205/Sheriff,NOT AVAILABLE,-999,0.008689402,3.41E-06,50944.97266,1058.929025,13,59,140500,13059140500,1405,Census Tract 1405,G5020,S,21229385,213743,33.9673636,-83.3253653,GA,c(-83.3280411870199, 33.94533124905)
1564,1955,10004470,CLAYTON COUNTY JAIL,9157 TARA BOULEVARD,JONESBORO,GA,30236,NOT AVAILABLE,(770) 477-4413,COUNTY,OPEN,236,CLAYTON,13063,USA,922140,CORRECTIONAL INSTITUTIONS,http://www.claytonsheriff.com/index.html,2/22/18,IMAGERY,2018-02-22T00:00:00.000Z,http://www.claytonsheriff.com/index.html,NOT AVAILABLE,1947,0.005895532,2.39E-06,35566.16406,705.2145755,13,63,40612,13063040612,406.12,Census Tract 406.12,G5020,S,7072864,19576,33.5209285,-84.3626158,GA,c(-84.3586395735851, 33.505218661777)
1565,1956,10006621,COLUMBIA GIRLS SECURE CENTER,419 SPOOK ROCK RD,CLAVERACK,NY,12513,NOT AVAILABLE,(518) 851-3211,STATE,OPEN,11,COLUMBIA,36021,USA,922140,CORRECTIONAL INSTITUTIONS,http://ocfs.ny.gov/main/rehab/prea.asp,6/14/17,IMAGERY,2017-12-20T00:00:00.000Z,http://ocfs.ny.gov/main/rehab/regionalListing1.asp,JUVENILE,16,0.005778303,1.51E-06,25185.83984,696.6014408,36,21,1000,36021001000,10,Census Tract 10,G5020,S,123176575,1009324,42.2188419,-73.6899142,NY,c(-73.7563708982327, 42.2134540693121)
1566,1957,10002119,CLAYTON COUNTY PRISON,11420 SLR BLVD,LOVEJOY,GA,30250,NOT AVAILABLE,(770) 473-5777,COUNTY,OPEN,237,CLAYTON,13063,USA,922140,CORRECTIONAL INSTITUTIONS,"http://www.dcor.state.ga.us/Research/Monthly, http://www.claytoncountyga.gov/departments/corrections-department/clayton-county-prison.aspx",2/1/18,IMAGERY,2018-02-22T00:00:00.000Z,http://www.claytoncountyga.gov/departments/corrections-department/clayton-county-prison.aspx,MEDIUM,242,0.005773802,2.08E-06,30895.33594,685.747185,13,63,40606,13063040606,406.06,Census Tract 406.06,G5020,S,24197568,766682,33.4677661,-84.3120126,GA,c(-84.3027074332127, 33.443120590848)
1567,1958,10004426,GILLESPIE COUNTY JAIL,1601 EAST MAIN STREET,FREDERICKSBURG,TX,78624,NOT AVAILABLE,(830) 997-7585,COUNTY,OPEN,70,GILLESPIE,48171,USA,922140,CORRECTIONAL INSTITUTIONS,"https://www.tcjs.state.tx.us/index.php?linkID=325, https://texasjailproject.org/list_of_county_jails/",3/1/18,IMAGERY,2018-04-27T00:00:00.000Z,NOT AVAILABLE,NOT AVAILABLE,96,0.004040247,5.32E-07,7630.730469,472.1639234,48,171,950400,48171950400,9504,Census Tract 9504,G5020,S,76278524,459388,30.2675065,-98.8228553,TX,c(-98.8493130442531, 30.250986744363)
1568,1959,10006622,MACCORMICK SECURE CENTER,300 SOUTH ROAD,BROOKTONDALE,NY,14817,NOT AVAILABLE,(607) 539-7121,STATE,OPEN,22,TOMPKINS,36109,USA,922140,CORRECTIONAL INSTITUTIONS,http://ocfs.ny.gov/main/rehab/prea.asp,6/6/17,IMAGERY,2017-12-20T00:00:00.000Z,http://ocfs.ny.gov/main/rehab/regionalListing1.asp,JUVENILE,39,0.006473603,2.57E-06,43040.03125,862.0425767,36,109,1900,36109001900,19,Census Tract 19,G5020,S,267413984,744646,42.3601164,-76.3770753,NY,c(-76.3189917612575, 42.3266444535177)
1569,1960,10005788,FRANKLIN COUNTY JAIL / SHERIFF,45 BARE HILL ROAD,MALONE,NY,12953,NOT AVAILABLE,NOT AVAILABLE,COUNTY,OPEN,94,FRANKLIN,36033,USA,922140,CORRECTIONAL INSTITUTIONS,http://www.criminaljustice.ny.gov/crimnet/ojsa/jail_pop_y.pdf,4/10/18,IMAGERY,2018-04-10T00:00:00.000Z,http://franklincountysheriffsoffices.us/,NOT AVAILABLE,-999,0.005533408,1.75E-06,30567.67578,735.9227033,36,33,950502,36033950502,9505.02,Census Tract 9505.02,G5020,S,114073486,1379600,44.8056453,-74.3255971,NY,c(-74.3191427481732, 44.8689203253425)
1570,1961,10000750,CENTRAL NEW YORK PSYCHIATRIC CENTER,"9005 OLD RIVER RD, PO BOX 300",MARCY,NY,13403,NOT AVAILABLE,(315) 765-3600,STATE,OPEN,-999,ONEIDA,36065,USA,922140,CORRECTIONAL INSTITUTIONS,https://www.omh.ny.gov/omhweb/facilities/cnpc/,12/21/17,IMAGERY,2017-12-21T00:00:00.000Z,https://www.omh.ny.gov/omhweb/facilities/cnpc/,MAXIMUM,220,0.011536535,6.54E-06,111193.5117,1461.713543,36,65,26600,36065026600,266,Census Tract 266,G5020,S,2598046,0,43.1632615,-75.3043813,NY,c(-75.3027757421143, 43.1672828607581)
1571,1962,10005242,HILLSIDE BIRCHVIEW JUVENILE DETENTION FACILITY,7432 COUNTY HOUSE ROAD,AUBURN,NY,13021,NOT AVAILABLE,NOT AVAILABLE,STATE,OPEN,-999,CAYUGA,36011,USA,922140,CORRECTIONAL INSTITUTIONS,https://www.hillside.com/about-us/family-agencies/regions-affiliates/hcc/,12/21/17,IMAGERY/OTHER,2017-12-21T00:00:00.000Z,https://www.hillside.com/about-us/family-agencies/regions-affiliates/hcc/,JUVENILE,40,0.004061972,7.32E-07,12398.94922,514.2786989,36,11,40600,36011040600,406,Census Tract 406,G5020,S,74642555,61548,42.9775784,-76.5183651,NY,c(-76.5385655790548, 42.9745805167647)
1572,1963,10003147,INDUSTRY SECURE CENTER,101 RYDER HILL RD,RUSH,NY,14543,NOT AVAILABLE,NOT AVAILABLE,STATE,OPEN,41,MONROE,36055,USA,922140,CORRECTIONAL INSTITUTIONS,http://newyork.webschoolpro.com/NY261701978752/about.html,11/13/15,IMAGERY,2017-12-21T00:00:00.000Z,NOT AVAILABLE,JUVENILE,-999,0.009268095,5.31E-06,90006.95313,1237.263362,36,55,13300,36055013300,133,Census Tract 133,G5020,S,78558656,966740,42.9713291,-77.6731429,NY,c(-77.7144132890314, 42.9925336113417)
1573,1964,10003213,NASSAU COUNTY MERCYFIRST-WHISTON HALL NSD,525 CONVENT RD,SYOSSET,NY,11791,NOT AVAILABLE,NOT AVAILABLE,STATE,OPEN,6,NASSAU,36059,USA,922140,CORRECTIONAL INSTITUTIONS,http://www.mercyfirst.org/,11/13/15,IMAGERY,2017-12-21T00:00:00.000Z,http://www.mercyfirst.org/,JUVENILE,-999,0.0115444,2.34E-06,38276.06641,1444.211594,36,59,518400,36059518400,5184,Census Tract 5184,G5020,S,3114568,0,40.8233116,-73.4918911,NY,c(-73.4873913924404, 40.8218378990385)
1574,1965,10001497,AUBURN RESIDENTIAL CENTER,6734 PINE RIDGE RD,AUBURN,NY,13021,NOT AVAILABLE,NOT AVAILABLE,STATE,CLOSED,0,CAYUGA,36011,USA,922140,CORRECTIONAL INSTITUTIONS,http://www.syracuse.com/news/index.ssf/2008/03/auburn_residential_center_has.html,6/30/09,IMAGERY,2017-12-21T00:00:00.000Z,NOT AVAILABLE,JUVENILE,22,0.002202356,1.73E-07,2927.832031,277.3741734,36,11,40600,36011040600,406,Census Tract 406,G5020,S,74642555,61548,42.9775784,-76.5183651,NY,c(-76.5067870217514, 42.9441268326391)
1575,1966,10003234,BAYVIEW CORRECTIONAL FACILITY,550 W 20TH ST,NEW YORK,NY,10011,NOT AVAILABLE,NOT AVAILABLE,STATE,CLOSED,0,NEW YORK,36061,USA,922140,CORRECTIONAL INSTITUTIONS,https://www.nytimes.com/2015/11/11/realestate/commercial/former-prison-for-women-to-become-a-place-that-serves-them.html,11/10/15,IMAGERY,2017-12-21T00:00:00.000Z,NOT AVAILABLE,MEDIUM,323,0.001735706,1.62E-07,2657.082031,214.8198164,36,61,9900,36061009900,99,Census Tract 99,G5020,S,1002373,1130336,40.7495435,-74.0091035,NY,c(-74.0075405633577, 40.7464260166194)
1576,1967,10002294,BROOKLYN COMMUNITY CORRECTIONAL CENTER,988 MYRTLE AVE,BROOKLYN,NY,11206,NOT AVAILABLE,(718) 574-4886,STATE,CLOSED,0,KINGS,36047,USA,922140,CORRECTIONAL INSTITUTIONS,http://www.samaritanvillage.org/where-good-lives,11/13/15,IMAGERY/OTHER,2017-12-21T00:00:00.000Z,NOT AVAILABLE,MINIMUM,-999,0.000879694,4.20E-08,686.1289063,116.8019123,36,47,28300,36047028300,283,Census Tract 283,G5020,S,121875,0,40.6952563,-73.9404379,NY,c(-73.9417791497791, 40.6960239541586)
1577,1968,10000743,CAMP GABRIELS,737 STATE HWY 86,GABRIELS,NY,12939,NOT AVAILABLE,NOT AVAILABLE,STATE,CLOSED,0,FRANKLIN,36033,USA,922140,CORRECTIONAL INSTITUTIONS,http://www.doccs.ny.gov/FactSheets/PrisonClosure09.html,11/13/15,IMAGERY,2017-12-21T00:00:00.000Z,NOT AVAILABLE,MINIMUM,336,0.012915083,1.12E-05,193886.4336,1671.636633,36,33,950800,36033950800,9508,Census Tract 9508,G5020,S,641601918,27180988,44.5201027,-74.069774,NY,c(-74.1862771843037, 44.4371789885574)
1578,1969,10006145,CAMP GEORGETOWN,3191 CRUMB HILL RD,GEORGETOWN,NY,13072,NOT AVAILABLE,NOT AVAILABLE,STATE,CLOSED,0,CHENANGO,36053,USA,922140,CORRECTIONAL INSTITUTIONS,http://www.syracuse.com/news/index.ssf/2013/05/camp_georgetown_sells_for_2410.html,5/9/13,IMAGERY,2017-12-21T00:00:00.000Z,NOT AVAILABLE,MINIMUM,262,0.016449743,1.23E-05,208194.6172,2159.271311,36,53,30800,36053030800,308,Census Tract 308,G5020,S,294809940,3273172,42.7960459,-75.729703,NY,c(-75.7823671701645, 42.7306906526831)
1579,1970,10004550,CLINCH COUNTY JAIL,115 COURT SQUARE,HOMERVILLE,GA,31634,NOT AVAILABLE,(912) 487-5316,COUNTY,OPEN,-999,CLINCH,13065,USA,922140,CORRECTIONAL INSTITUTIONS,http://www.dcor.state.ga.us/facility-finder,2/22/18,IMAGERY,2018-02-22T00:00:00.000Z,http://clinchsheriffoffice.tripod.com/,NOT AVAILABLE,-999,0.001307004,1.05E-07,1512.060547,155.8378201,13,65,970100,13065970100,9701,Census Tract 9701,G5020,S,774930042,4526537,31.0667367,-82.7730713,GA,c(-82.7488003854616, 31.0368032200718)
1580,1971,10002111,COBB COUNTY WORK RELEASE CENTER,1825 COUNTY SERVICES PKWY,MARIETTA,GA,30080,NOT AVAILABLE,(770) 499-4340,COUNTY,OPEN,115,COBB,13067,USA,922140,CORRECTIONAL INSTITUTIONS,http://www.cobbsheriff.org/,2/22/18,IMAGERY,2018-02-22T00:00:00.000Z,http://www.cobbsheriff.org/,MINIMUM,384,0.002924741,4.04E-07,6033.226563,356.3060854,13,67,30905,13067030905,309.05,Census Tract 309.05,G5020,S,6105166,27393,33.9073366,-84.5863344,GA,c(-84.5808835453619, 33.9083602199209)
1581,1972,10000746,HARRIET TUBMAN RESIDENTIAL CENTER,6706 PINE RIDGE RD,AUBURN,NY,13021,NOT AVAILABLE,NOT AVAILABLE,STATE,CLOSED,0,CAYUGA,36011,USA,922140,CORRECTIONAL INSTITUTIONS,http://correctionalnews.com/2017/09/27/harriet-tubman-residential-center-gets-new-life/,9/27/17,IMAGERY,2017-12-21T00:00:00.000Z,NOT AVAILABLE,JUVENILE,25,0.002988874,2.78E-07,4706.9375,376.7728465,36,11,40600,36011040600,406,Census Tract 406,G5020,S,74642555,61548,42.9775784,-76.5183651,NY,c(-76.5037043476796, 42.9457206403471)
1582,1973,10003206,MID-ORANGE CORRECTIONAL FACILITY,900 KINGS HWY,WARWICK,NY,10990,NOT AVAILABLE,(315) 768-8581,STATE,CLOSED,0,ORANGE,36071,USA,922140,CORRECTIONAL INSTITUTIONS,https://www.csmonitor.com/USA/Justice/2016/0101/When-a-prison-closes-what-happens-to-the-prison-town,1/1/16,IMAGERY,2017-12-21T00:00:00.000Z,NOT AVAILABLE,MEDIUM,750,0.01982319,1.62E-05,267337.1719,2435.721923,36,71,14700,36071014700,147,Census Tract 147,G5020,S,30855754,765122,41.2796965,-74.2905283,NY,c(-74.2995355401877, 41.276942946937)
1583,1974,10003184,MONTEREY SHOCK INCARCERATION CORRECTIONAL FACILITY,2150 EVERGREEN HILL RD,BEAVER DAMS,NY,14812,NOT AVAILABLE,NOT AVAILABLE,STATE,CLOSED,0,SCHUYLER,36097,USA,922140,CORRECTIONAL INSTITUTIONS,http://www.doccs.ny.gov/PressRel/2013/Prison_Closure_Announcement.html,7/26/13,IMAGERY,2017-12-21T00:00:00.000Z,NOT AVAILABLE,MINIMUM,300,0.008579114,2.45E-06,41047.30078,1139.612633,36,97,950300,36097950300,9503,Census Tract 9503,G5020,S,236633985,7035659,42.3748912,-77.0350237,NY,c(-77.0169924595584, 42.336979087414)
1584,1975,10003153,MT. MCGREGOR CORRECTIONAL FACILITY,1000 MT. MCGREGOR RD,WILTON,NY,12831,NOT AVAILABLE,NOT AVAILABLE,STATE,CLOSED,0,SARATOGA,36091,USA,922140,CORRECTIONAL INSTITUTIONS,http://www.doccs.ny.gov/PressRel/2013/Prison_Closure_Announcement.html,7/26/13,IMAGERY,2017-12-21T00:00:00.000Z,NOT AVAILABLE,MEDIUM,544,0.01716548,6.14E-06,104366.5234,2238.359238,36,91,60101,36091060101,601.01,Census Tract 601.01,G5020,S,84649566,2499191,43.2389775,-73.6671447,NY,c(-73.7473910012279, 43.2014828700048)
1585,1976,10003150,ONEIDA CORRECTIONAL FACILITY,6100 SCHOOL RD,ROME,NY,13340,NOT AVAILABLE,NOT AVAILABLE,STATE,CLOSED,0,ONEIDA,36065,USA,922140,CORRECTIONAL INSTITUTIONS,http://www.doccs.ny.gov/RulesRegs/20120801_CCS-20-12-00004.html,4/27/12,IMAGERY,2017-12-21T00:00:00.000Z,NOT AVAILABLE,MEDIUM,1200,0.021040336,2.08E-05,353197.375,2664.387127,36,65,25900,36065025900,259,Census Tract 259,G5020,S,2173458,0,43.1823069,-75.4828586,NY,c(-75.4838593538244, 43.1846102529403)
1586,1977,10003177,SUMMIT SHOCK INCARCERATION CORRECTIONAL FACILITY,137 EAGLE HEIGHTS RD,SUMMIT,NY,12175,NOT AVAILABLE,NOT AVAILABLE,STATE,CLOSED,0,SCHOHARIE,36095,USA,922140,CORRECTIONAL INSTITUTIONS,http://www.doccs.ny.gov/RulesRegs/20120801_CCS-20-12-00004.html,4/27/12,IMAGERY,2017-12-21T00:00:00.000Z,NOT AVAILABLE,MINIMUM,-999,0.008740452,3.50E-06,58860.60938,1111.220039,36,95,740600,36095740600,7406,Census Tract 7406,G5020,S,368179660,1683284,42.5266583,-74.5073423,NY,c(-74.5369104394623, 42.5643173353815)
1587,1978,10006678,ROBERT E. LEWIS RESIDENTIAL TREATMENT ACADEMY,4629 MCCLELLAN BLVD,ANNISTON,AL,36204,NOT AVAILABLE,(256) 236-7190,STATE,OPEN,20,CALHOUN,1015,USA,922140,CORRECTIONAL INSTITUTIONS,http://cvys.net/index.html,8/15/16,IMAGERY/OTHER,2018-01-24T00:00:00.000Z,http://cvys.net/index.html,JUVENILE,30,0.00141098,8.86E-08,1319.738281,171.779719,1,15,700,1015000700,7,Census Tract 7,G5020,S,45784584,107461,33.7077538,-85.7919352,AL,c(-85.8208805888201, 33.7062204543008)
1588,1979,10004548,COLQUITT COUNTY CORRECTIONAL INSTITUTION,200 SOUTH VANDENBERG DRIVE,MOULTRIE,GA,31768,NOT AVAILABLE,(229) 616-7490,COUNTY,OPEN,191,COLQUITT,13071,USA,922140,CORRECTIONAL INSTITUTIONS,"http://www.dcor.state.ga.us/Research/Monthly, http://www.ccboc.com/departments/county_prison.php",2/1/18,IMAGERY,2018-02-22T00:00:00.000Z,http://www.ccboc.com/departments/county_prison.php,MEDIUM,190,0.006621113,1.99E-06,28739.97656,789.5054417,13,71,970600,13071970600,9706,Census Tract 9706,G5020,S,205733792,3364049,31.0873618,-83.7537116,GA,c(-83.7078659413251, 31.1297308183944)
1589,1980,10006747,HENDRICKS COUNTY WORK RELEASE FACILITY,200 E CAMPUS BLVD,DANVILLE,IN,46122,NOT AVAILABLE,(317) 745-8700,COUNTY,OPEN,-999,HENDRICKS,18063,USA,922140,CORRECTIONAL INSTITUTIONS,http://www.co.hendricks.in.us/department/index.php?structureid=31,3/5/18,IMAGERY,2018-03-05T00:00:00.000Z,http://www.co.hendricks.in.us/department/index.php?structureid=31,NOT AVAILABLE,-999,0.002353531,3.14E-07,5063.488281,299.214173,18,63,210502,18063210502,2105.02,Census Tract 2105.02,G5020,S,49663379,310100,39.7398193,-86.5185986,IN,c(-86.5026586203489, 39.7574195384162)
1590,1981,10006796,MONROE COUNTY YOUTH CENTER,3600 S CUSTER ROAD,MONROE,MI,48161,NOT AVAILABLE,(734) 240-3220,COUNTY,OPEN,-999,MONROE,26115,USA,922140,CORRECTIONAL INSTITUTIONS,http://www.co.monroe.mi.us/officials_and_departments/departments/youth_center/index.php,3/21/18,IMAGERY,2018-03-21T00:00:00.000Z,http://www.co.monroe.mi.us/officials_and_departments/departments/youth_center/index.php,JUVENILE,45,0.003473169,4.03E-07,6714.960938,442.9218218,26,115,832400,26115832400,8324,Census Tract 8324,G5020,S,20789848,84193,41.8955237,-83.4498432,MI,c(-83.4587162453199, 41.9320766773761)
1591,1982,10003161,GENESEE COUNTY JAIL,14 W MAIN ST,BATAVIA,NY,14021,NOT AVAILABLE,(585) 343-0838,COUNTY,OPEN,78,GENESEE,36037,USA,922140,CORRECTIONAL INSTITUTIONS,"http://www.criminaljustice.ny.gov/crimnet/ojsa/jail_pop_y.pdf, http://co.genesee.ny.us/departments/sheriff/index.php",4/10/18,IMAGERY,2018-04-10T00:00:00.000Z,http://co.genesee.ny.us/departments/sheriff/index.php,NOT AVAILABLE,87,0.001949834,1.50E-07,2536.503906,255.5887615,36,37,950600,36037950600,9506,Census Tract 9506,G5020,S,1592901,0,43.0066396,-78.186868,NY,c(-78.1880641995526, 42.9988277013485)
1592,1983,10003405,BELMONT CAMP,68518 BANNOCK RD,ST. CLAIRSVILLE,OH,43950,NOT AVAILABLE,(740) 695-5169,STATE,OPEN,491,BELMONT,39013,USA,922140,CORRECTIONAL INSTITUTIONS,http://www.drc.ohio.gov/reports/population,12/4/17,IMAGERY,2017-12-21T00:00:00.000Z,http://www.drc.ohio.gov/institutions,MINIMUM,-999,0.005743211,2.35E-06,37982.28906,720.7516741,39,13,12200,39013012200,122,Census Tract 122,G5020,S,94456870,771202,40.0380398,-80.9247267,OH,c(-80.9770134817346, 40.0817524445723)
1593,1984,10002428,BELMONT CORRECTIONAL INSTITUTION,68518 BANNOCK RD,ST. CLAIRSVILLE,OH,43950,NOT AVAILABLE,(740) 695-5169,STATE,OPEN,2209,BELMONT,39013,USA,922140,CORRECTIONAL INSTITUTIONS,http://www.drc.ohio.gov/reports/population,12/4/17,IMAGERY,2017-12-21T00:00:00.000Z,http://www.drc.ohio.gov/institutions,CLOSE,-999,0.016199016,1.62E-05,262699.5938,2049.448409,39,13,12200,39013012200,122,Census Tract 122,G5020,S,94456870,771202,40.0380398,-80.9247267,OH,c(-80.9765990727186, 40.0850310950816)
1594,1985,10004547,COLQUITT COUNTY JAIL,200 VETERANS PARKWAY NORTH,MOULTRIE,GA,31776,NOT AVAILABLE,(229) 616-7430,COUNTY,OPEN,37,COLQUITT,13071,USA,922140,CORRECTIONAL INSTITUTIONS,http://www.ccboc.com/departments/sheriff/index.php,2/22/18,IMAGERY,2018-02-22T00:00:00.000Z,http://www.ccboc.com/departments/sheriff/index.php,NOT AVAILABLE,-999,0.006298339,1.74E-06,25160.20508,771.8464518,13,71,970400,13071970400,9704,Census Tract 9704,G5020,S,74463951,1021793,31.2017275,-83.7008836,GA,c(-83.7609344058939, 31.1822943779828)
1595,1986,10004912,HENRY COUNTY JAIL,127 N 12TH ST,NEW CASTLE,IN,47362,NOT AVAILABLE,(765) 521-7032,COUNTY,OPEN,-999,HENRY,18065,USA,922140,CORRECTIONAL INSTITUTIONS,http://www.henryco.org/index.html,3/5/18,IMAGERY,2018-03-05T00:00:00.000Z,http://www.henryco.org/index.html,NOT AVAILABLE,130,0.002210509,2.07E-07,3348.105469,270.7125945,18,65,976000,18065976000,9760,Census Tract 9760,G5020,S,3023730,5038,39.9304668,-85.375604,IN,c(-85.3722811005036, 39.9320710231595)
1596,1987,10002432,CHILLICOTHE CORRECTIONAL INSTITUTION / RTU,15802 STATE ROUTE N 104,CHILLICOTHE,OH,45601,NOT AVAILABLE,(740) 774-7080,STATE,OPEN,2715,ROSS,39141,USA,922140,CORRECTIONAL INSTITUTIONS,http://www.drc.ohio.gov/reports/population,12/4/17,IMAGERY,2017-12-21T00:00:00.000Z,http://www.drc.ohio.gov/institutions,CLOSE,2895,0.027519858,3.12E-05,499999.4297,3586.928233,39,141,955602,39141955602,9556.02,Census Tract 9556.02,G5020,S,6377097,173187,39.3673874,-83.0023887,OH,c(-83.0018289145024, 39.3691527811847)
1597,1988,10005621,HENRY COUNTY JAIL ANNEX,1124 BROAD STREET,NEW CASTLE,IN,47362,NOT AVAILABLE,(765) 521-7032,COUNTY,NOT AVAILABLE,-999,HENRY,18065,USA,922140,CORRECTIONAL INSTITUTIONS,http://www.henryco.org/jail-annex.html,2/15/16,IMAGERY,2018-03-05T00:00:00.000Z,http://www.henryco.org/jail-annex.html,NOT AVAILABLE,150,0.001398862,9.94E-08,1605.875,189.6365325,18,65,976000,18065976000,9760,Census Tract 9760,G5020,S,3023730,5038,39.9304668,-85.375604,IN,c(-85.3719798547748, 39.931531629586)
1598,1989,10003827,MONTCALM COUNTY JAIL,649 N STATE ST,STANTON,MI,48888,NOT AVAILABLE,(989) 831-7592,COUNTY,OPEN,-999,MONTCALM,26117,USA,922140,CORRECTIONAL INSTITUTIONS,http://www.montcalm.us/government/sheriff/index.php,3/21/18,IMAGERY,2018-03-21T00:00:00.000Z,http://www.montcalm.us/government/sheriff/index.php,NOT AVAILABLE,205,0.006079629,6.75E-07,11500.86328,795.3178874,26,117,970800,26117970800,9708,Census Tract 9708,G5020,S,93552601,3364441,43.2578089,-85.097903,MI,c(-85.0863959478796, 43.3018320663392)
1599,1990,10004466,COLUMBIA COUNTY JAIL,2273 COUNTY CAMP ROAD,APPLING,GA,30802,NOT AVAILABLE,(706) 541-3920,COUNTY,OPEN,336,COLUMBIA,13073,USA,922140,CORRECTIONAL INSTITUTIONS,http://www.columbiacountyso.org/sheriff-s-office,2/22/18,IMAGERY,2018-02-22T00:00:00.000Z,http://www.columbiacountyso.org/sheriff-s-office,CLOSE,338,0.007077409,2.37E-06,35180.46484,857.3598851,13,73,30402,13073030402,304.02,Census Tract 304.02,G5020,S,215748852,213312,33.5560587,-82.3159264,GA,c(-82.3071107112578, 33.5356900805231)
1600,1991,10002718,GRAYSON COUNTY DETENTION CENTER,200 S CROCKETT ST,SHERMAN,TX,75090,NOT AVAILABLE,(903) 893-4388,COUNTY,OPEN,354,GRAYSON,48181,USA,922140,CORRECTIONAL INSTITUTIONS,"https://www.tcjs.state.tx.us/index.php?linkID=325, https://texasjailproject.org/list_of_county_jails/",3/1/18,IMAGERY,2018-04-27T00:00:00.000Z,http://www.co.grayson.tx.us/page/gcso.home,NOT AVAILABLE,487,0.005234096,1.04E-06,15538.75391,651.73672,48,181,2000,48181002000,20,Census Tract 20,G5020,S,4050524,0,33.6365446,-96.6056726,TX,c(-96.6104947574143, 33.6344190437849)
1601,1992,10006679,COOSA VALLEY YOUTH SERVICES - ATTENTION HOME,4621 MCCLELLAN BLVD,ANNISTON,AL,36204,NOT AVAILABLE,(256) 236-5437,STATE,OPEN,14,CALHOUN,1015,USA,922140,CORRECTIONAL INSTITUTIONS,http://cvys.net/index.html,8/15/16,IMAGERY/OTHER,2018-01-24T00:00:00.000Z,http://cvys.net/index.html,JUVENILE,14,0.001353673,6.91E-08,1029.605469,163.2815367,1,15,700,1015000700,7,Census Tract 7,G5020,S,45784584,107461,33.7077538,-85.7919352,AL,c(-85.8209096735542, 33.704510931445)
1602,1993,10005241,HERKIMER COUNTY JAIL,320 NORTH MAIN STREET,HERKIMER,NY,13350,NOT AVAILABLE,(315) 867-1252,COUNTY,OPEN,31,HERKIMER,36043,USA,922140,CORRECTIONAL INSTITUTIONS,"http://www.criminaljustice.ny.gov/crimnet/ojsa/jail_pop_y.pdf, http://herkimercounty.org/content/Departments/View/27",4/10/18,IMAGERY,2018-04-10T00:00:00.000Z,NOT AVAILABLE,NOT AVAILABLE,-999,0.003700549,3.82E-07,6473.175781,475.3725349,36,43,11200,36043011200,112,Census Tract 112,G5020,S,25719518,427730,43.0456953,-75.0278155,NY,c(-74.9879619860046, 43.0290725184045)
1603,1994,10003424,CORRECTIONAL RECEPTION CENTER,11271 STATE ROUTE 762,ORIENT,OH,43146,NOT AVAILABLE,(614) 877-2441,STATE,OPEN,1656,PICKAWAY,39129,USA,922140,CORRECTIONAL INSTITUTIONS,http://www.drc.ohio.gov/reports/population,12/4/17,IMAGERY,2017-12-21T00:00:00.000Z,http://www.drc.ohio.gov/institutions,MAXIMUM,-999,0.018487396,1.84E-05,296476.4766,2209.386733,39,129,21300,39129021300,213,Census Tract 213,G5020,S,5147772,167257,39.7949776,-83.1481965,OH,c(-83.1492565397677, 39.8001804323076)
1604,1995,10003356,GRAFTON REINTEGRATION CENTER,2000 S AVON-BELDEN RD,GRAFTON,OH,44044,NOT AVAILABLE,(440) 748-1161,STATE,OPEN,661,LORAIN,39093,USA,922140,CORRECTIONAL INSTITUTIONS,"http://www.drc.ohio.gov/reports/population, http://www.drc.ohio.gov/prea",12/4/17,IMAGERY,2017-12-21T00:00:00.000Z,NOT AVAILABLE,MEDIUM,-999,0.015180403,1.44E-05,237040.6797,1965.93458,39,93,95100,39093095100,951,Census Tract 951,G5020,S,72918208,297370,41.2499039,-82.0285866,OH,c(-82.0251891114421, 41.2831540728437)
1605,1996,10003412,FRANKLIN MEDICAL CENTER (ZONE A),1990 HARMON AVE,COLUMBUS,OH,43223,NOT AVAILABLE,(614) 445-5960,STATE,OPEN,598,FRANKLIN,39049,USA,922140,CORRECTIONAL INSTITUTIONS,http://www.drc.ohio.gov/reports/population,12/4/17,IMAGERY,2017-12-21T00:00:00.000Z,http://www.drc.ohio.gov/institutions,NOT AVAILABLE,-999,0.005379479,1.97E-06,31772.41406,686.7970876,39,49,8340,39049008340,83.4,Census Tract 83.40,G5020,S,8188094,430198,39.9247568,-83.0331914,OH,c(-83.0149081895452, 39.9205536687148)
1606,1997,10003357,GRAFTON CORRECTIONAL INSTITUTION,2500 S AVON BELDEN RD,GRAFTON,OH,44044,NOT AVAILABLE,(440) 748-1161,STATE,OPEN,1141,LORAIN,39093,USA,922140,CORRECTIONAL INSTITUTIONS,"http://www.drc.ohio.gov/reports/population, http://www.drc.ohio.gov/prea",12/4/17,IMAGERY,2017-12-21T00:00:00.000Z,http://www.drc.ohio.gov/institutions,CLOSE,1234,0.014986581,1.53E-05,252246.418,1985.017639,39,93,95100,39093095100,951,Census Tract 951,G5020,S,72918208,297370,41.2499039,-82.0285866,OH,c(-82.0293875342925, 41.2782092122397)
1607,1998,10006400,COVINGTON COUNTY JAIL,290 HILLCREST DRIVE,ANDALUSIA,AL,36420,NOT AVAILABLE,(334) 428-2640,COUNTY,OPEN,-999,COVINGTON,1039,USA,922140,CORRECTIONAL INSTITUTIONS,http://www.covcounty.com/county-jail,1/24/18,IMAGERY,2018-01-24T00:00:00.000Z,http://www.covcounty.com/county-jail,NOT AVAILABLE,-999,0.003621393,6.58E-07,9544.085938,436.420331,1,39,962100,1039962100,9621,Census Tract 9621,G5020,S,15429743,163537,31.326445,-86.507274,AL,c(-86.5029995537076, 31.3122413464869)
1608,1999,10003433,LEBANON CORRECTIONAL INSTITUTION,3791 STATE ROUTE 63,LEBANON,OH,45036,NOT AVAILABLE,(513) 932-1211,STATE,OPEN,2344,WARREN,39165,USA,922140,CORRECTIONAL INSTITUTIONS,http://www.drc.ohio.gov/reports/population,12/4/17,IMAGERY,2017-12-21T00:00:00.000Z,http://www.drc.ohio.gov/institutions,MAXIMUM,-999,0.016071984,1.56E-05,249905.2539,2003.692905,39,165,31700,39165031700,317,Census Tract 317,G5020,S,7768069,823,39.4372809,-84.3038189,OH,c(-84.2996446717391, 39.4329903776112)
1609,2000,10004546,COOK COUNTY JAIL / SHERIFF,1000 COUNTY FARM ROAD,ADEL,GA,31620,NOT AVAILABLE,(229) 896-7471,COUNTY,OPEN,114,COOK,13075,USA,922140,CORRECTIONAL INSTITUTIONS,http://www.cookcogasheriff.com/index.shtml,2/22/18,IMAGERY,2018-02-22T00:00:00.000Z,http://www.cookcogasheriff.com/index.shtml,NOT AVAILABLE,-999,0.003182598,5.82E-07,8430.570313,380.3023091,13,75,960200,13075960200,9602,Census Tract 9602,G5020,S,124869662,3139592,31.1630441,-83.4829405,GA,c(-83.4379968687808, 31.1252795418556)
1610,1210,10003603,JAMES RIVER CORRECTIONAL CENTER,2521 CIRCLE DR,JAMESTOWN,ND,58401,NOT AVAILABLE,(701) 253-3660,STATE,OPEN,439,STUTSMAN,38093,USA,922140,CORRECTIONAL INSTITUTIONS,"http://www.nd.gov/docr/media/stats.html, http://www.nd.gov/docr/adult/",12/31/16,IMAGERY,2017-12-13T00:00:00.000Z,http://www.nd.gov/docr/adult/,MAXIMUM,424,0.014342118,6.70E-06,121448.0313,1899.160479,38,93,967300,38093967300,9673,Census Tract 9673,G5020,S,22396407,0,46.9174162,-98.6722581,ND,c(-98.6850704567864, 46.8832292460769)
1611,1211,10001548,MARYLAND CORRECTIONAL INSTITUTION - HAGERSTOWN,18601 ROXBURY RD,HAGERSTOWN,MD,21746,NOT AVAILABLE,(240) 420-1000,STATE,OPEN,1913,WASHINGTON,24043,USA,922140,CORRECTIONAL INSTITUTIONS,http://dpscs.maryland.gov/publicinfo/publications/annuals.shtml#doc,6/30/16,IMAGERY/OTHER,2017-12-05T00:00:00.000Z,http://www.dpscs.maryland.gov/locations/prisons.shtml,MEDIUM,1800,0.019419137,1.71E-05,274088.8672,2428.714336,24,43,11000,24043011000,110,Census Tract 110,G5020,S,4425974,0,39.5596859,-77.7147954,MD,c(-77.7225431696353, 39.5609503237705)
1612,1212,10001560,MARYLAND CORRECTIONAL INSTITUTION - JESSUP,"P O BOX 549, HOUSE OF CORRECTION RD",JESSUP,MD,20794,NOT AVAILABLE,(410) 799-7610,STATE,OPEN,997,ANNE ARUNDEL,24003,USA,922140,CORRECTIONAL INSTITUTIONS,http://dpscs.maryland.gov/publicinfo/publications/annuals.shtml#doc,6/30/16,IMAGERY/OTHER,2017-12-05T00:00:00.000Z,http://www.dpscs.maryland.gov/locations/prisons.shtml,MEDIUM,1038,0.011909503,8.72E-06,139266.3594,1483.691201,24,3,740400,24003740400,7404,Census Tract 7404,G5020,S,2705357,0,39.1354606,-76.7778306,MD,c(-76.7728627380724, 39.1410030289785)
1613,1213,10003453,MILL CREEK YOUTH CENTER,790 W 12TH ST,OGDEN,UT,84404,NOT AVAILABLE,(801) 334-0210,STATE,OPEN,32,WEBER,49057,USA,922140,CORRECTIONAL INSTITUTIONS,https://jjs.utah.gov/research-reports,1/17/18,IMAGERY,2018-01-17T00:00:00.000Z,https://jjs.utah.gov/research-reports-2,JUVENILE,58,0.007870721,2.66E-06,43798.10156,1021.255267,49,57,200300,49057200300,2003,Census Tract 2003,G5020,S,10602671,0,41.2611528,-111.9931474,UT,c(-111.998205956973, 41.2482602059772)
1614,1214,10001701,WASATCH YOUTH CENTER,3534 S 700 W,SALT LAKE CITY,UT,84119,NOT AVAILABLE,(801) 265-5830,STATE,OPEN,22,SALT LAKE,49035,USA,922140,CORRECTIONAL INSTITUTIONS,https://jjs.utah.gov/research-reports,1/17/18,IMAGERY,2018-01-17T00:00:00.000Z,https://jjs.utah.gov/research-reports-2,JUVENILE,46,0.00725379,1.56E-06,25424.44531,896.9989555,49,35,111600,49035111600,1116,Census Tract 1116,G5020,S,6781146,0,40.6921706,-111.9033505,UT,c(-111.912974019644, 40.6941432412416)
1615,1215,10006718,PUEBLO COUNTY WORK RELEASE FACILITY,"1600 WEST 24TH STREET, BUILDING 106",PUEBLO,CO,81003,NOT AVAILABLE,NOT AVAILABLE,COUNTY,OPEN,-999,PUEBLO,8101,USA,922140,CORRECTIONAL INSTITUTIONS,https://www.sheriff.co.pueblo.co.us/index.html,2/20/18,UNVERIFIED,2018-02-20T00:00:00.000Z,https://www.sheriff.co.pueblo.co.us/index.html,NOT AVAILABLE,80,0.003097285,4.18E-07,6599.519531,376.9972229,8,101,300,8101000300,3,Census Tract 3,G5020,S,1226785,0,38.2864927,-104.629568,CO,c(-104.63352385049, 38.2895375275886)
1616,1216,10003447,CACHE VALLEY YOUTH CENTER,2051 N 600 W,LOGAN,UT,84321,NOT AVAILABLE,(435) 713-6260,STATE,OPEN,7,CACHE,49005,USA,922140,CORRECTIONAL INSTITUTIONS,https://jjs.utah.gov/research-reports,1/17/18,IMAGERY,2018-01-17T00:00:00.000Z,https://jjs.utah.gov/research-reports-2,JUVENILE,16,0.004841,5.02E-07,8340.417969,628.2932097,49,5,300,49005000300,3,Census Tract 3,G5020,S,256385096,15677206,41.8218418,-111.9791309,UT,c(-111.850355018112, 41.7703125284875)
1617,1217,10003461,SALT LAKE VALLEY DETENTION CENTER / GENESIS YOUTH CENTER,3450 S 900 W,SALT LAKE CITY,UT,84119,NOT AVAILABLE,(801) 261-5100,STATE,OPEN,79,SALT LAKE,49035,USA,922140,CORRECTIONAL INSTITUTIONS,https://jjs.utah.gov/research-reports,1/17/18,IMAGERY,2018-01-17T00:00:00.000Z,https://jjs.utah.gov/research-reports-2,JUVENILE,112,0.006228247,1.20E-06,19612.87109,779.4979039,49,35,111600,49035111600,1116,Census Tract 1116,G5020,S,6781146,0,40.6921706,-111.9033505,UT,c(-111.9183853064, 40.6957508581719)
1618,1218,10001699,WEBER VALLEY YOUTH DETENTION CENTER,5470 S 2700 W,ROY,UT,84067,NOT AVAILABLE,(801) 825-2794,STATE,OPEN,17,WEBER,49057,USA,922140,CORRECTIONAL INSTITUTIONS,https://jjs.utah.gov/research-reports,1/17/18,IMAGERY,2018-01-17T00:00:00.000Z,https://jjs.utah.gov/research-reports-2,JUVENILE,24,0.003741705,3.54E-07,5831.125,468.0983206,49,57,210703,49057210703,2107.03,Census Tract 2107.03,G5020,S,1544988,0,41.1684391,-112.0489915,UT,c(-112.044270622681, 41.1643673548374)
1619,1219,10004722,RICHLAND COUNTY JAIL,211 WEST MARKET STREET,OLNEY,IL,62450,NOT AVAILABLE,(618) 395-7483,COUNTY,OPEN,22,RICHLAND,17159,USA,922140,CORRECTIONAL INSTITUTIONS,http://www.richlandcso.com/default.htm,3/2/18,IMAGERY,2018-03-02T00:00:00.000Z,http://www.richlandcso.com/default.htm,NOT AVAILABLE,60,0.001824945,1.67E-07,2656.417969,223.3312891,17,159,978200,17159978200,9782,Census Tract 9782,G5020,S,3826929,0,38.7242524,-88.0731832,IL,c(-88.0856287667504, 38.7300396325486)
1620,1220,10001881,SOUTHWESTERN REGIONAL JAIL,1300 GASTON CAPERTON DR,HOLDEN,WV,25625,NOT AVAILABLE,(304) 239-3032,COUNTY,OPEN,400,LOGAN,54045,USA,922140,CORRECTIONAL INSTITUTIONS,http://rja.wv.gov/Pages/About-Us.aspx,1/23/18,IMAGERY,2018-01-23T00:00:00.000Z,http://rja.wv.gov/facilityinfo/Pages/default.aspx,NOT AVAILABLE,500,0.006646664,2.10E-06,32991.00391,829.7256851,54,45,956200,54045956200,9562,Census Tract 9562,G5020,S,64143580,162337,37.8385716,-82.0667855,WV,c(-82.0957509406457, 37.805224727395)
1621,1221,10003602,MISSOURI RIVER CORRECTIONAL CENTER,1800 48TH AVE SW,BISMARCK,ND,58506,NOT AVAILABLE,(701) 328-9696,STATE,OPEN,187,BURLEIGH,38015,USA,922140,CORRECTIONAL INSTITUTIONS,"http://www.nd.gov/docr/media/stats.html, http://www.nd.gov/docr/adult/",12/31/16,IMAGERY,2017-12-13T00:00:00.000Z,http://www.nd.gov/docr/adult/,MINIMUM,191,0.008572648,2.27E-06,41014.68359,1136.574765,38,15,11200,38015011200,112,Census Tract 112,G5020,S,57775602,11831608,46.7220607,-100.7536162,ND,c(-100.822780794463, 46.7537877918322)
1622,1222,10001559,MARYLAND CORRECTIONAL INSTITUTION FOR WOMEN,7943 BROCK BRIDGE RD,JESSUP,MD,20794,NOT AVAILABLE,(410) 379-3800,STATE,OPEN,777,ANNE ARUNDEL,24003,USA,922140,CORRECTIONAL INSTITUTIONS,http://dpscs.maryland.gov/publicinfo/publications/annuals.shtml#doc,6/30/16,IMAGERY/OTHER,2017-12-05T00:00:00.000Z,http://www.dpscs.maryland.gov/locations/prisons.shtml,MAXIMUM,800,0.012204273,9.64E-06,153973.8047,1529.64398,24,3,740400,24003740400,7404,Census Tract 7404,G5020,S,2705357,0,39.1354606,-76.7778306,MD,c(-76.7758663284263, 39.1310857377118)
1623,1223,10000095,MARBLE VALLEY REGIONAL CORRECTIONAL FACILITY,167 STATE ST,RUTLAND,VT,5701,NOT AVAILABLE,(802) 786-5830,STATE,OPEN,130,RUTLAND,50021,USA,922140,CORRECTIONAL INSTITUTIONS,http://www.doc.state.vt.us/about/reports/,12/30/16,IMAGERY,2018-01-17T00:00:00.000Z,http://www.doc.state.vt.us/custody-supervision/facilities,NOT AVAILABLE,118,0.004391519,9.52E-07,16286.00781,598.0308398,50,21,963200,50021963200,9632,Census Tract 9632,G5020,S,5979867,173425,43.6202311,-72.9932497,VT,c(-72.9907897250825, 43.6096902934651)
1624,1224,10001914,CHITTENDEN REGIONAL CORRECTIONAL FACILITY,7 FARRELL ST,SOUTH BURLINGTON,VT,5403,NOT AVAILABLE,(802) 863-7356,STATE,OPEN,142,CHITTENDEN,50007,USA,922140,CORRECTIONAL INSTITUTIONS,http://www.doc.state.vt.us/about/reports/,12/30/16,IMAGERY,2018-01-17T00:00:00.000Z,http://www.doc.state.vt.us/custody-supervision/facilities,NOT AVAILABLE,185,0.004735429,1.12E-06,19504.23828,615.4097546,50,7,3304,50007003304,33.04,Census Tract 33.04,G5020,S,8492205,33471266,44.4502368,-73.276946,VT,c(-73.2056378948393, 44.4465271010308)
1625,1225,10001546,MARYLAND CORRECTIONAL TRAINING CENTER,18800 ROXBURY RD,HAGERSTOWN,MD,21746,NOT AVAILABLE,(240) 420-1601,STATE,OPEN,2436,WASHINGTON,24043,USA,922140,CORRECTIONAL INSTITUTIONS,http://dpscs.maryland.gov/publicinfo/publications/annuals.shtml#doc,6/30/16,IMAGERY/OTHER,2017-12-05T00:00:00.000Z,http://www.dpscs.maryland.gov/locations/prisons.shtml,MEDIUM,2417,0.020523936,2.25E-05,361452.3516,2504.743778,24,43,11000,24043011000,110,Census Tract 110,G5020,S,4425974,0,39.5596859,-77.7147954,MD,c(-77.714873973904, 39.5648348604576)
1626,1226,10002198,RIO BLANCO COUNTY DETENTION CENTER,355 4TH STREET,MEEKER,CO,81641,NOT AVAILABLE,(970) 878-9550,COUNTY,OPEN,-999,RIO BLANCO,8103,USA,922140,CORRECTIONAL INSTITUTIONS,http://www.co.rio-blanco.co.us/297/Sheriffs-Office,2/20/18,IMAGERY,2018-02-20T00:00:00.000Z,http://www.co.rio-blanco.co.us/297/Sheriffs-Office,NOT AVAILABLE,-999,0.003640053,4.41E-07,7143.796875,451.9508225,8,103,951100,8103951100,9511,Census Tract 9511,G5020,S,5156079830,4833853,39.9734231,-107.9122899,CO,c(-107.91191303248, 40.038344508221)
1627,1227,10005029,WASHINGTON COUNTY JAIL,83 COURT STREET,MACHIAS,ME,4654,NOT AVAILABLE,(207) 255-4422,COUNTY,OPEN,45,WASHINGTON,23029,USA,922140,CORRECTIONAL INSTITUTIONS,http://wcsheriffsoffice.blogspot.com/,10/31/14,IMAGERY/OTHER,2018-03-20T00:00:00.000Z,https://washingtoncountysheriff.wordpress.com/,NOT AVAILABLE,-999,0.002437706,1.85E-07,3230.394531,317.5861445,23,29,956200,23029956200,9562,Census Tract 9562,G5020,S,118573091,4555685,44.7297602,-67.4900109,ME,c(-67.4593665612663, 44.7162246875337)
1628,1228,10003597,TYGART VALLEY REGIONAL JAIL,400 ABBEY ROAD,BELINGTON,WV,26250,NOT AVAILABLE,(304) 637-0382,COUNTY,OPEN,444,RANDOLPH,54083,USA,922140,CORRECTIONAL INSTITUTIONS,http://rja.wv.gov/Pages/About-Us.aspx,1/23/18,IMAGERY/OTHER,2018-01-23T00:00:00.000Z,http://rja.wv.gov/facilityinfo/Pages/default.aspx,NOT AVAILABLE,300,0.006815381,2.13E-06,33899.38281,841.7486702,54,83,965900,54083965900,9659,Census Tract 9659,G5020,S,593019576,34445,38.7885314,-80.0788759,WV,c(-79.9514329134655, 38.9405561570675)
1629,1229,10000645,ROCK ISLAND COUNTY JAIL,1317 3RD AVENUE,ROCK ISLAND,IL,61201,NOT AVAILABLE,(309) 558-3456,COUNTY,OPEN,260,ROCK ISLAND,17161,USA,922140,CORRECTIONAL INSTITUTIONS,http://www.rockislandcounty.org/Sheriff/Home/,3/2/18,IMAGERY,2018-03-02T00:00:00.000Z,http://www.rockislandcounty.org/Sheriff/Home/,NOT AVAILABLE,329,0.003473059,4.00E-07,6623.398438,422.1129324,17,161,22600,17161022600,226,Census Tract 226,G5020,S,2376370,1129925,41.506928,-90.5865704,IL,c(-90.5807102547232, 41.5091944847915)
1630,1230,10002236,RIO GRANDE COUNTY JAIL,640 CHERRY STREET,DEL NORTE,CO,81132,NOT AVAILABLE,(719) 657-4000,COUNTY,OPEN,-999,RIO GRANDE,8105,USA,922140,CORRECTIONAL INSTITUTIONS,https://www.riograndecounty.org/departments/elected-officials/sheriff,2/20/18,IMAGERY,2018-02-20T00:00:00.000Z,https://www.riograndecounty.org/departments/elected-officials/sheriff,NOT AVAILABLE,-999,0.001934271,1.89E-07,2965.082031,245.7979277,8,105,976800,8105976800,9768,Census Tract 9768,G5020,S,10987825,13585,37.6748574,-106.3741193,CO,c(-106.350472019832, 37.6765179544451)
1631,1231,10006833,UNION COUNTY JUVENILE DETENTION CENTER,1075 EDWARD STREET,LINDEN,NJ,7036,NOT AVAILABLE,(908) 523-1630,COUNTY,OPEN,-999,UNION,34039,USA,922140,CORRECTIONAL INSTITUTIONS,http://ucnj.org/department-of-corrections/,4/6/18,IMAGERY,2018-04-06T00:00:00.000Z,http://ucnj.org/department-of-corrections/,JUVENILE,-999,0.004600263,1.02E-06,16637.48047,564.6393807,34,39,35400,34039035400,354,Census Tract 354,G5020,S,16770692,1873147,40.6213262,-74.2251144,NJ,c(-74.2536396308703, 40.6105890084607)
1632,1232,10000918,"MD RECEPTION, DIAGNOSTIC AND CLASSIFICATION CENTER",550 E MADISON ST,BALTIMORE,MD,21202,NOT AVAILABLE,(410) 878-3500,STATE,OPEN,352,BALTIMORE CITY,24510,USA,922140,CORRECTIONAL INSTITUTIONS,http://dpscs.maryland.gov/publicinfo/publications/annuals.shtml#doc,6/30/16,IMAGERY/OTHER,2017-12-05T00:00:00.000Z,http://www.dpscs.maryland.gov/locations/prisons.shtml,MAXIMUM,700,0.002155376,2.28E-07,3649.785156,267.739238,24,510,100300,24510100300,1003,Census Tract 1003,G5020,S,156309,0,39.2995112,-76.609125,MD,c(-76.6071075197475, 39.2992688961169)
1633,1233,10006587,BISMARCK TRANSITION CENTER,2001 LEE AVENUE,BISMARCK,ND,58504,NOT AVAILABLE,(701) 222-3440,STATE,OPEN,83,BURLEIGH,38015,USA,922140,CORRECTIONAL INSTITUTIONS,"http://www.nd.gov/docr/media/stats.html, https://www.nd.gov/docr/adult/transfacs/btc.html",12/31/16,IMAGERY,2017-12-13T00:00:00.000Z,http://www.cccscorp.com/programs/,MINIMUM,162,0.002675214,3.42E-07,6182.261719,356.4160668,38,15,10800,38015010800,108,Census Tract 108,G5020,S,4179660,0,46.7949479,-100.7662807,ND,c(-100.760541176243, 46.7915391365931)
1634,1234,10000092,NORTHEAST CORRECTIONAL COMPLEX WORK CAMP,1266 US ROUTE 5,ST. JOHNSBURY,VT,5819,NOT AVAILABLE,(802) 748-8151,STATE,OPEN,55,CALEDONIA,50005,USA,922140,CORRECTIONAL INSTITUTIONS,http://www.doc.state.vt.us/about/reports/,12/30/16,IMAGERY,2018-01-17T00:00:00.000Z,http://www.doc.state.vt.us/custody-supervision/facilities,MINIMUM,112,0.003386404,5.83E-07,10109.98438,434.1378309,50,5,957400,50005957400,9574,Census Tract 9574,G5020,S,47505596,429033,44.4605583,-72.0392927,VT,c(-72.0280261315429, 44.3948314996385)
1635,1235,10001543,NORTH BRANCH CORRECTIONAL INSTITUTION,14100 MCMULLEN HWY SW,CUMBERLAND,MD,21502,NOT AVAILABLE,(301) 729-7400,STATE,OPEN,1252,ALLEGANY,24001,USA,922140,CORRECTIONAL INSTITUTIONS,http://dpscs.maryland.gov/publicinfo/publications/annuals.shtml#doc,6/30/16,IMAGERY/OTHER,2017-12-05T00:00:00.000Z,http://www.dpscs.maryland.gov/locations/prisons.shtml,MAXIMUM,1400,0.017022356,1.38E-05,222564.1914,2140.885534,24,1,1300,24001001300,13,Census Tract 13,G5020,S,9705281,304110,39.6170751,-78.8129207,MD,c(-78.8180238239345, 39.6024730286268)
1636,1236,10001913,NORTHERN STATE CORRECTIONAL FACILITY,2559 GLEN RD,NEWPORT,VT,5855,NOT AVAILABLE,(802) 334-3364,STATE,OPEN,414,ORLEANS,50019,USA,922140,CORRECTIONAL INSTITUTIONS,http://www.doc.state.vt.us/about/reports/,12/30/16,IMAGERY,2018-01-17T00:00:00.000Z,http://www.doc.state.vt.us/custody-supervision/facilities,MEDIUM,433,0.009642045,4.81E-06,84072.9375,1312.577198,50,19,951400,50019951400,9514,Census Tract 9514,G5020,S,6949850,1832217,44.9341623,-72.1979341,VT,c(-72.190935925741, 44.9063130260885)
1637,1237,10001116,NORTHWEST STATE CORRECTIONAL FACILITY,3649 LOWER NEWTON RD,SWANTON,VT,5488,NOT AVAILABLE,(802) 524-6771,STATE,OPEN,215,FRANKLIN,50011,USA,922140,CORRECTIONAL INSTITUTIONS,http://www.doc.state.vt.us/about/reports/,12/30/16,IMAGERY,2018-01-17T00:00:00.000Z,http://www.doc.state.vt.us/custody-supervision/facilities,CLOSE,246,0.013134802,9.74E-06,170294.418,1698.496274,50,11,10600,50011010600,106,Census Tract 106,G5020,S,95885276,60896537,44.8113612,-73.1458957,VT,c(-73.132265495511, 44.8500904977824)
1638,1238,10001918,NORTHEAST CORRECTIONAL COMPLEX,1270 US ROUTE 5,ST. JOHNSBURY,VT,5819,NOT AVAILABLE,(802) 748-8151,STATE,OPEN,118,CALEDONIA,50005,USA,922140,CORRECTIONAL INSTITUTIONS,http://www.doc.state.vt.us/about/reports/,12/30/16,IMAGERY,2018-01-17T00:00:00.000Z,http://www.doc.state.vt.us/custody-supervision/facilities,NOT AVAILABLE,109,0.005031028,9.67E-07,16763.02344,652.2014998,50,5,957400,50005957400,9574,Census Tract 9574,G5020,S,47505596,429033,44.4605583,-72.0392927,VT,c(-72.0278760414948, 44.3962190218616)
1639,1239,10000093,SOUTHEAST STATE CORRECTIONAL FACILITY - WINDSOR,546 STATE FARM RD,WINDSOR,VT,5089,NOT AVAILABLE,(802) 674-6717,STATE,CLOSED,0,WINDSOR,50027,USA,922140,CORRECTIONAL INSTITUTIONS,http://www.vnews.com/Only-staff-remains-and-Windsor-prison-closes-down-208-years-after-the-first-prison-opened-on-State-Street-in-1809-13432197,11/1/17,IMAGERY,2018-01-17T00:00:00.000Z,http://www.doc.state.vt.us/custody-supervision/facilities/sescf/,NOT AVAILABLE,106,0.012907026,8.39E-06,143411.4453,1684.94281,50,27,966000,50027966000,9660,Census Tract 9660,G5020,S,50584090,721170,43.4753573,-72.4210442,VT,c(-72.4254137277462, 43.5000754212955)
1640,1240,10004976,DALE CORRECTIONAL FACILITY,103 S MAIN ST,WATERBURY,VT,5676,NOT AVAILABLE,NOT AVAILABLE,STATE,CLOSED,0,WASHINGTON,50023,USA,922140,CORRECTIONAL INSTITUTIONS,https://www.timesargus.com/articles/tentative-deal-would-close-waterburys-dale-womens-prison/,6/30/09,IMAGERY,2018-01-17T00:00:00.000Z,NOT AVAILABLE,NOT AVAILABLE,-999,0.018704997,1.14E-05,197683.6523,2369.009264,50,23,954300,50023954300,9543,Census Tract 9543,G5020,S,124931279,3936473,44.3682806,-72.7524504,VT,c(-72.7533459915996, 44.331366757143)
1641,1241,10002191,ROUTT COUNTY JAIL / SHERIFF,2025 SHIELD DRIVE,STEAMBOAT SPRINGS,CO,80487,NOT AVAILABLE,(970) 879-1090,COUNTY,OPEN,-999,ROUTT,8107,USA,922140,CORRECTIONAL INSTITUTIONS,http://www.co.routt.co.us/204/Sheriff,2/20/18,IMAGERY,2018-02-20T00:00:00.000Z,http://www.co.routt.co.us/204/Sheriff,MAXIMUM,54,0.002424431,2.44E-07,3978.058594,313.4649556,8,107,400,8107000400,4,Census Tract 4,G5020,S,100657473,14499,40.5043596,-106.9413569,CO,c(-106.860917090889, 40.5019259391191)
1642,1242,10001939,YORK COUNTY JAIL AND WOMEN'S REENTRY CENTER,1 LAYMAN WAY,ALFRED,ME,4002,NOT AVAILABLE,(207) 324-1113,COUNTY,OPEN,340,YORK,23031,USA,922140,CORRECTIONAL INSTITUTIONS,http://www.yorkcountymaine.gov/sheriff-s-office,3/20/18,IMAGERY,2018-03-20T00:00:00.000Z,http://www.yorkcountymaine.gov/sheriff-s-office,NOT AVAILABLE,350,0.010546008,1.42E-06,24232.09766,1330.642075,23,31,29000,23031029000,290,Census Tract 290,G5020,S,70614155,1682138,43.4785681,-70.7270912,ME,c(-70.7172906702325, 43.4533795601814)
1643,1243,10001959,BERNALILLO COUNTY YOUTH SERVICES CENTER,5100 2ND ST NW,ALBUQUERQUE,NM,87107,NOT AVAILABLE,(505) 468-7236,COUNTY,OPEN,33,BERNALILLO,35001,USA,922140,CORRECTIONAL INSTITUTIONS,https://www.bernco.gov/youth-services-center/,4/6/18,IMAGERY,2018-04-06T00:00:00.000Z,https://www.bernco.gov/youth-services-center/,JUVENILE,78,0.007663983,1.66E-06,25158.35156,906.0351604,35,1,3201,35001003201,32.01,Census Tract 32.01,G5020,S,1739788,0,35.1349467,-106.6440301,NM,c(-106.637092932447, 35.1327546560792)
1644,1244,10004040,POPLAR HILL PRE-RELEASE UNIT,24090 NANTICOKE RD,QUANTICO,MD,21856,NOT AVAILABLE,(410) 845-4580,STATE,OPEN,194,WICOMICO,24045,USA,922140,CORRECTIONAL INSTITUTIONS,http://dpscs.maryland.gov/publicinfo/publications/annuals.shtml#doc,6/30/16,IMAGERY,2017-12-05T00:00:00.000Z,http://www.dpscs.maryland.gov/locations/prisons.shtml,MINIMUM,192,0.004907697,3.50E-07,5530.960938,598.7482868,24,45,10800,24045010800,108,Census Tract 108,G5020,S,263141495,51174907,38.3188264,-75.7974016,MD,c(-75.7804328438256, 38.3616826717753)
1645,1245,10001547,ROXBURY CORRECTIONAL INSTITUTION,18701 ROXBURY RD,HAGERSTOWN,MD,21746,NOT AVAILABLE,(240) 420-3000,STATE,OPEN,1749,WASHINGTON,24043,USA,922140,CORRECTIONAL INSTITUTIONS,http://dpscs.maryland.gov/publicinfo/publications/annuals.shtml#doc,6/30/16,IMAGERY/OTHER,2017-12-05T00:00:00.000Z,http://www.dpscs.maryland.gov/locations/prisons.shtml,MEDIUM,1700,0.016399749,1.62E-05,259633.0352,2164.544703,24,43,11000,24043011000,110,Census Tract 110,G5020,S,4425974,0,39.5596859,-77.7147954,MD,c(-77.7173262209188, 39.5561122463085)
1646,1246,10002367,ALFRED D NOYES CHILDREN'S CENTER,9925 BLACKWELL RD,ROCKVILLE,MD,20850,NOT AVAILABLE,(301) 315-1610,STATE,OPEN,28,MONTGOMERY,24031,USA,922140,CORRECTIONAL INSTITUTIONS,"http://www.djs.state.md.us/Pages/Publications.aspx, http://www.djs.state.md.us/Pages/facilities/index.aspx",10/13/17,IMAGERY,2017-12-05T00:00:00.000Z,http://www.djs.state.md.us/Pages/facilities/index.aspx,JUVENILE,57,0.004282031,6.85E-07,10941.40625,539.9213927,24,31,700817,24031700817,7008.17,Census Tract 7008.17,G5020,S,3807582,32165,39.1066029,-77.2013839,MD,c(-77.2047701258661, 39.1028564459088)
1647,1247,10001567,SOUTHERN MARYLAND PRE-RELEASE UNIT,14320 OAKS RD,CHARLOTTE HALL,MD,20622,NOT AVAILABLE,(301) 274-4701,STATE,OPEN,171,CHARLES,24017,USA,922140,CORRECTIONAL INSTITUTIONS,http://dpscs.maryland.gov/publicinfo/publications/annuals.shtml#doc,6/30/16,IMAGERY,2017-12-05T00:00:00.000Z,http://www.dpscs.maryland.gov/locations/prisons.shtml,MINIMUM,165,0.005064306,5.33E-07,8438.828125,608.0923436,24,17,851302,24017851302,8513.02,Census Tract 8513.02,G5020,S,71456561,567589,38.5203192,-76.8591522,MD,c(-76.8130847795055, 38.5065142587889)
1648,1248,10001542,WESTERN CORRECTIONAL INSTITUTION,13800 MCMULLEN HWY SW,CUMBERLAND,MD,21502,NOT AVAILABLE,(301) 729-7000,STATE,OPEN,1606,ALLEGANY,24001,USA,922140,CORRECTIONAL INSTITUTIONS,http://dpscs.maryland.gov/publicinfo/publications/annuals.shtml#doc,6/30/16,IMAGERY/OTHER,2017-12-05T00:00:00.000Z,http://www.dpscs.maryland.gov/locations/prisons.shtml,MAXIMUM,1630,0.018488502,1.63E-05,262307.8828,2372.476149,24,1,1300,24001001300,13,Census Tract 13,G5020,S,9705281,304110,39.6170751,-78.8129207,MD,c(-78.8154198379271, 39.6067516954474)
1649,1249,10002361,BALTIMORE CITY JUVENILE JUSTICE CENTER,300 N GAY ST,BALTIMORE,MD,21202,NOT AVAILABLE,(443) 263-8706,STATE,OPEN,99,BALTIMORE CITY,24510,USA,922140,CORRECTIONAL INSTITUTIONS,"http://www.djs.state.md.us/Pages/Publications.aspx, http://www.djs.state.md.us/Pages/facilities/index.aspx",10/13/17,IMAGERY/OTHER,2017-12-05T00:00:00.000Z,http://www.djs.state.md.us/Pages/facilities/index.aspx,JUVENILE,120,0.006520674,1.68E-06,26885.23047,791.052158,24,510,280500,24510280500,2805,Census Tract 2805,G5020,S,923979,0,39.2951239,-76.6029382,MD,c(-76.6079932777449, 39.2941197037693)
1650,1250,10004740,BACKBONE MOUNTAIN YOUTH CENTER,124 CAMP 4 ROAD,SWANTON,MD,21561,NOT AVAILABLE,(301) 359-9190,STATE,OPEN,25,GARRETT,24023,USA,922140,CORRECTIONAL INSTITUTIONS,"http://www.djs.state.md.us/Pages/Publications.aspx, http://www.djs.state.md.us/Pages/facilities/index.aspx",10/13/17,IMAGERY,2017-12-05T00:00:00.000Z,http://www.djs.state.md.us/Pages/facilities/index.aspx,JUVENILE,48,0.008986439,2.81E-06,45126.72266,1143.954015,24,23,400,24023000400,4,Census Tract 4,G5020,S,264684192,2250594,39.4334404,-79.1904653,MD,c(-79.1687050048551, 39.4704008407968)
1651,1251,10004027,"CHARLES H HICKEY, JR. SCHOOL",9700 OLD HARFORD ROAD,PARKVILLE,MD,21234,NOT AVAILABLE,(410) 663-7700,STATE,OPEN,58,BALTIMORE,24005,USA,922140,CORRECTIONAL INSTITUTIONS,"http://www.djs.state.md.us/Pages/Publications.aspx, http://www.djs.state.md.us/Pages/facilities/index.aspx",10/13/17,IMAGERY,2017-12-05T00:00:00.000Z,http://www.djs.state.md.us/Pages/facilities/index.aspx,JUVENILE,72,0.018339203,1.14E-05,182318.7969,2301.602831,24,5,492600,24005492600,4926,Census Tract 4926,G5020,S,4325242,0,39.4110303,-76.5318285,MD,c(-76.5186892890902, 39.4235156049604)
1652,1252,10001566,CHELTENHAM YOUTH DETENTION CENTER,11003 FRANK TIPPETT RD,CHELTENHAM,MD,20623,NOT AVAILABLE,(301) 782-2400,STATE,OPEN,42,PRINCE GEORGE'S,24033,USA,922140,CORRECTIONAL INSTITUTIONS,"http://www.djs.state.md.us/Pages/Publications.aspx, http://www.turnerconstruction.com/experience/project/678F/cheltenham-youth-detention-center",10/13/17,IMAGERY,2017-12-05T00:00:00.000Z,http://www.djs.state.md.us/Pages/facilities/index.aspx,JUVENILE,72,0.008712251,4.33E-06,68713.92188,1054.018174,24,33,801004,24033801004,8010.04,Census Tract 8010.04,G5020,S,36523557,219049,38.7250838,-76.8513765,MD,c(-76.836510356821, 38.7396644874752)
1653,1253,10003634,TWO BRIDGES REGIONAL JAIL,522 BATH RD,WISCASSET,ME,4578,NOT AVAILABLE,(207) 882-4268,COUNTY,OPEN,146,LINCOLN,23015,USA,922140,CORRECTIONAL INSTITUTIONS,https://www.tbrj.org/,3/20/18,IMAGERY,2018-03-20T00:00:00.000Z,https://www.tbrj.org/,NOT AVAILABLE,172,0.006118722,1.78E-06,30613.06641,787.1287976,23,15,975500,23015975500,9755,Census Tract 9755,G5020,S,165484382,29078072,44.017464,-69.7172271,ME,c(-69.6989492943034, 43.9781016074507)
1654,1254,10001886,CROOK COUNTY JAIL,309 CLEVELAND ST,SUNDANCE,WY,82729,NOT AVAILABLE,NOT AVAILABLE,COUNTY,OPEN,-999,CROOK,56011,USA,922140,CORRECTIONAL INSTITUTIONS,http://www.crookcounty.wy.gov/elected_officials/sheriff_s_department/index.php,5/10/18,IMAGERY,2018-05-10T00:00:00.000Z,NOT AVAILABLE,NOT AVAILABLE,-999,0.002642996,2.99E-07,5178.796875,332.0521575,56,11,950300,56011950300,9503,Census Tract 9503,G5020,S,2189915360,369706,44.4406013,-104.3389748,WY,c(-104.378539679576, 44.4053913049994)
1655,1255,10001564,THOMAS J. S. WAXTER CHILDREN'S CENTER,375 RED CLAY RD,LAUREL,MD,20724,NOT AVAILABLE,(301) 362-6160,STATE,OPEN,19,ANNE ARUNDEL,24003,USA,922140,CORRECTIONAL INSTITUTIONS,"http://www.djs.state.md.us/Pages/Publications.aspx, http://www.djs.state.md.us/Pages/facilities/index.aspx",10/13/17,IMAGERY,2017-12-05T00:00:00.000Z,http://www.djs.state.md.us/Pages/facilities/index.aspx,JUVENILE,42,0.005862594,1.13E-06,18011.69531,741.1985839,24,3,751500,24003751500,7515,Census Tract 7515,G5020,S,12765150,0,39.0922977,-76.8003056,MD,c(-76.8090847282065, 39.0918712010591)
1656,1256,10004029,J DEWEESE CARTER CENTER,300 SCHEELER RD,CHESTERTOWN,MD,21620,NOT AVAILABLE,(410) 778-6444,STATE,OPEN,11,KENT,24029,USA,922140,CORRECTIONAL INSTITUTIONS,"http://www.djs.state.md.us/Pages/Publications.aspx, http://www.djs.state.md.us/Pages/facilities/index.aspx",10/13/17,IMAGERY,2017-12-05T00:00:00.000Z,http://www.djs.state.md.us/Pages/facilities/index.aspx,JUVENILE,14,0.00826072,1.41E-06,22600.62891,1025.053476,24,29,950300,24029950300,9503,Census Tract 9503,G5020,S,21441968,1753917,39.2277772,-76.0714268,MD,c(-76.0649425607765, 39.2314101474535)
1657,1257,10001915,WOODSIDE JUVENILE REHABILITATION CENTER,26 WOODSIDE DR E,COLCHESTER,VT,5446,NOT AVAILABLE,(802) 655-4990,STATE,OPEN,6,CHITTENDEN,50007,USA,922140,CORRECTIONAL INSTITUTIONS,http://dcf.vermont.gov/youth/PREA,4/21/17,IMAGERY,2018-01-18T00:00:00.000Z,http://dcf.vermont.gov/youth/woodside,JUVENILE,30,0.003810781,4.71E-07,8190.933594,479.1345416,50,7,2701,50007002701,27.01,Census Tract 27.01,G5020,S,40300359,512126,44.5413577,-73.0957383,VT,c(-73.1443997615887, 44.5022144172635)
1658,1258,10004741,MEADOW MOUNTAIN YOUTH CENTER,234 RECOVERY ROAD,GRANTSVILLE,MD,21535,NOT AVAILABLE,(301) 895-5669,STATE,OPEN,22,GARRETT,24023,USA,922140,CORRECTIONAL INSTITUTIONS,"http://www.djs.state.md.us/Pages/Publications.aspx, http://www.djs.state.md.us/Pages/facilities/index.aspx",10/13/17,IMAGERY,2017-12-05T00:00:00.000Z,http://www.djs.state.md.us/Pages/facilities/index.aspx,JUVENILE,40,0.00554643,1.60E-06,25652.86719,664.0983181,24,23,300,24023000300,3,Census Tract 3,G5020,S,326802297,1421234,39.620948,-79.0544096,MD,c(-79.1959849360601, 39.5720564650311)
1659,1259,10004742,SAVAGE MOUNTAIN YOUTH CENTER,164 FREEDOM LANE,LONACONING,MD,21539,NOT AVAILABLE,(301) 463-2244,STATE,OPEN,10,GARRETT,24023,USA,922140,CORRECTIONAL INSTITUTIONS,"http://www.djs.state.md.us/Pages/Publications.aspx, http://www.djs.state.md.us/Pages/facilities/index.aspx",10/13/17,IMAGERY,2017-12-05T00:00:00.000Z,http://www.djs.state.md.us/Pages/facilities/index.aspx,JUVENILE,36,0.009468276,4.20E-06,67622.18359,1159.502109,24,23,300,24023000300,3,Census Tract 3,G5020,S,326802297,1421234,39.620948,-79.0544096,MD,c(-79.0231213031897, 39.5945068065006)
1660,1260,10005711,CATRON COUNTY DETENTION CENTER,101 MAIN ST,RESERVE,NM,87830,NOT AVAILABLE,(505) 533-6222,COUNTY,OPEN,-999,CATRON,35003,USA,922140,CORRECTIONAL INSTITUTIONS,"http://www.nmjustice.net/nmsc/juvenile/program.php?id=6028, https://www.nmlegis.gov/handouts/CCJ%20052716%20Item%203%20NM%20County%20Jails%20An%20Overview.pdf",5/27/16,IMAGERY,2018-04-06T00:00:00.000Z,NOT AVAILABLE,NOT AVAILABLE,10,0.00131677,8.18E-08,1218.113281,156.1566706,35,3,976400,35003976400,9764,Census Tract 9764,G5020,S,17933559836,14195265,33.9016208,-108.3919284,NM,c(-108.757709385973, 33.7123860491416)
1661,1261,10006588,NORTH DAKOTA STATE HOSPITAL - TOMPKINS REHABILITATION AND CORRECTIONS CENTER,2605 CIRCLE DRIVE,JAMESTOWN,ND,58401,NOT AVAILABLE,(701) 253-3755,STATE,OPEN,102,STUTSMAN,38093,USA,922140,CORRECTIONAL INSTITUTIONS,"http://www.nd.gov/docr/media/stats.html, https://www.nd.gov/docr/adult/transfacs/trcc.html",12/31/16,IMAGERY,2017-12-13T00:00:00.000Z,https://www.nd.gov/docr/adult/transfacs/trcc.html,MINIMUM,90,0.011701605,7.15E-06,129580.8359,1615.332123,38,93,967300,38093967300,9673,Census Tract 9673,G5020,S,22396407,0,46.9174162,-98.6722581,ND,c(-98.6882019699825, 46.8821056343318)
1662,1262,10001248,CHAVES COUNTY ADULT DETENTION CENTER,3701 S ATKINSON,ROSWELL,NM,88203,NOT AVAILABLE,(575) 624-6517,COUNTY,OPEN,-999,CHAVES,35005,USA,922140,CORRECTIONAL INSTITUTIONS,"https://www.co.chaves.nm.us/148/Departments, https://www.nmlegis.gov/handouts/CCJ%20052716%20Item%203%20NM%20County%20Jails%20An%20Overview.pdf",5/27/16,IMAGERY,2018-04-06T00:00:00.000Z,https://www.co.chaves.nm.us/148/Departments,NOT AVAILABLE,400,0.008318891,3.91E-06,58078.89453,1031.920041,35,5,600,35005000600,6,Census Tract 6,G5020,S,20135621,40199,33.3640736,-104.4955418,NM,c(-104.504300223461, 33.3517575873578)
1663,1263,10006865,COCHRAN COUNTY JAIL,100 NORTH MAIN STREET,MORTON,TX,79346,NOT AVAILABLE,NOT AVAILABLE,COUNTY,OPEN,11,COCHRAN,48079,USA,922140,CORRECTIONAL INSTITUTIONS,"http://www.co.cochran.tx.us/page/cochran.Sheriff, https://www.tcjs.state.tx.us/index.php?linkID=325",3/1/18,IMAGERY,2018-04-26T00:00:00.000Z,NOT AVAILABLE,NOT AVAILABLE,13,0.001447002,1.12E-07,1665.578125,183.5990884,48,79,950100,48079950100,9501,Census Tract 9501,G5020,S,2007453828,229068,33.6084401,-102.830449,TX,c(-102.759779709712, 33.7258119322545)
1664,1264,10002737,COLLIN COUNTY DETENTION FACILITY,4300 COMMUNITY AVE,MCKINNEY,TX,75071,NOT AVAILABLE,(972) 547-5200,COUNTY,OPEN,1189,COLLIN,48085,USA,922140,CORRECTIONAL INSTITUTIONS,"http://www.collincountytx.gov/sheriff/Pages/default.aspx, https://www.tcjs.state.tx.us/index.php?linkID=325",3/1/18,IMAGERY,2018-04-26T00:00:00.000Z,http://www.collincountytx.gov/sheriff/Pages/default.aspx,MAXIMUM,1298,0.011648162,5.38E-06,79720.65234,1450.792814,48,85,30604,48085030604,306.04,Census Tract 306.04,G5020,S,4734065,99064,33.2443529,-96.6431785,TX,c(-96.6342730023098, 33.2456710101725)
1665,1265,10006738,ST. CLAIR COUNTY JUVENILE DETENTION CENTER,9006 LEBANON RD,BELLEVILLE,IL,62223,NOT AVAILABLE,(618) 397-9546,COUNTY,OPEN,-999,ST. CLAIR,17163,USA,922140,CORRECTIONAL INSTITUTIONS,http://ipcsa.org/il-probation-directory/,3/2/18,IMAGERY,2018-03-02T00:00:00.000Z,http://www.co.st-clair.il.us/departments/probation/Pages/default.aspx,JUVENILE,-999,0.003719081,4.41E-07,6997.433594,459.4927359,17,163,501501,17163501501,5015.01,Census Tract 5015.01,G5020,S,3888649,0,38.5822611,-90.0511444,IL,c(-90.0557299501301, 38.5867502867794)
1666,1266,10002736,JOHN R ROACH JUVENILE DETENTION CENTER,4700 COMMUNITY AVE,MCKINNEY,TX,75071,NOT AVAILABLE,(972) 547-5400,COUNTY,OPEN,-999,COLLIN,48085,USA,922140,CORRECTIONAL INSTITUTIONS,http://www.tjjd.texas.gov/publications/other/searchfacilityregistryresults.aspx?SelectedFacilityType=YKSBbGCMUWM=&SelectedSortBy=laExhobORj5ZHimppFKN0Q==&IncludeInactive=bZL7qeN3IjY=,4/26/18,IMAGERY,2018-04-26T00:00:00.000Z,http://www.collincountytx.gov/juvenile_probation/Pages/default.aspx,JUVENILE,144,0.004181947,8.46E-07,12542.16016,519.1522034,48,85,30604,48085030604,306.04,Census Tract 306.04,G5020,S,4734065,99064,33.2443529,-96.6431785,TX,c(-96.6330549791188, 33.2489664968512)
1667,1267,10004028,VICTOR CULLEN CENTER,6000 CULLEN DR,SABILLASVILLE,MD,21780,NOT AVAILABLE,(301) 739-8122,STATE,OPEN,28,FREDERICK,24021,USA,922140,CORRECTIONAL INSTITUTIONS,"http://www.djs.state.md.us/Pages/Publications.aspx, http://www.djs.state.md.us/Pages/facilities/index.aspx",10/13/17,IMAGERY,2017-12-05T00:00:00.000Z,http://www.djs.state.md.us/Pages/facilities/index.aspx,JUVENILE,48,0.023365922,1.43E-05,230299.1016,3044.51882,24,21,752900,24021752900,7529,Census Tract 7529,G5020,S,124351554,353462,39.642721,-77.4410705,MD,c(-77.457272357857, 39.7125770230867)
1668,1268,10005832,NEW BEGINNINGS YOUTH DEVELOPMENT CENTER,8400 RIVER ROAD,LAUREL,MD,20724,NOT AVAILABLE,(202) 299-3100,STATE,OPEN,-999,ANNE ARUNDEL,24003,USA,922140,CORRECTIONAL INSTITUTIONS,http://www.aecom.com/future/projects/new-beginnings-youth-development-center/,7/11/16,IMAGERY/OTHER,2017-12-05T00:00:00.000Z,https://dyrs.dc.gov/service/secure-facilities,JUVENILE,60,0.006175644,2.28E-06,36344.35156,767.9930693,24,3,751500,24003751500,7515,Census Tract 7515,G5020,S,12765150,0,39.0922977,-76.8003056,MD,c(-76.7867177667634, 39.1012641892644)
1669,1269,10001555,VOLUNTEERS OF AMERICA-CHESAPEAKE RESIDENTIAL RE-ENTRY CENTER,5000 EAST MONUMENT ST,BALTIMORE,MD,21205,NOT AVAILABLE,(410) 276-5880,STATE,OPEN,-999,BALTIMORE CITY,24510,USA,922140,CORRECTIONAL INSTITUTIONS,https://www.voachesapeake.org/rrc,12/5/17,IMAGERY,2017-12-05T00:00:00.000Z,https://www.voachesapeake.org/rrc,MINIMUM,148,0.00282597,4.99E-07,7983.269531,360.1343212,24,510,260404,24510260404,2604.04,Census Tract 2604.04,G5020,S,4467271,0,39.3000661,-76.5528622,MD,c(-76.5555481387283, 39.3004805476207)
1670,1270,10004033,BALTIMORE CITY DETENTION CENTER,401 E EAGER ST,BALTIMORE,MD,21202,NOT AVAILABLE,(410) 209-4145,STATE,CLOSED,0,BALTIMORE CITY,24510,USA,922140,CORRECTIONAL INSTITUTIONS,http://governor.maryland.gov/2015/08/25/governor-larry-hogan-announces-final-detainee-transfer-from-baltimore-city-detention-center/,8/25/15,IMAGERY/OTHER,2017-12-05T00:00:00.000Z,http://www.dpscs.state.md.us/locations/bcdc.shtml,MAXIMUM,-999,0.006738202,1.49E-06,23883.88281,896.7268074,24,510,100300,24510100300,1003,Census Tract 1003,G5020,S,156309,0,39.2995112,-76.609125,MD,c(-76.6097979576549, 39.2998646444684)
1671,1271,10001563,OAK HILL YOUTH DETENTION CENTER,3201 OAK HILL DR,LAUREL,MD,20724,NOT AVAILABLE,NOT AVAILABLE,STATE,CLOSED,0,ANNE ARUNDEL,24003,USA,922140,CORRECTIONAL INSTITUTIONS,http://www.washingtonpost.com/wp-dyn/content/article/2009/05/28/AR2009052803747.html,6/30/09,IMAGERY,2017-12-05T00:00:00.000Z,NOT AVAILABLE,JUVENILE,-999,0.013224009,1.16E-05,184634.1211,1618.789901,24,3,751500,24003751500,7515,Census Tract 7515,G5020,S,12765150,0,39.0922977,-76.8003056,MD,c(-76.775717307756, 39.1053382711067)
1672,1272,10000915,WESTERN MARYLAND CHILDREN'S CENTER,18420 ROXBURY RD,HAGERSTOWN,MD,21740,NOT AVAILABLE,(301) 745-6071,STATE,OPEN,20,WASHINGTON,24043,USA,922140,CORRECTIONAL INSTITUTIONS,"http://www.djs.state.md.us/Pages/Publications.aspx, http://www.djs.state.md.us/Pages/facilities/index.aspx",10/13/17,IMAGERY,2017-12-05T00:00:00.000Z,http://www.djs.state.md.us/Pages/facilities/index.aspx,JUVENILE,24,0.003556512,5.31E-07,8541.929688,438.7703738,24,43,11000,24043011000,110,Census Tract 110,G5020,S,4425974,0,39.5596859,-77.7147954,MD,c(-77.7280223976068, 39.567005249618)
1673,1273,10006666,HOWARD CENTER - PARK STREET PROGRAM,77 PARK STREET,RUTLAND,VT,5701,NOT AVAILABLE,(212) 677-5093,STATE,OPEN,7,RUTLAND,50021,USA,922140,CORRECTIONAL INSTITUTIONS,http://dcf.vermont.gov/youth/PREA,6/10/15,IMAGERY,2018-01-18T00:00:00.000Z,http://howardcenter.org/All-Programs,JUVENILE,12,0.002806341,4.50E-07,7700.632813,355.4492473,50,21,963300,50021963300,9633,Census Tract 9633,G5020,S,7625635,129118,43.5978333,-72.9756345,VT,c(-72.9769232708463, 43.595708788927)
1674,1274,10006719,SAGUACHE COUNTY JAIL,530 5TH STREET,SAGUACHE,CO,81149,NOT AVAILABLE,NOT AVAILABLE,COUNTY,OPEN,-999,SAGUACHE,8109,USA,922140,CORRECTIONAL INSTITUTIONS,https://www.saguachecounty.net/index.php/sheriff,2/20/18,IMAGERY,2018-02-20T00:00:00.000Z,https://www.saguachecounty.net/index.php/sheriff,NOT AVAILABLE,-999,0.001051767,6.26E-08,984.8242188,133.4170439,8,109,977600,8109977600,9776,Census Tract 9776,G5020,S,7204038324,4314125,38.1324118,-106.2972506,CO,c(-106.137929188653, 38.0852495764395)
1675,1275,10006269,SAN MIGUEL COUNTY JAIL,684 CR 63L,TELLURIDE,CO,81435,NOT AVAILABLE,(970) 728-1911,COUNTY,OPEN,13,SAN MIGUEL,8113,USA,922140,CORRECTIONAL INSTITUTIONS,https://www.sanmiguelcountyco.gov/201/Sheriff,2/20/18,IMAGERY/OTHER,2018-02-20T00:00:00.000Z,https://www.sanmiguelcountyco.gov/201/Sheriff,NOT AVAILABLE,37,0.001530895,1.35E-07,2121.421875,186.9578375,8,113,968103,8113968103,9681.03,Census Tract 9681.03,G5020,S,829345976,991507,37.9622487,-107.9945187,CO,c(-107.906072904705, 37.9459977342771)
1676,1276,10004032,WILLIAM DONALD SCHAFFER HOUSE,907 DRUID PARK LAKE DR,BALTIMORE,MD,21217,NOT AVAILABLE,(410) 230-3190,STATE,OPEN,-999,BALTIMORE CITY,24510,USA,922140,CORRECTIONAL INSTITUTIONS,http://162.242.255.103/resource/maryland-department-of-juvenile-services-william-donald-schaefer-house/,12/5/17,IMAGERY,2017-12-05T00:00:00.000Z,http://162.242.255.103/resource/maryland-department-of-juvenile-services-william-donald-schaefer-house/,JUVENILE,20,0.002056211,2.34E-07,3743.109375,254.1581401,24,510,130100,24510130100,1301,Census Tract 1301,G5020,S,301238,0,39.3152325,-76.6343935,MD,c(-76.6375507948176, 39.3162923210205)
1677,1277,10002202,SUMMIT COUNTY JAIL / SHERIFF,501 NORTH PARK AVENUE,BRECKENRIDGE,CO,80424,210,(970) 453-2232,COUNTY,OPEN,-999,SUMMIT,8117,USA,922140,CORRECTIONAL INSTITUTIONS,http://co.summit.co.us/109/Sheriffs-Office,2/20/18,IMAGERY,2018-02-20T00:00:00.000Z,http://co.summit.co.us/109/Sheriffs-Office,NOT AVAILABLE,95,0.00373225,4.92E-07,7894.484375,475.5922731,8,117,401,8117000401,4.01,Census Tract 4.01,G5020,S,151025310,447196,39.4502392,-106.0644288,CO,c(-106.046984392566, 39.4913272520634)
1678,1278,10006547,MARYLAND CORRECTIONAL TRAINING CENTER HED/EHU,18800 ROXBURY ROAD,HAGERSTOWN,MD,21746,NOT AVAILABLE,(240) 420-1601,STATE,OPEN,387,WASHINGTON,24043,USA,922140,CORRECTIONAL INSTITUTIONS,http://mgaleg.maryland.gov/pubs/budgetfiscal/2018fy-budget-docs-capital-q0-department-of-public-safety-and-correctional-services.pdf,12/5/17,IMAGERY,2017-12-05T00:00:00.000Z,http://www.dpscs.maryland.gov/locations/prisons.shtml,MINIMUM,390,0.00786796,3.59E-06,57766.07031,966.8093588,24,43,11000,24043011000,110,Census Tract 110,G5020,S,4425974,0,39.5596859,-77.7147954,MD,c(-77.722795723355, 39.5652071086568)
1679,1279,10006589,FARGO RESIDENTIAL RE-ENTRY FACILITY FOR MALES,123 15TH STREET NORTH,FARGO,ND,58102,NOT AVAILABLE,(701) 237-9340,STATE,OPEN,23,CASS,38017,USA,922140,CORRECTIONAL INSTITUTIONS,"http://www.nd.gov/docr/media/stats.html, http://centreinc.org/Fargo/",12/31/16,IMAGERY/OTHER,2017-12-13T00:00:00.000Z,http://centreinc.org/Fargo/,MINIMUM,134,0.002932631,3.35E-07,6067.453125,424.0613674,38,17,600,38017000600,6,Census Tract 6,G5020,S,8943002,0,46.8778896,-96.8226165,ND,c(-96.8033262937021, 46.8784195101321)
1680,1280,10001938,MOUNTAIN VIEW CORRECTIONAL FACILITY,1182 DOVER RD,CHARLESTON,ME,4422,NOT AVAILABLE,(207) 285-0880,STATE,OPEN,-999,PENOBSCOT,23019,USA,922140,CORRECTIONAL INSTITUTIONS,http://www.maine.gov/corrections/adultfacilities/index.shtml,12/5/17,IMAGERY,2017-12-05T00:00:00.000Z,http://www.maine.gov/corrections/adultfacilities/index.shtml,MEDIUM,394,0.022592497,8.13E-06,142762.8789,2844.817482,23,19,31200,23019031200,312,Census Tract 312,G5020,S,209330453,33017,45.0364784,-69.0212103,ME,c(-69.094449700847, 45.0925204622566)
1681,1281,10006548,SILVER OAK ACADEMY,999 CROUSE MILL ROAD,KEYMAR,MD,21757,NOT AVAILABLE,(410) 775-1745,STATE,OPEN,-999,CARROLL,24013,USA,922140,CORRECTIONAL INSTITUTIONS,http://silveroakacademy.com/,12/5/17,IMAGERY,2017-12-05T00:00:00.000Z,http://silveroakacademy.com/,JUVENILE,-999,0.009259741,3.60E-06,57859.41797,1129.969003,24,13,510000,24013510000,5100,Census Tract 5100,G5020,S,56579559,150286,39.6289823,-77.2397116,MD,c(-77.2003099763735, 39.6045931334211)
1682,1282,10000987,CLALLAM BAY CORRECTIONS CENTER,1830 EAGLE CREST WAY,CLALLAM BAY,WA,98326,NOT AVAILABLE,(360) 963-2000,STATE,OPEN,874,CLALLAM,53009,USA,922140,CORRECTIONAL INSTITUTIONS,http://www.doc.wa.gov/information/data/analytics.htm,1/18/18,IMAGERY,2018-01-18T00:00:00.000Z,http://www.doc.wa.gov/corrections/incarceration/prisons/default.htm,MAXIMUM,900,0.013430942,9.29E-06,172829.9219,1712.781742,53,9,200,53009000200,2,Census Tract 2,G5020,S,928616670,32622948,48.1811984,-124.4120541,WA,c(-124.28698033567, 48.2391976981578)
1683,1283,10000100,BOLDUC CORRECTIONAL FACILITY,516 CUSHING RD,WARREN,ME,4864,NOT AVAILABLE,(207) 273-5123,STATE,OPEN,192,KNOX,23013,USA,922140,CORRECTIONAL INSTITUTIONS,"http://www.maine.gov/corrections/PublicInterest/census/index.htm, http://www.maine.gov/corrections/adultfacilities/index.shtml",3/14/11,IMAGERY/OTHER,2017-12-05T00:00:00.000Z,http://www.maine.gov/corrections/adultfacilities/index.shtml,MINIMUM,222,0.006365554,1.13E-06,19406.41016,831.2377652,23,13,970400,23013970400,9704,Census Tract 9704,G5020,S,148690383,7289165,44.1224266,-69.225993,ME,c(-69.2174466560971, 44.0676096985085)
1684,1284,10005714,CHAVES COUNTY JUVENILE DETENTION CENTER,119 E FOURTH ST,ROSWELL,NM,88201,NOT AVAILABLE,(575) 624-6519,COUNTY,OPEN,-999,CHAVES,35005,USA,922140,CORRECTIONAL INSTITUTIONS,http://www.nmjustice.net/nmsc/juvenile/program.php?id=288,2/15/16,IMAGERY,2018-04-06T00:00:00.000Z,https://www.co.chaves.nm.us/148/Departments,JUVENILE,16,0.001664,1.20E-07,1773.902344,198.4176998,35,5,201,35005000201,2.01,Census Tract 2.01,G5020,S,3155613,7960,33.3914504,-104.532486,NM,c(-104.521519706608, 33.3967317946701)
1685,1285,10003768,COLFAX COUNTY VIGIL-MALDONADO DETENTION CENTER,444 HEREFORD STREET,RATON,NM,87740,NOT AVAILABLE,(575) 445-3691,COUNTY,OPEN,-999,COLFAX,35007,USA,922140,CORRECTIONAL INSTITUTIONS,http://www.co.colfax.nm.us/government/departments.php,4/6/18,IMAGERY,2018-04-06T00:00:00.000Z,http://www.co.colfax.nm.us/government/departments.php,NOT AVAILABLE,42,0.001815868,1.53E-07,2371.007813,233.2272174,35,7,950500,35007950500,9505,Census Tract 9505,G5020,S,2173884793,3121317,36.7239177,-104.2786041,NM,c(-104.431614873111, 36.8704856518435)
1686,1286,10004731,SALINE COUNTY JAIL,1 NORTH MAIN STREET,HARRISBURG,IL,62946,NOT AVAILABLE,(618) 252-8661,COUNTY,OPEN,-999,SALINE,17165,USA,922140,CORRECTIONAL INSTITUTIONS,http://www.ilsheriff.org/index.php/directory,3/2/18,IMAGERY,2018-03-02T00:00:00.000Z,http://www.salinecosheriff.com/default.htm,NOT AVAILABLE,110,0.002313034,1.99E-07,3124.222656,284.2032717,17,165,955900,17165955900,9559,Census Tract 9559,G5020,S,9389899,498190,37.7435632,-88.5287631,IL,c(-88.5408171385643, 37.7387307874108)
1687,1287,10002224,TELLER COUNTY JAIL,288 WEAVERVILLE RD,DIVIDE,CO,80814,NOT AVAILABLE,(719) 687-7770,COUNTY,OPEN,50,TELLER,8119,USA,922140,CORRECTIONAL INSTITUTIONS,https://www.tellercountysheriff.com/,2/15/16,IMAGERY,2018-02-20T00:00:00.000Z,https://www.tellercountysheriff.com/,MEDIUM,126,0.002313774,2.56E-07,4084.660156,303.0419002,8,119,10106,8119010106,101.06,Census Tract 101.06,G5020,S,334209917,2009675,38.8918585,-105.169007,CO,c(-105.151308318449, 38.9430297244627)
1688,1288,10006667,204 DEPOT STREET PROGRAM,204 DEPOT STREET,BENNINGTON,VT,5201,NOT AVAILABLE,(802) 442-6156,STATE,OPEN,8,BENNINGTON,50003,USA,922140,CORRECTIONAL INSTITUTIONS,http://dcf.vermont.gov/youth/PREA,6/9/17,IMAGERY,2018-01-18T00:00:00.000Z,http://seallinc.org/,JUVENILE,8,0.000733539,3.02E-08,510.7695313,91.81976097,50,3,971200,50003971200,9712,Census Tract 9712,G5020,S,4342740,107259,42.8854297,-73.1952797,VT,c(-73.1988934111177, 42.8823298396874)
1689,1289,10002491,CEDAR CREEK CORRECTIONS CENTER,12200 BORDEAUX RD,LITTLEROCK,WA,98556,37,(360) 359-4100,STATE,OPEN,475,THURSTON,53067,USA,922140,CORRECTIONAL INSTITUTIONS,http://www.doc.wa.gov/information/data/analytics.htm,1/18/18,IMAGERY,2018-01-18T00:00:00.000Z,http://www.doc.wa.gov/corrections/incarceration/prisons/default.htm,MINIMUM,480,0.01081045,4.34E-06,78733.83594,1400.144753,53,67,12730,53067012730,127.3,Census Tract 127.30,G5020,S,109693972,1074693,46.8584367,-123.0587556,WA,c(-123.143094451729, 46.8836447725299)
1690,1290,10005707,CURRY COUNTY ADULT DETENTION CENTER,801 MITCHELL ST,CLOVIS,NM,88101,NOT AVAILABLE,NOT AVAILABLE,COUNTY,OPEN,209,CURRY,35009,USA,922140,CORRECTIONAL INSTITUTIONS,http://www.curryjail.com/,4/6/18,IMAGERY,2018-04-06T00:00:00.000Z,http://www.curryjail.com/,NOT AVAILABLE,258,0.002660387,3.37E-07,5060.324219,333.2448507,35,9,100,35009000100,1,Census Tract 1,G5020,S,5839051,0,34.4067065,-103.231639,NM,c(-103.206272714486, 34.4063068732048)
1691,1291,10001162,DOWNEAST CORRECTIONAL FACILITY,64 BASE RD,MACHIASPORT,ME,4655,NOT AVAILABLE,(207) 255-1100,STATE,OPEN,147,WASHINGTON,23029,USA,922140,CORRECTIONAL INSTITUTIONS,"http://www.maine.gov/corrections/PublicInterest/census/index.htm, http://www.maine.gov/corrections/adultfacilities/index.shtml",3/14/11,IMAGERY,2017-12-05T00:00:00.000Z,http://www.maine.gov/corrections/adultfacilities/index.shtml,MINIMUM,148,0.007172318,2.47E-06,43021.75781,952.1797253,23,29,956100,23029956100,9561,Census Tract 9561,G5020,S,145911160,89655662,44.655762,-67.3789714,ME,c(-67.3973284747624, 44.6283881673501)
1692,1292,10002479,MISSION CREEK CORRECTIONS CENTER FOR WOMEN,3420 NE SAND HILL RD,BELFAIR,WA,98528,NOT AVAILABLE,(360) 277-2400,STATE,OPEN,317,MASON,53045,USA,922140,CORRECTIONAL INSTITUTIONS,http://www.doc.wa.gov/information/data/analytics.htm,1/18/18,IMAGERY,2018-01-18T00:00:00.000Z,http://www.doc.wa.gov/corrections/incarceration/prisons/default.htm,MINIMUM,300,0.008277805,1.93E-06,35397.6875,1134.848095,53,45,960400,53045960400,9604,Census Tract 9604,G5020,S,119909871,22269829,47.393598,-122.8491775,WA,c(-122.864329204932, 47.4840436096561)
1693,1293,10001165,MAINE CORRECTIONAL CENTER,17 MALLISON FALLS RD,WINDHAM,ME,4062,NOT AVAILABLE,(207) 893-7000,STATE,OPEN,500,CUMBERLAND,23005,USA,922140,CORRECTIONAL INSTITUTIONS,"http://www.maine.gov/corrections/PublicInterest/census/index.htm, http://www.maine.gov/corrections/adultfacilities/index.shtml",3/14/11,IMAGERY/OTHER,2017-12-05T00:00:00.000Z,http://www.maine.gov/corrections/adultfacilities/index.shtml,MEDIUM,650,0.013753702,7.26E-06,124544.0938,1799.761263,23,5,4803,23005004803,48.03,Census Tract 48.03,G5020,S,48160958,1005246,43.7607182,-70.4082386,ME,c(-70.4144273326469, 43.7269361064671)
1694,1294,10001163,MAINE STATE PRISON,807 CUSHING RD,WARREN,ME,4864,NOT AVAILABLE,(207) 273-5300,STATE,OPEN,836,KNOX,23013,USA,922140,CORRECTIONAL INSTITUTIONS,"http://www.maine.gov/corrections/PublicInterest/census/index.htm, http://www.maine.gov/corrections/adultfacilities/index.shtml",3/14/11,IMAGERY,2017-12-05T00:00:00.000Z,http://www.maine.gov/corrections/adultfacilities/index.shtml,CLOSE,916,0.016681388,1.36E-05,234265.2617,2074.684415,23,13,970400,23013970400,9704,Census Tract 9704,G5020,S,148690383,7289165,44.1224266,-69.225993,ME,c(-69.2304077441098, 44.0654412079427)
1695,1295,10005034,CENTRAL MAINE PRE-RELEASE CENTER,1 STEVENS STREET,HALLOWELL,ME,4347,NOT AVAILABLE,NOT AVAILABLE,STATE,CLOSED,0,KENNEBEC,23011,USA,922140,CORRECTIONAL INSTITUTIONS,http://www.kjonline.com/news/Hallowells-Pre-Release-Center-closes-causing-relocation-of-prisoners-and-staff---.html,3/12/14,IMAGERY/OTHER,2017-12-05T00:00:00.000Z,NOT AVAILABLE,MINIMUM,-999,0.001990981,2.32E-07,4020.902344,274.8057136,23,11,10700,23011010700,107,Census Tract 107,G5020,S,15201100,569567,44.2872407,-69.8180401,ME,c(-69.7977503879357, 44.2922465661368)
1696,1296,10006787,ALLEGAN COUNTY CORRECTIONS CENTER,640 RIVER ST,ALLEGAN,MI,49010,NOT AVAILABLE,(269) 673-0500,COUNTY,OPEN,156,ALLEGAN,26005,USA,922140,CORRECTIONAL INSTITUTIONS,http://cms.allegancounty.org/sheriff/corrections/SitePages/Home.aspx#.WrE1IvnwbmE,3/20/18,IMAGERY,2018-03-20T00:00:00.000Z,http://cms.allegancounty.org/sheriff/corrections/SitePages/Home.aspx#.WrE1IvnwbmE,NOT AVAILABLE,225,0.005993179,1.96E-06,32892.85547,782.3952332,26,5,31200,26005031200,312,Census Tract 312,G5020,S,11233173,1554094,42.5300225,-85.8499779,MI,c(-85.8475605325108, 42.5412881878685)
1697,1297,10001676,MONROE CORRECTIONAL COMPLEX,16550 177TH AVE SE,MONROE,WA,98272,NOT AVAILABLE,(360) 794-2600,STATE,OPEN,2499,SNOHOMISH,53061,USA,922140,CORRECTIONAL INSTITUTIONS,http://www.doc.wa.gov/information/data/analytics.htm,1/18/18,IMAGERY,2018-01-18T00:00:00.000Z,http://www.doc.wa.gov/corrections/incarceration/prisons/default.htm,MAXIMUM,2436,0.03838504,4.21E-05,777200.9453,5031.651027,53,61,52209,53061052209,522.09,Census Tract 522.09,G5020,S,8504451,156304,47.8308462,-122.0133548,WA,c(-121.999668920684, 47.8447825518415)
1698,1298,10005708,CURRY COUNTY JUVENILE DETENTION CENTER,700 N MAIN ST,CLOVIS,NM,88101,NOT AVAILABLE,NOT AVAILABLE,COUNTY,OPEN,10,CURRY,35009,USA,922140,CORRECTIONAL INSTITUTIONS,http://www.curryjail.com/,2/15/16,IMAGERY,2018-04-06T00:00:00.000Z,http://www.curryjail.com/,JUVENILE,17,0.001556765,1.13E-07,1689.96875,192.8426853,35,9,100,35009000100,1,Census Tract 1,G5020,S,5839051,0,34.4067065,-103.231639,NM,c(-103.205949764322, 34.4051046291069)
1699,1299,10006270,WASHINGTON COUNTY JUSTICE CENTER,26861 US HWY 34,AKRON,CO,80720,NOT AVAILABLE,(970) 514-3145,COUNTY,OPEN,190,WASHINGTON,8121,USA,922140,CORRECTIONAL INSTITUTIONS,http://washcountyjustice.com/,8/4/16,IMAGERY/OTHER,2018-02-20T00:00:00.000Z,http://washcountyjustice.com/,MAXIMUM,250,0.004432339,7.17E-07,11618.19531,559.3732556,8,121,924200,8121924200,9242,Census Tract 9242,G5020,S,1891834779,8294230,40.1924453,-103.2647949,CO,c(-103.192152530774, 40.1583329832237)
1700,1300,10002455,OLYMPIC CORRECTIONS CENTER,11235 HOH MAINLINE,FORKS,WA,98331,NOT AVAILABLE,(360) 374-7000,STATE,OPEN,392,JEFFERSON,53031,USA,922140,CORRECTIONAL INSTITUTIONS,http://www.doc.wa.gov/information/data/analytics.htm,1/18/18,IMAGERY,2018-01-18T00:00:00.000Z,http://www.doc.wa.gov/corrections/incarceration/prisons/default.htm,MINIMUM,381,0.014797189,4.53E-06,83415.35156,1994.326247,53,31,950702,53031950702,9507.02,Census Tract 9507.02,G5020,S,3995269683,187408540,47.7421905,-123.8061487,WA,c(-124.135299467224, 47.7177613827843)
1701,1301,10005709,DEBACA COUNTY JAIL,248 E AVENUE C,FORT SUMNER,NM,88119,NOT AVAILABLE,NOT AVAILABLE,COUNTY,NOT AVAILABLE,-999,DE BACA,35011,USA,922140,CORRECTIONAL INSTITUTIONS,NOT AVAILABLE,NOT AVAILABLE,UNVERIFIED,2018-04-06T00:00:00.000Z,NOT AVAILABLE,NOT AVAILABLE,-999,0.000828733,3.88E-08,582.625,99.03421096,35,11,960100,35011960100,9601,Census Tract 9601,G5020,S,6016819475,29089486,34.3592729,-104.3686961,NM,c(-104.243501270622, 34.4721937285773)
1702,1302,10002722,COOKE COUNTY JAIL,300 COUNTY RD 451,GAINESVILLE,TX,76240,NOT AVAILABLE,(940) 665-3471,COUNTY,OPEN,162,COOKE,48097,USA,922140,CORRECTIONAL INSTITUTIONS,"https://www.tcjs.state.tx.us/index.php?linkID=325, http://www.co.cooke.tx.us/default.aspx?Cooke_County/DetentionCtr",3/1/18,IMAGERY,2018-04-26T00:00:00.000Z,http://www.co.cooke.tx.us/default.aspx?Cooke_County/DetentionCtr,NOT AVAILABLE,212,0.003527487,5.99E-07,8910.492188,432.6157225,48,97,400,48097000400,4,Census Tract 4,G5020,S,33012395,26645,33.6616023,-97.1763687,TX,c(-97.1684424783871, 33.6493533934692)
1703,1303,10006590,FARGO RESIDENTIAL RE-ENTRY FACILITY FOR FEMALES,3501 WESTRAC DRIVE,FARGO,ND,58103,NOT AVAILABLE,(701) 365-4199,STATE,OPEN,18,CASS,38017,USA,922140,CORRECTIONAL INSTITUTIONS,"http://www.nd.gov/docr/media/stats.html, http://centreinc.org/Fargo/",12/31/16,IMAGERY/OTHER,2017-12-13T00:00:00.000Z,http://centreinc.org/Fargo/,MINIMUM,72,0.002229165,2.20E-07,3980.023438,313.9448607,38,17,600,38017000600,6,Census Tract 6,G5020,S,8943002,0,46.8778896,-96.8226165,ND,c(-96.8383727848402, 46.8664692261169)
1704,1304,10005035,RIVERVIEW PSYCHIATRIC CENTER,250 ARSENAL STREET,AUGUSTA,ME,4330,NOT AVAILABLE,(207) 624-3900,STATE,OPEN,77,KENNEBEC,23011,USA,922140,CORRECTIONAL INSTITUTIONS,"http://www.maine.gov/dhhs/riverview/quarterly-report/index.html, http://www.maine.gov/dhhs/riverview/index.shtml",10/20/17,IMAGERY/OTHER,2017-12-05T00:00:00.000Z,http://www.maine.gov/dhhs/riverview/index.shtml,NOT AVAILABLE,92,0.00646165,1.51E-06,26091.76563,850.4226536,23,11,10500,23011010500,105,Census Tract 105,G5020,S,33708601,1647062,44.2983512,-69.7073145,ME,c(-69.7709673085209, 44.2999669071642)
1705,1305,10006591,MANDAN RESIDENTIAL RE-ENTRY FACILITY,100 6TH AVENUE SE,MANDAN,ND,58554,NOT AVAILABLE,(701) 663-8120,STATE,OPEN,12,MORTON,38059,USA,922140,CORRECTIONAL INSTITUTIONS,"http://www.nd.gov/docr/media/stats.html, http://centreinc.org/Mandan/",12/31/16,IMAGERY/OTHER,2017-12-13T00:00:00.000Z,http://centreinc.org/Mandan/,MINIMUM,76,0.003267625,6.63E-07,12010.58984,424.5105238,38,59,20300,38059020300,203,Census Tract 203,G5020,S,82240051,2756244,46.7841887,-100.8831954,ND,c(-100.879816635248, 46.8256780295163)
1706,1306,10004702,SANGAMON COUNTY JUVENILE DETENTION CENTER,2201 SOUTH DIRKSEN PARKWAY,SPRINGFIELD,IL,62703,4564,(217) 747-8000,COUNTY,OPEN,22,SANGAMON,17167,USA,922140,CORRECTIONAL INSTITUTIONS,http://co.sangamon.il.us/departments/m-r/probation-and-court-services,3/2/18,IMAGERY,2018-03-02T00:00:00.000Z,http://co.sangamon.il.us/departments/m-r/probation-and-court-services,JUVENILE,48,0.005010701,6.76E-07,10907.50781,620.7918936,17,167,2400,17167002400,24,Census Tract 24,G5020,S,4642390,0,39.7800012,-89.6180738,IL,c(-89.6090702234613, 39.7783183618354)
1707,1307,10002193,WELD COUNTY NORTH JAIL COMPLEX,2110 O STREET,GREELEY,CO,80631,NOT AVAILABLE,(970) 356-4015,COUNTY,OPEN,-999,WELD,8123,USA,922140,CORRECTIONAL INSTITUTIONS,https://www.weldsheriff.com/,2/20/18,IMAGERY,2018-02-20T00:00:00.000Z,https://www.weldsheriff.com/,NOT AVAILABLE,80,0.009552858,2.83E-06,46047.01563,1174.974351,8,123,600,8123000600,6,Census Tract 6,G5020,S,4736002,93911,40.443058,-104.7043493,CO,c(-104.710378099701, 40.4508426036188)
1708,1308,10001681,STAFFORD CREEK CORRECTIONS CENTER,191 CONSTANTINE WAY,ABERDEEN,WA,98520,NOT AVAILABLE,(360) 537-1800,STATE,OPEN,1979,GRAYS HARBOR,53027,USA,922140,CORRECTIONAL INSTITUTIONS,http://www.doc.wa.gov/information/data/analytics.htm,1/18/18,IMAGERY/OTHER,2018-01-18T00:00:00.000Z,http://www.doc.wa.gov/corrections/incarceration/prisons/default.htm,MAXIMUM,1972,0.023393241,2.55E-05,462059.9141,3019.946337,53,27,1600,53027001600,16,Census Tract 16,G5020,S,294666915,80908428,46.8732512,-123.9699988,WA,c(-123.919239119647, 46.921650040525)
1709,1309,10004695,SCHUYLER COUNTY JAIL,216 WEST LAFAYETTE STREET,RUSHVILLE,IL,62681,NOT AVAILABLE,(217) 322-4366,COUNTY,OPEN,-999,SCHUYLER,17169,USA,922140,CORRECTIONAL INSTITUTIONS,http://www.ilsheriff.org/index.php/directory,3/2/18,IMAGERY,2018-03-02T00:00:00.000Z,NOT AVAILABLE,NOT AVAILABLE,34,0.001131848,8.00E-08,1296.667969,144.8870096,17,169,970200,17169970200,9702,Census Tract 9702,G5020,S,17528433,37235,40.136241,-90.5427545,IL,c(-90.5644225688492, 40.1203909230933)
1710,1310,10001897,GOSHEN COUNTY DETENTION CENTER,2120 E B ST,TORRINGTON,WY,82240,NOT AVAILABLE,(307) 532-5917,COUNTY,OPEN,37,GOSHEN,56015,USA,922140,CORRECTIONAL INSTITUTIONS,http://www.goshensheriff.org/index.php/departments,5/10/18,IMAGERY/OTHER,2018-05-10T00:00:00.000Z,http://www.goshensheriff.org/index.php,NOT AVAILABLE,90,0.001760563,1.35E-07,2249.582031,229.3749323,56,15,957900,56015957900,9579,Census Tract 9579,G5020,S,88640591,875967,42.0401606,-104.0893488,WY,c(-104.182023982986, 42.0653291726033)
1711,1311,10002816,CORYELL COUNTY JAIL,510 LEON ST,GATESVILLE,TX,76528,NOT AVAILABLE,(254) 865-7201 EXT 232,COUNTY,OPEN,76,CORYELL,48099,USA,922140,CORRECTIONAL INSTITUTIONS,https://www.tcjs.state.tx.us/index.php?linkID=325,3/1/18,IMAGERY/OTHER,2018-04-26T00:00:00.000Z,http://coryellcountysheriff.com/,NOT AVAILABLE,92,0.002095042,2.41E-07,3493.09375,257.0805166,48,99,10300,48099010300,103,Census Tract 103,G5020,S,72505902,116989,31.4335228,-97.7707734,TX,c(-97.7508779054804, 31.4335270571258)
1712,1312,10002197,YUMA COUNTY JAIL / SHERIFF,"310 ASH STREET, SUITE G",WRAY,CO,80758,NOT AVAILABLE,(970) 332-4805,COUNTY,OPEN,10,YUMA,8125,USA,922140,CORRECTIONAL INSTITUTIONS,http://www.yumacountysheriff.net/,2/20/18,IMAGERY,2018-02-20T00:00:00.000Z,http://www.yumacountysheriff.net/,NOT AVAILABLE,-999,0.001751741,1.58E-07,2560.867188,229.1396059,8,125,963100,8125963100,9631,Census Tract 9631,G5020,S,3445560646,9770022,40.0103234,-102.2561784,CO,c(-102.220370721075, 40.0785326322544)
1713,1313,10000264,ALGER CORRECTIONAL FACILITY,N6141 INDUSTRIAL PARK DR,MUNISING,MI,49862,NOT AVAILABLE,(906) 387-5000,STATE,OPEN,886,ALGER,26003,USA,922140,CORRECTIONAL INSTITUTIONS,"http://www.michigan.gov/corrections/0,4551,7-119-1441---,00.html",12/31/16,IMAGERY,2017-12-06T00:00:00.000Z,"http://www.michigan.gov/corrections/0,4551,7-119-68854_1381_1385---,00.html",MAXIMUM,1246,0.014881933,1.23E-05,221606.0117,2066.618727,26,3,300,26003000300,3,Census Tract 3,G5020,S,831237320,24193850,46.2637474,-86.8393449,MI,c(-86.6396173225428, 46.3786156449416)
1714,1314,10001679,WASHINGTON CORRECTIONS CENTER,2321 WEST DAYTON AIRPORT RD,SHELTON,WA,98584,NOT AVAILABLE,(360) 426-4433,STATE,OPEN,1924,MASON,53045,USA,922140,CORRECTIONAL INSTITUTIONS,http://www.doc.wa.gov/information/data/analytics.htm,1/18/18,IMAGERY,2018-01-18T00:00:00.000Z,http://www.doc.wa.gov/corrections/incarceration/prisons/default.htm,MAXIMUM,1398,0.030568994,4.63E-05,845782.5469,3997.513175,53,45,960600,53045960600,9606,Census Tract 9606,G5020,S,50205028,702399,47.2399899,-123.151908,WA,c(-123.192684772149, 47.2381712295331)
1715,1315,10006592,GRAND FORKS RESIDENTIAL TRANSITION PROGRAM,201 S 4TH STREET,GRAND FORKS,ND,58201,NOT AVAILABLE,(701) 775-2681,STATE,OPEN,18,GRAND FORKS,38035,USA,922140,CORRECTIONAL INSTITUTIONS,"http://www.nd.gov/docr/media/stats.html, http://centreinc.org/GrandForks/",12/31/16,IMAGERY/OTHER,2017-12-13T00:00:00.000Z,http://centreinc.org/GrandForks/,MINIMUM,16,0.001577808,1.44E-07,2671.90625,211.3182481,38,35,10600,38035010600,106,Census Tract 106,G5020,S,1212062,52498,47.9189705,-97.0278242,ND,c(-97.0279463469979, 47.9228815781432)
1716,1316,10001364,BELLAMY CREEK CORRECTIONAL FACILITY,1727 W BLUEWATER HWY,IONIA,MI,48846,NOT AVAILABLE,(616) 527-2510,STATE,OPEN,1753,IONIA,26067,USA,922140,CORRECTIONAL INSTITUTIONS,"http://www.michigan.gov/corrections/0,4551,7-119-1441---,00.html",12/31/16,IMAGERY,2017-12-06T00:00:00.000Z,"http://www.michigan.gov/corrections/0,4551,7-119-68854_1381_1385---,00.html",CLOSE,1888,0.026717214,2.40E-05,406487.6992,3392.571428,26,67,982200,26067982200,9822,Census Tract 9822,G5020,S,1987066,0,42.9792254,-85.1044377,MI,c(-85.1043768935139, 42.9778708247028)
1717,1317,10001346,BARAGA CORRECTIONAL FACILITY,13924 WADAGA RD,BARAGA,MI,49908,9204,(906) 353-7070,STATE,OPEN,787,BARAGA,26013,USA,922140,CORRECTIONAL INSTITUTIONS,"http://www.michigan.gov/corrections/0,4551,7-119-1441---,00.html",12/31/16,IMAGERY,2017-12-06T00:00:00.000Z,"http://www.michigan.gov/corrections/0,4551,7-119-68854_1381_1385---,00.html",MAXIMUM,868,0.021858481,1.42E-05,257368.9375,2829.421497,26,13,200,26013000200,2,Census Tract 2,G5020,S,1243652674,64225265,46.6032533,-88.4835894,MI,c(-88.5112163798181, 46.7625486668433)
1718,1318,10004139,COMMUNITY CORRECTIONS CENTER - LINCOLN,2720 W VAN DORN ST,LINCOLN,NE,68522,NOT AVAILABLE,(402) 471-0740,STATE,OPEN,381,LANCASTER,31109,USA,922140,CORRECTIONAL INSTITUTIONS,https://corrections.nebraska.gov/public-information/statistics-reports/ndcs-reports,9/30/17,IMAGERY,2017-12-13T00:00:00.000Z,https://corrections.nebraska.gov/facilities,MINIMUM,300,0.005580266,1.25E-06,20436.40234,669.5158616,31,109,3401,31109003401,34.01,Census Tract 34.01,G5020,S,9772375,31408,40.795292,-96.7715464,NE,c(-96.7603877820296, 40.7859141410594)
1719,1319,10004707,SHELBY COUNTY JAIL,151 NORTH MORGAN STREET,SHELBYVILLE,IL,62565,NOT AVAILABLE,(217) 774-3941,COUNTY,OPEN,-999,SHELBY,17173,USA,922140,CORRECTIONAL INSTITUTIONS,http://www.ilsheriff.org/index.php/directory,3/2/18,IMAGERY,2018-03-02T00:00:00.000Z,http://www.scso87.org/,NOT AVAILABLE,27,0.001663594,1.29E-07,2061.425781,207.1683562,17,173,959300,17173959300,9593,Census Tract 9593,G5020,S,17668906,68907,39.4062937,-88.8027798,IL,c(-88.7916934307495, 39.4074027470884)
1720,1320,10001362,CENTRAL MICHIGAN CORRECTIONAL FACILITY,320 N HUBBARD,ST LOUIS,MI,48880,NOT AVAILABLE,(989) 681-6668,STATE,OPEN,2542,GRATIOT,26057,USA,922140,CORRECTIONAL INSTITUTIONS,"http://www.michigan.gov/corrections/0,4551,7-119-1441---,00.html",12/31/16,IMAGERY,2017-12-06T00:00:00.000Z,"http://www.michigan.gov/corrections/0,4551,7-119-68854_1381_1385---,00.html",MINIMUM,2566,0.021481099,2.06E-05,351042.2461,2643.078751,26,57,400,26057000400,4,Census Tract 4,G5020,S,566259,0,43.415002,-84.5924849,MI,c(-84.5926954708796, 43.4134939086837)
1721,1321,10003796,DOA ANA COUNTY DETENTION CENTER,1850 COPPER LOOP,LAS CRUCES,NM,88005,NOT AVAILABLE,NOT AVAILABLE,COUNTY,OPEN,758,DONA ANA,35013,USA,922140,CORRECTIONAL INSTITUTIONS,https://www.donaanacounty.org/detention,4/6/18,IMAGERY,2018-04-06T00:00:00.000Z,https://www.donaanacounty.org/detention,MAXIMUM,896,0.011059525,4.41E-06,64612.30469,1319.159528,35,13,201,35013000201,2.01,Census Tract 2.01,G5020,S,8448224,51532,32.2970398,-106.7970623,NM,c(-106.805497103536, 32.3023221765626)
1722,1322,10002156,BAKER COUNTY DETENTION CENTER,1 SHERIFF'S OFFICE DRIVE,MACCLENNY,FL,32063,NOT AVAILABLE,(904) 259-3311,COUNTY,OPEN,469,BAKER,12003,USA,922140,CORRECTIONAL INSTITUTIONS,"http://www.dc.state.fl.us/pub/jails/, http://www.bakerso.com/",2/20/18,IMAGERY,2018-02-20T00:00:00.000Z,http://www.bakerso.com/,NOT AVAILABLE,508,0.007945109,1.42E-06,20403.30664,945.0881476,12,3,40101,12003040101,401.01,Census Tract 401.01,G5020,S,75834324,0,30.3211359,-82.0993295,FL,c(-82.1216275323696, 30.2963490350533)
1723,1323,10004415,CROCKETT COUNTY JAIL,903 AVENUE D,OZONA,TX,76943,NOT AVAILABLE,NOT AVAILABLE,COUNTY,OPEN,-999,CROCKETT,48105,USA,922140,CORRECTIONAL INSTITUTIONS,"https://www.tcjs.state.tx.us/index.php?linkID=325, http://www.ozona.com/directoryListings/index/county-officials",3/1/18,IMAGERY,2018-04-26T00:00:00.000Z,NOT AVAILABLE,NOT AVAILABLE,13,0.001848868,1.83E-07,2641.453125,221.9009691,48,105,950100,48105950100,9501,Census Tract 9501,G5020,S,7270935061,53329,30.7175316,-101.4042113,TX,c(-101.200082061857, 30.7115299491019)
1724,1324,10004377,CROSBY COUNTY JAIL,201 WEST ASPEN STREET,CROSBYTON,TX,79322,NOT AVAILABLE,NOT AVAILABLE,COUNTY,OPEN,6,CROSBY,48107,USA,922140,CORRECTIONAL INSTITUTIONS,"https://www.tcjs.state.tx.us/index.php?linkID=325, https://texasjailproject.org/list_of_county_jails/",3/1/18,IMAGERY,2018-04-26T00:00:00.000Z,NOT AVAILABLE,NOT AVAILABLE,11,0.00140562,1.15E-07,1719.464844,176.1920443,48,107,950100,48107950100,9501,Census Tract 9501,G5020,S,1056088719,3813785,33.6331748,-101.1785157,TX,c(-101.240336754097, 33.6584796241206)
1725,1325,10004126,COMMUNITY CORRECTIONS CENTER - OMAHA,2320 AVENUE J,OMAHA,NE,68110,NOT AVAILABLE,(402) 595-2010,STATE,OPEN,163,DOUGLAS,31055,USA,922140,CORRECTIONAL INSTITUTIONS,https://corrections.nebraska.gov/public-information/statistics-reports/ndcs-reports,9/30/17,IMAGERY,2017-12-13T00:00:00.000Z,https://corrections.nebraska.gov/facilities,MINIMUM,135,0.003433658,3.29E-07,5427.90625,430.8646568,31,55,500,31055000500,5,Census Tract 5,G5020,S,17635488,2547792,41.3024254,-95.8927626,NE,c(-95.9004566982512, 41.2835531146302)
1726,1326,10002506,WASHINGTON STATE PENITENTIARY,1313 N 13TH AVE,WALLA WALLA,WA,99362,NOT AVAILABLE,(509) 525-3610,STATE,OPEN,2593,WALLA WALLA,53071,USA,922140,CORRECTIONAL INSTITUTIONS,http://www.doc.wa.gov/information/data/analytics.htm,1/18/18,IMAGERY,2018-01-18T00:00:00.000Z,http://www.doc.wa.gov/corrections/incarceration/prisons/default.htm,MAXIMUM,2439,0.03238856,4.77E-05,851720.5703,4131.197558,53,71,920400,53071920400,9204,Census Tract 9204,G5020,S,2273790,0,46.0795897,-118.3682705,WA,c(-118.364223510062, 46.0798678849253)
1727,1327,10004137,DIAGNOSTIC AND EVALUATION CENTER,3220 W VAN DORN ST,LINCOLN,NE,68522,9284,(402) 471-3330,STATE,OPEN,489,LANCASTER,31109,USA,922140,CORRECTIONAL INSTITUTIONS,https://corrections.nebraska.gov/public-information/statistics-reports/ndcs-reports,9/30/17,IMAGERY,2017-12-13T00:00:00.000Z,https://corrections.nebraska.gov/facilities,MAXIMUM,275,0.006946971,2.61E-06,42669.60547,852.4490888,31,109,3401,31109003401,34.01,Census Tract 34.01,G5020,S,9772375,31408,40.795292,-96.7715464,NE,c(-96.7668594934096, 40.7860996094466)
1728,1328,10003846,CHARLES EGELER RECEPTION & GUIDANCE CENTER,3855 COOPER ST,JACKSON,MI,49201,7547,(517) 780-5600,STATE,OPEN,950,JACKSON,26075,USA,922140,CORRECTIONAL INSTITUTIONS,"http://www.michigan.gov/corrections/0,4551,7-119-1441---,00.html",12/31/16,IMAGERY,2017-12-06T00:00:00.000Z,"http://www.michigan.gov/corrections/0,4551,7-119-68854_1381_1385---,00.html",MEDIUM,1485,0.018763672,1.35E-05,226839.4375,2370.4968,26,75,5800,26075005800,58,Census Tract 58,G5020,S,2383646,2914,42.2958029,-84.3894236,MI,c(-84.3892004062952, 42.2997952507055)
1729,1329,10002440,BELLINGHAM WORK RELEASE,1127 N GARDEN ST,BELLINGHAM,WA,98225,NOT AVAILABLE,(360) 676-2150,STATE,OPEN,25,WHATCOM,53073,USA,922140,CORRECTIONAL INSTITUTIONS,http://www.doc.wa.gov/corrections/prea/resources.htm,4/21/16,IMAGERY,2018-01-18T00:00:00.000Z,http://www.doc.wa.gov/corrections/incarceration/work-release/locations.htm,MINIMUM,25,0.000827312,3.71E-08,697.421875,107.9853479,53,73,1000,53073001000,10,Census Tract 10,G5020,S,2481598,0,48.7369217,-122.4797992,WA,c(-122.477257095239, 48.7459024254544)
1730,1330,10002460,BROWNSTONE WORK RELEASE,223 S BROWNE  ST,SPOKANE,WA,99201,NOT AVAILABLE,(509) 381-6220,STATE,OPEN,61,SPOKANE,53063,USA,922140,CORRECTIONAL INSTITUTIONS,http://www.doc.wa.gov/corrections/prea/resources.htm,5/19/15,IMAGERY,2018-01-18T00:00:00.000Z,http://www.doc.wa.gov/corrections/incarceration/work-release/locations.htm,MINIMUM,80,0.001194223,8.11E-08,1491.742188,174.0610058,53,63,3500,53063003500,35,Census Tract 35,G5020,S,1628094,107706,47.6575712,-117.4215755,WA,c(-117.413146914004, 47.65381922639)
1731,1331,10003947,BAY COUNTY JAIL,5700 STAR LANE,PANAMA CITY,FL,32404,NOT AVAILABLE,(850) 785-5245,COUNTY,OPEN,900,BAY,12005,USA,922140,CORRECTIONAL INSTITUTIONS,http://www.bayso.org/index.html,2/20/18,IMAGERY,2018-02-20T00:00:00.000Z,http://www.bayso.org/index.html,MAXIMUM,1200,0.010584256,3.66E-06,52515.84961,1301.319887,12,5,500,12005000500,5,Census Tract 5,G5020,S,338037965,28527612,30.1593438,-85.481657,FL,c(-85.5619705118186, 30.2265509976221)
1732,1332,10002495,AHTANUM VIEW CORRECTIONS CENTER,2009 S 64TH AVE,YAKIMA,WA,98903,NOT AVAILABLE,NOT AVAILABLE,STATE,CLOSED,0,YAKIMA,53077,USA,922140,CORRECTIONAL INSTITUTIONS,http://www.nbcrightnow.com/story/12053876/ahtanum-view-prison-shuts-down-employees-say-goodbye,2/26/10,IMAGERY,2018-01-18T00:00:00.000Z,NOT AVAILABLE,MINIMUM,120,0.002131241,2.28E-07,4107.414063,293.6600952,53,77,2802,53077002802,28.02,Census Tract 28.02,G5020,S,29882944,0,46.5714185,-120.6263655,WA,c(-120.593121465429, 46.5678155174885)
1733,1333,10002166,BREVARD COUNTY JAIL COMPLEX,860 CAMP RD,COCOA,FL,32927,NOT AVAILABLE,(321) 690-1500,COUNTY,OPEN,1679,BREVARD,12009,USA,922140,CORRECTIONAL INSTITUTIONS,"http://www.dc.state.fl.us/pub/jails/, http://www.brevardsheriff.com/home/commands-services/",2/20/18,IMAGERY,2018-02-20T00:00:00.000Z,http://www.brevardsheriff.com/home/commands-services/,MAXIMUM,1701,0.013179485,5.88E-06,82940.26367,1571.798679,12,9,62109,12009062109,621.09,Census Tract 621.09,G5020,S,11169442,0,28.4536614,-80.7850991,FL,c(-80.7818139457685, 28.4484529311797)
1734,1334,10006788,ALLEGAN COUNTY JUVENILE DETENTION CENTER,2243 33RD ST,ALLEGAN,MI,49010,NOT AVAILABLE,(269) 686-4630,COUNTY,OPEN,-999,ALLEGAN,26005,USA,922140,CORRECTIONAL INSTITUTIONS,http://cms.allegancounty.org/sites/Office/CC/Family/Detention/SitePages/Home.aspx#.WrE2ZfnwbmE,3/20/18,IMAGERY,2018-03-20T00:00:00.000Z,http://cms.allegancounty.org/sites/Office/CC/Family/Detention/SitePages/Home.aspx#.WrE2ZfnwbmE,JUVENILE,22,0.004364116,6.77E-07,11390.34766,571.3759238,26,5,31100,26005031100,311,Census Tract 311,G5020,S,167214539,6310756,42.503086,-85.8252949,MI,c(-85.8683427975824, 42.5819492604384)
1735,1335,10005154,ANTRIM COUNTY JAIL,107 GROVE STREET,BELLAIRE,MI,49615,NOT AVAILABLE,(231) 533-8627,COUNTY,OPEN,-999,ANTRIM,26009,USA,922140,CORRECTIONAL INSTITUTIONS,http://www.michigan.gov/documents/corrections/JPIS_-_CY_2010_344047_7.pdf,3/20/18,IMAGERY/OTHER,2018-03-20T00:00:00.000Z,http://www.antrimcounty.org/sheriff.asp,NOT AVAILABLE,56,0.001742833,1.69E-07,2962.449219,232.1533103,26,9,960400,26009960400,9604,Census Tract 9604,G5020,S,118203576,13728155,44.9599099,-85.1876894,MI,c(-85.2076193832573, 44.9757985549315)
1736,1336,10005169,ARENAC COUNTY JAIL,126 GROVE STREET,STANDISH,MI,48658,NOT AVAILABLE,(989) 846-3002,COUNTY,OPEN,-999,ARENAC,26011,USA,922140,CORRECTIONAL INSTITUTIONS,http://www.arenaccountygov.com/sheriff/,3/20/18,IMAGERY/OTHER,2018-03-20T00:00:00.000Z,http://www.arenaccountygov.com/sheriff/,NOT AVAILABLE,46,0.002375186,1.77E-07,3054.621094,303.2896685,26,11,970500,26011970500,9705,Census Tract 9705,G5020,S,126793398,5715608,43.955559,-83.9533585,MI,c(-83.9565181856004, 43.9836550921047)
1737,1337,10004138,LINCOLN CORRECTIONAL CENTER,3216 W VAN DORN ST,LINCOLN,NE,68522,NOT AVAILABLE,(402) 471-2861,STATE,OPEN,510,LANCASTER,31109,USA,922140,CORRECTIONAL INSTITUTIONS,https://corrections.nebraska.gov/public-information/statistics-reports/ndcs-reports,9/30/17,IMAGERY,2017-12-13T00:00:00.000Z,https://corrections.nebraska.gov/facilities,MAXIMUM,468,0.011791873,8.38E-06,137211.3125,1487.54168,31,109,3401,31109003401,34.01,Census Tract 34.01,G5020,S,9772375,31408,40.795292,-96.7715464,NE,c(-96.7659643220346, 40.7879871498447)
1738,1338,10002084,CHIPPEWA CORRECTIONAL FACILITY,4269 W. M-80,KINCHELOE,MI,49784,NOT AVAILABLE,(906) 495-2275,STATE,OPEN,2322,CHIPPEWA,26033,USA,922140,CORRECTIONAL INSTITUTIONS,"http://www.michigan.gov/corrections/0,4551,7-119-1441---,00.html",12/31/16,IMAGERY,2017-12-06T00:00:00.000Z,"http://www.michigan.gov/corrections/0,4551,7-119-68854_1381_1385---,00.html",MAXIMUM,2366,0.024724901,1.99E-05,357331.1016,3029.087234,26,33,980200,26033980200,9802,Census Tract 9802,G5020,S,349853,0,46.2576809,-84.4548573,MI,c(-84.4554376644334, 46.2573961932114)
1739,1339,10002189,BROWARD COUNTY MAIN JAIL,555 SE 1ST AVE,FT. LAUDERDALE,FL,33301,NOT AVAILABLE,(954) 831-5900,COUNTY,OPEN,1414,BROWARD,12011,USA,922140,CORRECTIONAL INSTITUTIONS,http://www.sheriff.org/DOD/Pages/Jail-Facilities.aspx,2/20/18,IMAGERY,2018-02-20T00:00:00.000Z,http://www.sheriff.org/DOD/Pages/Jail-Facilities.aspx,MAXIMUM,1538,0.003495913,5.50E-07,7587.662109,409.3959588,12,11,42500,12011042500,425,Census Tract 425,G5020,S,2004339,0,26.1222046,-80.1412557,FL,c(-80.1422807485202, 26.1160821631257)
1740,1340,10001738,NEBRASKA CORRECTIONAL CENTER FOR WOMEN,1107 RECHARGE RD,YORK,NE,68467,8003,(402) 362-3317,STATE,OPEN,340,YORK,31185,USA,922140,CORRECTIONAL INSTITUTIONS,https://corrections.nebraska.gov/public-information/statistics-reports/ndcs-reports,9/30/17,IMAGERY,2017-12-13T00:00:00.000Z,https://corrections.nebraska.gov/facilities,MAXIMUM,318,0.01238319,7.90E-06,129516.2031,1526.378055,31,185,969800,31185969800,9698,Census Tract 9698,G5020,S,47847226,385430,40.8468799,-97.5868809,NE,c(-97.6286685682688, 40.8640905655256)
1741,1341,10002459,ELEANOR CHASE HOUSE WORK RELEASE,427 W 7TH AVE,SPOKANE,WA,99204,NOT AVAILABLE,(509) 381-6300,STATE,OPEN,26,SPOKANE,53063,USA,922140,CORRECTIONAL INSTITUTIONS,http://www.doc.wa.gov/corrections/prea/resources.htm,5/20/15,IMAGERY,2018-01-18T00:00:00.000Z,http://www.doc.wa.gov/corrections/incarceration/work-release/locations.htm,MINIMUM,40,0.001852268,1.36E-07,2507.226563,242.1755064,53,63,3200,53063003200,32,Census Tract 32,G5020,S,1241810,0,47.6492994,-117.4146338,WA,c(-117.418994230166, 47.649125389758)
1742,1342,10002470,HELEN B RATCLIFF WORK RELEASE,1531 13TH AVE S,SEATTLE,WA,98144,NOT AVAILABLE,(206) 320-6600,STATE,OPEN,40,KING,53033,USA,922140,CORRECTIONAL INSTITUTIONS,http://www.doc.wa.gov/corrections/prea/resources.htm,3/28/17,IMAGERY,2018-01-18T00:00:00.000Z,http://www.doc.wa.gov/corrections/incarceration/work-release/locations.htm,MINIMUM,47,0.00124636,7.78E-08,1429,170.7342639,53,33,9400,53033009400,94,Census Tract 94,G5020,S,1723075,0,47.5881924,-122.3098671,WA,c(-122.316312313797, 47.5889742767778)
1743,1343,10004127,NEBRASKA CORRECTIONAL YOUTH FACILITY,2610 N 20TH ST E,OMAHA,NE,68110,NOT AVAILABLE,(402) 595-2000,STATE,OPEN,50,DOUGLAS,31055,USA,922140,CORRECTIONAL INSTITUTIONS,https://corrections.nebraska.gov/public-information/statistics-reports/ndcs-reports,9/30/17,IMAGERY,2017-12-13T00:00:00.000Z,https://corrections.nebraska.gov/facilities,JUVENILE,70,0.007516856,2.45E-06,40433.05469,919.3360585,31,55,500,31055000500,5,Census Tract 5,G5020,S,17635488,2547792,41.3024254,-95.8927626,NE,c(-95.9060597514343, 41.282519154705)
1744,1344,10000538,NORTH BROWARD BUREAU,1550 NW 30TH AVE,POMPANO BEACH,FL,33069,NOT AVAILABLE,(954) 831-5900,COUNTY,OPEN,954,BROWARD,12011,USA,922140,CORRECTIONAL INSTITUTIONS,http://www.sheriff.org/DOD/Pages/Jail-Facilities.aspx,2/20/18,IMAGERY,2018-02-20T00:00:00.000Z,http://www.sheriff.org/DOD/Pages/Jail-Facilities.aspx,MEDIUM,1200,0.007183235,2.10E-06,29043.95508,847.3969122,12,11,30600,12011030600,306,Census Tract 306,G5020,S,7647622,410888,26.2542849,-80.1574777,FL,c(-80.1627192996775, 26.2480460864745)
1745,1345,10006739,STARK COUNTY JAIL,130 W. JEFFERSON,TOULON,IL,61483,NOT AVAILABLE,(309) 286-2541,COUNTY,OPEN,-999,STARK,17175,USA,922140,CORRECTIONAL INSTITUTIONS,http://www.ilsheriff.org/index.php/directory,3/2/18,IMAGERY,2018-03-02T00:00:00.000Z,NOT AVAILABLE,NOT AVAILABLE,13,0.000946775,4.23E-08,695.21875,120.0831294,17,175,951400,17175951400,9514,Census Tract 9514,G5020,S,337466017,659612,41.1616917,-89.7977965,IL,c(-89.8660489989688, 41.0931269331618)
1746,1346,10005144,BARAGA COUNTY JAIL,940 US HIGHWAY 41,L'ANSE,MI,49946,NOT AVAILABLE,(906) 524-6100 EXT 695,COUNTY,OPEN,21,BARAGA,26013,USA,922140,CORRECTIONAL INSTITUTIONS,http://www.michigan.gov/documents/corrections/JPIS_-_CY_2010_344047_7.pdf,3/4/16,IMAGERY/OTHER,2018-03-20T00:00:00.000Z,https://www.baragacounty.org/government/departments/county-sheriff/,NOT AVAILABLE,26,0.001524425,1.12E-07,2032.292969,200.392243,26,13,100,26013000100,1,Census Tract 1,G5020,S,1083261692,85290785,46.7423282,-88.237294,MI,c(-88.4407742664857, 46.7488632203049)
1747,1347,10005717,EDDY COUNTY DETENTION CENTER,201 N MAIN,CARLSBAD,NM,88220,NOT AVAILABLE,(575) 887-7556,COUNTY,OPEN,-999,EDDY,35015,USA,922140,CORRECTIONAL INSTITUTIONS,"http://www.co.eddy.nm.us/148/Departments, https://www.nmlegis.gov/handouts/CCJ%20052716%20Item%203%20NM%20County%20Jails%20An%20Overview.pdf",5/27/16,IMAGERY,2018-04-06T00:00:00.000Z,http://www.co.eddy.nm.us/148/Departments,NOT AVAILABLE,301,0.005076579,6.40E-07,9401.300781,623.000508,35,15,100,35015000100,1,Census Tract 1,G5020,S,2245582,182831,32.4244435,-104.2260142,NM,c(-104.226996136429, 32.4220344571688)
1748,1348,10002752,WEST TOWER DETENTION FACILITY,111 W COMMERCE ST,DALLAS,TX,75202,NOT AVAILABLE,NOT AVAILABLE,COUNTY,OPEN,-999,DALLAS,48113,USA,922140,CORRECTIONAL INSTITUTIONS,http://www.dallascounty.org/department/sheriff/sheriff_index.php,4/26/18,IMAGERY/OTHER,2018-04-26T00:00:00.000Z,http://www.dallascounty.org/department/sheriff/sheriff_index.php,MAXIMUM,1530,0.004369281,7.75E-07,11425.95703,518.616095,48,113,10000,48113010000,100,Census Tract 100,G5020,S,31397013,463801,32.8114428,-96.8620144,TX,c(-96.815674279612, 32.7775557170481)
1749,1349,10002088,CARSON CITY CORRECTIONAL FACILITY,10274 BOYER RD,CARSON CITY,MI,48811,9746,(989) 584-3941,STATE,OPEN,2240,MONTCALM,26117,USA,922140,CORRECTIONAL INSTITUTIONS,"http://www.michigan.gov/corrections/0,4551,7-119-1441---,00.html",12/31/16,IMAGERY,2017-12-06T00:00:00.000Z,"http://www.michigan.gov/corrections/0,4551,7-119-68854_1381_1385---,00.html",CLOSE,2248,0.025191156,2.51E-05,426612.0859,3052.655244,26,117,971000,26117971000,9710,Census Tract 9710,G5020,S,209477396,823642,43.1703843,-84.9428764,MI,c(-84.8706099130872, 43.1605526562761)
1750,1350,10000278,COOPER STREET CORRECTIONAL FACILITY,3100 COOPER ST,JACKSON,MI,49201,NOT AVAILABLE,(517) 780-6175,STATE,OPEN,1739,JACKSON,26075,USA,922140,CORRECTIONAL INSTITUTIONS,"http://www.michigan.gov/corrections/0,4551,7-119-1441---,00.html",12/31/16,IMAGERY,2017-12-06T00:00:00.000Z,"http://www.michigan.gov/corrections/0,4551,7-119-68854_1381_1385---,00.html",MINIMUM,1754,0.013555855,1.05E-05,175999.8789,1695.881393,26,75,5800,26075005800,58,Census Tract 58,G5020,S,2383646,2914,42.2958029,-84.3894236,MI,c(-84.396993758367, 42.2959408210009)
1751,1351,10001739,NEBRASKA STATE PENITENTIARY,4201 S 14TH ST,LINCOLN,NE,68502,NOT AVAILABLE,(402) 471-3161,STATE,OPEN,1341,LANCASTER,31109,USA,922140,CORRECTIONAL INSTITUTIONS,https://corrections.nebraska.gov/public-information/statistics-reports/ndcs-reports,9/30/17,IMAGERY,2017-12-13T00:00:00.000Z,https://corrections.nebraska.gov/facilities,MAXIMUM,1139,0.014557677,1.26E-05,205539.1797,1857.14098,31,109,3601,31109003601,36.01,Census Tract 36.01,G5020,S,194262,0,40.7700166,-96.7038431,NE,c(-96.7041152167605, 40.7696855622503)
1752,1352,10002493,OLYMPIA WORK RELEASE,1800 11TH AVE SW,OLYMPIA,WA,98502,NOT AVAILABLE,(360) 586-2731,STATE,OPEN,25,THURSTON,53067,USA,922140,CORRECTIONAL INSTITUTIONS,http://www.doc.wa.gov/corrections/prea/resources.htm,4/19/16,IMAGERY,2018-01-18T00:00:00.000Z,http://www.doc.wa.gov/corrections/incarceration/work-release/locations.htm,MINIMUM,25,0.001315437,9.66E-08,1755.921875,169.4549429,53,67,10520,53067010520,105.2,Census Tract 105.20,G5020,S,3715505,586278,47.0375908,-122.9174763,WA,c(-122.925364673, 47.0377828592886)
1753,1353,10001375,DETROIT DETENTION CENTER,17601 MOUND RD,DETROIT,MI,48212,NOT AVAILABLE,(313) 368-8300,STATE,OPEN,-999,WAYNE,26163,USA,922140,CORRECTIONAL INSTITUTIONS,"http://www.michigan.gov/corrections/0,4551,7-119-68854_1381_1385---,00.html",12/6/17,IMAGERY,2017-12-06T00:00:00.000Z,"http://www.michigan.gov/corrections/0,4551,7-119-68854_1381_1385---,00.html",NOT AVAILABLE,-999,0.017193527,8.52E-06,143105.8984,2028.900947,26,163,506400,26163506400,5064,Census Tract 5064,G5020,S,1824589,0,42.4225996,-83.0523153,MI,c(-83.0476790559486, 42.4237281969817)
1754,1354,10001376,DETROIT RE-ENTRY CENTER,17600 RYAN RD,DETROIT,MI,48212,NOT AVAILABLE,(313) 368-3200,STATE,OPEN,-999,WAYNE,26163,USA,922140,CORRECTIONAL INSTITUTIONS,"http://www.michigan.gov/corrections/0,4551,7-119-68854_1381_1385---,00.html",3/1/14,IMAGERY,2017-12-06T00:00:00.000Z,"http://www.michigan.gov/corrections/0,4551,7-119-68854_1381_1385---,00.html",MEDIUM,1044,0.017050594,8.94E-06,150050.3945,2017.568775,26,163,506400,26163506400,5064,Census Tract 5064,G5020,S,1824589,0,42.4225996,-83.0523153,MI,c(-83.0578476989054, 42.4234892360742)
1755,1355,10004125,OMAHA CORRECTIONAL CENTER,2323 AVENUE J,OMAHA,NE,68110,99,(402) 595-3963,STATE,OPEN,772,DOUGLAS,31055,USA,922140,CORRECTIONAL INSTITUTIONS,https://corrections.nebraska.gov/public-information/statistics-reports/ndcs-reports,9/30/17,IMAGERY,2017-12-13T00:00:00.000Z,https://corrections.nebraska.gov/facilities,MEDIUM,666,0.013045927,9.92E-06,163621.0117,1622.463468,31,55,500,31055000500,5,Census Tract 5,G5020,S,17635488,2547792,41.3024254,-95.8927626,NE,c(-95.898650190349, 41.28124336828)
1756,1356,10002154,CALHOUN COUNTY JAIL,20776 CENTRAL AVENUE EAST,BLOUNTSTOWN,FL,32424,2276,(850) 674-5049,COUNTY,OPEN,72,CALHOUN,12013,USA,922140,CORRECTIONAL INSTITUTIONS,http://www.calhounsheriff.com/index.html,2/20/18,IMAGERY,2018-02-20T00:00:00.000Z,http://www.calhounsheriff.com/index.html,NOT AVAILABLE,-999,0.002171966,1.86E-07,2677.626953,267.0832963,12,13,10300,12013010300,103,Census Tract 103,G5020,S,390315344,10375495,30.371792,-85.0982814,FL,c(-85.0426025071762, 30.4439247984844)
1757,1357,10005990,PROGRESS HOUSE WORK RELEASE,5601 6TH AVENUE,TACOMA,WA,98406,NOT AVAILABLE,(253) 593-2844,STATE,OPEN,68,PIERCE,53053,USA,922140,CORRECTIONAL INSTITUTIONS,http://www.doc.wa.gov/corrections/prea/resources.htm,8/29/17,IMAGERY/OTHER,2018-01-18T00:00:00.000Z,http://www.doc.wa.gov/corrections/incarceration/work-release/locations.htm,MINIMUM,86,0.002436834,1.92E-07,3510.429688,315.7544783,53,53,60906,53053060906,609.06,Census Tract 609.06,G5020,S,1573418,0,47.2633152,-122.5097996,WA,c(-122.512060841213, 47.2564261698174)
1758,1358,10002472,REYNOLDS WORK RELEASE,410 4TH AVE,SEATTLE,WA,98104,NOT AVAILABLE,(206) 464-6320,STATE,OPEN,94,KING,53033,USA,922140,CORRECTIONAL INSTITUTIONS,http://www.doc.wa.gov/corrections/prea/resources.htm,3/29/17,IMAGERY,2018-01-18T00:00:00.000Z,http://www.doc.wa.gov/corrections/incarceration/work-release/locations.htm,MINIMUM,99,0.001169682,7.25E-08,1333.203125,150.5344702,53,33,8100,53033008100,81,Census Tract 81,G5020,S,827622,368891,47.6058683,-122.3393353,WA,c(-122.328953618513, 47.6022139176715)
1759,1359,10002505,TRI-CITIES WORK RELEASE,524 E BRUNEAU AVE,KENNEWICK,WA,99336,NOT AVAILABLE,(509) 585-2211,STATE,OPEN,25,BENTON,53005,USA,922140,CORRECTIONAL INSTITUTIONS,http://www.doc.wa.gov/corrections/prea/resources.htm,11/17/15,IMAGERY,2018-01-18T00:00:00.000Z,http://www.doc.wa.gov/corrections/incarceration/work-release/locations.htm,MINIMUM,30,0.002605786,3.76E-07,6740.609375,376.3248336,53,5,11300,53005011300,113,Census Tract 113,G5020,S,5250708,1791651,46.2088971,-119.1124925,WA,c(-119.10847248429, 46.2097475387828)
1760,1360,10003851,BERRIEN COUNTY JAIL,919 PORT ST,ST. JOSEPH,MI,49085,NOT AVAILABLE,(269) 983-7141 EXT 7777,COUNTY,OPEN,275,BERRIEN,26021,USA,922140,CORRECTIONAL INSTITUTIONS,http://bcsheriff.org/253/Sheriffs-Office,3/20/18,IMAGERY/OTHER,2018-03-20T00:00:00.000Z,http://bcsheriff.org/253/Sheriffs-Office,NOT AVAILABLE,341,0.002939126,4.36E-07,7283.800781,375.2886967,26,21,800,26021000800,8,Census Tract 8,G5020,S,5253722,3462761,42.1088434,-86.4842214,MI,c(-86.4762554046632, 42.1096986268258)
1761,1361,10001742,TECUMSEH STATE CORRECTIONAL INSTITUTION,2725 HWY 50,TECUMSEH,NE,68450,NOT AVAILABLE,(402) 335-5998,STATE,OPEN,1017,JOHNSON,31097,USA,922140,CORRECTIONAL INSTITUTIONS,https://corrections.nebraska.gov/public-information/statistics-reports/ndcs-reports,9/30/17,IMAGERY,2017-12-13T00:00:00.000Z,https://corrections.nebraska.gov/facilities,MAXIMUM,976,0.017794574,1.82E-05,296021.9063,2202.886928,31,97,967600,31097967600,9676,Census Tract 9676,G5020,S,249454347,459385,40.337638,-96.1537256,NE,c(-96.1852747193869, 40.4022316636058)
1762,1362,10005716,GRANT COUNTY JAIL / JUVENILE DETENTION CENTER,209 N BLACK ST,SILVER CITY,NM,88061,NOT AVAILABLE,(505) 534-3803,COUNTY,NOT AVAILABLE,-999,GRANT,35017,USA,922140,CORRECTIONAL INSTITUTIONS,http://www.nmjustice.net/nmsc/juvenile/program.php?id=421,2/15/16,UNVERIFIED,2018-04-06T00:00:00.000Z,NOT AVAILABLE,NOT AVAILABLE,10,0.00200548,1.65E-07,2426.351563,243.575377,35,17,964400,35017964400,9644,Census Tract 9644,G5020,S,13374604,41691,32.7637077,-108.2746224,NM,c(-108.281483572113, 32.7704791337154)
1763,1363,10002188,CHARLOTTE COUNTY JAIL,26601 AIRPORT RD,PUNTA GORDA,FL,33982,NOT AVAILABLE,(941) 833-6300,COUNTY,OPEN,640,CHARLOTTE,12015,USA,922140,CORRECTIONAL INSTITUTIONS,"http://www.dc.state.fl.us/pub/jails/, https://www.ccso.org/",2/20/18,IMAGERY,2018-02-20T00:00:00.000Z,https://www.ccso.org/,MAXIMUM,960,0.012119001,3.41E-06,47411.72266,1423.298361,12,15,10501,12015010501,105.01,Census Tract 105.01,G5020,S,46558647,1559585,26.910363,-81.9928748,FL,c(-82.0067906053492, 26.9142834365438)
1764,1364,10002476,ECHO GLEN CHILDREN'S CENTER,33010 SE 99TH ST,SNOQUALMIE,WA,98065,NOT AVAILABLE,(425) 831-2500,STATE,OPEN,139,KING,53033,USA,922140,CORRECTIONAL INSTITUTIONS,https://www.dshs.wa.gov/ra/juvenile-rehabilitation/prison-rape-elimination-act-compliance,12/2/16,IMAGERY,2018-01-18T00:00:00.000Z,https://www.dshs.wa.gov/ra/juvenile-rehabilitation/institutions,JUVENILE,125,0.024608691,1.74E-05,318961.3438,3366.283018,53,33,32602,53033032602,326.02,Census Tract 326.02,G5020,S,30197235,640789,47.5350747,-121.8783343,WA,c(-121.89932746707, 47.5182191124533)
1765,1365,10002502,CAMP OUTLOOK,1270 N EPHRATA ST,CONNELL,WA,99326,NOT AVAILABLE,(509) 234-5200,STATE,CLOSED,0,FRANKLIN,53021,USA,922140,CORRECTIONAL INSTITUTIONS,https://www.dshs.wa.gov/ra/juvenile-rehabilitation/prison-rape-elimination-act-compliance,1/18/18,IMAGERY,2018-01-18T00:00:00.000Z,NOT AVAILABLE,JUVENILE,-999,0.003886792,6.20E-07,11200.97656,491.1684856,53,21,20800,53021020800,208,Census Tract 208,G5020,S,1177246221,12043386,46.6393457,-119.0316968,WA,c(-118.852726608647, 46.6709758348483)
1766,1366,10002497,GREEN HILL SCHOOL,375 SW 11TH ST,CHEHALIS,WA,98532,NOT AVAILABLE,(360) 740-3400,STATE,OPEN,172,LEWIS,53041,USA,922140,CORRECTIONAL INSTITUTIONS,https://www.dshs.wa.gov/ra/juvenile-rehabilitation/prison-rape-elimination-act-compliance,1/14/16,IMAGERY,2018-01-18T00:00:00.000Z,https://www.dshs.wa.gov/ra/juvenile-rehabilitation/institutions,JUVENILE,244,0.017617643,2.06E-05,371971.1016,2330.081555,53,41,971000,53041971000,9710,Census Tract 9710,G5020,S,9689413,271655,46.6377853,-122.9545579,WA,c(-122.960668860815, 46.6498091654497)
1767,1367,10005718,HIDALGO COUNTY DETENTION CENTER,83 OLD HWY 70,LORDSBURG,NM,88045,NOT AVAILABLE,(575) 542-3050,COUNTY,OPEN,-999,HIDALGO,35023,USA,922140,CORRECTIONAL INSTITUTIONS,"http://www.hidalgocounty.org/index.php/services/law-enforcement/, https://www.nmlegis.gov/handouts/CCJ%20052716%20Item%203%20NM%20County%20Jails%20An%20Overview.pdf",5/27/16,IMAGERY,2018-04-06T00:00:00.000Z,http://www.hidalgocounty.org/index.php/services/law-enforcement/,NOT AVAILABLE,158,0.004181115,1.04E-06,15255.125,501.8679275,35,23,970000,35023970000,9700,Census Tract 9700,G5020,S,8893107714,23582051,31.8980519,-108.7519293,NM,c(-108.666379415042, 32.3374602601694)
1768,1368,10002500,NASELLE YOUTH CAMP,11 YOUTH CAMP DRIVE,NASELLE,WA,98638,NOT AVAILABLE,(360) 484-3223,STATE,OPEN,66,PACIFIC,53049,USA,922140,CORRECTIONAL INSTITUTIONS,https://www.dshs.wa.gov/ra/juvenile-rehabilitation/prison-rape-elimination-act-compliance,5/14/15,IMAGERY,2018-01-18T00:00:00.000Z,https://www.dshs.wa.gov/ra/juvenile-rehabilitation/institutions,JUVENILE,76,0.011025375,4.32E-06,77705.67969,1387.078718,53,49,950400,53049950400,9504,Census Tract 9504,G5020,S,1502696361,114963698,46.4979194,-123.6740272,WA,c(-123.824147763991, 46.3933037095716)
1769,1369,10002484,LINCOLN PARK WORK RELEASE,3706 S YAKIMA AVE,TACOMA,WA,98418,NOT AVAILABLE,(253) 671-7290,STATE,CLOSED,0,PIERCE,53053,USA,922140,CORRECTIONAL INSTITUTIONS,http://www.thenewstribune.com/opinion/article150294352.html,5/14/17,IMAGERY,2018-01-18T00:00:00.000Z,http://www.doc.wa.gov/facilities/workrelease/raplincolnparkwr/default.asp,MINIMUM,-999,0.001517575,9.31E-08,1698.242188,191.4301698,53,53,61800,53053061800,618,Census Tract 618,G5020,S,1383817,0,47.2267872,-122.4518338,WA,c(-122.443673662012, 47.2241281846356)
1770,1370,10003789,LEA COUNTY DETENTION CENTER,1401 S COMMERCIAL,LOVINGTON,NM,88260,NOT AVAILABLE,(575) 396-8669,COUNTY,OPEN,318,LEA,35025,USA,922140,CORRECTIONAL INSTITUTIONS,https://www.leacounty.net/p/departments/law-and-safety,4/4/18,IMAGERY,2018-04-06T00:00:00.000Z,https://www.leacounty.net/p/departments/law-and-safety,NOT AVAILABLE,432,0.006698186,1.42E-06,20955.60938,825.647289,35,25,1003,35025001003,10.03,Census Tract 10.03,G5020,S,5125169,53573,32.9371831,-103.3513931,NM,c(-103.339084046846, 32.9344835401778)
1771,1371,10001262,SOUTH TOWER DETENTION FACILITY,111 W COMMERCE ST,DALLAS,TX,75202,NOT AVAILABLE,NOT AVAILABLE,COUNTY,OPEN,-999,DALLAS,48113,USA,922140,CORRECTIONAL INSTITUTIONS,http://www.dallascounty.org/department/sheriff/sheriff_index.php,4/26/18,IMAGERY/OTHER,2018-04-26T00:00:00.000Z,http://www.dallascounty.org/department/sheriff/sheriff_index.php,NOT AVAILABLE,2304,0.003576945,5.55E-07,8176.046875,415.8060721,48,113,10000,48113010000,100,Census Tract 100,G5020,S,31397013,463801,32.8114428,-96.8620144,TX,c(-96.8153081758766, 32.7769396406696)
1772,1372,10003826,EARNEST C. BROOKS CORRECTIONAL FACILITY,2500 S SHERIDAN DR,MUSKEGON HEIGHTS,MI,49444,NOT AVAILABLE,(231) 773-9200,STATE,OPEN,1218,MUSKEGON,26121,USA,922140,CORRECTIONAL INSTITUTIONS,"http://www.michigan.gov/corrections/0,4551,7-119-1441---,00.html",12/31/16,IMAGERY/OTHER,2017-12-06T00:00:00.000Z,"http://www.michigan.gov/corrections/0,4551,7-119-68854_1381_1385---,00.html",MAXIMUM,1246,0.014862608,1.38E-05,234288.7578,1928.004467,26,121,402,26121000402,4.02,Census Tract 4.02,G5020,S,5956593,1520,43.2113094,-86.2022528,MI,c(-86.1726647733021, 43.2103929290749)
1773,1373,10002492,MAPLE LANE COMPETENCY RESTORATION PROGRAM,20311 OLD HWY 9 SW,CENTRALIA,WA,98531,NOT AVAILABLE,(360) 664-4641,STATE,OPEN,-999,THURSTON,53067,USA,922140,CORRECTIONAL INSTITUTIONS,http://www.correctcarers.com/mlcrp/,1/18/18,IMAGERY,2018-01-18T00:00:00.000Z,http://www.correctcarers.com/mlcrp/,NOT AVAILABLE,30,0.002643332,2.90E-07,5242.140625,348.5665651,53,67,12720,53067012720,127.2,Census Tract 127.20,G5020,S,77375951,1514204,46.7868064,-123.075609,WA,c(-123.030433389325, 46.7935562312458)
1774,1374,10000280,FLORENCE CRANE CORRECTIONAL FACILITY,38 FOURTH ST,COLDWATER,MI,49036,NOT AVAILABLE,(517) 279-9165,STATE,CLOSED,0,BRANCH,26023,USA,922140,CORRECTIONAL INSTITUTIONS,"http://www.michigan.gov/corrections/0,4551,7-119-68854_1381_1385---,00.html",12/6/17,IMAGERY,2017-12-06T00:00:00.000Z,"http://michigan.gov/corrections/0,4551,7-119-68854_1381_1385-5364--,00.html",MINIMUM,1063,0.018466303,1.38E-05,230689.9492,2259.22163,26,23,951300,26023951300,9513,Census Tract 9513,G5020,S,85087940,2781568,41.9579786,-85.0716287,MI,c(-84.9907217417796, 41.9577850944084)
1775,1375,10002458,PINE LODGE CORRECTIONS CENTER FOR WOMEN,751 S PINE ST,MEDICAL LAKE,WA,99022,NOT AVAILABLE,NOT AVAILABLE,STATE,CLOSED,0,SPOKANE,53063,USA,922140,CORRECTIONAL INSTITUTIONS,http://www.spokesman.com/stories/2010/apr/12/pine-lodge-prison-close-under-spending-plan/,4/12/10,IMAGERY,2018-01-18T00:00:00.000Z,NOT AVAILABLE,MINIMUM,359,0.012521656,5.34E-06,98049.14844,1645.283911,53,63,13900,53063013900,139,Census Tract 139,G5020,S,39234223,5740639,47.5438426,-117.6671406,WA,c(-117.69514637682, 47.5673080699635)
1776,1376,10001743,WORK ETHIC CAMP,2309 N HWY 83,MCCOOK,NE,69001,NOT AVAILABLE,(308) 345-8405,STATE,OPEN,192,RED WILLOW,31145,USA,922140,CORRECTIONAL INSTITUTIONS,https://corrections.nebraska.gov/public-information/statistics-reports/ndcs-reports,9/30/17,IMAGERY,2017-12-14T00:00:00.000Z,https://corrections.nebraska.gov/facilities,MINIMUM,200,0.006649659,2.64E-06,42858.60938,847.7390463,31,145,963200,31145963200,9632,Census Tract 9632,G5020,S,24593025,0,40.2231109,-100.6380888,NE,c(-100.647997609044, 40.2282825698149)
1777,1377,10006740,VERMILION COUNTY JUVENILE DETENTION CENTER,150 SAGER,DANVILLE,IL,61832,NOT AVAILABLE,(217) 431-6691,COUNTY,OPEN,-999,VERMILION,17183,USA,922140,CORRECTIONAL INSTITUTIONS,http://ipcsa.org/il-probation-directory/,3/5/18,IMAGERY,2018-03-05T00:00:00.000Z,NOT AVAILABLE,JUVENILE,-999,0.002271696,2.85E-07,4625.871094,283.4565175,17,183,100,17183000100,1,Census Tract 1,G5020,S,1970260,51234,40.1230198,-87.6302178,IL,c(-87.6274948200402, 40.1211634271189)
1778,1378,10004578,CLAY COUNTY JAIL / SHERIFF,901 NORTH ORANGE AVENUE,GREEN COVE SPRINGS,FL,32043,NOT AVAILABLE,(904) 213-5906,COUNTY,OPEN,372,CLAY,12019,USA,922140,CORRECTIONAL INSTITUTIONS,"http://www.dc.state.fl.us/pub/jails/, https://www.claysheriff.com/",2/20/18,IMAGERY,2018-02-20T00:00:00.000Z,https://www.claysheriff.com/,NOT AVAILABLE,480,0.004621822,9.46E-07,13532.42773,558.4068474,12,19,31400,12019031400,314,Census Tract 314,G5020,S,6881253,4227012,29.9954459,-81.6846689,FL,c(-81.6868650112222, 30.0034426223385)
1779,1379,10002485,SECURE COMMUNITY TRANSITION FACILITY - PIERCE COUNTY,11150 N 20TH AVE,LOWER PENINSULA,WA,98303,NOT AVAILABLE,NOT AVAILABLE,STATE,OPEN,11,PIERCE,53053,USA,922140,CORRECTIONAL INSTITUTIONS,https://www.dshs.wa.gov/fsa/office-capital-programs/secure-community-transition-facility-pierce-county,6/1/15,IMAGERY,2018-01-18T00:00:00.000Z,https://www.dshs.wa.gov/ra/facilities,NOT AVAILABLE,24,0.003584048,7.45E-07,13598.02344,463.0782416,53,53,72603,53053072603,726.03,Census Tract 726.03,G5020,S,91149394,108018989,47.2094984,-122.6842971,WA,c(-122.68638846481, 47.2170166586519)
1780,1380,10004637,COLLIER COUNTY IMMOKALEE JAIL,302 STOCKADE RD,IMMOKALEE,FL,34142,NOT AVAILABLE,(239) 657-2878,COUNTY,OPEN,109,COLLIER,12021,USA,922140,CORRECTIONAL INSTITUTIONS,https://www.colliersheriff.org/my-ccso,2/20/18,IMAGERY,2018-02-20T00:00:00.000Z,https://www.colliersheriff.org/my-ccso,MAXIMUM,-999,0.005790193,1.71E-06,23722.97266,685.8280429,12,21,11202,12021011202,112.02,Census Tract 112.02,G5020,S,1316252775,24798581,26.2762049,-81.342054,FL,c(-81.4116383477869, 26.3959060062303)
1781,1381,10003850,BERRIEN COUNTY JUVENILE CENTER,6414 DEANS HILL RD,ST. JOSEPH,MI,49102,NOT AVAILABLE,(269) 471-2831,COUNTY,OPEN,48,BERRIEN,26021,USA,922140,CORRECTIONAL INSTITUTIONS,https://www.berriencounty.org/596/Juvenile-Center,3/20/18,IMAGERY,2018-03-20T00:00:00.000Z,https://www.berriencounty.org/596/Juvenile-Center,JUVENILE,42,0.005837555,6.99E-07,11653.71875,758.0286059,26,21,10600,26021010600,106,Census Tract 106,G5020,S,90820040,4402124,41.9387013,-86.2878857,MI,c(-86.3048934522222, 41.9546111454228)
1782,1382,10003788,LINCOLN COUNTY DETENTION CENTER,511 HANGAR RD,CARRIZOZO,NM,88301,NOT AVAILABLE,(575) 648-6510,COUNTY,OPEN,-999,LINCOLN,35027,USA,922140,CORRECTIONAL INSTITUTIONS,http://www.lasallecorrections.com/our-locations-table/,4/6/18,IMAGERY,2018-04-06T00:00:00.000Z,NOT AVAILABLE,MEDIUM,144,0.003670591,6.62E-07,9850.550781,440.5342761,35,27,960200,35027960200,9602,Census Tract 9602,G5020,S,6394814332,189796,33.9119459,-105.6609608,NM,c(-105.889387095578, 33.6472790614324)
1783,1383,10000277,G ROBERT COTTON CORRECTIONAL FACILITY,3500 N ELM RD,JACKSON,MI,49201,NOT AVAILABLE,(517) 780-5000,STATE,OPEN,1796,JACKSON,26075,USA,922140,CORRECTIONAL INSTITUTIONS,"http://www.michigan.gov/corrections/0,4551,7-119-1441---,00.html",12/31/16,IMAGERY,2017-12-06T00:00:00.000Z,"http://www.michigan.gov/corrections/0,4551,7-119-68854_1381_1385---,00.html",MAXIMUM,1842,0.017472701,1.88E-05,315487.1563,2274.280413,26,75,5800,26075005800,58,Census Tract 58,G5020,S,2383646,2914,42.2958029,-84.3894236,MI,c(-84.3899626934911, 42.2881678188725)
1784,1384,10004134,NEBRASKA YOUTH REHABILITATION AND TREATMENT CENTER,2802 30TH AVE,KEARNEY,NE,68845,NOT AVAILABLE,(308) 865-5313,STATE,OPEN,98,BUFFALO,31019,USA,922140,CORRECTIONAL INSTITUTIONS,http://dhhs.ne.gov/children_family_services/Pages/jus_yrtc_yrtckindex.aspx,12/14/17,IMAGERY,2017-12-14T00:00:00.000Z,http://dhhs.ne.gov/children_family_services/Pages/jus_yrtc_yrtckindex.aspx,JUVENILE,172,0.010378198,6.82E-06,111413.8594,1345.518861,31,19,969204,31019969204,9692.04,Census Tract 9692.04,G5020,S,35485451,173274,40.7168226,-99.1403432,NE,c(-99.1237868235691, 40.7053039949999)
1785,1385,10001387,GUS HARRISON CORRECTIONAL FACILITY,2727 E BEECHER ST,ADRIAN,MI,49221,NOT AVAILABLE,(517) 265-3900,STATE,OPEN,2331,LENAWEE,26091,USA,922140,CORRECTIONAL INSTITUTIONS,"http://www.michigan.gov/corrections/0,4551,7-119-1441---,00.html",12/31/16,IMAGERY,2017-12-06T00:00:00.000Z,"http://www.michigan.gov/corrections/0,4551,7-119-68854_1381_1385---,00.html",MAXIMUM,2368,0.022510463,2.47E-05,411456.8086,2964.772467,26,91,61700,26091061700,617,Census Tract 617,G5020,S,82335445,670473,41.8527313,-84.0730603,MI,c(-84.0072921897291, 41.8860846440301)
1786,1386,10000272,IONIA CORRECTIONAL FACILITY,1576 W BLUEWATER HWY,IONIA,MI,48846,NOT AVAILABLE,(616) 527-6331,STATE,OPEN,681,IONIA,26067,USA,922140,CORRECTIONAL INSTITUTIONS,"http://www.michigan.gov/corrections/0,4551,7-119-1441---,00.html",12/31/16,IMAGERY,2017-12-06T00:00:00.000Z,"http://www.michigan.gov/corrections/0,4551,7-119-68854_1381_1385---,00.html",MAXIMUM,706,0.014235611,1.25E-05,211401.1328,1811.033702,26,67,982200,26067982200,9822,Census Tract 9822,G5020,S,1987066,0,42.9792254,-85.1044377,MI,c(-85.1016535475337, 42.9844122592332)
1787,1387,10004140,YOUTH REHABILITATION & TREATMENT CENTER - GENEVA,855 N 1ST ST,GENEVA,NE,68361,NOT AVAILABLE,(402) 759-3164,STATE,OPEN,33,FILLMORE,31059,USA,922140,CORRECTIONAL INSTITUTIONS,http://dhhs.ne.gov/children_family_services/Pages/jus_yrtc_yrtcgindex.aspx,12/14/17,IMAGERY/OTHER,2017-12-14T00:00:00.000Z,http://dhhs.ne.gov/children_family_services/Pages/jus_yrtc_yrtcgindex.aspx,JUVENILE,82,0.012804153,9.37E-06,152855.0977,1609.002142,31,59,91700,31059091700,917,Census Tract 917,G5020,S,771921544,1557068,40.5185128,-97.7017406,NE,c(-97.6126267404569, 40.5360365827068)
1788,1388,10000529,COLLIER COUNTY NAPLES JAIL,3347 TAMIAMI TRAIL E,NAPLES,FL,34112,4434,(239) 252-9504,COUNTY,OPEN,763,COLLIER,12021,USA,922140,CORRECTIONAL INSTITUTIONS,https://www.colliersheriff.org/my-ccso,2/20/18,IMAGERY,2018-02-20T00:00:00.000Z,https://www.colliersheriff.org/my-ccso,MAXIMUM,-999,0.005800457,1.36E-06,18721.8457,686.8739156,12,21,10604,12021010604,106.04,Census Tract 106.04,G5020,S,2552539,135823,26.1301732,-81.7566346,FL,c(-81.7635944592883, 26.1290775542458)
1789,1389,10003847,CALHOUN COUNTY JUVENILE HOME,14555 18 1/2 MILE RD,MARSHALL,MI,49068,NOT AVAILABLE,(269) 781-0920,COUNTY,OPEN,-999,CALHOUN,26025,USA,922140,CORRECTIONAL INSTITUTIONS,https://www.calhouncountymi.gov/government/juvenile_home/,3/20/18,IMAGERY,2018-03-20T00:00:00.000Z,https://www.calhouncountymi.gov/government/juvenile_home/,JUVENILE,42,0.003392731,4.72E-07,7906.621094,434.6963811,26,25,3900,26025003900,39,Census Tract 39,G5020,S,14270744,105407,42.2855857,-84.9601997,MI,c(-84.9373831676862, 42.2834528392275)
1790,1390,10004638,COLLIER HALFWAY HOUSE,323 SERGEANT JOE JONES RD,IMMOKALEE,FL,34142,NOT AVAILABLE,(239) 377-1050,COUNTY,CLOSED,0,COLLIER,12021,USA,922140,CORRECTIONAL INSTITUTIONS,https://www.publicschoolreview.com/collier-halfway-house-profile,2/20/18,IMAGERY,2018-02-20T00:00:00.000Z,https://www.nefec.org/school/11/9029/collier-halfway-house/,JUVENILE,30,0.003911988,8.70E-07,12036.47656,453.2080482,12,21,11202,12021011202,112.02,Census Tract 112.02,G5020,S,1316252775,24798581,26.2762049,-81.342054,FL,c(-81.4115521327116, 26.3947867645601)
1791,1391,10003797,LUNA COUNTY DETENTION CENTER,1700 4TH ST NE,DEMING,NM,88030,NOT AVAILABLE,NOT AVAILABLE,COUNTY,OPEN,304,LUNA,35029,USA,922140,CORRECTIONAL INSTITUTIONS,http://www.lunacountynm.us/departments/index.php,4/6/18,IMAGERY,2018-04-06T00:00:00.000Z,http://www.lunacountynm.us/departments/index.php,NOT AVAILABLE,385,0.005200258,1.46E-06,21464.67188,620.0297436,35,29,600,35029000600,6,Census Tract 6,G5020,S,5486839,0,32.2748578,-107.7432467,NM,c(-107.737285841334, 32.2766800444053)
1792,1392,10002753,GEORGE ALLEN JAIL (GOVERNMENT CENTER JAIL),600 COMMERCE ST,DALLAS,TX,75202,NOT AVAILABLE,NOT AVAILABLE,COUNTY,CLOSED,0,DALLAS,48113,USA,922140,CORRECTIONAL INSTITUTIONS,http://www.dallascounty.org/department/sheriff/detention.php,4/26/18,IMAGERY/OTHER,2018-04-26T00:00:00.000Z,NOT AVAILABLE,NOT AVAILABLE,800,0.003383215,5.92E-07,8718.261719,399.8508429,48,113,3101,48113003101,31.01,Census Tract 31.01,G5020,S,936791,0,32.7798397,-96.7992069,TX,c(-96.8065109586305, 32.7778771547092)
1793,1393,10006741,WAYNE COUNTY JAIL,305 EAST COURT STREET,FAIRFIELD,IL,62837,NOT AVAILABLE,(618) 842-6631,COUNTY,OPEN,-999,WAYNE,17191,USA,922140,CORRECTIONAL INSTITUTIONS,http://www.ilsheriff.org/index.php/directory,3/5/18,IMAGERY,2018-03-05T00:00:00.000Z,NOT AVAILABLE,NOT AVAILABLE,30,0.00127227,1.00E-07,1584.273438,157.1558647,17,191,955100,17191955100,9551,Census Tract 9551,G5020,S,16835310,176484,38.3972654,-88.3635998,IL,c(-88.3575660284588, 38.3809795384998)
1794,1394,10001345,KINROSS CORRECTIONAL FACILITY,4533 W. INDUSTRIAL PARK DRIVE,KINCHELOE,MI,49788,NOT AVAILABLE,(906) 495-2282,STATE,OPEN,1509,CHIPPEWA,26033,USA,922140,CORRECTIONAL INSTITUTIONS,"http://www.michigan.gov/corrections/0,4551,7-119-1441---,00.html",12/31/16,IMAGERY,2017-12-06T00:00:00.000Z,"http://www.michigan.gov/corrections/0,4551,7-119-68854_1381_1385---,00.html",MEDIUM,1602,0.012731725,1.09E-05,195908.4609,1661.694949,26,33,980300,26033980300,9803,Census Tract 9803,G5020,S,295328,0,46.2490166,-84.4543156,MI,c(-84.4546902012834, 46.2490849506574)
1795,1395,10006668,SPECIAL COMMITMENT CENTER - TOTAL CONFINEMENT FACILITY,11150 N 20TH AVE,MCNEIL ISLAND,WA,98303,NOT AVAILABLE,NOT AVAILABLE,STATE,OPEN,-999,PIERCE,53053,USA,922140,CORRECTIONAL INSTITUTIONS,https://www.dshs.wa.gov/fsa/office-capital-programs/total-confinement-facility,1/18/18,IMAGERY/OTHER,2018-01-18T00:00:00.000Z,https://www.dshs.wa.gov/ra/facilities,NOT AVAILABLE,315,0.011785563,9.75E-06,177955.625,1604.696703,53,53,72603,53053072603,726.03,Census Tract 726.03,G5020,S,91149394,108018989,47.2094984,-122.6842971,WA,c(-122.688123381819, 47.215060784636)
1796,1396,10006593,LINCOLN REGIONAL CENTER,WEST PROSPECTOR PLACE AND FOLSOM STREET,LINCOLN,NE,68509,4949,(402) 479-5410,STATE,OPEN,-999,LANCASTER,31109,USA,922140,CORRECTIONAL INSTITUTIONS,http://dhhs.ne.gov/behavioral_health/Pages/beh_rc_lrcserv.aspx,12/14/17,IMAGERY,2017-12-14T00:00:00.000Z,http://dhhs.ne.gov/behavioral_health/Pages/beh_rc_lrcserv.aspx,NOT AVAILABLE,250,0.020694913,2.58E-05,422332.1484,2742.658863,31,109,3500,31109003500,35,Census Tract 35,G5020,S,783310,0,40.781986,-96.7344412,NE,c(-96.7325387181289, 40.780882335784)
1797,1397,10001389,LAKELAND CORRECTIONAL FACILITY,141 FIRST ST,COLDWATER,MI,49036,NOT AVAILABLE,(517) 278-6942,STATE,OPEN,1460,BRANCH,26023,USA,922140,CORRECTIONAL INSTITUTIONS,"http://www.michigan.gov/corrections/0,4551,7-119-1441---,00.html",12/31/16,IMAGERY,2017-12-06T00:00:00.000Z,"http://www.michigan.gov/corrections/0,4551,7-119-68854_1381_1385---,00.html",MEDIUM,1466,0.021872733,2.04E-05,340292.9375,2688.47028,26,23,951300,26023951300,9513,Census Tract 9513,G5020,S,85087940,2781568,41.9579786,-85.0716287,MI,c(-84.9959657227724, 41.9654429577033)
1798,1398,10004568,COLUMBIA COUNTY JAIL,389 NORTHWEST QUINTEN STREET,LAKE CITY,FL,32055,NOT AVAILABLE,(386) 755-7000,COUNTY,OPEN,229,COLUMBIA,12023,USA,922140,CORRECTIONAL INSTITUTIONS,https://www.columbiasheriff.org/,2/20/18,IMAGERY,2018-02-20T00:00:00.000Z,https://www.columbiasheriff.org/,MAXIMUM,256,0.004114066,8.18E-07,11727.29492,493.5187918,12,23,110202,12023110202,1102.02,Census Tract 1102.02,G5020,S,132143333,1011942,30.2757156,-82.7112939,FL,c(-82.6436841703299, 30.2208281135935)
1799,1399,10005181,CASS COUNTY JAIL,321 N M62,CASSOPOLIS,MI,49031,NOT AVAILABLE,(269) 445-2481,COUNTY,OPEN,103,CASS,26027,USA,922140,CORRECTIONAL INSTITUTIONS,http://www.michigan.gov/documents/corrections/JPIS_-_CY_2010_344047_7.pdf,2/15/16,IMAGERY/OTHER,2018-03-20T00:00:00.000Z,http://www.ccso.info/Home.aspx,MAXIMUM,103,0.003477552,4.85E-07,8073.480469,426.9955061,26,27,2100,26027002100,21,Census Tract 21,G5020,S,155834064,6052406,41.9049517,-86.0387907,MI,c(-86.0187527069615, 41.9192593100122)
1800,1400,10004733,WILLIAMSON COUNTY JAIL,404 N. VAN BUREN,MARION,IL,62959,NOT AVAILABLE,(618) 997-6541,COUNTY,OPEN,-999,WILLIAMSON,17199,USA,922140,CORRECTIONAL INSTITUTIONS,http://www.wcsheriff.com/home.html,3/5/18,IMAGERY,2018-03-05T00:00:00.000Z,http://www.wcsheriff.com/home.html,NOT AVAILABLE,244,0.003259197,5.00E-07,7839.222656,408.1645227,17,199,21000,17199021000,210,Census Tract 210,G5020,S,34590532,542004,37.7481321,-88.9777973,IL,c(-88.9285679570499, 37.7331501747953)
1801,1401,10006892,LARAMIE COUNTY JUVENILE SERVICES CENTER,13794 PRAIRIE CENTER CIRCLE,CHEYENNE,WY,82009,NOT AVAILABLE,(307) 775-7301,COUNTY,OPEN,-999,LARAMIE,56021,USA,922140,CORRECTIONAL INSTITUTIONS,http://www.laramiecounty.com/_officials/Sheriff/_pdfs/JuvenileServiceCenter/INFO%20PAMPHLET%20Updated%2001%2011%2016.pdf,5/10/18,IMAGERY,2018-05-10T00:00:00.000Z,NOT AVAILABLE,JUVENILE,-999,0.002986028,3.00E-07,4929.238281,376.5774827,56,21,2000,56021002000,20,Census Tract 20,G5020,S,2729588322,1205491,41.2408635,-104.3404666,WY,c(-104.646763696478, 41.1497658128097)
1802,1402,10003770,MCKINLEY COUNTY ADULT DETENTION CENTER,255 SOUTH BOARDMAN DR,GALLUP,NM,87301,NOT AVAILABLE,NOT AVAILABLE,COUNTY,OPEN,-999,MCKINLEY,35031,USA,922140,CORRECTIONAL INSTITUTIONS,https://www.co.mckinley.nm.us/148/Departments,4/6/18,IMAGERY/OTHER,2018-04-06T00:00:00.000Z,https://www.co.mckinley.nm.us/148/Departments,NOT AVAILABLE,328,0.003128598,5.74E-07,8733.796875,388.1137296,35,31,945600,35031945600,9456,Census Tract 9456,G5020,S,12321526,0,35.5297673,-108.6672089,NM,c(-108.708311069689, 35.5272221999284)
1803,1403,10006742,WHITESIDE COUNTY JAIL,400 N. CHERRY ST,MORRISON,IL,61270,NOT AVAILABLE,(815) 772-5203,COUNTY,OPEN,-999,WHITESIDE,17195,USA,922140,CORRECTIONAL INSTITUTIONS,http://www.ilsheriff.org/index.php/directory,3/5/18,IMAGERY,2018-03-05T00:00:00.000Z,https://www.whiteside.org/departments.html,NOT AVAILABLE,129,0.002315002,2.53E-07,4214.523438,310.9271986,17,195,200,17195000200,2,Census Tract 2,G5020,S,191386871,300790,41.8688919,-89.9490361,IL,c(-89.963376027989, 41.8102380815253)
1804,1404,10000398,MONTGOMERY CORRECTIONAL CENTER,4727 LANNIE RD,JACKSONVILLE,FL,32218,NOT AVAILABLE,(904) 766-5048,LOCAL,OPEN,512,DUVAL,12031,USA,922140,CORRECTIONAL INSTITUTIONS,http://www.coj.net/departments/sheriffs-office/department-of-corrections,2/20/18,IMAGERY,2018-02-20T00:00:00.000Z,http://www.coj.net/departments/sheriffs-office/department-of-corrections,NOT AVAILABLE,648,0.013567516,4.75E-06,68414.25586,1626.934588,12,31,10301,12031010301,103.01,Census Tract 103.01,G5020,S,131488905,2173082,30.5303592,-81.6816428,FL,c(-81.7262541624349, 30.5393123245591)
1805,1405,10000401,JOHN E GOODE PRETRIAL DETENTION FACILITY,500 E ADAMS ST,JACKSONVILLE,FL,32202,NOT AVAILABLE,(904) 630-5747,LOCAL,OPEN,2426,DUVAL,12031,USA,922140,CORRECTIONAL INSTITUTIONS,http://www.coj.net/departments/sheriffs-office/department-of-corrections,2/20/18,IMAGERY,2018-02-20T00:00:00.000Z,http://www.coj.net/departments/sheriffs-office/department-of-corrections,MAXIMUM,2189,0.003654842,6.89E-07,9889.328125,426.0380391,12,31,1000,12031001000,10,Census Tract 10,G5020,S,1175361,9188,30.3316498,-81.651717,FL,c(-81.6506195045691, 30.3256948113048)
1806,1406,10001366,MACOMB CORRECTIONAL FACILITY,34625 26 MILE RD,NEW HAVEN,MI,48048,NOT AVAILABLE,(586) 749-4900,STATE,OPEN,1355,MACOMB,26099,USA,922140,CORRECTIONAL INSTITUTIONS,"http://www.michigan.gov/corrections/0,4551,7-119-1441---,00.html",12/31/16,IMAGERY,2017-12-06T00:00:00.000Z,"http://www.michigan.gov/corrections/0,4551,7-119-68854_1381_1385---,00.html",MAXIMUM,1422,0.017239695,1.48E-05,249382.4688,2276.876988,26,99,218000,26099218000,2180,Census Tract 2180,G5020,S,24475422,215194,42.7310169,-82.776781,MI,c(-82.7634685724431, 42.7244371519444)
1807,1407,10005150,CHARLEVOIX COUNTY JAIL,1000 GRANT STREET,CHARLEVOIX,MI,49720,NOT AVAILABLE,(231) 547-4461,COUNTY,OPEN,-999,CHARLEVOIX,26029,USA,922140,CORRECTIONAL INSTITUTIONS,http://www.charlevoixcounty.org/charlevoix_county_sheriff/index.php,3/20/18,IMAGERY/OTHER,2018-03-20T00:00:00.000Z,http://www.charlevoixcounty.org/charlevoix_county_sheriff/index.php,NOT AVAILABLE,89,0.003321105,3.19E-07,5614.8125,447.9265274,26,29,1500,26029001500,15,Census Tract 15,G5020,S,3981064,1274894,45.314141,-85.2515752,MI,c(-85.263456964261, 45.310276042902)
1808,1408,10006669,SECURE COMMUNITY TRANSITION FACILITY - KING COUNTY,132 SOUTH SPOKANE STREET,SEATTLE,WA,98134,NOT AVAILABLE,NOT AVAILABLE,STATE,OPEN,-999,KING,53033,USA,922140,CORRECTIONAL INSTITUTIONS,https://www.dshs.wa.gov/fsa/office-capital-programs/secure-community-transition-facility-king-county,1/18/18,IMAGERY/OTHER,2018-01-18T00:00:00.000Z,https://www.dshs.wa.gov/ra/facilities,NOT AVAILABLE,6,0.00174961,1.42E-07,2610.367188,246.5624655,53,33,9300,53033009300,93,Census Tract 93,G5020,S,9429074,719984,47.5771253,-122.330936,WA,c(-122.33261198437, 47.571969361726)
1809,1409,10001342,MARQUETTE BRANCH PRISON,1960 US HWY 41 S,MARQUETTE,MI,49855,NOT AVAILABLE,(906) 226-6531,STATE,OPEN,1060,MARQUETTE,26103,USA,922140,CORRECTIONAL INSTITUTIONS,"http://www.michigan.gov/corrections/0,4551,7-119-1441---,00.html",12/31/16,IMAGERY,2017-12-06T00:00:00.000Z,"http://www.michigan.gov/corrections/0,4551,7-119-68854_1381_1385---,00.html",CLOSE,1172,0.017758969,1.30E-05,234175.7148,2365.681694,26,103,2800,26103002800,28,Census Tract 28,G5020,S,21909565,3579663,46.5183,-87.4207247,MI,c(-87.3814177822378, 46.5106102903112)
1810,1410,10006594,WHITEHALL PSYCHIATRIC RESIDENTIAL TREATMENT FACILITY,5845 HUNTINGTON AVE,LINCOLN,NE,68507,NOT AVAILABLE,(402) 471-6969,STATE,OPEN,-999,LANCASTER,31109,USA,922140,CORRECTIONAL INSTITUTIONS,http://dhhs.ne.gov/behavioral_health/Pages/beh_rc_lrcserv.aspx,12/14/17,IMAGERY,2017-12-14T00:00:00.000Z,http://dhhs.ne.gov/behavioral_health/Pages/beh_rc_lrcserv.aspx,JUVENILE,24,0.008586051,4.51E-06,73943.25391,1087.75035,31,109,201,31109000201,2.01,Census Tract 2.01,G5020,S,2554980,0,40.8440359,-96.635512,NE,c(-96.6402364241811, 40.8362642081092)
1811,1411,10004663,WINNEBAGO COUNTY JUVENILE DETENTION CENTER,5350 NORTHROCK DRIVE,ROCKFORD,IL,61103,NOT AVAILABLE,(815) 516-2980,COUNTY,OPEN,-999,WINNEBAGO,17201,USA,922140,CORRECTIONAL INSTITUTIONS,http://wincoil.us/departments/,3/5/18,IMAGERY,2018-03-05T00:00:00.000Z,http://wincoil.us/departments/,JUVENILE,48,0.003400431,4.77E-07,7996.328125,433.554758,17,201,3801,17201003801,38.01,Census Tract 38.01,G5020,S,97724304,1131968,42.3826655,-89.1071181,IL,c(-89.0701609968078, 42.3365951848488)
1812,1412,10000348,ESCAMBIA COUNTY ROAD PRISON,601 HIGHWAY 297-A,CANTONMENT,FL,32533,NOT AVAILABLE,(850) 937-2100,COUNTY,OPEN,228,ESCAMBIA,12033,USA,922140,CORRECTIONAL INSTITUTIONS,https://myescambia.com/our-services/corrections,2/20/18,IMAGERY,2018-02-21T00:00:00.000Z,https://myescambia.com/our-services/corrections,NOT AVAILABLE,-999,0.00387694,6.77E-07,9747.916016,465.1200177,12,33,3700,12033003700,37,Census Tract 37,G5020,S,17169473,562975,30.5881547,-87.3252581,FL,c(-87.3318035820472, 30.5987100709258)
1813,1413,10002750,DR JEROME MCNEIL JR DETENTION CENTER,2600 LONE STAR DR,DALLAS,TX,75212,NOT AVAILABLE,(214) 698-4430,COUNTY,OPEN,295,DALLAS,48113,USA,922140,CORRECTIONAL INSTITUTIONS,http://www.tjjd.texas.gov/publications/other/searchfacilityregistryresults.aspx?SelectedFacilityType=YKSBbGCMUWM=&SelectedSortBy=laExhobORj5ZHimppFKN0Q==&IncludeInactive=bZL7qeN3IjY=,4/26/18,IMAGERY,2018-04-26T00:00:00.000Z,NOT AVAILABLE,JUVENILE,322,0.007713931,2.55E-06,37630.50391,921.9283124,48,113,20500,48113020500,205,Census Tract 205,G5020,S,5439922,144058,32.7833893,-96.8622702,TX,c(-96.8680411855587, 32.7688055088602)
1814,1414,10005172,CLARE COUNTY CORRECTIONAL FACILITY,255 WEST MAIN STREET,HARRISON,MI,48625,NOT AVAILABLE,(989) 539-7166,COUNTY,OPEN,163,CLARE,26035,USA,922140,CORRECTIONAL INSTITUTIONS,http://www.michigan.gov/documents/corrections/JPIS_-_CY_2010_344047_7.pdf,3/20/18,IMAGERY/OTHER,2018-03-20T00:00:00.000Z,http://claresheriff.org/,NOT AVAILABLE,176,0.003349129,4.09E-07,7046.414063,448.5576901,26,35,1300,26035001300,13,Census Tract 13,G5020,S,58577511,2426656,44.001758,-84.7699611,MI,c(-84.8044021070991, 44.0190377972561)
1815,1415,10000999,COLUMBIA CORRECTIONAL INSTITUTION,2925 COLUMBIA DR,PORTAGE,WI,53901,950,(608) 742-9100,STATE,OPEN,839,COLUMBIA,55021,USA,922140,CORRECTIONAL INSTITUTIONS,https://doc.wi.gov/Pages/DataResearch/DataAndReports.aspx,1/12/18,IMAGERY,2018-01-18T00:00:00.000Z,https://doc.wi.gov/Pages/OffenderInformation/AdultInstitutions/AdultFacilities.aspx,MAXIMUM,541,0.015424865,1.52E-05,259347.0859,1945.257726,55,21,970400,55021970400,9704,Census Tract 9704,G5020,S,34266983,4295143,43.553393,-89.4817003,WI,c(-89.48969737394, 43.5662353392052)
1816,1416,10003834,MICHIGAN REFORMATORY,1342 W MAIN ST,IONIA,MI,48846,NOT AVAILABLE,(616) 527-2500,STATE,OPEN,1193,IONIA,26067,USA,922140,CORRECTIONAL INSTITUTIONS,"http://www.michigan.gov/corrections/0,4551,7-119-1441---,00.html",12/31/16,IMAGERY,2017-12-06T00:00:00.000Z,"http://www.michigan.gov/corrections/0,4551,7-119-68854_1381_1385---,00.html",CLOSE,1337,0.012412394,7.95E-06,134711.4414,1612.777406,26,67,32100,26067032100,321,Census Tract 321,G5020,S,15568486,680948,42.9640599,-85.1093269,MI,c(-85.0941814357653, 42.9758265559242)
1817,1417,10006595,NORFOLK REGIONAL CENTER,1700 N VICTORY ROAD,NORFOLK,NE,68702,1209,(402) 370-3400,STATE,OPEN,-999,MADISON,31119,USA,922140,CORRECTIONAL INSTITUTIONS,http://dhhs.ne.gov/behavioral_health/Pages/beh_rc_nrcserv.aspx,12/14/17,IMAGERY,2017-12-14T00:00:00.000Z,http://dhhs.ne.gov/behavioral_health/Pages/beh_rc_nrcserv.aspx,NOT AVAILABLE,120,0.00602398,1.59E-06,26500.32813,780.1472828,31,119,960600,31119960600,9606,Census Tract 9606,G5020,S,16904551,0,42.0431155,-97.3852666,NE,c(-97.3841650605934, 42.0509580034699)
1818,1418,10004118,NH STATE PRISON FOR MEN,281 N STATE ST,CONCORD,NH,3302,NOT AVAILABLE,(603) 271-1801,STATE,OPEN,1412,MERRIMACK,33013,USA,922140,CORRECTIONAL INSTITUTIONS,https://www.nh.gov/nhdoc/facilities/index.html,7/1/17,IMAGERY,2017-12-14T00:00:00.000Z,https://www.nh.gov/nhdoc/facilities/index.html,MAXIMUM,1205,0.014260122,7.77E-06,132140.4688,1816.182956,33,13,32600,33013032600,326,Census Tract 326,G5020,S,14201645,2083068,43.2264912,-71.575198,NH,c(-71.5588179560643, 43.2271084896493)
1819,1419,10003824,MUSKEGON CORRECTIONAL FACILITY,2400 S SHERIDAN DR,MUSKEGON,MI,49442,NOT AVAILABLE,(231) 773-3201,STATE,OPEN,1297,MUSKEGON,26121,USA,922140,CORRECTIONAL INSTITUTIONS,"http://www.michigan.gov/corrections/0,4551,7-119-1441---,00.html",12/31/16,IMAGERY/OTHER,2017-12-06T00:00:00.000Z,"http://www.michigan.gov/corrections/0,4551,7-119-68854_1381_1385---,00.html",MEDIUM,1321,0.020976008,1.73E-05,294770.0508,2578.734092,26,121,402,26121000402,4.02,Census Tract 4.02,G5020,S,5956593,1520,43.2113094,-86.2022528,MI,c(-86.1788551685351, 43.2101680185964)
1820,1420,10001451,GILCHRIST COUNTY JAIL,9239 S US HWY 129,TRENTON,FL,32693,NOT AVAILABLE,(352) 463-3490,COUNTY,OPEN,10,GILCHRIST,12041,USA,922140,CORRECTIONAL INSTITUTIONS,http://www.gcso.us/,2/21/18,IMAGERY,2018-02-21T00:00:00.000Z,http://www.gcso.us/,MAXIMUM,-999,0.001886778,1.39E-07,1981.017578,225.4960129,12,41,950204,12041950204,9502.04,Census Tract 9502.04,G5020,S,145952817,1449477,29.6452541,-82.8155766,FL,c(-82.8187482308513, 29.6023961199833)
1821,1421,10006720,ESCAMBIA COUNTY WORK RELEASE FACILITY,1211 W. FAIRFIELD DR,PENSACOLA,FL,32501,NOT AVAILABLE,(850) 595-4419,COUNTY,OPEN,267,ESCAMBIA,12033,USA,922140,CORRECTIONAL INSTITUTIONS,https://myescambia.com/our-services/corrections,2/20/18,IMAGERY,2018-02-21T00:00:00.000Z,https://myescambia.com/our-services/corrections,NOT AVAILABLE,-999,0.002662127,4.23E-07,6074.384766,317.2705512,12,33,1600,12033001600,16,Census Tract 16,G5020,S,2313544,3051,30.4409358,-87.2305399,FL,c(-87.2321966875065, 30.4444997388187)
1822,1422,10006670,MARTIN HALL JUVENILE DETENTION FACILITY,201 SOUTH PINE STREET,MEDICAL LAKE,WA,99022,NOT AVAILABLE,(509) 299-7733,STATE,OPEN,13,SPOKANE,53063,USA,922140,CORRECTIONAL INSTITUTIONS,http://www.cccscorp.com/programs/mhall/,8/10/16,IMAGERY/OTHER,2018-01-18T00:00:00.000Z,http://www.cccscorp.com/programs/mhall/,JUVENILE,68,0.002740997,3.26E-07,5987.195313,373.3074124,53,63,13900,53063013900,139,Census Tract 139,G5020,S,39234223,5740639,47.5438426,-117.6671406,WA,c(-117.695990097317, 47.5709403012275)
1823,1423,10004121,NH CORRECTIONAL FACILITY FOR WOMEN,317 MAST RD,GOFFSTOWN,NH,3045,NOT AVAILABLE,(603) 668-6137,STATE,OPEN,162,HILLSBOROUGH,33011,USA,922140,CORRECTIONAL INSTITUTIONS,https://www.nh.gov/nhdoc/facilities/index.html,7/1/17,IMAGERY,2017-12-14T00:00:00.000Z,https://www.nh.gov/nhdoc/facilities/index.html,CLOSE,105,0.006116348,1.44E-06,24326.94141,754.2514789,33,11,2800,33011002800,28,Census Tract 28,G5020,S,18280337,394810,42.9974717,-71.5377193,NH,c(-71.539626870853, 43.0102726274093)
1824,1424,10004583,FLAGLER COUNTY DETENTION FACILITY,1002 JUSTICE LANE,BUNNELL,FL,32110,NOT AVAILABLE,(386) 437-4116,COUNTY,OPEN,219,FLAGLER,12035,USA,922140,CORRECTIONAL INSTITUTIONS,http://www.flaglersheriff.com/divisions/court-and-correction,2/21/18,IMAGERY,2018-02-21T00:00:00.000Z,http://www.flaglersheriff.com/divisions/court-and-correction,NOT AVAILABLE,400,0.004644797,1.34E-06,19041.95898,553.354814,12,35,60207,12035060207,602.07,Census Tract 602.07,G5020,S,293697372,2912295,29.3456542,-81.2418371,FL,c(-81.2561790160137, 29.4524610300751)
1825,1425,10003835,CLINTON COUNTY JAIL,1347 E TOWNSEND RD,ST. JOHNS,MI,48879,NOT AVAILABLE,(989) 227-6580,COUNTY,OPEN,182,CLINTON,26037,USA,922140,CORRECTIONAL INSTITUTIONS,https://www.clinton-county.org/241/Sheriffs-Office,3/20/18,IMAGERY,2018-03-20T00:00:00.000Z,https://www.clinton-county.org/241/Sheriffs-Office,NOT AVAILABLE,236,0.004321692,5.81E-07,9840.867188,536.6710699,26,37,10901,26037010901,109.01,Census Tract 109.01,G5020,S,78243584,50024,42.9789853,-84.5363518,MI,c(-84.5343390269575, 42.988866741823)
1826,1426,10004688,WOODFORD COUNTY CORRECTIONAL FACILITY,111 EAST COURT STREET,EUREKA,IL,61530,NOT AVAILABLE,(309) 467-2116,COUNTY,OPEN,-999,WOODFORD,17203,USA,922140,CORRECTIONAL INSTITUTIONS,http://www.ilsheriff.org/index.php/directory,3/5/18,IMAGERY,2018-03-05T00:00:00.000Z,http://www.woodford-county.org/215/Corrections,NOT AVAILABLE,86,0.002796672,3.34E-07,5460.273438,370.7898911,17,203,30601,17203030601,306.01,Census Tract 306.01,G5020,S,107361660,157898,40.7206345,-89.2458431,IL,c(-89.2720091155638, 40.7224067592903)
1827,1427,10004116,NORTHERN NH CORRECTIONAL FACILITY,138 EAST MILAN RD,BERLIN,NH,3570,NOT AVAILABLE,(603) 752-2906,STATE,OPEN,641,COOS,33007,USA,922140,CORRECTIONAL INSTITUTIONS,"https://www.nh.gov/nhdoc/facilities/index.html, https://www.nh.gov/nhdoc/divisions/publicinformation/index.html",7/1/17,IMAGERY,2017-12-14T00:00:00.000Z,https://www.nh.gov/nhdoc/facilities/index.html,CLOSE,662,0.011973504,5.11E-06,88742.55469,1545.218291,33,7,950600,33007950600,9506,Census Tract 9506,G5020,S,17836698,752097,44.4884299,-71.1564285,NH,c(-71.1450772954245, 44.5128499599324)
1828,1428,10001001,FOX LAKE CORRECTIONAL INSTITUTION,W 10237 LAKE EMILY RD,FOX LAKE,WI,53933,147,(920) 928-3151,STATE,OPEN,1306,DODGE,55027,USA,922140,CORRECTIONAL INSTITUTIONS,https://doc.wi.gov/Pages/DataResearch/DataAndReports.aspx,1/12/18,IMAGERY,2018-01-18T00:00:00.000Z,https://doc.wi.gov/Pages/OffenderInformation/AdultInstitutions/AdultFacilities.aspx,MEDIUM,979,0.023258625,3.88E-05,664176.2969,3081.205647,55,27,960500,55027960500,9605,Census Tract 9605,G5020,S,88399953,14226397,43.5990044,-88.9373438,WI,c(-88.9120734250287, 43.6145568936741)
1829,1429,10001341,NEWBERRY CORRECTIONAL FACILITY,13747 E. COUNTY ROAD 428,NEWBERRY,MI,49868,NOT AVAILABLE,(906) 293-6200,STATE,OPEN,1098,LUCE,26095,USA,922140,CORRECTIONAL INSTITUTIONS,"http://www.michigan.gov/corrections/0,4551,7-119-1441---,00.html",12/31/16,IMAGERY,2017-12-06T00:00:00.000Z,"http://www.michigan.gov/corrections/0,4551,7-119-68854_1381_1385---,00.html",MEDIUM,1108,0.013047253,9.37E-06,168204.6367,1739.262114,26,95,960100,26095960100,9601,Census Tract 9601,G5020,S,675580507,10509351,46.3987452,-85.4449347,MI,c(-85.5077348623387, 46.3304537342107)
1830,1430,10000523,HENDRY COUNTY JAIL,101 S BRIDGE ST,LABELLE,FL,33935,NOT AVAILABLE,NOT AVAILABLE,COUNTY,OPEN,257,HENDRY,12051,USA,922140,CORRECTIONAL INSTITUTIONS,http://www.hendrysheriff.org/,2/21/18,IMAGERY,2018-02-21T00:00:00.000Z,http://www.hendrysheriff.org/,MAXIMUM,-999,0.003279907,5.98E-07,8300.623047,391.0720188,12,51,402,12051000402,4.02,Census Tract 4.02,G5020,S,33278179,3063464,26.7435667,-81.4678386,FL,c(-81.4364883258934, 26.760392436958)
1831,1431,10000992,GREEN BAY CORRECTIONAL INSTITUTION,2833 RIVERSIDE DR,GREEN BAY,WI,54307,9033,(920) 432-4877,STATE,OPEN,1096,BROWN,55009,USA,922140,CORRECTIONAL INSTITUTIONS,https://doc.wi.gov/Pages/DataResearch/DataAndReports.aspx,1/12/18,IMAGERY,2018-01-18T00:00:00.000Z,https://doc.wi.gov/Pages/OffenderInformation/AdultInstitutions/AdultFacilities.aspx,MAXIMUM,749,0.017182843,1.42E-05,247269.6367,2145.509628,55,9,21100,55009021100,211,Census Tract 211,G5020,S,210104,0,44.4704276,-88.0366393,WI,c(-88.035449413797, 44.4699100700506)
1832,1432,10001458,GLADES COUNTY DETENTION CENTER,1297 EAST STATE ROAD 78,MOORE HAVEN,FL,33471,NOT AVAILABLE,(863) 946-1600,COUNTY,OPEN,63,GLADES,12043,USA,922140,CORRECTIONAL INSTITUTIONS,http://www.gladessheriff.org/?page=1&pageid=2,2/21/18,IMAGERY,2018-02-21T00:00:00.000Z,http://www.gladessheriff.org/?page=1&pageid=2,MAXIMUM,546,0.00703982,2.09E-06,29039.91406,836.0462151,12,43,300,12043000300,3,Census Tract 3,G5020,S,713122847,10936178,27.0399248,-81.1770999,FL,c(-81.1244130342354, 26.8385253680157)
1833,1433,10001447,GULF COUNTY JAIL,1000 CECIL G COSTIN SR BLVD,PORT SAINT JOE,FL,32456,NOT AVAILABLE,(850) 227-1124,COUNTY,OPEN,42,GULF,12045,USA,922140,CORRECTIONAL INSTITUTIONS,http://www.dc.state.fl.us/pub/jails/,2/21/18,IMAGERY,2018-02-21T00:00:00.000Z,http://dos.myflorida.com/library-archives/research/florida-information/government/local-resources/county-jails-and-inmate-searches/,MAXIMUM,-999,0.003106225,5.55E-07,7933.341797,377.097108,12,45,960300,12045960300,9603,Census Tract 9603,G5020,S,570497197,134056531,29.8243304,-85.2028016,FL,c(-85.2898630820548, 29.8145008233002)
1834,1434,10005712,SOCORRO COUNTY DETENTION CENTER,1001 GREFCO RD,SOCORRO,NM,87801,NOT AVAILABLE,(575) 835-0945,COUNTY,OPEN,70,SOCORRO,35053,USA,922140,CORRECTIONAL INSTITUTIONS,"http://www.socorrocounty.net/departments/detention, https://www.nmlegis.gov/handouts/CCJ%20052716%20Item%203%20NM%20County%20Jails%20An%20Overview.pdf",5/27/16,IMAGERY,2018-04-09T00:00:00.000Z,http://www.socorrocounty.net/departments/detention,NOT AVAILABLE,90,0.002422459,2.40E-07,3588.371094,298.2309319,35,53,978301,35053978301,9783.01,Census Tract 9783.01,G5020,S,170854666,25853,34.0235851,-106.9597599,NM,c(-106.922689158451, 34.027972619446)
1835,1435,10004566,HAMILTON COUNTY JAIL,3995 COUNTY ROUTE 51 NORTH,JASPER,FL,32052,NOT AVAILABLE,(386) 792-7130,COUNTY,OPEN,50,HAMILTON,12047,USA,922140,CORRECTIONAL INSTITUTIONS,http://hamiltonsheriff.com/index.htm,2/21/18,IMAGERY,2018-02-21T00:00:00.000Z,http://hamiltonsheriff.com/index.htm,NOT AVAILABLE,-999,0.002952734,3.02E-07,4342.40625,353.532496,12,47,960100,12047960100,9601,Census Tract 9601,G5020,S,658855538,2557636,30.4972554,-82.9056706,FL,c(-82.9415024865024, 30.526335398138)
1836,1436,10000493,HARDEE COUNTY DETENTION FACILITY,900 E SUMMIT ST,WAUCHULA,FL,33873,NOT AVAILABLE,(863) 767-0942,COUNTY,OPEN,118,HARDEE,12049,USA,922140,CORRECTIONAL INSTITUTIONS,"http://www.dc.state.fl.us/pub/jails/, http://www.hardeeso.com/departments/index.html",2/21/18,IMAGERY,2018-02-21T00:00:00.000Z,http://www.hardeeso.com/departments/index.html,MAXIMUM,190,0.004131324,8.28E-07,11578.28906,489.1787912,12,49,970400,12049970400,9704,Census Tract 9704,G5020,S,410469838,408719,27.4342821,-81.9357662,FL,c(-81.8019011357106, 27.5430438073595)
1837,1437,10002754,LYLE B MEDLOCK RESIDENTIAL TREATMENT CENTER,1508-B EAST LANGDON RD,DALLAS,TX,75241,NOT AVAILABLE,NOT AVAILABLE,COUNTY,OPEN,161,DALLAS,48113,USA,922140,CORRECTIONAL INSTITUTIONS,http://www.dallascounty.org/department/juvenile/institutiional.php,4/26/18,IMAGERY,2018-04-26T00:00:00.000Z,http://www.dallascounty.org/department/juvenile/institutiional.php,JUVENILE,96,0.004789055,1.07E-06,15684.94531,575.4354882,48,113,16902,48113016902,169.02,Census Tract 169.02,G5020,S,25139276,1817916,32.6469938,-96.7003825,TX,c(-96.7065593391238, 32.668137127243)
1838,1438,10000267,OAKS CORRECTIONAL FACILITY,1500 CABERFAE HWY,MANISTEE,MI,49660,NOT AVAILABLE,(231) 723-8272,STATE,OPEN,1039,MANISTEE,26101,USA,922140,CORRECTIONAL INSTITUTIONS,"http://www.michigan.gov/corrections/0,4551,7-119-1441---,00.html",12/31/16,IMAGERY,2017-12-06T00:00:00.000Z,"http://www.michigan.gov/corrections/0,4551,7-119-68854_1381_1385---,00.html",CLOSE,1060,0.015778499,1.38E-05,239179.8359,1978.408955,26,101,500,26101000500,5,Census Tract 5,G5020,S,363249353,6469839,44.2988929,-86.0292984,MI,c(-86.2700159320772, 44.2457089874724)
1839,1439,10000998,KETTLE MORAINE CORRECTIONAL INSTITUTION,W9071 FOREST DR,PLYMOUTH,WI,53073,NOT AVAILABLE,(920) 526-3244,STATE,OPEN,1174,SHEBOYGAN,55117,USA,922140,CORRECTIONAL INSTITUTIONS,https://doc.wi.gov/Pages/DataResearch/DataAndReports.aspx,1/12/18,IMAGERY,2018-01-18T00:00:00.000Z,https://doc.wi.gov/Pages/OffenderInformation/AdultInstitutions/AdultFacilities.aspx,MEDIUM,783,0.022729551,3.01E-05,516312.4805,2989.115066,55,117,10400,55117010400,104,Census Tract 104,G5020,S,190565509,3483743,43.8005415,-88.0912212,WI,c(-88.1503983919994, 43.719819375596)
1840,1440,10001347,OJIBWAY CORRECTIONAL FACILITY,N 5705 OJIBWAY RD,MARENISCO,MI,49947,9771,(906) 787-2217,STATE,OPEN,1112,GOGEBIC,26053,USA,922140,CORRECTIONAL INSTITUTIONS,"http://www.michigan.gov/corrections/0,4551,7-119-1441---,00.html",12/31/16,IMAGERY,2017-12-06T00:00:00.000Z,"http://www.michigan.gov/corrections/0,4551,7-119-68854_1381_1385---,00.html",MINIMUM,1142,0.01193147,8.32E-06,149174.7188,1610.641199,26,53,950100,26053950100,9501,Census Tract 9501,G5020,S,1183103354,68621896,46.2974099,-89.3488416,MI,c(-89.7065064907281, 46.3056249183755)
1841,1441,10006596,NORTH END TRANSITIONAL HOUSING UNIT / WORK CENTER,1 PERIMETER ROAD,CONCORD,NH,3302,NOT AVAILABLE,(603) 271-3957,STATE,OPEN,45,MERRIMACK,33013,USA,922140,CORRECTIONAL INSTITUTIONS,https://www.nh.gov/nhdoc/facilities/index.html,7/1/17,IMAGERY/OTHER,2017-12-14T00:00:00.000Z,https://www.nh.gov/nhdoc/facilities/index.html,MINIMUM,48,0.001299159,7.05E-08,1199.09375,166.7072577,33,13,32600,33013032600,326,Census Tract 326,G5020,S,14201645,2083068,43.2264912,-71.575198,NH,c(-71.555647421853, 43.2258265577544)
1842,1442,10006135,ADAMS COUNTY JAIL,911 W PEACEKEEPERS WAY,DECATUR,IN,46733,608,(260) 724-5345,COUNTY,OPEN,-999,ADAMS,18001,USA,922140,CORRECTIONAL INSTITUTIONS,https://www.co.adams.in.us/186/Sheriffs-Department,3/5/18,IMAGERY,2018-03-05T00:00:00.000Z,https://www.co.adams.in.us/186/Sheriffs-Department,NOT AVAILABLE,-999,0.003799222,8.86E-07,14507.58984,481.8762595,18,1,30300,18001030300,303,Census Tract 303,G5020,S,24641573,52005,40.8151602,-84.9116931,IN,c(-84.9302594969117, 40.8096938887324)
1843,1443,10004897,ALLEN COUNTY WORK RELEASE CENTER,12103 LIMA RD,FORT WAYNE,IN,46818,NOT AVAILABLE,(260) 449-7453,COUNTY,OPEN,83,ALLEN,18003,USA,922140,CORRECTIONAL INSTITUTIONS,http://www.allencountysheriff.org/,6/28/17,IMAGERY,2018-03-05T00:00:00.000Z,http://www.allencountysheriff.org/,MINIMUM,104,0.008673967,2.00E-06,33001.19531,1107.618242,18,3,10307,18003010307,103.07,Census Tract 103.07,G5020,S,5852603,23944,41.1856653,-85.1787113,IN,c(-85.1697519670459, 41.1938051486335)
1844,1444,10001007,MILWAUKEE SECURE DETENTION FACILITY,1015 N 10TH ST,MILWAUKEE,WI,53205,740,(414) 212-3535,STATE,OPEN,1093,MILWAUKEE,55079,USA,922140,CORRECTIONAL INSTITUTIONS,https://doc.wi.gov/Pages/DataResearch/DataAndReports.aspx,1/12/18,IMAGERY/OTHER,2018-01-18T00:00:00.000Z,https://doc.wi.gov/Pages/OffenderInformation/AdultInstitutions/AdultFacilities.aspx,MEDIUM,1040,0.003601055,7.45E-07,12633.51172,472.9173391,55,79,186300,55079186300,1863,Census Tract 1863,G5020,S,1192482,35023,43.0408345,-87.9174316,WI,c(-87.9249296910288, 43.0438935245123)
1845,1445,10000466,HERNANDO COUNTY DETENTION CENTER,16425 SPRING HILL DR,BROOKSVILLE,FL,34604,NOT AVAILABLE,(352) 544-2334,COUNTY,OPEN,632,HERNANDO,12053,USA,922140,CORRECTIONAL INSTITUTIONS,"http://www.dc.state.fl.us/pub/jails/, http://www.hernandosheriff.org/jail/",2/21/18,IMAGERY,2018-02-21T00:00:00.000Z,http://www.hernandosheriff.org/jail/,MAXIMUM,744,0.004931478,1.41E-06,19888.10352,584.9844024,12,53,40911,12053040911,409.11,Census Tract 409.11,G5020,S,22923070,134623,28.4711974,-82.4579738,FL,c(-82.4514055584058, 28.4837287552647)
1846,1446,10000491,HIGHLANDS COUNTY DETENTION FACILITY,338 S ORANGE ST,SEBRING,FL,33870,NOT AVAILABLE,(863) 402-7201,COUNTY,OPEN,424,HIGHLANDS,12055,USA,922140,CORRECTIONAL INSTITUTIONS,http://www.dc.state.fl.us/pub/jails/,2/21/18,IMAGERY,2018-02-21T00:00:00.000Z,http://www.highlandssheriff.org/index.php,MAXIMUM,-999,0.004291907,1.02E-06,14280.85742,504.7776862,12,55,960800,12055960800,9608,Census Tract 9608,G5020,S,2521678,1511211,27.5027312,-81.4490529,FL,c(-81.4359277784754, 27.4935239417205)
1847,1447,10000482,HILLSBOROUGH COUNTY JAIL DIVISION III,1301 N MORGAN ST,TAMPA,FL,33602,NOT AVAILABLE,NOT AVAILABLE,COUNTY,CLOSED,0,HILLSBOROUGH,12057,USA,922140,CORRECTIONAL INSTITUTIONS,"https://florida.hometownlocator.com/maps/feature-map,ftc,3,fid,2333800,n,hillsborough%20county%20sheriff's%20office%20jail%20division%20iii.cfm",2/15/16,UNVERIFIED,2018-02-21T00:00:00.000Z,NOT AVAILABLE,MAXIMUM,-999,0.004944562,1.45E-06,20392.26953,579.3312746,12,57,5101,12057005101,51.01,Census Tract 51.01,G5020,S,1866372,140886,27.948492,-82.4568348,FL,c(-82.4573235065213, 27.9558624971093)
1848,1448,10001353,CRAWFORD COUNTY JAIL,200 W MICHIGAN AVE,GRAYLING,MI,49738,NOT AVAILABLE,(989) 348-4822,COUNTY,OPEN,65,CRAWFORD,26039,USA,922140,CORRECTIONAL INSTITUTIONS,http://www.crawfordsheriff.org/homepage.htm,3/20/18,IMAGERY,2018-03-20T00:00:00.000Z,http://www.crawfordsheriff.org/homepage.htm,MAXIMUM,51,0.004025003,4.21E-07,7332.671875,519.9345166,26,39,960200,26039960200,9602,Census Tract 9602,G5020,S,114158922,8752584,44.7008389,-84.7737915,MI,c(-84.7165836220498, 44.6600187551569)
1849,1449,10005703,TAOS COUNTY JUVENILE DETENTION CENTER,"105 ALBRIGHT ST, SUITE P",TAOS,NM,87571,NOT AVAILABLE,(575) 737-6420,COUNTY,OPEN,16,TAOS,35055,USA,922140,CORRECTIONAL INSTITUTIONS,https://www.taoscounty.org/index.php/services/juvenile-detention-center,4/9/18,IMAGERY,2018-04-09T00:00:00.000Z,https://www.taoscounty.org/index.php/services/juvenile-detention-center,JUVENILE,18,0.003508511,4.67E-07,7186.09375,424.9958739,35,55,952600,35055952600,9526,Census Tract 9526,G5020,S,66361363,0,36.3603796,-105.6529445,NM,c(-105.575652929949, 36.3975621697381)
1850,1450,10001386,PARNALL CORRECTIONAL FACILITY,1780 E PARNALL RD,JACKSON,MI,49201,NOT AVAILABLE,(517) 780-6004,STATE,OPEN,1675,JACKSON,26075,USA,922140,CORRECTIONAL INSTITUTIONS,"http://www.michigan.gov/corrections/0,4551,7-119-1441---,00.html",12/31/16,IMAGERY/OTHER,2017-12-06T00:00:00.000Z,"http://www.michigan.gov/corrections/0,4551,7-119-68854_1381_1385---,00.html",MINIMUM,1695,0.033796703,2.41E-05,403867.2227,4130.436872,26,75,5800,26075005800,58,Census Tract 58,G5020,S,2383646,2914,42.2958029,-84.3894236,MI,c(-84.3882782406004, 42.2935485207355)
1851,1451,10000266,PUGSLEY CORRECTIONAL FACILITY,7401 EAST WALTON RD,KINGSLEY,MI,49649,NOT AVAILABLE,(231) 263-5253,STATE,CLOSED,0,GRAND TRAVERSE,26055,USA,922140,CORRECTIONAL INSTITUTIONS,"http://www.michigan.gov/corrections/0,4551,7-119-68854_1381_1385---,00.html",9/24/16,IMAGERY,2017-12-06T00:00:00.000Z,"http://michigan.gov/corrections/0,4551,7-119-68854_1381_1385-5259--,00.html",MINIMUM,1344,0.013151363,1.09E-05,188673.3047,1729.127015,26,55,550300,26055550300,5503,Census Tract 5503,G5020,S,325539098,4506545,44.5484406,-85.5996279,MI,c(-85.4279151104032, 44.543246032499)
1852,1452,10004122,JOHN H. SUNUNU YOUTH SERVICES CENTER,1056 N RIVER RD,MANCHESTER,NH,3104,NOT AVAILABLE,NOT AVAILABLE,STATE,OPEN,60,HILLSBOROUGH,33011,USA,922140,CORRECTIONAL INSTITUTIONS,https://www.dhhs.nh.gov/djjs/institutional/documents/prea-audit-summary.pdf,8/8/14,IMAGERY/OTHER,2017-12-14T00:00:00.000Z,https://www.dhhs.nh.gov/djjs/institutional/index.htm,JUVENILE,144,0.018646896,5.40E-06,91548.94922,2373.914463,33,11,102,33011000102,1.02,Census Tract 1.02,G5020,S,4386233,281848,43.0281489,-71.466226,NH,c(-71.4720817911589, 43.0187994011986)
1853,1453,10000483,"HILLSBOROUGH COUNTY JAIL, FALKENBURG ROAD",520 N FALKENBURG RD,TAMPA,FL,33619,NOT AVAILABLE,(813) 247-8300,COUNTY,OPEN,2155,HILLSBOROUGH,12057,USA,922140,CORRECTIONAL INSTITUTIONS,http://www.hcso.tampa.fl.us/Departments/Department-of-Detention-Services.aspx,2/21/18,IMAGERY,2018-02-21T00:00:00.000Z,http://www.hcso.tampa.fl.us/Departments/Department-of-Detention-Services.aspx,MAXIMUM,3072,0.021939795,1.96E-05,275290.9961,2623.54905,12,57,12211,12057012211,122.11,Census Tract 122.11,G5020,S,9679178,126831,27.9617855,-82.3442931,FL,c(-82.3376654215502, 27.9605107833619)
1854,1454,10006597,CONCORD TRANSITIONAL WORK CENTER,275 NORTH STATE STREET,CONCORD,NH,3302,NOT AVAILABLE,(603) 271-1924,STATE,OPEN,153,MERRIMACK,33013,USA,922140,CORRECTIONAL INSTITUTIONS,https://www.nh.gov/nhdoc/facilities/index.html,7/1/17,UNVERIFIED,2017-12-14T00:00:00.000Z,https://www.nh.gov/nhdoc/facilities/index.html,MINIMUM,130,0.002267469,2.22E-07,3781.417969,286.7074968,33,13,32600,33013032600,326,Census Tract 326,G5020,S,14201645,2083068,43.2264912,-71.575198,NH,c(-71.5550902640427, 43.2254355214709)
1855,1455,10006389,CALUMET TRANSITIONAL HOUSING UNIT,126 LOWELL STREET,MANCHESTER,NH,3104,NOT AVAILABLE,(603) 271-1928,STATE,OPEN,69,HILLSBOROUGH,33011,USA,922140,CORRECTIONAL INSTITUTIONS,https://www.nh.gov/nhdoc/facilities/index.html,7/1/17,IMAGERY,2017-12-14T00:00:00.000Z,https://www.nh.gov/nhdoc/facilities/index.html,MINIMUM,64,0.001072596,7.32E-08,1240.101563,144.0139421,33,11,1400,33011001400,14,Census Tract 14,G5020,S,488562,0,42.9874112,-71.4595137,NH,c(-71.4586977032637, 42.9938823043642)
1856,1456,10001737,SHEA FARM TRANSITIONAL HOUSING UNIT,60 IRON WORKS RD,CONCORD,NH,3302,NOT AVAILABLE,(603) 271-6368,STATE,OPEN,49,MERRIMACK,33013,USA,922140,CORRECTIONAL INSTITUTIONS,https://www.nh.gov/nhdoc/facilities/index.html,7/1/17,IMAGERY,2017-12-14T00:00:00.000Z,https://www.nh.gov/nhdoc/facilities/index.html,MINIMUM,40,0.001809762,1.55E-07,2640.949219,244.1269909,33,13,32100,33013032100,321,Census Tract 321,G5020,S,4338900,36041,43.1854102,-71.5404665,NH,c(-71.5518074410117, 43.1800279395047)
1857,1457,10001003,OAKHILL CORRECTIONAL INSTITUTION,5212 COUNTY HWY M,OREGON,WI,53575,140,(608) 835-3101,STATE,OPEN,721,DANE,55025,USA,922140,CORRECTIONAL INSTITUTIONS,https://doc.wi.gov/Pages/DataResearch/DataAndReports.aspx,1/12/18,IMAGERY,2018-01-18T00:00:00.000Z,https://doc.wi.gov/Pages/OffenderInformation/AdultInstitutions/AdultFacilities.aspx,MINIMUM,344,0.018647605,1.64E-05,277177.0703,2432.076332,55,25,12502,55025012502,125.02,Census Tract 125.02,G5020,S,29406508,360653,42.9372009,-89.4059846,WI,c(-89.394253322673, 42.9617307280942)
1858,1458,10002571,OSHKOSH CORRECTIONAL INSTITUTION,1730 W SNELL RD,OSHKOSH,WI,54901,NOT AVAILABLE,(920) 231-4010,STATE,OPEN,2031,WINNEBAGO,55139,USA,922140,CORRECTIONAL INSTITUTIONS,https://doc.wi.gov/Pages/DataResearch/DataAndReports.aspx,1/12/18,IMAGERY,2018-01-18T00:00:00.000Z,https://doc.wi.gov/Pages/OffenderInformation/AdultInstitutions/AdultFacilities.aspx,MEDIUM,1494,0.029455874,4.35E-05,750658.457,3621.569159,55,139,1700,55139001700,17,Census Tract 17,G5020,S,25539499,11250470,44.0779637,-88.5912929,WI,c(-88.5571425848966, 44.0716197330506)
1859,1459,10004899,ALLEN COUNTY JUVENILE CENTER,2929 WELLS ST,FORT WAYNE,IN,46808,NOT AVAILABLE,(260) 449-8034,COUNTY,OPEN,60,ALLEN,18003,USA,922140,CORRECTIONAL INSTITUTIONS,http://www.in.gov/idoc/dys/2481.htm,3/5/18,IMAGERY,2018-03-05T00:00:00.000Z,http://acjc.us/,JUVENILE,140,0.004366133,9.71E-07,15971.78516,551.1187048,18,3,704,18003000704,7.04,Census Tract 7.04,G5020,S,3806978,61597,41.1103622,-85.1612305,IN,c(-85.148514156094, 41.1036204436424)
1860,1460,10000273,RICHARD A HANDLON CORRECTIONAL FACILITY,1728 BLUEWATER HWY,IONIA,MI,48846,NOT AVAILABLE,(616) 527-3100,STATE,OPEN,1257,IONIA,26067,USA,922140,CORRECTIONAL INSTITUTIONS,"http://www.michigan.gov/corrections/0,4551,7-119-1441---,00.html",12/31/16,IMAGERY,2017-12-06T00:00:00.000Z,"http://www.michigan.gov/corrections/0,4551,7-119-68854_1381_1385---,00.html",MEDIUM,1297,0.018339269,1.74E-05,295592.7773,2512.583542,26,67,982200,26067982200,9822,Census Tract 9822,G5020,S,1987066,0,42.9792254,-85.1044377,MI,c(-85.1063470719046, 42.983813427259)
1861,1461,10001518,BAYSIDE STATE PRISON FARM,4293 STATE ROUTE 47,LEESBURG,NJ,8327,NOT AVAILABLE,(856) 785-0040,STATE,OPEN,512,CUMBERLAND,34011,USA,922140,CORRECTIONAL INSTITUTIONS,http://www.state.nj.us/corrections/pages/offender_stats.html,12/14/17,IMAGERY,2017-12-14T00:00:00.000Z,http://www.state.nj.us/corrections/pages/index.shtml,MINIMUM,-999,0.026421818,2.02E-05,322746.0469,3323.474524,34,11,10103,34011010103,101.03,Census Tract 101.03,G5020,S,4302064,942,39.238828,-74.9434814,NJ,c(-74.9619032316754, 39.2347965074204)
1862,1462,10001357,SAGINAW CORRECTIONAL FACILITY,9625 PIERCE RD,FREELAND,MI,48623,NOT AVAILABLE,(989) 695-9880,STATE,OPEN,1463,SAGINAW,26145,USA,922140,CORRECTIONAL INSTITUTIONS,"http://www.michigan.gov/corrections/0,4551,7-119-1441---,00.html",12/31/16,IMAGERY,2017-12-06T00:00:00.000Z,"http://www.michigan.gov/corrections/0,4551,7-119-68854_1381_1385---,00.html",CLOSE,1488,0.01942732,2.22E-05,378734.4688,2547.326647,26,145,10100,26145010100,101,Census Tract 101,G5020,S,91059831,1068353,43.5200848,-84.0988726,MI,c(-84.1034508978814, 43.5069467144846)
1863,1463,10000331,JACKSON COUNTY JAIL,2737 PENN AVE,MARIANNA,FL,32448,NOT AVAILABLE,(850) 482-9651,COUNTY,OPEN,242,JACKSON,12063,USA,922140,CORRECTIONAL INSTITUTIONS,"http://www.dc.state.fl.us/pub/jails/, http://www.jacksoncountyfl.net/correctional-facility",2/21/18,IMAGERY,2018-02-21T00:00:00.000Z,http://www.jacksoncountyfl.net/correctional-facility,NOT AVAILABLE,300,0.005265861,1.55E-06,22308.81836,625.4287545,12,63,210600,12063210600,2106,Census Tract 2106,G5020,S,94739795,765914,30.7338695,-85.2514342,FL,c(-85.2583736740462, 30.7649347007858)
1864,1464,10004005,ALBERT C WAGNER YOUTH CORRECTIONAL FACILITY,500 WARD AVE,CHESTERFIELD,NJ,8515,NOT AVAILABLE,(609) 298-0500,STATE,OPEN,653,BURLINGTON,34005,USA,922140,CORRECTIONAL INSTITUTIONS,"http://www.state.nj.us/corrections/pages/offender_stats.html, http://www.state.nj.us/treasury/omb/publications/12budget/pdf/26.pdf",12/14/17,IMAGERY/OTHER,2017-12-14T00:00:00.000Z,http://www.state.nj.us/corrections/pages/index.shtml,JUVENILE,1032,0.024073217,1.28E-05,207978.3867,3100.092671,34,5,981802,34005981802,9818.02,Census Tract 9818.02,G5020,S,2455738,135588,40.1599322,-74.6708371,NJ,c(-74.6695228304155, 40.159583161456)
1865,1465,10002298,ADULT DIAGNOSTIC AND TREATMENT CENTER,"8 PRODUCTION WAY, P.O. BOX 190",WOODBRIDGE,NJ,7095,NOT AVAILABLE,(732) 574-2250,STATE,OPEN,491,MIDDLESEX,34023,USA,922140,CORRECTIONAL INSTITUTIONS,"http://www.state.nj.us/corrections/pages/offender_stats.html, http://www.state.nj.us/treasury/omb/publications/12budget/pdf/26.pdf",12/14/17,IMAGERY,2017-12-14T00:00:00.000Z,http://www.state.nj.us/corrections/pages/index.shtml,NOT AVAILABLE,512,0.014731972,5.49E-06,89552.89844,1862.997636,34,23,9000,34023009000,90,Census Tract 90,G5020,S,5707389,90884,40.5822168,-74.2595585,NJ,c(-74.2715810151322, 40.5895931549313)
1866,1466,10004018,BAYSIDE STATE PRISON,4293 RTE 47,LEESBURG,NJ,8327,NOT AVAILABLE,(856) 785-0040,STATE,OPEN,1143,CUMBERLAND,34011,USA,922140,CORRECTIONAL INSTITUTIONS,http://www.state.nj.us/corrections/pages/offender_stats.html,12/14/17,IMAGERY,2017-12-14T00:00:00.000Z,http://www.state.nj.us/corrections/pages/index.shtml,MEDIUM,-999,0.019228498,1.75E-05,279635.8516,2343.388975,34,11,10103,34011010103,101.03,Census Tract 101.03,G5020,S,4302064,942,39.238828,-74.9434814,NJ,c(-74.9514489755956, 39.2437968834451)
1867,1467,10002305,BAYSIDE STATE PRISON - ANCORA,301 SPRING GARDEN RD,HAMMONDTON,NJ,8037,NOT AVAILABLE,(856) 785-0040,STATE,OPEN,254,CAMDEN,34007,USA,922140,CORRECTIONAL INSTITUTIONS,"http://www.state.nj.us/corrections/pages/offender_stats.html, http://www.nj.com/politics/index.ssf/2017/02/christie_will_shut_down_250-inmate_nj_prison_unit.html",3/1/17,UNVERIFIED,2017-12-14T00:00:00.000Z,http://www.state.nj.us/corrections/pages/index.shtml,MINIMUM,250,0.005153984,1.43E-06,22952.73047,645.9148749,34,7,611500,34007611500,6115,Census Tract 6115,G5020,S,34219320,990123,39.6917595,-74.8508618,NJ,c(-74.8654626796173, 39.6815163733992)
1868,1468,10000379,JEFFERSON COUNTY JAIL,171 INDUSTRIAL PARK,MONTICELLO,FL,32344,NOT AVAILABLE,(850) 997-5094,COUNTY,OPEN,56,JEFFERSON,12065,USA,922140,CORRECTIONAL INSTITUTIONS,http://www.dc.state.fl.us/pub/jails/,2/21/18,IMAGERY,2018-02-21T00:00:00.000Z,https://www.jcso-fl.org/,MAXIMUM,-999,0.003943359,5.67E-07,8159.728516,469.2514123,12,65,250101,12065250101,2501.01,Census Tract 2501.01,G5020,S,178205983,241374,30.5053414,-83.8720998,FL,c(-83.881267547109, 30.5027207468089)
1869,1469,10000454,LAKE COUNTY DETENTION CENTER,551 W MAIN ST,TAVARES FL,FL,32778,NOT AVAILABLE,(352) 742-4000,COUNTY,OPEN,832,LAKE,12069,USA,922140,CORRECTIONAL INSTITUTIONS,"http://www.dc.state.fl.us/pub/jails/, https://www.lcso.org/",2/21/18,IMAGERY,2018-02-21T00:00:00.000Z,https://www.lcso.org/,MAXIMUM,960,0.007597581,2.00E-06,28257.03125,888.1218477,12,69,30803,12069030803,308.03,Census Tract 308.03,G5020,S,6323142,6816966,28.8199412,-81.7280115,FL,c(-81.7327841710753, 28.8014681653174)
1870,1470,10003816,DELTA COUNTY CORRECTIONAL FACILITY,111 N THIRD ST,ESCANABA,MI,49829,NOT AVAILABLE,(906) 789-5100,COUNTY,OPEN,79,DELTA,26041,USA,922140,CORRECTIONAL INSTITUTIONS,"http://www.michigan.gov/documents/corrections/JPIS_-_CY_2010_344047_7.pdf, http://www.deltacountymi.org/pages.php?ID=67",2/15/16,IMAGERY,2018-03-20T00:00:00.000Z,http://www.deltacountymi.org/pages.php?ID=67,NOT AVAILABLE,85,0.003591448,4.22E-07,7488.925781,469.3225545,26,41,970900,26041970900,9709,Census Tract 9709,G5020,S,4505847,8717490,45.7415733,-87.0574686,MI,c(-87.0513234563677, 45.7467916053498)
1871,1471,10001384,SPECIAL ALTERNATIVE INCARCERATION FACILITY,18901 WATERLOO RD,CHELSEA,MI,48118,NOT AVAILABLE,(734) 475-1368,STATE,OPEN,137,WASHTENAW,26161,USA,922140,CORRECTIONAL INSTITUTIONS,"http://www.michigan.gov/corrections/0,4551,7-119-1441---,00.html",12/31/16,IMAGERY,2017-12-06T00:00:00.000Z,"http://www.michigan.gov/corrections/0,4551,7-119-68854_1381_1385---,00.html",MINIMUM,530,0.021152383,1.72E-05,288247.3398,2792.909389,26,161,445000,26161445000,4450,Census Tract 4450,G5020,S,82994664,8070170,42.3872604,-84.0768063,MI,c(-84.0755764319457, 42.3488392266437)
1872,1472,10002301,CENTRAL RECEPTION AND ASSIGNMENT FACILITY,2401 STUYVESANT AVENUE,TRENTON,NJ,8628,NOT AVAILABLE,(609) 984-6000,STATE,OPEN,578,MERCER,34021,USA,922140,CORRECTIONAL INSTITUTIONS,"http://www.state.nj.us/corrections/pages/offender_stats.html, http://www.state.nj.us/treasury/omb/publications/12budget/pdf/26.pdf",12/14/17,IMAGERY,2017-12-14T00:00:00.000Z,http://www.state.nj.us/corrections/pages/index.shtml,MAXIMUM,691,0.007970085,3.03E-06,49116.26563,998.2186077,34,21,3705,34021003705,37.05,Census Tract 37.05,G5020,S,16319102,538246,40.2625743,-74.8162331,NJ,c(-74.8045260692353, 40.2475959367265)
1873,1473,10001002,PRAIRIE DU CHIEN CORRECTIONAL INSTITUTION,500 E PARRISH ST,PRAIRIE DU CHIEN,WI,53821,6000,(608) 326-7828,STATE,OPEN,515,CRAWFORD,55023,USA,922140,CORRECTIONAL INSTITUTIONS,https://doc.wi.gov/Pages/DataResearch/DataAndReports.aspx,1/12/18,IMAGERY/OTHER,2018-01-18T00:00:00.000Z,https://doc.wi.gov/Pages/OffenderInformation/AdultInstitutions/AdultFacilities.aspx,MEDIUM,326,0.020222004,1.72E-05,291971.957,2600.331739,55,23,960600,55023960600,9606,Census Tract 9606,G5020,S,21664679,7584075,43.0331937,-91.1323552,WI,c(-91.1404511774498, 43.0327841675462)
1874,1474,10001361,ST. LOUIS CORRECTIONAL FACILITY,8585 N CROSWELL RD,ST LOUIS,MI,48880,NOT AVAILABLE,(989) 681-6444,STATE,OPEN,1133,GRATIOT,26057,USA,922140,CORRECTIONAL INSTITUTIONS,"http://www.michigan.gov/corrections/0,4551,7-119-1441---,00.html",12/31/16,IMAGERY,2017-12-06T00:00:00.000Z,"http://www.michigan.gov/corrections/0,4551,7-119-68854_1381_1385---,00.html",CLOSE,1176,0.014593552,1.12E-05,191881.7305,1798.531512,26,57,400,26057000400,4,Census Tract 4,G5020,S,566259,0,43.415002,-84.5924849,MI,c(-84.5921498537303, 43.4165490603657)
1875,1475,10003996,EAST JERSEY STATE PRISON,1100 WOODBRIDGE RD,RAHWAY,NJ,7065,NOT AVAILABLE,(732) 499-5010,STATE,OPEN,1203,MIDDLESEX,34023,USA,922140,CORRECTIONAL INSTITUTIONS,"http://www.state.nj.us/corrections/pages/offender_stats.html, http://www.state.nj.us/treasury/omb/publications/12budget/pdf/26.pdf",12/14/17,IMAGERY,2017-12-14T00:00:00.000Z,http://www.state.nj.us/corrections/pages/index.shtml,MAXIMUM,1227,0.016446611,1.13E-05,183920.0391,2047.521738,34,23,9000,34023009000,90,Census Tract 90,G5020,S,5707389,90884,40.5822168,-74.2595585,NJ,c(-74.2695974785381, 40.5905640278326)
1876,1476,10004002,CRAF JONES FARM,721 BEAR TAVERN RD,TRENTON,NJ,8628,NOT AVAILABLE,(609) 984-6000,STATE,OPEN,149,MERCER,34021,USA,922140,CORRECTIONAL INSTITUTIONS,http://www.state.nj.us/corrections/pages/offender_stats.html,12/14/17,IMAGERY,2017-12-14T00:00:00.000Z,http://www.state.nj.us/corrections/pages/index.shtml,MINIMUM,-999,0.005024986,1.44E-06,23416.33594,633.1366672,34,21,3705,34021003705,37.05,Census Tract 37.05,G5020,S,16319102,538246,40.2625743,-74.8162331,NJ,c(-74.8293138482066, 40.2746448952946)
1877,1477,10000269,THUMB CORRECTIONAL FACILITY,3225 JOHN CONLEY DR,LAPEER,MI,48446,NOT AVAILABLE,(810) 667-2045,STATE,OPEN,1106,LAPEER,26087,USA,922140,CORRECTIONAL INSTITUTIONS,"http://www.michigan.gov/corrections/0,4551,7-119-1441---,00.html",12/31/16,IMAGERY,2017-12-06T00:00:00.000Z,"http://www.michigan.gov/corrections/0,4551,7-119-68854_1381_1385---,00.html",MEDIUM,1216,0.016760317,1.65E-05,279059.8359,2241.172609,26,87,336500,26087336500,3365,Census Tract 3365,G5020,S,309085,0,43.034784,-83.3490585,MI,c(-83.348371851189, 43.0351189804226)
1878,1478,10003815,DICKINSON COUNTY JAIL,"300 E ""D"" ST",IRON MOUNTAIN,MI,49801,NOT AVAILABLE,(906) 774-6270,COUNTY,OPEN,89,DICKINSON,26043,USA,922140,CORRECTIONAL INSTITUTIONS,http://www.michigan.gov/documents/corrections/JPIS_-_CY_2010_344047_7.pdf,2/15/16,IMAGERY,2018-03-20T00:00:00.000Z,http://www.dickinsoncountymi.gov/?sheriff,MINIMUM,71,0.001917377,1.56E-07,2779.105469,243.5011447,26,43,950400,26043950400,9504,Census Tract 9504,G5020,S,19503508,3126425,45.8214522,-88.0294434,MI,c(-88.0635181941095, 45.8159330692539)
1879,1479,10000524,LEE COUNTY JAIL,2115 DR MARTIN LUTHER KING JR BLVD,FORT MYERS,FL,33901,NOT AVAILABLE,(239) 477-1500,COUNTY,OPEN,371,LEE,12071,USA,922140,CORRECTIONAL INSTITUTIONS,http://www.sheriffleefl.org/bureau_and_departments/index.php,2/21/18,IMAGERY,2018-02-21T00:00:00.000Z,http://www.sheriffleefl.org/bureau_and_departments/index.php,MAXIMUM,457,0.005434483,1.35E-06,18721.45508,637.8303552,12,71,80300,12071080300,803,Census Tract 803,G5020,S,1603662,2961219,26.6512146,-81.872383,FL,c(-81.8707627651519, 26.6414388981947)
1880,1480,10004004,GARDEN STATE YOUTH CORRECTIONAL FACILITY,55 HOGBACK RD,CROSSWICKS,NJ,8515,NOT AVAILABLE,(609) 298-6300,STATE,OPEN,1417,BURLINGTON,34005,USA,922140,CORRECTIONAL INSTITUTIONS,"http://www.state.nj.us/corrections/pages/offender_stats.html, http://www.state.nj.us/treasury/omb/publications/12budget/pdf/26.pdf",12/14/17,IMAGERY/OTHER,2017-12-14T00:00:00.000Z,http://www.state.nj.us/corrections/pages/index.shtml,JUVENILE,1168,0.01760292,1.59E-05,257298.3945,2257.498636,34,5,981802,34005981802,9818.02,Census Tract 9818.02,G5020,S,2455738,135588,40.1599322,-74.6708371,NJ,c(-74.6763438577418, 40.1591682910892)
1881,1481,10003993,EDNA MAHAN CORRECTIONAL FACILITY FOR WOMEN,"30 COUNTY RD 513, P.O. BOX 4004",CLINTON,NJ,8809,NOT AVAILABLE,(908) 735-7111,STATE,OPEN,646,HUNTERDON,34019,USA,922140,CORRECTIONAL INSTITUTIONS,"http://www.state.nj.us/corrections/pages/offender_stats.html, http://www.state.nj.us/treasury/omb/publications/12budget/pdf/26.pdf",12/14/17,IMAGERY,2017-12-14T00:00:00.000Z,http://www.state.nj.us/corrections/pages/index.shtml,MAXIMUM,648,0.018847849,2.42E-05,395364.25,2465.582507,34,19,10701,34019010701,107.01,Census Tract 107.01,G5020,S,48601963,4825363,40.6322148,-74.964965,NJ,c(-74.9345737661344, 40.6288866888195)
1882,1482,10001516,MID-STATE CORRECTIONAL FACILITY,866 RANGE RD,WRIGHTSTOWN,NJ,8562,NOT AVAILABLE,(609) 723-4221,STATE,OPEN,-999,BURLINGTON,34005,USA,922140,CORRECTIONAL INSTITUTIONS,http://www.state.nj.us/corrections/pages/index.shtml,12/14/17,IMAGERY,2017-12-14T00:00:00.000Z,http://www.state.nj.us/corrections/pages/index.shtml,MEDIUM,696,0.007537466,3.35E-06,54201.26953,968.9393768,34,5,704801,34005704801,7048.01,Census Tract 7048.01,G5020,S,52713571,812375,40.0058557,-74.5676552,NJ,c(-74.5833929121066, 39.9985635788851)
1883,1483,10001512,MOUNTAINVIEW YOUTH CORRECTIONAL FACILITY,31 PETTICOAT LN,ANNANDALE,NJ,8801,NOT AVAILABLE,(908) 638-6191,STATE,OPEN,675,HUNTERDON,34019,USA,922140,CORRECTIONAL INSTITUTIONS,"http://www.state.nj.us/corrections/pages/offender_stats.html, http://www.state.nj.us/treasury/omb/publications/12budget/pdf/26.pdf",12/14/17,IMAGERY,2017-12-14T00:00:00.000Z,http://www.state.nj.us/corrections/pages/index.shtml,JUVENILE,710,0.022643993,2.32E-05,379454.8047,2872.202831,34,19,11001,34019011001,110.01,Census Tract 110.01,G5020,S,31646760,965764,40.6608203,-74.8607285,NJ,c(-74.8662363581613, 40.6494915869925)
1884,1484,10003825,WEST SHORELINE CORRECTIONAL FACILITY,2500 S SHERIDAN DR,MUSKEGON HEIGHTS,MI,49444,NOT AVAILABLE,(231) 773-9200,STATE,OPEN,1272,MUSKEGON,26121,USA,922140,CORRECTIONAL INSTITUTIONS,"http://www.michigan.gov/corrections/0,4551,7-119-1441---,00.html",12/31/16,IMAGERY/OTHER,2017-12-06T00:00:00.000Z,"http://www.michigan.gov/corrections/0,4551,7-119-68854_1381_1385---,00.html",MINIMUM,1282,0.013738948,1.28E-05,216789.7383,1800.477223,26,121,402,26121000402,4.02,Census Tract 4.02,G5020,S,5956593,1520,43.2113094,-86.2022528,MI,c(-86.1725036746093, 43.2049642869278)
1885,1485,10004003,NEW JERSEY STATE PRISON,600 CASS ST,TRENTON,NJ,8608,NOT AVAILABLE,(609) 292-9700,STATE,OPEN,1587,MERCER,34021,USA,922140,CORRECTIONAL INSTITUTIONS,"http://www.state.nj.us/corrections/pages/offender_stats.html, http://www.state.nj.us/treasury/omb/publications/12budget/pdf/26.pdf",12/14/17,IMAGERY,2017-12-14T00:00:00.000Z,http://www.state.nj.us/corrections/pages/index.shtml,MAXIMUM,1819,0.009164164,5.06E-06,82111.03125,1203.439973,34,21,2400,34021002400,24,Census Tract 24,G5020,S,41134,0,40.2071846,-74.7566636,NJ,c(-74.7563687165926, 40.2072733506779)
1886,1486,10003990,NORTHERN STATE PRISON,168 FRONTAGE RD,NEWARK,NJ,7114,NOT AVAILABLE,(973) 465-0068,STATE,OPEN,2378,ESSEX,34013,USA,922140,CORRECTIONAL INSTITUTIONS,"http://www.state.nj.us/corrections/pages/offender_stats.html, http://www.state.nj.us/treasury/omb/publications/12budget/pdf/26.pdf",12/14/17,IMAGERY,2017-12-14T00:00:00.000Z,http://www.state.nj.us/corrections/pages/index.shtml,MEDIUM,1530,0.019777752,1.11E-05,181939.0586,2425.101385,34,13,980100,34013980100,9801,Census Tract 9801,G5020,S,1460681,2569,40.7139378,-74.1664366,NJ,c(-74.1735179308611, 40.7127918382201)
1887,1487,10000526,LEE COUNTY CORE / CPU FACILITY,2501 ORTIZ AVE,FORT MYERS,FL,33905,NOT AVAILABLE,NOT AVAILABLE,COUNTY,OPEN,1296,LEE,12071,USA,922140,CORRECTIONAL INSTITUTIONS,http://www.sheriffleefl.org/bureau_and_departments/index.php,2/21/18,IMAGERY,2018-02-21T00:00:00.000Z,http://www.sheriffleefl.org/bureau_and_departments/index.php,MAXIMUM,1552,0.012731007,2.94E-06,40744.51953,1484.583414,12,71,1201,12071001201,12.01,Census Tract 12.01,G5020,S,15413954,488102,26.6197173,-81.8317608,FL,c(-81.8092448760457, 26.6333260816521)
1888,1488,10000376,LEON COUNTY DETENTION CENTER,535 APPLEYARD DR,TALLAHASSEE,FL,32304,NOT AVAILABLE,(850) 606-3500,COUNTY,OPEN,1035,LEON,12073,USA,922140,CORRECTIONAL INSTITUTIONS,http://www.dc.state.fl.us/pub/jails/,2/21/18,IMAGERY,2018-02-21T00:00:00.000Z,http://www.leoncountyso.com/home,MAXIMUM,-999,0.007891631,3.48E-06,50069.9043,952.4897137,12,73,2003,12073002003,20.03,Census Tract 20.03,G5020,S,5760333,37488,30.4433362,-84.3422636,FL,c(-84.3353756327472, 30.4375908848806)
1889,1489,10004017,SOUTHERN STATE CORRECTIONAL FACILITY,4295 N DELSEA DR,DELMONT,NJ,8314,NOT AVAILABLE,(856) 785-1300,STATE,OPEN,1689,CUMBERLAND,34011,USA,922140,CORRECTIONAL INSTITUTIONS,"http://www.state.nj.us/corrections/pages/offender_stats.html, http://www.state.nj.us/treasury/omb/publications/12budget/pdf/26.pdf",12/14/17,IMAGERY,2017-12-14T00:00:00.000Z,http://www.state.nj.us/corrections/pages/index.shtml,MEDIUM,1352,0.032143477,2.74E-05,437804.8477,4093.724543,34,11,10103,34011010103,101.03,Census Tract 101.03,G5020,S,4302064,942,39.238828,-74.9434814,NJ,c(-74.9544199360574, 39.2346484923571)
1890,1490,10004006,JOHNSTONE JUVENILE MEDIUM SECURITY FACILITY,"BURLINGTON ST, P.O. BOX 307",BORDENTOWN,NJ,8505,NOT AVAILABLE,(609) 298-8222,STATE,OPEN,-999,BURLINGTON,34005,USA,922140,CORRECTIONAL INSTITUTIONS,http://www.nj.gov/oag/jjc/secure_johnstone.htm,12/14/17,IMAGERY,2017-12-14T00:00:00.000Z,http://www.nj.gov/oag/jjc/secure_johnstone.htm,JUVENILE,262,0.012036925,4.18E-06,67704.59375,1480.256619,34,5,704200,34005704200,7042,Census Tract 7042,G5020,S,16273388,1692565,40.1327618,-74.7178635,NJ,c(-74.722247779564, 40.1367524404033)
1891,1491,10002608,RACINE CORRECTIONAL INSTITUTION,2019 WISCONSIN ST,STURTEVANT,WI,53177,1829,(262) 886-3214,STATE,OPEN,1688,RACINE,55101,USA,922140,CORRECTIONAL INSTITUTIONS,https://doc.wi.gov/Pages/DataResearch/DataAndReports.aspx,1/12/18,IMAGERY/OTHER,2018-01-18T00:00:00.000Z,https://doc.wi.gov/Pages/OffenderInformation/AdultInstitutions/AdultFacilities.aspx,MEDIUM,1171,0.017384767,1.73E-05,292233.0078,2187.912162,55,101,1702,55101001702,17.02,Census Tract 17.02,G5020,S,15453098,70891,42.6955402,-87.897841,WI,c(-87.9016364403319, 42.7107146432789)
1892,1492,10004584,LEVY COUNTY JAIL / SHERIFF,9150 NORTHEAST 80TH AVENUE,BRONSON,FL,32621,NOT AVAILABLE,(352) 486-5121,COUNTY,OPEN,167,LEVY,12075,USA,922140,CORRECTIONAL INSTITUTIONS,"http://www.dc.state.fl.us/pub/jails/, http://www.levyso.com/home.html",2/21/18,IMAGERY,2018-02-21T00:00:00.000Z,http://www.levyso.com/home.html,NOT AVAILABLE,304,0.006441239,1.84E-06,26188.5957,758.5961674,12,75,970102,12075970102,9701.02,Census Tract 9701.02,G5020,S,310761386,17563337,29.4849574,-82.6474168,FL,c(-82.6413199489405, 29.4652408926853)
1893,1493,10001382,WOMEN'S HURON VALLEY CORRECTIONAL FACILITY,3201 BEMIS RD,YPSILANTI,MI,48197,911,(734) 572-9900,STATE,OPEN,2213,WASHTENAW,26161,USA,922140,CORRECTIONAL INSTITUTIONS,"http://www.michigan.gov/corrections/0,4551,7-119-1441---,00.html",12/31/16,IMAGERY,2017-12-06T00:00:00.000Z,"http://www.michigan.gov/corrections/0,4551,7-119-68854_1381_1385---,00.html",MAXIMUM,2397,0.031075952,4.01E-05,670134.6992,3891.119665,26,161,422900,26161422900,4229,Census Tract 4229,G5020,S,2568237,0,42.1673449,-83.6908188,MI,c(-83.6920137245968, 42.1750044854324)
1894,1494,10004007,JOHNSTONE JUVENILE FEMALE SECURE CARE AND INTAKE FACILITY,"BURLINGTON ST, P.O. BOX 367",BORDENTOWN,NJ,8505,NOT AVAILABLE,(609) 324-6341,STATE,OPEN,-999,BURLINGTON,34005,USA,922140,CORRECTIONAL INSTITUTIONS,http://www.nj.gov/oag/jjc/secure_johnstone.htm,12/14/17,IMAGERY,2017-12-14T00:00:00.000Z,http://www.nj.gov/oag/jjc/secure_johnstone.htm,JUVENILE,48,0.018658969,5.39E-06,87358.78125,2385.414744,34,5,704200,34005704200,7042,Census Tract 7042,G5020,S,16273388,1692565,40.1327618,-74.7178635,NJ,c(-74.7215824276498, 40.1429004101215)
1895,1495,10000274,WOODLAND CENTER CORRECTIONAL FACILITY,9036 E. M-36,WHITMORE LAKE,MI,48189,NOT AVAILABLE,(734) 449-3320,STATE,OPEN,336,LIVINGSTON,26093,USA,922140,CORRECTIONAL INSTITUTIONS,"http://www.michigan.gov/corrections/0,4551,7-119-1441---,00.html",12/31/16,IMAGERY,2017-12-06T00:00:00.000Z,"http://www.michigan.gov/corrections/0,4551,7-119-68854_1381_1385---,00.html",MAXIMUM,377,0.033716725,4.95E-05,831312.6055,4239.331508,26,93,744600,26093744600,7446,Census Tract 7446,G5020,S,20809006,644516,42.4688265,-83.7790136,MI,c(-83.7720937454889, 42.4384417858947)
1896,1496,10003840,EATON COUNTY JAIL,1025 INDEPENDENCE BLVD,CHARLOTTE,MI,48813,NOT AVAILABLE,(517) 543-5041,COUNTY,OPEN,198,EATON,26045,USA,922140,CORRECTIONAL INSTITUTIONS,http://www.michigan.gov/documents/corrections/JPIS_-_CY_2010_344047_7.pdf,2/15/16,IMAGERY,2018-03-20T00:00:00.000Z,http://www.eatoncounty.org/departments/office-of-the-sheriff,MAXIMUM,374,0.005163899,8.90E-07,14970.73438,657.8051574,26,45,21001,26045021001,210.01,Census Tract 210.01,G5020,S,46644817,259432,42.54767,-84.8738123,MI,c(-84.8460623084484, 42.5799555177788)
1897,1497,10001515,NEW JERSEY TRAINING SCHOOL,"GRACE HILL ROAD, P.O. BOX 500",MONROE TOWNSHIP,NJ,8831,NOT AVAILABLE,(732) 521-0030,STATE,OPEN,-999,MIDDLESEX,34023,USA,922140,CORRECTIONAL INSTITUTIONS,http://www.nj.gov/oag/jjc/secure_njts.htm,12/14/17,IMAGERY,2017-12-14T00:00:00.000Z,http://www.nj.gov/oag/jjc/secure_njts.htm,JUVENILE,200,0.022078191,2.34E-05,381025.8516,2860.947503,34,23,8202,34023008202,82.02,Census Tract 82.02,G5020,S,64367018,184970,40.2960171,-74.4278661,NJ,c(-74.3984785557809, 40.3424612860537)
1898,1498,10005771,BAY PINES CENTER,2425 NORTH 30TH STREET,ESCANABA,MI,49829,NOT AVAILABLE,(906) 789-7220,STATE,OPEN,-999,DELTA,26041,USA,922140,CORRECTIONAL INSTITUTIONS,"http://www.michigan.gov/mdhhs/0,5885,7-339-73971_34044_34049---,00.html",12/6/17,IMAGERY/OTHER,2017-12-06T00:00:00.000Z,"http://www.michigan.gov/mdhhs/0,5885,7-339-73971_34044_34049---,00.html",JUVENILE,45,0.005445222,1.46E-06,25999.5,726.2718714,26,41,970500,26041970500,9705,Census Tract 9705,G5020,S,207349456,1414877,45.8226821,-87.1577065,MI,c(-87.0915876478322, 45.7777550954604)
1899,1499,10002606,RACINE YOUTHFUL OFFENDER CORRECTIONAL FACILITY,1501 ALBERT ST,RACINE,WI,53404,1,(262) 638-1999,STATE,OPEN,448,RACINE,55101,USA,922140,CORRECTIONAL INSTITUTIONS,https://doc.wi.gov/Pages/DataResearch/DataAndReports.aspx,1/12/18,IMAGERY/OTHER,2018-01-18T00:00:00.000Z,https://doc.wi.gov/Pages/OffenderInformation/AdultInstitutions/AdultFacilities.aspx,MEDIUM,400,0.006861647,2.76E-06,46504.25,929.8699597,55,101,1202,55101001202,12.02,Census Tract 12.02,G5020,S,5127892,153681,42.7452888,-87.8194182,WI,c(-87.7993797120708, 42.7365828810701)
1900,1500,10004015,ATLANTIC YOUTH CENTER - HARBORFIELDS,BUFFALO AVE & DUERER ST (800 BUFFALO AVE),EGG HARBOR CITY,NJ,8215,NOT AVAILABLE,(609) 965-3583,STATE,OPEN,-999,ATLANTIC,34001,USA,922140,CORRECTIONAL INSTITUTIONS,http://www.atlantic-county.org/public-safety/harborfields.asp,12/14/17,IMAGERY,2017-12-14T00:00:00.000Z,http://www.atlantic-county.org/public-safety/harborfields.asp,JUVENILE,27,0.0028081,2.90E-07,4656.84375,350.9835823,34,1,10600,34001010600,106,Census Tract 106,G5020,S,28103807,1477247,39.5636873,-74.5958654,NJ,c(-74.6336535790705, 39.5368318779036)
1901,1501,10001441,LIBERTY COUNTY JAIL,12499 NW POGO ST,BRISTOL,FL,32321,NOT AVAILABLE,(850) 643-2235,COUNTY,OPEN,46,LIBERTY,12077,USA,922140,CORRECTIONAL INSTITUTIONS,http://www.dc.state.fl.us/pub/jails/,2/21/18,IMAGERY,2018-02-21T00:00:00.000Z,http://libertycountysheriff.org/,MAXIMUM,-999,0.002387566,2.87E-07,4122.697266,288.0428088,12,77,950200,12077950200,9502,Census Tract 9502,G5020,S,898974683,15647476,30.2896579,-84.9882212,FL,c(-84.9800329652447, 30.4323960137655)
1902,1502,10004012,RIVERFRONT STATE PRISON,P.O. BOX 9104,CAMDEN,NJ,8101,NOT AVAILABLE,NOT AVAILABLE,STATE,CLOSED,0,CAMDEN,34007,USA,922140,CORRECTIONAL INSTITUTIONS,"http://www.state.nj.us/corrections/cia/rfsp.html, http://www.nj.com/news/index.ssf/2009/10/sale_of_riverfront_state_priso.html, http://en.wikipedia.org/wiki/Camden,_New_Jersey",10/30/09,IMAGERY,2017-12-18T00:00:00.000Z,NOT AVAILABLE,NOT AVAILABLE,-999,0.009192048,4.14E-06,66916.25,1161.933438,34,7,600700,34007600700,6007,Census Tract 6007,G5020,S,629533,537888,39.9560193,-75.1255342,NJ,c(-75.1280449954082, 39.9540550423117)
1903,1503,10000383,MADISON COUNTY JAIL,823 SW PINCKNEY ST,MADISON,FL,32340,1371,(850) 973-4002,COUNTY,OPEN,68,MADISON,12079,USA,922140,CORRECTIONAL INSTITUTIONS,http://www.dc.state.fl.us/pub/jails/,2/21/18,IMAGERY,2018-02-21T00:00:00.000Z,https://www.mcso-fl.org/,MAXIMUM,120,0.002873021,4.48E-07,6439.273438,350.0900065,12,79,110302,12079110302,1103.02,Census Tract 1103.02,G5020,S,69663881,1413792,30.431354,-83.4152352,FL,c(-83.4221700487423, 30.4680972628353)
1904,1504,10003818,SHAWONO CENTER,10 N HOWES LAKE RD,GRAYLING,MI,49738,NOT AVAILABLE,(989) 344-5000,STATE,OPEN,-999,CRAWFORD,26039,USA,922140,CORRECTIONAL INSTITUTIONS,"http://www.michigan.gov/mdhhs/0,5885,7-339-73971_34044_34049---,00.html",12/6/17,IMAGERY,2017-12-06T00:00:00.000Z,"http://www.michigan.gov/mdhhs/0,5885,7-339-73971_34044_34049---,00.html",JUVENILE,40,0.007300405,9.29E-07,16198.67188,932.0412975,26,39,960200,26039960200,9602,Census Tract 9602,G5020,S,114158922,8752584,44.7008389,-84.7737915,MI,c(-84.8133398688969, 44.6858472547974)
1905,1505,10001372,W.J. MAXEY BOYS TRAINING SCHOOL,9036 E. M-36,WHITMORE LAKE,MI,48189,NOT AVAILABLE,(734) 449-4422,STATE,CLOSED,0,LIVINGSTON,26093,USA,922140,CORRECTIONAL INSTITUTIONS,https://www.freep.com/story/news/local/michigan/2015/10/07/maxey-school-boys-closes-livingston-county/73515420/,10/7/15,IMAGERY,2017-12-06T00:00:00.000Z,"http://www.michigan.gov/dhs/0,4562,7-124-5453_34044_34049-109003--,00.html",JUVENILE,80,0.006991968,2.52E-06,42317.46094,899.698504,26,93,744600,26093744600,7446,Census Tract 7446,G5020,S,20809006,644516,42.4688265,-83.7790136,MI,c(-83.7762109176659, 42.4435444112225)
1906,1506,10002607,STURTEVANT TRANSITIONAL FACILITY,9351 RAYNE RD,STURTEVANT,WI,53177,NOT AVAILABLE,(262) 884-2410,STATE,OPEN,149,RACINE,55101,USA,922140,CORRECTIONAL INSTITUTIONS,https://doc.wi.gov/Pages/DataResearch/DataAndReports.aspx,1/12/18,IMAGERY/OTHER,2018-01-18T00:00:00.000Z,https://doc.wi.gov/Pages/OffenderInformation/AdultInstitutions/AdultFacilities.aspx,MEDIUM,150,0.007779676,1.60E-06,27060.91406,970.0998927,55,101,1702,55101001702,17.02,Census Tract 17.02,G5020,S,15453098,70891,42.6955402,-87.897841,WI,c(-87.8982250814393, 42.7130225617858)
1907,1507,10002300,TRENTON PSYCHIATRIC HOSPITAL,100 SULLIVAN WAY,WEST TRENTON,NJ,8628,NOT AVAILABLE,(609) 633-1500,STATE,OPEN,382,MERCER,34021,USA,922140,CORRECTIONAL INSTITUTIONS,"http://www.state.nj.us/humanservices/dmhas/resources/services/treatment/mh_hospitals.html, http://www.state.nj.us/humanservices/dmhas/resources/services/treatment/tph_census.html",12/18/17,IMAGERY,2017-12-18T00:00:00.000Z,http://www.state.nj.us/humanservices/dmhas/resources/services/treatment/mh_hospitals.html,NOT AVAILABLE,400,0.008881274,3.72E-06,60443.37891,1099.976818,34,21,1300,34021001300,13,Census Tract 13,G5020,S,2292663,23603,40.240277,-74.7948451,NJ,c(-74.8058773887436, 40.2438627499369)
1908,1508,10006743,BARTHOLOMEW COUNTY JUVENILE DETENTION FACILITY,2350 ILLINOIS ST,COLUMBUS,IN,47201,NOT AVAILABLE,(812) 379-1690,COUNTY,OPEN,5,BARTHOLOMEW,18005,USA,922140,CORRECTIONAL INSTITUTIONS,http://www.in.gov/idoc/dys/2481.htm,3/5/18,IMAGERY,2018-03-05T00:00:00.000Z,http://www.bartholomew.in.gov/youth-services.html,JUVENILE,16,0.004396157,3.09E-07,4942.667969,549.1255832,18,5,10800,18005010800,108,Census Tract 108,G5020,S,9975485,20367,39.1911502,-85.8964659,IN,c(-85.8967815992269, 39.1964275734541)
1909,1509,10006834,TEURMAN HALL YOUTH DETENTION FACILITY,335 N. BROADWAY STREET,FALLON,NV,89406,NOT AVAILABLE,(775) 423-6587 EXT 259,COUNTY,OPEN,-999,CHURCHILL,32001,USA,922140,CORRECTIONAL INSTITUTIONS,http://www.churchillcounty.org/index.aspx?NID=159,4/9/18,IMAGERY,2018-04-09T00:00:00.000Z,http://www.churchillcounty.org/index.aspx?NID=159,JUVENILE,16,0.002641555,3.82E-07,6133.6875,339.8538984,32,1,950301,32001950301,9503.01,Census Tract 9503.01,G5020,S,4379397,0,39.4744137,-118.7685478,NV,c(-118.77458039895, 39.4790966794883)
1910,1510,10001314,ELKO COUNTY JAIL,775 W SILVER ST,ELKO,NV,89801,NOT AVAILABLE,(775) 777-2530,COUNTY,OPEN,96,ELKO,32007,USA,922140,CORRECTIONAL INSTITUTIONS,http://www.elkosheriff.com/home.html,4/9/18,IMAGERY,2018-04-09T00:00:00.000Z,http://www.elkosheriff.com/home.html,NOT AVAILABLE,-999,0.005103743,1.34E-06,21954.69141,646.0944386,32,7,951000,32007951000,9510,Census Tract 9510,G5020,S,4496334,0,40.8191936,-115.7901789,NV,c(-115.772549184453, 40.8245572436998)
1911,1511,10006866,DALLAS COUNTY YOUTH VILLAGE,1508 E LANGDON ROAD,DALLAS,TX,75241,NOT AVAILABLE,(972) 225-9700,COUNTY,OPEN,59,DALLAS,48113,USA,922140,CORRECTIONAL INSTITUTIONS,http://www.dallascounty.org/department/juvenile/institutiional.php,10/9/15,IMAGERY,2018-04-26T00:00:00.000Z,http://www.dallascounty.org/department/juvenile/institutiional.php,JUVENILE,72,0.010384201,6.64E-06,97804.88672,1259.536421,48,113,16902,48113016902,169.02,Census Tract 169.02,G5020,S,25139276,1817916,32.6469938,-96.7003825,TX,c(-96.7040267309822, 32.6687095513218)
1912,1512,10006893,LINCOLN COUNTY DETENTION FACILITY,1040 JUSTICE CENTER DR,KEMMERER,WY,83101,NOT AVAILABLE,NOT AVAILABLE,COUNTY,OPEN,-999,LINCOLN,56023,USA,922140,CORRECTIONAL INSTITUTIONS,https://www.lcwy.org/departments/sheriff/index.php,5/10/18,IMAGERY,2018-05-10T00:00:00.000Z,NOT AVAILABLE,NOT AVAILABLE,-999,0.004024336,4.93E-07,8189.769531,525.1059346,56,23,978400,56023978400,9784,Census Tract 9784,G5020,S,121124634,12706,41.8197691,-110.5562089,WY,c(-110.57261164159, 41.7940315372412)
1913,1513,10001383,CENTER FOR FORENSIC PSYCHIATRY,8303 PLATT RD,SALINE,MI,48176,NOT AVAILABLE,(734) 429-2531,STATE,OPEN,-999,WASHTENAW,26161,USA,922140,CORRECTIONAL INSTITUTIONS,"http://www.michigan.gov/mdhhs/0,5885,7-339-71550_2941_4868_4896---,00.html",12/6/17,IMAGERY,2017-12-06T00:00:00.000Z,"http://www.michigan.gov/mdhhs/0,5885,7-339-71550_2941_4868_4896---,00.html",MAXIMUM,210,0.014030927,7.54E-06,125996.8203,1755.059852,26,161,422900,26161422900,4229,Census Tract 4229,G5020,S,2568237,0,42.1673449,-83.6908188,MI,c(-83.6930111771031, 42.1695489256343)
1914,1514,10005613,BENTON COUNTY JAIL,105 SOUTH LINCOLN AVE,FOWLER,IN,47944,NOT AVAILABLE,(765) 884-0080,COUNTY,OPEN,-999,BENTON,18007,USA,922140,CORRECTIONAL INSTITUTIONS,http://www.bentoncounty.in.gov/sheriff,3/5/18,IMAGERY,2018-03-05T00:00:00.000Z,http://www.bentoncounty.in.gov/sheriff,NOT AVAILABLE,43,0.002430851,3.16E-07,5163.324219,303.4365045,18,7,100200,18007100200,1002,Census Tract 1002,G5020,S,278217233,105024,40.6569774,-87.2954498,IN,c(-87.3158919175766, 40.6171533231658)
1915,1515,10001000,WAUPUN CORRECTIONAL INSTITUTION,200 S MADISON ST,WAUPUN,WI,53963,351,(920) 324-5571,STATE,OPEN,1259,DODGE,55027,USA,922140,CORRECTIONAL INSTITUTIONS,https://doc.wi.gov/Pages/DataResearch/DataAndReports.aspx,1/12/18,IMAGERY,2018-01-18T00:00:00.000Z,https://doc.wi.gov/Pages/OffenderInformation/AdultInstitutions/AdultFacilities.aspx,MAXIMUM,882,0.011696599,8.36E-06,143179.8945,1513.694622,55,27,960300,55027960300,9603,Census Tract 9603,G5020,S,13512195,5191,43.6226965,-88.7501535,WI,c(-88.7315711644756, 43.6296875227878)
1916,1516,10000436,MARION COUNTY JAIL,700 NW 30TH AVE,OCALA,FL,34475,NOT AVAILABLE,(352) 351-8077,COUNTY,OPEN,1255,MARION,12083,USA,922140,CORRECTIONAL INSTITUTIONS,"http://www.dc.state.fl.us/pub/jails/, http://www.marionso.com/#home-1-section",11/16/16,IMAGERY,2018-02-21T00:00:00.000Z,http://www.marionso.com/#home-1-section,MAXIMUM,1924,0.012924295,5.78E-06,82118.23438,1512.245729,12,83,1600,12083001600,16,Census Tract 16,G5020,S,7595288,0,29.1799217,-82.1776775,FL,c(-82.1756088109228, 29.1950464473965)
1917,1517,10003854,ADRIAN TRAINING SCHOOL,2300 N ADRIAN HWY,ADRIAN,MI,49221,NOT AVAILABLE,NOT AVAILABLE,STATE,CLOSED,0,LENAWEE,26091,USA,922140,CORRECTIONAL INSTITUTIONS,http://www.lenconnect.com/article/20081211/NEWS/312119958,6/30/09,IMAGERY,2017-12-06T00:00:00.000Z,NOT AVAILABLE,JUVENILE,71,0.001662541,1.22E-07,2030.148438,228.2497381,26,91,61400,26091061400,614,Census Tract 614,G5020,S,4318491,363401,41.90944,-84.0441085,MI,c(-84.0259875368863, 41.9164452438403)
1918,1518,10006598,ANN KLEIN FORENSIC CENTER,STUYVESANT AVENUE,WEST TRENTON,NJ,8628,NOT AVAILABLE,(609) 633-0900,STATE,OPEN,193,MERCER,34021,USA,922140,CORRECTIONAL INSTITUTIONS,"http://www.state.nj.us/humanservices/dmhas/resources/services/treatment/mh_hospitals.html, http://www.state.nj.us/humanservices/dmhas/resources/services/treatment/akfc_census.html",12/18/17,IMAGERY,2017-12-18T00:00:00.000Z,http://www.state.nj.us/humanservices/dmhas/resources/services/treatment/mh_hospitals.html,NOT AVAILABLE,200,0.007435834,2.49E-06,40426.57813,920.3595968,34,21,1300,34021001300,13,Census Tract 13,G5020,S,2292663,23603,40.240277,-74.7948451,NJ,c(-74.8018850688869, 40.2470506291391)
1919,1519,10004634,MARTIN COUNTY JAIL,800 SE MONTEREY RD,STUART,FL,34994,NOT AVAILABLE,(772) 220-7200,COUNTY,OPEN,519,MARTIN,12085,USA,922140,CORRECTIONAL INSTITUTIONS,"http://www.dc.state.fl.us/pub/jails/, http://www.sheriff.martin.fl.us/department-corrections.html",2/21/18,IMAGERY,2018-02-21T00:00:00.000Z,http://www.sheriff.martin.fl.us/department-corrections.html,MAXIMUM,696,0.009272124,4.79E-06,66787.12305,1087.440687,12,85,1000,12085001000,10,Census Tract 10,G5020,S,6325944,120822,27.1746025,-80.2418685,FL,c(-80.2424017398416, 27.169633907854)
1920,1520,10001313,ELKO COUNTY JUVENILE DETENTION CENTER,665 W SILVER ST,ELKO,NV,89801,NOT AVAILABLE,(775) 753-4608,COUNTY,OPEN,-999,ELKO,32007,USA,922140,CORRECTIONAL INSTITUTIONS,http://www.elkocountynv.net/departments/juvenile/detention/index.php,4/9/18,IMAGERY,2018-04-09T00:00:00.000Z,http://www.elkocountynv.net/departments/juvenile/detention/index.php,JUVENILE,-999,0.002817073,3.73E-07,6115.753906,348.889648,32,7,951000,32007951000,9510,Census Tract 9510,G5020,S,4496334,0,40.8191936,-115.7901789,NV,c(-115.771138507235, 40.8248770838943)
1921,1521,10005617,BLACKFORD COUNTY JAIL,64 NORTH COUNTY RD 500 EAST,HARTFORD CITY,IN,47348,NOT AVAILABLE,(765) 348-0930,COUNTY,OPEN,-999,BLACKFORD,18009,USA,922140,CORRECTIONAL INSTITUTIONS,http://gov.blackfordcounty.org/pages.asp?PageIndex=369,3/5/18,IMAGERY,2018-03-05T00:00:00.000Z,http://gov.blackfordcounty.org/pages.asp?PageIndex=369,NOT AVAILABLE,-999,0.002473779,3.18E-07,5186.285156,325.0535195,18,9,975400,18009975400,9754,Census Tract 9754,G5020,S,220498691,957003,40.4309374,-85.3213654,IN,c(-85.2772727543519, 40.4506083916008)
1922,1522,10006789,EATON COUNTY YOUTH FACILITY,822 COURTHOUSE DRIVE,CHARLOTTE,MI,48813,NOT AVAILABLE,(517) 543-3244 EXT 1465,COUNTY,OPEN,-999,EATON,26045,USA,922140,CORRECTIONAL INSTITUTIONS,https://www.eatoncounty.org/courts/youth-services,3/20/18,IMAGERY,2018-03-20T00:00:00.000Z,https://www.eatoncounty.org/courts/youth-services,JUVENILE,-999,0.002903795,3.45E-07,5803.453125,383.7254374,26,45,21001,26045021001,210.01,Census Tract 210.01,G5020,S,46644817,259432,42.54767,-84.8738123,MI,c(-84.8476818807499, 42.5831597051815)
1923,1523,10002989,HUMBOLDT COUNTY DETENTION CENTER,801 FAIRGROUND RD,WINNEMUCCA,NV,89445,NOT AVAILABLE,NOT AVAILABLE,COUNTY,OPEN,46,HUMBOLDT,32013,USA,922140,CORRECTIONAL INSTITUTIONS,http://www.hcsonv.com/,4/9/18,IMAGERY,2018-04-09T00:00:00.000Z,http://www.hcsonv.com/,NOT AVAILABLE,84,0.002706939,2.90E-07,4765.972656,348.3428507,32,13,10701,32013010701,107.01,Census Tract 107.01,G5020,S,7356761,0,40.9611204,-117.727215,NV,c(-117.721347978334, 40.9792971170005)
1924,1524,10001893,NATRONA COUNTY JAIL,1100 BRUCE LANE,CASPER,WY,82601,NOT AVAILABLE,(307) 235-9524,COUNTY,OPEN,294,NATRONA,56025,USA,922140,CORRECTIONAL INSTITUTIONS,http://www.natrona.net/118/Sheriff,5/10/18,IMAGERY,2018-05-10T00:00:00.000Z,NOT AVAILABLE,NOT AVAILABLE,476,0.005242778,1.38E-06,23246.85547,672.1285944,56,25,1200,56025001200,12,Census Tract 12,G5020,S,12949570,142630,42.8556128,-106.3624353,WY,c(-106.345418801163, 42.8630279680407)
1925,1525,10000279,CAMP BRANCH,19 FOURTH ST,COLDWATER,MI,49036,NOT AVAILABLE,NOT AVAILABLE,STATE,CLOSED,0,BRANCH,26023,USA,922140,CORRECTIONAL INSTITUTIONS,"http://www.michigan.gov/corrections/0,1607,7-119-1381_1383-5189--,00.html, http://www.michigan.gov/documents/corrections/MAP_CFA-REGIONS_SEPT_30_2009_300214_7.pdf",9/30/09,IMAGERY,2017-12-06T00:00:00.000Z,NOT AVAILABLE,MINIMUM,-999,0.012985618,6.48E-06,107933.3945,1644.853911,26,23,951300,26023951300,9513,Census Tract 9513,G5020,S,85087940,2781568,41.9579786,-85.0716287,MI,c(-84.98763703542, 41.9602457689214)
1926,1526,10003849,ACADEMY HALL RESTRICTED CUSTODY CENTER,818 S PARK ST,KALAMAZOO,MI,49001,NOT AVAILABLE,NOT AVAILABLE,STATE,CLOSED,0,KALAMAZOO,26077,USA,922140,CORRECTIONAL INSTITUTIONS,"http://www.michigan.gov/dhs/0,1607,7-124-5452_34044_34049-107658--,00.html, http://www.mlive.com/news/kalamazoo/index.ssf/2010/01/halfway_house_closes_academy_h.html",1/15/10,IMAGERY,2017-12-06T00:00:00.000Z,NOT AVAILABLE,JUVENILE,-999,0.001188185,7.35E-08,1231.421875,146.0872077,26,77,600,26077000600,6,Census Tract 6,G5020,S,1681294,0,42.2809847,-85.5941492,MI,c(-85.5875132418844, 42.2835882457712)
1927,1527,10001374,CAMP BRIGHTON,7200 CHAMBERS RD,PINCKNEY,MI,48169,NOT AVAILABLE,NOT AVAILABLE,STATE,CLOSED,0,LIVINGSTON,26093,USA,922140,CORRECTIONAL INSTITUTIONS,"http://www.michigan.gov/corrections/0,1607,7-119--165018--,00.html",12/6/17,IMAGERY,2017-12-06T00:00:00.000Z,NOT AVAILABLE,MINIMUM,404,0.011226352,5.40E-06,90791.92969,1420.113255,26,93,743400,26093743400,7434,Census Tract 7434,G5020,S,30744846,1606868,42.4942962,-83.8576787,MI,c(-83.9010387593267, 42.4954876441677)
1928,1528,10001339,CAMP KITWEN,"M-26 S, P O BOX 7",PAINSEDALE,MI,49955,NOT AVAILABLE,NOT AVAILABLE,STATE,CLOSED,0,HOUGHTON,26061,USA,922140,CORRECTIONAL INSTITUTIONS,http://money.cnn.com/2009/06/05/news/economy/Michigan_closes_prisons/index.htm,6/30/09,IMAGERY,2017-12-06T00:00:00.000Z,NOT AVAILABLE,MINIMUM,288,0.008619292,3.94E-06,71569.5625,1132.955592,26,61,700,26061000700,7,Census Tract 7,G5020,S,916587731,40626047,46.9774822,-88.7750598,MI,c(-88.6973293733289, 47.0240464068324)
1929,1529,10001352,CAMP LEHMAN,5135 HARTWICK PINES RD,GRAYLING,MI,49738,NOT AVAILABLE,NOT AVAILABLE,STATE,CLOSED,0,CRAWFORD,26039,USA,922140,CORRECTIONAL INSTITUTIONS,http://money.cnn.com/2009/06/05/news/economy/Michigan_closes_prisons/index.htm,6/30/09,IMAGERY,2017-12-06T00:00:00.000Z,NOT AVAILABLE,MINIMUM,582,0.010973719,7.24E-06,126422.793,1422.703544,26,39,960100,26039960100,9601,Census Tract 9601,G5020,S,525272362,4478377,44.7229796,-84.7363647,MI,c(-84.6481067538165, 44.7596769942538)
1930,1530,10006599,ANCORA PSYCHIATRIC HOSPITAL - HOLLY HALL,301 SPRING GARDEN ROAD,HAMMONTON,NJ,8037,NOT AVAILABLE,(609) 561-1700,STATE,OPEN,-999,CAMDEN,34007,USA,922140,CORRECTIONAL INSTITUTIONS,http://www.state.nj.us/humanservices/dmhas/resources/services/treatment/aph_contact.html#4,12/18/17,UNVERIFIED,2017-12-18T00:00:00.000Z,http://www.state.nj.us/humanservices/dmhas/resources/services/treatment/mh_hospitals.html,NOT AVAILABLE,111,0.00387868,8.20E-07,13195.96875,489.4730652,34,7,611500,34007611500,6115,Census Tract 6115,G5020,S,34219320,990123,39.6917595,-74.8508618,NJ,c(-74.8633383118676, 39.6801648635097)
1931,1531,10001348,CAMP OTTAWA,216 GENDRON RD,TRON RIVER,MI,49935,NOT AVAILABLE,NOT AVAILABLE,STATE,CLOSED,0,IRON,26071,USA,922140,CORRECTIONAL INSTITUTIONS,http://money.cnn.com/2009/06/05/news/economy/Michigan_closes_prisons/index.htm,6/30/09,IMAGERY,2017-12-06T00:00:00.000Z,NOT AVAILABLE,MINIMUM,288,0.013354662,6.95E-06,124249.1875,1623.699258,26,71,200,26071000200,2,Census Tract 2,G5020,S,1392254790,40896358,46.2549894,-88.7524067,MI,c(-88.6756414755098, 46.1510778556696)
1932,1532,10001371,CAMP WHITE LAKE,8110 E WHITE LAKE RD,WHITE LAKE,MI,48386,NOT AVAILABLE,NOT AVAILABLE,STATE,CLOSED,0,OAKLAND,26125,USA,922140,CORRECTIONAL INSTITUTIONS,http://money.cnn.com/2009/06/05/news/economy/Michigan_closes_prisons/index.htm,6/30/09,IMAGERY,2017-12-06T00:00:00.000Z,NOT AVAILABLE,MINIMUM,160,0.007669402,2.41E-06,40628.875,968.3893303,26,125,130100,26125130100,1301,Census Tract 1301,G5020,S,21107396,90219,42.678254,-83.5236163,MI,c(-83.503611397623, 42.6922798080256)
